Date,ISIN,SECURITY_NAME,Maturity,RESIDUAL_NS,SIGNAL,Z_Residual_Score,Volatility_Score,Cluster_Score,Regression_Score,COMPOSITE_SCORE,Z_SPRD_VAL,Top_Features,Top_Feature_Effects_Pct
2025-11-06,IT0001086567,BTPS 7 1/4 11/01/26,2026-11-01,-2.278725282428025,NO ACTION,-0.530497198139895,0.9487983327502111,-0.9563517459764095,1.226390535928784,-0.6849003388614604,-13.556162330285314,"['Issue_Age', 'Cpn', 'AMT_OUTSTANDING']","[0.5257402533419989, 0.4047945089519933, 0.04244193570693805]"
2025-11-06,IT0001174611,BTPS 6 1/2 11/01/27,2027-11-01,-0.2815272950993053,NO ACTION,-0.09053338125138155,0.9402561345195166,-0.7727050688185192,1.2059304737530532,-0.4067773538580104,0.1561156164117714,"['Issue_Age', 'Cpn', 'AMT_OUTSTANDING']","[0.5595633871524247, 0.35323770770817714, 0.05912712218917244]"
2025-11-06,IT0001278511,BTPS 5 1/4 11/01/29,2029-11-01,-6.347070121579915,MODERATE SELL,-1.3779819633389865,0.9765761143265597,-1.6060579943107294,1.1468152452277782,-1.3064954683148917,15.220435849648268,"['Issue_Age', 'Cpn', 'AMT_OUTSTANDING']","[0.6179711585770875, 0.2600403485279502, 0.09088733542477534]"
2025-11-06,IT0001444378,BTPS 6 05/01/31,2031-05-01,-4.972591746653308,STRONG SELL,-1.856568215454912,0.983389686448789,-1.6969002740020427,1.2387751889051373,-1.5777210998730902,30.521298532644902,"['Issue_Age', 'Cpn', 'AMT_OUTSTANDING']","[0.5482424807889894, 0.3280349331642936, 0.09733393865528503]"
2025-11-06,IT0003256820,BTPS 5 3/4 02/01/33,2033-02-01,4.55438346045635,WEAK BUY,0.699572992535799,0.9827679117914824,0.9433178577864816,1.1243452569333812,1.0017328460345425,54.59640862315192,"['Issue_Age', 'Cpn', 'AMT_OUTSTANDING']","[0.5638869161932013, 0.3429881097503821, 0.06087233647355834]"
2025-11-06,IT0003535157,BTPS 5 08/01/34,2034-08-01,3.319483815195383,NO ACTION,0.24072528660401615,0.9876322258786049,0.3917740977665754,0.9965880553830824,0.5901791175473663,64.32246257523354,"['Issue_Age', 'Cpn', 'AMT_OUTSTANDING']","[0.5884107558186228, 0.28421973464466577, 0.08856992253366193]"
2025-11-06,IT0003934657,BTPS 4 02/01/37,2037-02-01,-0.6840992590098409,NO ACTION,-0.2959765898215392,0.9842913045205886,-0.9962921626132756,0.9780308880812936,-0.5825508624652378,76.09787264644756,"['Issue_Age', 'AMT_OUTSTANDING', 'Cpn']","[0.6145889779057205, 0.17302861510052933, 0.17263185335842815]"
2025-11-06,IT0004286966,BTPS 5 08/01/39,2039-08-01,0.7451137614849443,NO ACTION,0.20486568924328147,0.981970714759663,0.49591727199213065,0.9230614112721438,0.5879339022605868,90.41372750246636,"['Issue_Age', 'Cpn', 'AMT_OUTSTANDING']","[0.5290950099072579, 0.34078472730850773, 0.08755278470193953]"
2025-11-06,IT0004532559,BTPS 5 09/01/40,2040-09-01,0.4531036913366932,NO ACTION,0.10253595466508889,0.9670073437860904,0.6569052621491349,0.9325233172712366,0.5804168322573728,94.96084468535769,"['Issue_Age', 'Cpn', 'AMT_OUTSTANDING']","[0.49641209287357635, 0.37957723932578663, 0.08192806743359386]"
2025-11-06,IT0004644735,BTPS 4 1/2 03/01/26,2026-03-01,7.995528285346728,STRONG BUY,1.7328236363681402,0.7846641212519846,1.5570833911027433,0.5282591244341405,1.568100018464662,-11.613273868813064,"['Issue_Age', 'Cpn', 'AMT_OUTSTANDING']","[0.5377096513187636, 0.34499747997124414, 0.05449364970398419]"
2025-11-06,IT0004889033,BTPS 4 3/4 09/01/28,2028-09-01,-1.89279439892402,NO ACTION,-0.44548027661341044,0.9633534309851208,-0.5193088780534044,0.47078534706380915,-0.5200354887340773,7.725535551631191,"['Cpn', 'Issue_Age', 'AMT_OUTSTANDING']","[0.40810359424176085, 0.40536994829606937, 0.12078198050698256]"
2025-11-06,IT0004923998,BTPS 4 3/4 09/01/44,2044-09-01,-1.6170649921877782,NO ACTION,-0.6229178346840116,0.9975290557620832,-0.5322135757291798,0.6201061377467513,-0.6200869377458909,107.2285988246052,"['Cpn', 'Issue_Age', 'GREEN_BOND_LOAN_INDICATOR']","[0.45743326396498735, 0.43176541707754096, 0.05270882288572069]"
2025-11-06,IT0005024234,BTPS 3 1/2 03/01/30,2030-03-01,-4.939992479185207,WEAK SELL,-0.9088879832226918,0.9883138594927471,-1.2248600169144717,-0.012929067513526663,-0.9631287002152924,19.81803540942639,"['Issue_Age', 'AMT_OUTSTANDING', 'Cpn']","[0.4712020539424448, 0.2583390688227792, 0.17992633535936234]"
2025-11-06,IT0005083057,BTPS 3 1/4 09/01/46,2046-09-01,-3.02116406723205,NO ACTION,-0.45547598740605927,0.991678855279933,-0.3377186512561274,0.2735741496293083,-0.4784597845942639,111.22630677246931,"['Issue_Age', 'Cpn', 'GREEN_BOND_LOAN_INDICATOR']","[0.6580235474163031, 0.15748601176148633, 0.1086398272341642]"
2025-11-06,IT0005094088,BTPS 1.65 03/01/32,2032-03-01,-1.4755931468468972,NO ACTION,-0.5431960099458005,0.9883632214517774,-0.8430205779378389,0.15183652979075488,-0.665974843575482,41.1645722630764,"['Cpn', 'Issue_Age', 'AMT_OUTSTANDING']","[0.39823244042121175, 0.3788656525288477, 0.14081281899669]"
2025-11-06,IT0005162828,BTPS 2.7 03/01/47,2047-03-01,-4.924485037268298,WEAK SELL,-0.80604747789737,0.983276859325711,-0.541307236956846,-1.78386666919021,-1.017259689988627,110.50456262451137,"['Issue_Age', 'Cpn', 'GREEN_BOND_LOAN_INDICATOR']","[0.5252271375168899, 0.15902449636714647, 0.13446368844077344]"
2025-11-06,IT0005170839,BTPS 1.6 06/01/26,2026-06-01,-0.7125479621646917,NO ACTION,-0.18548315540650076,0.9683575637950371,-0.5126301310106787,0.24646063904655896,-0.38627220560753184,-17.147526202375786,"['Cpn', 'Issue_Age', 'GREEN_BOND_LOAN_INDICATOR']","[0.48360463105148777, 0.36412934021059884, 0.07502597658800876]"
2025-11-06,IT0005177909,BTPS 2 1/4 09/01/36,2036-09-01,-0.4686600976004058,NO ACTION,-0.22047976810719422,0.9791703142543767,-0.4228821093094165,0.15951320366767976,-0.3805247484160129,73.88463982992879,"['Issue_Age', 'Cpn', 'GREEN_BOND_LOAN_INDICATOR']","[0.46268293141011857, 0.3505011658066856, 0.10512020778315602]"
2025-11-06,IT0005210650,BTPS 1 1/4 12/01/26,2026-12-01,-4.8755542622286985,WEAK SELL,-1.1025540482912075,0.9665292020215754,-1.2872327223473854,0.8841390098561506,-1.0737711839543789,-15.159119171037169,"['Cpn', 'Issue_Age', 'GREEN_BOND_LOAN_INDICATOR']","[0.5553424136328508, 0.3316999862370676, 0.06839553395184624]"
2025-11-06,IT0005217390,BTPS 2.8 03/01/67,2067-03-01,5.594166170126357,WEAK BUY,1.1313762618643695,0.9892985926792275,1.1714329156780012,-0.9073188044011813,1.0966440102393575,135.43872612136076,"['REL_SPRD_LOG', 'Issue_Age', 'AMT_OUTSTANDING']","[0.3736389845842486, 0.2743046738811036, 0.21569057618308968]"
2025-11-06,IT0005240350,BTPS 2.45 09/01/33,2033-09-01,0.0649199626412695,WEAK SELL,-0.9685625800528538,0.992160582141089,-1.209257407297708,-1.1760704549779635,-1.1877367576812503,54.50973881536164,"['Issue_Age', 'Cpn', 'AMT_OUTSTANDING']","[0.40651217279351876, 0.28579475941153726, 0.1575550575791588]"
2025-11-06,IT0005240830,BTPS 2.2 06/01/27,2027-06-01,-4.616768639724771,WEAK SELL,-1.0455460245724462,0.9348008917308932,-1.2258222092850337,0.18621960679375246,-1.0218558405733558,-8.990801975029541,"['Cpn', 'Issue_Age', 'GREEN_BOND_LOAN_INDICATOR']","[0.40818229998151045, 0.3970582870086212, 0.11443229424928844]"
2025-11-06,IT0005273013,BTPS 3.45 03/01/48,2048-03-01,-2.457330641549589,NO ACTION,-0.35162386391132494,0.9858361508868541,-0.2749120159306068,-1.470920181858898,-0.6569274564415979,115.18339866397253,"['Issue_Age', 'Cpn', 'GREEN_BOND_LOAN_INDICATOR']","[0.3797064838283351, 0.32095396527999603, 0.13409189343077946]"
2025-11-06,IT0005274805,BTPS 2.05 08/01/27,2027-08-01,-2.3178916042393265,NO ACTION,-0.539125168199404,0.9495230578893338,-0.6274140208636276,0.07796121287537697,-0.5961430749801523,-4.756664246155628,"['Cpn', 'Issue_Age', 'GREEN_BOND_LOAN_INDICATOR']","[0.4657235045266511, 0.33958236891937255, 0.10881927959730175]"
2025-11-06,IT0005321325,BTPS 2.95 09/01/38,2038-09-01,-0.7250100454278225,NO ACTION,-0.31031304716841,0.9732002508988598,-0.5742293092437291,0.9260075986519714,-0.46828731066442003,84.51924810993366,"['Issue_Age', 'GREEN_BOND_LOAN_INDICATOR', 'AMT_OUTSTANDING']","[0.5214649085686375, 0.2552809537336253, 0.1808376377170607]"
2025-11-06,IT0005323032,BTPS 2 02/01/28,2028-02-01,-5.501894156815091,MODERATE SELL,-1.2405307999403279,0.9478588296243081,-1.2039181829669416,-0.9924150471848585,-1.2862657579562775,-2.2380776223883,"['Cpn', 'Issue_Age', 'AMT_OUTSTANDING']","[0.46442513026047827, 0.21790407081907745, 0.17694425554156124]"
2025-11-06,IT0005340929,BTPS 2.8 12/01/28,2028-12-01,-5.8192673775188,STRONG SELL,-1.2020221708810819,0.9538916363068002,-1.511668809410285,-2.1843245690404487,-1.5577224663478062,6.435268524263657,"['Issue_Age', 'AMT_OUTSTANDING', 'GREEN_BOND_LOAN_INDICATOR']","[0.39374955089781327, 0.21502671253845645, 0.18941749467594787]"
2025-11-06,IT0005358806,BTPS 3.35 03/01/35,2035-03-01,-0.0237688029490499,MODERATE SELL,-1.0015163806221625,0.9793590349593841,-1.0514955915596478,-2.049207024466381,-1.3062100349139183,64.91165771801049,"['Cpn', 'AMT_OUTSTANDING', 'GREEN_BOND_LOAN_INDICATOR']","[0.37262302681797566, 0.23729396320850063, 0.1952009001062646]"
2025-11-06,IT0005363111,BTPS 3.85 09/01/49,2049-09-01,-1.8177041486630827,NO ACTION,-0.23381146311342807,0.975967402317642,-0.20197406093857848,-1.0259560953779852,-0.49871014159958355,118.7229345294799,"['Cpn', 'GREEN_BOND_LOAN_INDICATOR', 'REL_SPRD_LOG']","[0.6061544756326295, 0.14159160335235546, 0.10980855831827038]"
2025-11-06,IT0005365165,BTPS 3 08/01/29,2029-08-01,-4.303974467265871,WEAK SELL,-0.696851197442251,0.9708504884724366,-0.7301799393430841,-1.1744186344618859,-0.9092654510573797,14.766193673238844,"['AMT_OUTSTANDING', 'GREEN_BOND_LOAN_INDICATOR', 'Issue_Age']","[0.4168833577298762, 0.24808260224112813, 0.18498067776447075]"
2025-11-06,IT0005370306,BTPS 2.1 07/15/26,2026-07-15,-1.7267353433911516,NO ACTION,-0.4088990381159388,0.8911710772175584,-0.5776441488333715,-0.5052867404956168,-0.5916010126517043,-16.663174429068466,"['Cpn', 'GREEN_BOND_LOAN_INDICATOR', 'AMT_OUTSTANDING']","[0.6524768881107644, 0.16228197822319476, 0.06947760095377985]"
2025-11-06,IT0005377152,BTPS 3.1 03/01/40,2040-03-01,-0.6273080095390071,NO ACTION,-0.27607510669198837,0.9619446990504213,-0.22904751293380882,0.08144843111867467,-0.35100303657082105,91.69255136412812,"['AMT_OUTSTANDING', 'GREEN_BOND_LOAN_INDICATOR', 'Cpn']","[0.4466454811364794, 0.27161927189699975, 0.19603910337199726]"
2025-11-06,IT0005383309,BTPS 1.35 04/01/30,2030-04-01,-5.048702653176534,WEAK SELL,-0.9451299692085805,0.9856833638730962,-0.7670262471804952,0.06138830592525334,-0.8491424837478911,20.521401264788818,"['Cpn', 'AMT_OUTSTANDING', 'GREEN_BOND_LOAN_INDICATOR']","[0.6469246252939423, 0.18101793836619445, 0.08533330666384795]"
2025-11-06,IT0005390874,BTPS 0.85 01/15/27,2027-01-15,-3.014092759001114,NO ACTION,-0.6924916943598233,0.9825119373848678,-0.9090722541993732,0.5304051015891778,-0.7599220535673317,-11.817420655545176,"['Cpn', 'GREEN_BOND_LOAN_INDICATOR', 'REL_SPRD_LOG']","[0.8179175337948695, 0.08233475803434895, 0.03705846029532743]"
2025-11-06,IT0005398406,BTPS 2.45 09/01/50,2050-09-01,-2.453324737588161,WEAK SELL,-0.3508860189841522,0.9802953431633045,-0.27440261996972093,-3.1961552744189317,-0.9490237584009933,119.75841845342735,"['Cpn', 'REL_SPRD_LOG', 'GREEN_BOND_LOAN_INDICATOR']","[0.3967153593643579, 0.18124562491454824, 0.16838125885392805]"
2025-11-06,IT0005402117,BTPS 1.45 03/01/36,2036-03-01,2.405050507123349,NO ACTION,0.7865609934892264,0.9821040183532784,0.5867218186493041,0.11973926944365643,0.7739556110471637,73.72962899254397,"['Cpn', 'AMT_OUTSTANDING', 'GREEN_BOND_LOAN_INDICATOR']","[0.6961000413330559, 0.12195741723853422, 0.09820862132288208]"
2025-11-06,IT0005403396,BTPS 0.95 08/01/30,2030-08-01,-3.0716109611942564,NO ACTION,-0.28600371852890183,0.9828254222238036,-0.4121093280625339,1.208496220336222,-0.4115395956759302,25.646706980411075,"['Cpn', 'GREEN_BOND_LOAN_INDICATOR', 'Issue_Age']","[0.821654798441007, 0.08690019480209511, 0.06350470612548632]"
2025-11-06,IT0005413171,BTPS 1.65 12/01/30,2030-12-01,-1.019001009298389,NO ACTION,-0.37171312094967646,0.9816069064421495,-0.6390169288615836,-0.7831348393334712,-0.6526896550980735,30.77260236886069,"['Cpn', 'Issue_Age', 'AMT_OUTSTANDING']","[0.5820684064550751, 0.15621017042901938, 0.13171949579642103]"
2025-11-06,IT0005416570,BTPS 0.95 09/15/27,2027-09-15,-3.750306908711616,WEAK SELL,-0.8546727046597558,0.9560698717566051,-1.0084799326403966,-0.3296664592964437,-0.9224976914616653,-4.775812258623683,"['Cpn', 'Issue_Age', 'AMT_OUTSTANDING']","[0.7039780429326903, 0.100456552022224, 0.08880157711829696]"
2025-11-06,IT0005421703,BTPS 1.8 03/01/41,2041-03-01,-1.007319295733211,NO ACTION,-0.4092433019985,0.9685254784900055,-0.5307231208806619,-0.22865344837563478,-0.5445615801214386,95.56303028438003,"['Cpn', 'Issue_Age', 'GREEN_BOND_LOAN_INDICATOR']","[0.6099601214745426, 0.17598883532924764, 0.11246365202018531]"
2025-11-06,IT0005422891,BTPS 0.9 04/01/31,2031-04-01,-1.2843787481093116,NO ACTION,-0.47138137535916275,0.9834009108753222,-0.4699352028816149,0.4327392149507216,-0.522666334662213,33.482779654854646,"['Cpn', 'AMT_OUTSTANDING', 'GREEN_BOND_LOAN_INDICATOR']","[0.6924827563593376, 0.16838479653969188, 0.07143828668719378]"
2025-11-06,IT0005425233,BTPS 1.7 09/01/51,2051-09-01,-6.293941592144464,MODERATE SELL,-1.0582868180633591,0.966333043234709,-1.4641251863942706,-1.28466843888589,-1.3199013025587434,117.3990117572844,"['Cpn', 'Issue_Age', 'GREEN_BOND_LOAN_INDICATOR']","[0.5769908894831987, 0.16941670206833886, 0.0978892676635013]"
2025-11-06,IT0005433195,BTPS 0.95 03/01/37,2037-03-01,0.3560204159253715,NO ACTION,0.06851484779100593,0.9722096630587302,0.5926081719750964,1.1637243206637096,0.5850413810729482,77.57381049920765,"['Cpn', 'Issue_Age', 'GREEN_BOND_LOAN_INDICATOR']","[0.668561242859061, 0.23016097179168996, 0.0710431376356777]"
2025-11-06,IT0005433690,BTPS 0 1/4 03/15/28,2028-03-15,-4.320207867773218,WEAK SELL,-0.9802164929010655,0.9489678269855342,-1.0023105815585567,1.170002814555441,-0.9275310286474712,0.2475205127749929,"['Cpn', 'Issue_Age', 'GREEN_BOND_LOAN_INDICATOR']","[0.7821505821166987, 0.12652673042063203, 0.06140978272284308]"
2025-11-06,IT0005436693,BTPS 0.6 08/01/31,2031-08-01,-0.9821084844342564,NO ACTION,-0.3578573485309264,0.9830849553186338,-0.27838345507145873,0.42619829255693387,-0.41033896495723343,36.71351180144976,"['Cpn', 'Issue_Age', 'GREEN_BOND_LOAN_INDICATOR']","[0.7236683255958177, 0.14299732347993382, 0.06530499932317355]"
2025-11-06,IT0005437147,BTPS 0 04/01/26,2026-04-01,5.79266782912606,MODERATE BUY,1.2475543237909192,0.8394696310549871,1.1519249370277798,1.4754927434673824,1.375987567270334,-12.740535514495544,"['Cpn', 'Issue_Age', 'GREEN_BOND_LOAN_INDICATOR']","[0.8105586247674739, 0.11694664212416071, 0.05823673540074197]"
2025-11-06,IT0005438004,BTPS 1 1/2 04/30/45,2045-04-30,-8.562561519194574,STRONG SELL,-3.0568435406075487,0.9587834762796873,-1.699107656499215,-0.12196820737869504,-2.207618362501459,102.1837012066844,"['GREEN_BOND_LOAN_INDICATOR', 'Cpn', 'Issue_Age']","[0.6413238719681935, 0.18231557116625297, 0.08024027727472523]"
2025-11-06,IT0005441883,BTPS 2.15 03/01/2072,2072-03-01,-4.537199250444445,MODERATE SELL,-0.7347135527894297,0.9570542616246591,-0.7887038752937493,-3.9913706484288207,-1.4221656929443973,123.21275755344033,"['REL_SPRD_LOG', 'AMT_OUTSTANDING', 'Issue_Age']","[0.32817217536727084, 0.23536919259485675, 0.14204986647119686]"
2025-11-06,IT0005445306,BTPS 0 1/2 07/15/28,2028-07-15,-4.485144144380865,WEAK SELL,-1.0165503938263003,0.9581911777424843,-0.7825722572460491,0.21811253820314422,-0.8853312468197803,3.7238657728046753,"['Cpn', 'Issue_Age', 'GREEN_BOND_LOAN_INDICATOR']","[0.7067597494433271, 0.15333794322587418, 0.06120954973550097]"
2025-11-06,IT0005449969,BTPS 0.95 12/01/31,2031-12-01,-0.36982614528835,NO ACTION,-0.1279016927857814,0.988589478293707,-0.1375260386279812,0.5611359634318652,-0.2539437709862053,40.18370953578451,"['Cpn', 'Issue_Age', 'GREEN_BOND_LOAN_INDICATOR']","[0.6791137728902676, 0.18769370301773103, 0.07207808683920912]"
2025-11-06,IT0005454241,BTPS 0 08/01/26,2026-08-01,-8.259369854330615,MODERATE SELL,-1.8479766017853936,0.9142966944521973,-1.2884024464057162,0.701819886253729,-1.445731007279187,-22.62015799118109,"['Cpn', 'Issue_Age', 'GREEN_BOND_LOAN_INDICATOR']","[0.7716948679396032, 0.118941465092682, 0.05545861216673074]"
2025-11-06,IT0005466013,BTPS 0.95 06/01/32,2032-06-01,-1.2442711367357333,NO ACTION,-0.45631810881672397,0.9894230092135029,-0.6364699490571541,-0.015620524768447736,-0.5658879491403448,43.466939749362666,"['Cpn', 'Issue_Age', 'AMT_OUTSTANDING']","[0.6770881910369473, 0.1450754675076835, 0.08716587518664731]"
2025-11-06,IT0005467482,BTPS 0.45 02/15/29,2029-02-15,-3.9556667762016335,NO ACTION,-0.5807317764639122,0.9701372017926186,-0.49587666385265455,0.5465242098445878,-0.583586372161861,10.4652019736007,"['Cpn', 'Issue_Age', 'GREEN_BOND_LOAN_INDICATOR']","[0.6916336560218299, 0.18772680326432215, 0.05877632053128455]"
2025-11-06,IT0005480980,BTPS 2.15 09/01/52,2052-09-01,-4.154398226968482,NO ACTION,-0.6642056734174014,0.9577713977473585,-0.460803808619809,-0.6778474345700491,-0.7294869436060903,120.84544468823984,"['Issue_Age', 'Cpn', 'AMT_OUTSTANDING']","[0.3413551630409269, 0.28042239540676756, 0.25361599335419144]"
2025-11-06,IT0005484552,BTPS 1.1 04/01/27,2027-04-01,-0.1215839886742093,NO ACTION,-0.0552993844082973,0.9498123671904862,-0.24627264301857904,0.2646698846565103,-0.24112422108330586,-6.453524502544309,"['Cpn', 'Issue_Age', 'GREEN_BOND_LOAN_INDICATOR']","[0.6154042838991004, 0.23756916955808158, 0.07071963169195838]"
2025-11-06,IT0005494239,BTPS 2 1/2 12/01/32,2032-12-01,0.9825858900860354,WEAK SELL,-0.6275883905827372,0.9907375031665602,-0.595303208810748,-1.2168182860642887,-0.8462570737851216,49.70055476268785,"['Issue_Age', 'Cpn', 'AMT_OUTSTANDING']","[0.42509856587495676, 0.2529198103504579, 0.169755480867512]"
2025-11-06,IT0005495731,BTPS 2.8 06/15/29,2029-06-15,-1.7593665673068417,NO ACTION,0.1514745890407565,0.9675361820245547,0.34853204064248616,-1.5068823282364388,0.3593605576029246,16.017568841924767,"['Issue_Age', 'GREEN_BOND_LOAN_INDICATOR', 'AMT_OUTSTANDING']","[0.5688055090553592, 0.14969792773537963, 0.11440601665469845]"
2025-11-06,IT0005496770,BTPS 3 1/4 03/01/38,2038-03-01,2.951007911918353,WEAK BUY,0.9778820540790482,0.9618472807133065,0.9256210647749651,-0.9634316481794776,0.9439079416082276,85.61270536191351,"['Issue_Age', 'Cpn', 'AMT_OUTSTANDING']","[0.4993723298259061, 0.1849046541512307, 0.17648173410095372]"
2025-11-06,IT0005500068,BTPS 2.65 12/01/27,2027-12-01,1.089002807704813,NO ACTION,0.21138143090843106,0.9565135069829288,0.281121975151923,-0.402130754756653,0.3689485002846837,2.453707860148417,"['Issue_Age', 'Cpn', 'GREEN_BOND_LOAN_INDICATOR']","[0.5371216124060564, 0.20566417898537917, 0.1467369299221252]"
2025-11-06,IT0005508590,BTPS 4 04/30/35,2035-04-30,-3.072551599262397,STRONG SELL,-2.134342839307423,0.9648090839035178,-1.5329691071821423,0.5225873004792027,-1.6698651192836536,62.94445533094397,"['GREEN_BOND_LOAN_INDICATOR', 'Cpn', 'Issue_Age']","[0.6784461029846744, 0.13982080312283524, 0.11864322086383142]"
2025-11-06,IT0005518128,BTPS 4.4 05/01/33,2033-05-01,3.164487628141778,NO ACTION,0.18313384981751452,0.9994039671917986,0.210844199066743,0.01950398419374405,0.34521540427579095,55.07814530821694,"['Cpn', 'Issue_Age', 'GREEN_BOND_LOAN_INDICATOR']","[0.5599818995627958, 0.2692611851514632, 0.0818864131739829]"
2025-11-06,IT0005519787,BTPS 3.85 12/15/29,2029-12-15,0.5195289152745701,WEAK BUY,0.9112167098620338,0.9796757764564861,0.6501887820722693,-0.6167214276007199,0.8347998688817998,23.265617994060204,"['Issue_Age', 'Cpn', 'AMT_OUTSTANDING']","[0.384073990361148, 0.36721872445498993, 0.12723325434485003]"
2025-11-06,IT0005521981,BTPS 3.4 04/01/28,2028-04-01,-0.1674879210334605,NO ACTION,-0.06541158631271678,0.9576723961782557,-0.4830191324695538,0.22882687047768044,-0.31476361327940033,4.912775107017767,"['Issue_Age', 'Cpn', 'GREEN_BOND_LOAN_INDICATOR']","[0.5444492255633704, 0.2566142393330895, 0.12079283611802175]"
2025-11-06,IT0005530032,BTPS 4.45 09/01/43,2043-09-01,3.2261843611902634,WEAK BUY,1.074312745670842,0.9947403266202085,1.4380734014261487,0.226604600802066,1.1826167778836452,108.9498020826998,"['Cpn', 'Issue_Age', 'AMT_OUTSTANDING']","[0.4961804945271763, 0.3262309525178021, 0.0993309732098456]"
2025-11-06,IT0005534141,BTPS 4 1/2 10/01/53,2053-10-01,8.358150212723487,MODERATE BUY,1.6404727415238254,0.9502076616583485,1.6711503533070382,-0.329976039380544,1.4915879485663954,134.581381534861,"['Cpn', 'Issue_Age', 'AMT_OUTSTANDING']","[0.47837760683830666, 0.31317964705427065, 0.10166305367258668]"
2025-11-06,IT0005538597,BTPS 3.8 04/15/26,2026-04-15,5.994449122133576,MODERATE BUY,1.2920048331603111,0.9161269853433284,1.4905977849486025,-0.5160974773225778,1.2567028044711388,-12.055056779084872,"['Issue_Age', 'Cpn', 'AMT_OUTSTANDING']","[0.4147475634433224, 0.3400623496270258, 0.1288725553324571]"
2025-11-06,IT0005542359,BTPS 4 10/30/31,2031-10-30,-2.3825411329547848,WEAK SELL,-0.8838196169619728,0.9913980428479544,-1.2235393607195824,0.4552433009061676,-0.9482823496711673,37.428123156392616,"['GREEN_BOND_LOAN_INDICATOR', 'Issue_Age', 'Cpn']","[0.6606346400762438, 0.13688214611067082, 0.13594228085506135]"
2025-11-06,IT0005542797,BTPS 3.7 06/15/30,2030-06-15,1.5130945007410084,WEAK BUY,1.242453324637472,0.9715757332205621,1.2242591634735729,-0.5612271737256835,1.1653110777941857,29.027531158277448,"['Issue_Age', 'Cpn', 'GREEN_BOND_LOAN_INDICATOR']","[0.46245388447373525, 0.32644759650957844, 0.09246830495529894]"
2025-11-06,IT0005544082,BTPS 4.35 11/01/33,2033-11-01,4.655142115811692,WEAK BUY,0.737011563386469,0.9945241871007422,0.7673121200418793,0.7370269641262596,0.9070254944231951,60.33173221482279,"['Cpn', 'Issue_Age', 'GREEN_BOND_LOAN_INDICATOR']","[0.5075710792624729, 0.3632434839481126, 0.07708457740964467]"
2025-11-06,IT0005548315,BTPS 3.8 08/01/28,2028-08-01,0.3228465165348702,NO ACTION,0.04260445019099808,0.9654520827112326,0.6182666351900883,0.04338256358300514,0.38730805591821177,9.032484986614197,"['Issue_Age', 'Cpn', 'GREEN_BOND_LOAN_INDICATOR']","[0.43834881859489044, 0.3792537827528748, 0.09475056025250585]"
2025-11-06,IT0005556011,BTPS 3.85 09/15/26,2026-09-15,6.818583777285097,MODERATE BUY,1.4735538988067927,0.9251061073287864,1.5352359643358602,0.5961699413747801,1.4650074177165735,-6.02733047250284,"['Issue_Age', 'Cpn', 'GREEN_BOND_LOAN_INDICATOR']","[0.47462129796270913, 0.3769747392755363, 0.08908485038143196]"
2025-11-06,IT0005560948,BTPS 4.2 03/01/34,2034-03-01,4.987776468290711,WEAK BUY,0.8606074443431336,0.9862920102888916,1.0887975709120716,0.5337949859352961,1.025306921432846,63.04277059315812,"['Cpn', 'Issue_Age', 'GREEN_BOND_LOAN_INDICATOR']","[0.47938430538182547, 0.37659077955554177, 0.08150938264967338]"
2025-11-06,IT0005561888,BTPS 4 11/15/30,2030-11-15,2.730707050494537,WEAK BUY,1.0365694974014303,0.9832777987101909,1.0073508167215424,-0.2954779187585989,1.000690762972082,34.12347231780377,"['Issue_Age', 'Cpn', 'AMT_OUTSTANDING']","[0.42977931861858204, 0.3827019839447853, 0.08250686973319972]"
2025-11-06,IT0005566408,BTPS 4.1 02/01/29,2029-02-01,1.3555576639811768,MODERATE BUY,1.1899334212973618,0.967089285342775,1.319912405017697,0.29214967081221915,1.214575779752287,15.379761396436066,"['Cpn', 'Issue_Age', 'GREEN_BOND_LOAN_INDICATOR']","[0.4488181517295608, 0.3933284272964713, 0.08295471456737569]"
2025-11-06,IT0005580045,BTPS 2.95 02/15/27,2027-02-15,6.907145135662138,MODERATE BUY,1.4930631279906799,0.9630389986175454,1.3296946941184127,0.605241518741153,1.4246740602304877,-0.8838010146074183,"['Issue_Age', 'GREEN_BOND_LOAN_INDICATOR', 'AMT_OUTSTANDING']","[0.744775513651731, 0.12321783356687063, 0.0731524156289165]"
2025-11-06,IT0005580094,BTPS 3 1/2 02/15/31,2031-02-15,2.996936353526351,MODERATE BUY,1.13655757486689,0.9828008422604303,1.3960859676872042,1.0110962298603519,1.3339383721878217,36.665829178830194,"['Issue_Age', 'Cpn', 'GREEN_BOND_LOAN_INDICATOR']","[0.6027240423966794, 0.25906060176849566, 0.1001592438244129]"
2025-11-06,IT0005582421,BTPS 4.15 10/01/39,2039-10-01,3.732831493883623,MODERATE BUY,1.2518582206847426,0.9694387933334515,1.4561758245546668,0.36032689452055305,1.2968306643894216,94.17396970371904,"['Issue_Age', 'Cpn', 'GREEN_BOND_LOAN_INDICATOR']","[0.463281212942891, 0.39507300894648767, 0.07024083041047499]"
2025-11-06,IT0005584849,BTPS 3.35 07/01/29,2029-07-01,1.8445072639173248,MODERATE BUY,1.3529402853108952,0.9796961216279715,1.4559682928668984,0.9071116616245973,1.4431555793628768,20.06302351768777,"['Issue_Age', 'Cpn', 'GREEN_BOND_LOAN_INDICATOR']","[0.6453031754990706, 0.20336747018399662, 0.1079445273655326]"
2025-11-06,IT0005584856,BTPS 3.85 07/01/34,2034-07-01,5.368744332107703,MODERATE BUY,1.0021624533003328,0.9880991882886115,1.2970933526217172,0.8885656762106067,1.2173121113751997,65.78196582244037,"['Issue_Age', 'Cpn', 'GREEN_BOND_LOAN_INDICATOR']","[0.508793757464995, 0.3613690339487631, 0.08550198802117757]"
2025-11-06,IT0005595803,BTPS 3.45 07/15/31,2031-07-15,3.36360356365941,MODERATE BUY,1.274267244664009,0.9836878992855748,1.456270157140016,0.9991004041081849,1.4194126876062354,40.655422153775575,"['Issue_Age', 'Cpn', 'GREEN_BOND_LOAN_INDICATOR']","[0.633091463973968, 0.23026235758941585, 0.09797533736592533]"
2025-11-06,IT0005596470,BTPS 4.05 10/30/37,2037-10-30,2.2302882904267847,WEAK BUY,0.7253186834559568,0.9690945263820607,0.5988812889008205,0.7382990724149403,0.8491800204878384,83.12067523699886,"['GREEN_BOND_LOAN_INDICATOR', 'Issue_Age', 'Cpn']","[0.6389634851341258, 0.17167070615888, 0.13733013883139264]"
2025-11-06,IT0005599904,BTPS 3.45 07/15/27,2027-07-15,4.273040958481408,WEAK BUY,0.9127949045961281,0.9370056667374482,0.9684574917820528,-0.6656265829803947,0.9186041139919884,1.297196596956715,"['Issue_Age', 'Cpn', 'AMT_OUTSTANDING']","[0.543499910916407, 0.19398587678009807, 0.13853402467040757]"
2025-11-06,IT0005607269,BTPS 3.1 08/28/26,2026-08-28,8.137818044956347,STRONG BUY,1.7641687239053696,0.9413131298141568,1.5455842489486715,-0.4666627578106994,1.5176077200185432,-5.312497741820054,"['Issue_Age', 'AMT_OUTSTANDING', 'GREEN_BOND_LOAN_INDICATOR']","[0.6378426577483215, 0.154006750721698, 0.09436635437191142]"
2025-11-06,IT0005607970,BTPS 3.85 02/01/35,2035-02-01,5.386598853365584,WEAK BUY,1.00879660057791,0.9777800526138969,1.1463121481995,0.2574256845157863,1.0687894038560726,69.81259920999327,"['Issue_Age', 'Cpn', 'GREEN_BOND_LOAN_INDICATOR']","[0.49228774229618516, 0.3485598643901429, 0.08247424763327363]"
2025-11-06,IT0005611055,BTPS 3 10/01/29,2029-10-01,1.2345463169144466,MODERATE BUY,1.1495904489378854,0.9765023453564277,1.3683804873701337,0.2778494623786173,1.2068956015932,21.96557018790814,"['Issue_Age', 'GREEN_BOND_LOAN_INDICATOR', 'AMT_OUTSTANDING']","[0.6997553766526279, 0.11407931845667808, 0.11053378076285479]"
2025-11-06,IT0005611741,BTPS 4.3 10/01/54,2054-10-01,9.67597387753422,STRONG BUY,1.8832018521943301,0.9558250361402729,1.5305948011366781,0.045656134877087425,1.5843576220712148,136.86866304122415,"['Issue_Age', 'Cpn', 'AMT_OUTSTANDING']","[0.427624133925947, 0.3937128434001716, 0.09113269399794847]"
2025-11-06,IT0005619546,BTPS 3.15 11/15/31,2031-11-15,4.287779492126951,MODERATE BUY,1.621361171872627,0.979323154122466,1.430611693925024,-0.2134763393534803,1.4185708421942949,44.47047559933059,"['Issue_Age', 'GREEN_BOND_LOAN_INDICATOR', 'Cpn']","[0.70574146853902, 0.09946471961175982, 0.09398417538218297]"
2025-11-06,IT0005622128,BTPS 2.7 10/15/27,2027-10-15,4.357128612595572,WEAK BUY,0.9313186190660944,0.9592679498979141,0.850305928632136,-0.7584432539828968,0.8983408659751672,4.267066615349814,"['Issue_Age', 'AMT_OUTSTANDING', 'Cpn']","[0.653134422050741, 0.11284420568917297, 0.10528477134438084]"
2025-11-06,ES0000011868,SPGB 6 01/31/29,2029-01-31,-4.573014788425022,STRONG SELL,-1.6736577492542035,0.9810350753122163,-1.7136231696031827,1.2541623921747462,-1.5108520975267565,0.3195888689573016,"['Issue_Age', 'Cpn', 'AMT_OUTSTANDING']","[0.6337776782596739, 0.2553981741843382, 0.0702979980863038]"
2025-11-06,ES00000120N0,SPGB 4.9 07/30/40,2040-07-30,3.139272409809891,NO ACTION,0.32508069113370763,0.9862830370046554,0.20721471643572523,0.7953745046114287,0.5363590314924376,72.58664782063194,"['Issue_Age', 'Cpn', 'AMT_OUTSTANDING']","[0.6341658317331469, 0.2147145825394843, 0.06362883418800239]"
2025-11-06,ES00000121S7,SPGB 4.7 07/30/41,2041-07-30,2.45780788699399,NO ACTION,0.031152216252184,0.9873696641184813,0.6336231133532854,1.261888268554807,0.5871093408638189,75.60630080661409,"['Issue_Age', 'Cpn', 'YAS_RISK']","[0.6515267064337669, 0.22610238411131212, 0.082635632455206]"
2025-11-06,ES00000123C7,SPGB 5.9 07/30/26,2026-07-30,6.497149770860876,MODERATE BUY,1.6409841147819046,0.9076628715560643,1.1020336083784763,0.6289196791423038,1.4254011862663356,-9.845819593650468,"['Issue_Age', 'Cpn', 'AMT_OUTSTANDING']","[0.5083232896808642, 0.32148489000141867, 0.06566163758879696]"
2025-11-06,ES0000012411,SPGB 5 3/4 07/30/32,2032-07-30,-2.757159616996649,WEAK SELL,-1.0004010306323416,0.9971032508449948,-1.4636752002192173,1.3657000249906766,-1.0965793558648913,26.81225689306559,"['Issue_Age', 'Cpn', 'AMT_OUTSTANDING']","[0.6517088058489746, 0.251569133734241, 0.06761365034910567]"
2025-11-06,ES00000124C5,SPGB 5.15 10/31/28,2028-10-31,-1.7476497342322466,NO ACTION,-0.5306628972869841,0.9769931992705092,-0.778028047239506,0.5316872239614293,-0.656325534115094,1.1544674748924215,"['Issue_Age', 'Cpn', 'AMT_OUTSTANDING']","[0.5115560267008065, 0.3034219142432323, 0.07053851075306919]"
2025-11-06,ES00000124H4,SPGB 5.15 10/31/44,2044-10-31,-1.1961561287320848,MODERATE SELL,-1.5448712368490967,0.9888897705786687,-1.6329739796883775,0.16014481101535216,-1.4230570197172074,82.4574372195896,"['Issue_Age', 'Cpn', 'AMT_OUTSTANDING']","[0.3979248517944205, 0.2435204611050687, 0.20603756805821258]"
2025-11-06,ES00000127A2,SPGB 1.95 07/30/30,2030-07-30,-3.491488781047332,WEAK SELL,-1.0318915952327714,0.9860679840271601,-1.2101786664790004,0.45747742728267704,-1.0385438018265245,12.587993546571305,"['Issue_Age', 'AMT_OUTSTANDING', 'Cpn']","[0.5223027938406914, 0.2844875504418386, 0.07112949541769151]"
2025-11-06,ES00000127Z9,SPGB 1.95 04/30/26,2026-04-30,4.173289569044572,WEAK BUY,1.028888688977711,0.9475219722346052,1.0421273901097587,0.327199334915494,1.0491773104297475,-14.459676606490548,"['Issue_Age', 'YAS_RISK', 'Cpn']","[0.6067290019857842, 0.15806755509912934, 0.09978714421174642]"
2025-11-06,ES00000128C6,SPGB 2.9 10/31/46,2046-10-31,-5.083509913278888,NO ACTION,-0.6688729593932455,0.981921578452999,-0.644408469388656,-0.010738031590866377,-0.6918593708431572,83.97644643882063,"['Issue_Age', 'YAS_RISK', 'AMT_OUTSTANDING']","[0.5050597668166938, 0.18392891605984038, 0.14100148538955448]"
2025-11-06,ES00000128E2,SPGB 3.45 07/30/66,2066-07-30,4.4662718835025,MODERATE BUY,1.472152169117543,0.9790599434116927,1.3064309152985598,-1.1393570437865632,1.3015863612583203,119.79478424564743,"['AMT_OUTSTANDING', 'Issue_Age', 'YAS_RISK']","[0.29364356970291755, 0.2541764013502488, 0.16663719332834698]"
2025-11-06,ES00000128H5,SPGB 1.3 10/31/26,2026-10-31,3.248504697061829,WEAK BUY,0.7853040750878003,0.9776874687496429,1.2192975305146037,-0.025460369458593896,0.923796674651606,-10.789245871933527,"['Issue_Age', 'AMT_OUTSTANDING', 'Cpn']","[0.3543220736644705, 0.33308814367444556, 0.14107287378273128]"
2025-11-06,ES00000128P8,SPGB 1 1/2 04/30/27,2027-04-30,1.1629498353203471,NO ACTION,0.23597731690419063,0.9489931317606284,0.3424472780848713,-0.4906367185298894,0.3866584859316708,-8.488166602131269,"['Issue_Age', 'AMT_OUTSTANDING', 'Cpn']","[0.38746315829773387, 0.2376661582692274, 0.15573520676207853]"
2025-11-06,ES00000128Q6,SPGB 2.35 07/30/33,2033-07-30,-0.3464335028967369,WEAK SELL,-1.4060261425872687,0.9950820037768621,-1.0442994126622283,0.046959098931170465,-1.1848835334350065,35.36185232085065,"['Issue_Age', 'GREEN_BOND_LOAN_INDICATOR', 'AMT_ISSUED']","[0.6993866093531051, 0.10432972005321058, nan]"
2025-11-06,ES0000012932,SPGB 4.2 01/31/37,2037-01-31,3.410212065611283,WEAK BUY,0.44194206417416776,0.9808638147185922,1.0111742310204561,1.130355622778937,0.8821301025066645,57.87896333574247,"['Issue_Age', 'Cpn', 'YAS_RISK']","[0.753128228441353, 0.1594192295548098, 0.03425270210808528]"
2025-11-06,ES0000012A89,SPGB 1.45 10/31/27,2027-10-31,-4.824802376552832,MODERATE SELL,-1.341172520625594,0.966887696298306,-1.0990440827763983,-0.7522079123366217,-1.2911259270478401,-10.14868470209922,"['Issue_Age', 'AMT_OUTSTANDING', 'Cpn']","[0.38672530551797546, 0.1923286417225536, 0.17503439615213537]"
2025-11-06,ES0000012B39,SPGB 1.4 04/30/28,2028-04-30,-5.964819861626248,MODERATE SELL,-1.6414485386945152,0.9789785005950441,-1.3070222137286989,-0.44787568217763685,-1.454627665060385,-7.135908834634556,"['AMT_OUTSTANDING', 'Issue_Age', 'Cpn']","[0.3969641794866371, 0.22365768940282418, 0.16461996062138914]"
2025-11-06,ES0000012B47,SPGB 2.7 10/31/48,2048-10-31,-5.009032028994199,NO ACTION,-0.652175298109971,0.9855468026565553,-0.5462745351003206,-0.7271173904722938,-0.7785307164414034,88.77409180646121,"['Issue_Age', 'YAS_RISK', 'GREEN_BOND_LOAN_INDICATOR']","[0.33806152871261885, 0.32090960341781705, 0.0976856451878434]"
2025-11-06,ES0000012B88,SPGB 1.4 07/30/28,2028-07-30,-2.803482895058704,WEAK SELL,-0.8087651031120764,0.9894291299346334,-0.6517314158329204,-1.105397926577551,-0.9544381182626129,-1.944589020390961,"['Issue_Age', 'Cpn', 'AMT_OUTSTANDING']","[0.28241397914620386, 0.22352344979059896, 0.21199601820977998]"
2025-11-06,ES0000012E51,SPGB 1.45 04/30/29,2029-04-30,-3.028654710232537,MODERATE SELL,-0.7572507270976746,0.9809086042429271,-0.7178960112390269,-3.223214358751283,-1.30790290666986,3.760815253168417,"['Cpn', 'REL_SPRD_LOG', 'Issue_Age']","[0.2855669461433106, 0.10908385431351046, 0.10648876723071234]"
2025-11-06,ES0000012E69,SPGB 1.85 07/30/35,2035-07-30,-0.2005220045687181,STRONG SELL,-1.3045985082445597,0.9905539280845815,-1.3008928752951736,-2.3868992125442112,-1.6137845743569244,46.70027271446819,"['Cpn', 'GREEN_BOND_LOAN_INDICATOR', 'REL_SPRD_LOG']","[0.2763225286801068, 0.1677334323614009, 0.1426944283594536]"
2025-11-06,ES0000012F43,SPGB 0.6 10/31/29,2029-10-31,-1.433814262500574,NO ACTION,0.1891108152386154,0.9858198786015491,0.1430179612635399,-3.2175777354230233,0.3120030890037188,9.18939422003549,"['Cpn', 'REL_SPRD_LOG', 'Issue_Age']","[0.4004135084973718, 0.0853978421872607, 0.015905219532401836]"
2025-11-06,ES0000012F76,SPGB 0 1/2 04/30/30,2030-04-30,-2.549283038822221,NO ACTION,-0.4727966207616179,0.9838245032719989,-0.36158789019541565,-0.08572729367035418,-0.523652656424405,11.73225066144661,"['AMT_OUTSTANDING', 'Cpn', 'Issue_Age']","[0.4037167743183718, 0.2928570044550027, 0.1257399861949568]"
2025-11-06,ES0000012G00,SPGB 1 10/31/50,2050-10-31,-8.434310048035712,STRONG SELL,-1.420109735457557,0.9729179714694837,-1.4627719292921715,-2.1461858814413017,-1.675059470216776,89.45191110201606,"['Cpn', 'Issue_Age', 'YAS_RISK']","[0.26712008590231234, 0.17367340115770727, 0.17059793170237095]"
2025-11-06,ES0000012G26,SPGB 0.8 07/30/27,2027-07-30,-1.954833051079266,NO ACTION,-0.5852341492262718,0.9665728124365947,-0.7664790832437058,-0.39812883620208783,-0.7474162252957297,-9.44943417296246,"['Cpn', 'Issue_Age', 'YAS_RISK']","[0.3680798337687047, 0.23741974298646923, 0.18483467321575459]"
2025-11-06,ES0000012G34,SPGB 1 1/4 10/31/30,2030-10-31,-1.5404623601657867,NO ACTION,0.12582695613082062,0.9838009176487177,0.17495504046980292,0.11713749125160601,0.308322211208723,16.348450222975433,"['AMT_OUTSTANDING', 'Cpn', 'Issue_Age']","[0.5061870472789591, 0.17474477829133472, 0.16214853798548737]"
2025-11-06,ES0000012G42,SPGB 1.2 10/31/40,2040-10-31,-0.0599004590363847,WEAK SELL,-1.0547827804624008,0.9861014319258886,-1.1417558937552792,-0.7674131033164515,-1.162140540430825,70.3534051665549,"['AMT_OUTSTANDING', 'Issue_Age', 'Cpn']","[0.3025483604891434, 0.22822516341008273, 0.22175831426930528]"
2025-11-06,ES0000012H41,SPGB 0.1 04/30/31,2031-04-30,-2.6867277191761474,WEAK SELL,-0.9454109494951047,0.9922858879982034,-0.7229930400416426,0.45150816103972297,-0.856216548501219,18.644028100071218,"['AMT_OUTSTANDING', 'Cpn', 'Issue_Age']","[0.3609835132645259, 0.2600541306298932, 0.2562711417188316]"
2025-11-06,ES0000012H58,SPGB 1.45 10/31/2071,2071-10-31,-1.2117130386045574,NO ACTION,0.19916932445884922,0.9883649975873131,0.19369791220600377,0.30021941605067753,0.3834493920958695,116.20867558839876,"['AMT_OUTSTANDING', 'REL_SPRD_LOG', 'Issue_Age']","[0.4560978267690649, 0.2927879181724268, 0.11293611109354172]"
2025-11-06,ES0000012I08,SPGB 0 01/31/28,2028-01-31,-4.497651391022291,WEAK SELL,-1.2550022675122328,0.9341644265471802,-1.24182540860157,0.016409625796098386,-1.1532554042159096,-7.706706096971789,"['AMT_OUTSTANDING', 'Issue_Age', 'Cpn']","[0.3361005556869016, 0.255631873562662, 0.24103675511713415]"
2025-11-06,ES0000012I24,SPGB 0.85 07/30/37,2037-07-30,3.5360195375959123,NO ACTION,0.49620519472767405,0.9851763093306874,0.978543568780926,0.39915516152880376,0.7762661327070925,60.32506948658708,"['Issue_Age', 'AMT_OUTSTANDING', 'Cpn']","[0.3437652853839778, 0.31071809647976784, 0.21746619995220492]"
2025-11-06,ES0000012I32,SPGB 0 1/2 10/31/31,2031-10-31,-2.2655115069466483,NO ACTION,-0.616544137672842,0.9889937171280527,-0.6692161602064503,0.367128915774003,-0.6714380683683374,22.45867201616274,"['Issue_Age', 'Cpn', 'AMT_OUTSTANDING']","[0.3731378206348516, 0.24994797253836973, 0.24558536755003532]"
2025-11-06,ES0000012J07,SPGB 1 07/30/42,2042-07-30,-1.3931268248331747,MODERATE SELL,-1.6298284053633354,0.9833785032782217,-1.6362644666369013,0.45781769156909125,-1.4666780045409173,75.22309980256885,"['GREEN_BOND_LOAN_INDICATOR', 'AMT_OUTSTANDING', 'Issue_Age']","[0.6101504242283607, 0.13936566935339686, 0.12843857785060678]"
2025-11-06,ES0000012J15,SPGB 0 01/31/27,2027-01-31,3.076503515391284,WEAK BUY,0.7399996559789528,0.8998429910737828,0.88057093287242,0.6870530501419606,0.9081778416324455,-8.715244427088955,"['Issue_Age', 'Cpn', 'YAS_RISK']","[0.4565097039560668, 0.31317603840262026, 0.131734996264019]"
2025-11-06,ES0000012K20,SPGB 0.7 04/30/32,2032-04-30,-1.43147339758438,NO ACTION,0.034635579538022945,0.9870406108586459,0.26163678979023597,0.8372673258687067,0.4100408497113539,26.547559796511223,"['AMT_OUTSTANDING', 'Issue_Age', 'Cpn']","[0.38326276600487635, 0.36345785574241196, 0.17007705658095557]"
2025-11-06,ES0000012K46,SPGB 1.9 10/31/52,2052-10-31,-3.230389331592363,NO ACTION,-0.2534103010853256,0.9846072810922063,-0.530370514849121,-0.39729506149091914,-0.5126116844009249,98.21824302894952,"['Issue_Age', 'AMT_OUTSTANDING', 'YAS_RISK']","[0.4198852648037671, 0.20838580342019827, 0.16214853251272504]"
2025-11-06,ES0000012K53,SPGB 0.8 07/30/29,2029-07-30,0.7061133072515684,MODERATE BUY,1.4589213209093008,0.982575840297738,1.5378940903540517,0.2784334376606037,1.4090842474632894,9.406284979447394,"['Issue_Age', 'AMT_OUTSTANDING', 'Cpn']","[0.4291905510041848, 0.27660878100506764, 0.15379236531077503]"
2025-11-06,ES0000012K61,SPGB 2.55 10/31/32,2032-10-31,-0.3439424523998973,WEAK BUY,0.8837311848752796,0.9919257590911428,0.6833675336927374,0.8567781193043824,0.9705391823567853,30.825774612305867,"['Issue_Age', 'AMT_OUTSTANDING', 'GREEN_BOND_LOAN_INDICATOR']","[0.6136396549073176, 0.23134156340015039, 0.07381371556001197]"
2025-11-06,ES0000012K95,SPGB 3.45 07/30/43,2043-07-30,3.2805446551906385,NO ACTION,0.38601406952333994,0.9779299370781092,0.8683122560053698,0.36662089045738494,0.6814270622533493,83.14417945061821,"['Issue_Age', 'AMT_OUTSTANDING', 'YAS_RISK']","[0.4408599519626473, 0.2807629447783975, 0.14699625910701125]"
2025-11-06,ES0000012L29,SPGB 2.8 05/31/26,2026-05-31,6.302499406316191,MODERATE BUY,1.5897139920456929,0.9329439003035461,1.4425828777127345,0.23800401763241125,1.4336406786138125,-11.546511962461278,"['Issue_Age', 'YAS_RISK', 'GREEN_BOND_LOAN_INDICATOR']","[0.6331185995106375, 0.1577999340688106, 0.06453453742762955]"
2025-11-06,ES0000012L52,SPGB 3.15 04/30/33,2033-04-30,0.8149635057957951,NO ACTION,-0.5987028509055895,0.9979942865564569,-0.46214130018119537,0.3519765466988461,-0.6047431238070473,35.02803786484502,"['Issue_Age', 'AMT_OUTSTANDING', 'GREEN_BOND_LOAN_INDICATOR']","[0.5762426814739516, 0.23029510465493327, 0.060582276574310194]"
2025-11-06,ES0000012L60,SPGB 3.9 07/30/39,2039-07-30,4.495597023512161,WEAK BUY,0.9100890251001693,0.9876325338293497,0.9294766016367583,0.0082698125361348,0.9083120127863957,69.9834997663316,"['Issue_Age', 'AMT_OUTSTANDING', 'Cpn']","[0.45621912242499013, 0.2674913512632125, 0.10822546485610414]"
2025-11-06,ES0000012L78,SPGB 3.55 10/31/33,2033-10-31,2.428103783042104,NO ACTION,0.5226412793302099,0.9968139143195024,0.8121804198246649,0.4454315396060979,0.7522942295194868,39.6408043137682,"['Issue_Age', 'AMT_OUTSTANDING', 'Cpn']","[0.5325169553787513, 0.26385809750155714, 0.08031168904936979]"
2025-11-06,ES0000012M51,SPGB 3 1/2 05/31/29,2029-05-31,-0.1567211579725196,WEAK BUY,0.9469244271437812,0.9810756373154012,0.8775707830075893,0.24642852263599746,0.9520620471677537,7.286896337142107,"['Issue_Age', 'AMT_OUTSTANDING', 'Cpn']","[0.5101462727934526, 0.28158660142422065, 0.06458258556611977]"
2025-11-06,ES0000012M77,SPGB 2 1/2 05/31/27,2027-05-31,1.4656274480628584,NO ACTION,0.3157013821075197,0.9383711474718724,0.9110724564981997,0.6319392672129918,0.6961625891955521,-7.447215665706353,"['Issue_Age', 'YAS_RISK', 'AMT_OUTSTANDING']","[0.7284974589616916, 0.10148160685405017, 0.06579985672162435]"
2025-11-06,ES0000012M85,SPGB 3 1/4 04/30/34,2034-04-30,3.017977635141172,WEAK BUY,0.9326809956281578,0.9994419122209782,1.3110440489616864,0.21023597082147197,1.0653573856172365,43.09133933229378,"['Issue_Age', 'AMT_OUTSTANDING', 'GREEN_BOND_LOAN_INDICATOR']","[0.6738092153744469, 0.12363694983348858, 0.055164382480459184]"
2025-11-06,ES0000012M93,SPGB 4 10/31/54,2054-10-31,3.802097624162897,MODERATE BUY,1.3232468004697064,0.9767416543106128,1.542749171586923,0.6097832427977671,1.3965178165533325,108.32352942645116,"['AMT_OUTSTANDING', 'Issue_Age', 'YAS_RISK']","[0.3763760466523434, 0.36677303213126067, 0.1503618046482972]"
2025-11-06,ES0000012N35,SPGB 3.45 10/31/34,2034-10-31,3.123480573212745,WEAK BUY,1.0060193791512206,0.9932370876920638,1.2155554081025568,0.3301105809925213,1.0952324196327152,46.0159326424261,"['Issue_Age', 'AMT_OUTSTANDING', 'Cpn']","[0.6082329038770622, 0.19727406614652798, 0.05937474592698901]"
2025-11-06,ES0000012N43,SPGB 3.1 07/30/31,2031-07-30,0.6298045313185696,STRONG BUY,1.6439893533869854,0.9941427006020903,1.520731942740181,0.5811487961739084,1.5530157426379836,23.65193558340224,"['Issue_Age', 'GREEN_BOND_LOAN_INDICATOR', 'AMT_OUTSTANDING']","[0.7943105980270557, 0.056624566579509886, 0.039644505016885996]"
2025-11-06,ES0000012O00,SPGB 2.7 01/31/30,2030-01-31,0.2947340081021163,MODERATE BUY,1.2148131729237492,0.9900171413381853,1.0543215476248773,0.8932641875147096,1.2522940100175044,12.791218273248544,"['Issue_Age', 'AMT_OUTSTANDING', 'GREEN_BOND_LOAN_INDICATOR']","[0.559971147815583, 0.32534034283070934, 0.03721840162143276]"
2025-11-06,ES0000012O59,SPGB 2.4 05/31/28,2028-05-31,-0.394633058142836,NO ACTION,-0.1742837494260973,0.9766171855332937,-0.4411563809653629,0.6270138345116536,-0.377157704400919,-0.8707522923839449,"['Issue_Age', 'AMT_OUTSTANDING', 'YAS_RISK']","[0.6758438719089889, 0.15025767594309097, 0.06917317439336504]"
2025-11-06,ES0000012O67,SPGB 3.15 04/30/35,2035-04-30,2.8961371128227142,WEAK BUY,0.8479858476278298,0.9920370537425474,0.5973471077296058,0.4919219101184876,0.8652117717666419,48.47662383708686,"['Issue_Age', 'AMT_OUTSTANDING', 'GREEN_BOND_LOAN_INDICATOR']","[0.6440144647177658, 0.1946088147794718, 0.042822528245583226]"
2025-11-06,ES0000012O75,SPGB 3 1/2 01/31/41,2041-01-31,6.185553733753423,STRONG BUY,1.63899916176359,0.9896939091000172,1.338964798510192,1.0491388970666584,1.5779420423312462,77.53884611751607,"['AMT_OUTSTANDING', 'Issue_Age', 'YAS_RISK']","[0.48490049838297855, 0.39169079510540705, 0.06189497841637654]"
2025-11-06,FR0000187635,FRTR 5 3/4 10/25/32,2032-10-25,1.246517570831692,MODERATE BUY,1.332931952127255,0.9773533400462265,1.525533531051527,1.0719144234661533,1.4800335684161159,51.190853468393975,"['Issue_Age', 'Cpn', 'AMT_OUTSTANDING']","[0.38833155176044976, 0.35883472179261927, 0.12233654062010509]"
2025-11-06,FR0000571218,FRTR 5 1/2 04/25/29,2029-04-25,-0.8449006496945302,WEAK BUY,1.17435678104852,0.930455152975869,1.1710468586722427,-1.7435635623164278,1.0979051457468334,18.308823030313185,"['YAS_RISK', 'Issue_Age', 'GREEN_BOND_LOAN_INDICATOR']","[0.41799465715899015, 0.15793617318100878, 0.0736526630649269]"
2025-11-06,FR0010070060,FRTR 4 3/4 04/25/35,2035-04-25,3.447414611132004,WEAK SELL,-0.5864931081789952,0.9834026470901718,-0.5510362187636032,-1.0064888089409794,-0.838316860800295,71.50899548999234,"['Issue_Age', 'Cpn', 'AMT_OUTSTANDING']","[0.34368296981886504, 0.1979060927264759, 0.16556795121254073]"
2025-11-06,FR0010171975,FRTR 4 04/25/55,2055-04-25,1.3287101011764548,NO ACTION,0.24902685246619377,0.9688006473715624,0.17363323776394696,0.47673637146574566,0.4118863455135837,136.76567224270963,"['Issue_Age', 'Cpn', 'AMT_OUTSTANDING']","[0.637965601915672, 0.1352997424574986, 0.0497476184876992]"
2025-11-06,FR0010371401,FRTR 4 10/25/38,2038-10-25,2.0578701435227345,WEAK BUY,0.6946010915387818,0.9873380649719946,0.8899701905129025,0.8170193474299572,0.9171311709836693,90.90100072718636,"['Issue_Age', 'Cpn', 'YAS_RISK']","[0.6373603046438824, 0.11403388308391645, 0.09819856063341692]"
2025-11-06,FR0010773192,FRTR 4 1/2 04/25/41,2041-04-25,-0.5913123934751496,NO ACTION,0.05380194891894522,0.9883043859779227,0.187423854482784,-0.2337235504400955,0.23354342779941203,100.20575968930554,"['YAS_RISK', 'Issue_Age', 'Cpn']","[0.44823025823506957, 0.17461083439635822, 0.14467725643825416]"
2025-11-06,FR0010870956,FRTR 4 04/25/60,2060-04-25,8.940840308702946,STRONG BUY,1.6211888365496634,0.9674944691191295,1.5005360197157431,0.8737873725338929,1.58759334698193,147.50670528885007,"['AMT_OUTSTANDING', 'Issue_Age', 'YAS_RISK']","[0.3340388506004582, 0.27921820884798365, 0.24076988643989192]"
2025-11-06,FR0010916924,FRTR 3 1/2 04/25/26,2026-04-25,3.5964157322128525,MODERATE BUY,1.2124910894180925,0.9188546377744173,1.339634725820554,0.9099518963844778,1.3241264540669866,-9.39844366913582,"['Issue_Age', 'YAS_RISK', 'GREEN_BOND_LOAN_INDICATOR']","[0.6266994505816045, 0.1977582303161515, 0.032394105945218514]"
2025-11-06,FR0011317783,FRTR 2 3/4 10/25/27,2027-10-25,-3.1447577152905053,WEAK SELL,-0.8426242133374008,0.9734544169536343,-0.7150379791810603,-0.6660705599834742,-0.9592080606859361,0.6526945550705399,"['Issue_Age', 'AMT_OUTSTANDING', 'GREEN_BOND_LOAN_INDICATOR']","[0.6164123130841871, 0.08352129622384664, 0.033813756235902534]"
2025-11-06,FR0011461037,FRTR 3 1/4 05/25/45,2045-05-25,-5.287788527669903,WEAK SELL,-1.0822080609979086,0.9958400187453229,-1.3554135021344547,1.2581270627691377,-1.1589600641374864,110.65420860459338,"['YAS_RISK', 'Issue_Age', 'AMT_OUTSTANDING']","[0.4342382949449676, 0.26750863793018714, 0.1823011050080861]"
2025-11-06,FR0011883966,FRTR 2 1/2 05/25/30,2030-05-25,-2.9254845239462703,MODERATE SELL,-1.3247902899188986,0.9904745307154452,-1.415258965319478,-0.11578391011281239,-1.3229618284544116,26.46163063012365,"['AMT_OUTSTANDING', 'Issue_Age', 'YAS_RISK']","[0.5397109799417169, 0.15549669854870357, 0.08152303371028354]"
2025-11-06,FR0012993103,FRTR 1 1/2 05/25/31,2031-05-25,-1.6787535701700094,WEAK SELL,-1.0442078792907472,0.982903686124277,-1.354702978556435,0.7352293622965699,-1.136556913816062,36.5764266719594,"['AMT_OUTSTANDING', 'REL_SPRD_LOG', 'Issue_Age']","[0.44012965812123933, 0.2171774321669401, 0.1858969744935481]"
2025-11-06,FR0013131877,FRTR 0 1/2 05/25/26,2026-05-25,2.7333666619204884,WEAK BUY,0.9493818006274846,0.872603473827353,1.1376522505053162,1.1275367916222045,1.1572003363507959,-9.30333166183306,"['Cpn', 'Issue_Age', 'YAS_RISK']","[0.4205022004763627, 0.2948712980925819, 0.15847402491688298]"
2025-11-06,FR0013154028,FRTR 1 3/4 05/25/66,2066-05-25,8.05743877938383,MODERATE BUY,1.4619469473325875,0.9661412894416095,1.1468244639670253,-0.38895059391569886,1.2479493741130863,146.31639979557266,"['AMT_OUTSTANDING', 'REL_SPRD_LOG', 'Issue_Age']","[0.4366831918816699, 0.19943438308593317, 0.11927586098309777]"
2025-11-06,FR0013154044,FRTR 1 1/4 05/25/36,2036-05-25,5.415242199427297,MODERATE BUY,1.5067010902491236,0.9597560978053675,1.2310861010149075,-2.609949027700026,1.29486642315548,80.45554665289912,"['Cpn', 'REL_SPRD_LOG', 'Issue_Age']","[0.34736020920683564, 0.1390998957639201, 0.09544930110946208]"
2025-11-06,FR0013200813,FRTR 0 1/4 11/25/26,2026-11-25,0.0158691778743564,NO ACTION,0.12092504778557116,0.8792593178195197,0.31354178958128137,-0.9042367289133878,0.28644197087376677,-6.244008700535239,"['Cpn', 'Issue_Age', 'YAS_RISK']","[0.3477691450754309, 0.26680993346650256, 0.10056492999991155]"
2025-11-06,FR0013234333,FRTR 1 3/4 06/25/39,2039-06-25,-1.833663662249464,NO ACTION,-0.2467049496224453,0.9773616379012321,-1.0037366275409751,0.5923808412212026,-0.61495283442158,90.40976613839824,"['GREEN_BOND_LOAN_INDICATOR', 'YAS_RISK', 'Cpn']","[0.39935564632255177, 0.293565283974527, 0.13912511801771793]"
2025-11-06,FR0013250560,FRTR 1 05/25/27,2027-05-25,-3.381441208331076,WEAK SELL,-0.9147795839483509,0.9484070974125594,-0.9898491212433174,1.180521454126924,-0.9562995930464965,-4.123508540478834,"['Issue_Age', 'Cpn', 'GREEN_BOND_LOAN_INDICATOR']","[0.6476959572364805, 0.18650015977970588, 0.043790082406023514]"
2025-11-06,FR0013257524,FRTR 2 05/25/48,2048-05-25,-4.469981493561463,NO ACTION,-0.7962448319115238,0.9709198643104086,-0.553975202654503,0.4912061977935424,-0.7710278728691783,119.65101244138474,"['Issue_Age', 'YAS_RISK', 'AMT_OUTSTANDING']","[0.4652107346689852, 0.1987524209530101, 0.16018005737533883]"
2025-11-06,FR0013286192,FRTR 0 3/4 05/25/28,2028-05-25,-3.254289766983054,WEAK SELL,-0.8760161735544949,0.9787033892807961,-1.057962495154388,0.47666949201565734,-0.9611131784250712,6.677030460492541,"['Issue_Age', 'AMT_OUTSTANDING', 'Cpn']","[0.4455350888071701, 0.253372914203372, 0.12409973584100797]"
2025-11-06,FR0013313582,FRTR 1 1/4 05/25/34,2034-05-25,4.458267724909035,NO ACTION,0.37218158803126494,0.989999118263438,0.3347283108167779,1.3747105734303158,0.6841646201688117,66.20696716061136,"['Issue_Age', 'Cpn', 'AMT_OUTSTANDING']","[0.4409350920291911, 0.2883014390244392, 0.16391794154757094]"
2025-11-06,FR0013341682,FRTR 0 3/4 11/25/28,2028-11-25,-1.94558164360987,NO ACTION,-0.14775463010634723,0.9867505200417988,-0.4534361163647148,-0.38966136752779335,-0.47244814136156754,13.114375675928557,"['Issue_Age', 'Cpn', 'AMT_OUTSTANDING']","[0.5024096708751339, 0.1619122694322079, 0.09101597652696693]"
2025-11-06,FR0013404969,FRTR 1 1/2 05/25/50,2050-05-25,-3.2374356136444646,NO ACTION,-0.5740662099025903,0.9923594549428368,-0.37111227089325005,0.1127734961945549,-0.6049347434010734,125.14153289430304,"['Issue_Age', 'YAS_RISK', 'GREEN_BOND_LOAN_INDICATOR']","[0.5257747586922232, 0.19695687521240743, 0.07185188687972754]"
2025-11-06,FR0013407236,FRTR 0 1/2 05/25/29,2029-05-25,-1.618524483639746,NO ACTION,0.24509852688171882,0.9810514917149217,0.24765687598309072,-0.8754054342371667,0.350178922821143,18.336371279989784,"['AMT_OUTSTANDING', 'Issue_Age', 'Cpn']","[0.29445128436872137, 0.23596248567438946, 0.1869822748400167]"
2025-11-06,FR0013451507,FRTR 0 11/25/29,2029-11-25,-3.113231404021537,MODERATE SELL,-1.5503073052289011,0.9780060042536247,-1.4155657823190773,0.7029073422454,-1.4189263014595876,21.668718574003822,"['Issue_Age', 'Cpn', 'YAS_RISK']","[0.38876626443986295, 0.3671377338085491, 0.08477536673761278]"
2025-11-06,FR0013480613,FRTR 0 3/4 05/25/52,2052-05-25,-5.562715530510914,WEAK SELL,-0.9932209822581851,0.9813728628087495,-0.6112046472113627,-0.9536548813070143,-1.0596187747026735,126.23516175755591,"['Issue_Age', 'YAS_RISK', 'GREEN_BOND_LOAN_INDICATOR']","[0.5224045839852665, 0.13143618554671474, 0.05744314613650129]"
2025-11-06,FR0013508470,FRTR 0 02/25/26,2026-02-25,7.280356870028331,STRONG BUY,2.335578021646341,0.8453130347712928,1.6510055356245517,-0.6816942807906706,1.8320432356554432,-7.612363693581452,"['YAS_RISK', 'Issue_Age', 'GREEN_BOND_LOAN_INDICATOR']","[0.5215915774930008, 0.1779194690462092, 0.03301593721337785]"
2025-11-06,FR0013515806,FRTR 0 1/2 05/25/40,2040-05-25,-1.2111494325180132,NO ACTION,-0.09612771339597827,0.9698935748702513,-0.1416131551928859,0.9218906923838246,-0.2834071601090056,95.4559734633191,"['Issue_Age', 'Cpn', 'GREEN_BOND_LOAN_INDICATOR']","[0.5668803634691412, 0.19398732269903377, 0.09691664993294526]"
2025-11-06,FR0013516549,FRTR 0 11/25/30,2030-11-25,-2.131191451293269,MODERATE SELL,-1.4118688777485435,0.9881195985187907,-1.03890754465295,0.027761439872673793,-1.2383027939275755,31.795256515175083,"['Issue_Age', 'AMT_ISSUED', 'REL_SPRD_LOG']","[0.3139678362738766, nan, 0.2920676520917782]"
2025-11-06,FR0014001NN8,FRTR 0 1/2 05/25/2072,2072-05-25,-8.990933236477048,STRONG SELL,-1.6111912325092153,0.9612310899600901,-1.6993715069485384,1.3410714059012512,-1.5306414683634084,125.78156080714058,"['REL_SPRD_LOG', 'AMT_OUTSTANDING', 'YAS_RISK']","[0.4628448783219908, 0.2741300934626395, 0.15355191753886158]"
2025-11-06,FR0014002JM6,FRTR 0 1/2 06/25/44,2044-06-25,-9.695447682917589,STRONG SELL,-2.1483573988400244,0.9766326611435553,-1.754598566876434,0.28058163749866144,-1.831214847273038,103.2830285271988,"['GREEN_BOND_LOAN_INDICATOR', 'Issue_Age', 'AMT_OUTSTANDING']","[0.3934782510368429, 0.2534968347928549, 0.16071606806042005]"
2025-11-06,FR0014002WK3,FRTR 0 11/25/31,2031-11-25,-0.6246021472156826,NO ACTION,-0.18758118895509118,0.9860320061150606,-0.41506784315165085,-1.9992875342070973,-0.7634908260320058,41.89545730042168,"['REL_SPRD_LOG', 'Issue_Age', 'GREEN_BOND_LOAN_INDICATOR']","[0.42844049978122983, 0.11556239389288725, 0.08560578817612965]"
2025-11-06,FR0014003513,FRTR 0 02/25/27,2027-02-25,-1.94258823242388,NO ACTION,-0.4761306169354476,0.9204610849722201,-0.5923434758675669,0.6426023969042394,-0.6054616861643592,-5.3776447411013,"['Issue_Age', 'Cpn', 'GREEN_BOND_LOAN_INDICATOR']","[0.4054720042236187, 0.3516992583500486, 0.07879763311181064]"
2025-11-06,FR0014004J31,FRTR 0 3/4 05/25/53,2053-05-25,-3.810873109479616,NO ACTION,-0.6774340071658348,0.9748988320699742,-0.7292484507414542,0.5921122011706802,-0.7604783678686006,129.40408847608026,"['Issue_Age', 'Cpn', 'YAS_RISK']","[0.568261937884689, 0.1759095833665531, 0.08785354336638469]"
2025-11-06,FR0014007L00,FRTR 0 05/25/32,2032-05-25,0.4010626828832215,WEAK BUY,0.6458966678967651,0.9949766448222243,0.7957935198990181,0.7758271735770498,0.8582686709262035,47.00829583751586,"['Issue_Age', 'YAS_RISK', 'AMT_OUTSTANDING']","[0.6564102180997305, 0.10627976644207059, 0.0836852089529073]"
2025-11-06,FR0014009O62,FRTR 1 1/4 05/25/38,2038-05-25,4.08853813680814,MODERATE BUY,1.1857904644377286,0.9743193578978568,1.481287290056664,-1.2860900500890455,1.2019870496831955,90.70541333245862,"['Cpn', 'Issue_Age', 'YAS_RISK']","[0.3364184038738666, 0.17969530074452658, 0.16920342427810836]"
2025-11-06,FR001400AIN5,FRTR 0 3/4 02/25/28,2028-02-25,-3.2814035121168548,WEAK SELL,-0.8842820745839549,0.9846630150330646,-0.8995803303085415,0.027761439872673793,-0.9203337490538076,4.084222661514682,"['Issue_Age', 'AMT_ISSUED', 'REL_SPRD_LOG']","[0.3720275522279603, nan, 0.347131724852518]"
2025-11-06,FR001400BKZ3,FRTR 2 11/25/32,2032-11-25,2.2376970716810405,MODERATE SELL,-1.7337672064899612,0.9889396998352431,-1.0031229935417765,0.027761439872673793,-1.396878086483297,52.84735440762182,"['Issue_Age', 'AMT_ISSUED', 'REL_SPRD_LOG']","[0.3796036809950039, nan, 0.20783627788650857]"
2025-11-06,FR001400CMX2,FRTR 2 1/2 05/25/43,2043-05-25,-2.2231334022221034,NO ACTION,-0.34091207652494204,0.9806440355313257,-0.46079972435510086,-0.795718120261475,-0.6458551869113911,106.92177903214402,"['YAS_RISK', 'Issue_Age', 'Cpn']","[0.3634634117666043, 0.18382184933725934, 0.17633522597056345]"
2025-11-06,FR001400FTH3,FRTR 3 05/25/54,2054-05-25,2.231801612730237,NO ACTION,0.41181805631046475,0.9885043966679984,0.6405764146279868,-0.6827450535173312,0.5534487905283405,136.6838284411595,"['YAS_RISK', 'REL_SPRD_LOG', 'AMT_OUTSTANDING']","[0.3408626721184877, 0.2250658959104239, 0.16651633899443316]"
2025-11-06,FR001400FYQ4,FRTR 2 1/2 09/24/26,2026-09-24,2.015947196559263,WEAK BUY,0.730669178375558,0.9103501430454681,0.9806911328155091,-1.5341903225019464,0.8061652705546718,-6.171401237798476,"['Issue_Age', 'YAS_RISK', 'AMT_OUTSTANDING']","[0.27627709051546584, 0.21798621146429958, 0.17167450885174465]"
2025-11-06,FR001400H7V7,FRTR 3 05/25/33,2033-05-25,3.3856984247571447,WEAK SELL,-0.645023616140832,0.9866708143260042,-0.5649883181138082,-1.2561526721160237,-0.9173142353319003,57.80830754811627,"['Issue_Age', 'YAS_RISK', 'AMT_OUTSTANDING']","[0.48760969915728525, 0.11179500265538012, 0.08825086050887312]"
2025-11-06,FR001400HI98,FRTR 2 3/4 02/25/29,2029-02-25,-1.1384852750345864,WEAK BUY,0.8217100237705708,0.9490622656157712,1.3037855816568327,-0.7371582825218662,0.9548524917378668,16.427888254388012,"['REL_SPRD_LOG', 'AMT_OUTSTANDING', 'Issue_Age']","[0.3568940930905991, 0.20943436958327702, 0.1618661818988608]"
2025-11-06,FR001400L834,FRTR 3 1/2 11/25/33,2033-11-25,4.309364365870934,NO ACTION,0.23096435226774525,0.9915310563829469,0.7773199068705059,1.5623610018861396,0.7721508533250445,62.48482883948442,"['Issue_Age', 'YAS_RISK', 'GREEN_BOND_LOAN_INDICATOR']","[0.4646285168161712, 0.3486534300739172, 0.09453005632448222]"
2025-11-06,FR001400NBC6,FRTR 2 1/2 09/24/27,2027-09-24,-3.092855956410727,WEAK SELL,-0.826801434151492,0.9701606060128718,-1.1014174712555478,-0.4641697557638748,-1.02763096740928,-0.2060650360494665,"['YAS_RISK', 'REL_SPRD_LOG', 'Issue_Age']","[0.3243806157222694, 0.29945211748655104, 0.12568527161937054]"
2025-11-06,FR001400NEF3,FRTR 3 06/25/49,2049-06-25,-5.184135678035844,WEAK SELL,-0.9249782082456502,0.9538903233869509,-1.0695892446128923,0.928068805949358,-0.9858471792050372,121.3566284584881,"['GREEN_BOND_LOAN_INDICATOR', 'AMT_OUTSTANDING', 'Cpn']","[0.7057884135743941, 0.1270586178578496, 0.025419882243917644]"
2025-11-06,FR001400OHF4,FRTR 3 1/4 05/25/55,2055-05-25,3.657697767176643,WEAK BUY,0.6688499833849151,0.9871188389381991,1.0972815926632877,-0.35892986789411313,0.8211382093369413,139.17608440422157,"['Issue_Age', 'YAS_RISK', 'AMT_OUTSTANDING']","[0.5184881701652254, 0.1558430357058546, 0.08340717388986399]"
2025-11-06,FR001400PM68,FRTR 2 3/4 02/25/30,2030-02-25,-1.1718052345897547,WEAK BUY,0.7816868935533381,0.9851227806075544,1.228647713281249,-1.742395201227342,0.9182651874922513,25.96842802751208,"['Issue_Age', 'AMT_OUTSTANDING', 'GREEN_BOND_LOAN_INDICATOR']","[0.47870465495082665, 0.11976103617454548, 0.051209063933319594]"
2025-11-06,FR001400QMF9,FRTR 3 11/25/34,2034-11-25,5.014726982054171,WEAK BUY,0.8999174202964744,0.9889031599188374,0.9958220553747016,1.2635403505343903,1.134036116457103,70.27834229527001,"['Issue_Age', 'YAS_RISK', 'GREEN_BOND_LOAN_INDICATOR']","[0.7293888356928393, 0.09120111547841733, 0.06388092310938052]"
2025-11-06,FR001400WYO4,FRTR 3.6 05/25/42,2042-05-25,1.1434483045634067,NO ACTION,0.47341560423671925,0.9849110382672348,0.29913753886324557,1.7927130585253617,0.7990993107435471,106.45040751570843,"['Issue_Age', 'AMT_OUTSTANDING', 'YAS_RISK']","[0.6050633405548789, 0.26790086382193856, 0.05284078904740162]"
2025-11-06,FR001400X8V5,FRTR 3.2 05/25/35,2035-05-25,5.607634974961499,MODERATE BUY,1.4622205702143012,0.9800189254244002,1.3464169963380146,0.027761439872673793,1.3135415372901142,74.21595920720019,"['Issue_Age', 'AMT_ISSUED', 'REL_SPRD_LOG']","[0.7360230709184626, nan, 0.1316286497854366]"
2025-11-06,FR001400XJJ3,FRTR 3 3/4 05/25/56,2056-05-25,6.4062555824581295,WEAK BUY,1.1643047959491741,0.9685411856202121,1.2302140948055196,0.4563279308472899,1.1963281561476389,142.83145753920547,"['Issue_Age', 'AMT_OUTSTANDING', 'YAS_RISK']","[0.44717143842892876, 0.2141983757526256, 0.1600490284548226]"
2025-11-06,FR001400XLW2,FRTR 2.4 09/24/28,2028-09-24,-2.1140780794219936,NO ACTION,-0.5284110413419058,0.9813615105531914,-0.4487692683181764,0.027761439872673793,-0.6016937069482633,11.23511393520424,"['Issue_Age', 'AMT_ISSUED', 'REL_SPRD_LOG']","[0.38196533155644674, nan, 0.21594837276318526]"
2025-11-06,FR001400Z2L7,FRTR 2.7 02/25/31,2031-02-25,0.4243609161436978,NO ACTION,0.664829325970362,0.9873067848494268,0.7231101875202298,0.027761439872673793,0.7148707482387833,36.56777616523856,"['Issue_Age', 'AMT_ISSUED', 'REL_SPRD_LOG']","[0.6180997827375502, nan, 0.10045390192156427]"
2025-11-06,DE0001030724,DBR 0 08/15/50,2050-08-15,-3.625192195226276,STRONG SELL,-1.8285868579421012,0.87070343787706,-1.670501591419078,0.0,-1.6981213024440165,22.08122229513188,,
2025-11-06,DE0001030732,DBR 0 08/15/31,2031-08-15,-4.599775509735684,MODERATE SELL,-1.1766283793159658,0.9405366103745351,-1.4361404784870995,0.0,-1.2790324429648092,-13.544319153217463,,
2025-11-06,DE0001030740,OBL 1.3 10/15/27,2027-10-15,-1.306446855736656,WEAK SELL,-0.8957243131552336,0.940780865809085,-1.3581421070479993,0.0,-1.100019245275173,-20.745091915542933,,
2025-11-06,DE0001030757,DBR 1.8 08/15/53,2053-08-15,-0.4994719002802625,NO ACTION,0.09293738881195844,0.8986917404473922,0.7722138294528849,0.0,0.4381780645076592,28.12627642031314,,
2025-11-06,DE0001102341,DBR 2 1/2 08/15/46,2046-08-15,-0.4341992308258255,NO ACTION,0.13306350540974243,0.9797790060615174,0.3199615412494273,0.0,0.336511831626775,20.31968714862738,,
2025-11-06,DE0001102432,DBR 1 1/4 08/15/48,2048-08-15,-0.65074981730179,NO ACTION,-6.0115163468263465e-05,0.9604002501791647,-0.5144339671903304,0.0,-0.3501519943372447,22.733674946419185,,
2025-11-06,DE0001102481,DBR 0 08/15/50,2050-08-15,-1.95621896600542,WEAK SELL,-0.8025921352803647,0.8801004027449625,-1.254198500479522,0.0,-1.0055270239557248,23.750195524352737,,
2025-11-06,DE0001102515,DBR 0 05/15/35,2035-05-15,-0.1694119972805797,NO ACTION,0.4483786250488147,0.9872227253773354,0.6689208870882789,0.0,0.6190752590981842,-0.0131082595631287,,
2025-11-06,DE0001102531,DBR 0 02/15/31,2031-02-15,-3.507245609591706,NO ACTION,-0.6391087297473629,0.9795056407947241,-0.35327257719389993,0.0,-0.657135891084881,-13.740575211647382,,
2025-11-06,DE0001102549,DBR 0 05/15/36,2036-05-15,0.5449391036408553,STRONG SELL,-1.808198444772374,0.973288842028138,-1.2924250224569747,0.0,-1.5897509462994803,2.9420932972335674,,
2025-11-06,DE0001102564,DBR 0 08/15/31,2031-08-15,-3.982523601589168,WEAK SELL,-0.8729433000163119,0.9458713820937694,-1.2531411711482305,0.0,-1.0561609930806841,-12.927067245070948,,
2025-11-06,DE0001102572,DBR 0 08/15/52,2052-08-15,-2.5332102715082208,MODERATE SELL,-1.1572952689812834,0.9559980799723853,-1.3679834031315563,0.0,-1.2502911939819912,25.195476406721458,,
2025-11-06,DE0001102580,DBR 0 02/15/32,2032-02-15,-2.806556366054396,NO ACTION,-0.29437286797092077,0.9549597826368942,-0.5760844005071581,0.0,-0.5305979533935589,-10.46151719983459,,
2025-11-06,DE0001102598,DBR 1 05/15/38,2038-05-15,2.734638442997261,WEAK BUY,0.7396343578484462,0.9869063964044026,0.7492372497536713,0.0,0.8045030180247836,9.3612067423395,,
2025-11-06,DE0001102606,DBR 1.7 08/15/32,2032-08-15,-2.366509986508772,NO ACTION,-0.07787208781275302,0.9829383645682408,-0.7296004861080982,0.0,-0.46328591876309644,-8.766260925532931,,
2025-11-06,DE0001102614,DBR 1.8 08/15/53,2053-08-15,0.7221395853725134,WEAK BUY,0.8439182406784883,0.9036225013861725,1.1499243998003101,0.0,0.9696943272386971,29.34788790596592,,
2025-11-06,DE0001135176,DBR 5 1/2 01/04/31,2031-01-04,0.6335125754781394,MODERATE BUY,1.398125114647881,0.9921214513547364,1.386928836060516,0.0,1.3647573478980854,-9.901744447462018,,
2025-11-06,DE0001135226,DBR 4 3/4 07/04/34,2034-07-04,-2.190532039643128,STRONG SELL,-2.6375733007019195,0.9754679972970323,-1.631746404775979,0.0,-2.1522755068864217,-4.027522043555163,,
2025-11-06,DE0001135275,DBR 4 01/04/37,2037-01-04,1.5768316708936485,NO ACTION,-0.6075360139201016,0.9724077610399988,-0.7008085950867828,0.0,-0.7450185299542891,5.3644610212412775,,
2025-11-06,DE0001135325,DBR 4 1/4 07/04/39,2039-07-04,2.1460379892231938,NO ACTION,0.054766112784333576,0.9873152322035852,0.1857620492009234,0.0,0.25348690979838023,11.035224526949085,,
2025-11-06,DE0001135366,DBR 4 3/4 07/04/40,2040-07-04,2.546035829841271,NO ACTION,0.52018508651603,0.9821621297896729,0.6572495979313333,0.0,0.6542177064725686,13.345874404970386,,
2025-11-06,DE0001135432,DBR 3 1/4 07/04/42,2042-07-04,2.693429129272776,NO ACTION,0.6916851077419933,0.9731947938601304,0.4291917944743609,0.0,0.6773082688648779,17.0680535710859,,
2025-11-06,DE0001135481,DBR 2 1/2 07/04/44,2044-07-04,1.1261022509459195,MODERATE SELL,-1.1319839052852285,0.9667781193054505,-1.3139172744411058,0.0,-1.2217098607231196,18.767392282946066,,
2025-11-06,DE0001141836,OBL 0 04/10/26,2026-04-10,0.3748593960141093,NO ACTION,-0.17788595767580354,0.8696416123929689,-0.3178520445956433,0.0,-0.37133656653183966,-23.543730495317657,,
2025-11-06,DE0001141844,OBL 0 10/09/26,2026-10-09,5.254591000076218,STRONG BUY,1.9055289503419206,0.8982511561798253,1.2611473121496006,0.0,1.589098880396818,-17.168521258852657,,
2025-11-06,DE0001141851,OBL 0 04/16/27,2027-04-16,3.483870577910757,WEAK BUY,1.1495149674417242,0.781340876011918,0.8396389075790726,0.0,1.0207523859459757,-17.4081357898999,,
2025-11-06,DE0001141869,OBL 1.3 10/15/27,2027-10-15,-0.5531581004268595,WEAK SELL,-0.5741055951199844,0.9379348419426513,-1.1720928112534827,0.0,-0.8648023414030261,-19.991803160233136,,
2025-11-06,DE000BU25000,OBL 2.2 04/13/28,2028-04-13,-1.7027926085474512,WEAK SELL,-1.0649452287990624,0.9634855418587582,-1.0190647238054464,0.0,-1.0936202750343411,-19.71649097009917,,
2025-11-06,DE000BU25018,OBL 2.4 10/19/28,2028-10-19,-0.0104217832489936,NO ACTION,-0.34238282303356077,0.9723585540573512,-0.3707185111602054,0.0,-0.49730714752761374,-16.557892092895294,,
2025-11-06,DE000BU25026,OBL 2.1 04/12/29,2029-04-12,0.3004426447374637,WEAK SELL,-0.8304664938097923,0.9669337205789079,-0.7079659013293698,0.0,-0.8693191070857934,-14.909136370323589,,
2025-11-06,DE000BU25034,OBL 2 1/2 10/11/29,2029-10-11,1.208032589300915,WEAK BUY,0.9558011835607391,0.9817929753705912,1.1021615805848655,0.0,1.0312171695934238,-12.630221265445426,,
2025-11-06,DE000BU25042,OBL 2.4 04/18/30,2030-04-18,0.9333432466903684,NO ACTION,0.4151730100529446,0.9837611113908411,0.5345993955015493,0.0,0.5588901381285619,-11.502471016483227,,
2025-11-06,DE000BU25059,OBL 2.2 10/10/30,2030-10-10,1.206315888905264,WEAK BUY,0.9524224700273324,0.990034983016797,0.7367729635982574,0.0,0.9187661402188585,-9.950552924660942,,
2025-11-06,DE000BU27006,DBR 2.4 11/15/30,2030-11-15,1.1714752335210346,STRONG BUY,1.662800250215433,0.982416357907887,1.4781438241407567,0.0,1.5371215210846954,-9.72463120827918,,
2025-11-06,DE000BU2D004,DBR 2 1/2 08/15/54,2054-08-15,1.2743303922828415,MODERATE BUY,1.1833753654981645,0.9673646321249609,1.2774545837591307,0.0,1.2080184359304889,30.72248770551445,,
2025-11-06,DE000BU2D012,DBR 2.9 08/15/56,2056-08-15,1.84670414527249,MODERATE BUY,1.5352398769688635,0.9687724878548154,1.323062077799251,0.0,1.4165857262771924,32.71867871883227,,
2025-11-06,DE000BU2F009,DBR 2.6 05/15/41,2041-05-15,3.423745727349271,MODERATE BUY,1.5414476990869042,0.9888536580040036,1.5621405062092975,0.0,1.497060546055156,15.804604960106571,,
2025-11-06,DE000BU2Z007,DBR 2.3 02/15/33,2033-02-15,-0.6386689736796303,NO ACTION,-0.2681075012764103,0.9623285797417321,-0.2551442819475243,0.0,-0.418984065808216,-5.789954561753989,,
2025-11-06,DE000BU2Z015,DBR 2.6 08/15/33,2033-08-15,0.0401967565893421,WEAK BUY,0.7684202475656955,0.9851572191260884,0.701047432154436,0.0,0.8052931211068167,-3.9030866234169928,,
2025-11-06,DE000BU2Z023,DBR 2.2 02/15/34,2034-02-15,0.2009079829748259,WEAK BUY,1.013802564379653,0.9889787382039714,1.1616973552391106,0.0,1.0828367015956597,-2.534751041882288,,
2025-11-06,DE000BU2Z031,DBR 2.6 08/15/34,2034-08-15,-0.0490368673549808,NO ACTION,0.6321736774061067,0.9877595162239347,0.9054576584519524,0.0,0.793244282436474,-1.6167883804620358,,
2025-11-06,DE000BU2Z049,DBR 2 1/2 02/15/35,2035-02-15,-0.1077255104070435,NO ACTION,0.5425647836985836,0.9494721503148844,0.3928969318521519,0.0,0.5794549499993037,-0.5085303038669271,,
2025-11-06,DE000BU2Z056,DBR 2.6 08/15/35,2035-08-15,0.034222091923317,NO ACTION,0.7592978166633317,0.9911470145377673,0.5415737024367973,0.0,0.7524308800704784,0.7613905491812204,,
2025-11-06,DE000BU35025,OBL 2.1 04/12/29,2029-04-12,-0.0361504530454244,MODERATE SELL,-1.4929301698312243,0.9782757864979769,-1.0374053210520753,0.0,-1.338322620630907,-15.245729468106475,,
2025-11-06,DE000BU3Z005,DBR 2.3 02/15/33,2033-02-15,-1.0486030877044603,WEAK SELL,-0.8940163746192848,0.9573941452179788,-0.5809643820361948,0.0,-0.8636937255995661,-6.199888675778819,,
2025-11-06,DE000BU3Z047,DBR 2 1/2 02/15/35,2035-02-15,-0.7020890127231356,NO ACTION,-0.3649405381645703,0.9493731355473654,-0.2412566678461413,0.0,-0.46581405438223494,-1.1028938061830191,,
2025-11-06,FI4000037635,RFGB 2 3/4 07/04/28,2028-07-04,-8.541700762040486,STRONG SELL,-2.9451441862042733,0.957335052333982,-2.035935453622689,0.0,-2.7095576036865956,-10.91232286175554,"['GREEN_BOND_LOAN_INDICATOR', 'Issue_Age', 'AMT_OUTSTANDING']","[nan, 0.876948673786145, 0.06666014196673688]"
2025-11-06,FI4000046545,RFGB 2 5/8 07/04/42,2042-07-04,-1.0098141058199277,STRONG SELL,-1.1279871802497357,0.9957500809315589,-1.983407086893323,0.0,-1.630778089278887,53.00395724987602,"['GREEN_BOND_LOAN_INDICATOR', 'Issue_Age', 'YAS_RISK']","[nan, 0.8821448739844238, 0.03045197134493218]"
2025-11-06,FI4000148630,RFGB 0 3/4 04/15/31,2031-04-15,-1.7503664668325314,NO ACTION,-1.691358291792277e-17,0.9838038671265008,0.031515294992763065,0.0,0.07972743628056327,12.64815432570014,"['GREEN_BOND_LOAN_INDICATOR', 'Issue_Age', 'AMT_OUTSTANDING']","[nan, 0.5228153180259446, 0.3632378938004906]"
2025-11-06,FI4000197959,RFGB 0 1/2 04/15/26,2026-04-15,7.667785759415933,STRONG BUY,3.0711689055595994,0.9558403985160099,2.059506532164646,0.0,2.5440816588642243,-11.088677479325076,"['GREEN_BOND_LOAN_INDICATOR', 'Issue_Age', 'AMT_OUTSTANDING']","[nan, 0.6001021583573538, 0.11270461311123474]"
2025-11-06,FI4000242870,RFGB 1 3/8 04/15/47,2047-04-15,-1.597987742021374,NO ACTION,-1.691358291792277e-17,0.9871457929986646,0.031515294992763065,0.0,0.08038285551268477,60.94584657907868,"['GREEN_BOND_LOAN_INDICATOR', 'YAS_RISK', 'Cpn']","[nan, 0.3844123572716785, 0.29590526675554324]"
2025-11-06,FI4000278551,RFGB 0 1/2 09/15/27,2027-09-15,-1.3679194475731098,WEAK SELL,-0.2825234805729865,0.9608479131402521,-1.0494476675334659,0.0,-0.8212149498078095,-9.322504396463694,"['REL_SPRD_LOG', 'Issue_Age', 'AMT_ISSUED']","[0.4652908455444183, 0.25238632776751774, nan]"
2025-11-06,FI4000306758,RFGB 1 1/8 04/15/34,2034-04-15,2.232207995270418,NO ACTION,-1.691358291792277e-17,0.9883619562455,0.031515294992763065,0.0,0.08062136971433558,30.96485622853974,"['GREEN_BOND_LOAN_INDICATOR', 'Issue_Age', 'AMT_OUTSTANDING']","[nan, 0.43390198841932487, 0.23627858455156753]"
2025-11-06,FI4000348727,RFGB 0 1/2 09/15/28,2028-09-15,-1.9298455997268704,WEAK SELL,-0.49108799378764767,0.9607599616544035,-1.366051226231332,0.0,-1.0473961195874,-2.9646531671058773,"['GREEN_BOND_LOAN_INDICATOR', 'AMT_OUTSTANDING', 'Issue_Age']","[nan, 0.33775325762023767, 0.2681332434442759]"
2025-11-06,FI4000369467,RFGB 0 1/2 09/15/29,2029-09-15,-1.7761165642771035,NO ACTION,-1.691358291792277e-17,0.9942300305175131,0.031515294992763065,0.0,0.08177221772249461,3.553815221688733,"['GREEN_BOND_LOAN_INDICATOR', 'REL_SPRD_LOG', 'Issue_Age']","[nan, 0.8909757660375995, 0.03824001810274637]"
2025-11-06,FI4000415153,RFGB 0 1/8 04/15/36,2036-04-15,4.692454641045572,STRONG BUY,3.5730237446181192,0.9840000407038347,2.2122013510199947,0.0,2.8947868781063084,41.21831465876929,"['GREEN_BOND_LOAN_INDICATOR', 'AMT_OUTSTANDING', 'Cpn']","[nan, 0.5036548070790505, 0.21078057531144906]"
2025-11-06,FI4000440557,RFGB 0 1/4 09/15/40,2040-09-15,-0.6471839824491568,MODERATE SELL,-0.8290310546568738,0.9997304458396926,-1.5459798531983748,0.0,-1.3126841562783196,49.1842488878404,"['REL_SPRD_LOG', 'Issue_Age', 'AMT_ISSUED']","[0.40715309276461065, 0.06357371270991176, nan]"
2025-11-06,FI4000441878,RFGB 0 09/15/30,2030-09-15,-0.55553202402265,NO ACTION,-1.691358291792277e-17,0.9636900445887149,0.031515294992763065,0.0,0.07578270901041337,10.644964416044822,"['GREEN_BOND_LOAN_INDICATOR', 'Cpn', 'YAS_RISK']","[nan, 0.5580376013594073, 0.27492968884858754]"
2025-11-06,FI4000480488,RFGB 0 1/8 04/15/52,2052-04-15,-7.016371794332635,NO ACTION,-1.691358291792277e-17,0.984271570095374,0.031515294992763065,0.0,0.07981916228899245,61.48766132124718,"['GREEN_BOND_LOAN_INDICATOR', 'REL_SPRD_LOG', 'AMT_OUTSTANDING']","[nan, 0.46614993359473816, 0.25958400453505676]"
2025-11-06,FI4000507231,RFGB 0 1/8 09/15/31,2031-09-15,-0.6335522288946667,NO ACTION,-1.691358291792277e-17,0.9864421326471048,0.031515294992763065,0.0,0.08024485349081614,15.981360113866945,"['GREEN_BOND_LOAN_INDICATOR', 'Cpn', 'YAS_RISK']","[nan, 0.5508327340252587, 0.29469400654658984]"
2025-11-06,FI4000511449,RFGB 0 09/15/26,2026-09-15,2.286597298927948,WEAK BUY,1.0738869718457815,0.9420675572018232,1.5402935589392244,0.0,1.1965448158336522,-13.149699662696497,"['GREEN_BOND_LOAN_INDICATOR', 'Cpn', 'AMT_OUTSTANDING']","[nan, 0.3042380706349089, 0.26853999288087266]"
2025-11-06,FI4000517677,RFGB 0 1/2 04/15/43,2043-04-15,-1.5791224347370445,STRONG SELL,-1.5973310138473342,0.9812674682733309,-1.7904096046404823,0.0,-1.8409966876836954,54.065724657915474,"['GREEN_BOND_LOAN_INDICATOR', 'REL_SPRD_LOG', 'AMT_OUTSTANDING']","[nan, 0.5022538864375894, 0.1760157392618025]"
2025-11-06,FI4000523238,RFGB 1 1/2 09/15/32,2032-09-15,0.9067995036435724,NO ACTION,-1.691358291792277e-17,0.9857961824176378,0.031515294992763065,0.0,0.08011816959069964,22.52822154295016,"['GREEN_BOND_LOAN_INDICATOR', 'Issue_Age', 'AMT_ISSUED']","[nan, 0.41317062815842365, nan]"
2025-11-06,FI4000527551,RFGB 1 3/8 04/15/27,2027-04-15,-1.7552907550632837,WEAK SELL,-0.4263002168404734,0.9664471729352291,-1.0685872168875046,0.0,-0.9131617403077029,-12.772734169834612,"['GREEN_BOND_LOAN_INDICATOR', 'Cpn', 'AMT_OUTSTANDING']","[nan, 0.3872269459189413, 0.2357613182111339]"
2025-11-06,FI4000546528,RFGB 2 3/4 04/15/38,2038-04-15,1.698941494890569,MODERATE BUY,1.105139709593324,0.9776849176787781,1.9489693110054176,0.0,1.3555006112380739,44.83858572220194,"['GREEN_BOND_LOAN_INDICATOR', 'AMT_OUTSTANDING', 'REL_SPRD_LOG']","[nan, 0.34405964530779126, 0.23491326798508075]"
2025-11-06,FI4000550249,RFGB 3 09/15/33,2033-09-15,1.532174588937302,NO ACTION,-1.691358291792277e-17,0.9864067884983401,0.031515294992763065,0.0,0.08023792178863917,27.757330143970616,"['GREEN_BOND_LOAN_INDICATOR', 'Issue_Age', 'Cpn']","[nan, 0.517944620027764, 0.2675775220427679]"
2025-11-06,FI4000557525,RFGB 2 7/8 04/15/29,2029-04-15,-0.1984470456336877,NO ACTION,-1.691358291792277e-17,0.9561216900181395,0.031515294992763065,0.0,0.07429840165865931,2.525980325872072,"['GREEN_BOND_LOAN_INDICATOR', 'Issue_Age', 'AMT_OUTSTANDING']","[nan, 0.4743533498099263, 0.3565595406125242]"
2025-11-06,FI4000566294,RFGB 2.95 04/15/55,2055-04-15,6.840334900337481,NO ACTION,-1.691358291792277e-17,0.9743602511903255,0.031515294992763065,0.0,0.0778753522601206,77.89057382686786,"['GREEN_BOND_LOAN_INDICATOR', 'Issue_Age', 'AMT_OUTSTANDING']","[nan, 0.530942239221864, 0.29825745724943964]"
2025-11-06,FI4000571104,RFGB 3 09/15/34,2034-09-15,2.3143868812108934,NO ACTION,-1.691358291792277e-17,0.9875736303288641,0.031515294992763065,0.0,0.08046676306334828,32.784664434785256,"['GREEN_BOND_LOAN_INDICATOR', 'Issue_Age', 'Cpn']","[nan, 0.5010742322776438, 0.24228613480570882]"
2025-11-06,FI4000577952,RFGB 2 1/2 04/15/30,2030-04-15,-1.5806153360386537,NO ACTION,-1.691358291792277e-17,0.984260751024248,0.031515294992763065,0.0,0.0798170404503997,7.216718723646889,"['GREEN_BOND_LOAN_INDICATOR', 'Issue_Age', 'Cpn']","[nan, 0.7156197587258675, 0.10542652273263584]"
2025-11-06,FI4000586284,RFGB 3.2 04/15/45,2045-04-15,-1.0047523384427564,MODERATE SELL,-1.1238142054575002,0.9909406474026199,-1.145566990280621,0.0,-1.3535173433056802,58.37546673911303,"['GREEN_BOND_LOAN_INDICATOR', 'Cpn', 'Issue_Age']","[nan, 0.25127142926207574, 0.22849250408578717]"
2025-11-06,FI4000587415,RFGB 3 09/15/35,2035-09-15,1.8915007803709472,NO ACTION,-1.691358291792277e-17,0.9943876028066784,0.031515294992763065,0.0,0.08180312083426873,36.27591756832287,"['GREEN_BOND_LOAN_INDICATOR', 'Issue_Age', 'Cpn']","[nan, 0.404897657543767, 0.31296567901510547]"
2025-11-06,FI4000591862,RFGB 2 5/8 04/15/32,2032-04-15,0.8814269483188824,NO ACTION,-1.691358291792277e-17,0.9900656923721877,0.031515294992763065,0.0,0.08095550681569753,20.459304717441,"['GREEN_BOND_LOAN_INDICATOR', 'Issue_Age', 'Cpn']","[nan, 0.48225121572663643, 0.2513056421040131]"
2025-11-06,EU000A18Z2D4,EU 0 3/4 04/04/31,2031-04-04,-1.323588970482298,NO ACTION,-0.3561796419010188,0.9738719553637117,-0.6454302923661925,-1.206010351671354,-0.7328398439795032,15.82132043554192,"['YAS_RISK', 'Issue_Age', 'Cpn']","[0.2767226329096265, 0.24671775774169075, 0.1635479474566213]"
2025-11-06,EU000A19XC51,EU 1 1/4 04/04/33,2033-04-04,3.7019541354068863,MODERATE BUY,1.3095929364905021,0.9708837830696689,1.5324561443583824,-1.629361629968945,1.2527778887174192,32.137993980239585,"['AMT_OUTSTANDING', 'Issue_Age', 'YAS_RISK']","[0.2526557860210729, 0.24276154333201092, 0.15430638446143896]"
2025-11-06,EU000A1G1Q17,EU 3 3/8 04/04/32,2032-04-04,7.928747100941873,STRONG BUY,2.1558211542477848,0.9710838098893503,1.657772846418539,0.1614755553631407,1.743239200384081,30.87483945789438,"['Issue_Age', 'Cpn', 'AMT_OUTSTANDING']","[0.3487148200288856, 0.32283698533216526, 0.13580666309608702]"
2025-11-06,EU000A1G30R0,EU 3 3/8 04/04/38,2038-04-04,3.1846311801215776,NO ACTION,0.3449533963135342,0.9605661971468569,0.7498493915750432,-0.4688454206804351,0.5432595094191149,55.065464902920304,"['REL_SPRD_LOG', 'YAS_RISK', 'Issue_Age']","[0.40168779134491334, 0.18424512408823498, 0.16594284738299758]"
2025-11-06,EU000A1G6TV9,EU 2 7/8 04/04/28,2028-04-04,-0.1456519137965806,NO ACTION,-0.13316046306759255,0.9665223878302951,-0.6228635668134304,-0.3768573241131602,-0.4726788818358878,-2.256690326803568,"['YAS_RISK', 'REL_SPRD_LOG', 'Issue_Age']","[0.31474271603507636, 0.23950759217676312, 0.20572251733630154]"
2025-11-06,EU000A1GVVF8,EU 3 09/04/26,2026-09-04,1.7302502737633976,NO ACTION,0.6141534669188768,0.9776981911449024,1.0156082725799802,0.04325594866676553,0.7642654997061955,-11.786331430779263,"['YAS_RISK', 'REL_SPRD_LOG', 'Issue_Age']","[0.3581782067149631, 0.2651196886339562, 0.17365453572628112]"
2025-11-06,EU000A1GY6W8,EU 3 3/4 04/04/42,2042-04-04,12.77927834235402,STRONG BUY,2.4040470774486047,0.9129717316126109,1.3825681354715975,-0.3724928816131931,1.7544361106360014,79.22332489488542,"['REL_SPRD_LOG', 'YAS_RISK', 'Issue_Age']","[0.34542280154506144, 0.27282555675359305, 0.1421086383110824]"
2025-11-06,EU000A1HBXS7,EU 2 1/2 11/04/27,2027-11-04,2.9242903113922534,WEAK BUY,1.0898300554953173,0.849376752267073,1.058554907750378,0.2135698544777913,1.0239929562295398,-2.0990482374315445,"['YAS_RISK', 'REL_SPRD_LOG', 'Issue_Age']","[0.3333840326205676, 0.28460444976840404, 0.19395547944884686]"
2025-11-06,EU000A1Z6TV6,EU 1 1/2 10/04/35,2035-10-04,5.093265160803817,STRONG BUY,1.7682423598276258,0.8875691423835568,1.3937148222520335,0.659767425462035,1.5429466245565244,46.04852533131504,"['REL_SPRD_LOG', 'Issue_Age', 'AMT_OUTSTANDING']","[0.5005356061572125, 0.21836971680692213, 0.1323142610242196]"
2025-11-06,EU000A1ZR7H3,EU 1 3/8 10/04/29,2029-10-04,2.085696537260373,MODERATE BUY,1.427840164566491,0.9389104059189424,1.4039807081697098,0.6419696521657616,1.3793224890304985,9.979912310110576,"['YAS_RISK', 'Issue_Age', 'AMT_OUTSTANDING']","[0.408405815396335, 0.29080421933547973, 0.15044293692029712]"
2025-11-06,EU000A283859,EU 0 10/04/30,2030-10-04,-2.04920469465446,WEAK SELL,-0.7881829343277491,0.9508333493677279,-1.0380244976084576,0.8367382549347905,-0.8544401415303636,12.096630390723366,"['YAS_RISK', 'Cpn', 'REL_SPRD_LOG']","[0.3944055114530534, 0.32973457215551993, 0.14265699313642405]"
2025-11-06,EU000A283867,EU 0.1 10/04/40,2040-10-04,-5.239664127178948,MODERATE SELL,-1.4629727256140437,0.9450499705942028,-1.5511365588310186,-0.13252645089763218,-1.3612676567145212,56.14342909604243,"['REL_SPRD_LOG', 'YAS_RISK', 'GREEN_BOND_LOAN_INDICATOR']","[0.6180581974965779, 0.1364438867837218, 0.026977463133125677]"
2025-11-06,EU000A284469,EU 0.3 11/04/50,2050-11-04,-16.5918839258822,STRONG SELL,-1.797078560754,0.8784142866216029,-1.6840159993334867,1.202778744320256,-1.5340070054705022,71.29619394294811,"['REL_SPRD_LOG', 'YAS_RISK', 'GREEN_BOND_LOAN_INDICATOR']","[0.7353064308095314, 0.14760781884502622, 0.016102787233182116]"
2025-11-06,EU000A285VM2,EU 0 07/04/35,2035-07-04,-4.339018923726513,STRONG SELL,-1.341135469538427,0.9795059940150739,-0.884977754593157,-2.858142755441169,-1.5777851907931364,35.42973422131824,"['REL_SPRD_LOG', 'Issue_Age', 'GREEN_BOND_LOAN_INDICATOR']","[0.3856378168207368, 0.09593140255172539, 0.059993566798952916]"
2025-11-06,EU000A287074,EU 0 06/02/28,2028-06-02,-6.104546296005192,STRONG SELL,-2.5070394470965676,0.9739602131625771,-1.583088369438698,-0.41576886254379214,-1.9509238248251908,-7.101493985040064,"['YAS_RISK', 'REL_SPRD_LOG', 'GREEN_BOND_LOAN_INDICATOR']","[0.4183135379074609, 0.30416035338239794, 0.03407382623421474]"
2025-11-06,EU000A28X702,EU 0 1/8 06/10/35,2035-06-10,-0.3571315376791091,NO ACTION,-0.02849557804976316,0.9141324999006588,-0.8326460343678421,-2.2489511171306065,-0.7854690229913899,39.09941760555114,"['REL_SPRD_LOG', 'GREEN_BOND_LOAN_INDICATOR', 'Issue_Age']","[0.516448057954482, 0.043088554431558464, 0.03564901299261986]"
2025-11-06,EU000A3K4C42,EU 0.4 02/04/37,2037-02-04,-7.212802903584368,STRONG SELL,-1.8864252526117797,0.9363715301186389,-1.5553887009270977,0.32560186061955126,-1.552824600487155,39.78175944081007,"['GREEN_BOND_LOAN_INDICATOR', 'Cpn', 'REL_SPRD_LOG']","[0.5351946901293881, 0.15299162090561658, 0.13361903739056294]"
2025-11-06,EU000A3K4D09,EU 2 3/4 12/04/37,2037-12-04,0.6137733967957999,NO ACTION,-0.20677476286051524,0.9421390063680943,-0.14215890285169996,-1.112333359400168,-0.49472370352104517,51.13233824154162,"['YAS_RISK', 'REL_SPRD_LOG', 'Issue_Age']","[0.3241538571344043, 0.31566216650359485, 0.055418038767644444]"
2025-11-06,EU000A3K4D41,EU 3 1/4 07/04/34,2034-07-04,-1.5131258182603062,NO ACTION,-0.40957220325534455,0.9616375053758939,-0.40515389149418585,0.0028007002121228316,-0.4869488129569986,33.38555174926904,"['REL_SPRD_LOG', 'Issue_Age', 'AMT_ISSUED']","[0.45200979848886436, 0.059170250146537144, nan]"
2025-11-06,EU000A3K4D74,EU 3 3/8 10/04/38,2038-10-04,3.396373634495667,NO ACTION,0.3903951454948843,0.9296405217213004,1.0490483329212874,0.28222177265563386,0.6926771901753823,57.28983622503555,"['YAS_RISK', 'Cpn', 'REL_SPRD_LOG']","[0.4082603246603811, 0.26649406665278713, 0.14323251421955815]"
2025-11-06,EU000A3K4D82,EU 2 3/4 10/05/26,2026-10-05,2.5624592377154176,WEAK BUY,0.9456853322502443,0.9616966073671909,1.2116016507656786,0.6876473123237977,1.092952578436522,-10.319258162923392,"['YAS_RISK', 'REL_SPRD_LOG', 'Issue_Age']","[0.42146505059096334, 0.3907733064570632, 0.04143529655699307]"
2025-11-06,EU000A3K4DA4,EU 0 1/4 10/22/26,2026-10-22,2.7706509124602743,WEAK BUY,1.0286238456097363,0.9385714222780152,0.7619072516617814,-0.3535736081793068,0.8887164247989722,-9.764051453879144,"['YAS_RISK', 'REL_SPRD_LOG', 'GREEN_BOND_LOAN_INDICATOR']","[0.4352303044841443, 0.30001643013478885, 0.026775592066700084]"
2025-11-06,EU000A3K4DD8,EU 1 07/06/32,2032-07-06,-3.0899879221974054,NO ACTION,-0.8357553445961505,0.9526480334349999,-0.5193542792174503,0.05921302564587277,-0.7330701604864455,21.28242670340729,"['REL_SPRD_LOG', 'YAS_RISK', 'AMT_OUTSTANDING']","[0.5045058140738039, 0.1711978627715192, 0.12265334306409252]"
2025-11-06,EU000A3K4DE6,EU 1 1/8 06/04/37,2037-06-04,-2.0402614455612564,NO ACTION,-0.7763534332384446,0.9890000802479986,-0.6293025248446357,0.0022251872452378834,-0.7400486103628101,46.369438192017206,"['REL_SPRD_LOG', 'YAS_RISK', 'AMT_OUTSTANDING']","[0.35743165577242253, 0.23999878756953266, 0.1959103394703782]"
2025-11-06,EU000A3K4DG1,EU 1 1/4 02/04/43,2043-02-04,-0.0731951170334213,NO ACTION,-0.35420410570623717,0.9229502196593379,-0.2851827394976713,1.3136639715348248,-0.41871370829490223,69.01140716322958,"['GREEN_BOND_LOAN_INDICATOR', 'YAS_RISK', 'REL_SPRD_LOG']","[0.5226964882905891, 0.3083507059763818, 0.07773028635547825]"
2025-11-06,EU000A3K4DM9,EU 2 5/8 02/04/48,2048-02-04,0.8148357824004364,NO ACTION,0.4102348759392859,0.9616440716788811,0.2627361420256507,1.8741465432927165,0.7555484313475417,83.0964257936843,"['YAS_RISK', 'GREEN_BOND_LOAN_INDICATOR', 'Cpn']","[0.45370322011868786, 0.4116142077983422, 0.09279537665567185]"
2025-11-06,EU000A3K4DS6,EU 2 10/04/27,2027-10-04,0.5072309139701483,NO ACTION,0.12693221930923487,0.9562371349985647,0.47904868494189795,1.2314582776224923,0.5637819869677323,-5.117579011590812,"['REL_SPRD_LOG', 'YAS_RISK', 'AMT_OUTSTANDING']","[0.43221964035236804, 0.40143615520786824, 0.06788569817505576]"
2025-11-06,EU000A3K4DT4,EU 2 1/2 10/04/52,2052-10-04,4.233629688904173,WEAK BUY,0.8437657107880857,0.9929657588695359,0.7591433592993302,0.8454607983396951,0.9461501889840142,95.43112426730175,"['YAS_RISK', 'REL_SPRD_LOG', 'Issue_Age']","[0.5149609575790468, 0.3245578030219569, 0.02804610006134456]"
2025-11-06,EU000A3K4DV0,EU 3 3/8 11/04/42,2042-11-04,4.312748635736824,WEAK BUY,0.587057090712969,0.9476728654349467,1.1014256118119174,0.9288214788360116,0.9189083669111273,72.61740829524601,"['YAS_RISK', 'Cpn', 'REL_SPRD_LOG']","[0.5746231232342675, 0.24101609953466402, 0.05926329009569752]"
2025-11-06,EU000A3K4DW8,EU 2 3/4 02/04/33,2033-02-04,-3.1953338814192698,WEAK SELL,-0.9641166178522191,0.9548330284420372,-0.8488649192200289,0.3258336015468414,-0.8909454157551745,24.37276693803315,"['GREEN_BOND_LOAN_INDICATOR', 'REL_SPRD_LOG', 'Issue_Age']","[0.4975125469937182, 0.2868347422666075, 0.037478457683048735]"
2025-11-06,EU000A3K4DY4,EU 3 03/04/53,2053-03-04,4.945883519887261,WEAK BUY,0.9340852814948601,0.9946517709575237,0.7623932107584762,-0.062143023546003005,0.8504931246865931,96.79743648900374,"['YAS_RISK', 'REL_SPRD_LOG', 'Issue_Age']","[0.5937903775432395, 0.16244666194615406, 0.03143786414756408]"
2025-11-06,EU000A3K4EL9,EU 4 04/04/44,2044-04-04,6.2748101559664775,MODERATE BUY,1.00813234340242,0.9445251568083564,1.4906788482644062,1.100696745360912,1.2696919549807133,78.81115176595672,"['YAS_RISK', 'Cpn', 'REL_SPRD_LOG']","[0.5449525421892968, 0.24853436497690165, 0.09654457202194519]"
2025-11-06,EU000A3K4EN5,EU 3 1/8 12/05/28,2028-12-05,0.6380747186146651,NO ACTION,0.6520142841750022,0.9798108187506139,0.9377029548911044,-0.282766210521603,0.754588002243807,3.094419912632042,"['REL_SPRD_LOG', 'YAS_RISK', 'Issue_Age']","[0.3970454549077069, 0.3120718637667827, 0.059137683347614496]"
2025-11-06,EU000A3K4ES4,EU 3 12/04/34,2034-12-04,-1.6856204664443697,NO ACTION,-0.4664355281871583,0.9449566078456908,-0.32486433698715134,-1.4985137737499175,-0.7429684970622598,35.28650376847951,"['REL_SPRD_LOG', 'YAS_RISK', 'Issue_Age']","[0.4615732543416158, 0.10809447011696822, 0.09157360239163956]"
2025-11-06,EU000A3K4EU0,EU 3 1/4 02/04/50,2050-02-04,3.070704292366827,WEAK BUY,0.6962973252066643,0.9602283104206035,0.4324573565462895,1.3191606424945819,0.8541144435039083,89.53860034010224,"['YAS_RISK', 'GREEN_BOND_LOAN_INDICATOR', 'Cpn']","[0.45434918547096537, 0.3350274328511919, 0.11988469544000399]"
2025-11-06,EU000A3K4EW6,EU 2 7/8 12/06/27,2027-12-06,1.087112343420208,NO ACTION,0.35794291530515293,0.9753645323377732,0.5656860801495075,0.08703493515334014,0.5152507153582165,-3.318035409733617,"['REL_SPRD_LOG', 'YAS_RISK', 'Issue_Age']","[0.38521061599335965, 0.35102824017571393, 0.06456713001981168]"
2025-11-06,EU000A3K4EY2,EU 3 3/8 10/05/54,2054-10-05,7.645945202099782,MODERATE BUY,1.2764750327477905,0.9883732002050245,1.4240113346865961,1.5097179515061658,1.4630266986532954,101.82367732343612,"['YAS_RISK', 'Cpn', 'Issue_Age']","[0.6901509749803848, 0.16867595566921076, 0.06720779774647503]"
2025-11-06,EU000A3K7MW2,EU 1 5/8 12/04/29,2029-12-04,-0.8800339348931079,NO ACTION,-0.1615876990691163,0.9888229233500899,-0.5360287507227885,1.4554031673610948,-0.4028832754121443,8.081395452637247,"['REL_SPRD_LOG', 'YAS_RISK', 'AMT_OUTSTANDING']","[0.5048557385212493, 0.337439511478457, 0.07895853139442503]"
2025-11-06,EU000A3KM903,EU 0.2 06/04/36,2036-06-04,-1.875946166880084,WEAK SELL,-0.7410899632717568,0.9676596989722683,-0.6477082256319491,-2.24697853089319,-1.1026022388096712,42.1482916742645,"['REL_SPRD_LOG', 'YAS_RISK', 'GREEN_BOND_LOAN_INDICATOR']","[0.43493507944838866, 0.09929476667484813, 0.06112941209602648]"
2025-11-06,EU000A3KNYF7,EU 0 03/04/26,2026-03-04,-3.245327103679447,MODERATE SELL,-1.367995873567298,0.7396780394573114,-1.390132235607342,0.1783975201128947,-1.2110267194954714,-20.58571233700235,"['YAS_RISK', 'REL_SPRD_LOG', 'GREEN_BOND_LOAN_INDICATOR']","[0.44736876974906126, 0.3364962128715662, 0.024983006929352732]"
2025-11-06,EU000A3KNYG5,EU 0.45 05/02/46,2046-05-02,-6.111923126054577,NO ACTION,-0.4681344129102644,0.918798828947827,-0.5207514116204476,0.6164286638660705,-0.5418261418737447,71.99369104346859,"['REL_SPRD_LOG', 'YAS_RISK', 'GREEN_BOND_LOAN_INDICATOR']","[0.6433465822176202, 0.18232453394508866, 0.02173366260122316]"
2025-11-06,EU000A3KP2Z3,EU 0 1/4 04/22/36,2036-04-22,0.5956140414763524,NO ACTION,-0.210671916467054,0.96202311365012,-0.10908331183291402,0.0028007002121228316,-0.3032267463709775,44.08712152530575,"['REL_SPRD_LOG', 'Issue_Age', 'AMT_ISSUED']","[0.5439275173459175, 0.011597860895132785, nan]"
2025-11-06,EU000A3KRJQ6,EU 0 07/04/29,2029-07-04,-3.4731803359605835,MODERATE SELL,-1.5513360875496935,0.9506753623534305,-1.1726047949493579,-0.7857981232083726,-1.4106810977755764,2.794149288680925,"['YAS_RISK', 'REL_SPRD_LOG', 'GREEN_BOND_LOAN_INDICATOR']","[0.3643479879186047, 0.3224787986706064, 0.0371498674159682]"
2025-11-06,EU000A3KRJR4,EU 0 3/4 01/04/47,2047-01-04,-9.955970342616157,WEAK SELL,-0.9555908213892483,0.9064521732202316,-1.3857586037370893,1.0188530567215937,-1.029333752050434,69.81095365269992,"['REL_SPRD_LOG', 'YAS_RISK', 'GREEN_BOND_LOAN_INDICATOR']","[0.6458197294818188, 0.2153817064820253, 0.02162592110567544]"
2025-11-06,EU000A3KSXE1,EU 0 07/04/31,2031-07-04,-3.881191564146549,MODERATE SELL,-1.0505664110283877,0.975637050202033,-1.1586638433629273,-1.4620139028345567,-1.2717023782496635,14.734477062206867,"['REL_SPRD_LOG', 'YAS_RISK', 'GREEN_BOND_LOAN_INDICATOR']","[0.4071121541004352, 0.2192005207234017, 0.038141477984745986]"
2025-11-06,EU000A3KT6A3,EU 0 04/22/31,2031-04-22,1.5425211028890151,NO ACTION,0.4219666263041559,0.901017076499277,0.5396113373674802,0.27306136741649706,0.5591329911903945,18.97986043354045,"['YAS_RISK', 'Cpn', 'GREEN_BOND_LOAN_INDICATOR']","[0.384200674073783, 0.37067525700288034, 0.06230464865262021]"
2025-11-06,EU000A3KT6B1,EU 0.45 07/04/41,2041-07-04,-2.024017706696249,WEAK SELL,-0.7728673873746004,0.9234477436410635,-0.9265880022476444,0.4868854084252377,-0.810765645297175,61.94080845464382,"['YAS_RISK', 'Cpn', 'REL_SPRD_LOG']","[0.4248863688111805, 0.2950544324173678, 0.11606119929609073]"
2025-11-06,EU000A3KTGV8,EU 0 07/06/26,2026-07-06,1.3485707113690903,NO ACTION,0.4621015872100443,0.9575481700930581,0.431272831248096,0.023282865738657024,0.5164115319970405,-13.40441528291879,"['YAS_RISK', 'REL_SPRD_LOG', 'GREEN_BOND_LOAN_INDICATOR']","[0.4108281666327143, 0.36022274336575616, 0.024143431590641095]"
2025-11-06,EU000A3KTGW6,EU 0.7 07/06/51,2051-07-06,-9.833451453298297,WEAK SELL,-0.9400544311231739,0.958083710949807,-0.6079506970336105,0.7012189474578853,-0.8116313343650687,79.26129949763629,"['REL_SPRD_LOG', 'YAS_RISK', 'GREEN_BOND_LOAN_INDICATOR']","[0.49314316981230105, 0.33093876632341473, 0.030786332698417528]"
2025-11-06,EU000A3KWCF4,EU 0 10/04/28,2028-10-04,-1.5413753162934216,NO ACTION,-0.6891828122129433,0.9774156565164948,-0.7738753561113215,-0.3336374216319112,-0.7908773480921578,-0.2262554710822964,"['REL_SPRD_LOG', 'YAS_RISK', 'GREEN_BOND_LOAN_INDICATOR']","[0.39917328272877317, 0.3354217686364475, 0.029182117078584625]"
2025-11-06,EU000A3L1CN4,EU 2 7/8 10/05/29,2029-10-05,0.2074934092186779,NO ACTION,0.42125227220506584,0.9795856028856302,0.6881174000730391,-0.09590249494072467,0.5677097971337305,8.119278045687125,"['REL_SPRD_LOG', 'YAS_RISK', 'Issue_Age']","[0.4286443624580353, 0.27287213295661766, 0.08318680028733524]"
2025-11-06,EU000A3L1DJ0,EU 2 1/2 12/04/31,2031-12-04,-0.2300899031944894,NO ACTION,-0.05929564348048406,0.9721067029646916,-0.29399074812526355,-0.2874345906230604,-0.3287794412112911,20.815846854498872,"['REL_SPRD_LOG', 'YAS_RISK', 'Issue_Age']","[0.4949489765089544, 0.15506977119748216, 0.1178253297727224]"
2025-11-06,EU000A3LNF05,EU 3 1/8 12/04/30,2030-12-04,-1.0282329041443994,NO ACTION,-0.27599073954589953,0.9905938868836839,-0.46752370431060164,-1.0586647984596818,-0.6202730729820554,14.13140590729348,"['REL_SPRD_LOG', 'YAS_RISK', 'Issue_Age']","[0.4228987862555028, 0.2088467408710062, 0.06821259981451945]"
2025-11-06,EU000A3LZ0X9,EU 3 3/8 10/04/39,2039-10-04,5.114953548539596,WEAK BUY,0.7592171544441048,0.9431859334612827,1.2137125355919463,-1.2902679608947887,0.8801863929662667,62.85571364081168,"['YAS_RISK', 'REL_SPRD_LOG', 'Issue_Age']","[0.36183055069748055, 0.23501764075497347, 0.08272354414940765]"
2025-11-06,EU000A4D5QM6,EU 2 5/8 07/04/28,2028-07-04,0.3696144896176268,NO ACTION,0.07210917384579422,0.9876732051004786,0.16753371773879633,0.5798653858375401,0.34397332119422575,-0.0268680365681266,"['REL_SPRD_LOG', 'YAS_RISK', 'Issue_Age']","[0.4154397901114585, 0.33881716304647774, 0.08992941836709965]"
2025-11-06,EU000A4D8KD2,EU 3 3/8 12/12/35,2035-12-12,0.3939893290856204,NO ACTION,-0.25394231132624684,0.9547425984115248,-0.12970620099889713,-1.1131181234761103,-0.5173375763723954,42.2285102142339,"['REL_SPRD_LOG', 'YAS_RISK', 'Issue_Age']","[0.3630947169961455, 0.20355130335757599, 0.12851896481051975]"
2025-11-06,EU000A4EA8Y7,EU 3 3/4 10/12/45,2045-10-12,7.036043938229568,WEAK BUY,1.1714996506541617,0.9499038974237798,1.0708405611636922,0.8602853055807743,1.194727174917954,83.72818615613146,"['YAS_RISK', 'Cpn', 'REL_SPRD_LOG']","[0.5551486946948871, 0.21082513953914964, 0.10289592314409635]"
2025-11-06,EU000A4ED0K0,EU 2 3/4 12/13/32,2032-12-13,0.1294887237812432,NO ACTION,0.13192010056478448,0.9434950402999516,0.19178611390821834,0.0028007002121228316,0.2763036773042018,26.911573675209468,"['REL_SPRD_LOG', 'Issue_Age', 'AMT_ISSUED']","[0.5001267164518113, 0.14534376557898593, nan]"
2025-11-06,AT0000383864,RAGB 6 1/4 07/15/27,2027-07-15,-5.526380703348371,STRONG SELL,-1.867512428596385,0.9953877140540778,-1.3956428393116542,-1.499509577606136,-1.9453923065739136,-15.45605944659334,"['Issue_Age', 'YAS_RISK', 'GREEN_BOND_LOAN_INDICATOR']","[0.3894807528928226, 0.18139614611582294, 0.10288753891217299]"
2025-11-06,AT0000A04967,RAGB 4.15 03/15/37,2037-03-15,2.908887929263188,STRONG BUY,2.102202633853542,0.9971392246177437,1.5236141258835287,1.1491477014985605,1.8589604277505998,40.42982567381735,"['Issue_Age', 'YAS_RISK', 'Cpn']","[0.4549562149906286, 0.3483388895393878, 0.11282300001173828]"
2025-11-06,AT0000A0DXC2,RAGB 4.85 03/15/26,2026-03-15,5.402063783870307,STRONG BUY,1.940572573612736,0.9836326831525303,1.6341309729188493,0.17813752565851862,1.630651887782526,-14.135162122361669,"['YAS_RISK', 'Issue_Age', 'Cpn']","[0.35562856458751174, 0.25576072246072484, 0.21588082711832693]"
2025-11-06,AT0000A0U299,RAGB 3.8 01/26/62,2062-01-26,5.982160288036042,STRONG BUY,1.8878183259936188,0.9921578094815768,1.8261569913034306,1.0116875645148011,1.8089795268262092,78.75812046592173,"['YAS_RISK', 'Issue_Age', 'Cpn']","[0.5847578901340066, 0.19484492987050642, 0.12393760282845866]"
2025-11-06,AT0000A0VRQ6,RAGB 3.15 06/20/44,2044-06-20,-1.446071132926427,STRONG SELL,-1.7780350839397001,0.9994089166552999,-1.6801757738562229,0.8458772759342104,-1.7162867374415154,54.592525708046736,"['YAS_RISK', 'Issue_Age', 'Cpn']","[0.6030187022456721, 0.18372000621892082, 0.10162997745926636]"
2025-11-06,AT0000A10683,RAGB 2.4 05/23/34,2034-05-23,0.2427692721280756,NO ACTION,-2.0838702658374664e-17,0.9987326433056559,0.028729930016670895,-1.5757723616444193,0.09219095440980557,27.288011484324432,"['YAS_RISK', 'GREEN_BOND_LOAN_INDICATOR', 'REL_SPRD_LOG']","[0.29173758461161464, 0.23753292668942913, 0.13751583795416744]"
2025-11-06,AT0000A1K9C8,RAGB 0 3/4 10/20/26,2026-10-20,1.829884283099496,NO ACTION,0.6958242292354806,0.9948090555210043,1.0250297167258107,-1.1876068166111966,0.7572938329012328,-13.272005585717288,"['GREEN_BOND_LOAN_INDICATOR', 'AMT_OUTSTANDING', 'Issue_Age']","[0.23873455443918207, 0.23504154502311111, 0.22852762074040228]"
2025-11-06,AT0000A1K9F1,RAGB 1 1/2 02/20/47,2047-02-20,-3.352877834718754,WEAK SELL,-0.7527822271188785,0.9987995438421247,-0.8079677072049095,0.9021041181373243,-0.9115568297081315,57.18689445158672,"['YAS_RISK', 'Issue_Age', 'AMT_OUTSTANDING']","[0.6480663282254753, 0.20084340786771585, 0.04460373827798585]"
2025-11-06,AT0000A1PEF7,RAGB 1 1/2 11/02/2086,2086-11-02,1.296728740565328,NO ACTION,-2.0838702658374664e-17,0.9978471800417041,0.028729930016670895,-0.5568970144013373,0.09203365833652989,75.13707017158657,"['YAS_RISK', 'REL_SPRD_LOG', 'Issue_Age']","[0.3861209722959787, 0.2005779571550103, 0.17331510093233993]"
2025-11-06,AT0000A1VGK0,RAGB 0 1/2 04/20/27,2027-04-20,-3.028748392330028,WEAK SELL,-0.9971967898295284,0.9883822830264568,-1.1064351140573483,0.409969334722043,-1.128329245145479,-14.588283180054582,"['Issue_Age', 'Cpn', 'YAS_RISK']","[0.5774209742176893, 0.17358203711572084, 0.0974798468937597]"
2025-11-06,AT0000A1ZGE4,RAGB 0 3/4 02/20/28,2028-02-20,-3.649274483462275,MODERATE SELL,-1.2134229969428845,0.9945248034249131,-1.3197973567068828,-0.6858837906116404,-1.4296660749528893,-9.5342424151671,"['REL_SPRD_LOG', 'Issue_Age', 'YAS_RISK']","[0.37752267189170974, 0.2464985896404401, 0.12419040453368313]"
2025-11-06,AT0000A269M8,RAGB 0 1/2 02/20/29,2029-02-20,-0.9255671787064246,NO ACTION,0.2781244825777596,0.9956730953272293,1.0154703690565405,-0.2911409554070832,0.5320131604247404,-0.4626437163883279,"['Issue_Age', 'GREEN_BOND_LOAN_INDICATOR', 'AMT_OUTSTANDING']","[0.5263041615889791, 0.18084639856051923, 0.07718030270290656]"
2025-11-06,AT0000A2CQD2,RAGB 0 02/20/30,2030-02-20,-0.1486778384740956,WEAK BUY,0.868953202477854,0.9980232373799947,1.0155602688778815,0.4235239602316798,0.9225624006725008,6.197996106783198,"['Cpn', 'Issue_Age', 'GREEN_BOND_LOAN_INDICATOR']","[0.4528369682643998, 0.29245796909885763, 0.10442817690528473]"
2025-11-06,AT0000A2EJ08,RAGB 0 3/4 03/20/51,2051-03-20,-4.206832883063605,WEAK SELL,-0.9943403378989532,0.997417941237085,-1.0720334490908223,1.6300733402281582,-1.1182267400346602,61.50344052015554,"['YAS_RISK', 'Issue_Age', 'Cpn']","[0.6285850333479511, 0.24361356813641072, 0.08792447600637751]"
2025-11-06,AT0000A2KQ43,RAGB 0 10/20/40,2040-10-20,-0.4375776294430338,WEAK SELL,-0.8794745063350483,0.9962917250700484,-1.4163497648272199,0.7443365504841971,-1.1587535768759158,47.57962199860295,"['YAS_RISK', 'Cpn', 'Issue_Age']","[0.6056738579610237, 0.16402906596186667, 0.10937472713651163]"
2025-11-06,AT0000A2NW83,RAGB 0 02/20/31,2031-02-20,1.0443320127841569,NO ACTION,-2.0838702658374664e-17,0.9959553144566595,0.028729930016670895,-0.09034052036869207,0.09169758225092825,12.858078824973193,"['Issue_Age', 'GREEN_BOND_LOAN_INDICATOR', 'YAS_RISK']","[0.31629201570947674, 0.24510379878393268, 0.24130840382274302]"
2025-11-06,AT0000A2QQB6,RAGB 0.7 04/20/2071,2071-04-20,-5.508875367554907,MODERATE SELL,-1.36264886106855,0.9975327715490526,-1.553147326301254,0.39873046211927504,-1.4569730220319916,68.98373802216153,"['YAS_RISK', 'AMT_OUTSTANDING', 'Cpn']","[0.5426860342550396, 0.16327367258024172, 0.14149478807533017]"
2025-11-06,AT0000A2T198,RAGB 0 1/4 10/20/36,2036-10-20,0.8401221282374678,NO ACTION,0.25894693941660546,0.9980380099319479,1.1784587451479476,0.152018410362435,0.597474133267572,37.0050396227603,"['YAS_RISK', 'Issue_Age', 'GREEN_BOND_LOAN_INDICATOR']","[0.4192309668481963, 0.294730308587588, 0.1109189246370085]"
2025-11-06,AT0000A2VB47,RAGB 0 10/20/28,2028-10-20,-0.5999492366336034,NO ACTION,-0.1508664956140113,0.995908500039766,-0.954504415990896,-0.048627254350002064,-0.6422890408168008,-2.218750794443224,"['Issue_Age', 'AMT_ISSUED', 'REL_SPRD_LOG']","[0.6219280494583247, nan, 0.15139560046302664]"
2025-11-06,AT0000A2WSC8,RAGB 0.9 02/20/32,2032-02-20,1.6924238945727232,NO ACTION,-2.0838702658374664e-17,0.9987738558398966,0.028729930016670895,-1.055230393346371,0.09219827551511814,18.5841423654321,"['Issue_Age', 'AMT_OUTSTANDING', 'YAS_RISK']","[0.3047681688680554, 0.2230044105952134, 0.18664365971479197]"
2025-11-06,AT0000A2Y8G4,RAGB 1.85 05/23/49,2049-05-23,-2.7986552878470974,WEAK SELL,-0.5960093950669794,0.9983516873473672,-0.8545957478738245,0.6455105407174236,-0.8417338473406343,60.824581602749205,"['YAS_RISK', 'GREEN_BOND_LOAN_INDICATOR', 'Issue_Age']","[0.48865668239265536, 0.2785537318908894, 0.1028245999600477]"
2025-11-06,AT0000A308C5,RAGB 2 07/15/26,2026-07-15,4.403457371814804,MODERATE BUY,1.5926019081345932,0.9870263882905991,1.5302667126627698,0.38376871716553207,1.4515890897720716,-12.639246814278804,"['Issue_Age', 'AMT_OUTSTANDING', 'YAS_RISK']","[0.3213439499527541, 0.2836974414564436, 0.24104409522042833]"
2025-11-06,AT0000A324S8,RAGB 2.9 02/20/33,2033-02-20,1.0198087607014052,NO ACTION,-2.0838702658374664e-17,0.9981988769389216,0.028729930016670895,-0.6065831947400839,0.09209613471829264,22.638632582702297,"['Issue_Age', 'YAS_RISK', 'Cpn']","[0.4050701587311547, 0.20125641961306276, 0.14914113791969677]"
2025-11-06,AT0000A33SH3,RAGB 2.9 05/23/29,2029-05-23,-4.176638929030091,STRONG SELL,-2.1943338986540737,0.9937809787337959,-1.6485909699583847,-0.7606332971177716,-2.06291388883613,-2.1898261002864103,"['GREEN_BOND_LOAN_INDICATOR', 'Issue_Age', 'Cpn']","[0.3479453012850032, 0.2728504109531131, 0.12057633092792429]"
2025-11-06,AT0000A33SK7,RAGB 3.15 10/20/53,2053-10-20,5.735206297527213,STRONG BUY,1.817962495159742,0.9981017684187944,1.7796488170629696,1.280800607709034,1.806843530890272,73.87276614636309,"['YAS_RISK', 'AMT_OUTSTANDING', 'REL_SPRD_LOG']","[0.7886983359933373, 0.0756991274258721, 0.06376695787070365]"
2025-11-06,AT0000A38239,RAGB 3.45 10/20/30,2030-10-20,0.8113528545560289,STRONG BUY,1.5990619529186354,0.9950031616288908,1.0877198588076682,1.4403427810056222,1.5131161462727742,10.827573674333424,"['Issue_Age', 'Cpn', 'GREEN_BOND_LOAN_INDICATOR']","[0.6706936217574268, 0.20404650769772492, 0.06802249258505651]"
2025-11-06,AT0000A39UW5,RAGB 2.9 02/20/34,2034-02-20,1.5436145634989806,NO ACTION,-2.0838702658374664e-17,0.9983839526611525,0.028729930016670895,-2.4390447557975534,0.09212901206685215,27.53702574871137,"['AMT_OUTSTANDING', 'Cpn', 'REL_SPRD_LOG']","[0.27707554492436015, 0.1834486995811667, 0.12727218345402852]"
2025-11-06,AT0000A3D3Q8,RAGB 3.2 07/15/39,2039-07-15,0.8821124476808109,NO ACTION,0.2963600170046015,0.9981555373474047,0.8058839189033321,0.23440877069414134,0.5217608797192925,45.53440282787748,"['YAS_RISK', 'Cpn', 'GREEN_BOND_LOAN_INDICATOR']","[0.3965473823200147, 0.35449418636594526, 0.08137739681267095]"
2025-11-06,AT0000A3EPP2,RAGB 2 1/2 10/20/29,2029-10-20,-2.016854587074425,MODERATE SELL,-0.5518057393201754,0.9985580761240522,-0.9023924862201741,-2.117889526897454,-1.208591963225636,2.395051537912879,"['YAS_RISK', 'Cpn', 'AMT_OUTSTANDING']","[0.2719717325750171, 0.19045985247087963, 0.1547507313381264]"
2025-11-06,AT0000A3HU25,RAGB 2.95 02/20/35,2035-02-20,2.188056631068548,NO ACTION,-2.0838702658374664e-17,0.9967953646564297,0.028729930016670895,-0.3740958327833236,0.09184681102546667,32.239500067348395,"['Cpn', 'Issue_Age', 'YAS_RISK']","[0.4446613274398539, 0.20316042887612973, 0.12891868747585572]"
2025-11-06,NL0000102234,NETHER 4 01/15/37,2037-01-15,0.3032149478442214,MODERATE SELL,-0.14001428875623265,0.940101318169311,-1.948030893696238,-1.2061874472859173,-1.3294885419673588,19.52948583002989,"['Issue_Age', 'REL_SPRD_LOG', 'Cpn']","[0.32239763708754154, 0.19658437089740896, 0.18318277466925184]"
2025-11-06,NL0000102317,NETHER 5 1/2 01/15/28,2028-01-15,-0.2090206562022754,WEAK SELL,-0.32776105792432075,0.655973029076615,-1.754790577388093,1.268278157299721,-1.0827821020309503,-12.584038311118524,"['REL_SPRD_LOG', 'Cpn', 'Issue_Age']","[0.5703283715190898, 0.22886693708588107, 0.1398912746350854]"
2025-11-06,NL0009446418,NETHER 3 3/4 01/15/42,2042-01-15,0.856274044663504,WEAK BUY,0.7805043210138239,0.938994313010061,1.7342761140331564,0.6889196942992284,1.1734243369801352,29.32885034106152,"['Issue_Age', 'REL_SPRD_LOG', 'YAS_RISK']","[0.41217835379555634, 0.32094307036786446, 0.15049352512692263]"
2025-11-06,NL0010071189,NETHER 2 1/2 01/15/33,2033-01-15,-1.4443790613027243,NO ACTION,0.0,0.9061816978317346,0.003071370230597575,0.06405570486655855,0.011225865993503344,6.900139167789325,"['Issue_Age', 'Cpn', 'REL_SPRD_LOG']","[0.3685955482152892, 0.34472325509162005, 0.1104675101667568]"
2025-11-06,NL0010721999,NETHER 2 3/4 01/15/47,2047-01-15,-0.276114224957972,NO ACTION,0.0,0.9057105807827135,0.003071370230597575,-1.4126115211792982,-0.0015182212113054522,34.40207599306603,"['Cpn', 'Issue_Age', 'YAS_RISK']","[0.32370171696766764, 0.19135377711012355, 0.1673448743204786]"
2025-11-06,NL0011819040,NETHER 0 1/2 07/15/26,2026-07-15,-1.4976620265986114,STRONG SELL,-2.3213646893359043,0.4852817734865343,-2.189410409569778,-0.8691405659756856,-2.5450029291856393,-22.333780171669567,"['Issue_Age', 'Cpn', 'YAS_RISK']","[0.3152778826681105, 0.24648440774920677, 0.17267360316034383]"
2025-11-06,NL0012171458,NETHER 0 3/4 07/15/27,2027-07-15,1.8047402699819308,STRONG BUY,2.787644971606487,0.7011058776789776,1.7962809654003482,-1.8363620676446628,2.2000237093442045,-13.266785468953454,"['REL_SPRD_LOG', 'YAS_RISK', 'Issue_Age']","[0.21643108011377335, 0.21615683317369944, 0.20923975841145226]"
2025-11-06,NL0012818504,NETHER 0 3/4 07/15/28,2028-07-15,-1.2793726771505811,STRONG SELL,-1.9836582880396152,0.8244684101913593,-1.7839865625200462,0.09007497838355023,-2.106792597897919,-11.115451926813355,"['YAS_RISK', 'REL_SPRD_LOG', 'Cpn']","[0.32603549450352315, 0.27429659590064764, 0.22594548143257692]"
2025-11-06,NL0013332430,NETHER 0 1/4 07/15/29,2029-07-15,-0.2197346347303703,NO ACTION,0.0,0.8691460772210023,0.003071370230597575,1.0054638676736747,0.18984000196418566,-5.321310446053107,"['Cpn', 'Issue_Age', 'YAS_RISK']","[0.4711103540988967, 0.3796955381083586, 0.06311710233611276]"
2025-11-06,NL0013552060,NETHER 0 1/2 01/15/40,2040-01-15,-1.7830785671533391,STRONG SELL,-3.6124678060073414,0.9423670222223318,-2.3299221908570042,1.5051016485778281,-3.2748546790517667,23.44029984560748,"['Issue_Age', 'REL_SPRD_LOG', 'Cpn']","[0.6878738695913219, 0.1393707917183975, 0.1345169786660853]"
2025-11-06,NL0014555419,NETHER 0 07/15/30,2030-07-15,0.011336927942753,NO ACTION,0.0,0.8751130913968076,0.003071370230597575,0.8680997090301055,0.1638889847305949,-0.7912310253251025,"['Cpn', 'Issue_Age', 'REL_SPRD_LOG']","[0.4676353071806788, 0.36196193035007057, 0.07117359852575815]"
2025-11-06,NL00150006U0,NETHER 0 07/15/31,2031-07-15,-0.1023023932881193,NO ACTION,0.0,0.9205413631685929,0.003071370230597575,0.24319099275224396,0.0494412388315559,3.003533748095053,"['Cpn', 'Issue_Age', 'REL_SPRD_LOG']","[0.47094794533491885, 0.21581734568051023, 0.1541726267786572]"
2025-11-06,NL0015000B11,NETHER 0 01/15/38,2038-01-15,1.953413171918697,STRONG BUY,2.6065966680226107,0.9500171374335731,2.331377950427451,-0.06732683896061288,2.3180490234804103,23.35032845229041,"['Cpn', 'REL_SPRD_LOG', 'Issue_Age']","[0.519521191454247, 0.1878946877386982, 0.10379099539444239]"
2025-11-06,NL0015000LS8,NETHER 0 01/15/29,2029-01-15,-0.0490107864770088,NO ACTION,0.0,0.945217527970489,0.003071370230597575,0.8427638523806011,0.17273080693184317,-7.440942950127212,"['Cpn', 'Issue_Age', 'REL_SPRD_LOG']","[0.4639694144887288, 0.2563881248161777, 0.1779874732664568]"
2025-11-06,NL0015000RP1,NETHER 0 1/2 07/15/32,2032-07-15,-0.3608356693415215,NO ACTION,0.0,0.9654285570411149,0.003071370230597575,0.27210184478757504,0.06401639850429791,6.3120849793513045,"['Cpn', 'Issue_Age', 'REL_SPRD_LOG']","[0.47290006743753593, 0.20918383133159524, 0.16162213635420317]"
2025-11-06,NL00150012X2,NETHER 2 01/15/54,2054-01-15,3.18175490552089,NO ACTION,0.0,0.9347667143053239,0.003071370230597575,-1.481804579368046,0.004220383115607916,43.54116900344778,"['Cpn', 'GREEN_BOND_LOAN_INDICATOR', 'AMT_OUTSTANDING']","[0.307341578834365, 0.1880866740111736, 0.18034711179283253]"
2025-11-06,NL0015001AM2,NETHER 2 1/2 07/15/33,2033-07-15,-0.0956033946180667,NO ACTION,0.0,0.8738979766627653,0.003071370230597575,0.3102192812979111,0.053467269581948,9.819299032010198,"['Issue_Age', 'Cpn', 'YAS_RISK']","[0.37649311758948817, 0.37295232432047515, 0.09791021019532056]"
2025-11-06,NL0015001DQ7,NETHER 2 1/2 01/15/30,2030-01-15,0.8718636243925264,NO ACTION,0.0,0.9142285604758378,0.003071370230597575,0.3123506246876295,0.06185352644525024,-2.011043037664213,"['Issue_Age', 'Cpn', 'YAS_RISK']","[0.37663930033589044, 0.37312772975345226, 0.0977926910127472]"
2025-11-06,NL0015001RG8,NETHER 3 1/4 01/15/44,2044-01-15,0.6068628235557405,WEAK BUY,0.36538110572713883,0.9047093286715626,1.916091914420103,1.187606528617887,1.0790306028948398,31.846787328515564,"['Issue_Age', 'REL_SPRD_LOG', 'Cpn']","[0.5195366279251615, 0.30116194733604545, 0.11066396950845228]"
2025-11-06,NL0015001XZ6,NETHER 2 1/2 07/15/34,2034-07-15,0.0941122015363262,NO ACTION,0.0,0.8884253507064432,0.003071370230597575,0.19189832347954647,0.03296797264377257,12.967865508032052,"['Issue_Age', 'Cpn', 'REL_SPRD_LOG']","[0.4068787642978986, 0.2691136089509187, 0.1600344431185925]"
2025-11-06,NL0015002F72,NETHER 2 1/2 07/15/35,2035-07-15,0.3499805369422581,NO ACTION,0.0,0.9112697797874905,0.003071370230597575,0.35348457474450673,0.0693931459871423,15.927791440123997,"['Issue_Age', 'Cpn', 'REL_SPRD_LOG']","[0.41117328831789235, 0.2483765269325288, 0.19194834391062737]"
2025-11-06,NL0015031501,NETHER 0 01/15/27,2027-01-15,1.1955158054779955,STRONG BUY,1.8451390636933536,0.86764791732164,1.9392338825681728,-0.05899472631735717,1.7215348497691194,-16.66297815392474,"['GREEN_BOND_LOAN_INDICATOR', 'REL_SPRD_LOG', 'Issue_Age']","[0.3567231911167391, 0.3194393846169695, 0.13584207075500024]"
2025-11-06,NL0015614579,NETHER 0 01/15/52,2052-01-15,-3.9120030900922487,NO ACTION,0.0,0.9114694980864515,0.003071370230597575,-1.927669198648671,-0.0003808314849039648,35.084307876012694,"['Cpn', 'GREEN_BOND_LOAN_INDICATOR', 'AMT_OUTSTANDING']","[0.2953177867112763, 0.17276942989832708, 0.16499810286437713]"
2025-11-06,BE0000291972,BGB 5 1/2 03/28/28,2028-03-28,-0.3286726932362245,NO ACTION,0.6328816541009389,0.6915913019928207,0.6423323121644845,9.906615682976882e-16,0.5708760401645344,-2.943942973564436,"['REL_SPRD_LOG', 'Issue_Age', 'AMT_ISSUED']","[0.347136880887835, 0.0910400294490443, nan]"
2025-11-06,BE0000304130,BGB 5 03/28/35,2035-03-28,1.6239444763210784,NO ACTION,0.28234389442099905,0.9418353528239596,0.5157186388394533,-1.0557700753838002,0.39633458206972666,52.16560905767259,"['AMT_OUTSTANDING', 'REL_SPRD_LOG', 'Issue_Age']","[0.3463358249045723, 0.2208808628925656, 0.1387735000970798]"
2025-11-06,BE0000320292,BGB 4 1/4 03/28/41,2041-03-28,-1.1195098815569082,NO ACTION,-0.3442883194382194,0.8925518827292577,-0.5091073287796222,0.19306370622762242,-0.5385017977035128,81.78869369985297,"['AMT_OUTSTANDING', 'Cpn', 'GREEN_BOND_LOAN_INDICATOR']","[0.40380422343770345, 0.2773116754256037, 0.12586107222401893]"
2025-11-06,BE0000324336,BGB 4 1/2 03/28/26,2026-03-28,-2.5383267220199563,MODERATE SELL,-1.7965714560437573,0.0,-1.4027154894982112,-0.5055133992973498,-1.479687975522957,-23.87760883433072,"['REL_SPRD_LOG', 'GREEN_BOND_LOAN_INDICATOR', 'AMT_OUTSTANDING']","[0.30066951377422113, 0.2931751238184828, 0.1566419856692375]"
2025-11-06,BE0000326356,BGB 4 03/28/32,2032-03-28,0.9079578165882792,NO ACTION,0.0,0.9629894656313805,0.01598959164465137,1.6285661690520044,0.3911291322385453,30.889366465448845,"['REL_SPRD_LOG', 'GREEN_BOND_LOAN_INDICATOR', 'Issue_Age']","[0.4754377686583783, 0.32785293261542775, 0.11976799191376812]"
2025-11-06,BE0000331406,BGB 3 3/4 06/22/45,2045-06-22,-4.532113448628664,STRONG SELL,-2.2499761209418323,0.8824670537093474,-1.5644469659772078,-0.7398159292991,-1.9532045549735184,95.0187721610258,"['Cpn', 'REL_SPRD_LOG', 'GREEN_BOND_LOAN_INDICATOR']","[0.2821457781848937, 0.22470142526027823, 0.2246925758513924]"
2025-11-06,BE0000333428,BGB 3 06/22/34,2034-06-22,0.3462524860171072,NO ACTION,-0.2573067642095558,0.919280132103124,-0.47755547221841127,0.23786910676065592,-0.48905554988864913,45.945577670518304,"['Issue_Age', 'Cpn', 'YAS_RISK']","[0.346152701645618, 0.2549399595004763, 0.20950749289490825]"
2025-11-06,BE0000335449,BGB 1 06/22/31,2031-06-22,0.5663817073749478,NO ACTION,0.0,0.8995119568660381,0.01598959164465137,-0.33969057890166143,0.09941232125749372,24.774526654783788,"['AMT_OUTSTANDING', 'Issue_Age', 'YAS_RISK']","[0.44174858524414334, 0.254481101227915, 0.06766617784209207]"
2025-11-06,BE0000336454,BGB 1.9 06/22/38,2038-06-22,1.842059184830049,MODERATE BUY,1.3095299258397848,0.8917536301765727,1.33633774081773,1.1395889994574122,1.3512452356118478,71.20635402395334,"['AMT_OUTSTANDING', 'REL_SPRD_LOG', 'Issue_Age']","[0.651566303850168, 0.13400531895071005, 0.09794599443300789]"
2025-11-06,BE0000337460,BGB 1 06/22/26,2026-06-22,0.2431116231857544,MODERATE BUY,1.2615425972930077,0.6857186809218231,1.5280863626661196,0.3995786426937465,1.2184198876480246,-18.80510334296754,"['GREEN_BOND_LOAN_INDICATOR', 'REL_SPRD_LOG', 'Issue_Age']","[0.4429382526393559, 0.24146327784210553, 0.13927524439250832]"
2025-11-06,BE0000338476,BGB 1.6 06/22/47,2047-06-22,-5.685568286058938,MODERATE SELL,-1.200009336055062,0.9173880165549367,-1.5634539175589726,0.8963683414130981,-1.2883331762547083,100.14346082963122,"['AMT_OUTSTANDING', 'GREEN_BOND_LOAN_INDICATOR', 'Cpn']","[0.4101152224626083, 0.2592286664346694, 0.19450572109363246]"
2025-11-06,BE0000340498,BGB 2.15 06/22/66,2066-06-22,9.23220283343565,STRONG BUY,2.096141003650405,0.8896550587656201,1.7596697676550934,1.5497620933667382,1.9500873449254712,135.47346719189673,"['AMT_OUTSTANDING', 'Cpn', 'GREEN_BOND_LOAN_INDICATOR']","[0.4737013577196382, 0.37670466187628315, 0.06628019214284654]"
2025-11-06,BE0000341504,BGB 0.8 06/22/27,2027-06-22,0.1830076132936291,WEAK BUY,1.195459911106625,0.6505179023133527,1.2100400374439557,-1.2832750822813759,1.0178948095820972,-9.4052567897709,"['AMT_OUTSTANDING', 'Issue_Age', 'GREEN_BOND_LOAN_INDICATOR']","[0.4026701458921203, 0.20988905957415116, 0.07503381929446144]"
2025-11-06,BE0000343526,BGB 2 1/4 06/22/57,2057-06-22,4.706395153202863,MODERATE BUY,1.096142920615979,0.8493950960826341,0.9371774152515091,1.8529815900985418,1.241872501245017,129.06351353821,"['AMT_OUTSTANDING', 'Issue_Age', 'YAS_RISK']","[0.7734064066619722, 0.09527648087265497, 0.07252312982380146]"
2025-11-06,BE0000344532,BGB 1.45 06/22/37,2037-06-22,1.888828713387,WEAK BUY,1.3356472636146888,0.9001669847037925,1.3139941514074303,-1.1495156216422677,1.163312919844423,65.79551717222824,"['GREEN_BOND_LOAN_INDICATOR', 'Cpn', 'REL_SPRD_LOG']","[0.3044996667863996, 0.2561266561577869, 0.13778314340428013]"
2025-11-06,BE0000345547,BGB 0.8 06/22/28,2028-06-22,-1.6634921478178253,WEAK SELL,-0.8347151882879614,0.7266579634175001,-0.7397202546325934,-1.8448340482849444,-1.1478803493362781,-2.1856144283436176,"['AMT_OUTSTANDING', 'REL_SPRD_LOG', 'GREEN_BOND_LOAN_INDICATOR']","[0.3025505811683789, 0.24692535523134804, 0.09270669477221853]"
2025-11-06,BE0000346552,BGB 1 1/4 04/22/33,2033-04-22,-4.191330383278064,STRONG SELL,-2.173816848477439,0.9551097634661634,-1.7461071186676138,1.7646710421575829,-1.8509883617360234,33.47480532997799,"['Issue_Age', 'AMT_OUTSTANDING', 'YAS_RISK']","[0.7078729385977487, 0.15246855445486948, 0.07372330320025178]"
2025-11-06,BE0000347568,BGB 0.9 06/22/29,2029-06-22,-0.2029470414576168,NO ACTION,0.0,0.810811720462709,0.01598959164465137,1.0281784612367773,0.2613830761070841,7.909473181655943,"['AMT_OUTSTANDING', 'Issue_Age', 'YAS_RISK']","[0.4872896247473904, 0.2520299483103622, 0.13518884532646963]"
2025-11-06,BE0000348574,BGB 1.7 06/22/50,2050-06-22,-3.832976530163109,WEAK SELL,-0.790670642183315,0.9611160407577028,-0.7206266418637919,-0.26259562774199574,-0.887249370336834,109.69508446245553,"['AMT_OUTSTANDING', 'Cpn', 'Issue_Age']","[0.4961793086752226, 0.18141602466759763, 0.09253480428510812]"
2025-11-06,BE0000349580,BGB 0.1 06/22/30,2030-06-22,-0.1452203642910525,NO ACTION,0.0,0.8769078115355909,0.01598959164465137,-0.008942208336872348,0.09551525330517215,16.20690893461831,"['AMT_OUTSTANDING', 'Issue_Age', 'YAS_RISK']","[0.4403496604122391, 0.18179138706124306, 0.16850074130357082]"
2025-11-06,BE0000350596,BGB 0.4 06/22/40,2040-06-22,-1.9529631072580715,WEAK SELL,-0.8097105737744928,0.8917437557418522,-1.3173133255299545,0.49878858026426426,-1.0113171355248995,77.436006684769,"['AMT_OUTSTANDING', 'GREEN_BOND_LOAN_INDICATOR', 'Cpn']","[0.45017827739109645, 0.20838974791795087, 0.1731313484115903]"
2025-11-06,BE0000351602,BGB 0 10/22/27,2027-10-22,-1.3214028431899465,NO ACTION,-0.45859751816885386,0.6938401851040356,-0.7779074801701963,-0.8240405208339782,-0.7826715465230194,-7.841508567380909,"['AMT_OUTSTANDING', 'REL_SPRD_LOG', 'Issue_Age']","[0.3910342868893197, 0.23029155214882133, 0.10340312949232944]"
2025-11-06,BE0000352618,BGB 0 10/22/31,2031-10-22,-0.5525297489220762,NO ACTION,0.0,0.8710035258528263,0.01598959164465137,-0.1487046319244272,0.09449732485977945,26.19779614338237,"['AMT_OUTSTANDING', 'Cpn', 'Issue_Age']","[0.45812196412460393, 0.16600134955176418, 0.15521660468589873]"
2025-11-06,BE0000353624,BGB 0.65 06/22/2071,2071-06-22,-7.135610192232903,MODERATE SELL,-1.5204027837985081,0.7880927826719931,-1.4797218804759305,1.1900417380725372,-1.4076946339155512,115.50870282632576,"['AMT_OUTSTANDING', 'GREEN_BOND_LOAN_INDICATOR', 'Cpn']","[0.610205827225872, 0.20612230408428014, 0.07126934014536594]"
2025-11-06,BE0000354630,BGB 0.35 06/22/32,2032-06-22,1.4042072772473446,NO ACTION,0.0,0.9782675999796652,0.01598959164465137,-1.1242314423861524,0.11299018887229717,33.11553276395484,"['REL_SPRD_LOG', 'AMT_OUTSTANDING', 'GREEN_BOND_LOAN_INDICATOR']","[0.3001385693126957, 0.22798774906122038, 0.172327749879424]"
2025-11-06,BE0000355645,BGB 1.4 06/22/53,2053-06-22,-2.2888875420104853,NO ACTION,-0.4494970578679139,0.9107012116543168,-0.5208884941050529,0.8490881903595573,-0.5994315944086204,117.02826983684903,"['AMT_OUTSTANDING', 'Cpn', 'Issue_Age']","[0.5967590534402378, 0.15812375667563017, 0.10514349653869227]"
2025-11-06,BE0000356650,BGB 2 3/4 04/22/39,2039-04-22,-1.1564779493673851,NO ACTION,-0.3649322631272412,0.9100110508708663,-1.050544409540317,0.7095120266977124,-0.707766648117934,72.52084053842528,"['Issue_Age', 'AMT_OUTSTANDING', 'Cpn']","[0.5462118375734184, 0.207430983495159, 0.0950966770561426]"
2025-11-06,BE0000357666,BGB 3 06/22/33,2033-06-22,0.7676351276250699,NO ACTION,-0.07933005166467992,0.9690598287132828,-0.4428890547090978,-1.909318747261441,-0.7248006022748509,39.59891328452947,"['Cpn', 'Issue_Age', 'GREEN_BOND_LOAN_INDICATOR']","[0.2787283481522258, 0.19559102015433186, 0.16264871597315883]"
2025-11-06,BE0000358672,BGB 3.3 06/22/54,2054-06-22,0.4279278820069265,NO ACTION,0.1507958418595515,0.8574941545311635,0.4886355001603023,-0.06823363939787944,0.305972991151714,121.2789120035428,"['YAS_RISK', 'Issue_Age', 'Cpn']","[0.3378813337556168, 0.3357173741287894, 0.1122484869427292]"
2025-11-06,BE0000359688,BGB 3.45 06/22/43,2043-06-22,-0.3725435783884592,NO ACTION,0.07283735722038193,0.8772522345579139,0.4743717137892827,-1.0012533529082868,0.2649595022459888,91.90243083819506,"['Cpn', 'AMT_OUTSTANDING', 'Issue_Age']","[0.33082727479175666, 0.2377136965833539, 0.14185770427312147]"
2025-11-06,BE0000360694,BGB 2.85 10/22/34,2034-10-22,2.852038187146164,WEAK BUY,0.8010460424630552,0.9172404957807199,1.3231121414294111,-0.0013210978884329453,0.8923726671410961,50.63684259794927,"['AMT_OUTSTANDING', 'GREEN_BOND_LOAN_INDICATOR', 'Issue_Age']","[0.3627318510900278, 0.2741135731908955, 0.1544126446127311]"
2025-11-06,BE0000361700,BGB 3 1/2 06/22/55,2055-06-22,2.540145437756678,NO ACTION,0.6175000537788635,0.8085759714488532,0.6371413772509805,-0.8364245500964893,0.5815976165629652,124.73813191160838,"['AMT_OUTSTANDING', 'Cpn', 'GREEN_BOND_LOAN_INDICATOR']","[0.35302601236090664, 0.20475672610261467, 0.1659447971327947]"
2025-11-06,BE0000362716,BGB 2.7 10/22/29,2029-10-22,0.9257165755609248,NO ACTION,0.0,0.8481567946055913,0.01598959164465137,-0.05956679406413568,0.09055843387950535,11.835604529352194,"['Cpn', 'AMT_OUTSTANDING', 'GREEN_BOND_LOAN_INDICATOR']","[0.30112670440925593, 0.2973699534350824, 0.18805138031645321]"
2025-11-06,BE0000363722,BGB 3.1 06/22/35,2035-06-22,4.334215164283052,MODERATE BUY,1.4270637274676201,0.9220671689335971,1.687290079535063,-0.4840384896756456,1.3216340728444504,56.35973637278488,"['AMT_OUTSTANDING', 'GREEN_BOND_LOAN_INDICATOR', 'REL_SPRD_LOG']","[0.43495544590349944, 0.16348556422535618, 0.1537821789387132]"
2025-11-06,BE0000364738,BGB 3.45 06/22/42,2042-06-22,1.378905558967162,WEAK BUY,1.0508927306069304,0.9016522175678786,1.258699409937497,0.8607965834167418,1.1488068163891505,89.63131957059313,"['AMT_OUTSTANDING', 'Cpn', 'REL_SPRD_LOG']","[0.29812152656516844, 0.28678168597338644, 0.2760698918152795]"
2025-11-06,BE0000365743,BGB 2.6 10/22/30,2030-10-22,2.849606389503652,NO ACTION,0.0,0.8763755492944695,0.01598959164465137,-1.1517694336687603,0.09542348862697789,21.86972979203609,"['AMT_OUTSTANDING', 'Cpn', 'YAS_RISK']","[0.274272838777872, 0.25993206645891376, 0.16402230689192104]"
