Date,ISIN,SECURITY_NAME,Maturity,RESIDUAL_NS,SIGNAL,Z_Residual_Score,Volatility_Score,Cluster_Score,Regression_Score,COMPOSITE_SCORE,Z_SPRD_VAL,Top_Features,Top_Feature_Effects_Pct
2025-11-06,AT0000383864,RAGB 6 1/4 07/15/27,2027-07-15,-5.526380703348371,STRONG SELL,-1.4770904189365146,0.9950164773866182,-1.2184228437123437,-1.5239778858950461,-1.5792921462473446,-15.45605944659334,,
2025-11-06,AT0000A04967,RAGB 4.15 03/15/37,2037-03-15,2.908887929263188,STRONG BUY,1.6627163073083193,0.9967673347124197,1.293867100283488,1.2756750769051646,1.595008389773217,40.42982567381735,,
2025-11-06,AT0000A0DXC2,RAGB 4.85 03/15/26,2026-03-15,5.402063783870307,MODERATE BUY,1.534876615460451,0.9832658306043806,1.3627111083577463,0.24930917553092755,1.3692210414474462,-14.135162122361669,,
2025-11-06,AT0000A0U299,RAGB 3.8 01/26/62,2062-01-26,5.982160288036042,STRONG BUY,1.4931511669315922,0.9917877774291561,1.61650781159082,1.1303785590017277,1.5740907650818534,78.75812046592173,,
2025-11-06,AT0000A0VRQ6,RAGB 3.15 06/20/44,2044-06-20,-1.446071132926427,MODERATE SELL,-1.4063192013100783,0.9990361802527806,-1.4589307449548448,0.9551156930395741,-1.3495746457069702,54.592525708046736,,
2025-11-06,AT0000A10683,RAGB 2.4 05/23/34,2034-05-23,0.2427692721280756,NO ACTION,0.0,0.9983601591239155,0.00043541048392272997,-1.6045882883689906,0.14261707983704636,27.288011484324432,,
2025-11-06,AT0000A1K9C8,RAGB 0 3/4 10/20/26,2026-10-20,1.829884283099496,NO ACTION,0.5503552675363453,0.9944380346682092,0.7098558534615416,-1.1942940510652658,0.6308068395221376,-13.272005585717288,,
2025-11-06,AT0000A1K9F1,RAGB 1 1/2 02/20/47,2047-02-20,-3.352877834718754,NO ACTION,-0.5954056306113621,0.998427034709371,-0.5658546798134487,1.0145479369182755,-0.6729250731506085,57.18689445158672,,
2025-11-06,AT0000A1PEF7,RAGB 1 1/2 11/02/2086,2086-11-02,1.296728740565328,NO ACTION,0.0,0.9974750260995545,0.00043541048392272997,-0.5276284992952625,0.14246436339036742,75.13707017158657,,
2025-11-06,AT0000A1VGK0,RAGB 0 1/2 04/20/27,2027-04-20,-3.028748392330028,WEAK SELL,-0.7887229029894645,0.9880136590824942,-0.8520286382538932,0.49435734247815194,-0.8534821187139711,-14.588283180054582,,
2025-11-06,AT0000A1ZGE4,RAGB 0 3/4 02/20/28,2028-02-20,-3.649274483462275,WEAK SELL,-0.9597448752984625,0.9941538885858847,-1.0754370692321804,-0.6639686037806901,-1.1218641660179107,-9.5342424151671,,
2025-11-06,AT0000A269M8,RAGB 0 1/2 02/20/29,2029-02-20,-0.9255671787064246,NO ACTION,0.2199797989007502,0.9953017522248688,0.6249182263150821,-0.24672211559096247,0.4355273181037763,-0.4626437163883279,,
2025-11-06,AT0000A2CQD2,RAGB 0 02/20/30,2030-02-20,-0.1486778384740956,WEAK BUY,0.6872899104874659,0.9976510177760546,0.7577050414807524,0.5086846953475006,0.803764617111468,6.197996106783198,,
2025-11-06,AT0000A2EJ08,RAGB 0 3/4 03/20/51,2051-03-20,-4.206832883063605,WEAK SELL,-0.7864636206874042,0.9970459473824883,-0.8370916447823632,1.7840175113823888,-0.8495758312923888,61.50344052015554,,
2025-11-06,AT0000A2KQ43,RAGB 0 10/20/40,2040-10-20,-0.4375776294430338,WEAK SELL,-0.6956116313414802,0.9959201512454869,-1.0750880161491203,0.8477862944444094,-0.8707939908234379,47.57962199860295,,
2025-11-06,AT0000A2NW83,RAGB 0 02/20/31,2031-02-20,1.0443320127841569,NO ACTION,0.0,0.9955838660987414,0.00043541048392272997,-0.03447437130113534,0.14213807205621004,12.858078824973193,,
2025-11-06,AT0000A2QQB6,RAGB 0.7 04/20/2071,2071-04-20,-5.508875367554907,WEAK SELL,-1.0777735913500122,0.9971607348677044,-1.3163787050749334,0.48247775985751584,-1.1382021601672263,68.98373802216153,,
2025-11-06,AT0000A2T198,RAGB 0 1/4 10/20/36,2036-10-20,0.8401221282374678,NO ACTION,0.2048115114889375,0.9976657848184833,0.7319122905857764,0.2217010515575917,0.49710224898355765,37.0050396227603,,
2025-11-06,AT0000A2VB47,RAGB 0 10/20/28,2028-10-20,-0.5999492366336034,NO ACTION,-0.11932635724275852,0.9955370691416052,-0.6406016092568484,0.009616900800619525,-0.4474995131062957,-2.218750794443224,,
2025-11-06,AT0000A2WSC8,RAGB 0.9 02/20/32,2032-02-20,1.6924238945727232,NO ACTION,0.0,0.9984013562876594,0.00043541048392272997,-1.0543710612084816,0.14262418779063868,18.5841423654321,,
2025-11-06,AT0000A2Y8G4,RAGB 1.85 05/23/49,2049-05-23,-2.7986552878470974,NO ACTION,-0.47140771518787594,0.9979793452457616,-0.592326948248819,0.7433263730993598,-0.6162782038894943,60.824581602749205,,
2025-11-06,AT0000A308C5,RAGB 2 07/15/26,2026-07-15,4.403457371814804,MODERATE BUY,1.2596526714704044,0.9866582700368672,1.251485033630309,0.46666306993184653,1.232866217810903,-12.639246814278804,,
2025-11-06,AT0000A324S8,RAGB 2.9 02/20/33,2033-02-20,1.0198087607014052,NO ACTION,0.0,0.9978265918290047,0.00043541048392272997,-0.5801472087156891,0.14252502079156934,22.638632582702297,,
2025-11-06,AT0000A33SH3,RAGB 2.9 05/23/29,2029-05-23,-4.176638929030091,STRONG SELL,-1.735586616730383,0.993410341309282,-1.4225631314251574,-0.7429794592087214,-1.636766641018586,-2.1898261002864103,,
2025-11-06,AT0000A33SK7,RAGB 3.15 10/20/53,2053-10-20,5.735206297527213,STRONG BUY,1.4378993909050617,0.9977295195261653,1.5532032139826355,1.4148333031661322,1.5773919631674724,73.87276614636309,,
2025-11-06,AT0000A38239,RAGB 3.45 10/20/30,2030-10-20,0.8113528545560289,MODERATE BUY,1.2647621797715518,0.994632068382893,0.8955975325122443,1.5834707186917678,1.3272366877130226,10.827573674333424,,
2025-11-06,AT0000A39UW5,RAGB 2.9 02/20/34,2034-02-20,1.5436145634989806,NO ACTION,0.0,0.998011598525977,0.00043541048392272997,-2.517074450720431,0.1425569409262788,27.53702574871137,,
2025-11-06,AT0000A3D3Q8,RAGB 3.2 07/15/39,2039-07-15,0.8821124476808109,NO ACTION,0.23440301385430198,0.9977832684012853,0.4811827105973405,0.30878835357607265,0.4553654505566625,45.53440282787748,,
2025-11-06,AT0000A3EPP2,RAGB 2 1/2 10/20/29,2029-10-20,-2.016854587074425,WEAK SELL,-0.43644527242938475,0.9981856570483383,-0.6427103855752158,-2.177610679698736,-0.9884193501173157,2.395051537912879,,
2025-11-06,AT0000A3HU25,RAGB 2.95 02/20/35,2035-02-20,2.188056631068548,NO ACTION,0.0,0.9964236029960342,0.00043541048392272997,-0.334406116861079,0.1422829560810631,32.239500067348395,,
2025-11-06,BE0000291972,BGB 5 1/2 03/28/28,2028-03-28,-0.3286726932362245,NO ACTION,0.5939068218349893,0.9837625233821334,0.46472764602492916,0.009616900800619525,0.5826780292371875,-2.943942973564436,,
2025-11-06,BE0000304130,BGB 5 03/28/35,2035-03-28,1.6239444763210784,NO ACTION,0.2649562740735489,0.9969376768404715,0.3206947122955863,-1.1382912692601885,0.3716076056315837,52.16560905767259,,
2025-11-06,BE0000320292,BGB 4 1/4 03/28/41,2041-03-28,-1.1195098815569082,NO ACTION,-0.323085967601536,0.9943429407046851,-0.345220084873915,0.21952946688688757,-0.46782106113120353,81.78869369985297,,
2025-11-06,BE0000324336,BGB 4 1/2 03/28/26,2026-03-28,-2.5383267220199563,MODERATE SELL,-1.6859329651041377,0.9473507825077988,-1.0622763222188245,-0.5400131509108688,-1.464496487388573,-23.87760883433072,,
2025-11-06,BE0000326356,BGB 4 03/28/32,2032-03-28,0.9079578165882792,NO ACTION,0.0,0.9980514243265239,0.00043541048392272997,1.7803096439718367,0.449729577566564,30.889366465448845,,
2025-11-06,BE0000331406,BGB 3 3/4 06/22/45,2045-06-22,-4.532113448628664,STRONG SELL,-2.1114155522353903,0.9938119823482442,-1.3034079751245449,-0.7947634935526159,-1.8060373970525208,95.0187721610258,,
2025-11-06,BE0000333428,BGB 3 06/22/34,2034-06-22,0.3462524860171072,NO ACTION,-0.2414610086706186,0.9957501621191557,-0.30971580973901475,0.26824507886899357,-0.4156048120784959,45.945577670518304,,
2025-11-06,BE0000335449,BGB 1 06/22/31,2031-06-22,0.5663817073749478,NO ACTION,0.0,0.9947093831616743,0.00043541048392272997,-0.3597188096021899,0.1419871931225869,24.774526654783788,,
2025-11-06,BE0000336454,BGB 1.9 06/22/38,2038-06-22,1.842059184830049,MODERATE BUY,1.2288849760673795,0.9943009133324251,0.8835727570709766,1.2486589550215996,1.2473847491983758,71.20635402395334,,
2025-11-06,BE0000337460,BGB 1 06/22/26,2026-06-22,0.2431116231857544,WEAK BUY,1.183852857343612,0.9834533344781171,1.2201797225064177,0.4440671653274071,1.1801781969601903,-18.80510334296754,,
2025-11-06,BE0000338476,BGB 1.6 06/22/47,2047-06-22,-5.685568286058938,MODERATE SELL,-1.1261090068430224,0.9956505437161387,-1.5093121168783827,0.9842121905164215,-1.2184398730922812,100.14346082963122,,
2025-11-06,BE0000340498,BGB 2.15 06/22/66,2066-06-22,9.23220283343565,STRONG BUY,1.9670540827487228,0.9941904251897871,1.7367473043920623,1.6946282589597423,1.951728565037152,135.47346719189673,,
2025-11-06,BE0000341504,BGB 0.8 06/22/27,2027-06-22,0.1830076132936291,WEAK BUY,1.1218397497160462,0.981600041029265,0.7881532104184312,-1.3856508622591952,0.9469101612206395,-9.4052567897709,,
2025-11-06,BE0000343526,BGB 2 1/4 06/22/57,2057-06-22,4.706395153202863,MODERATE BUY,1.028639010218693,0.9920707696582626,0.6723130257054577,2.024310019918568,1.2164291143174981,129.06351353821,,
2025-11-06,BE0000344532,BGB 1.45 06/22/37,2037-06-22,1.888828713387,WEAK BUY,1.2533939264725216,0.9947438698647677,0.8873028746331425,-1.2402180817035025,1.045782356737115,65.79551717222824,,
2025-11-06,BE0000345547,BGB 0.8 06/22/28,2028-06-22,-1.6634921478178253,WEAK SELL,-0.7833108155390318,0.9856087556662068,-0.5552137242872704,-1.9962176325022896,-1.1093317064772668,-2.1856144283436176,,
2025-11-06,BE0000346552,BGB 1 1/4 04/22/33,2033-04-22,-4.191330383278064,STRONG SELL,-2.0399464060379895,0.9976365641734536,-1.74453052140067,1.928292523450768,-1.759428422501147,33.47480532997799,,
2025-11-06,BE0000347568,BGB 0.9 06/22/29,2029-06-22,-0.2029470414576168,NO ACTION,0.0,0.9900393851236658,0.00043541048392272997,1.1275255093631331,0.3357190945474856,7.909473181655943,,
2025-11-06,BE0000348574,BGB 1.7 06/22/50,2050-06-22,-3.832976530163109,NO ACTION,-0.7419786703793884,0.9979527899728944,-0.5359848236761057,-0.2758957060969614,-0.787722542463027,109.69508446245553,,
2025-11-06,BE0000349580,BGB 0.1 06/22/30,2030-06-22,-0.1452203642910525,NO ACTION,0.0,0.9935192925979462,0.00043541048392272997,-0.00010570286813025174,0.14178186081985206,16.20690893461831,,
2025-11-06,BE0000350596,BGB 0.4 06/22/40,2040-06-22,-1.9529631072580715,WEAK SELL,-0.7598460634156677,0.9943003934511639,-1.315738430188847,0.5519352518963697,-0.9729636346983256,77.436006684769,,
2025-11-06,BE0000351602,BGB 0 10/22/27,2027-10-22,-1.3214028431899465,NO ACTION,-0.4303556482514789,0.9838809253181703,-0.4786719597599715,-0.8863384481730853,-0.7128389558399433,-7.841508567380909,,
2025-11-06,BE0000352618,BGB 0 10/22/31,2031-10-22,-0.5525297489220762,NO ACTION,0.0,0.9932084365768984,0.00043541048392272997,-0.1520653308632042,0.14172822726912399,26.19779614338237,,
2025-11-06,BE0000353624,BGB 0.65 06/22/2071,2071-06-22,-7.135610192232903,MODERATE SELL,-1.4267716237052206,0.9888432508267305,-1.1786163344235168,1.3035147538442653,-1.2777955304694835,115.50870282632576,,
2025-11-06,BE0000354630,BGB 0.35 06/22/32,2032-06-22,1.4042072772473446,NO ACTION,0.0,0.9988558061447018,0.00043541048392272997,-1.2127273272124492,0.14270259630715673,33.11553276395484,,
2025-11-06,BE0000355645,BGB 1.4 06/22/53,2053-06-22,-2.2888875420104853,NO ACTION,-0.42181562276718076,0.9952984886705981,-0.3857308965374364,0.9328058540976338,-0.5307381196173492,117.02826983684903,,
2025-11-06,BE0000356650,BGB 2 3/4 04/22/39,2039-04-22,-1.1564779493673851,NO ACTION,-0.34245859265243056,0.9952621522454056,-0.9188836633755674,0.7810487411154993,-0.6429687907173863,72.52084053842528,,
2025-11-06,BE0000357666,BGB 3 06/22/33,2033-06-22,0.7676351276250699,NO ACTION,-0.07444465889456989,0.9983710241926796,-0.23795132202306105,-2.066329974692063,-0.6654863037437083,39.59891328452947,,
2025-11-06,BE0000358672,BGB 3.3 06/22/54,2054-06-22,0.4279278820069265,NO ACTION,0.14150936214443352,0.9924971787480011,0.2679319308763797,-0.06457155553475857,0.29177233733412467,121.2789120035428,,
2025-11-06,BE0000359688,BGB 3.45 06/22/43,2043-06-22,-0.3725435783884592,NO ACTION,0.06835180488691728,0.9935374262005578,0.23636018278376283,-1.0790168187015952,0.24500637351935392,91.90243083819506,,
2025-11-06,BE0000360694,BGB 2.85 10/22/34,2034-10-22,2.852038187146164,WEAK BUY,0.7517151210498697,0.9956427768628123,1.2638423389317694,0.00818050939784927,0.8959544566156786,50.63684259794927,,
2025-11-06,BE0000361700,BGB 3 1/2 06/22/55,2055-06-22,2.540145437756678,NO ACTION,0.5794724685829628,0.9899216746875773,0.4581885805754182,-0.8998032438707099,0.5727297889270672,124.73813191160838,,
2025-11-06,BE0000362716,BGB 2.7 10/22/29,2029-10-22,0.9257165755609248,NO ACTION,0.0,0.9920055740544769,0.00043541048392272997,-0.055148346069723096,0.14152069135620274,11.835604529352194,,
2025-11-06,BE0000363722,BGB 3.1 06/22/35,2035-06-22,4.334215164283052,MODERATE BUY,1.339180678479759,0.995896897427402,1.6044107470495106,-0.5166641047683075,1.296595324106362,56.35973637278488,,
2025-11-06,BE0000364738,BGB 3.45 06/22/42,2042-06-22,1.378905558967162,WEAK BUY,0.9861754684782066,0.9948220662128555,0.8261132495519002,0.9455360501526219,1.0530247151649992,89.63131957059313,,
2025-11-06,BE0000365743,BGB 2.6 10/22/30,2030-10-22,2.849606389503652,NO ACTION,0.0,0.9934912694074506,0.00043541048392272997,-1.242668586126117,0.14177702583803653,21.86972979203609,,
2025-11-06,DE0001030724,DBR 0 08/15/50,2050-08-15,-3.625192195226276,STRONG SELL,-1.903661888033782,0.9879907874175836,-1.701243808295537,0.009616900800619525,-1.6747751741268562,22.08122229513188,,
2025-11-06,DE0001030732,DBR 0 08/15/31,2031-08-15,-4.599775509735684,MODERATE SELL,-1.224936399577735,0.9943731919516725,-1.4891558503838225,0.009616900800619525,-1.263576941428695,-13.544319153217463,,
2025-11-06,DE0001030740,OBL 1.3 10/15/27,2027-10-15,-1.306446855736656,WEAK SELL,-0.9324994488136287,0.9943955156831772,-1.4492687903835204,0.009616900800619525,-1.1007440869912823,-20.745091915542933,,
2025-11-06,DE0001030757,DBR 1.8 08/15/53,2053-08-15,-0.4994719002802625,NO ACTION,0.09675305511809841,0.9905487790258383,0.8669028906012978,0.009616900800619525,0.4421684447749511,28.12627642031314,,
2025-11-06,DE0001102341,DBR 2 1/2 08/15/46,2046-08-15,-0.4341992308258255,NO ACTION,0.13852660202413208,0.9979597516797183,0.5835089644081818,0.009616900800619525,0.3835770007988896,20.31968714862738,,
2025-11-06,DE0001102432,DBR 1 1/4 08/15/48,2048-08-15,-0.65074981730179,NO ACTION,-6.258327029444142e-05,0.9961886298047525,-0.7063020741807098,0.009616900800619525,-0.4047731149057512,22.733674946419185,,
2025-11-06,DE0001102481,DBR 0 08/15/50,2050-08-15,-1.95621896600542,WEAK SELL,-0.8355436073123416,0.9888496232549752,-1.3689659272511807,0.009616900800619525,-1.0265106307390017,23.750195524352737,,
2025-11-06,DE0001102515,DBR 0 05/15/35,2035-05-15,-0.1694119972805797,NO ACTION,0.4667873971680071,0.9986400705913857,0.8477111672415832,0.009616900800619525,0.6295773863359125,-0.0131082595631287,,
2025-11-06,DE0001102531,DBR 0 02/15/31,2031-02-15,-3.507245609591706,NO ACTION,-0.6653481762955226,0.9979347674543732,-0.7006015622916856,0.009616900800619525,-0.7477903500876697,-13.740575211647382,,
2025-11-06,DE0001102549,DBR 0 05/15/36,2036-05-15,0.5449391036408553,STRONG SELL,-1.8824364018392812,0.9973665829767623,-1.3993521341031092,0.009616900800619525,-1.578594929756003,2.9420932972335674,,
2025-11-06,DE0001102564,DBR 0 08/15/31,2031-08-15,-3.982523601589168,WEAK SELL,-0.908783131322335,0.9948607635453933,-1.3515215347096234,0.009616900800619525,-1.0604406307237437,-12.927067245070948,,
2025-11-06,DE0001102572,DBR 0 08/15/52,2052-08-15,-2.5332102715082208,MODERATE SELL,-1.2048095430593053,0.9957862933494155,-1.4552006273926787,0.009616900800619525,-1.2436388793258328,25.195476406721458,,
2025-11-06,DE0001102580,DBR 0 02/15/32,2032-02-15,-2.806556366054396,NO ACTION,-0.3064587318855082,0.9956913981386614,-0.8009181791213602,0.009616900800619525,-0.5904871776989912,-10.46151719983459,,
2025-11-06,DE0001102598,DBR 1 05/15/38,2038-05-15,2.734638442997261,WEAK BUY,0.770001015812293,0.9986111596970512,0.9508326011528866,0.009616900800619525,0.816170735768158,9.3612067423395,,
2025-11-06,DE0001102606,DBR 1.7 08/15/32,2032-08-15,-2.366509986508772,NO ACTION,-0.08106922844102148,0.9982485013288747,-0.8823694062429381,0.009616900800619525,-0.49768760033843873,-8.766260925532931,,
2025-11-06,DE0001102614,DBR 1.8 08/15/53,2053-08-15,0.7221395853725134,WEAK BUY,0.8785664101316791,0.9909994260442495,1.2209335945497128,0.009616900800619525,0.9487212453594064,29.34788790596592,,
2025-11-06,DE0001135176,DBR 5 1/2 01/04/31,2031-01-04,0.6335125754781394,MODERATE BUY,1.45552697368358,0.9990877897737062,1.3852033454850912,0.009616900800619525,1.295991625697415,-9.901744447462018,,
2025-11-06,DE0001135226,DBR 4 3/4 07/04/34,2034-07-04,-2.190532039643128,STRONG SELL,-2.7458623294998503,0.9975657469266628,-1.6738317815596209,0.009616900800619525,-2.104471849725772,-4.027522043555163,,
2025-11-06,DE0001135275,DBR 4 01/04/37,2037-01-04,1.5768316708936485,NO ACTION,-0.6324792012391671,0.9972860565579775,-0.9301876132192737,0.009616900800619525,-0.7966846675864263,5.3644610212412775,,
2025-11-06,DE0001135325,DBR 4 1/4 07/04/39,2039-07-04,2.1460379892231938,NO ACTION,0.05701460732394511,0.9986485252550673,0.4425865273835022,0.009616900800619525,0.3009813902204693,11.035224526949085,,
2025-11-06,DE0001135366,DBR 4 3/4 07/04/40,2040-07-04,2.546035829841271,NO ACTION,0.5415419670239566,0.9981775573320166,0.8462282079892939,0.009616900800619525,0.667764493531272,13.345874404970386,,
2025-11-06,DE0001135432,DBR 3 1/4 07/04/42,2042-07-04,2.693429129272776,NO ACTION,0.7200831463979956,0.9973579874421125,0.7046613652728112,0.009616900800619525,0.7193281777045869,17.0680535710859,,
2025-11-06,DE0001135481,DBR 2 1/2 07/04/44,2044-07-04,1.1261022509459195,MODERATE SELL,-1.178458988152349,0.9967715353118869,-1.3897128989632268,0.009616900800619525,-1.2113381427362422,18.767392282946066,,
2025-11-06,DE0001141836,OBL 0 04/10/26,2026-04-10,0.3748593960141093,NO ACTION,-0.18518929881456023,0.9878937418511042,-0.6477169221038369,0.009616900800619525,-0.4823178316409335,-23.543730495317657,,
2025-11-06,DE0001141844,OBL 0 10/09/26,2026-10-09,5.254591000076218,STRONG BUY,1.9837629388812925,0.990508511815766,1.3506326324421616,0.009616900800619525,1.557987914978171,-17.168521258852657,,
2025-11-06,DE0001141851,OBL 0 04/16/27,2027-04-16,3.483870577910757,WEAK BUY,1.1967098110427807,0.979823493857399,1.0076745532173186,0.009616900800619525,1.0501412199295097,-17.4081357898999,,
2025-11-06,DE0001141869,OBL 1.3 10/15/27,2027-10-15,-0.5531581004268595,WEAK SELL,-0.5976762527796052,0.9941354032612489,-1.2868083323520498,0.009616900800619525,-0.8806761602845232,-19.991803160233136,,
2025-11-06,DE000BU25000,OBL 2.2 04/13/28,2028-04-13,-1.7027926085474512,WEAK SELL,-1.108667950938747,0.9964706101144046,-1.181051444393502,0.009616900800619525,-1.1151596798856387,-19.71649097009917,,
2025-11-06,DE000BU25018,OBL 2.4 10/19/28,2028-10-19,-0.0104217832489936,NO ACTION,-0.3564397985775319,0.997281559284577,-0.7097760817884411,0.009616900800619525,-0.5904233165633704,-16.557892092895294,,
2025-11-06,DE000BU25026,OBL 2.1 04/12/29,2029-04-12,0.3004426447374637,WEAK SELL,-0.8645623841647457,0.9967857564941375,-0.9910550354546147,0.009616900800619525,-0.9342287170073285,-14.909136370323589,,
2025-11-06,DE000BU25034,OBL 2 1/2 10/11/29,2029-10-11,1.208032589300915,WEAK BUY,0.9950428538734318,0.99814381845472,1.183820370588164,0.009616900800619525,0.9995704827060053,-12.630221265445426,,
2025-11-06,DE000BU25042,OBL 2.4 04/18/30,2030-04-18,0.9333432466903684,NO ACTION,0.43221848212751496,0.9983236962951517,0.7852203383595854,0.009616900800619525,0.5936599940460001,-11.502471016483227,,
2025-11-06,DE000BU25059,OBL 2.2 10/10/30,2030-10-10,1.206315888905264,WEAK BUY,0.9915254228275975,0.9988970969481614,0.9677255311312662,0.009616900800619525,0.9357399293447901,-9.950552924660942,,
2025-11-06,DE000BU27006,DBR 2.4 11/15/30,2030-11-15,1.1714752335210346,MODERATE BUY,1.7310686938385418,0.9982007925171923,1.5023116875530869,0.009616900800619525,1.472135862789237,-9.72463120827918,,
2025-11-06,DE000BU2D004,DBR 2 1/2 08/15/54,2054-08-15,1.2743303922828415,WEAK BUY,1.2319603921205866,0.9968251396655868,1.2945280291981573,0.009616900800619525,1.153807597165816,30.72248770551445,,
2025-11-06,DE000BU2D012,DBR 2.9 08/15/56,2056-08-15,1.84670414527249,MODERATE BUY,1.5982711622812265,0.9969538106749684,1.3584543130667033,0.009616900800619525,1.3618166469310191,32.71867871883227,,
2025-11-06,DE000BU2F009,DBR 2.6 05/15/41,2041-05-15,3.423745727349271,MODERATE BUY,1.6047338546726104,0.9987891297192896,1.5484507220055905,0.009616900800619525,1.4201134840484713,15.804604960106571,,
2025-11-06,DE000BU2Z007,DBR 2.3 02/15/33,2033-02-15,-0.6386689736796303,NO ACTION,-0.27911500613663015,0.9963648695329962,-0.5653052826531298,0.009616900800619525,-0.5086976632164177,-5.789954561753989,,
2025-11-06,DE000BU2Z015,DBR 2.6 08/15/33,2033-08-15,0.0401967565893421,WEAK BUY,0.799968747960134,0.9984512935962746,0.9391176361403702,0.009616900800619525,0.8282858670668538,-3.9030866234169928,,
2025-11-06,DE000BU2Z023,DBR 2.2 02/15/34,2034-02-15,0.2009079829748259,WEAK BUY,1.0554255574014237,0.9988005614272709,1.212409676953335,0.009616900800619525,1.039159281671683,-2.534751041882288,,
2025-11-06,DE000BU2Z031,DBR 2.6 08/15/34,2034-08-15,-0.0490368673549808,NO ACTION,0.6581283962909642,0.998689130604137,1.0215953684825443,0.009616900800619525,0.7786267796909592,-1.6167883804620358,,
2025-11-06,DE000BU2Z049,DBR 2 1/2 02/15/35,2035-02-15,-0.1077255104070435,NO ACTION,0.5648404920063085,0.9951898558463551,0.6568989241736507,0.009616900800619525,0.6248652244654369,-0.5085303038669271,,
2025-11-06,DE000BU2Z056,DBR 2.6 08/15/35,2035-08-15,0.034222091923317,NO ACTION,0.790471783700752,0.998998731096628,0.7734310188441689,0.009616900800619525,0.775820068503945,0.7613905491812204,,
2025-11-06,DE000BU35025,OBL 2.1 04/12/29,2029-04-12,-0.0361504530454244,MODERATE SELL,-1.554224374663799,0.9978223648903894,-1.2476152477121505,0.009616900800619525,-1.3651561472058698,-15.245729468106475,,
2025-11-06,DE000BU3Z005,DBR 2.3 02/15/33,2033-02-15,-1.0486030877044603,WEAK SELL,-0.9307213886225756,0.9959138867671953,-0.8649291445070978,0.009616900800619525,-0.9320539691859588,-6.199888675778819,,
2025-11-06,DE000BU3Z047,DBR 2 1/2 02/15/35,2035-02-15,-0.7020890127231356,NO ACTION,-0.3799236502685329,0.9951808063892196,-0.5738292002495075,0.009616900800619525,-0.5631235599073214,-1.1028938061830191,,
2025-11-06,ES0000011868,SPGB 6 01/31/29,2029-01-31,-4.573014788425022,STRONG SELL,-1.7989059730443158,0.99774066786103,-1.7063949230242426,1.3534218365571238,-1.6237164235432426,0.3195888689573016,,
2025-11-06,ES00000120N0,SPGB 4.9 07/30/40,2040-07-30,3.139272409809891,NO ACTION,0.3494081136136635,0.998309963389895,0.35688883198517285,0.8427195950842856,0.5713636401488249,72.58664782063194,,
2025-11-06,ES00000121S7,SPGB 4.7 07/30/41,2041-07-30,2.45780788699399,NO ACTION,0.03348349321394645,0.9984278400044168,0.776293667205831,1.3620219380236092,0.6180610062092062,75.60630080661409,,
2025-11-06,ES00000123C7,SPGB 5.9 07/30/26,2026-07-30,6.497149770860876,STRONG BUY,1.763787206235823,0.989781298111527,1.2344495908547035,0.657429497469579,1.5223628458911898,-9.845819593650468,,
2025-11-06,ES0000012411,SPGB 5 3/4 07/30/32,2032-07-30,-2.757159616996649,WEAK SELL,-1.0752660693299683,0.9994837332688831,-1.469088396212171,1.4775805613879065,-1.1812180027522492,26.81225689306559,,
2025-11-06,ES00000124C5,SPGB 5.15 10/31/28,2028-10-31,-1.7476497342322466,NO ACTION,-0.5703750698301022,0.9973022077323889,-0.9130902083579181,0.5491946592123751,-0.7596255391138835,1.1544674748924215,,
2025-11-06,ES00000124H4,SPGB 5.15 10/31/44,2044-10-31,-1.1961561287320848,STRONG SELL,-1.6604817184341192,0.9985927401812664,-1.625959874108968,0.13561019406539285,-1.5290845683339072,82.4574372195896,,
2025-11-06,ES00000127A2,SPGB 1.95 07/30/30,2030-07-30,-3.491488781047332,WEAK SELL,-1.109113231200126,0.9982866345804005,-1.2541832288016783,0.4665876189429175,-1.1367331438652934,12.587993546571305,,
2025-11-06,ES00000127Z9,SPGB 1.95 04/30/26,2026-04-30,4.173289569044572,WEAK BUY,1.1058856023727104,0.9941051878673473,1.1913446332011042,0.32156784926222043,1.1122325747150241,-14.459676606490548,,
2025-11-06,ES00000128C6,SPGB 2.9 10/31/46,2046-10-31,-5.083509913278888,WEAK SELL,-0.7189280857430449,0.9978368351549146,-0.7534841370766762,-0.05460897499713353,-0.8001354739018095,83.97644643882063,,
2025-11-06,ES00000128E2,SPGB 3.45 07/30/66,2066-07-30,4.4662718835025,MODERATE BUY,1.5823207172647948,0.9975264068153545,1.3879833777324195,-1.310937389329248,1.3604914861775725,119.79478424564743,,
2025-11-06,ES00000128H5,SPGB 1.3 10/31/26,2026-10-31,3.248504697061829,WEAK BUY,0.8440723271893504,0.9973775216415715,1.2779924139142709,-0.07099722576090557,0.9467158670338912,-10.789245871933527,,
2025-11-06,ES00000128P8,SPGB 1 1/2 04/30/27,2027-04-30,1.1629498353203471,NO ACTION,0.25363668591806254,0.9942647783120753,0.5262849128149564,-0.5888108180346889,0.42440654409333206,-8.488166602131269,,
2025-11-06,ES00000128Q6,SPGB 2.35 07/30/33,2033-07-30,-0.3464335028967369,MODERATE SELL,-1.5112461477167471,0.9992644696793113,-1.120122060072411,0.009616900800619525,-1.3064974792424011,35.36185232085065,,
2025-11-06,ES0000012932,SPGB 4.2 01/31/37,2037-01-31,3.410212065611283,WEAK BUY,0.47501481072621277,0.9977220896213372,1.0933763794213647,1.2156056553676753,0.9123959392581608,57.87896333574247,,
2025-11-06,ES0000012A89,SPGB 1.45 10/31/27,2027-10-31,-4.824802376552832,MODERATE SELL,-1.4415392031682563,0.9962059692313922,-1.2380028628094264,-0.87998022028572,-1.4556141321504554,-10.14868470209922,,
2025-11-06,ES0000012B39,SPGB 1.4 04/30/28,2028-04-30,-5.964819861626248,STRONG SELL,-1.764286385324733,0.9975175719506788,-1.3883807141195963,-0.5412111369951955,-1.6076888854886213,-7.135908834634556,,
2025-11-06,ES0000012B47,SPGB 2.7 10/31/48,2048-10-31,-5.009032028994199,WEAK SELL,-0.7009808545174622,0.998230097158559,-0.654070101296097,-0.8520505689082802,-0.8999130129861784,88.77409180646121,,
2025-11-06,ES0000012B88,SPGB 1.4 07/30/28,2028-07-30,-2.803482895058704,WEAK SELL,-0.8692890618923904,0.9986512495393367,-0.7442352630770204,-1.2731356126319766,-1.0856825225747402,-1.944589020390961,,
2025-11-06,ES0000012E51,SPGB 1.45 04/30/29,2029-04-30,-3.028654710232537,MODERATE SELL,-0.8139196061292557,0.9977269483602986,-0.8075563839080715,-3.6305945348444024,-1.4818162849459156,3.760815253168417,,
2025-11-06,ES0000012E69,SPGB 1.85 07/30/35,2035-07-30,-0.2005220045687181,STRONG SELL,-1.4022281735627369,0.9987732669234505,-1.3441026076424587,-2.6996457645661316,-1.780175399039368,46.70027271446819,,
2025-11-06,ES0000012F43,SPGB 0.6 10/31/29,2029-10-31,-1.433814262500574,NO ACTION,0.20326292830874057,0.998259720262468,0.37125577426780026,-3.6243200968173457,0.354442172587025,9.18939422003549,,
2025-11-06,ES0000012F76,SPGB 0 1/2 04/30/30,2030-04-30,-2.549283038822221,NO ACTION,-0.5081783689062117,0.9980432632225554,-0.513911863329004,-0.13808368143236638,-0.6365972657474008,11.73225066144661,,
2025-11-06,ES0000012G00,SPGB 1 10/31/50,2050-10-31,-8.434310048035712,STRONG SELL,-1.526383686647616,0.9968601296262218,-1.501663930093942,-2.4316944060427805,-1.8431859222695344,89.45191110201606,,
2025-11-06,ES0000012G26,SPGB 0.8 07/30/27,2027-07-30,-1.954833051079266,WEAK SELL,-0.6290301629122067,0.9961718108314095,-0.9085091448181154,-0.48583516383938574,-0.8722969375282832,-9.44943417296246,,
2025-11-06,ES0000012G34,SPGB 1 1/4 10/31/30,2030-10-31,-1.5404623601657867,NO ACTION,0.13524321986056123,0.9980407046692225,0.3821817553884299,0.08773636130198317,0.3374764913011488,16.348450222975433,,
2025-11-06,ES0000012G42,SPGB 1.2 10/31/40,2040-10-31,-0.0599004590363847,MODERATE SELL,-1.1337174789072775,0.9982902629870681,-1.2191209498784632,-0.8969059616270277,-1.294134292070353,70.3534051665549,,
2025-11-06,ES0000012H41,SPGB 0.1 04/30/31,2031-04-30,-2.6867277191761474,WEAK SELL,-1.0161608039553434,0.9989611488274703,-0.8147729014951188,0.4599428976395373,-0.9623807555074121,18.644028100071218,,
2025-11-06,ES0000012H58,SPGB 1.45 10/31/2071,2071-10-31,-1.2117130386045574,NO ACTION,0.2140741663436751,0.9985358131427025,0.4002127223417562,0.2915350052998447,0.41871257155313296,116.20867558839876,,
2025-11-06,ES0000012I08,SPGB 0 01/31/28,2028-01-31,-4.497651391022291,MODERATE SELL,-1.3489203967883732,0.9926561698519495,-1.3098830130854473,-0.02438941198317726,-1.2801120629881924,-7.706706096971789,,
2025-11-06,ES0000012I24,SPGB 0.85 07/30/37,2037-07-30,3.5360195375959123,NO ACTION,0.5333387241501393,0.9981899062794612,1.049422541192987,0.401665870449357,0.7895929936171782,60.32506948658708,,
2025-11-06,ES0000012I32,SPGB 0 1/2 10/31/31,2031-10-31,-2.2655115069466483,NO ACTION,-0.6626832352070543,0.9986040162364804,-0.7547440328202648,0.36601568016250147,-0.762095552585425,22.45867201616274,,
2025-11-06,ES0000012J07,SPGB 1 07/30/42,2042-07-30,-1.3931268248331747,STRONG SELL,-1.7517966589954728,0.9979948814284014,-1.632556770838513,0.4669663859907745,-1.5781434857398549,75.22309980256885,,
2025-11-06,ES0000012J15,SPGB 0 01/31/27,2027-01-31,3.076503515391284,WEAK BUY,0.7953775506279386,0.988933002476817,1.0410039591423847,0.7221409767363446,0.9765008244087463,-8.715244427088955,,
2025-11-06,ES0000012K20,SPGB 0.7 04/30/32,2032-04-30,-1.43147339758438,NO ACTION,0.037227534087279864,0.9983921445171854,0.46127016164006457,0.8893528177513947,0.44785315822882316,26.547559796511223,,
2025-11-06,ES0000012K46,SPGB 1.9 10/31/52,2052-10-31,-3.230389331592363,NO ACTION,-0.27237426795083186,0.9981281784599857,-0.7342263208254945,-0.4849070429682382,-0.637750961965915,98.21824302894952,,
2025-11-06,ES0000012K53,SPGB 0.8 07/30/29,2029-07-30,0.7061133072515684,MODERATE BUY,1.5680997381662574,0.9979078090614989,1.5639804860974647,0.26728382452961563,1.4499217032457612,9.406284979447394,,
2025-11-06,ES0000012K61,SPGB 2.55 10/31/32,2032-10-31,-0.3439424523998973,WEAK BUY,0.9498652324503484,0.9989220822738978,0.8452946458973231,0.9110713639698539,1.0345071549864537,30.825774612305867,,
2025-11-06,ES0000012K95,SPGB 3.45 07/30/43,2043-07-30,3.2805446551906385,NO ACTION,0.4149014430543593,0.99740382445081,0.956330703561793,0.365450169008099,0.6951358158142674,83.14417945061821,,
2025-11-06,ES0000012L29,SPGB 2.8 05/31/26,2026-05-31,6.302499406316191,MODERATE BUY,1.7086802824516831,0.9925237679454408,1.4795117053998486,0.22227959492907898,1.4897034590798792,-11.546511962461278,,
2025-11-06,ES0000012L52,SPGB 3.15 04/30/33,2033-04-30,0.8149635057957951,NO ACTION,-0.6435067952528828,0.999580392253137,-0.5883386553293606,0.3491487378127247,-0.7044869297444536,35.02803786484502,,
2025-11-06,ES0000012L60,SPGB 3.9 07/30/39,2039-07-30,4.495597023512161,WEAK BUY,0.9781955623748688,0.9984563559425736,1.1075016695695659,-0.03345028954712564,0.9672988293045091,69.9834997663316,,
2025-11-06,ES0000012L78,SPGB 3.55 10/31/33,2033-10-31,2.428103783042104,NO ACTION,0.5617531538724633,0.9994523462275986,0.9489985234146784,0.45317867331963096,0.7845282571803832,39.6408043137682,,
2025-11-06,ES0000012M51,SPGB 3 1/2 05/31/29,2029-05-31,-0.1567211579725196,WEAK BUY,1.0177875427455687,0.9977450680012002,1.0792221736331464,0.23165737866151645,1.0195061222945254,7.286896337142107,,
2025-11-06,ES0000012M77,SPGB 2 1/2 05/31/27,2027-05-31,1.4656274480628584,NO ACTION,0.33932690373801444,0.9931125122480955,1.0188566442923828,0.6607907684137952,0.7242141043348094,-7.447215665706353,,
2025-11-06,ES0000012M85,SPGB 3 1/4 04/30/34,2034-04-30,3.017977635141172,WEAK BUY,1.002478203639936,0.9997374297596167,1.3620295254144932,0.19136944204124312,1.0862982244381345,43.09133933229378,,
2025-11-06,ES0000012M93,SPGB 4 10/31/54,2054-10-31,3.802097624162897,MODERATE BUY,1.4222720112504843,0.9972749202959763,1.5807536227100605,0.6361276688906621,1.4427930741397346,108.32352942645116,,
2025-11-06,ES0000012N35,SPGB 3.45 10/31/34,2034-10-31,3.123480573212745,WEAK BUY,1.0813048671150947,0.9990643343620661,1.2751566157897671,0.324808518724776,1.1250250542169498,46.0159326424261,,
2025-11-06,ES0000012N43,SPGB 3.1 07/30/31,2031-07-30,0.6298045313185696,STRONG BUY,1.767017341954737,0.9991625746714996,1.5690324614889692,0.6042530783215708,1.6126906900242564,23.65193558340224,,
2025-11-06,ES0000012O00,SPGB 2.7 01/31/30,2030-01-31,0.2947340081021163,MODERATE BUY,1.305723750198781,0.9987150366404213,1.2337680079114504,0.9516860299683615,1.3373818246717004,12.791218273248544,,
2025-11-06,ES0000012O59,SPGB 2.4 05/31/28,2028-05-31,-0.394633058142836,NO ACTION,-0.18732627861752058,0.9972614180025977,-0.6058718601938264,0.6553079961153443,-0.4730072975766886,-0.8707522923839449,,
2025-11-06,ES0000012O67,SPGB 3.15 04/30/35,2035-04-30,2.8961371128227142,WEAK BUY,0.9114448919048727,0.9989341554465206,0.7482847390438542,0.5049296830371738,0.9166529999299774,48.47662383708686,,
2025-11-06,ES0000012O75,SPGB 3 1/2 01/31/41,2041-01-31,6.185553733753423,STRONG BUY,1.761653709203679,0.9986799726138985,1.412010209183513,1.1251988137951172,1.6545595020200237,77.53884611751607,,
2025-11-06,EU000A18Z2D4,EU 0 3/4 04/04/31,2031-04-04,-1.323588970482298,WEAK SELL,-0.3849901295626985,0.9965466738869466,-0.8789408374980905,-1.3043004395018143,-0.8787565670872145,15.82132043554192,,
2025-11-06,EU000A19XC51,EU 1 1/4 04/04/33,2033-04-04,3.7019541354068863,MODERATE BUY,1.415522660427581,0.996198762939972,1.534102368348688,-1.7644621700946164,1.3159446404147632,32.137993980239585,,
2025-11-06,EU000A1G1Q17,EU 3 3/8 04/04/32,2032-04-04,7.928747100941873,STRONG BUY,2.33020017948838,0.9962220519318398,1.6241993718352858,0.18208855658838963,1.8467151797319168,30.87483945789438,,
2025-11-06,EU000A1G30R0,EU 3 3/8 04/04/38,2038-04-04,3.1846311801215776,NO ACTION,0.37285582081849067,0.9949974931550755,0.9070088833045843,-0.50303891564111,0.5957217565785532,55.065464902920304,,
2025-11-06,EU000A1G6TV9,EU 2 7/8 04/04/28,2028-04-04,-0.1456519137965806,NO ACTION,-0.1439314825951448,0.9956909685430804,-0.8281773660457588,-0.40305244133411644,-0.5837414451377597,-2.256690326803568,,
2025-11-06,EU000A1GVVF8,EU 3 09/04/26,2026-09-04,1.7302502737633976,WEAK BUY,0.6638308173328605,0.9969921600179292,1.1198775634967517,0.05358973871269556,0.8171343174219484,-11.786331430779263,,
2025-11-06,EU000A1GY6W8,EU 3 3/4 04/04/42,2042-04-04,12.77927834235402,STRONG BUY,2.598504481845058,0.9894561006430752,1.437478691829729,-0.398308509954167,1.8993137350942817,79.22332489488542,,
2025-11-06,EU000A1HBXS7,EU 2 1/2 11/04/27,2027-11-04,2.9242903113922534,WEAK BUY,1.1779837051525348,0.9820517787667723,1.2027167413391355,0.2387124622277295,1.1364459717477613,-2.0990482374315445,,
2025-11-06,EU000A1Z6TV6,EU 1 1/2 10/04/35,2035-10-04,5.093265160803817,STRONG BUY,1.9112710978508685,0.9864984937835548,1.4270607998122518,0.7237069738212063,1.664957008551259,46.04852533131504,,
2025-11-06,EU000A1ZR7H3,EU 1 3/8 10/04/29,2029-10-04,2.085696537260373,MODERATE BUY,1.5433346134477819,0.9924761235377308,1.4404817875857587,0.7043616816712802,1.476064146651661,9.979912310110576,,
2025-11-06,EU000A283859,EU 0 10/04/30,2030-10-04,-2.04920469465446,WEAK SELL,-0.8519370966470727,0.9938643040500335,-1.1954349098989963,0.916065441432547,-0.9859608952100062,12.096630390723366,,
2025-11-06,EU000A283867,EU 0.1 10/04/40,2040-10-04,-5.239664127178948,STRONG SELL,-1.5813089602054369,0.9931909490397411,-1.5958628236572077,-0.13747696484512137,-1.5022372816673797,56.14342909604243,,
2025-11-06,EU000A284469,EU 0.3 11/04/50,2050-11-04,-16.5918839258822,STRONG SELL,-1.9424397875364683,0.9854325999112677,-1.6926930404620006,1.3139332020779988,-1.6919465896554786,71.29619394294811,,
2025-11-06,EU000A285VM2,EU 0 07/04/35,2035-07-04,-4.339018923726513,STRONG SELL,-1.449616590726469,0.9972026413244319,-1.1135953870400501,-3.100085984650811,-1.807238577613347,35.42973422131824,,
2025-11-06,EU000A287074,EU 0 06/02/28,2028-06-02,-6.104546296005192,STRONG SELL,-2.709827648781582,0.9965569496847788,-1.5942683326505676,-0.4453473434217424,-2.139604941790086,-7.101493985040064,,
2025-11-06,EU000A28X702,EU 0 1/8 06/10/35,2035-06-10,-0.3571315376791091,WEAK SELL,-0.030800514669479563,0.9895912481361158,-0.9802818941455025,-2.437925048997276,-0.9189575897848004,39.09941760555114,,
2025-11-06,EU000A3K4C42,EU 0.4 02/04/37,2037-02-04,-7.212802903584368,STRONG SELL,-2.039013511657074,0.9921805238878392,-1.5622091494833819,0.3604856668234106,-1.705576156789144,39.78175944081007,,
2025-11-06,EU000A3K4D09,EU 2 3/4 12/04/37,2037-12-04,0.6137733967957999,NO ACTION,-0.22350026048397328,0.9928520273776488,-0.42590504753504815,-1.2024782197754902,-0.6466890033051844,51.13233824154162,,
2025-11-06,EU000A3K4D41,EU 3 1/4 07/04/34,2034-07-04,-1.5131258182603062,NO ACTION,-0.44270148275452004,0.9951222248719209,-0.7035509575733981,0.009616900800619525,-0.6329101541482397,33.38555174926904,,
2025-11-06,EU000A3K4D74,EU 3 3/8 10/04/38,2038-10-04,3.396373634495667,NO ACTION,0.42197324036417405,0.9913968369798649,1.135359823322884,0.3133336742015478,0.7402491997455914,57.28983622503555,,
2025-11-06,EU000A3K4D82,EU 2 3/4 10/05/26,2026-10-05,2.5624592377154176,WEAK BUY,1.0221794728227103,0.9951291060781357,1.2794216726922438,0.7540110207078252,1.1690214020806224,-10.319258162923392,,
2025-11-06,EU000A3K4DA4,EU 0 1/4 10/22/26,2026-10-22,2.7706509124602743,WEAK BUY,1.1118266767830138,0.9924366558939945,0.9725337889854866,-0.3777442030743002,0.9966172184367382,-9.764051453879144,,
2025-11-06,EU000A3K4DD8,EU 1 07/06/32,2032-07-06,-3.0899879221974054,WEAK SELL,-0.903357521169627,0.9940755865298166,-0.7486862062367474,0.0709342857456845,-0.884146491476047,21.28242670340729,,
2025-11-06,EU000A3K4DE6,EU 1 1/8 06/04/37,2037-06-04,-2.0402614455612564,WEAK SELL,-0.8391507365599934,0.998308031578716,-0.8890571806982498,0.008991346901537599,-0.8920078281452627,46.369438192017206,,
2025-11-06,EU000A3K4DG1,EU 1 1/4 02/04/43,2043-02-04,-0.0731951170334213,NO ACTION,-0.3828547971458162,0.9906178894839107,-0.6238635844928442,1.4344599151599051,-0.5782412794724526,69.01140716322958,,
2025-11-06,EU000A3K4DM9,EU 2 5/8 02/04/48,2048-02-04,0.8148357824004364,WEAK BUY,0.4434177573879792,0.9951229893822857,0.3975442218487782,2.0436765241763033,0.8383715726940111,83.0964257936843,,
2025-11-06,EU000A3K4DS6,EU 2 10/04/27,2027-10-04,0.5072309139701483,NO ACTION,0.13719945164952288,0.994493463278844,0.6716314427622049,1.3451064247738662,0.6380510769443187,-5.117579011590812,,
2025-11-06,EU000A3K4DT4,EU 2 1/2 10/04/52,2052-10-04,4.233629688904173,WEAK BUY,0.9120158260115832,0.9987697529484533,0.9295424284890964,0.9255464111948499,1.0416134359942135,95.43112426730175,,
2025-11-06,EU000A3K4DV0,EU 3 3/8 11/04/42,2042-11-04,4.312748635736824,WEAK BUY,0.6345426824733981,0.9934963309715921,1.1791360369054442,1.0161553144083517,0.9844880212339118,72.61740829524601,,
2025-11-06,EU000A3K4DW8,EU 2 3/4 02/04/33,2033-02-04,-3.1953338814192698,WEAK SELL,-1.0421016193947015,0.9943299840702626,-1.0527114415818424,0.3607375576564319,-1.0434300340792269,24.37276693803315,,
2025-11-06,EU000A3K4DY4,EU 3 03/04/53,2053-03-04,4.945883519887261,WEAK BUY,1.0096411227378668,0.9989660542337948,0.9638590969804498,-0.06097368873498815,0.942357527282688,96.79743648900374,,
2025-11-06,EU000A3K4EL9,EU 4 04/04/44,2044-04-04,6.2748101559664775,MODERATE BUY,1.0896776677952362,0.9931298453136999,1.4892314912512066,1.202975159167628,1.3414084751425568,78.81115176595672,,
2025-11-06,EU000A3K4EN5,EU 3 1/8 12/05/28,2028-12-05,0.6380747186146651,WEAK BUY,0.7047541021758386,0.997238131869142,1.0633805337096627,-0.30078009238124626,0.8128665551659148,3.094419912632042,,
2025-11-06,EU000A3K4ES4,EU 3 12/04/34,2034-12-04,-1.6856204664443697,WEAK SELL,-0.50416434097972,0.9931800788759584,-0.6447179571535242,-1.6222370746508723,-0.9273633420302584,35.28650376847951,,
2025-11-06,EU000A3K4EU0,EU 3 1/4 02/04/50,2050-02-04,3.070704292366827,WEAK BUY,0.752619088544003,0.9949581532243976,0.5418497887554222,1.4404345224210717,0.9358032102025619,89.53860034010224,,
2025-11-06,EU000A3K4EW6,EU 2 7/8 12/06/27,2027-12-06,1.087112343420208,NO ACTION,0.3868960297783563,0.9967204536484128,0.7599398073734784,0.10117531413902045,0.5784516520932957,-3.318035409733617,,
2025-11-06,EU000A3K4EY2,EU 3 3/8 10/05/54,2054-10-05,7.645945202099782,STRONG BUY,1.379725931606413,0.998235044345073,1.4338291249790387,1.6475608158492894,1.5531949345958418,101.82367732343612,,
2025-11-06,EU000A3K7MW2,EU 1 5/8 12/04/29,2029-12-04,-0.8800339348931079,NO ACTION,-0.17465812719763837,0.9982874053168911,-0.7871543344733686,1.5885233536985282,-0.5187565100361369,8.081395452637247,,
2025-11-06,EU000A3KM903,EU 0.2 06/04/36,2036-06-04,-1.875946166880084,MODERATE SELL,-0.801034891985479,0.9958233849359361,-0.8917545968312448,-2.4357809461132525,-1.2928833712723538,42.1482916742645,,
2025-11-06,EU000A3KNYF7,EU 0 03/04/26,2026-03-04,-3.245327103679447,MODERATE SELL,-1.4786496662048683,0.9692796293389637,-1.456177562944675,0.2004818885173498,-1.3810875132398903,-20.58571233700235,,
2025-11-06,EU000A3KNYG5,EU 0.45 05/02/46,2046-05-02,-6.111923126054577,NO ACTION,-0.5060006442736698,0.9901345457769286,-0.7858841117154882,0.6765999009007149,-0.6884891594123524,71.99369104346859,,
2025-11-06,EU000A3KP2Z3,EU 0 1/4 04/22/36,2036-04-22,0.5956140414763524,NO ACTION,-0.2277126451781104,0.9951671209912359,-0.3038046267584398,0.009616900800619525,-0.4066881842795608,44.08712152530575,,
2025-11-06,EU000A3KRJQ6,EU 0 07/04/29,2029-07-04,-3.4731803359605835,STRONG SELL,-1.6768198152858496,0.9938459097252271,-1.3170540918096112,-0.8475506995615963,-1.594125991250505,2.794149288680925,,
2025-11-06,EU000A3KRJR4,EU 0 3/4 01/04/47,2047-01-04,-9.955970342616157,WEAK SELL,-1.032886192405709,0.988697032720964,-1.456439869107684,1.1140151504632407,-1.1537836901540715,69.81095365269992,,
2025-11-06,EU000A3KSXE1,EU 0 07/04/31,2031-07-04,-3.881191564146549,MODERATE SELL,-1.1355441218856515,0.996752182725217,-1.3027284575841505,-1.582563534903061,-1.4371563829372298,14.734477062206867,,
2025-11-06,EU000A3KT6A3,EU 0 04/22/31,2031-04-22,1.5425211028890151,NO ACTION,0.4560984599370138,0.9880642279623976,0.755800740045361,0.3033767704578688,0.646474288071626,18.97986043354045,,
2025-11-06,EU000A3KT6B1,EU 0.45 07/04/41,2041-07-04,-2.024017706696249,WEAK SELL,-0.835382713094026,0.9906758158758961,-1.1018804220275338,0.5357928414535572,-0.9499397603026793,61.94080845464382,,
2025-11-06,EU000A3KTGV8,EU 0 07/06/26,2026-07-06,1.3485707113690903,NO ACTION,0.49947983826813636,0.9946461062379369,0.6984238486406181,0.031879993457098785,0.6067224057974754,-13.40441528291879,,
2025-11-06,EU000A3KTGW6,EU 0.7 07/06/51,2051-07-06,-9.833451453298297,WEAK SELL,-1.0160931020719979,0.9947084589098316,-0.850180102695677,0.7687627113969127,-0.9717936118368703,79.26129949763629,,
2025-11-06,EU000A3KWCF4,EU 0 10/04/28,2028-10-04,-1.5413753162934216,WEAK SELL,-0.7449291002431294,0.9969592646958227,-1.0065786033379136,-0.3560745623448306,-0.9382351237758334,-0.2262554710822964,,
2025-11-06,EU000A3L1CN4,EU 2 7/8 10/05/29,2029-10-05,0.2074934092186779,NO ACTION,0.45532632350694036,0.9972119101331943,0.876178614838112,-0.09766855084421097,0.6299254694907156,8.119278045687125,,
2025-11-06,EU000A3L1DJ0,EU 2 1/2 12/04/31,2031-12-04,-0.2300899031944894,NO ACTION,-0.06409192098744103,0.9963411467039871,-0.5715159490481644,-0.3058543887792403,-0.45195305450437034,20.815846854498872,,
2025-11-06,EU000A3LNF05,EU 3 1/8 12/04/30,2030-12-04,-1.0282329041443994,NO ACTION,-0.2983149458199759,0.9984935974435161,-0.7227922506017129,-1.1441431700264741,-0.7616943935961245,14.13140590729348,,
2025-11-06,EU000A3LZ0X9,EU 3 3/8 10/04/39,2039-10-04,5.114953548539596,WEAK BUY,0.8206283466837949,0.9929739204147843,1.2696461209637107,-1.3958842595195093,0.9314213220411467,62.85571364081168,,
2025-11-06,EU000A4D5QM6,EU 2 5/8 07/04/28,2028-07-04,0.3696144896176268,NO ACTION,0.07794190603758946,0.998153544372603,0.39745954033158626,0.6368574407824598,0.4069723826287606,-0.0268680365681266,,
2025-11-06,EU000A4D8KD2,EU 3 3/8 12/12/35,2035-12-12,0.3939893290856204,NO ACTION,-0.2744830749369768,0.9943194553609197,-0.3238844733472414,-1.2033312191965497,-0.644141451304199,42.2285102142339,,
2025-11-06,EU000A4EA8Y7,EU 3 3/4 10/12/45,2045-10-12,7.036043938229568,MODERATE BUY,1.2662593512667344,0.9937560885677363,1.201644797255656,0.9416599113941932,1.305132104779845,83.72818615613146,,
2025-11-06,EU000A4ED0K0,EU 2 3/4 12/13/32,2032-12-13,0.1294887237812432,NO ACTION,0.14259079024644086,0.9930099095219626,0.42030083054199124,0.009616900800619525,0.33789475888741854,26.911573675209468,,
2025-11-06,FI4000037635,RFGB 2 3/4 07/04/28,2028-07-04,-8.541700762040486,MODERATE SELL,-1.7089548639632561,0.995052781317799,-1.3376358312929897,0.009616900800619525,-1.4706537550359762,-10.91232286175554,,
2025-11-06,FI4000046545,RFGB 2 5/8 07/04/42,2042-07-04,-1.0098141058199277,WEAK SELL,-0.654527947122478,0.9992610029094063,-1.2624407094293297,0.009616900800619525,-0.903980116936087,53.00395724987602,,
2025-11-06,FI4000148630,RFGB 0 3/4 04/15/31,2031-04-15,-1.7503664668325314,NO ACTION,0.0,0.9979523402139014,0.00043541048392272997,0.009616900800619525,0.14420596899246327,12.64815432570014,,
2025-11-06,FI4000197959,RFGB 0 1/2 04/15/26,2026-04-15,7.667785759415933,MODERATE BUY,1.7820822028999146,0.9948890476255855,1.2444461406890788,0.009616900800619525,1.4238179249324752,-11.088677479325076,,
2025-11-06,FI4000242870,RFGB 1 3/8 04/15/47,2047-04-15,-1.597987742021374,NO ACTION,0.0,0.9983184355970421,0.00043541048392272997,0.009616900800619525,0.14426913326779822,60.94584657907868,,
2025-11-06,FI4000278551,RFGB 0 1/2 09/15/27,2027-09-15,-1.3679194475731098,NO ACTION,-0.16393760229827528,0.9954376019786949,-0.2769089507371092,0.009616900800619525,-0.36599048946101775,-9.322504396463694,,
2025-11-06,FI4000306758,RFGB 1 1/8 04/15/34,2034-04-15,2.232207995270418,NO ACTION,0.0,0.998451661696855,0.00043541048392272997,0.009616900800619525,0.14429211943598802,30.96485622853974,,
2025-11-06,FI4000348727,RFGB 0 1/2 09/15/28,2028-09-15,-1.9298455997268704,NO ACTION,-0.28495963611852454,0.9954279672249209,-0.4064592796237575,0.009616900800619525,-0.4658837268937623,-2.9646531671058773,,
2025-11-06,FI4000369467,RFGB 0 1/2 09/15/29,2029-09-15,-1.7761165642771035,NO ACTION,0.0,0.999094487115816,0.00043541048392272997,0.009616900800619525,0.1444030293344064,3.553815221688733,,
2025-11-06,FI4000415153,RFGB 0 1/8 04/15/36,2036-04-15,4.692454641045572,STRONG BUY,2.0732894287566213,0.9979738302898945,1.6987521534100014,0.009616900800619525,1.7057199914009094,41.21831465876929,,
2025-11-06,FI4000440557,RFGB 0 1/4 09/15/40,2040-09-15,-0.6471839824491568,NO ACTION,-0.48105510754582315,0.9996970368825775,-0.5604846323817594,0.009616900800619525,-0.6124115805427803,49.1842488878404,,
2025-11-06,FI4000441878,RFGB 0 09/15/30,2030-09-15,-0.55553202402265,NO ACTION,0.0,0.9957489467665097,0.00043541048392272997,0.009616900800619525,0.1438258064534322,10.644964416044822,,
2025-11-06,FI4000480488,RFGB 0 1/8 04/15/52,2052-04-15,-7.016371794332635,NO ACTION,0.0,0.998003575311308,0.00043541048392272997,0.009616900800619525,0.14421480884117055,61.48766132124718,,
2025-11-06,FI4000507231,RFGB 0 1/8 09/15/31,2031-09-15,-0.6335522288946667,NO ACTION,0.0,0.9982413522577165,0.00043541048392272997,0.009616900800619525,0.144255833692078,15.981360113866945,,
2025-11-06,FI4000511449,RFGB 0 09/15/26,2026-09-15,2.286597298927948,NO ACTION,0.6231356591908912,0.993380284771253,0.568198133019292,0.009616900800619525,0.6292202290403616,-13.149699662696497,,
2025-11-06,FI4000517677,RFGB 0 1/2 04/15/43,2043-04-15,-1.5791224347370445,WEAK SELL,-0.9268702762535737,0.9976744872795551,-0.9536588513014732,0.009616900800619525,-0.9558793491508081,54.065724657915474,,
2025-11-06,FI4000523238,RFGB 1 1/2 09/15/32,2032-09-15,0.9067995036435724,NO ACTION,0.0,0.9981705908447491,0.00043541048392272997,0.009616900800619525,0.14424362487006717,22.52822154295016,,
2025-11-06,FI4000527551,RFGB 1 3/8 04/15/27,2027-04-15,-1.7552907550632837,NO ACTION,-0.24736575971074976,0.9960509797848937,-0.31209102302610814,0.009616900800619525,-0.41939605519520057,-12.772734169834612,,
2025-11-06,FI4000546528,RFGB 2 3/4 04/15/38,2038-04-15,1.698941494890569,NO ACTION,0.6412704311439973,0.9972820323650226,1.0705640048509764,0.009616900800619525,0.7837395790864111,44.83858572220194,,
2025-11-06,FI4000550249,RFGB 3 09/15/33,2033-09-15,1.532174588937302,NO ACTION,0.0,0.998237480439436,0.00043541048392272997,0.009616900800619525,0.1442551656678221,27.757330143970616,,
2025-11-06,FI4000557525,RFGB 2 7/8 04/15/29,2029-04-15,-0.1984470456336877,NO ACTION,0.0,0.9949198620494194,0.00043541048392272997,0.009616900800619525,0.14368276030273497,2.525980325872072,,
2025-11-06,FI4000566294,RFGB 2.95 04/15/55,2055-04-15,6.840334900337481,NO ACTION,0.0,0.9969178276823146,0.00043541048392272997,0.009616900800619525,0.1440274793490757,77.89057382686786,,
2025-11-06,FI4000571104,RFGB 3 09/15/34,2034-09-15,2.3143868812108934,NO ACTION,0.0,0.9983653035639909,0.00043541048392272997,0.009616900800619525,0.14427721963355175,32.784664434785256,,
2025-11-06,FI4000577952,RFGB 2 1/2 04/15/30,2030-04-15,-1.5806153360386537,NO ACTION,0.0,0.9980023901228446,0.00043541048392272997,0.009616900800619525,0.14421460435465183,7.216718723646889,,
2025-11-06,FI4000586284,RFGB 3.2 04/15/45,2045-04-15,-1.0047523384427564,NO ACTION,-0.6521065289787442,0.9987341475936938,-0.49225611435928734,0.009616900800619525,-0.6811628496499688,58.37546673911303,,
2025-11-06,FI4000587415,RFGB 3 09/15/35,2035-09-15,1.8915007803709472,NO ACTION,0.0,0.9991117485661836,0.00043541048392272997,0.009616900800619525,0.14440600753914187,36.27591756832287,,
2025-11-06,FI4000591862,RFGB 2 5/8 04/15/32,2032-04-15,0.8814269483188824,NO ACTION,0.0,0.9986382995679298,0.00043541048392272997,0.009616900800619525,0.14432432100535875,20.459304717441,,
2025-11-06,FR0000187635,FRTR 5 3/4 10/25/32,2032-10-25,1.246517570831692,STRONG BUY,1.433278510323431,0.9971650718612283,1.5177072004591687,1.1026672892365423,1.5108360387379338,51.190853468393975,,
2025-11-06,FR0000571218,FRTR 5 1/2 04/25/29,2029-04-25,-0.8449006496945302,WEAK BUY,1.2627653910188126,0.9922150462208081,1.2582471625885208,-1.8446587772956664,1.1568648990410582,18.308823030313185,,
2025-11-06,FR0010070060,FRTR 4 3/4 04/25/35,2035-04-25,3.447414611132004,WEAK SELL,-0.6306458233401974,0.9978035661580202,-0.8007674047127012,-1.073067010435367,-0.9437507672944949,71.50899548999234,,
2025-11-06,FR0010171975,FRTR 4 04/25/55,2055-04-25,1.3287101011764548,NO ACTION,0.2677742367595397,0.9962623493749474,0.3218389454791078,0.47961720831002547,0.45602947963974144,136.76567224270963,,
2025-11-06,FR0010371401,FRTR 4 10/25/38,2038-10-25,2.0578701435227345,WEAK BUY,0.746892454758027,0.9982189429697413,1.0106631911533397,0.835835544990681,0.9638983960858175,90.90100072718636,,
2025-11-06,FR0010773192,FRTR 4 1/2 04/25/41,2041-04-25,-0.5913123934751496,NO ACTION,0.05785229851829762,0.9983209365446539,0.5172611677268599,-0.2641133616441535,0.3211725286794181,100.20575968930554,,
2025-11-06,FR0010870956,FRTR 4 04/25/60,2060-04-25,8.940840308702946,STRONG BUY,1.7432361171135333,0.9961244844329443,1.5338503891999702,0.8952620015210732,1.6399495623617337,147.50670528885007,,
2025-11-06,FR0010916924,FRTR 3 1/2 04/25/26,2026-04-25,3.5964157322128525,MODERATE BUY,1.303770548562622,0.9909906311362097,1.415366488828319,0.9331201003472046,1.3840549974867222,-9.39844366913582,,
2025-11-06,FR0011317783,FRTR 2 3/4 10/25/27,2027-10-25,-3.1447577152905053,WEAK SELL,-0.9060591392735872,0.9967535470138094,-0.9375301203806797,-0.7167070659633362,-1.0639676231916284,0.6526945550705399,,
2025-11-06,FR0011461037,FRTR 3 1/4 05/25/45,2045-05-25,-5.287788527669903,MODERATE SELL,-1.163679477449429,0.9991163100493794,-1.3844213368401546,1.2976002166140208,-1.202571115856789,110.65420860459338,,
2025-11-06,FR0011883966,FRTR 2 1/2 05/25/30,2030-05-25,-2.9254845239462703,MODERATE SELL,-1.424523922767085,0.9985499917121393,-1.4549073401867945,-0.14065063951691403,-1.3820238148542514,26.46163063012365,,
2025-11-06,FR0012993103,FRTR 1 1/2 05/25/31,2031-05-25,-1.6787535701700094,WEAK SELL,-1.1228185439694127,0.9977509016579822,-1.3728571462362973,0.7502153567376695,-1.1778603289815865,36.5764266719594,,
2025-11-06,FR0013131877,FRTR 0 1/2 05/25/26,2026-05-25,2.7333666619204884,MODERATE BUY,1.0208537133196647,0.986108897710272,1.2292819529031316,1.1608944380107187,1.2225624239545894,-9.30333166183306,,
2025-11-06,FR0013154028,FRTR 1 3/4 05/25/66,2066-05-25,8.05743877938383,MODERATE BUY,1.5720060874080488,0.9959816585686999,1.2781122072800548,-0.42660964603232915,1.3232916834452777,146.31639979557266,,
2025-11-06,FR0013154044,FRTR 1 1/4 05/25/36,2036-05-25,5.415242199427297,MODERATE BUY,1.620129437732005,0.9953077122118614,1.3136536596664052,-2.7516168422083807,1.3583045363263888,80.45554665289912,,
2025-11-06,FR0013200813,FRTR 0 1/4 11/25/26,2026-11-25,0.0158691778743564,NO ACTION,0.1300285975396487,0.9868114109731073,0.5959137739753843,-0.9660264928592048,0.3791627660213424,-6.244008700535239,,
2025-11-06,FR0013234333,FRTR 1 3/4 06/25/39,2039-06-25,-1.833663662249464,NO ACTION,-0.2652775350759373,0.9971659476860224,-1.0456498292091707,0.6006772776416685,-0.639800627705457,90.40976613839824,,
2025-11-06,FR0013250560,FRTR 1 05/25/27,2027-05-25,-3.381441208331076,WEAK SELL,-0.9836465524465172,0.9941098440969756,-1.100554433392478,1.21636035808367,-1.0268930660875202,-4.123508540478834,,
2025-11-06,FR0013257524,FRTR 2 05/25/48,2048-05-25,-4.469981493561463,WEAK SELL,-0.8561881982899046,0.9964860291979897,-0.733383636459291,0.4947646527331277,-0.8557469145928052,119.65101244138474,,
2025-11-06,FR0013286192,FRTR 0 3/4 05/25/28,2028-05-25,-3.254289766983054,WEAK SELL,-0.941964932454068,0.9973075673124261,-1.1427093057312399,0.47954719691318415,-1.017992153993544,6.677030460492541,,
2025-11-06,FR0013313582,FRTR 1 1/4 05/25/34,2034-05-25,4.458267724909035,NO ACTION,0.40020037873046116,0.9984998127185744,0.5410277584178022,1.419643301885745,0.7501769645215924,66.20696716061136,,
2025-11-06,FR0013341682,FRTR 0 3/4 11/25/28,2028-11-25,-1.94558164360987,NO ACTION,-0.15887798007560774,0.9981569285796115,-0.6901258389941747,-0.4273537049824995,-0.5563982392331857,13.114375675928557,,
2025-11-06,FR0013404969,FRTR 1 1/2 05/25/50,2050-05-25,-3.2374356136444646,NO ACTION,-0.6172833960826609,0.9987489423291821,-0.47539416542378266,0.09861004897376713,-0.658291977581082,125.14153289430304,,
2025-11-06,FR0013407236,FRTR 0 1/2 05/25/29,2029-05-25,-1.618524483639746,NO ACTION,0.2635501766844579,0.9975554056187942,0.4774402006180247,-0.935845036367554,0.4160598597217115,18.336371279989784,,
2025-11-06,FR0013451507,FRTR 0 11/25/29,2029-11-25,-3.113231404021537,MODERATE SELL,-1.6670184411408542,0.9972339594827554,-1.4431283476856696,0.7163797051357584,-1.479658835866933,21.668718574003822,,
2025-11-06,FR0013480613,FRTR 0 3/4 05/25/52,2052-05-25,-5.562715530510914,WEAK SELL,-1.0679932217103,0.9975893258032174,-0.6877382332899312,-1.0177588841068357,-1.1280419602619791,126.23516175755591,,
2025-11-06,FR0013508470,FRTR 0 02/25/26,2026-02-25,7.280356870028331,STRONG BUY,2.51140636419362,0.9832284372595692,1.6225449841457538,-0.7330624414355662,1.9063741795194908,-7.612363693581452,,
2025-11-06,FR0013515806,FRTR 0 1/2 05/25/40,2040-05-25,-1.2111494325180132,NO ACTION,-0.10336445580519164,0.9963777060545886,-0.36777428408701046,0.9456179869687918,-0.36092880996955606,95.4559734633191,,
2025-11-06,FR0013516549,FRTR 0 11/25/30,2030-11-25,-2.131191451293269,MODERATE SELL,-1.5181580114738324,0.9983014325356959,-1.2163822256883017,0.009616900800619525,-1.337589353796867,31.795256515175083,,
2025-11-06,FR0014001NN8,FRTR 0 1/2 05/25/2072,2072-05-25,-8.990933236477048,STRONG SELL,-1.732485867633034,0.9954633951804663,-1.6958200603895306,1.3844288211419726,-1.585903240733918,125.78156080714058,,
2025-11-06,FR0014002JM6,FRTR 0 1/2 06/25/44,2044-06-25,-9.695447682917589,STRONG SELL,-2.3100912896097947,0.9970890054017428,-1.711678223535881,0.274276600635488,-1.8897153572257683,103.2830285271988,,
2025-11-06,FR0014002WK3,FRTR 0 11/25/31,2031-11-25,-0.6246021472156826,WEAK SELL,-0.20170278508304787,0.9980810906297347,-0.6739661270305063,-2.112358234367082,-0.8646269253799568,41.89545730042168,,
2025-11-06,FR0014003513,FRTR 0 02/25/27,2027-02-25,-1.94258823242388,NO ACTION,-0.5119749588653144,0.9911601889659649,-0.8176933811368146,0.6532506953397897,-0.7009054760156727,-5.3776447411013,,
2025-11-06,FR0014004J31,FRTR 0 3/4 05/25/53,2053-05-25,-3.810873109479616,WEAK SELL,-0.7284329879582506,0.9969060026268709,-0.9352561118336454,0.6003960572494589,-0.8477427505641125,129.40408847608026,,
2025-11-06,FR0014007L00,FRTR 0 05/25/32,2032-05-25,0.4010626828832215,WEAK BUY,0.6945214363782932,0.9990251823678297,0.9588050561860867,0.7927143526578436,0.9145778392891121,47.00829583751586,,
2025-11-06,FR0014009O62,FRTR 1 1/4 05/25/38,2038-05-25,4.08853813680814,MODERATE BUY,1.2750598316085526,0.9968448400918323,1.4742139470682012,-1.3657619028947718,1.2261304222650158,90.70541333245862,,
2025-11-06,FR001400AIN5,FRTR 0 3/4 02/25/28,2028-02-25,-3.2814035121168548,WEAK SELL,-0.9508531118506816,0.9979365958980466,-1.0609358757637604,0.009616900800619525,-0.999186615802441,4.084222661514682,,
2025-11-06,FR001400BKZ3,FRTR 2 11/25/32,2032-11-25,2.2376970716810405,STRONG SELL,-1.864289677353543,0.9983879928655887,-1.1961495392879826,0.009616900800619525,-1.5109457148881222,52.84735440762182,,
2025-11-06,FR001400CMX2,FRTR 2 1/2 05/25/43,2043-05-25,-2.2231334022221034,NO ACTION,-0.3665768176786025,0.9975123992963297,-0.7195454373083991,-0.852425986799951,-0.7455927141873989,106.92177903214402,,
2025-11-06,FR001400FTH3,FRTR 3 05/25/54,2054-05-25,2.231801612730237,NO ACTION,0.4428207826595807,0.9983420473403175,0.8287920770591697,-0.7341624215678657,0.6100211307687817,136.6838284411595,,
2025-11-06,FR001400FYQ4,FRTR 2 1/2 09/24/26,2026-09-24,2.015947196559263,WEAK BUY,0.7856758402782921,0.9900929958629322,1.078966063678712,-1.6254806446817134,0.8580010204033175,-6.171401237798476,,
2025-11-06,FR001400H7V7,FRTR 3 05/25/33,2033-05-25,3.3856984247571447,WEAK SELL,-0.6935826590324714,0.9981485157738823,-0.8082379668513244,-1.3344225655214805,-1.0236279177380352,57.80830754811627,,
2025-11-06,FR001400HI98,FRTR 2 3/4 02/25/29,2029-02-25,-1.1384852750345864,WEAK BUY,0.8835704755281282,0.9941789960110959,1.311968290933998,-0.7911238075275844,0.97637849900144,16.427888254388012,,
2025-11-06,FR001400L834,FRTR 3 1/2 11/25/33,2033-11-25,4.309364365870934,WEAK BUY,0.24835194491948534,0.9986615062390453,0.9023204188161477,1.6160813496973878,0.8093925154586719,62.48482883948442,,
2025-11-06,FR001400NBC6,FRTR 2 1/2 09/24/27,2027-09-24,-3.092855956410727,WEAK SELL,-0.8890451804255283,0.9964058907475444,-1.1757784708961547,-0.505351301103808,-1.0871451649358435,-0.2060650360494665,,
2025-11-06,FR001400NEF3,FRTR 3 06/25/49,2049-06-25,-5.184135678035844,WEAK SELL,-0.9946129555077187,0.9946885894784279,-1.1510948413361086,0.9520854199395495,-1.0472025031550805,121.3566284584881,,
2025-11-06,FR001400OHF4,FRTR 3 1/4 05/25/55,2055-05-25,3.657697767176643,WEAK BUY,0.7192027367082432,0.9981958040265089,1.1780640928219643,-0.39518305744366095,0.8534886911330757,139.17608440422157,,
2025-11-06,FR001400PM68,FRTR 2 3/4 02/25/30,2030-02-25,-1.1718052345897547,WEAK BUY,0.8405343007521487,0.9979851233897148,1.252771779611056,-1.8434357021693917,0.9377369946668878,25.96842802751208,,
2025-11-06,FR001400QMF9,FRTR 3 11/25/34,2034-11-25,5.014726982054171,WEAK BUY,0.9676655267496322,0.9983841361381882,1.1002913481910939,1.3032670071969115,1.1846217837765858,70.27834229527001,,
2025-11-06,FR001400WYO4,FRTR 3.6 05/25/42,2042-05-25,1.1434483045634067,WEAK BUY,0.5090555530020726,0.997962774337881,0.42565435475081387,1.8572207315147784,0.8487491403512525,106.45040751570843,,
2025-11-06,FR001400X8V5,FRTR 3.2 05/25/35,2035-05-25,5.607634974961499,MODERATE BUY,1.57230030932663,0.9974464199642774,1.3895530839047596,0.009616900800619525,1.3574017060546306,74.21595920720019,,
2025-11-06,FR001400XJJ3,FRTR 3 3/4 05/25/56,2056-05-25,6.4062555824581295,MODERATE BUY,1.251956666532922,0.9962349636186502,1.2903972234814736,0.4582530458780006,1.2402735439478276,142.83145753920547,,
2025-11-06,FR001400XLW2,FRTR 2.4 09/24/28,2028-09-24,-2.1140780794219936,NO ACTION,-0.5681911885781507,0.9975881275915253,-0.7169946647783467,0.009616900800619525,-0.7021555671084393,11.23511393520424,,
2025-11-06,FR001400Z2L7,FRTR 2.7 02/25/31,2031-02-25,0.4243609161436978,NO ACTION,0.7148793938245689,0.9982156414048321,0.9385413887428931,0.009616900800619525,0.784036823039577,36.56777616523856,,
2025-11-06,IT0001086567,BTPS 7 1/4 11/01/26,2026-11-01,-2.278725282428025,WEAK SELL,-0.5895008690859762,0.9940186631725184,-1.066851189550052,1.3786534218719528,-0.8131738806856582,-13.556162330285314,"['Issue_Age', 'Cpn', 'AMT_OUTSTANDING']","[0.5257402533419989, 0.4047945089519933, 0.04244193570693805]"
2025-11-06,IT0001174611,BTPS 6 1/2 11/01/27,2027-11-01,-0.2815272950993053,NO ACTION,-0.10060280641653382,0.9930674070388255,-0.9361049924084238,1.3556900766093267,-0.522356476744055,0.1561156164117714,"['Issue_Age', 'Cpn', 'AMT_OUTSTANDING']","[0.5595633871524247, 0.35323770770817714, 0.05912712218917244]"
2025-11-06,IT0001278511,BTPS 5 1/4 11/01/29,2029-11-01,-6.347070121579915,MODERATE SELL,-1.5312457216011888,0.9971119869741057,-1.6483818875391298,1.2893421158237952,-1.4683835171735324,15.220435849648268,"['Issue_Age', 'Cpn', 'AMT_OUTSTANDING']","[0.6179711585770875, 0.2600403485279502, 0.09088733542477534]"
2025-11-06,IT0001444378,BTPS 6 05/01/31,2031-05-01,-4.972591746653308,STRONG SELL,-2.063061935794538,0.9978707439238496,-1.7315184833931148,1.3925533337984741,-1.7676918216208444,30.521298532644902,"['Issue_Age', 'Cpn', 'AMT_OUTSTANDING']","[0.5482424807889894, 0.3280349331642936, 0.09733393865528503]"
2025-11-06,IT0003256820,BTPS 5 3/4 02/01/33,2033-02-01,4.55438346045635,WEAK BUY,0.777381838273496,0.9978015033208381,1.1016483178690246,1.2641229305241801,1.0796659413543246,54.59640862315192,"['Issue_Age', 'Cpn', 'AMT_OUTSTANDING']","[0.5638869161932013, 0.3429881097503821, 0.06087233647355834]"
2025-11-06,IT0003535157,BTPS 5 08/01/34,2034-08-01,3.319483815195383,NO ACTION,0.26749955732398867,0.9983431915943503,0.5112198643662093,1.1207346698342238,0.621319606921105,64.32246257523354,"['Issue_Age', 'Cpn', 'AMT_OUTSTANDING']","[0.5884107558186228, 0.28421973464466577, 0.08856992253366193]"
2025-11-06,IT0003934657,BTPS 4 02/01/37,2037-02-01,-0.6840992590098409,NO ACTION,-0.32889609509848894,0.9979711477892113,-1.1056518476468664,1.0999070381199487,-0.6901229247803154,76.09787264644756,"['Issue_Age', 'AMT_OUTSTANDING', 'Cpn']","[0.6145889779057205, 0.17302861510052933, 0.17263185335842815]"
2025-11-06,IT0004286966,BTPS 5 08/01/39,2039-08-01,0.7451137614849443,NO ACTION,0.22765153572585814,0.997712727745067,0.5781141321421924,1.03821206065445,0.6055832583040366,90.41372750246636,"['Issue_Age', 'Cpn', 'AMT_OUTSTANDING']","[0.5290950099072579, 0.34078472730850773, 0.08755278470193953]"
2025-11-06,IT0004532559,BTPS 5 09/01/40,2040-09-01,0.4531036913366932,NO ACTION,0.11394034614993474,0.9960464121158901,0.8554068582917659,1.048831628299626,0.6280083645211356,94.96084468535769,"['Issue_Age', 'Cpn', 'AMT_OUTSTANDING']","[0.49641209287357635, 0.37957723932578663, 0.08192806743359386]"
2025-11-06,IT0004644735,BTPS 4 1/2 03/01/26,2026-03-01,7.995528285346728,STRONG BUY,1.9255540711496177,0.9757407362010381,1.6333325832748748,0.5951058205429612,1.7076208332033507,-11.613273868813064,"['Issue_Age', 'Cpn', 'AMT_OUTSTANDING']","[0.5377096513187636, 0.34499747997124414, 0.05449364970398419]"
2025-11-06,IT0004889033,BTPS 4 3/4 09/01/28,2028-09-01,-1.89279439892402,NO ACTION,-0.4950280814772835,0.9956395136958309,-0.6024019833918118,0.5306001420183027,-0.6309976830188578,7.725535551631191,"['Cpn', 'Issue_Age', 'AMT_OUTSTANDING']","[0.40810359424176085, 0.40536994829606937, 0.12078198050698256]"
2025-11-06,IT0004923998,BTPS 4 3/4 09/01/44,2044-09-01,-1.6170649921877782,NO ACTION,-0.6922008376348556,0.9994452990234364,-0.6230869930181077,0.6981902911532345,-0.7396600799932898,107.2285988246052,"['Cpn', 'Issue_Age', 'GREEN_BOND_LOAN_INDICATOR']","[0.45743326396498735, 0.43176541707754096, 0.05270882288572069]"
2025-11-06,IT0005024234,BTPS 3 1/2 03/01/30,2030-03-01,-4.939992479185207,WEAK SELL,-1.0099775416161316,0.9984190980693433,-1.341339098617997,-0.012296600672148264,-1.1126268573001628,19.81803540942639,"['Issue_Age', 'AMT_OUTSTANDING', 'Cpn']","[0.4712020539424448, 0.2583390688227792, 0.17992633535936234]"
2025-11-06,IT0005083057,BTPS 3 1/4 09/01/46,2046-09-01,-3.02116406723205,NO ACTION,-0.506135548623311,0.9987938227942871,-0.4236847394623304,0.30926020778701385,-0.5858995534681288,111.22630677246931,"['Issue_Age', 'Cpn', 'GREEN_BOND_LOAN_INDICATOR']","[0.6580235474163031, 0.15748601176148633, 0.1086398272341642]"
2025-11-06,IT0005094088,BTPS 1.65 03/01/32,2032-03-01,-1.4755931468468972,NO ACTION,-0.6036120851719214,0.9984245949994109,-0.9330130843294858,0.17262802300709856,-0.7827518276138301,41.1645722630764,"['Cpn', 'Issue_Age', 'AMT_OUTSTANDING']","[0.39823244042121175, 0.3788656525288477, 0.14081281899669]"
2025-11-06,IT0005162828,BTPS 2.7 03/01/47,2047-03-01,-4.924485037268298,WEAK SELL,-0.895698771663927,0.9978581795358576,-0.6096494820217342,-1.999907940099366,-1.1859079020331715,110.50456262451137,"['Issue_Age', 'Cpn', 'GREEN_BOND_LOAN_INDICATOR']","[0.5252271375168899, 0.15902449636714647, 0.13446368844077344]"
2025-11-06,IT0005170839,BTPS 1.6 06/01/26,2026-06-01,-0.7125479621646917,NO ACTION,-0.2061132117122081,0.9961967721322066,-0.5975957909404497,0.27882936649992973,-0.48016796767767955,-17.147526202375786,"['Cpn', 'Issue_Age', 'GREEN_BOND_LOAN_INDICATOR']","[0.48360463105148777, 0.36412934021059884, 0.07502597658800876]"
2025-11-06,IT0005177909,BTPS 2 1/4 09/01/36,2036-09-01,-0.4686600976004058,NO ACTION,-0.2450022646128866,0.997400876148381,-0.5099855324952958,0.1812439358616308,-0.47531182544320527,73.88463982992879,"['Issue_Age', 'Cpn', 'GREEN_BOND_LOAN_INDICATOR']","[0.46268293141011857, 0.3505011658066856, 0.10512020778315602]"
2025-11-06,IT0005210650,BTPS 1 1/4 12/01/26,2026-12-01,-4.8755542622286985,MODERATE SELL,-1.225183793544808,0.995993166420346,-1.4012481739270672,0.9945275139268177,-1.2387059078394662,-15.159119171037169,"['Cpn', 'Issue_Age', 'GREEN_BOND_LOAN_INDICATOR']","[0.5553424136328508, 0.3316999862370676, 0.06839553395184624]"
2025-11-06,IT0005217390,BTPS 2.8 03/01/67,2067-03-01,5.594166170126357,WEAK BUY,1.2572117100162539,0.9985287576040898,1.3167311099253347,-1.016114680553756,1.1718971706024008,135.43872612136076,"['REL_SPRD_LOG', 'Issue_Age', 'AMT_OUTSTANDING']","[0.3736389845842486, 0.2743046738811036, 0.21569057618308968]"
2025-11-06,IT0005240350,BTPS 2.45 09/01/33,2033-09-01,0.0649199626412695,MODERATE SELL,-1.0762893464985752,0.9988474677249084,-1.3193384273709376,-1.3177480230670384,-1.365933706337346,54.50973881536164,"['Issue_Age', 'Cpn', 'AMT_OUTSTANDING']","[0.40651217279351876, 0.28579475941153726, 0.1575550575791588]"
2025-11-06,IT0005240830,BTPS 2.2 06/01/27,2027-06-01,-4.616768639724771,WEAK SELL,-1.1618351469451296,0.9924599131568858,-1.331714321298123,0.21121786020455502,-1.185311675887443,-8.990801975029541,"['Cpn', 'Issue_Age', 'GREEN_BOND_LOAN_INDICATOR']","[0.40818229998151045, 0.3970582870086212, 0.11443229424928844]"
2025-11-06,IT0005273013,BTPS 3.45 03/01/48,2048-03-01,-2.457330641549589,NO ACTION,-0.39073264494873644,0.9981431813269303,-0.37309063104438295,-1.6486725344787945,-0.795959161280249,115.18339866397253,"['Issue_Age', 'Cpn', 'GREEN_BOND_LOAN_INDICATOR']","[0.3797064838283351, 0.32095396527999603, 0.13409189343077946]"
2025-11-06,IT0005274805,BTPS 2.05 08/01/27,2027-08-01,-2.3178916042393265,NO ACTION,-0.5990884708044439,0.9940993683042905,-0.6879220541443236,0.08971408099933721,-0.7091861512674941,-4.756664246155628,"['Cpn', 'Issue_Age', 'GREEN_BOND_LOAN_INDICATOR']","[0.4657235045266511, 0.33958236891937255, 0.10881927959730175]"
2025-11-06,IT0005321325,BTPS 2.95 09/01/38,2038-09-01,-0.7250100454278225,NO ACTION,-0.34482710113438836,0.996736052032609,-0.6273912925748925,1.041518713265292,-0.5606279705666897,84.51924810993366,"['Issue_Age', 'GREEN_BOND_LOAN_INDICATOR', 'AMT_OUTSTANDING']","[0.5214649085686375, 0.2552809537336253, 0.1808376377170607]"
2025-11-06,IT0005323032,BTPS 2 02/01/28,2028-02-01,-5.501894156815091,MODERATE SELL,-1.3785067805389208,0.9939140404411086,-1.3473328977129055,-1.1116224256822982,-1.4939979527372256,-2.2380776223883,"['Cpn', 'Issue_Age', 'AMT_OUTSTANDING']","[0.46442513026047827, 0.21790407081907745, 0.17694425554156124]"
2025-11-06,IT0005340929,BTPS 2.8 12/01/28,2028-12-01,-5.8192673775188,STRONG SELL,-1.3357150930854675,0.9945858516312871,-1.5837843477416227,-2.4493617559492025,-1.7707651493559746,6.435268524263657,"['Issue_Age', 'AMT_OUTSTANDING', 'GREEN_BOND_LOAN_INDICATOR']","[0.39374955089781327, 0.21502671253845645, 0.18941749467594787]"
2025-11-06,IT0005358806,BTPS 3.35 03/01/35,2035-03-01,-0.0237688029490499,MODERATE SELL,-1.1129083788768963,0.9974218920184587,-1.0635424141709882,-2.2977126162524044,-1.4801638699428947,64.91165771801049,"['Cpn', 'AMT_OUTSTANDING', 'GREEN_BOND_LOAN_INDICATOR']","[0.37262302681797566, 0.23729396320850063, 0.1952009001062646]"
2025-11-06,IT0005363111,BTPS 3.85 09/01/49,2049-09-01,-1.8177041486630827,NO ACTION,-0.2598167552833756,0.9970442010229373,-0.31755194818356464,-1.1492672120721827,-0.6258712986305629,118.7229345294799,"['Cpn', 'GREEN_BOND_LOAN_INDICATOR', 'REL_SPRD_LOG']","[0.6061544756326295, 0.14159160335235546, 0.10980855831827038]"
2025-11-06,IT0005365165,BTPS 3 08/01/29,2029-08-01,-4.303974467265871,WEAK SELL,-0.774357316035214,0.9964743833308896,-0.7761044291812385,-1.3158941027564945,-1.0527113666451287,14.766193673238844,"['AMT_OUTSTANDING', 'GREEN_BOND_LOAN_INDICATOR', 'Issue_Age']","[0.4168833577298762, 0.24808260224112813, 0.18498067776447075]"
2025-11-06,IT0005370306,BTPS 2.1 07/15/26,2026-07-15,-1.7267353433911516,NO ACTION,-0.45437815540394316,0.9876013126483466,-0.6321045418976291,-0.5648941021011479,-0.71457544026268,-16.663174429068466,"['Cpn', 'GREEN_BOND_LOAN_INDICATOR', 'AMT_OUTSTANDING']","[0.6524768881107644, 0.16228197822319476, 0.06947760095377985]"
2025-11-06,IT0005377152,BTPS 3.1 03/01/40,2040-03-01,-0.6273080095390071,NO ACTION,-0.30678110251774343,0.9954826378124317,-0.3385447028357534,0.0936279594538201,-0.45765865599450184,91.69255136412812,"['AMT_OUTSTANDING', 'GREEN_BOND_LOAN_INDICATOR', 'Cpn']","[0.4466454811364794, 0.27161927189699975, 0.19603910337199726]"
2025-11-06,IT0005383309,BTPS 1.35 04/01/30,2030-04-01,-5.048702653176534,WEAK SELL,-1.0502504823799943,0.9981261670198326,-0.8442792467293937,0.07111348335538266,-0.9883664788382697,20.521401264788818,"['Cpn', 'AMT_OUTSTANDING', 'GREEN_BOND_LOAN_INDICATOR']","[0.6469246252939423, 0.18101793836619445, 0.08533330666384795]"
2025-11-06,IT0005390874,BTPS 0.85 01/15/27,2027-01-15,-3.014092759001114,WEAK SELL,-0.7695129344533974,0.9977729981026512,-0.9239831430328143,0.5975143574239138,-0.8659138896319553,-11.817420655545176,"['Cpn', 'GREEN_BOND_LOAN_INDICATOR', 'REL_SPRD_LOG']","[0.8179175337948695, 0.08233475803434895, 0.03705846029532743]"
2025-11-06,IT0005398406,BTPS 2.45 09/01/50,2050-09-01,-2.453324737588161,WEAK SELL,-0.3899127344433764,0.9975261589645014,-0.37275190497561483,-3.5849896751298806,-1.1294134322784666,119.75841845342735,"['Cpn', 'REL_SPRD_LOG', 'GREEN_BOND_LOAN_INDICATOR']","[0.3967153593643579, 0.18124562491454824, 0.16838125885392805]"
2025-11-06,IT0005402117,BTPS 1.45 03/01/36,2036-03-01,2.405050507123349,WEAK BUY,0.8740449353490333,0.9977275723854798,0.6901436485815249,0.13660367151665698,0.816818320854998,73.72962899254397,"['Cpn', 'AMT_OUTSTANDING', 'GREEN_BOND_LOAN_INDICATOR']","[0.6961000413330559, 0.12195741723853422, 0.09820862132288208]"
2025-11-06,IT0005403396,BTPS 0.95 08/01/30,2030-08-01,-3.0716109611942564,NO ACTION,-0.3178140077379786,0.9978079076619712,-0.512414446256706,1.3585697415946851,-0.5137682344358067,25.646706980411075,"['Cpn', 'GREEN_BOND_LOAN_INDICATOR', 'Issue_Age']","[0.821654798441007, 0.08690019480209511, 0.06350470612548632]"
2025-11-06,IT0005413171,BTPS 1.65 12/01/30,2030-12-01,-1.019001009298389,NO ACTION,-0.41305629627983514,0.9976722141812071,-0.6893822939651715,-0.8767368408659423,-0.765199110957228,30.77260236886069,"['Cpn', 'Issue_Age', 'AMT_OUTSTANDING']","[0.5820684064550751, 0.15621017042901938, 0.13171949579642103]"
2025-11-06,IT0005416570,BTPS 0.95 09/15/27,2027-09-15,-3.750306908711616,WEAK SELL,-0.9497322586200071,0.9948284191503608,-1.0316154167867364,-0.3677867268811591,-1.0530949350704215,-4.775812258623683,"['Cpn', 'Issue_Age', 'AMT_OUTSTANDING']","[0.7039780429326903, 0.100456552022224, 0.08880157711829696]"
2025-11-06,IT0005421703,BTPS 1.8 03/01/41,2041-03-01,-1.007319295733211,NO ACTION,-0.45476070946582386,0.9962154710524624,-0.5979262553977844,-0.2544148013283918,-0.6528628905056063,95.56303028438003,"['Cpn', 'Issue_Age', 'GREEN_BOND_LOAN_INDICATOR']","[0.6099601214745426, 0.17598883532924764, 0.11246365202018531]"
2025-11-06,IT0005422891,BTPS 0.9 04/01/31,2031-04-01,-1.2843787481093116,NO ACTION,-0.5238099869697913,0.9978719938719658,-0.5720426267770417,0.48789907590636145,-0.6375504370612058,33.482779654854646,"['Cpn', 'AMT_OUTSTANDING', 'GREEN_BOND_LOAN_INDICATOR']","[0.6924827563593376, 0.16838479653969188, 0.07143828668719378]"
2025-11-06,IT0005425233,BTPS 1.7 09/01/51,2051-09-01,-6.293941592144464,MODERATE SELL,-1.1759930140593637,0.9959713222481381,-1.5332728554380093,-1.4396329410054045,-1.4995926471043668,117.3990117572844,"['Cpn', 'Issue_Age', 'GREEN_BOND_LOAN_INDICATOR']","[0.5769908894831987, 0.16941670206833886, 0.0978892676635013]"
2025-11-06,IT0005433195,BTPS 0.95 03/01/37,2037-03-01,0.3560204159253715,NO ACTION,0.07613529809339431,0.9966257405257303,0.8165938077778018,1.3083200120770948,0.6421500511084152,77.57381049920765,"['Cpn', 'Issue_Age', 'GREEN_BOND_LOAN_INDICATOR']","[0.668561242859061, 0.23016097179168996, 0.0710431376356777]"
2025-11-06,IT0005433690,BTPS 0 1/4 03/15/28,2028-03-15,-4.320207867773218,WEAK SELL,-1.089239446473394,0.9940375379898221,-1.0286288442535736,1.3153666780024866,-1.0608532026481174,0.2475205127749929,"['Cpn', 'Issue_Age', 'GREEN_BOND_LOAN_INDICATOR']","[0.7821505821166987, 0.12652673042063203, 0.06140978272284308]"
2025-11-06,IT0005436693,BTPS 0.6 08/01/31,2031-08-01,-0.9821084844342564,NO ACTION,-0.39765943855589153,0.9978368091744024,-0.37572195428591076,0.48055787342249245,-0.5157945502760842,36.71351180144976,"['Cpn', 'Issue_Age', 'GREEN_BOND_LOAN_INDICATOR']","[0.7236683255958177, 0.14299732347993382, 0.06530499932317355]"
2025-11-06,IT0005437147,BTPS 0 04/01/26,2026-04-01,5.79266782912606,MODERATE BUY,1.3863114841801223,0.9818438581319883,1.1724585894644244,1.6582332172929226,1.4804576737519466,-12.740535514495544,"['Cpn', 'Issue_Age', 'GREEN_BOND_LOAN_INDICATOR']","[0.8105586247674739, 0.11694664212416071, 0.05823673540074197]"
2025-11-06,IT0005438004,BTPS 1 1/2 04/30/45,2045-04-30,-8.562561519194574,STRONG SELL,-3.396835893132846,0.9951306051775737,-1.7358764834242166,-0.1346766498800969,-2.482076831040758,102.1837012066844,"['GREEN_BOND_LOAN_INDICATOR', 'Cpn', 'Issue_Age']","[0.6413238719681935, 0.18231557116625297, 0.08024027727472523]"
2025-11-06,IT0005441883,BTPS 2.15 03/01/2072,2072-03-01,-4.537199250444445,STRONG SELL,-0.8164308490549266,0.9949380404532903,-0.8206551688356769,-4.477499435593748,-1.632522354481285,123.21275755344033,"['REL_SPRD_LOG', 'AMT_OUTSTANDING', 'Issue_Age']","[0.32817217536727084, 0.23536919259485675, 0.14204986647119686]"
2025-11-06,IT0005445306,BTPS 0 1/2 07/15/28,2028-07-15,-4.485144144380865,WEAK SELL,-1.1296145252632757,0.9950646470247335,-0.8677360269915847,0.24701288316689124,-1.0356626838334213,3.7238657728046753,"['Cpn', 'Issue_Age', 'GREEN_BOND_LOAN_INDICATOR']","[0.7067597494433271, 0.15333794322587418, 0.06120954973550097]"
2025-11-06,IT0005449969,BTPS 0.95 12/01/31,2031-12-01,-0.36982614528835,NO ACTION,-0.14212734641984437,0.9984497908802443,-0.26733787389155206,0.6320051319215961,-0.3524688552740575,40.18370953578451,"['Cpn', 'Issue_Age', 'GREEN_BOND_LOAN_INDICATOR']","[0.6791137728902676, 0.18769370301773103, 0.07207808683920912]"
2025-11-06,IT0005454241,BTPS 0 08/01/26,2026-08-01,-8.259369854330615,STRONG SELL,-2.053514734145235,0.9901765730960425,-1.2729205635325576,0.7899016947429499,-1.6295489566605343,-22.62015799118109,"['Cpn', 'Issue_Age', 'GREEN_BOND_LOAN_INDICATOR']","[0.7716948679396032, 0.118941465092682, 0.05545861216673074]"
2025-11-06,IT0005466013,BTPS 0.95 06/01/32,2032-06-01,-1.2442711367357333,NO ACTION,-0.5070713335910798,0.9985426125847594,-0.6782043336958242,-0.01531735699602999,-0.6621725985497088,43.466939749362666,"['Cpn', 'Issue_Age', 'AMT_OUTSTANDING']","[0.6770881910369473, 0.1450754675076835, 0.08716587518664731]"
2025-11-06,IT0005467482,BTPS 0.45 02/15/29,2029-02-15,-3.9556667762016335,NO ACTION,-0.6453227050617554,0.9963949519818464,-0.5948901131960216,0.6156056342252956,-0.7067611804115258,10.4652019736007,"['Cpn', 'Issue_Age', 'GREEN_BOND_LOAN_INDICATOR']","[0.6916336560218299, 0.18772680326432215, 0.05877632053128455]"
2025-11-06,IT0005480980,BTPS 2.15 09/01/52,2052-09-01,-4.154398226968482,WEAK SELL,-0.738080847748682,0.9950179004749133,-0.5340020369320974,-0.7585675505371874,-0.8679062693191915,120.84544468823984,"['Issue_Age', 'Cpn', 'AMT_OUTSTANDING']","[0.3413551630409269, 0.28042239540676756, 0.25361599335419144]"
2025-11-06,IT0005484552,BTPS 1.1 04/01/27,2027-04-01,-0.1215839886742093,NO ACTION,-0.06144996671596783,0.9941315856843868,-0.3962685819206977,0.29926650839724334,-0.3470398974129232,-6.453524502544309,"['Cpn', 'Issue_Age', 'GREEN_BOND_LOAN_INDICATOR']","[0.6154042838991004, 0.23756916955808158, 0.07071963169195838]"
2025-11-06,IT0005494239,BTPS 2 1/2 12/01/32,2032-12-01,0.9825858900860354,WEAK SELL,-0.6973908683665303,0.9986889941602952,-0.6793485668793456,-1.3634813402926504,-0.9936427480437622,49.70055476268785,"['Issue_Age', 'Cpn', 'AMT_OUTSTANDING']","[0.42509856587495676, 0.2529198103504579, 0.169755480867512]"
2025-11-06,IT0005495731,BTPS 2.8 06/15/29,2029-06-15,-1.7593665673068417,NO ACTION,0.16832209896124584,0.9961053033526052,0.4724481219094118,-1.6890346397627225,0.36508361654095617,16.017568841924767,"['Issue_Age', 'GREEN_BOND_LOAN_INDICATOR', 'AMT_OUTSTANDING']","[0.5688055090553592, 0.14969792773537963, 0.11440601665469845]"
2025-11-06,IT0005496770,BTPS 3 1/4 03/01/38,2038-03-01,2.951007911918353,WEAK BUY,1.0866453635654494,0.9954717893413225,0.9556986902871404,-1.0790929156285858,0.9792658363260817,85.61270536191351,"['Issue_Age', 'Cpn', 'AMT_OUTSTANDING']","[0.4993723298259061, 0.1849046541512307, 0.17648173410095372]"
2025-11-06,IT0005500068,BTPS 2.65 12/01/27,2027-12-01,1.089002807704813,NO ACTION,0.23489197995028266,0.9948778222101782,0.424658830573093,-0.449117009339418,0.3855865300916904,2.453707860148417,"['Issue_Age', 'Cpn', 'GREEN_BOND_LOAN_INDICATOR']","[0.5371216124060564, 0.20566417898537917, 0.1467369299221252]"
2025-11-06,IT0005508590,BTPS 4 04/30/35,2035-04-30,-3.072551599262397,STRONG SELL,-2.371731581450054,0.9958016146831596,-1.6224404276383535,0.588740050457445,-1.8957374894688004,62.94445533094397,"['GREEN_BOND_LOAN_INDICATOR', 'Cpn', 'Issue_Age']","[0.6784461029846744, 0.13982080312283524, 0.11864322086383142]"
2025-11-06,IT0005518128,BTPS 4.4 05/01/33,2033-05-01,3.164487628141778,NO ACTION,0.20350260850579732,0.9996540884883354,0.37135904441071743,0.02410462616078318,0.35899539804796643,55.07814530821694,"['Cpn', 'Issue_Age', 'GREEN_BOND_LOAN_INDICATOR']","[0.5599818995627958, 0.2692611851514632, 0.0818864131739829]"
2025-11-06,IT0005519787,BTPS 3.85 12/15/29,2029-12-15,0.5195289152745701,WEAK BUY,1.0125652770133575,0.9974571642380649,0.7554640793794513,-0.6899627931074973,0.8836850160776253,23.265617994060204,"['Issue_Age', 'Cpn', 'AMT_OUTSTANDING']","[0.384073990361148, 0.36721872445498993, 0.12723325434485003]"
2025-11-06,IT0005521981,BTPS 3.4 04/01/28,2028-04-01,-0.1674879210334605,NO ACTION,-0.07268688150445303,0.9950068756956573,-0.574882555707262,0.2590381111043955,-0.4043691430945828,4.912775107017767,"['Issue_Age', 'Cpn', 'GREEN_BOND_LOAN_INDICATOR']","[0.5444492255633704, 0.2566142393330895, 0.12079283611802175]"
2025-11-06,IT0005530032,BTPS 4.45 09/01/43,2043-09-01,3.2261843611902634,MODERATE BUY,1.1938013988833467,0.9991347471455971,1.5270758678246084,0.25654394733355756,1.243929438458892,108.9498020826998,"['Cpn', 'Issue_Age', 'AMT_OUTSTANDING']","[0.4961804945271763, 0.3262309525178021, 0.0993309732098456]"
2025-11-06,IT0005534141,BTPS 4 1/2 10/01/53,2053-10-01,8.358150212723487,STRONG BUY,1.8229316012054226,0.9941756055346658,1.7109338994685033,-0.36813418400502157,1.5773218948922156,134.581381534861,"['Cpn', 'Issue_Age', 'AMT_OUTSTANDING']","[0.47837760683830666, 0.31317964705427065, 0.10166305367258668]"
2025-11-06,IT0005538597,BTPS 3.8 04/15/26,2026-04-15,5.994449122133576,MODERATE BUY,1.4357059277256297,0.9903803936337555,1.575364986652646,-0.5770275296620552,1.337253140720136,-12.055056779084872,"['Issue_Age', 'Cpn', 'AMT_OUTSTANDING']","[0.4147475634433224, 0.3400623496270258, 0.1288725553324571]"
2025-11-06,IT0005542359,BTPS 4 10/30/31,2031-10-30,-2.3825411329547848,WEAK SELL,-0.9821209878980807,0.998762551622497,-1.3311773165549539,0.5131565307066551,-1.0932237218791838,37.428123156392616,"['GREEN_BOND_LOAN_INDICATOR', 'Issue_Age', 'Cpn']","[0.6606346400762438, 0.13688214611067082, 0.13594228085506135]"
2025-11-06,IT0005542797,BTPS 3.7 06/15/30,2030-06-15,1.5130945007410084,MODERATE BUY,1.3806431348566808,0.996555146326134,1.378693195675597,-0.6276788322436901,1.2532631011700308,29.027531158277448,"['Issue_Age', 'Cpn', 'GREEN_BOND_LOAN_INDICATOR']","[0.46245388447373525, 0.32644759650957844, 0.09246830495529894]"
2025-11-06,IT0005544082,BTPS 4.35 11/01/33,2033-11-01,4.655142115811692,WEAK BUY,0.8189844520689923,0.9991106779261676,0.8111494058432119,0.829416349094004,0.9428880395041416,60.33173221482279,"['Cpn', 'Issue_Age', 'GREEN_BOND_LOAN_INDICATOR']","[0.5075710792624729, 0.3632434839481126, 0.07708457740964467]"
2025-11-06,IT0005548315,BTPS 3.8 08/01/28,2028-08-01,0.3228465165348702,NO ACTION,0.047343059496990025,0.9958732187999546,0.8270075689895623,0.05090474329566873,0.4131635980628774,9.032484986614197,"['Issue_Age', 'Cpn', 'GREEN_BOND_LOAN_INDICATOR']","[0.43834881859489044, 0.3792537827528748, 0.09475056025250585]"
2025-11-06,IT0005556011,BTPS 3.85 09/15/26,2026-09-15,6.818583777285097,STRONG BUY,1.6374474870695965,0.991380305440198,1.619936380335668,0.6713255076133499,1.570492153501124,-6.02733047250284,"['Issue_Age', 'Cpn', 'GREEN_BOND_LOAN_INDICATOR']","[0.47462129796270913, 0.3769747392755363, 0.08908485038143196]"
2025-11-06,IT0005560948,BTPS 4.2 03/01/34,2034-03-01,4.987776468290711,WEAK BUY,0.9563270798809249,0.9981939456665744,1.2330988173853479,0.601318993205159,1.0957994145548278,63.04277059315812,"['Cpn', 'Issue_Age', 'GREEN_BOND_LOAN_INDICATOR']","[0.47938430538182547, 0.37659077955554177, 0.08150938264967338]"
2025-11-06,IT0005561888,BTPS 4 11/15/30,2030-11-15,2.730707050494537,WEAK BUY,1.1518602204285673,0.9978582841453767,1.0378191079348211,-0.3294152276328792,1.0370475443137062,34.12347231780377,"['Issue_Age', 'Cpn', 'AMT_OUTSTANDING']","[0.42977931861858204, 0.3827019839447853, 0.08250686973319972]"
2025-11-06,IT0005566408,BTPS 4.1 02/01/29,2029-02-01,1.3555576639811768,MODERATE BUY,1.3222817923804815,0.996055537098277,1.4480287696301404,0.33010843897481407,1.2998620662256744,15.379761396436066,"['Cpn', 'Issue_Age', 'GREEN_BOND_LOAN_INDICATOR']","[0.4488181517295608, 0.3933284272964713, 0.08295471456737569]"
2025-11-06,IT0005580045,BTPS 2.95 02/15/27,2027-02-15,6.907145135662138,STRONG BUY,1.65912659791019,0.9956044986200612,1.4546153393453933,0.6815069900229067,1.5366594053916307,-0.8838010146074183,"['Issue_Age', 'GREEN_BOND_LOAN_INDICATOR', 'AMT_OUTSTANDING']","[0.744775513651731, 0.12321783356687063, 0.0731524156289165]"
2025-11-06,IT0005580094,BTPS 3 1/2 02/15/31,2031-02-15,2.996936353526351,MODERATE BUY,1.2629693059634182,0.9978051704460588,1.4921974097557857,1.1370179155443536,1.4213847029335709,36.665829178830194,"['Issue_Age', 'Cpn', 'GREEN_BOND_LOAN_INDICATOR']","[0.6027240423966794, 0.25906060176849566, 0.1001592438244129]"
2025-11-06,IT0005582421,BTPS 4.15 10/01/39,2039-10-01,3.732831493883623,MODERATE BUY,1.391094074867239,0.9963171774661229,1.5512348850586357,0.40662712760904546,1.3784047307601017,94.17396970371904,"['Issue_Age', 'Cpn', 'GREEN_BOND_LOAN_INDICATOR']","[0.463281212942891, 0.39507300894648767, 0.07024083041047499]"
2025-11-06,IT0005584849,BTPS 3.35 07/01/29,2029-07-01,1.8445072639173248,STRONG BUY,1.503418824470173,0.9974594298690704,1.553924039580197,1.0203108634409095,1.5433968954049595,20.06302351768777,"['Issue_Age', 'Cpn', 'GREEN_BOND_LOAN_INDICATOR']","[0.6453031754990706, 0.20336747018399662, 0.1079445273655326]"
2025-11-06,IT0005584856,BTPS 3.85 07/01/34,2034-07-01,5.368744332107703,MODERATE BUY,1.113626309917078,0.9983951923609828,1.3973582413064345,0.9994957817153879,1.2931866292635668,65.78196582244037,"['Issue_Age', 'Cpn', 'GREEN_BOND_LOAN_INDICATOR']","[0.508793757464995, 0.3613690339487631, 0.08550198802117757]"
2025-11-06,IT0005595803,BTPS 3.45 07/15/31,2031-07-15,3.36360356365941,STRONG BUY,1.41599550536954,0.9979039527984832,1.5439853210258552,1.1235544037479888,1.5131780029484325,40.655422153775575,"['Issue_Age', 'Cpn', 'GREEN_BOND_LOAN_INDICATOR']","[0.633091463973968, 0.23026235758941585, 0.09797533736592533]"
2025-11-06,IT0005596470,BTPS 4.05 10/30/37,2037-10-30,2.2302882904267847,WEAK BUY,0.8059910509627772,0.9962788400217913,0.7023997491429266,0.8308440994885787,0.9046484607665021,83.12067523699886,"['GREEN_BOND_LOAN_INDICATOR', 'Issue_Age', 'Cpn']","[0.6389634851341258, 0.17167070615888, 0.13733013883139264]"
2025-11-06,IT0005599904,BTPS 3.45 07/15/27,2027-07-15,4.273040958481408,WEAK BUY,1.0143190038390553,0.9927054361114881,1.0043533854211046,-0.7448514810528325,0.9553431180037434,1.297196596956715,"['Issue_Age', 'Cpn', 'AMT_OUTSTANDING']","[0.543499910916407, 0.19398587678009807, 0.13853402467040757]"
2025-11-06,IT0005607269,BTPS 3.1 08/28/26,2026-08-28,8.137818044956347,STRONG BUY,1.960385464057182,0.99318511365604,1.6240816438723606,-0.5215444855558224,1.6233227233128318,-5.312497741820054,"['Issue_Age', 'AMT_OUTSTANDING', 'GREEN_BOND_LOAN_INDICATOR']","[0.6378426577483215, 0.154006750721698, 0.09436635437191142]"
2025-11-06,IT0005607970,BTPS 3.85 02/01/35,2035-02-01,5.386598853365584,WEAK BUY,1.1209983292217773,0.9972460571103268,1.2901803561813474,0.2911359823238509,1.1437673853784505,69.81259920999327,"['Issue_Age', 'Cpn', 'GREEN_BOND_LOAN_INDICATOR']","[0.49228774229618516, 0.3485598643901429, 0.08247424763327363]"
2025-11-06,IT0005611055,BTPS 3 10/01/29,2029-10-01,1.2345463169144466,MODERATE BUY,1.2774517398357905,0.9971037720880284,1.4627303071758193,0.3140586038976836,1.2782970525717856,21.96557018790814,"['Issue_Age', 'GREEN_BOND_LOAN_INDICATOR', 'AMT_OUTSTANDING']","[0.6997553766526279, 0.11407931845667808, 0.11053378076285479]"
2025-11-06,IT0005611741,BTPS 4.3 10/01/54,2054-10-01,9.67597387753422,STRONG BUY,2.092657854604022,0.9948011543438681,1.6159770030562262,0.05345648542415236,1.6989589653735413,136.86866304122415,"['Issue_Age', 'Cpn', 'AMT_OUTSTANDING']","[0.427624133925947, 0.3937128434001716, 0.09113269399794847]"
2025-11-06,IT0005619546,BTPS 3.15 11/15/31,2031-11-15,4.287779492126951,STRONG BUY,1.8016943789194575,0.997417896341318,1.5446586423576745,-0.23738077711229477,1.519074967535381,44.47047559933059,"['Issue_Age', 'GREEN_BOND_LOAN_INDICATOR', 'Cpn']","[0.70574146853902, 0.09946471961175982, 0.09398417538218297]"
2025-11-06,IT0005622128,BTPS 2.7 10/15/27,2027-10-15,4.357128612595572,WEAK BUY,1.0349029877263105,0.9951845559860781,0.903559660531153,-0.849024246709733,0.9374411480093777,4.267066615349814,"['Issue_Age', 'AMT_OUTSTANDING', 'Cpn']","[0.653134422050741, 0.11284420568917297, 0.10528477134438084]"
2025-11-06,NL0000102234,NETHER 4 01/15/37,2037-01-15,0.3032149478442214,NO ACTION,-0.0711627939892515,0.9977418331940027,-0.48256937495366303,-1.3601164960637766,-0.6121744465654719,19.52948583002989,,
2025-11-06,NL0000102317,NETHER 5 1/2 01/15/28,2028-01-15,-0.2090206562022754,NO ACTION,-0.16658580242032117,0.9883961794074978,-0.45349676431964003,1.415491502714758,-0.4169256233801854,-12.584038311118524,,
2025-11-06,NL0009446418,NETHER 3 3/4 01/15/42,2042-01-15,0.856274044663504,NO ACTION,0.3966942852577603,0.9977054211669171,0.5121183146095881,0.765625131129656,0.6270709397120298,29.32885034106152,,
2025-11-06,NL0010071189,NETHER 2 1/2 01/15/33,2033-01-15,-1.4443790613027243,NO ACTION,0.0,0.9966261363752982,0.00043541048392272997,0.06471521183077197,0.15348354074125253,6.900139167789325,,
2025-11-06,NL0010721999,NETHER 2 3/4 01/15/47,2047-01-15,-0.276114224957972,NO ACTION,0.0,0.9966106402173931,0.00043541048392272997,-1.5916623739200433,0.1423152265523442,34.40207599306603,,
2025-11-06,NL0011819040,NETHER 0 1/2 07/15/26,2026-07-15,-1.4976620265986114,MODERATE SELL,-1.1798424191458117,0.9827817388876091,-1.0053682772629253,-0.9820510188171471,-1.2685571653130945,-22.333780171669567,,
2025-11-06,NL0012171458,NETHER 0 3/4 07/15/27,2027-07-15,1.8047402699819308,WEAK BUY,1.4168311433912466,0.9898807059176294,0.9109372795411511,-2.066983349922454,1.1363354935425958,-13.266785468953454,,
2025-11-06,NL0012818504,NETHER 0 3/4 07/15/28,2028-07-15,-1.2793726771505811,WEAK SELL,-1.0082018581874965,0.9939383924041412,-0.77960322162327,0.09390103019993136,-0.9472812275667525,-11.115451926813355,,
2025-11-06,NL0013332430,NETHER 0 1/4 07/15/29,2029-07-15,-0.2197346347303703,NO ACTION,0.0,0.995407946912005,0.00043541048392272997,1.1206927214637632,0.3354664642618034,-5.321310446053107,,
2025-11-06,NL0013552060,NETHER 0 1/2 01/15/40,2040-01-15,-1.7830785671533391,STRONG SELL,-1.8360504813853173,0.9978163575777936,-1.6332569424074912,1.6811364061929157,-1.6219242298603764,23.44029984560748,,
2025-11-06,NL0014555419,NETHER 0 07/15/30,2030-07-15,0.011336927942753,NO ACTION,0.0,0.9956042161705301,0.00043541048392272997,0.9666113485927834,0.3089158943771478,-0.7912310253251025,,
2025-11-06,NL00150006U0,NETHER 0 07/15/31,2031-07-15,-0.1023023932881193,NO ACTION,0.0,0.9970984598498698,0.00043541048392272997,0.26565125919291105,0.18823353862748013,3.003533748095053,,
2025-11-06,NL0015000B11,NETHER 0 01/15/38,2038-01-15,1.953413171918697,MODERATE BUY,1.3248126555319544,0.9980679880240947,1.5334001313768517,-0.08265658386959042,1.2691132547559318,23.35032845229041,,
2025-11-06,NL0015000LS8,NETHER 0 01/15/29,2029-01-15,-0.0490107864770088,NO ACTION,0.0,0.9979101174773227,0.00043541048392272997,0.9381921189045832,0.30441043066535406,-7.440942950127212,,
2025-11-06,NL0015000RP1,NETHER 0 1/2 07/15/32,2032-07-15,-0.3608356693415215,NO ACTION,0.0,0.9985749061928928,0.00043541048392272997,0.2980805611044263,0.19408346768098206,6.3120849793513045,,
2025-11-06,NL00150012X2,NETHER 2 01/15/54,2054-01-15,3.18175490552089,NO ACTION,0.0,0.997566365411614,0.00043541048392272997,-1.6692762253361746,0.14248012262067059,43.54116900344778,,
2025-11-06,NL0015001AM2,NETHER 2 1/2 07/15/33,2033-07-15,-0.0956033946180667,NO ACTION,0.0,0.9955642481629392,0.00043541048392272997,0.3408368885615373,0.20094098766807425,9.819299032010198,,
2025-11-06,NL0015001DQ7,NETHER 2 1/2 01/15/30,2030-01-15,0.8718636243925264,NO ACTION,0.0,0.9968908167863177,0.00043541048392272997,0.3432276163815899,0.20158235149528303,-2.011043037664213,,
2025-11-06,NL0015001RG8,NETHER 3 1/4 01/15/44,2044-01-15,0.6068628235557405,NO ACTION,0.18570633458485403,0.9965777066590569,0.5052715041341842,1.325002139100716,0.6122112039654259,31.846787328515564,,
2025-11-06,NL0015001XZ6,NETHER 2 1/2 07/15/34,2034-07-15,0.0941122015363262,NO ACTION,0.0,0.9960420879749228,0.00043541048392272997,0.2081162735183612,0.1781244774075424,12.967865508032052,,
2025-11-06,NL0015002F72,NETHER 2 1/2 07/15/35,2035-07-15,0.3499805369422581,NO ACTION,0.0,0.9967934954670229,0.00043541048392272997,0.38936756699866215,0.2095263175982177,15.927791440123997,,
2025-11-06,NL0015031501,NETHER 0 01/15/27,2027-01-15,1.1955158054779955,WEAK BUY,0.9377989363623829,0.9953586688771392,0.8330550685587879,-0.07331045335297046,0.8669354537292391,-16.66297815392474,,
2025-11-06,NL0015614579,NETHER 0 01/15/52,2052-01-15,-3.9120030900922487,NO ACTION,0.0,0.9968000646758929,0.00043541048392272997,-2.1694025561909056,0.14234790890564028,35.084307876012694,,
