Date,ISIN,SECURITY_NAME,Maturity,RESIDUAL_NS,SIGNAL,Z_Residual_Score,Volatility_Score,Cluster_Score,Regression_Score,COMPOSITE_SCORE,Z_SPRD_VAL,COMPOSITE_SCORE_1W_AGO,COMPOSITE_SCORE_1W_Change,COMPOSITE_SCORE_1W_Change_Pct,Z_Residual_Score_1W_AGO,Z_Residual_Score_1W_Change,Z_Residual_Score_1W_Change_Pct,Cluster_Score_1W_AGO,Cluster_Score_1W_Change,Cluster_Score_1W_Change_Pct,Regression_Score_1W_AGO,Regression_Score_1W_Change,Regression_Score_1W_Change_Pct,Z_SPRD_VAL_1W_AGO,Z_SPRD_VAL_1W_Change,Z_SPRD_VAL_1W_Change_Pct,COMPOSITE_SCORE_1M_AGO,COMPOSITE_SCORE_1M_Change,COMPOSITE_SCORE_1M_Change_Pct,Z_Residual_Score_1M_AGO,Z_Residual_Score_1M_Change,Z_Residual_Score_1M_Change_Pct,Cluster_Score_1M_AGO,Cluster_Score_1M_Change,Cluster_Score_1M_Change_Pct,Regression_Score_1M_AGO,Regression_Score_1M_Change,Regression_Score_1M_Change_Pct,Z_SPRD_VAL_1M_AGO,Z_SPRD_VAL_1M_Change,Z_SPRD_VAL_1M_Change_Pct,COMPOSITE_SCORE_3M_AGO,COMPOSITE_SCORE_3M_Change,COMPOSITE_SCORE_3M_Change_Pct,Z_Residual_Score_3M_AGO,Z_Residual_Score_3M_Change,Z_Residual_Score_3M_Change_Pct,Cluster_Score_3M_AGO,Cluster_Score_3M_Change,Cluster_Score_3M_Change_Pct,Regression_Score_3M_AGO,Regression_Score_3M_Change,Regression_Score_3M_Change_Pct,Z_SPRD_VAL_3M_AGO,Z_SPRD_VAL_3M_Change,Z_SPRD_VAL_3M_Change_Pct,COMPOSITE_SCORE_6M_AGO,COMPOSITE_SCORE_6M_Change,COMPOSITE_SCORE_6M_Change_Pct,Z_Residual_Score_6M_AGO,Z_Residual_Score_6M_Change,Z_Residual_Score_6M_Change_Pct,Cluster_Score_6M_AGO,Cluster_Score_6M_Change,Cluster_Score_6M_Change_Pct,Regression_Score_6M_AGO,Regression_Score_6M_Change,Regression_Score_6M_Change_Pct,Z_SPRD_VAL_6M_AGO,Z_SPRD_VAL_6M_Change,Z_SPRD_VAL_6M_Change_Pct,COMPOSITE_SCORE_1Y_AGO,COMPOSITE_SCORE_1Y_Change,COMPOSITE_SCORE_1Y_Change_Pct,Z_Residual_Score_1Y_AGO,Z_Residual_Score_1Y_Change,Z_Residual_Score_1Y_Change_Pct,Cluster_Score_1Y_AGO,Cluster_Score_1Y_Change,Cluster_Score_1Y_Change_Pct,Regression_Score_1Y_AGO,Regression_Score_1Y_Change,Regression_Score_1Y_Change_Pct,Z_SPRD_VAL_1Y_AGO,Z_SPRD_VAL_1Y_Change,Z_SPRD_VAL_1Y_Change_Pct,COMPOSITE_SCORE_Market_Percentile,COMPOSITE_SCORE_Market_Zscore,Z_Residual_Score_Market_Percentile,Z_Residual_Score_Market_Zscore,Cluster_Score_Market_Percentile,Cluster_Score_Market_Zscore,Regression_Score_Market_Percentile,Regression_Score_Market_Zscore,Z_SPRD_VAL_Market_Percentile,Z_SPRD_VAL_Market_Zscore,Issuer_Proxy,COMPOSITE_SCORE_Issuer_Percentile,COMPOSITE_SCORE_Issuer_Zscore,Z_Residual_Score_Issuer_Percentile,Z_Residual_Score_Issuer_Zscore,Cluster_Score_Issuer_Percentile,Cluster_Score_Issuer_Zscore,Regression_Score_Issuer_Percentile,Regression_Score_Issuer_Zscore,Z_SPRD_VAL_Issuer_Percentile,Z_SPRD_VAL_Issuer_Zscore,VOLATILITY_1M_AGO,Volatility_1M_Change,Volatility_Trend,Volatility_Market_Percentile,Volatility_Issuer_Percentile,COMPOSITE_Direction,Direction_1W_Ago,Direction_1M_Ago,Direction_Consistency_1W,Direction_Consistency_1M,COMPOSITE_SCORE_Relative_Strength,Z_Residual_Score_Relative_Strength,Cluster_Score_Relative_Strength,Regression_Score_Relative_Strength,COMPOSITE_Market_Category,COMPOSITE_Issuer_Category,Z_SPRD_VAL_Market_Category,Z_SPRD_VAL_Issuer_Category,Z_SPRD_VAL_Level_Category,YAS_RISK,Top_Features,Top_Feature_Effects_Pct,TopN_FeaturePct,SHAP_Signal,Z_SPRD_MID
2025-11-06,IT0001086567,BTPS 7 1/4 11/01/26,2026-11-01,-2.278725282428025,NO ACTION,-0.530497198139895,0.9487983327502111,-0.9563517459764095,1.226390535928784,-0.6849003388614604,-13.556162330285314,-0.6560286134437704,-0.02887172541769001,-4.400985625616481,-0.4924169039182758,-0.03808029422161924,-7.733344071917735,-0.9330138643610087,-0.023337881615400735,-2.5013434694509873,1.226390535928784,0.0,0.0,-13.010327937451729,-0.5458343928335854,-4.1953930372715575,-0.698198788240403,0.013298449378942645,1.904679499944332,-0.54456247313018,0.014065274990284982,2.582857876921098,-0.9651812759650977,0.008829529988688245,0.914805344558611,1.226390535928784,0.0,0.0,-8.866,-4.690162330285315,-52.90054505972547,-0.6723970976219229,-0.0125032412395375,-1.859502531734246,-0.5252816190194872,-0.005215579120407821,-0.9929110085466798,-0.9528803068355576,-0.0034714391408519063,-0.3643100901045253,1.226390535928784,0.0,0.0,-5.985,-7.571162330285314,-126.5022943631593,-0.7803225666776283,0.09542222781616794,12.228561708728998,-0.6643606334349592,0.13386343529506417,20.14921212113754,-1.0355156516014872,0.07916390562507769,7.644877674051395,1.226390535928784,0.0,0.0,4.522,-18.078162330285316,-399.78244781749385,-0.7704521265402423,0.08555178767878191,11.104101555608231,-0.6471526677285782,0.11665546958868311,18.025957954485893,-1.024724003837535,0.06837225786112544,6.672260719749809,1.226390535928784,0.0,0.0,18.471,-32.027162330285314,-173.39159933379975,29.545454545454547,-0.6542293163632497,32.95454545454545,-0.5263610149692365,20.454545454545457,-0.9450848692223428,97.72727272727273,1.234463611540235,5.681818181818182,-1.2755969858713472,BTPS 7 1/4,100.0,0.0,100.0,0.0,100.0,0.0,100.0,0.0,100.0,0.0,0.9700407824147728,-0.02124244966456168,falling,13.636363636363635,100.0,-1.0,-1.0,-1.0,1,1,0.7423884326322051,0.6352128630663447,1.0553037055800651,1.6494336273519121,Below Median,Top Decile,Bottom Decile,Top Decile,Very Tight,0.9916733406811318,"['Issue_Age', 'Cpn', 'AMT_OUTSTANDING']","[0.5257402533419989, 0.4047945089519933, 0.04244193570693805]",0.9729766980009302,1.2415379720581228,0.0
2025-11-06,IT0001174611,BTPS 6 1/2 11/01/27,2027-11-01,-0.2815272950993053,NO ACTION,-0.09053338125138155,0.9402561345195166,-0.7727050688185192,1.2059304737530532,-0.4067773538580104,0.1561156164117714,-0.49748474185476876,0.09070738799675837,18.233199642516613,-0.21595899704865854,0.12542561579727698,58.078436973465465,-0.8493597276733073,0.07665465885478806,9.0249932337,1.2059304737530532,0.0,0.0,0.3221641808962269,-0.16604856448445549,-51.54159561387808,-0.47015305866007834,0.06337570480206794,13.479802435978295,-0.18573956950730314,0.09520618825592159,51.25788941079096,-0.831266737803324,0.05856166898480486,7.04487087202247,1.2059304737530532,0.0,0.0,5.799,-5.642884383588229,-97.30788711601035,-0.6581947487119131,0.2514173948539027,38.19802444886167,-0.45893465337837275,0.3684012721269912,80.27314158731555,-0.9987259433152859,0.22602087449676667,22.630920298655198,1.2059304737530532,0.0,0.0,7.162,-7.005884383588229,-97.8202230355516,-0.7137294798640842,0.3069521260060738,43.00678763666145,-0.5338417207988423,0.44330833954746074,83.04115507869587,-1.043099991463566,0.2703949226450467,25.922243530405293,1.2059304737530532,0.0,0.0,22.016,-21.859884383588227,-99.29089922628606,-1.5474556389913203,1.14067828513331,73.71314879859979,-1.8804312673912909,1.7898978861399093,95.18549854281419,-1.550760232779008,0.7780551639604888,50.17249878460846,1.2059304737530532,0.0,0.0,30.752,-30.595884383588228,-99.49233992468456,50.0,-0.38050669930275666,54.54545454545454,-0.08982751013796607,26.136363636363637,-0.7639507904648796,95.45454545454545,1.2137575064147388,20.454545454545457,-0.9732323284427055,BTPS 6 1/2,100.0,0.0,100.0,0.0,100.0,0.0,100.0,0.0,100.0,0.0,0.9294898542724608,0.010766280247055837,rising,10.227272727272728,100.0,-1.0,-1.0,-1.0,1,1,0.44092079537138207,0.10840390582534583,0.8526554438525562,1.6219158721330957,Above Median,Top Decile,Bottom Quartile,Top Decile,Very Tight,2.0058100418047786,"['Issue_Age', 'Cpn', 'AMT_OUTSTANDING']","[0.5595633871524247, 0.35323770770817714, 0.05912712218917244]",0.9719282170497744,1.2207132061222068,0.0
2025-11-06,IT0001278511,BTPS 5 1/4 11/01/29,2029-11-01,-6.347070121579915,MODERATE SELL,-1.3779819633389865,0.9765761143265597,-1.6060579943107294,1.1468152452277782,-1.3064954683148917,15.220435849648268,-1.2948650141691542,-0.01163045414573749,-0.8981981850347786,-1.35539260281629,-0.022589360522696555,-1.6666285701350745,-1.598832118272978,-0.0072258760377512665,-0.45194713753697785,1.1468152452277782,0.0,0.0,16.338880451019733,-1.1184446013714648,-6.845295208810537,-1.385277654878451,0.07878218656355918,5.687104366219014,-1.5103383504048344,0.13235638706584796,8.76335995533947,-1.6429609016993503,0.0369029073886209,2.2461220547512246,1.1468152452277782,0.0,0.0,21.364,-6.143564150351732,-28.75661930104882,-1.2423011601874736,-0.06419430812741811,-5.1673708169920385,-1.273017792885046,-0.10496417045394058,-8.245302635678764,-1.5705700757023475,-0.03548791860838185,-2.259556509540414,1.1468152452277782,0.0,0.0,23.688,-8.46756415035173,-35.74621811371627,-1.3782689928093066,0.07177352449441488,5.207512056653664,-1.4983411682894963,0.12035920495050978,8.032830352290768,-1.6396215281779873,0.033563533867257966,2.04702933486438,1.1468152452277782,0.0,0.0,47.117,-31.89656415035173,-67.69650899586578,-1.5955469138962135,0.2890514455813218,18.116135680640372,-1.8914849305983228,0.5135029672593363,27.148139339502368,-1.7110501618044278,0.10499216749369844,6.136124423691007,1.1468152452277782,0.0,0.0,55.592,-40.37156415035173,-72.62117596612752,9.090909090909092,-1.2659897775992695,5.681818181818182,-1.367238106771566,3.4090909090909087,-1.5859020327903277,92.04545454545455,1.1539313863448786,34.090909090909086,-0.6410542582180523,BTPS 5 1/4,100.0,0.0,100.0,0.0,100.0,0.0,100.0,0.0,100.0,0.0,0.9810001064868259,-0.004423992160266232,falling,55.68181818181818,100.0,-1.0,-1.0,-1.0,1,1,1.4161580421696436,1.649983960811638,1.7722338667789788,1.542408861143047,Bottom Decile,Top Decile,Below Median,Top Decile,Very Tight,3.952346694941866,"['Issue_Age', 'Cpn', 'AMT_OUTSTANDING']","[0.6179711585770875, 0.2600403485279502, 0.09088733542477534]",0.9688988425298132,1.1605442395416807,0.0
2025-11-06,IT0001444378,BTPS 6 05/01/31,2031-05-01,-4.972591746653308,STRONG SELL,-1.856568215454912,0.983389686448789,-1.6969002740020427,1.2387751889051373,-1.5777210998730902,30.521298532644902,-1.528541557379652,-0.049179542493438255,-3.2174161006131983,-1.766538074449795,-0.09003014100511697,-5.096416646638994,-1.6844861057700835,-0.012414168231959177,-0.7369706473528213,1.2387751889051373,0.0,0.0,32.84375877223417,-2.3224602395892653,-7.071237658844119,-1.3705927133678844,-0.20712838650520582,-15.112322061380882,-1.488958077583885,-0.3676101378710268,-24.68908567248817,-1.6263206336437448,-0.07057964035829789,-4.339835482882721,1.2387751889051373,0.0,0.0,41.696,-11.174701467355096,-26.8004160223404,-1.2595953151032888,-0.31812578476980136,-25.256189700744926,-1.3016032227117753,-0.5549649927431366,-42.6370324531936,-1.5695512837805756,-0.12734899022146706,-8.113719553231151,1.2387751889051373,0.0,0.0,45.203,-14.6817014673551,-32.479484689306354,-1.149526503946253,-0.4281945959268372,-37.24964937580011,-1.1245301662279896,-0.7320380492269223,-65.09723480097233,-1.5035939401043907,-0.19330633389765195,-12.856285693636316,1.2387751889051373,0.0,0.0,69.623,-39.1017014673551,-56.16204625158194,-1.732928639771171,0.15520753989808078,8.956372203701264,-2.153443185604864,0.29687497014995223,13.786059959968682,-1.7204645538222814,0.023564279820238676,1.3696463336557738,1.2387751889051373,0.0,0.0,71.372,-40.850701467355094,-57.23631320634348,3.4090909090909087,-1.5329241688113953,3.4090909090909087,-1.8420929152367969,2.272727272727273,-1.6755014358329812,98.86363636363636,1.2469971964467041,45.45454545454545,-0.3036602729523622,BTPS 6 05/01/31,100.0,0.0,100.0,0.0,100.0,0.0,100.0,0.0,100.0,0.0,0.9865722192714066,-0.003182532822617601,falling,76.13636363636364,100.0,-1.0,-1.0,-1.0,1,1,1.710149386716051,2.2230390956864143,1.872475430392905,1.6660903631011084,Bottom Decile,Top Decile,Below Median,Top Decile,Very Tight,5.475429567001555,"['Issue_Age', 'Cpn', 'AMT_OUTSTANDING']","[0.5482424807889894, 0.3280349331642936, 0.09733393865528503]",0.973611352608568,1.2541433833816535,0.0
2025-11-06,IT0003256820,BTPS 5 3/4 02/01/33,2033-02-01,4.55438346045635,WEAK BUY,0.699572992535799,0.9827679117914824,0.9433178577864816,1.1243452569333812,1.0017328460345425,54.59640862315192,1.080372042867079,-0.07863919683253662,-7.278899581291909,0.8145834082034246,-0.1150104156676256,-14.118924237530237,1.0083884751603838,-0.06507061737390218,-6.452931417949773,1.1243452569333812,0.0,0.0,57.42978518179629,-2.8333765586443675,-4.933636002958807,1.0041148494371075,-0.0023820034025650028,-0.23722419603473652,0.7042460143137783,-0.004673021777979347,-0.6635496142889508,0.9461478353469586,-0.0028299775604769817,-0.29910521641987253,1.1243452569333812,0.0,0.0,66.37,-11.773591376848081,-17.73932706806411,1.217924339010937,-0.21619149297639462,-17.750814584827157,1.0311555388902245,-0.3315825463544255,-32.156404211885345,1.1175690094435884,-0.1742511516571068,-15.591981222230231,1.1243452569333812,0.0,0.0,69.839,-15.242591376848075,-21.82532879145684,1.0979098065770976,-0.09617696054255509,-8.760005520526407,0.8423601995382379,-0.14278720700243897,-16.950848981899508,1.0223496977920705,-0.07903184000558894,-7.73041156105683,1.1243452569333812,0.0,0.0,94.971,-40.37459137684808,-42.512547380354874,1.158989337119218,-0.15725649108467543,-13.56841557478953,0.9401882948272173,-0.24061530229141836,-25.592245835863416,1.0711385109346947,-0.12782065314821311,-11.933158097672981,1.1243452569333812,0.0,0.0,94.907,-40.31059137684807,-42.47378104101984,76.13636363636364,1.0057185278794023,67.04545454545455,0.6941185583775801,73.86363636363636,0.92859402846504,90.9090909090909,1.1311911846878013,61.36363636363637,0.22721158097081573,BTPS 5 3/4,100.0,0.0,100.0,0.0,100.0,0.0,100.0,0.0,100.0,0.0,0.9780311026884201,0.004736809103062289,rising,69.31818181818183,100.0,1.0,1.0,1.0,1,1,1.085814731410449,0.8376627908134032,1.040921224905129,1.5121878563218434,Top Quartile,Top Decile,Above Median,Top Decile,Tight,6.987593684647919,"['Issue_Age', 'Cpn', 'AMT_OUTSTANDING']","[0.5638869161932013, 0.3429881097503821, 0.06087233647355834]",0.9677473624171418,1.1376737202444014,0.0
2025-11-06,IT0003535157,BTPS 5 08/01/34,2034-08-01,3.319483815195383,NO ACTION,0.24072528660401615,0.9876322258786049,0.3917740977665754,0.9965880553830824,0.5901791175473663,64.32246257523354,0.5639083985546346,0.0262707189927317,4.658685452140486,0.20788932828883427,0.03283595831518188,15.79492175282252,0.3710775285409533,0.020696569225622075,5.577424412967516,0.9965880553830824,0.0,0.0,67.25579458343569,-2.933332008202143,-4.361456177767682,0.5238211324497054,0.06635798509766089,12.668061618767561,0.14341273721001707,0.09731254939399908,67.85488130388593,0.3333444944012594,0.058429603365315996,17.528293580320156,0.9965880553830824,0.0,0.0,76.828,-12.505537424766459,-16.27731741440455,-0.26211271375134937,0.8522918312987157,325.1623267656529,-0.06452374886216164,0.30524903546617776,473.0800574068594,-0.29413699682478084,0.6859110945913562,233.1944225569541,0.9965880553830824,0.0,0.0,78.326,-14.00353742476645,-17.87853001937875,-0.25508950342339765,0.8452686209707639,331.3615717192525,-0.04791791288986106,0.28864319949387723,602.3700154059707,-0.2839113445729239,0.6756854423394993,237.9916940468637,0.9965880553830824,0.0,0.0,106.488,-42.165537424766455,-39.596515495461276,-0.28215902798170944,0.8723381455290757,309.16540961045655,-0.08931066640920661,0.33003595301322275,369.53695379156363,-0.31075839836331604,0.7025324961298914,226.07030967559268,0.9965880553830824,0.0,0.0,105.654,-41.33153742476645,-39.119709070034716,65.9090909090909,0.6006762634972765,65.9090909090909,0.2388483985022606,61.36363636363637,0.3845963236781402,87.5,1.0018976359625416,67.04545454545455,0.4416774037017506,BTPS 5 08/01/34,100.0,0.0,100.0,0.0,100.0,0.0,100.0,0.0,100.0,0.0,0.9869708047977971,0.0006614210808078003,rising,84.0909090909091,100.0,1.0,1.0,1.0,1,1,0.6397166495443555,0.28824242437540604,0.4323102444919384,1.340360841843255,Above Median,Top Decile,Above Median,Top Decile,Tight,8.0175691984671,"['Issue_Age', 'Cpn', 'AMT_OUTSTANDING']","[0.5884107558186228, 0.28421973464466577, 0.08856992253366193]",0.9612004129969504,1.0076392268952834,0.0
2025-11-06,IT0003934657,BTPS 4 02/01/37,2037-02-01,-0.6840992590098409,NO ACTION,-0.2959765898215392,0.9842913045205886,-0.9962921626132756,0.9780308880812936,-0.5825508624652378,76.09787264644756,-0.5724164213734168,-0.010134441091821045,-1.770466488445337,-0.2838654708897572,-0.012111118931781961,-4.266499362240339,-0.9889342209560352,-0.007357941657240352,-0.7440274011070673,0.9780308880812936,0.0,0.0,80.1712150457568,-4.07334239930924,-5.0808041221233164,0.5826471803337698,-1.1651980427990076,-199.98346548818387,0.008635796175866876,-0.30461238599740603,-3527.3184667884066,0.8025547739283536,-1.7988469365416293,-224.14008022438222,0.9780308880812936,0.0,0.0,90.658,-14.560127353552446,-16.06049918589247,-0.617905316031257,0.035354453566019184,5.721661891652114,-0.3509673248537689,0.05499073503222973,15.668334221229365,-1.0294594996220665,0.03316733700879093,3.221820450322254,0.9780308880812936,0.0,0.0,90.707,-14.609127353552438,-16.10584337696303,-1.5043525963734463,0.9218017339082085,61.27564309077794,-1.749915694067618,1.4539391042460788,83.08623671794292,-1.6287921473798952,0.6324999847666196,38.83245519698908,0.9780308880812936,0.0,0.0,118.704,-42.60612735355244,-35.892747801222505,-1.8761818462175535,1.2936309837523157,68.95019155340943,-2.4575630947126768,2.1615865048911376,87.95650051654958,-1.684146508462826,0.6878543458495504,40.84290400560736,0.9780308880812936,0.0,0.0,116.518,-40.420127353552445,-34.69002845061144,38.63636363636363,-0.553499178817812,46.590909090909086,-0.2936689180863797,19.318181818181817,-0.9844788331353848,86.36363636363636,0.9831173090171991,73.86363636363636,0.7013328632909447,BTPS 4 02/01/37,100.0,0.0,100.0,0.0,100.0,0.0,100.0,0.0,100.0,0.0,0.9735586787459253,0.010732625774663274,rising,79.54545454545455,100.0,-1.0,-1.0,1.0,1,0,0.6314481059142646,0.3543998680490189,1.0993766838086594,1.315402384582506,Below Median,Top Decile,Above Median,Top Decile,Tight,9.349534674160507,"['Issue_Age', 'AMT_OUTSTANDING', 'Cpn']","[0.6145889779057205, 0.17302861510052933, 0.17263185335842815]",0.960249446364678,0.9887512752275812,0.0
2025-11-06,IT0004286966,BTPS 5 08/01/39,2039-08-01,0.7451137614849443,NO ACTION,0.20486568924328147,0.981970714759663,0.49591727199213065,0.9230614112721438,0.5879339022605868,90.41372750246636,0.5915510409261612,-0.0036171386655743376,-0.6114668649326493,0.21374870152587183,-0.008883012282590363,-4.155820270998535,0.5013508289082466,-0.005433556916115911,-1.0837833497891722,0.9230614112721438,0.0,0.0,95.40679100041852,-4.993063497952164,-5.233446639460829,0.5965118424343668,-0.008577940173779997,-1.43801671983103,0.2167048144417973,-0.01183912519851582,-5.463249481875555,0.5030865484786725,-0.0071692764865418646,-1.4250582460842658,0.9230614112721438,0.0,0.0,105.466,-15.052272497533636,-14.27215642586845,-0.2510788446465761,0.8390127469071629,334.16304534612243,-0.0050433995998655,0.20990908884314696,4162.047216009283,-0.3819983668190582,0.8779156388111888,229.8218244071316,0.9230614112721438,0.0,0.0,105.848,-15.434272497533641,-14.581543813842007,0.7749255333434745,-0.18699163108288763,-24.130270667824185,0.48110456277162444,-0.276238873528343,-57.41763624006767,0.6642443372893053,-0.16832706529717467,-25.341136282769362,0.9230614112721438,0.0,0.0,138.399,-47.98527249753364,-34.671690181335464,0.8949675685219851,-0.3070336662613983,-34.30668033454978,0.655424409230783,-0.4505587199875016,-68.74304752274637,0.7674441856613683,-0.27152691366923765,-35.38067200250841,0.9230614112721438,0.0,0.0,137.399,-46.98527249753364,-34.19622595078131,64.77272727272727,0.5984665712485259,63.63636363636363,0.20326839142707337,62.5,0.48731464243108835,82.95454545454545,0.9274867954963805,79.54545454545455,1.0170067845872182,BTPS 5 08/01/39,100.0,0.0,100.0,0.0,100.0,0.0,100.0,0.0,100.0,0.0,0.9849165646563866,-0.002945849896723529,falling,65.9090909090909,100.0,1.0,1.0,1.0,1,1,0.6372829788873299,0.24530444546093153,0.5472289217814237,1.2414712012679785,Above Median,Top Decile,Top Quartile,Top Decile,Tight,11.395685350244378,"['Issue_Age', 'Cpn', 'AMT_OUTSTANDING']","[0.5290950099072579, 0.34078472730850773, 0.08755278470193953]",0.9574325219177052,0.9328019590261796,0.0
2025-11-06,IT0004532559,BTPS 5 09/01/40,2040-09-01,0.4531036913366932,NO ACTION,0.10253595466508889,0.9670073437860904,0.6569052621491349,0.9325233172712366,0.5804168322573728,94.96084468535769,0.5757949167744827,0.004621915482890149,0.8027016682452257,0.08978643316591285,0.012749521499176034,14.199829116314023,0.6488492593603101,0.00805600278882479,1.241583087049951,0.9325233172712366,0.0,0.0,100.22551820561291,-5.264673520255229,-5.252827437548844,0.5202191362857296,0.06019769597164326,11.571603313996398,0.009903979726922908,0.09263197493816598,935.2995862501365,0.5965324075256245,0.060372854623510386,10.120632651270292,0.9325233172712366,0.0,0.0,110.159,-15.198155314642321,-13.796562526223607,0.8771666574582248,-0.2967498252008519,-33.830494957218,0.5408355056170262,-0.4382995509519373,-81.04119243202655,0.9237532795850504,-0.26684801743591546,-28.88736856956509,0.9325233172712366,0.0,0.0,112.979,-18.018155314642314,-15.9482340196386,1.3201256171001132,-0.7397087848427404,-56.03321151091053,1.2159003024678978,-1.113364347802809,-91.56707473353858,1.2668408925002177,-0.6099356303510828,-48.14619019225881,0.9325233172712366,0.0,0.0,145.411,-50.450155314642316,-34.694868552704285,1.3754740066959112,-0.7950571744385384,-57.80241318904602,1.3024110265585005,-1.1998750718934117,-92.1272193042812,1.297725380943557,-0.640820118794422,-49.380255889768115,0.9325233172712366,0.0,0.0,143.82,-48.85915531464231,-33.972434509279005,62.5,0.59106843378829,60.22727272727273,0.10173650182808963,69.31818181818183,0.6461000435033541,85.22727272727273,0.9370624858643782,82.95454545454545,1.117273679310133,BTPS 5 09/01/40,100.0,0.0,100.0,0.0,100.0,0.0,100.0,0.0,100.0,0.0,0.9917465865844599,-0.024739242798369476,falling,39.77272727272727,100.0,1.0,1.0,1.0,1,1,0.6291349528154645,0.12277568582534967,0.7248740437580864,1.2541969892421387,Above Median,Top Decile,Top Quartile,Top Decile,Tight,12.012188383801714,"['Issue_Age', 'Cpn', 'AMT_OUTSTANDING']","[0.49641209287357635, 0.37957723932578663, 0.08192806743359386]",0.9579173996329567,0.9424325249573268,0.0
2025-11-06,IT0004644735,BTPS 4 1/2 03/01/26,2026-03-01,7.995528285346728,STRONG BUY,1.7328236363681402,0.7846641212519846,1.5570833911027433,0.5282591244341405,1.568100018464662,-11.613273868813064,1.7147304419282354,-0.14663042346357336,-8.551222922453244,1.9949802964037635,-0.2621566600356233,-13.140814432810021,1.5881565447167811,-0.03107315361403784,-1.9565548195958034,0.5282591244341405,0.0,0.0,-9.885373579919747,-1.7279002888933164,-17.479362546856905,1.180240177173221,0.38785984129144113,32.86278890573956,1.056620576820636,0.6762030595475041,63.9967712139884,1.3520420835876463,0.20504130751509697,15.165305021755607,0.5282591244341405,0.0,0.0,-11.004,-0.6092738688130641,-5.5368399514665585,1.6259271098726606,-0.057827091407998576,-3.5565610968176413,1.8085198305674124,-0.0756961941992722,-4.185532970184224,1.5687428986519087,-0.011659507549165449,-0.7432389007058516,0.5282591244341405,0.0,0.0,-1.34,-10.273273868813064,-766.6622232945404,1.6004522835225958,-0.03235226505793376,-2.021445137032259,1.7413256255575786,-0.008501989189438452,-0.4882480919036195,1.558573845951261,-0.0014904548485177305,-0.0956294013804078,0.5282591244341405,0.0,0.0,3.387,-15.000273868813064,-442.87788085400877,0.9243658919814127,0.6437341264832493,69.64061797426552,0.6579219573375152,1.074901679030625,163.3782929274344,1.1427558097318338,0.4143275813709095,36.256877822607656,0.5282591244341405,0.0,0.0,9.545,-21.158273868813062,-221.66866261546562,98.86363636363636,1.56312483017693,97.72727272727273,1.719313148494508,98.86363636363636,1.5339622070286107,67.04545454545455,0.5279368046488079,10.227272727272728,-1.2327550301905539,BTPS 4 1/2,100.0,0.7071066504882405,100.0,0.7071066729039102,50.0,-0.7071066935187538,100.0,0.7071067695347296,50.0,-0.7071067811181456,0.8755807050561488,-0.09091658380416423,falling,1.1363636363636365,50.0,1.0,1.0,1.0,1,1,1.6997207460193577,2.0748683821628346,1.7181919512785957,0.7104819698704419,Top Decile,Top Decile,Bottom Quartile,Above Median,Very Tight,0.3125119548059274,"['Issue_Age', 'Cpn', 'AMT_OUTSTANDING']","[0.5377096513187636, 0.34499747997124414, 0.05449364970398419]",0.9372007809939918,0.530962260605415,0.0
2025-11-06,IT0004889033,BTPS 4 3/4 09/01/28,2028-09-01,-1.89279439892402,NO ACTION,-0.44548027661341044,0.9633534309851208,-0.5193088780534044,0.47078534706380915,-0.5200354887340773,7.725535551631191,-0.5252247484813797,0.005189259747302333,0.9880074508114228,-0.44816376186428813,0.002683485250877693,0.5987733545964308,-0.520969131555551,0.0016602535021466025,0.318685574579194,0.47078534706380915,0.0,0.0,8.69651358543075,-0.9709780337995593,-11.165141331000992,-0.5390440554901869,0.019008566756109513,3.526347468239692,-0.471235226627865,0.025754950014454547,5.465412603428309,-0.5334021663045801,0.014093288251175728,2.642150496800422,0.47078534706380915,0.0,0.0,14.745,-7.019464448368808,-47.60572698276185,-0.24683218664994439,-0.27320330208413296,-110.68381912574716,-0.04510792478590999,-0.40037235182750047,-887.5874138945541,-0.27170470802873276,-0.24760417002467167,-91.1298750426879,0.47078534706380915,0.0,0.0,15.991,-8.265464448368808,-51.688227397911234,-0.748972613966866,0.22893712523278864,30.566821524162496,-0.7794952001076214,0.33401492349421097,42.8501572765399,-0.713917001628876,0.19460812357547153,27.259208059975045,0.47078534706380915,0.0,0.0,33.276,-25.550464448368814,-76.78346087477601,0.5262545304104973,-1.0462900191445748,-198.8182407563517,0.2852002249156341,-0.7306805015290445,-256.1991233089935,0.40994255370483806,-0.9292514317582425,-226.67844572180385,0.47078534706380915,0.0,0.0,44.936,-37.21046444836881,-82.80769191758955,43.18181818181818,-0.4919729022175671,37.5,-0.44200695379577937,39.77272727272727,-0.5140214898904506,64.77272727272727,0.469771875042628,29.545454545454547,-0.8063216900686168,BTPS 4 3/4,100.0,0.7071066812379835,100.0,0.7071067248286982,100.0,0.7071060062757908,50.0,-0.7071067142166433,50.0,-0.7071067810860482,0.9743119289859301,-0.01095849800080928,falling,34.090909090909086,50.0,-1.0,-1.0,-1.0,1,1,0.5636854144884679,0.5334143195089404,0.5730408143824335,0.6331826281776528,Below Median,Top Decile,Below Median,Above Median,Very Tight,2.7824917766608337,"['Cpn', 'Issue_Age', 'AMT_OUTSTANDING']","[0.40810359424176085, 0.40536994829606937, 0.12078198050698256]",0.9342555230448129,0.4724640042995374,0.0
2025-11-06,IT0004923998,BTPS 4 3/4 09/01/44,2044-09-01,-1.6170649921877782,NO ACTION,-0.6229178346840116,0.9975290557620832,-0.5322135757291798,0.6201061377467513,-0.6200869377458909,107.2285988246052,-0.606794927452464,-0.01329201029342686,-2.1905275527233856,-0.6043076998007768,-0.01861013488323482,-3.079579257621925,-0.520723866833643,-0.011489708895536799,-2.206487815654254,0.6201061377467513,0.0,0.0,113.64171384054524,-6.413115015940036,-5.643275517979411,-0.5162196641316664,-0.10386727361422443,-20.120750684084186,-0.4726035727516192,-0.15031426193239245,-31.805569703307008,-0.44235235492549857,-0.08986122080368125,-20.314398187701737,0.6201061377467513,0.0,0.0,124.424,-17.195401175394807,-13.820003515409251,-0.47172888019834913,-0.14835805754754172,-31.449856184377683,-0.41028969182344477,-0.21262814286056686,-51.82390440598109,-0.40727949969265315,-0.12493407603652668,-30.675266754962983,0.6201061377467513,0.0,0.0,125.217,-17.9884011753948,-14.365781941715758,-0.36180515470866853,-0.2582817830372223,-71.38698068204612,-0.24945117348599616,-0.37346666119801547,-149.71532946003495,-0.3075133574273024,-0.22470021830187742,-73.07006527285277,0.6201061377467513,0.0,0.0,157.492,-50.26340117539479,-31.91489165938797,0.5786996832592751,-1.198786621005166,-207.1517636813526,0.3622095527089563,-0.9851273873929679,-271.97718912367327,0.36405918419097016,-0.89627275992015,-246.18874463859933,0.6201061377467513,0.0,0.0,154.89,-47.661401175394786,-30.771128654088496,34.090909090909086,-0.5904413709917978,28.40909090909091,-0.6180610658385641,37.5,-0.5267496293880986,75.0,0.6208883263391783,86.36363636363636,1.3877856461876608,BTPS 4 3/4,50.0,-0.707106681237985,50.0,-0.7071067248286977,50.0,-0.7071060062757908,100.0,0.7071067142166433,100.0,0.7071067810860481,0.987819051147595,0.009710004614488121,rising,98.86363636363636,100.0,-1.0,-1.0,-1.0,1,1,0.6721348255924764,0.7458765524344477,0.5872807374378698,0.8340115861642652,Below Median,Above Median,Top Quartile,Top Decile,Moderate,13.805166678043436,"['Cpn', 'Issue_Age', 'GREEN_BOND_LOAN_INDICATOR']","[0.45743326396498735, 0.43176541707754096, 0.05270882288572069]",0.941907503928249,0.6244464610794908,0.0
2025-11-06,IT0005024234,BTPS 3 1/2 03/01/30,2030-03-01,-4.939992479185207,WEAK SELL,-0.9088879832226918,0.9883138594927471,-1.2248600169144717,-0.012929067513526663,-0.9631287002152924,19.81803540942639,-0.9721053547711284,0.008976654555835961,0.9234240321211905,-0.9238389321686423,0.014950948945950504,1.6183501542870966,-1.2325764223960387,0.007716405481567046,0.6260387006237753,-0.012929067513526663,0.0,0.0,21.085451784701988,-1.267416375275598,-6.010857095289055,-0.8448127359220905,-0.1183159642932019,-14.004992806312739,-0.7339732862480122,-0.17491469697467965,-23.831207193616393,-1.132942345750177,-0.09191767116429461,-8.113181636980233,-0.012929067513526663,0.0,0.0,27.909,-8.09096459057361,-28.990521293040082,-0.9280528897768798,-0.03507581043841257,-3.779505505219089,-0.8596964932466603,-0.04919148997603151,-5.72195999288806,-1.2006731420309278,-0.024186874883543874,-2.014442885029285,-0.012929067513526663,0.0,0.0,28.934,-9.115964590573611,-31.50606410251954,-1.4908673086759339,0.5277386084606415,35.39809356940869,-1.790437843865051,0.8815498606423592,49.236551759634736,-1.5123668705418696,0.2875068536273979,19.010390754152617,-0.012929067513526663,0.0,0.0,52.822,-33.00396459057362,-62.481474734628506,-0.9886097306465885,0.025481030431296126,2.5774609923052707,-0.950852444588886,0.04196446136619414,4.413351531425351,-1.2467074436813543,0.02184742676688267,1.7524100543692307,-0.012929067513526663,0.0,0.0,61.995,-42.176964590573604,-68.03284875194825,17.045454545454543,-0.9280556425450959,18.181818181818183,-0.9018015609128268,11.363636363636363,-1.2099194910505964,37.5,-0.019759458387859245,37.5,-0.5396741942133524,BTPS 3 1/2,50.0,-0.7071067768331701,50.0,-0.7071067762976372,50.0,-0.7071067773711313,50.0,-0.7071067714211638,50.0,-0.7071067805929978,0.9709185229107997,0.017395336581947363,rising,86.36363636363636,100.0,-1.0,-1.0,-1.0,1,1,1.0439702911587478,1.0882947922323143,1.3515940344177382,0.017388945937163055,Bottom Quartile,Above Median,Below Median,Above Median,Very Tight,4.103366640190842,"['Issue_Age', 'AMT_OUTSTANDING', 'Cpn']","[0.4712020539424448, 0.2583390688227792, 0.17992633535936234]",0.9094674581245864,-0.0198726942345574,0.0
2025-11-06,IT0005083057,BTPS 3 1/4 09/01/46,2046-09-01,-3.02116406723205,NO ACTION,-0.45547598740605927,0.991678855279933,-0.3377186512561274,0.2735741496293083,-0.4784597845942639,111.22630677246931,-0.4866264270604882,0.008166642466224283,1.6782159464158255,-0.4676097134193456,0.012133726013286328,2.5948403990746316,-0.34385026930382767,0.0061316180477002935,1.7832232273053843,0.2735741496293083,0.0,0.0,118.15222571907915,-6.9259189466098405,-5.861860751138826,-0.42785619445638345,-0.05060359013788046,-11.82724233301123,-0.3819786783283911,-0.07349730907766816,-19.241206727869002,-0.29443886109789846,-0.043279790158228915,-14.699074886698213,0.2735741496293083,0.0,0.0,129.702,-18.475693227530684,-14.244725005093375,-0.4330842004600197,-0.045375584134244196,-10.477312041934407,-0.38882029674687496,-0.06665569065918431,-17.14305798914399,-0.29858949485326475,-0.03912915640286263,-13.104665692148757,0.2735741496293083,0.0,0.0,130.066,-18.839693227530688,-14.484717932497512,-0.4025390917116806,-0.0759206928825833,-18.860451707611162,-0.3446848658873254,-0.11079112151873388,-32.14272782741723,-0.2706859161069611,-0.0670327351491663,-24.764026749834947,0.2735741496293083,0.0,0.0,161.523,-50.29669322753068,-31.13902863642749,-0.39295193804514383,-0.08550784654912008,-21.76038240158988,-0.32999922490740635,-0.12547676249865292,-38.02334951893453,-0.2618563861182727,-0.07586226513785466,-28.970942189088227,0.2735741496293083,0.0,0.0,157.055,-45.82869322753069,-29.180028158678606,45.45454545454545,-0.45105499482799505,36.36363636363637,-0.4519247299812252,48.86363636363637,-0.33491572576053635,56.81818181818182,0.27018910980316174,89.77272727272727,1.4759377095322381,BTPS 3 1/4,50.0,-0.707106774156017,50.0,-0.7071067742099236,50.0,-0.7071067732710202,100.0,0.7071067731025111,100.0,0.7071067807961304,0.9869096215919029,0.004769233688030172,rising,94.31818181818183,100.0,-1.0,-1.0,-1.0,1,1,0.5186199939000578,0.5453830991617733,0.3726617801593727,0.36794348028056556,Below Median,Above Median,Top Quartile,Top Decile,Moderate,12.781720526213292,"['Issue_Age', 'Cpn', 'GREEN_BOND_LOAN_INDICATOR']","[0.6580235474163031, 0.15748601176148633, 0.1086398272341642]",0.9241493864119537,0.2717374868900912,0.0
2025-11-06,IT0005094088,BTPS 1.65 03/01/32,2032-03-01,-1.4755931468468972,NO ACTION,-0.5431960099458005,0.9883632214517774,-0.8430205779378389,0.15183652979075488,-0.665974843575482,41.1645722630764,-0.6417525598055542,-0.024222283769927744,-3.7743960693865075,-0.5065999421105541,-0.03659606783524638,-7.223859315971688,-0.8205882891417907,-0.022432288796048194,-2.733683726603087,0.15183652979075488,0.0,0.0,43.78956541036666,-2.6249931472902617,-5.994563138709226,-0.6858694144650136,0.019894570889531615,2.9006353366822872,-0.571880754515757,0.02868474456995651,5.015861058772534,-0.8588873187935802,0.015866740855741246,1.8473599881870608,0.15183652979075488,0.0,0.0,52.398,-11.233427736923602,-21.438657457879568,-0.6653722141246546,-0.0006026294508273411,-0.09057027464892208,-0.5413708920464924,-0.0018251178993081707,-0.33712892444142323,-0.841775387811229,-0.0012451901266099519,-0.14792427170569197,0.15183652979075488,0.0,0.0,55.373,-14.208427736923596,-25.659486996112996,-1.0010304648494421,0.33505562127396016,33.47107103051518,-1.0477410542528993,0.5045450443070988,48.15550917314375,-1.116056812972664,0.2730362350348251,24.464366814906583,0.15183652979075488,0.0,0.0,81.309,-40.144427736923596,-49.372674282042986,-0.8284870536596143,0.1625122100841323,19.615539845158136,-0.789279456677738,0.2460834467319375,31.178240043132032,-0.9852363836103453,0.14221580567250636,14.434688628519318,0.15183652979075488,0.0,0.0,83.286,-42.1214277369236,-50.57443955990942,30.681818181818183,-0.6356032538722989,30.681818181818183,-0.5389608166166282,22.727272727272727,-0.8333042640141981,46.590909090909086,0.1469875314084106,55.68181818181818,-0.06896915686421831,BTPS 1.65 03/01/32,100.0,0.0,100.0,0.0,100.0,0.0,100.0,0.0,100.0,0.0,0.9927835725021084,-0.004420351050331006,falling,87.5,100.0,-1.0,-1.0,-1.0,1,1,0.7218743987137788,0.6504183130348905,0.9302463696239172,0.20421250063514407,Below Median,Top Decile,Above Median,Top Decile,Very Tight,5.431326553674154,"['Cpn', 'Issue_Age', 'AMT_OUTSTANDING']","[0.39823244042121175, 0.3788656525288477, 0.14081281899669]",0.9179109119467496,0.1478298752240559,0.0
2025-11-06,IT0005162828,BTPS 2.7 03/01/47,2047-03-01,-4.924485037268298,WEAK SELL,-0.80604747789737,0.983276859325711,-0.541307236956846,-1.78386666919021,-1.017259689988627,110.50456262451137,-0.989158186684374,-0.028101503304252984,-2.840951366368727,-0.7647971091789577,-0.041250368718412256,-5.393635473247635,-0.518139153995074,-0.023168082961771974,-4.47140161788508,-1.78386666919021,0.0,0.0,117.77670981745212,-7.27214719294075,-6.174520585262362,-0.9798404752412959,-0.03741921474733112,-3.8189088235230706,-0.7491480957862988,-0.05689938211107115,-7.595211370300414,-0.5094605561429444,-0.03184668081390163,-6.251059047613527,-1.78386666919021,0.0,0.0,128.814,-18.309437375488628,-14.21385670351611,-0.9362514323225841,-0.08100825766604292,-8.652404044909511,-0.6825188734661334,-0.12352860443123659,-18.09892845805285,-0.4710483273887359,-0.0702589095681101,-14.915435209386684,-1.78386666919021,0.0,0.0,129.431,-18.926437375488646,-14.622800854529721,-0.8099397570674705,-0.20731993292115658,-25.59695687887939,-0.49746228225300504,-0.30858519564436493,-62.031876676880096,-0.36169799445190287,-0.17960924250494315,-49.65723899337323,-1.78386666919021,0.0,0.0,161.778,-51.273437375488626,-31.693702093188975,-0.7794094437908272,-0.23785024619779982,-30.51672584172074,-0.4534473986844765,-0.3526000792128935,-77.75986199498698,-0.33658666023193656,-0.20472057672490945,-60.822544334224446,-1.78386666919021,0.0,0.0,157.655,-47.150437375488636,-29.90735300022067,15.909090909090908,-0.9813301900789796,21.59090909090909,-0.7997628829465939,36.36363636363637,-0.5357188738879031,5.681818181818182,-1.8119935110540157,88.63636363636364,1.4600227811084747,BTPS 2.7 03/01/47,100.0,0.0,100.0,0.0,100.0,0.0,100.0,0.0,100.0,0.0,0.9871424147290362,-0.003865555403325227,falling,73.86363636363636,100.0,-1.0,-1.0,-1.0,1,1,1.1026448433154297,0.9651544400194443,0.5973153030997415,2.399211005527071,Bottom Quartile,Top Decile,Top Quartile,Top Decile,Moderate,12.245107356434204,"['Issue_Age', 'Cpn', 'GREEN_BOND_LOAN_INDICATOR']","[0.5252271375168899, 0.15902449636714647, 0.13446368844077344]",0.8187153223248098,-1.8223775314766737,0.0
2025-11-06,IT0005170839,BTPS 1.6 06/01/26,2026-06-01,-0.7125479621646917,NO ACTION,-0.18548315540650076,0.9683575637950371,-0.5126301310106787,0.24646063904655896,-0.38627220560753184,-17.147526202375786,-0.2695934756118501,-0.11667872999568174,-43.27950645056428,-0.01946258110290835,-0.1660205743035924,-853.0240060316709,-0.40837375768270423,-0.10425637332797444,-25.529645040515657,0.24646063904655896,0.0,0.0,-16.079315594730833,-1.0682106076449536,-6.643383548803944,-0.5395833375763508,0.15331113196881896,28.4128731283957,-0.4239986523537272,0.23851549694722643,56.25383241144316,-0.6604681587699995,0.14783802775932087,22.38382328623679,0.24646063904655896,0.0,0.0,-14.082,-3.0655262023757857,-21.76911092315633,0.3310688733673837,-0.7173410789749155,-216.67426780755156,0.013117161050506138,-0.1986003164570069,-1514.0483850696126,0.3913590343910388,-0.9039891654017175,-230.98716596887127,0.24646063904655896,0.0,0.0,-8.439,-8.708526202375786,-103.19381670880914,0.4417688435379544,-0.8280410491454863,-187.4376254717888,0.17107334978373148,-0.35655650519023224,-208.42316164304364,0.49167230565141506,-1.0043024366620936,-204.26255550538707,0.24646063904655896,0.0,0.0,0.817,-17.964526202375787,-2198.8403895338733,-0.9370637274611133,0.5507915218535815,58.778448021678834,-1.0143058782738406,0.8288227228673398,81.71329107413953,-0.9876512977952855,0.4750211667846068,48.096039871094504,0.24646063904655896,0.0,0.0,11.172,-28.319526202375787,-253.48662886705262,51.13636363636363,-0.36032597658304055,52.27272727272727,-0.18403697942569813,40.909090909090914,-0.5074341194486854,53.40909090909091,0.24274954507331462,2.272727272727273,-1.3547888977555282,BTPS 1.6 06/01/26,100.0,0.0,100.0,0.0,100.0,0.0,100.0,0.0,100.0,0.0,0.9074143248998447,0.060943238895192375,rising,43.18181818181818,100.0,-1.0,-1.0,-1.0,1,1,0.4186945180477801,0.22209596320105912,0.5656710296432166,0.33147717138420785,Above Median,Top Decile,Bottom Decile,Top Decile,Very Tight,0.5455217072231733,"['Cpn', 'Issue_Age', 'GREEN_BOND_LOAN_INDICATOR']","[0.48360463105148777, 0.36412934021059884, 0.07502597658800876]",0.9227599478500954,0.2441406738043281,0.0
2025-11-06,IT0005177909,BTPS 2 1/4 09/01/36,2036-09-01,-0.4686600976004058,NO ACTION,-0.22047976810719422,0.9791703142543767,-0.4228821093094165,0.15951320366767976,-0.3805247484160129,73.88463982992879,-0.35505645877179054,-0.025468289644222375,-7.1730251056464756,-0.18541549558654205,-0.03506427252065217,-18.91118674769411,-0.40171387715704826,-0.021168232152368238,-5.269479803692375,0.15951320366767976,0.0,0.0,77.88903208799812,-4.0043922580693305,-5.141150365087475,-0.37707193271057443,-0.0034528157054384834,-0.9156914939409132,-0.2186104064529964,-0.0018693616541978209,-0.8551109707069946,-0.42165578569987655,-0.0012263236095399477,-0.29083523149597884,0.15951320366767976,0.0,0.0,87.297,-13.41236017007121,-15.364056231640042,-0.39975810125390643,0.019233352837893514,4.811247676142197,-0.2479771988480966,0.027497430740902384,11.088692734559524,-0.44088076659405057,0.017998657284634068,4.082431859170552,0.15951320366767976,0.0,0.0,88.437,-14.55236017007121,-16.455058593604154,-0.7347512001372712,0.35422645172125833,48.21039378146506,-0.7406668843330753,0.5201871162258811,70.23226233086567,-0.7344815052350092,0.3115993959255927,42.424402719773205,0.15951320366767976,0.0,0.0,118.175,-44.29036017007121,-37.478620830398434,-0.7337790058625444,0.3532542574465315,48.141776994165916,-0.7420352509121835,0.5215554828049893,70.28715618767785,-0.735236165917803,0.31235405660838655,42.483499430434264,0.15951320366767976,0.0,0.0,118.258,-44.37336017007121,-37.52250178957784,52.27272727272727,-0.35466945371821446,51.13636363636363,-0.21876073036389743,46.590909090909086,-0.41891400308858123,47.72727272727273,0.15475652130416487,72.72727272727273,0.652529638547552,BTPS 2 1/4,100.0,0.0,100.0,0.0,100.0,0.0,100.0,0.0,100.0,0.0,0.9665302892536493,0.012640025000727473,rising,57.95454545454546,100.0,-1.0,-1.0,-1.0,1,1,0.4124646397809283,0.2640006115746576,0.46663694488486834,0.21453724113815556,Above Median,Top Decile,Above Median,Top Decile,Tight,8.265994637076801,"['Issue_Age', 'Cpn', 'GREEN_BOND_LOAN_INDICATOR']","[0.46268293141011857, 0.3505011658066856, 0.10512020778315602]",0.9183043049999602,0.1556433869954399,0.0
2025-11-06,IT0005210650,BTPS 1 1/4 12/01/26,2026-12-01,-4.8755542622286985,WEAK SELL,-1.1025540482912075,0.9665292020215754,-1.2872327223473854,0.8841390098561506,-1.0737711839543789,-15.159119171037169,-1.1227253799860843,0.04895419603170548,4.360300075899437,-1.1917149850022437,0.0891609367110362,7.4817332235438005,-1.32243764319972,0.03520492085233462,2.6621232968642516,0.8841390098561506,0.0,0.0,-15.268869815795416,0.10975064475824681,0.7187869567977633,-0.8978507227172039,-0.17592046123717497,-19.59350867875102,-0.8322857697255093,-0.27026827856569824,-32.473014095571074,-1.1560349626436697,-0.13119775970371572,-11.348943830279385,0.8841390098561506,0.0,0.0,-9.044,-6.115119171037168,-67.61520526620573,-0.9231561192793519,-0.15061506467502694,-16.315232049924465,-0.8731372340658659,-0.22941681422534166,-26.275000383334397,-1.175505208259752,-0.11172751408763348,-9.504637865669178,0.8841390098561506,0.0,0.0,-6.948,-8.211119171037168,-118.17960793349465,-1.034557052407639,-0.039214131546739806,-3.7904271278647506,-1.036134407477891,-0.06641964081331642,-6.410330522075691,-1.2584235507817292,-0.02880917156565621,-2.28930643572503,0.8841390098561506,0.0,0.0,4.25,-19.40911917103717,-456.68515589102714,-0.7439779542175691,-0.3297932297368098,-44.328359924429826,-0.6065105327699702,-0.49604351552123727,-81.78646215377833,-1.0274785153297328,-0.2597542070176526,-25.280743160475666,0.8841390098561506,0.0,0.0,19.823,-34.98211917103717,-176.4723762971797,13.636363636363635,-1.0369475782718758,9.090909090909092,-1.0939576494501324,9.090909090909092,-1.2714388319558945,79.54545454545455,0.88809633184411,4.545454545454546,-1.310943227969917,BTPS 1 1/4,100.0,0.0,100.0,0.0,100.0,0.0,100.0,0.0,100.0,0.0,0.9621233870771578,0.004405814944417608,rising,38.63636363636363,100.0,-1.0,-1.0,-1.0,1,1,1.163899710703406,1.3201889023281117,1.4204203291856796,1.1891225277647144,Bottom Quartile,Top Decile,Bottom Decile,Top Decile,Very Tight,1.0257295092102936,"['Cpn', 'Issue_Age', 'GREEN_BOND_LOAN_INDICATOR']","[0.5553424136328508, 0.3316999862370676, 0.06839553395184624]",0.9554379338217648,0.8931857598088929,0.0
2025-11-06,IT0005217390,BTPS 2.8 03/01/67,2067-03-01,5.594166170126357,WEAK BUY,1.1313762618643695,0.9892985926792275,1.1714329156780012,-0.9073188044011813,1.0966440102393575,135.43872612136076,1.1135536054195054,-0.016909595180147896,-1.5185254617288992,1.1610154196663036,-0.029639157801934157,-2.5528651079557987,1.1829414910906082,-0.01150857541260697,-0.9728778136532267,-0.9073188044011813,0.0,0.0,144.5409913438727,-9.102265222511932,-6.297359065586659,1.05425779384993,0.04238621638942752,4.02047926367174,1.0636662433221236,0.0677100185422459,6.365720293444379,1.141887949946621,0.029544965731380213,2.5873786893034,-0.9073188044011813,0.0,0.0,155.57,-20.131273878639234,-12.940331604644342,0.9944461423566566,0.10219786788270091,10.276862919174711,0.975728632873429,0.15564762899094042,15.951938085221398,1.1010230739733327,0.07040984170466857,6.394946911610251,-0.9073188044011813,0.0,0.0,157.277,-21.838273878639228,-13.885230438812227,0.7880188555747515,0.30862515466460605,39.164691119356185,0.667421404276465,0.46395485758790445,69.51452975042258,0.9354127871342158,0.2360201285437854,25.23165486583786,-0.9073188044011813,0.0,0.0,190.168,-54.72927387863925,-28.779433908839184,1.0122919227050786,0.08435208753427892,8.332782748635623,1.0121685815481511,0.11920768031621831,11.777453016387868,1.1185689348482901,0.05286398082971111,4.726036877135095,-0.9073188044011813,0.0,0.0,183.836,-48.397273878639254,-26.326331010251863,79.54545454545455,1.0991280396969096,81.81818181818183,1.1225551418463675,80.68181818181817,1.153588084994369,17.045454545454543,-0.9249046996925425,98.86363636363636,2.0098373220112573,BTPS 2.8 03/01/67,100.0,0.0,100.0,0.0,100.0,0.0,100.0,0.0,100.0,0.0,0.9925691065734258,-0.0032705138941983014,falling,89.77272727272727,100.0,1.0,1.0,1.0,1,1,1.1886924005183965,1.3547003773517552,1.29263892909121,1.2202981863152156,Top Quartile,Top Decile,Top Decile,Top Decile,Moderate,15.050581110719463,"['REL_SPRD_LOG', 'Issue_Age', 'AMT_OUTSTANDING']","[0.3736389845842486, 0.2743046738811036, 0.21569057618308968]",0.8636342346484418,-0.9302050659642908,0.0
2025-11-06,IT0005240350,BTPS 2.45 09/01/33,2033-09-01,0.0649199626412695,WEAK SELL,-0.9685625800528538,0.992160582141089,-1.209257407297708,-1.1760704549779635,-1.1877367576812503,54.50973881536164,-1.1470458160517725,-0.04069094162947784,-3.5474556208045724,-0.9094953513431189,-0.05906722870973491,-6.494505768837125,-1.178089921098321,-0.03116748619938714,-2.6455948206203597,-1.1760704549779635,0.0,0.0,57.24699064216796,-2.7372518268063217,-4.781477236834738,-1.1792092917983283,-0.00852746588292197,-0.7231511717145834,-0.9571787802661382,-0.011383799786715554,-1.1893075674556424,-1.2029371240793094,-0.006320283218398615,-0.5254042825135631,-1.1760704549779635,0.0,0.0,66.314,-11.804261184638356,-17.800556719332725,-1.2000989372210007,0.012362179539750384,1.0300966906417812,-0.9923843293402532,0.02382174928739944,2.4004559869653295,-1.2211621795687815,0.01190477227107345,0.9748723284068662,-1.1760704549779635,0.0,0.0,68.357,-13.847261184638363,-20.257268725386773,-1.6019253416397372,0.4141885839584869,25.85567320815054,-1.656828635370245,0.6882660553173913,41.54117308634455,-1.4423532256956673,0.23309581839795923,16.16079977007393,-1.1760704549779635,0.0,0.0,94.798,-40.288261184638365,-42.49906240678966,-1.1946592209141336,0.006922463232883258,0.5794508637903634,-0.9870561150157964,0.018493534962942593,1.8736052078747427,-1.2185020006619331,0.009244593364225118,0.7586851136341688,-1.1760704549779635,0.0,0.0,96.187,-41.67726118463836,-43.32941164638196,12.5,-1.1491100271789045,15.909090909090908,-0.9610108865521321,13.636363636363635,-1.1945303516287324,11.363636363636363,-1.196888229444192,60.22727272727273,0.22530045527428413,BTPS 2.45 09/01/33,100.0,0.0,100.0,0.0,100.0,0.0,100.0,0.0,100.0,0.0,0.9867304014894369,0.005430180651652128,rising,95.45454545454545,100.0,-1.0,-1.0,-1.0,1,1,1.2874311485674426,1.1597486503068313,1.3343770514252735,1.5817556477689274,Bottom Quartile,Top Decile,Above Median,Top Decile,Tight,6.620712021268815,"['Issue_Age', 'Cpn', 'AMT_OUTSTANDING']","[0.40651217279351876, 0.28579475941153726, 0.1575550575791588]",0.8498619897842148,-1.2037472561141918,0.0
2025-11-06,IT0005240830,BTPS 2.2 06/01/27,2027-06-01,-4.616768639724771,WEAK SELL,-1.0455460245724462,0.9348008917308932,-1.2258222092850337,0.18621960679375246,-1.0218558405733558,-8.990801975029541,-0.8226064618969977,-0.19924937867635806,-24.221712991981782,-0.7386723032403006,-0.3068737213321455,-41.54395878004366,-1.0674755315178082,-0.15834667776722555,-14.833752307062479,0.18621960679375246,0.0,0.0,-7.076940801080495,-1.913861173949046,-27.043622732473317,-0.9719117361245262,-0.049944104448829574,-5.1387489294146755,-0.9639018886088978,-0.08164413596354836,-8.470170676225152,-1.1854289962384912,-0.04039321304654253,-3.4074763510904003,0.18621960679375246,0.0,0.0,-3.043,-5.947801975029541,-195.4584934434338,-0.9611316412817863,-0.06072419929156947,-6.317989758279871,-0.9457626330140045,-0.09978339155844163,-10.550574427474405,-1.1757693394987299,-0.050052869786303855,-4.257031347827113,0.18621960679375246,0.0,0.0,-0.939,-8.05180197502954,-857.48688916729,-1.1547487659628985,0.13289292538954278,11.508384174620902,-1.2509641343325888,0.20541810976014263,16.420783176782162,-1.308004757641287,0.08218254835625327,6.283046544581968,0.18621960679375246,0.0,0.0,11.811,-20.80180197502954,-176.12227548401754,-1.5241679669760542,0.5023121264026984,32.95648078102812,-1.9008832911204239,0.8553372665479777,44.99683205401523,-1.4574653058686147,0.23164309658358095,15.893558087557452,0.18621960679375246,0.0,0.0,25.457,-34.44780197502954,-135.31760207996928,14.772727272727273,-0.9858536219213371,11.363636363636363,-1.0373941061718424,10.227272727272728,-1.2108685189955963,48.86363636363637,0.18178408289722198,11.363636363636363,-1.1749278173188153,BTPS 2.2 06/01/27,100.0,0.0,100.0,0.0,100.0,0.0,100.0,0.0,100.0,0.0,0.9535369331286755,-0.018736041397782288,falling,7.954545454545454,100.0,-1.0,-1.0,-1.0,1,1,1.1076267784016502,1.2519279763682367,1.3526557830666084,0.2504560109681916,Bottom Quartile,Top Decile,Bottom Quartile,Top Decile,Very Tight,1.5130177053904958,"['Cpn', 'Issue_Age', 'GREEN_BOND_LOAN_INDICATOR']","[0.40818229998151045, 0.3970582870086212, 0.11443229424928844]",0.91967288123942,0.1828258358713956,0.0
2025-11-06,IT0005273013,BTPS 3.45 03/01/48,2048-03-01,-2.457330641549589,NO ACTION,-0.35162386391132494,0.9858361508868541,-0.2749120159306068,-1.470920181858898,-0.6569274564415979,115.18339866397253,-0.6282878967634553,-0.02863955967814258,-4.558349662605413,-0.30981200976327083,-0.041811854148054106,-13.495878623431972,-0.2490837540619863,-0.025828261868620528,-10.369307676831548,-1.470920181858898,0.0,0.0,122.76249258222212,-7.5790939182495976,-6.173786274790731,-0.6549804385978207,-0.0019470178437771546,-0.2972635057955274,-0.34940152535703833,-0.002222338554286607,-0.6360414392614776,-0.2735158936674381,-0.0013961222631687087,-0.510435497332624,-1.470920181858898,0.0,0.0,133.605,-18.421601336027464,-13.788107731483592,-0.5770065269943447,-0.07992092944725315,-13.8509573675829,-0.23684177683266866,-0.11478208707865628,-48.46361303622114,-0.20393617871384254,-0.07097583721676429,-34.80296344870678,-1.470920181858898,0.0,0.0,134.77,-19.586601336027485,-14.533354110391144,0.20404602974830166,-0.8609734861898996,-421.9505986256544,0.009401223958868414,-0.36102508787019333,-3840.1883141056132,0.04813935585638276,-0.32305137178698956,-671.0752541916928,-1.470920181858898,0.0,0.0,167.408,-52.22460133602746,-31.196000987352974,-0.4827078873436386,-0.17421956909795927,-36.092131505760875,-0.09658584732367434,-0.2550380165876506,-264.0531685016557,-0.11760299660222279,-0.15730901932838404,-133.76275307353475,-1.470920181858898,0.0,0.0,161.363,-46.179601336027474,-28.61845734968092,31.818181818181817,-0.6266990114422262,43.18181818181818,-0.348882321235112,51.13636363636363,-0.2729683918604341,7.954545454545454,-1.4952836785187456,90.9090909090909,1.563194162387048,BTPS 3.45 03/01/48,100.0,0.0,100.0,0.0,100.0,0.0,100.0,0.0,100.0,0.0,0.9833875345011757,0.0024486163856783927,rising,81.81818181818183,100.0,-1.0,-1.0,-1.0,1,1,0.712067606144649,0.4210314438996589,0.30335665756939145,1.9783137100542203,Below Median,Top Decile,Top Decile,Top Decile,Moderate,13.469614718539448,"['Issue_Age', 'Cpn', 'GREEN_BOND_LOAN_INDICATOR']","[0.3797064838283351, 0.32095396527999603, 0.13409189343077946]",0.8347523425391106,-1.5038527247988136,0.0
2025-11-06,IT0005274805,BTPS 2.05 08/01/27,2027-08-01,-2.3178916042393265,NO ACTION,-0.539125168199404,0.9495230578893338,-0.6274140208636276,0.07796121287537697,-0.5961430749801523,-4.756664246155628,-0.5738349124997364,-0.022308162480415894,-3.8875574848664147,-0.5021366000122576,-0.036988568187146464,-7.366236089864777,-0.6050760646529287,-0.022337956210698895,-3.691759953244215,0.07796121287537697,0.0,0.0,-3.978596467988152,-0.7780677781674763,-19.55633808234104,-0.6988036528236056,0.10266057784345328,14.690904370569566,-0.6924310447706061,0.1533058765712021,22.140236997601217,-0.7172186421160992,0.08980462125247157,12.521233376671095,0.07796121287537697,0.0,0.0,0.328,-5.084664246155628,-1550.2024668095676,-0.708780231487449,0.11263715650729667,15.891689682392371,-0.7037950962772498,0.16466992807784575,23.397424422126694,-0.7239539887100346,0.09653996784640695,13.335096983844979,0.07796121287537697,0.0,0.0,2.591,-7.347664246155628,-283.5841072094642,-0.8893727319275162,0.2932296569473639,32.97038948055169,-0.9719183881962872,0.43279321999688314,44.529789825984636,-0.8662263939337506,0.23881237307012293,27.569278884321264,0.07796121287537697,0.0,0.0,15.881,-20.63766424615563,-129.95191885372734,-0.5965436874585748,0.0004006124784224907,0.0671555965018489,-0.5397202102397528,0.00059504204034877,0.11025009218376926,-0.6276592855855356,0.00024526472190800064,0.03907609170022666,0.07796121287537697,0.0,0.0,28.757,-33.51366424615563,-116.54089172897568,35.22727272727273,-0.5668763399365834,31.818181818181817,-0.5349217144292359,31.818181818181817,-0.6206475707698696,43.18181818181818,0.07222382516495549,17.045454545454543,-1.0815623233525102,BTPS 2.05 08/01/27,100.0,0.0,100.0,0.0,100.0,0.0,100.0,0.0,100.0,0.0,0.9432608753555852,0.00626218253374855,rising,15.909090909090908,100.0,-1.0,-1.0,-1.0,1,1,0.646181200311218,0.6455439215208818,0.6923313978731492,0.10485391266363694,Below Median,Top Decile,Bottom Quartile,Top Decile,Very Tight,1.6719654196791112,"['Cpn', 'Issue_Age', 'GREEN_BOND_LOAN_INDICATOR']","[0.4657235045266511, 0.33958236891937255, 0.10881927959730175]",0.9141251530433254,0.07263771940406,0.0
2025-11-06,IT0005321325,BTPS 2.95 09/01/38,2038-09-01,-0.7250100454278225,NO ACTION,-0.31031304716841,0.9732002508988598,-0.5742293092437291,0.9260075986519714,-0.46828731066442003,84.51924810993366,-0.3647401413971943,-0.10354716926722574,-28.38929820875823,-0.1539581388521051,-0.1563549083163049,-101.55676038070722,-0.4785194681483953,-0.09570984109533376,-20.001242470981058,0.9260075986519714,0.0,0.0,89.57217571685081,-5.052927606917152,-5.641179937758785,-0.46564945660465484,-0.002637854059765188,-0.5664892261123915,-0.30497998598629833,-0.005333061182111687,-1.7486593390706457,-0.5711729334784138,-0.0030563757653152557,-0.53510513763171,0.9260075986519714,0.0,0.0,99.03,-14.510751890066345,-14.65288487185808,-0.35855540410633874,-0.1097319065580813,-30.603890567815412,-0.15305621571123423,-0.15725683145717578,-102.74448538530324,-0.478066671738719,-0.09616263750501008,-20.114900531295863,0.9260075986519714,0.0,0.0,100.548,-16.028751890066346,-15.941393054533364,-0.875534461520422,0.407247150856002,46.514119558170115,-0.9165038458324164,0.6061907986640064,66.14165284808675,-0.9210713590557957,0.3468420498120667,37.65637077261664,0.9260075986519714,0.0,0.0,130.268,-45.748751890066345,-35.11894854189398,-0.6157352045641228,0.14744789389970275,23.946639791274677,-0.5259515127252525,0.21563846555684252,40.99968461722433,-0.7035404172404601,0.12931110799673107,18.380053652913162,0.9260075986519714,0.0,0.0,130.004,-45.484751890066335,-34.987194152924225,46.590909090909086,-0.44104346634529173,45.45454545454545,-0.3078935968719067,35.22727272727273,-0.5681905163197681,84.0909090909091,0.930468412320521,77.27272727272727,0.8870296758113095,BTPS 2.95 09/01/38,100.0,0.0,100.0,0.0,100.0,0.0,100.0,0.0,100.0,0.0,0.9787908901935579,-0.005590639294698163,falling,52.27272727272727,100.0,-1.0,-1.0,-1.0,1,1,0.5075936787586129,0.37156622095241887,0.6336437617718705,1.2454336752062554,Below Median,Top Decile,Top Quartile,Top Decile,Tight,9.591711755233945,"['Issue_Age', 'GREEN_BOND_LOAN_INDICATOR', 'AMT_OUTSTANDING']","[0.5214649085686375, 0.2552809537336253, 0.1808376377170607]",0.9575835000193236,0.935800662649917,0.0
2025-11-06,IT0005323032,BTPS 2 02/01/28,2028-02-01,-5.501894156815091,MODERATE SELL,-1.2405307999403279,0.9478588296243081,-1.2039181829669416,-0.9924150471848585,-1.2862657579562775,-2.2380776223883,-1.283176399882309,-0.0030893580739685955,-0.2407586400572893,-1.2261759958131002,-0.014354804127227672,-1.1706968705286915,-1.1989185559434323,-0.004999627023509312,-0.41701139389522196,-0.9924150471848585,0.0,0.0,-1.503271677979909,-0.7348059444083912,-48.88044857651918,-1.3532438823661317,0.06697812440985418,4.94944959941727,-1.3488125190850102,0.10828171914468232,8.027929516501233,-1.2420285474480321,0.03811036448109051,3.0683967975257356,-0.9924150471848585,0.0,0.0,3.746,-5.9840776223883,-159.74579835594557,-1.3981144874465574,0.11184872949027991,7.999969222445983,-1.419895229171732,0.17936442923140405,12.632229778869657,-1.2634797773564483,0.0595615943895067,4.714091589397417,-0.9924150471848585,0.0,0.0,4.586,-6.8240776223883,-148.80239004596731,-1.136015197134842,-0.1502505608214355,-13.22610471037481,-0.9969893896227238,-0.24354141031760412,-24.427683023486903,-1.1024163211311648,-0.10150186183577681,-9.207216817228026,-0.9924150471848585,0.0,0.0,23.879,-26.1170776223883,-109.372576789024,-0.706669308310283,-0.5795964496459945,-82.01805775746251,-0.3563399063061708,-0.8841908936341571,-248.13130754469043,-0.7416696482386209,-0.4622485347283207,-62.32539373743657,-0.9924150471848585,0.0,0.0,36.205,-38.4430776223883,-106.1816810157993,11.363636363636363,-1.2460801348861117,6.8181818181818175,-1.2308586232815484,14.772727272727273,-1.1892641769535364,14.772727272727273,-1.0110242693072244,18.181818181818183,-1.0260258483291753,BTPS 2 02/01/28,100.0,0.0,100.0,0.0,100.0,0.0,100.0,0.0,100.0,0.0,0.9531226596705594,-0.0052638300462513055,falling,12.5,100.0,-1.0,-1.0,-1.0,1,1,1.3942303220130137,1.48540109903517,1.3284853873540918,1.3347483555693351,Bottom Quartile,Top Decile,Bottom Quartile,Top Decile,Very Tight,2.1362313851291503,"['Cpn', 'Issue_Age', 'AMT_OUTSTANDING']","[0.46442513026047827, 0.21790407081907745, 0.17694425554156124]",0.859273456621117,-1.0168181623847885,0.0
2025-11-06,IT0005340929,BTPS 2.8 12/01/28,2028-12-01,-5.8192673775188,STRONG SELL,-1.2020221708810819,0.9538916363068002,-1.511668809410285,-2.1843245690404487,-1.5577224663478062,6.435268524263657,-1.5963103693678713,0.038587903020065095,2.417318305939078,-1.2594252644831305,0.05740309360204865,4.557880071575262,-1.5336860348307966,0.022017225420511544,1.435575781283228,-2.1843245690404487,0.0,0.0,7.021988653979197,-0.5867201297155402,-8.355469622519436,-1.742252135347521,0.1845296689997149,10.591444498574997,-1.5017892488234905,0.29976707794240864,19.960662002420214,-1.6086993067005078,0.09703049729022273,6.031611767526282,-2.1843245690404487,0.0,0.0,11.042,-4.606731475736343,-41.720082155083624,-1.7955056182755857,0.23778315192777955,13.243241802374516,-1.5917660427640465,0.38974387188296467,24.484997101564517,-1.6308485977405085,0.11917978833022347,7.307838861593871,-2.1843245690404487,0.0,0.0,12.194,-5.758731475736344,-47.22594284905485,-1.6692942329090261,0.11157176656121992,6.683768726524051,-1.3778007910460308,0.17577862016494894,12.757912466845516,-1.5742301800138978,0.06256137060361278,3.97409292494006,-2.1843245690404487,0.0,0.0,34.802,-28.366731475736344,-81.50891175100699,-1.8333647051775568,0.2756422388297506,15.034773853114944,-1.6614648510497567,0.45944268016867484,27.65286771568476,-1.644828686889265,0.13315987747897995,8.095668426190201,-2.1843245690404487,0.0,0.0,45.786,-39.350731475736346,-85.94489902402887,4.545454545454546,-1.5132419469119482,7.954545454545454,-1.1926502384912607,5.681818181818182,-1.4928042522249292,3.4090909090909087,-2.2172671266185935,28.40909090909091,-0.8347729181751349,BTPS 2.8 12/01/28,100.0,0.0,100.0,0.0,100.0,0.0,100.0,0.0,100.0,0.0,0.977342267783277,-0.023450631476476858,falling,19.318181818181817,100.0,-1.0,-1.0,-1.0,1,1,1.6884721391586885,1.439291191945646,1.6680784061849037,2.9378067521515088,Bottom Decile,Top Decile,Below Median,Top Decile,Very Tight,2.931187697650728,"['Issue_Age', 'AMT_OUTSTANDING', 'GREEN_BOND_LOAN_INDICATOR']","[0.39374955089781327, 0.21502671253845645, 0.18941749467594787]",0.7981937581122176,-2.229973655082872,0.0
2025-11-06,IT0005358806,BTPS 3.35 03/01/35,2035-03-01,-0.0237688029490499,MODERATE SELL,-1.0015163806221625,0.9793590349593841,-1.0514955915596478,-2.049207024466381,-1.3062100349139183,64.91165771801049,-1.340783356851232,0.03457332193731366,2.578591202134877,-1.057624926113542,0.05610854549137945,5.3051458579977995,-1.0774747855648272,0.02597919400517945,2.41111848853604,-2.049207024466381,0.0,0.0,67.87747971919325,-2.965822001182758,-4.369375546963916,-1.241491422255886,-0.06471861265803236,-5.212972959501914,-0.8999837503767911,-0.1015326302453714,-11.281606926203125,-0.9996881356858478,-0.05180745587379998,-5.182361729242759,-2.049207024466381,0.0,0.0,78.077,-13.16534228198951,-16.86199813043958,-1.0505026476896582,-0.2557073872242601,-24.34143172818148,-0.6196482845356327,-0.38186809608652983,-61.62658712273282,-0.8455864242593379,-0.20590916730030984,-24.351049042156028,-2.049207024466381,0.0,0.0,80.868,-15.956342281989507,-19.731342780848266,0.88765588071354,-2.193865915627458,-247.1527467545925,0.841336585276608,-1.8428529658987705,-219.03872674085827,0.9582978723399402,-2.0097934638995882,-209.7253370728672,-2.049207024466381,0.0,0.0,110.622,-45.71034228198951,-41.32120399003579,0.6664426059197041,-1.9726526408336222,-295.9973737740829,0.5194028973054301,-1.5209192779275926,-292.82070942148766,0.7735946702261384,-1.8250902617857863,-235.92332114438443,-2.049207024466381,0.0,0.0,111.417,-46.50534228198951,-41.73989811053567,10.227272727272728,-1.2657088602291715,13.636363636363635,-0.993707752766647,15.909090909090908,-1.0389269854308787,4.545454545454546,-2.0805247228947086,68.18181818181817,0.45466954025243095,BTPS 3.35 03/01/35,100.0,0.0,100.0,0.0,100.0,0.0,100.0,0.0,100.0,0.0,0.9899554335729918,-0.010596398613607616,falling,60.22727272727273,100.0,-1.0,-1.0,-1.0,1,1,1.4158486505061474,1.199207252693319,1.16029191021247,2.756080446267304,Bottom Quartile,Top Decile,Above Median,Top Decile,Tight,7.878458865732796,"['Cpn', 'AMT_OUTSTANDING', 'GREEN_BOND_LOAN_INDICATOR']","[0.37262302681797566, 0.23729396320850063, 0.1952009001062646]",0.8051178901327408,-2.0924476194617148,0.0
2025-11-06,IT0005363111,BTPS 3.85 09/01/49,2049-09-01,-1.8177041486630827,NO ACTION,-0.23381146311342807,0.975967402317642,-0.20197406093857848,-1.0259560953779852,-0.49871014159958355,118.7229345294799,-0.45397852390987514,-0.0447316176897084,-9.853245109291583,-0.1668357071497404,-0.06697575596368768,-40.14473465749232,-0.1608639202433819,-0.041110140695196584,-25.555847499808245,-1.0259560953779852,0.0,0.0,126.7621458209974,-8.039211291517503,-6.341965291622303,-0.510214467652999,0.011504326053415503,2.254801962173971,-0.24942928668653308,0.01561782357310501,6.26142308885732,-0.21204878105387676,0.01007472011529828,4.751133012938764,-1.0259560953779852,0.0,0.0,137.368,-18.645065470520095,-13.573077768594421,-0.3661962134395297,-0.13251392816005386,-36.186590597632424,-0.044672598526343234,-0.18913886458708484,-423.3888971931211,-0.083926263632546,-0.11804779730603247,-140.6565455567354,-1.0259560953779852,0.0,0.0,139.214,-20.4910654705201,-14.719112638849674,0.3895740797132842,-0.8882842213128678,-228.01419415922152,0.2776645187426298,-0.5114759818560579,-184.20645379955982,0.21771161128016728,-0.41968567221874575,-192.77136872664389,-1.0259560953779852,0.0,0.0,172.247,-53.524065470520114,-31.074018977057776,0.4350216571270578,-0.9337317987266414,-214.6402970898284,0.3468730609648908,-0.5806845240783188,-167.40547845442103,0.259783944345926,-0.4617580052845045,-177.7469306936608,-1.0259560953779852,0.0,0.0,166.157,-47.43406547052011,-28.54773826421116,44.31818181818182,-0.47098495752358677,50.0,-0.23198848074476006,55.68181818181818,-0.20102835195121357,13.636363636363635,-1.0449686661492839,93.18181818181817,1.6412432329784385,BTPS 3.85 09/01/49,100.0,0.0,100.0,0.0,100.0,0.0,100.0,0.0,100.0,0.0,0.9799329384209314,-0.003965536103289424,falling,53.40909090909091,100.0,-1.0,-1.0,-1.0,1,1,0.5405700937093422,0.2799638705402665,0.2228719462648353,1.379859379476965,Below Median,Top Decile,Top Decile,Top Decile,Moderate,14.467823692982051,"['Cpn', 'GREEN_BOND_LOAN_INDICATOR', 'REL_SPRD_LOG']","[0.6061544756326295, 0.14159160335235546, 0.10980855831827038]",0.8575546373032553,-1.0509570849290055,0.0
2025-11-06,IT0005365165,BTPS 3 08/01/29,2029-08-01,-4.303974467265871,WEAK SELL,-0.696851197442251,0.9708504884724366,-0.7301799393430841,-1.1744186344618859,-0.9092654510573797,14.766193673238844,-0.8868298093788144,-0.022435641678565266,-2.5298700143259114,-0.660288763374954,-0.03656243406729698,-5.537339955125134,-0.7091437728102047,-0.02103616653287943,-2.9664176775994595,-1.1744186344618859,0.0,0.0,16.067918447247227,-1.3017247740083828,-8.101390217232877,-0.9298498672023192,0.020584416144939555,2.213735426504847,-0.7256181964807902,0.028766999038539187,3.9644814286093517,-0.7474239359449242,0.01724399660184006,2.307123914800387,-1.1744186344618859,0.0,0.0,21.621,-6.854806326761155,-31.70439074784106,-0.9478294006998307,0.03856394964245102,4.068659318555783,-0.7507389467858667,0.05388774934361573,7.1779609751870295,-0.7613662920595411,0.031186352716456978,4.0961036273993265,-1.1744186344618859,0.0,0.0,23.225,-8.458806326761158,-36.42112518027575,-0.8126077092241629,-0.09665774183321674,-11.894760478709296,-0.5493144196383941,-0.14753677780385688,-26.858347395130007,-0.6442429540899312,-0.08593698525315296,-13.339219835260296,-1.1744186344618859,0.0,0.0,47.113,-32.346806326761154,-68.65792099822843,-0.904175903413352,-0.005089547644027692,-0.5628935219933203,-0.6858341447344225,-0.01101705270782849,-1.6063727115040887,-0.7241615203978029,-0.006018418945281212,-0.8310879123853927,-1.1744186344618859,0.0,0.0,55.871,-41.10480632676116,-73.57091571549473,22.727272727272727,-0.8750445995250363,23.863636363636363,-0.69141798458944,28.40909090909091,-0.7220074769740924,12.5,-1.1952165449223864,32.95454545454545,-0.6510705939861556,BTPS 3 08/01/29,100.0,0.0,100.0,0.0,100.0,0.0,100.0,0.0,100.0,0.0,0.9767828274333137,-0.005932338960877082,falling,48.86363636363637,100.0,-1.0,-1.0,-1.0,1,1,0.9855859528106407,0.8344037363638892,0.8057303172926831,1.5795340322021498,Bottom Quartile,Top Decile,Below Median,Top Decile,Very Tight,3.544328338740144,"['AMT_OUTSTANDING', 'GREEN_BOND_LOAN_INDICATOR', 'Issue_Age']","[0.4168833577298762, 0.24808260224112813, 0.18498067776447075]",0.8499466377354752,-1.2020659916429497,0.0
2025-11-06,IT0005370306,BTPS 2.1 07/15/26,2026-07-15,-1.7267353433911516,NO ACTION,-0.4088990381159388,0.8911710772175584,-0.5776441488333715,-0.5052867404956168,-0.5916010126517043,-16.663174429068466,-0.376877271359606,-0.21472374129209826,-56.974445505834225,-0.09623114401589467,-0.31266789410004414,-324.91337893381206,-0.3838472854919032,-0.19379686334146823,-50.488010627537726,-0.5052867404956168,0.0,0.0,-14.904104049106792,-1.759070379961674,-11.802590568245776,0.9360885867169626,-1.5276895993686668,-163.19925322523522,0.994531993399799,-1.403431031515738,-141.1147179495603,0.8913406032590534,-1.4689847520924249,-164.80621776239974,-0.5052867404956168,0.0,0.0,-6.066,-10.597174429068467,-174.69789666334782,0.4072915890055729,-0.9988926016572772,-245.25244421837672,0.20623200138735284,-0.6151310395032916,-298.27136697412556,0.4384498609973769,-1.0160940098307483,-231.7469058707574,-0.5052867404956168,0.0,0.0,-5.67,-10.993174429068466,-193.88314655520549,-0.4908510940448529,-0.1007499186068514,-20.525556075278807,-0.24874510073992642,-0.16015393737601238,-64.38475791528627,-0.478066671738719,-0.09957747709465248,-20.829202472862402,-0.5052867404956168,0.0,0.0,1.082,-17.745174429068467,-1640.034590116914,-0.7438151053682754,0.15221409271657116,20.463968743255155,-0.621960692629601,0.21306165451366216,34.256449581598034,-0.7027291570064568,0.12508500817308532,17.799888498428587,-0.5052867404956168,0.0,0.0,13.737,-30.400174429068464,-221.30140792704606,36.36363636363637,-0.5624061405843822,39.77272727272727,-0.4057109320790289,34.090909090909086,-0.5715586351049645,26.136363636363637,-0.5180379899264715,3.4090909090909087,-1.344108625770063,BTPS 2.1 07/15/26,100.0,0.0,100.0,0.0,100.0,0.0,100.0,0.0,100.0,0.0,0.9230777040547843,-0.03190662683722589,falling,3.4090909090909087,100.0,-1.0,-1.0,1.0,1,0,0.6412578934567642,0.4896122535942321,0.637411928545312,0.6795852681603757,Below Median,Top Decile,Bottom Decile,Top Decile,Very Tight,0.6663999793453002,"['Cpn', 'GREEN_BOND_LOAN_INDICATOR', 'AMT_OUTSTANDING']","[0.6524768881107644, 0.16228197822319476, 0.06947760095377985]",0.8842364672877391,-0.521006718585978,0.0
2025-11-06,IT0005377152,BTPS 3.1 03/01/40,2040-03-01,-0.6273080095390071,NO ACTION,-0.27607510669198837,0.9619446990504213,-0.22904751293380882,0.08144843111867467,-0.35100303657082105,91.69255136412812,-0.301522618264092,-0.04948041830672906,-16.410184068636823,-0.19878950893919176,-0.07728559775279661,-38.87810492485658,-0.17959837169373993,-0.04944914124006888,-27.533177511806322,0.08144843111867467,0.0,0.0,97.00993342601969,-5.317382061891564,-5.481275858619676,-0.2621097537406147,-0.08889328283020637,-33.91452556425013,-0.1392631509306882,-0.13681195576130017,-98.23987538915048,-0.1447896476998723,-0.08425786523393652,-58.19328988855731,0.08144843111867467,0.0,0.0,107.307,-15.61444863587188,-14.551192964500695,-0.21529071540741573,-0.13571232116340531,-63.03677081610627,-0.07923934840746998,-0.19683575828451838,-248.40655229985114,-0.1056416247799398,-0.12340588815386902,-116.81557977679316,0.08144843111867467,0.0,0.0,108.459,-16.766448635871882,-15.458789620341328,-0.22736559139420487,-0.12363744517661618,-54.37825441424381,-0.09547709823335784,-0.18059800845863053,-189.15320310835838,-0.11681060288528923,-0.11223691004851959,-96.0845143058524,0.08144843111867467,0.0,0.0,140.025,-48.332448635871884,-34.51701384211404,-0.17575360939116766,-0.1752494271796534,-99.71312555993961,-0.020050865959732097,-0.25602424073225627,-1276.8730964493834,-0.06811612232801416,-0.16093139060579464,-236.26031764520533,0.08144843111867467,0.0,0.0,138.361,-46.66844863587187,-33.72948203070151,53.40909090909091,-0.3256148244279692,48.86363636363637,-0.27392260293863957,54.54545454545454,-0.22773139314876434,44.31818181818182,0.07575297903169789,80.68181818181817,1.0452056834387449,BTPS 3.1 03/01/40,100.0,0.0,100.0,0.0,100.0,0.0,100.0,0.0,100.0,0.0,0.9903900603042285,-0.028445361253807144,falling,31.818181818181817,100.0,-1.0,-1.0,-1.0,1,1,0.38046498064540435,0.3305700002904057,0.25274663863990976,0.10954404591882728,Above Median,Top Decile,Top Quartile,Top Decile,Tight,10.345541961704896,"['AMT_OUTSTANDING', 'GREEN_BOND_LOAN_INDICATOR', 'Cpn']","[0.4466454811364794, 0.27161927189699975, 0.19603910337199726]",0.9143038564054764,0.0761870978497556,0.0
2025-11-06,IT0005383309,BTPS 1.35 04/01/30,2030-04-01,-5.048702653176534,WEAK SELL,-0.9451299692085805,0.9856833638730962,-0.7670262471804952,0.06138830592525334,-0.8491424837478911,20.521401264788818,-0.8335688896331798,-0.015573594114711375,-1.8683031626497446,-0.9221843435419875,-0.022945625666592973,-2.4881820623459805,-0.7550082758070027,-0.012017971373492475,-1.591766818909394,0.06138830592525334,0.0,0.0,21.93368902658527,-1.4122877617964527,-6.438897530829239,-0.6405345942680766,-0.20860788947981457,-32.56777824176818,-0.633053140402266,-0.3120768288063145,-49.29709750405776,-0.5981143198541553,-0.16891192732633986,-28.24074242921541,0.06138830592525334,0.0,0.0,29.201,-8.679598735211183,-29.72363525988432,-0.6410521819418927,-0.2080903018059984,-32.460742576301875,-0.636603497117467,-0.3085264720911135,-48.46446314568979,-0.6002273697659781,-0.16679887741451704,-27.789281701802743,0.06138830592525334,0.0,0.0,30.777,-10.255598735211183,-33.322282002400996,-0.6970412012247416,-0.15210128252314958,-21.820988497351376,-0.7133168082847999,-0.23181316092378057,-32.49792448202539,-0.6449032821873758,-0.12212296499311937,-18.936632278446595,0.06138830592525334,0.0,0.0,58.099,-37.57759873521118,-64.67856370805578,0.3554893352433614,-1.2046318189912526,-338.86580149584626,0.1502796283315208,-1.0954095975401013,-728.9141827208814,0.29500773171533035,-1.0620339788958255,-360.0020706984165,0.06138830592525334,0.0,0.0,65.977,-45.45559873521118,-68.89612854225196,25.0,-0.8158728775000066,17.045454545454543,-0.9377609752036496,27.27272727272727,-0.7583496647502712,42.04545454545455,0.05545162033991959,39.77272727272727,-0.5241645191082842,BTPS 1.35 04/01/30,100.0,0.0,100.0,0.0,100.0,0.0,100.0,0.0,100.0,0.0,0.9774581677015142,0.008225196171582017,rising,80.68181818181817,100.0,-1.0,-1.0,-1.0,1,1,0.9204164778761027,1.1316906400558795,0.8463890449641259,0.08256418583872649,Below Median,Top Decile,Below Median,Top Decile,Very Tight,3.9669863474294687,"['Cpn', 'AMT_OUTSTANDING', 'GREEN_BOND_LOAN_INDICATOR']","[0.6469246252939423, 0.18101793836619445, 0.08533330666384795]",0.9132758703239848,0.0557693978344697,0.0
2025-11-06,IT0005390874,BTPS 0.85 01/15/27,2027-01-15,-3.014092759001114,NO ACTION,-0.6924916943598233,0.9825119373848678,-0.9090722541993732,0.5304051015891778,-0.7599220535673317,-11.817420655545176,-0.7971468337832529,0.03722478021592124,4.669751941719133,-0.7527381050168903,0.06024641065706704,8.003634923643425,-0.9437866456078914,0.034714391408518175,3.678203246702899,0.5304051015891778,0.0,0.0,-11.69209813197803,-0.1253225235671458,-1.0718565824999493,-0.861624122449653,0.10170206888232136,11.803530687235488,-0.8481582238862985,0.1556665295264752,18.353477370985868,-0.9949715064183863,0.08589925221901307,8.633337819380586,0.5304051015891778,0.0,0.0,-7.464,-4.353420655545175,-58.3255714055817,-0.8633672863277904,0.1034452327604587,11.981601943975436,-0.8574011047634525,0.16490941040362928,19.233636108477178,-0.9994240044468701,0.09035175024749686,9.040382154265316,0.5304051015891778,0.0,0.0,-5.243,-6.574420655545175,-125.39425220304692,-0.8624143104990099,0.10249225693167818,11.88434079716744,-0.849292530609348,0.15680083624952468,18.462523659636016,-0.9954620358622023,0.08638978166282907,8.67836016671073,0.5304051015891778,0.0,0.0,7.269,-19.086420655545176,-262.5728522394812,-0.6681014814930688,-0.09182057207426286,-13.743506524594467,-0.5639705049876442,-0.12852118937217905,-22.78863627737609,-0.833247722095658,-0.0758245321037152,-9.099878605491414,0.5304051015891778,0.0,0.0,21.804,-33.62142065554517,-154.19840689839174,27.27272727272727,-0.7280640628348584,25.0,-0.6870924717021448,21.59090909090909,-0.8984522411797908,68.18181818181817,0.5301085883016368,9.090909090909092,-1.237256599767495,BTPS 0.85 01/15/27,100.0,0.0,100.0,0.0,100.0,0.0,100.0,0.0,100.0,0.0,0.9700436469650628,0.012468290419804906,rising,68.18181818181817,100.0,-1.0,-1.0,-1.0,1,1,0.823707202727219,0.8291837042049159,1.0031322915787158,0.7133682012782592,Below Median,Top Decile,Bottom Decile,Top Decile,Very Tight,1.137848251403284,"['Cpn', 'GREEN_BOND_LOAN_INDICATOR', 'REL_SPRD_LOG']","[0.8179175337948695, 0.08233475803434895, 0.03705846029532743]",0.937310752124546,0.5331464901338318,0.0
2025-11-06,IT0005398406,BTPS 2.45 09/01/50,2050-09-01,-2.453324737588161,WEAK SELL,-0.3508860189841522,0.9802953431633045,-0.27440261996972093,-3.1961552744189317,-0.9490237584009933,119.75841845342735,-0.9257730096346354,-0.02325074876635791,-2.511495612124668,-0.31948390432058427,-0.03140211466356796,-9.829012747119934,-0.2552153721096866,-0.01918724786003434,-7.518060902688081,-3.1961552744189317,0.0,0.0,127.75271466653057,-7.994296213103212,-6.257633141765122,-0.9036050208650905,-0.04541873753590275,-5.0263927251954215,-0.2801935035369177,-0.07069251544723454,-25.229890069500215,-0.2317642913918668,-0.04263832857785413,-18.3972804792578,-3.1961552744189317,0.0,0.0,139.012,-19.253581546572647,-13.850301805015116,-0.9079782078177298,-0.041045550583263535,-4.520543530428958,-0.2948570717170704,-0.05602894726708185,-19.00206938927936,-0.2405938213805552,-0.03380879858916572,-14.052230015693636,-3.1961552744189317,0.0,0.0,139.42,-19.661581546572634,-14.102411092499207,-0.7596654174101604,-0.18935834099083293,-24.926544523210758,-0.0754211779266493,-0.2754648410575029,-365.2353518024744,-0.10290597980481196,-0.17149664016490895,-166.65370061567558,-3.1961552744189317,0.0,0.0,171.77,-52.01158154657266,-30.279782001248574,0.20958960677686064,-1.1586133651778538,-552.8009368953474,0.01790620091202868,-0.3687922198961809,-2059.5771026490083,0.05419550783580361,-0.32859812780552455,-606.3197491738702,-3.1961552744189317,0.0,0.0,166.396,-46.63758154657263,-28.02806650626808,18.181818181818183,-0.9141738643567594,44.31818181818182,-0.3481502291409062,52.27272727272727,-0.2724659653013164,2.272727272727273,-3.2412656254903847,94.31818181818183,1.6640763277533772,BTPS 2.45 09/01/50,100.0,0.0,100.0,0.0,100.0,0.0,100.0,0.0,100.0,0.0,0.9965136814584517,-0.016218338295147183,falling,63.63636363636363,100.0,-1.0,-1.0,-1.0,1,1,1.0286814307921535,0.4201479546176575,0.30279455534351896,4.298668192079801,Bottom Quartile,Top Decile,Top Decile,Top Decile,Moderate,12.51720639485896,"['Cpn', 'REL_SPRD_LOG', 'GREEN_BOND_LOAN_INDICATOR']","[0.3967153593643579, 0.18124562491454824, 0.16838125885392805]",0.7463422431328343,-3.259840398658737,0.0
2025-11-06,IT0005402117,BTPS 1.45 03/01/36,2036-03-01,2.405050507123349,NO ACTION,0.7865609934892264,0.9821040183532784,0.5867218186493041,0.11973926944365643,0.7739556110471637,73.72962899254397,0.7225258315412986,0.051429779505865136,7.1180539918343495,0.7127174108914383,0.07384358259778812,10.360849957256207,0.5453475467151296,0.04137427193417442,7.586771302944863,0.11973926944365643,0.0,0.0,77.37578666384792,-3.6461576713039534,-4.712272182347079,0.7530447750402313,0.020910836006932443,2.7768382999711343,0.7590811297771989,0.027479863712027486,3.620148396796318,0.5717229375787759,0.014998881070528158,2.6234526940098917,0.11973926944365643,0.0,0.0,86.902,-13.172371007456036,-15.157730553888591,0.6471012426964355,0.12685436835072816,19.60348057156943,0.6007387329617957,0.18582226052743067,30.93229173322156,0.4795977347267131,0.10712408392259098,22.33623596033234,0.11973926944365643,0.0,0.0,88.106,-14.37637100745603,-16.317130508506025,0.4578509743411032,0.3161046367060605,69.04094290874335,0.3193487351531384,0.467212258336088,146.3015795199208,0.3117611988733544,0.27496061977594966,88.1959050548992,0.11973926944365643,0.0,0.0,117.034,-43.30437100745604,-37.00153032773031,-0.20805752438140784,0.9820131354285715,471.9911433865021,-0.03806649571315178,0.8246274892023782,2166.2810225249377,-0.1484497520114226,0.7351715706607267,495.23256938879985,0.11973926944365643,0.0,0.0,116.83,-43.10037100745603,-36.891527008274316,67.04545454545455,0.7815451073806442,70.45454545454545,0.7804283308561836,63.63636363636363,0.5768768286915846,45.45454545454545,0.11450428471643403,71.5909090909091,0.6491115486484278,BTPS 1.45 03/01/36,100.0,0.0,100.0,0.0,100.0,0.0,100.0,0.0,100.0,0.0,0.9666500650147045,0.015453953338573911,rising,67.04545454545455,100.0,1.0,1.0,1.0,1,1,0.8389186870126923,0.9418214882236641,0.6474288481934332,0.16104329880965995,Above Median,Top Decile,Above Median,Top Decile,Tight,7.647540807639075,"['Cpn', 'AMT_OUTSTANDING', 'GREEN_BOND_LOAN_INDICATOR']","[0.6961000413330559, 0.12195741723853422, 0.09820862132288208]",0.9162660798944724,0.1151604762666402,0.0
2025-11-06,IT0005403396,BTPS 0.95 08/01/30,2030-08-01,-3.0716109611942564,NO ACTION,-0.28600371852890183,0.9828254222238036,-0.4121093280625339,1.208496220336222,-0.4115395956759302,25.646706980411075,-0.4394691408933098,0.027929545217379614,6.355291414791499,-0.3268302847079634,0.04082656617906155,12.491671316926665,-0.43682446542403347,0.02471513736149955,5.657910385517688,1.208496220336222,0.0,0.0,27.186872500841577,-1.5401655204305023,-5.665107377894663,0.48754394829849934,-0.8990835439744296,-184.41076515688556,0.047784886626652645,-0.3337886051555545,-698.5232337394647,0.25025635322565337,-0.6623656812881873,-264.674860910905,1.208496220336222,0.0,0.0,35.328,-9.681293019588928,-27.404022352945322,-0.950858628534597,0.5393190328586668,56.71916003096222,-1.1000935884744136,0.8140898699455118,74.00187321101353,-0.8621512262466637,0.4500418981841298,52.19987854374214,1.208496220336222,0.0,0.0,38.491,-12.844293019588925,-33.36960072809739,-0.2794624229250563,-0.13207717275087388,-47.26115469920536,-0.09728843415701247,-0.18871528437188936,-193.9750255100435,-0.2949671235758541,-0.11714220448667984,-39.71364642106997,1.208496220336222,0.0,0.0,64.694,-39.04729301958893,-60.356900197163945,0.9360226261494686,-1.3475622218253989,-143.96684116197096,0.7055108997236073,-0.9915146182525091,-140.53852386789416,0.6490756575651484,-1.0611849856276823,-163.4917219449102,1.208496220336222,0.0,0.0,71.238,-45.591293019588925,-63.99855837220174,47.72727272727273,-0.3851935945389046,47.72727272727273,-0.28377380332581903,47.72727272727273,-0.40828861178279624,96.5909090909091,1.2163541074426425,43.18181818181818,-0.4111481907531208,BTPS 0.95 08/01/30,100.0,0.0,100.0,0.0,100.0,0.0,100.0,0.0,100.0,0.0,0.9872276772181465,-0.00440225499434288,falling,71.5909090909091,100.0,-1.0,-1.0,1.0,1,0,0.44608276279703424,0.3424584362205368,0.45474952373771327,1.625366672322398,Below Median,Top Decile,Below Median,Top Decile,Very Tight,4.182230493965733,"['Cpn', 'GREEN_BOND_LOAN_INDICATOR', 'Issue_Age']","[0.821654798441007, 0.08690019480209511, 0.06350470612548632]",0.9720596993685884,1.2233246875334776,0.0
2025-11-06,IT0005413171,BTPS 1.65 12/01/30,2030-12-01,-1.019001009298389,NO ACTION,-0.37171312094967646,0.9816069064421495,-0.6390169288615836,-0.7831348393334712,-0.6526896550980735,30.77260236886069,-0.7154522926541941,0.06276263755612055,8.77244189770344,-0.46414452153848296,0.0924314005888065,19.914357340897133,-0.6935034301593016,0.05448650129771804,7.856702381346829,-0.7831348393334712,0.0,0.0,32.597925415117125,-1.825323046256436,-5.599506785944117,-0.8045301096452098,0.15184045454713624,18.87318458805451,-0.5953255950709597,0.22361247412128327,37.561373509985316,-0.7705542858725565,0.1315373570109729,17.07048519689625,-0.7831348393334712,0.0,0.0,40.297,-9.524397631139308,-23.635500480868945,-0.6697392137535569,0.01704955865548341,2.545701080478618,-0.3986366912486044,0.026923570298927946,6.753911572767462,-0.6556383304001187,0.016621401538535086,2.535147887841868,-0.7831348393334712,0.0,0.0,44.059,-13.286397631139309,-30.155921895920734,0.3090727701021439,-0.9617624252002175,-311.17668300727405,0.015607144169764874,-0.38732026511944134,-2481.684110417655,0.4039241347595569,-1.0429410636211405,-258.2022087939234,-0.7831348393334712,0.0,0.0,69.2,-38.427397631139314,-55.53092142425755,0.7809089030916099,-1.4335985581896833,-183.58076520270234,0.7048452942785356,-1.0765584152282122,-152.73683582671433,0.8231381440515565,-1.46215507291314,-177.63179433686648,-0.7831348393334712,0.0,0.0,74.861,-44.088397631139316,-58.8936797868716,32.95454545454545,-0.6225282591603981,40.909090909090914,-0.36881494625511463,29.545454545454547,-0.6320917312831058,18.181818181818183,-0.7992273574876374,46.590909090909086,-0.2981188597281508,BTPS 1.65 12/01/30,100.0,0.0,100.0,0.0,100.0,0.0,100.0,0.0,100.0,0.0,0.9838974410829121,-0.002290534640762565,falling,64.77272727272727,100.0,-1.0,-1.0,-1.0,1,1,0.7074740988579457,0.44508615055023365,0.705134837462467,1.053276995300031,Below Median,Top Decile,Below Median,Top Decile,Very Tight,4.5157434287148135,"['Cpn', 'Issue_Age', 'AMT_OUTSTANDING']","[0.5820684064550751, 0.15621017042901938, 0.13171949579642103]",0.8699980726805155,-0.803807502588526,0.0
2025-11-06,IT0005416570,BTPS 0.95 09/15/27,2027-09-15,-3.750306908711616,WEAK SELL,-0.8546727046597558,0.9560698717566051,-1.0084799326403966,-0.3296664592964437,-0.9224976914616653,-4.775812258623683,-0.8995108826776644,-0.022986808784000834,-2.55547864635343,-0.8108005390900336,-0.04387216556972218,-5.410968902149879,-0.9868211710442122,-0.021658761596184406,-2.1948010452376003,-0.3296664592964437,0.0,0.0,-3.971863212497159,-0.8039490461265237,-20.241106027338756,-0.9168814137350118,-0.005616277726653518,-0.6125413364549395,-0.8476029009886628,-0.007069803671093,-0.8340938403392957,-1.0051782921531736,-0.0033016404872230343,-0.32846316719637225,-0.3296664592964437,0.0,0.0,1.209,-5.984812258623682,-495.0216880993808,-1.1491712781411942,0.22667358667952897,19.724960849498572,-1.2080279507581164,0.35335524609836066,29.25058505074727,-1.1705244477533123,0.16204451511291573,13.843753032204182,-0.3296664592964437,0.0,0.0,1.164,-5.939812258623682,-510.293144982334,-1.0569067077061598,0.13440901624449453,12.71720710946061,-1.0599527679404914,0.20528006328073567,19.36690648423025,-1.1102459257151511,0.10176599307475453,9.166076614295664,-0.3296664592964437,0.0,0.0,17.494,-22.26981225862368,-127.29971559331032,-0.6198317521331965,-0.30266593932846875,-48.83033716872166,-0.4057285761036594,-0.44894412855609633,-110.65134277755718,-0.7518198344221985,-0.25666009821819813,-34.1385107246605,-0.3296664592964437,0.0,0.0,30.721,-35.496812258623684,-115.54575777829209,21.59090909090909,-0.8880674838903458,20.454545454545457,-0.8480089883011585,17.045454545454543,-0.9964998537720523,30.681818181818183,-0.340305782983684,15.909090909090908,-1.081984549495595,BTPS 0.95 09/15/27,100.0,0.0,100.0,0.0,100.0,0.0,100.0,0.0,100.0,0.0,0.9497755028449469,0.0062943689116581325,rising,21.59090909090909,100.0,-1.0,-1.0,-1.0,1,1,0.9999288603207758,1.0233778757270917,1.1128255000276825,0.4433848173508498,Bottom Quartile,Top Decile,Bottom Quartile,Top Decile,Very Tight,1.759406660791285,"['Cpn', 'Issue_Age', 'AMT_OUTSTANDING']","[0.7039780429326903, 0.100456552022224, 0.08880157711829696]",0.8932361720732113,-0.3422559788198667,0.0
2025-11-06,IT0005421703,BTPS 1.8 03/01/41,2041-03-01,-1.007319295733211,NO ACTION,-0.4092433019985,0.9685254784900055,-0.5307231208806619,-0.22865344837563478,-0.5445615801214386,95.56303028438003,-0.42725328833121334,-0.11730829179022528,-27.456380617402772,-0.2355570180162262,-0.17368628398227381,-73.7342822861178,-0.42237271334853066,-0.10835040753213121,-25.652794686441755,-0.22865344837563478,0.0,0.0,101.46697170061744,-5.9039414162374015,-5.818584428709837,-0.34727764239536535,-0.19728393772607328,-56.808705185979356,-0.11499185176158906,-0.29425145023691096,-255.88893485956268,-0.348604631605429,-0.1821184892752329,-52.242129776735794,-0.22865344837563478,0.0,0.0,112.047,-16.483969715619963,-14.71165646036824,-0.4127362405399533,-0.13182533958148535,-31.939365492860805,-0.2233406348209903,-0.1859026671775097,-83.23727520645087,-0.41422237797435674,-0.11650074290630513,-28.12516809533659,-0.22865344837563478,0.0,0.0,112.559,-16.995969715619964,-15.099609728329147,-0.49860892206499735,-0.045952658056441276,-9.21617225470221,-0.3431051703524645,-0.06613813164603549,-19.276343067188094,-0.4889903851221604,-0.04173273575850145,-8.534469424103046,-0.22865344837563478,0.0,0.0,144.121,-48.557969715619976,-33.6925012401043,-0.42481832773925365,-0.11974325238218497,-28.186931152600426,-0.23272928984715738,-0.17651401215134263,-75.84520396325965,-0.42050492815861584,-0.11021819272204603,-26.21091519274177,-0.22865344837563478,0.0,0.0,142.031,-46.46796971561997,-32.71677993701959,40.909090909090914,-0.5161109500697793,38.63636363636363,-0.4060525118032528,38.63636363636363,-0.5252795664929023,32.95454545454545,-0.2380780377693927,84.0909090909091,1.1305522638797167,BTPS 1.8 03/01/41,100.0,0.0,100.0,0.0,100.0,0.0,100.0,0.0,100.0,0.0,0.995385241692156,-0.026859763202150555,falling,44.31818181818182,100.0,-1.0,-1.0,-1.0,1,1,0.5902701385870501,0.49002447225864504,0.5856360679621688,0.3075273949950371,Below Median,Top Decile,Top Quartile,Top Decile,Tight,9.686652317014222,"['Cpn', 'Issue_Age', 'GREEN_BOND_LOAN_INDICATOR']","[0.6099601214745426, 0.17598883532924764, 0.11246365202018531]",0.8984126088239756,-0.2394423954181912,0.0
2025-11-06,IT0005422891,BTPS 0.9 04/01/31,2031-04-01,-1.2843787481093116,NO ACTION,-0.47138137535916275,0.9834009108753222,-0.4699352028816149,0.4327392149507216,-0.522666334662213,33.482779654854646,-0.4714623291845586,-0.05120400547765441,-10.860677772527255,-0.39578317131557317,-0.07559820404358958,-19.100913735723456,-0.42682521137701457,-0.04310999150460032,-10.100150915524573,0.4327392149507216,0.0,0.0,35.88446875659468,-2.4016891017400326,-6.692837275539652,-0.4947732239355184,-0.027893110726694592,-5.637554502459157,-0.4318126779904854,-0.03956869736867735,-9.163393867099433,-0.44782364487575427,-0.02211155800586062,-4.937559185433233,0.4327392149507216,0.0,0.0,44.094,-10.611220345145355,-24.064998282620888,-0.3264682654719676,-0.1961980691902454,-60.09713161458228,-0.1839728919986131,-0.28740848336054964,-156.22326996978953,-0.29458979323445716,-0.17534540964715772,-59.52188694990382,0.4327392149507216,0.0,0.0,47.971,-14.48822034514535,-30.202039444925365,0.37409398988028636,-0.8967603245424993,-239.71523863774112,0.09488338543402088,-0.5662647607931837,-596.800692263324,0.22795613004909418,-0.697891332930709,-306.15158371272935,0.4327392149507216,0.0,0.0,73.415,-39.93222034514536,-54.392454320923676,0.3107788761031203,-0.8334452107653334,-268.1794832383774,0.010694848908568408,-0.48207622426773117,-4507.551042880106,0.17297909930756017,-0.642914302189175,-371.67164564714056,0.4327392149507216,0.0,0.0,76.445,-42.96222034514535,-56.20017050104694,42.04545454545455,-0.4945621237898989,34.090909090909086,-0.46770610672709684,44.31818181818182,-0.4653233304381923,62.5,0.4312682182899833,47.72727272727273,-0.23835768584909922,BTPS 0.9 04/01/31,100.0,0.0,100.0,0.0,100.0,0.0,100.0,0.0,100.0,0.0,0.9750335268255781,0.008367384049744131,rising,77.27272727272727,100.0,-1.0,-1.0,-1.0,1,1,0.566537084248673,0.5644280763177271,0.5185585356747192,0.5820124928418692,Below Median,Top Decile,Below Median,Top Decile,Very Tight,4.66099120339436,"['Cpn', 'AMT_OUTSTANDING', 'GREEN_BOND_LOAN_INDICATOR']","[0.6924827563593376, 0.16838479653969188, 0.07143828668719378]",0.9323058395862232,0.4337396940204714,0.0
2025-11-06,IT0005425233,BTPS 1.7 09/01/51,2051-09-01,-6.293941592144464,MODERATE SELL,-1.0582868180633591,0.966333043234709,-1.4641251863942706,-1.28466843888589,-1.3199013025587434,117.3990117572844,-1.3632346803310151,0.04333337777227175,3.1787173609666377,-1.1205059893531506,0.062219171289791486,5.552774489892029,-1.4911420388382914,0.027016852444020856,1.8118228551779463,-1.28466843888589,0.0,0.0,124.893905148847,-7.494893391562599,-6.001008121277157,-1.3700201911156809,0.05011888855693747,3.658259091079312,-1.1396582669019086,0.08137144883854952,7.139986651064636,-1.498613179597951,0.034487993203680345,2.3013272165936836,-1.28466843888589,0.0,0.0,135.529,-18.129988242715598,-13.377202105363336,-1.6561707147804214,0.33626941222167805,20.304030689001664,-1.6220714818447883,0.5637846637814292,34.75707862544546,-1.6473568001766246,0.18323161378235397,11.12276421540446,-1.28466843888589,0.0,0.0,132.368,-14.968988242715596,-11.30861555782722,-1.4049326233961135,0.08503132083737008,6.052341501373322,-1.1933469119042892,0.1350600938409301,11.317756082649234,-1.5194229479259922,0.05529776153172161,3.639392260283002,-1.28466843888589,0.0,0.0,166.154,-48.7549882427156,-29.34325278944911,-1.6763893844764448,0.3564880819177014,21.26523128172358,-1.647288819547587,0.5890020014842279,35.75584262572775,-1.6529601557463693,0.18883496935209876,11.424048399063095,-1.28466843888589,0.0,0.0,160.63,-43.2309882427156,-26.913396152664042,7.954545454545454,-1.2791835092610404,10.227272727272728,-1.050035562181233,6.8181818181818175,-1.445911106707279,9.090909090909092,-1.3067921609132642,92.04545454545455,1.612049873783638,BTPS 1.7 09/01/51,100.0,0.0,100.0,0.0,100.0,0.0,100.0,0.0,100.0,0.0,0.9592842915903416,0.007048751644367468,rising,37.5,100.0,-1.0,-1.0,-1.0,1,1,1.4306891143676286,1.2671836948517219,1.6156155317701386,1.7278144775402275,Bottom Decile,Top Decile,Top Decile,Top Decile,Moderate,11.513916524203085,"['Cpn', 'Issue_Age', 'GREEN_BOND_LOAN_INDICATOR']","[0.5769908894831987, 0.16941670206833886, 0.0978892676635013]",0.8442968592150388,-1.3142810158149565,0.0
2025-11-06,IT0005433195,BTPS 0.95 03/01/37,2037-03-01,0.3560204159253715,NO ACTION,0.06851484779100593,0.9722096630587302,0.5926081719750964,1.1637243206637096,0.5850413810729482,77.57381049920765,0.5836874833539473,0.0013538977190009627,0.23195592408898177,0.06436633607071301,0.004148511720292916,6.445156473128601,0.5901366582389463,0.002471513736150066,0.41880362112142977,1.1637243206637096,0.0,0.0,81.67967192824992,-4.105861429042264,-5.026784916749309,0.6031824676216286,-0.018141086548680407,-3.0075619272316065,0.09490491532323259,-0.026390067532226655,-27.806847160298442,0.6106068292597303,-0.0179986572846339,-2.9476671611563647,1.1637243206637096,0.0,0.0,91.398,-13.824189500792343,-15.125264775246524,-0.4599849469168725,1.0450263279898206,227.1870660715271,-0.22751345551767377,0.2960283033086797,130.11462975833555,-0.7040309466842761,1.2966391186593724,184.173594406425,1.1637243206637096,0.0,0.0,91.607,-14.033189500792346,-15.3189052138597,-0.8137071039271332,1.3987484850000813,171.89827409144883,-0.7394166656255805,0.8079315134165864,109.26606608284013,-1.0103288513132418,1.6029370232883382,158.65497707398112,1.1637243206637096,0.0,0.0,121.505,-43.93118950079234,-36.15586971497203,-0.7703494667390056,1.3553908478119538,175.94493002701944,-0.6818563357249153,0.7503711835159212,110.04828043627934,-0.9772181138556603,1.5698262858307568,160.64236300048682,1.1637243206637096,0.0,0.0,121.39,-43.81618950079235,-36.095386355698835,63.63636363636363,0.5956198145542759,59.09090909090909,0.0679806508878611,64.77272727272727,0.5826826467080557,93.18181818181817,1.1710438022576046,75.0,0.7338782539963064,BTPS 0.95 03/01/37,100.0,0.0,100.0,0.0,100.0,0.0,100.0,0.0,100.0,0.0,0.9696557330184007,0.002553930040329555,rising,51.13636363636363,100.0,1.0,1.0,1.0,1,1,0.6341476697788307,0.0820390998868251,0.6539242516924042,1.5651507176841473,Above Median,Top Decile,Top Quartile,Top Decile,Tight,7.838890315819924,"['Cpn', 'Issue_Age', 'GREEN_BOND_LOAN_INDICATOR']","[0.668561242859061, 0.23016097179168996, 0.0710431376356777]",0.9697653522864288,1.1777547218521256,0.0
2025-11-06,IT0005433690,BTPS 0 1/4 03/15/28,2028-03-15,-4.320207867773218,WEAK SELL,-0.9802164929010655,0.9489678269855342,-1.0023105815585567,1.170002814555441,-0.9275310286474712,0.2475205127749929,-0.9282840203957167,0.0007529917482455017,0.08111652507094301,-0.972148464184312,-0.008068028716753495,-0.8299173357776475,-0.9982165473544,-0.00409403420415666,-0.410134872437619,1.170002814555441,0.0,0.0,1.0310298223932697,-0.7835093096182768,-75.99288449293094,-0.9406012523414424,0.013070223693971261,1.3895605095654988,-0.9948447754229719,0.0146282825219064,1.4704085236459257,-1.009668523215797,0.007357941657240241,0.728748239167678,1.170002814555441,0.0,0.0,6.781,-6.533479487225007,-96.34979321029388,-1.0125082391423685,0.08497721049489737,8.392742534875758,-1.1039108899104682,0.12369439700940266,11.205106953779948,-1.059344062660704,0.05703348110214734,5.383848607270636,1.170002814555441,0.0,0.0,7.863,-7.615479487225008,-96.85208543227519,-0.6002881709381045,-0.3272428577093667,-54.514292984740365,-0.48645351725733665,-0.49376297564372884,-101.50259952427592,-0.7271990296460482,-0.27511155191250847,-37.8316715113395,1.170002814555441,0.0,0.0,27.245,-26.997479487225007,-99.09150110961959,0.898002919033719,-1.82553394768119,-203.28819524514526,0.5810679453908502,-1.5612844382919158,-268.6922284746767,0.7714250207631059,-1.7737356023216626,-229.92974451024165,1.170002814555441,0.0,0.0,39.003,-38.75547948722501,-99.36538080990813,20.454545454545457,-0.8930211853150217,14.772727272727273,-0.9725739361151763,18.181818181818183,-0.9904149098894048,94.31818181818183,1.1773977983224937,21.59090909090909,-0.9712167909599037,BTPS 0 1/4,100.0,0.0,100.0,0.0,100.0,0.0,100.0,0.0,100.0,0.0,0.9696326331517481,-0.02066480616621391,falling,14.772727272727273,100.0,-1.0,-1.0,-1.0,1,1,1.0053846778934339,1.1737029470914226,1.106017817514338,1.5735949763853958,Bottom Quartile,Top Decile,Bottom Quartile,Top Decile,Very Tight,2.189981700437471,"['Cpn', 'Issue_Age', 'GREEN_BOND_LOAN_INDICATOR']","[0.7821505821166987, 0.12652673042063203, 0.06140978272284308]",0.9700870952601738,1.1841451308646884,0.0
2025-11-06,IT0005436693,BTPS 0.6 08/01/31,2031-08-01,-0.9821084844342564,NO ACTION,-0.3578573485309264,0.9830849553186338,-0.27838345507145873,0.42619829255693387,-0.41033896495723343,36.71351180144976,-0.3973804377957652,-0.012958527161468225,-3.260987608562034,-0.34291818226723897,-0.014939166263687409,-4.356481108487005,-0.2696105246339798,-0.008772930437478954,-3.253927169199448,0.42619829255693387,0.0,0.0,39.082533774684734,-2.3690219732349718,-6.061587476099925,-0.44571970199374467,0.035380737036511234,7.937889234974596,-0.4076698718226435,0.04981252329171715,12.218838210223254,-0.3102490024024302,0.031865547330971467,10.270958506594061,0.42619829255693387,0.0,0.0,47.415,-10.701488198550237,-22.569836963604878,-0.46067311800037186,0.05033415304313843,10.926218610063533,-0.42908237509841385,0.07122502656748747,16.599382552409224,-0.32258770456611013,0.044204249494651404,13.703017039600349,0.42619829255693387,0.0,0.0,50.368,-13.65448819855024,-27.109450833543708,-0.332895581324354,-0.07744338363287945,-23.263565409438886,-0.2451122533230734,-0.11274509520785297,-45.99732941931504,-0.20901127180563134,-0.06937218326582739,-33.190640556111035,0.42619829255693387,0.0,0.0,75.908,-39.19448819855024,-51.634199548646805,0.2783659647198132,-0.6887049296770467,-247.4098820339866,0.019276408556160318,-0.3771337570870867,-1956.4513811958238,0.055138833689295966,-0.3335222887607547,-604.8771908241902,0.42619829255693387,0.0,0.0,79.12,-42.40648819855024,-53.59768477400212,48.86363636363637,-0.3840119597939704,42.04545454545455,-0.35506720459109026,50.0,-0.2763923358188658,61.36363636363637,0.4246486378830316,51.13636363636363,-0.16711793833623384,BTPS 0.6 08/01/31,100.0,0.0,100.0,0.0,100.0,0.0,100.0,0.0,100.0,0.0,0.9884685257542694,-0.005383570435635532,falling,72.72727272727273,100.0,-1.0,-1.0,-1.0,1,1,0.44478135541431185,0.4284953657186256,0.3071872801457077,0.5732152809960994,Below Median,Top Decile,Above Median,Top Decile,Very Tight,4.849851241697678,"['Cpn', 'Issue_Age', 'GREEN_BOND_LOAN_INDICATOR']","[0.7236683255958177, 0.14299732347993382, 0.06530499932317355]",0.9319706483989252,0.4270821786773757,0.0
2025-11-06,IT0005437147,BTPS 0 04/01/26,2026-04-01,5.79266782912606,MODERATE BUY,1.2475543237909192,0.8394696310549871,1.1519249370277798,1.4754927434673824,1.375987567270334,-12.740535514495544,1.0251734574516802,0.3508141098186539,34.21997554137724,0.7198966767000852,0.5276576470908341,73.29630165538747,0.9026039139497519,0.24932102307802784,27.622417370734535,1.4754927434673824,0.0,0.0,-14.761750707267346,2.021215192771802,13.692245801221356,-0.6776748621920085,2.0536624294623427,303.0453855872746,-0.6017194684970385,1.8492737922879576,307.3315487321488,-0.8453034265032902,1.99722836353107,236.27354122596142,1.4754927434673824,0.0,0.0,-17.219,4.478464485504457,26.008853492674206,0.8065895194228478,0.5693980478474863,70.59328531761587,0.36598508766325527,0.8815692361276639,240.8757191908399,0.6931101084061712,0.4588148286216086,66.1965272815044,1.4754927434673824,0.0,0.0,-8.651,-4.0895355144955445,-47.2724021473622,0.6039594946758656,0.7720280725944685,127.82778756148596,0.05847808514972341,1.1890762386411957,2033.3703339631093,0.5019922904886214,0.6499326465391584,129.47064046730142,1.4754927434673824,0.0,0.0,-2.81,-9.930535514495544,-353.39983911585625,-0.4730608114006882,1.8490483786710223,390.8690584851575,-0.2800792431053933,1.5276335668963126,545.429034803041,-0.6533366153175973,1.8052615523453772,276.314151448009,1.4754927434673824,0.0,0.0,9.532,-22.272535514495544,-233.66067447680945,89.77272727272727,1.3740519173065127,87.5,1.2378273860867444,79.54545454545455,1.13434700861927,100.0,1.4865614034230772,6.8181818181818175,-1.2576118834905068,BTPS 0 04/01/26,100.0,0.0,100.0,0.0,100.0,0.0,100.0,0.0,100.0,0.0,0.8777483781973106,-0.03827874714232349,falling,2.272727272727273,100.0,1.0,1.0,-1.0,1,0,1.491483060273173,1.4938110071545574,1.2711124957003899,1.98446357558173,Top Quartile,Top Decile,Bottom Decile,Top Decile,Very Tight,0.3841408123903989,"['Cpn', 'Issue_Age', 'GREEN_BOND_LOAN_INDICATOR']","[0.8105586247674739, 0.11694664212416071, 0.05823673540074197]",0.9857420022923764,1.4950804648206586,0.0
2025-11-06,IT0005438004,BTPS 1 1/2 04/30/45,2045-04-30,-8.562561519194574,STRONG SELL,-3.0568435406075487,0.9587834762796873,-1.699107656499215,-0.12196820737869504,-2.207618362501459,102.1837012066844,-2.2761819081116825,0.06856354561022338,3.012217304102987,-3.1811319555431607,0.12428841493561205,3.907049952088061,-1.700145314938056,0.0010376584388411825,0.061033514230849004,-0.12196820737869504,0.0,0.0,107.975680346234,-5.791979139549596,-5.36415155749949,-2.3159012716352043,0.10828290913374516,4.675627151831321,-3.2583559566419114,0.20151241603436265,6.184481318106045,-1.701296172479317,0.002188515980102057,0.1286381526415177,-0.12196820737869504,0.0,0.0,118.114,-15.9302987933156,-13.487223184353148,-2.2522565433549815,0.044638180853522336,1.9819314450225,-3.137312241841897,0.08046870123434813,2.564892964897117,-1.6996359189771708,0.0005282624779558986,0.031080919681063898,-0.12196820737869504,0.0,0.0,117.817,-15.63329879331559,-13.269136705219687,-1.426349719245485,-0.7812686432559741,-54.773988961967426,-1.5748933973944752,-1.4819501432130735,-94.09844096463847,-1.6055297318327737,-0.09357792466644121,-5.828476559993117,-0.12196820737869504,0.0,0.0,149.846,-47.6622987933156,-31.807521582247674,-1.2423648866463137,-0.9652534758551454,-77.6948446032874,-1.260755186285326,-1.7960883543222228,-142.46130887377632,-1.5130837981905234,-0.1860238583086915,-12.29435258653352,-0.12196820737869504,0.0,0.0,149.612,-47.42829879331559,-31.70086543201448,1.1363636363636365,-2.1528554096749977,1.1363636363636365,-3.033009927815003,1.1363636363636365,-1.6776786175891578,35.22727272727273,-0.13010985094531577,85.22727272727273,1.2765423687442787,BTPS 1 1/2,100.0,0.0,100.0,0.0,100.0,0.0,100.0,0.0,100.0,0.0,0.986970607963496,-0.028187131683808708,falling,28.40909090909091,100.0,-1.0,-1.0,-1.0,1,1,2.392917980902105,3.6602386293153124,1.8749112067050193,0.1640411082966263,Bottom Decile,Top Decile,Top Quartile,Top Decile,Moderate,10.444078649248212,"['GREEN_BOND_LOAN_INDICATOR', 'Cpn', 'Issue_Age']","[0.6413238719681935, 0.18231557116625297, 0.08024027727472523]",0.9038797204091716,-0.1308554735654625,0.0
2025-11-06,IT0005441883,BTPS 2.15 03/01/2072,2072-03-01,-4.537199250444445,MODERATE SELL,-0.7347135527894297,0.9570542616246591,-0.7887038752937493,-3.9913706484288207,-1.4221656929443973,123.21275755344033,-1.4725602463337124,0.05039455338931509,3.422240493898991,-0.8057729351437157,0.071059382354286,8.818784842870594,-0.8288329571013139,0.04012908180756458,4.841636783332646,-3.9913706484288207,0.0,0.0,130.99935092752668,-7.786593374086351,-5.943993858259466,-1.5492991614089728,0.12713346846457552,8.205869518987546,-0.9247903182805033,0.19007676549107355,20.553498417797066,-0.8883756849737509,0.09967180968000156,11.219556122924613,-3.9913706484288207,0.0,0.0,141.664,-18.45124244655966,-13.02465160185876,-1.4077556220067522,-0.014410070937645125,-1.0236201944440886,-0.7122348039151972,-0.022478748874232513,-3.1560867897857294,-0.7762142409935107,-0.012489634300238639,-1.6090447043780254,-3.9913706484288207,0.0,0.0,144.535,-21.32224244655967,-14.752303902227446,-1.4443518798013906,0.02218618685699325,1.5360652077690031,-0.7721722597032571,0.037458706913827355,4.851081602324647,-0.8100419060997464,0.021338030805997055,2.6341884761639354,-3.9913706484288207,0.0,0.0,181.906,-58.69324244655968,-32.26569901121079,-1.3279189760273857,-0.09424671691701159,-7.097324302814655,-0.5944076231153553,-0.1403059296740744,-23.604328386349227,-0.7064081278350769,-0.08229574745867241,-11.6498866662102,-3.9913706484288207,0.0,0.0,178.027,-54.81424244655966,-30.789847856494056,6.8181818181818175,-1.3798299069980338,22.727272727272727,-0.7289851345377258,23.863636363636363,-0.7797307060993903,1.1363636363636365,-4.046043880328284,96.5909090909091,1.740246754190027,BTPS 2.15 03/01/2072,100.0,0.0,100.0,0.0,100.0,0.0,100.0,0.0,100.0,0.0,0.9678597507800784,-0.010805489155419234,falling,23.863636363636363,100.0,-1.0,-1.0,-1.0,1,1,1.541537213258481,0.879739800770726,0.8703096174651437,5.368192899301862,Bottom Decile,Top Decile,Top Decile,Top Decile,Moderate,14.015900555757456,"['REL_SPRD_LOG', 'AMT_OUTSTANDING', 'Issue_Age']","[0.32817217536727084, 0.23536919259485675, 0.14204986647119686]",0.7055912344333245,-4.069230609214452,0.0
2025-11-06,IT0005445306,BTPS 0 1/2 07/15/28,2028-07-15,-4.485144144380865,WEAK SELL,-1.0165503938263003,0.9581911777424843,-0.7825722572460491,0.21811253820314422,-0.8853312468197803,3.7238657728046753,-0.8548008013863783,-0.030530445433401998,-3.571644414315131,-0.9655581813527542,-0.05099221247354613,-5.281112306872531,-0.7567062623432889,-0.025865994902760203,-3.4182345050029905,0.21811253820314422,0.0,0.0,4.81671395936431,-1.0928481865596344,-22.68866686937327,-0.9772582131143865,0.09192696629460628,9.406619880019814,-1.1551632997113883,0.138612905885088,11.999420750276405,-0.8419451864648576,0.059372929218808546,7.0518757596221695,0.21811253820314422,0.0,0.0,10.118,-6.394134227195325,-63.19563373073493,-0.6486985843405855,-0.2366326624791948,-36.47806000254038,-0.6568007351257614,-0.3597496587005389,-54.77302840630236,-0.5903790478555181,-0.19219320939053097,-32.55420510487787,0.21811253820314422,0.0,0.0,11.823,-8.099134227195325,-68.50320747986977,-0.7543006327631004,-0.13103061405667982,-17.37113912255169,-0.812820669574089,-0.20372972425221125,-25.0645350655896,-0.679523341010545,-0.10304891623550405,-15.164882278475947,0.21811253820314422,0.0,0.0,31.191,-27.467134227195324,-88.06108883456515,-0.6565955265537008,-0.22873572026607947,-34.836624304005134,-0.6673903934600238,-0.3491600003662765,-52.31720422650501,-0.5968691297275454,-0.1857031275185037,-31.112871341157316,0.21811253820314422,0.0,0.0,42.007,-38.28313422719532,-91.13513037846504,23.863636363636363,-0.8514890741839906,12.5,-1.008624548702493,25.0,-0.7736829789988997,50.0,0.21406054348913697,25.0,-0.894561114365648,BTPS 0 1/2,100.0,0.0,100.0,0.0,100.0,0.0,100.0,0.0,100.0,0.0,0.9836466280706495,-0.025455450328165208,falling,27.27272727272727,100.0,-1.0,-1.0,-1.0,1,1,0.9596427967599548,1.2172088530868035,0.8635435721537157,0.29335040064287965,Bottom Quartile,Top Decile,Below Median,Top Decile,Very Tight,2.495043535507336,"['Cpn', 'Issue_Age', 'GREEN_BOND_LOAN_INDICATOR']","[0.7067597494433271, 0.15333794322587418, 0.06120954973550097]",0.9213072424047022,0.2152872636963128,0.0
2025-11-06,IT0005449969,BTPS 0.95 12/01/31,2031-12-01,-0.36982614528835,NO ACTION,-0.1279016927857814,0.988589478293707,-0.1375260386279812,0.5611359634318652,-0.2539437709862053,40.18370953578451,-0.2801981838560852,0.026254412869879895,9.369943649017463,-0.1679674727964195,0.0400657800106381,23.85329549719975,-0.16163744744324565,0.02411140881526444,14.91696862636587,0.5611359634318652,0.0,0.0,42.54872441062132,-2.3650148748368096,-5.558368451794529,-0.37098482538690836,0.11704105440070306,31.54874357024279,-0.2995468432598224,0.171645150474041,57.30160360761948,-0.2432728668044734,0.1057468281764922,43.46840040925914,0.5611359634318652,0.0,0.0,50.911,-10.727290464215493,-21.07067325746582,-0.48042721876700395,0.22648344778079865,47.14209233353796,-0.4626019401692432,0.3347002473834618,72.35167237427588,-0.3413598890506079,0.20383385042262667,59.712301002411394,0.5611359634318652,0.0,0.0,53.361,-13.177290464215488,-24.694609287206067,-0.2998978349380112,0.0459540639518059,15.323239138748928,-0.19711735089803548,0.06921565811225408,35.113933038124344,-0.1786173128061079,0.04109127417812669,23.005201025620543,0.5611359634318652,0.0,0.0,79.789,-39.60529046421549,-49.63753206488582,-0.35359614822042634,0.09965237723422105,28.1825395772822,-0.27928248570012654,0.15138079291434514,54.203466112278996,-0.2310096307090729,0.0934835920810917,40.46739858741321,0.5611359634318652,0.0,0.0,81.854,-41.67029046421549,-50.90806858446098,55.68181818181818,-0.23009119776525055,53.40909090909091,-0.12690446823670887,56.81818181818182,-0.13746208802728763,71.5909090909091,0.5612090048324608,53.40909090909091,-0.09059781868649225,BTPS 0.95 12/01/31,100.0,0.0,100.0,0.0,100.0,0.0,100.0,0.0,100.0,0.0,0.9852522933992874,0.003337184894419587,rising,88.63636363636364,100.0,-1.0,-1.0,-1.0,1,1,0.27525890618269183,0.15314840634476554,0.15175560539148714,0.7546996657961637,Above Median,Top Decile,Above Median,Top Decile,Very Tight,5.130351029400515,"['Cpn', 'Issue_Age', 'GREEN_BOND_LOAN_INDICATOR']","[0.6791137728902676, 0.18769370301773103, 0.07207808683920912]",0.9388855627472078,0.5644251343229997,0.0
2025-11-06,IT0005454241,BTPS 0 08/01/26,2026-08-01,-8.259369854330615,MODERATE SELL,-1.8479766017853936,0.9142966944521973,-1.2884024464057162,0.701819886253729,-1.445731007279187,-22.62015799118109,-1.66323775978378,0.21750675250459306,13.07730959794575,-2.2609320549921987,0.41295545320680516,18.264832437954304,-1.3192680683319857,0.030865621926269515,2.3396019681833287,0.701819886253729,0.0,0.0,-24.46162938716884,1.8414713959877496,7.527999734150494,-1.2463375511045187,-0.1993934561746682,-15.998350879994616,-1.4895264327075834,-0.35845016907781013,-24.06470666114783,-1.2189547970716093,-0.06944764933410696,-5.69731124822802,0.701819886253729,0.0,0.0,-16.532,-6.088157991181092,-36.826506094232045,-0.7134461284568464,-0.7322848788223405,-102.6405273432752,-0.6531943923369868,-1.1947822094484066,-182.91372448596266,-0.8540952234578388,-0.4343072229478774,-50.84997620108089,0.701819886253729,0.0,0.0,-10.097,-12.523157991181092,-124.02850330571695,-0.6062341399277206,-0.8394968673514663,-138.4773304921138,-0.4805974721320679,-1.3673791296533258,-284.5164988354165,-0.7518387009392683,-0.5365637454664479,-71.36686867268665,0.701819886253729,0.0,0.0,0.855,-23.475157991181092,-2745.632481475771,0.8422944864856823,-2.288025493764869,-271.64198547078627,0.6006352763081197,-2.448611878093513,-407.67033404650823,0.8110824396439241,-2.0994848860496402,-258.8497491187661,0.701819886253729,0.0,0.0,16.359,-38.9791579911811,-238.27347617430004,5.681818181818182,-1.4030223788877332,4.545454545454546,-1.8335682887031073,7.954545454545454,-1.2725925522027575,76.13636363636364,0.7035847254141927,1.1363636363636365,-1.47546399218459,BTPS 0 08/01/26,100.0,0.0,100.0,0.0,100.0,0.0,100.0,0.0,100.0,0.0,0.9335703725307605,-0.019273678078563172,falling,4.545454545454546,100.0,-1.0,-1.0,-1.0,1,1,1.567080516102471,2.2127515700660894,1.4217110824450907,0.9439124706344083,Bottom Decile,Top Decile,Bottom Decile,Top Decile,Very Tight,0.7078084975276511,"['Cpn', 'Issue_Age', 'GREEN_BOND_LOAN_INDICATOR']","[0.7716948679396032, 0.118941465092682, 0.05545861216673074]",0.946094945199016,0.7076167697417287,0.0
2025-11-06,IT0005466013,BTPS 0.95 06/01/32,2032-06-01,-1.2442711367357333,NO ACTION,-0.45631810881672397,0.9894230092135029,-0.6364699490571541,-0.015620524768447736,-0.5658879491403448,43.466939749362666,-0.5898272277936248,0.02393927865328005,4.058693312101023,-0.4917731830033827,0.03545507418665872,7.2096394620710536,-0.6562986584975633,0.019828709440409154,3.021293565291268,-0.015620524768447736,0.0,0.0,45.99523651483914,-2.528296765476476,-5.4968665377144035,-0.6116476291917262,0.045759680051381424,7.481379330074983,-0.5238596058325966,0.06754149701587264,12.893052828385237,-0.675674571528296,0.03920462247114187,5.80229352160409,-0.015620524768447736,0.0,0.0,54.838,-11.371060250637335,-20.735731150960575,-0.6344172597293198,0.06852931058897505,10.80193018992275,-0.5597107080494709,0.1033925992327469,18.472506582160605,-0.6973710661586201,0.06090111710146595,8.732957127635979,-0.015620524768447736,0.0,0.0,57.56,-14.093060250637336,-24.484121348486664,-0.9017356169416783,0.33584766780133346,37.24458231071479,-0.9608662852363778,0.5045481764196539,52.50971742072944,-0.9178829176709915,0.28141296861383736,30.65891739896352,-0.015620524768447736,0.0,0.0,84.15,-40.68306025063734,-48.3458826450419,-0.7919282627329096,0.22604031359256482,28.54302862713938,-0.7968552050293798,0.3405370962126558,42.73512801194384,-0.8347004439100362,0.19823049485288202,23.74869858094593,-0.015620524768447736,0.0,0.0,85.631,-42.164060250637334,-49.23924775573497,39.77272727272727,-0.5370999004802618,35.22727272727273,-0.45276028553552217,30.681818181818183,-0.6295795984875173,36.36363636363637,-0.02248328182409886,56.81818181818182,-0.01820045461270991,BTPS 0.95 06/01/32,100.0,0.0,100.0,0.0,100.0,0.0,100.0,0.0,100.0,0.0,0.9903842676321053,-0.0009612584186023954,falling,90.9090909090909,100.0,-1.0,-1.0,-1.0,1,1,0.6133865670239241,0.5463914482241122,0.7023243263331045,0.021008820661232906,Below Median,Top Decile,Above Median,Top Decile,Very Tight,5.463106400974738,"['Cpn', 'Issue_Age', 'AMT_OUTSTANDING']","[0.6770881910369473, 0.1450754675076835, 0.08716587518664731]",0.909329533731278,-0.0226121271296704,0.0
2025-11-06,IT0005467482,BTPS 0.45 02/15/29,2029-02-15,-3.9556667762016335,NO ACTION,-0.5807317764639122,0.9701372017926186,-0.49587666385265455,0.5465242098445878,-0.583586372161861,10.4652019736007,-0.555574371889722,-0.028012000272139015,-5.041989189073015,-0.5370317846011798,-0.043699991862732324,-8.13731929879228,-0.4706898635644089,-0.02518680028824566,-5.351039336689515,0.5465242098445878,0.0,0.0,11.66803098481308,-1.2028290112123816,-10.308757422285632,-0.6445738520684284,0.06098747990656739,9.461674370546056,-0.6700757889089171,0.0893440124450049,13.333418784932025,-0.5486651786140864,0.052788514761431815,9.621261901957766,0.5465242098445878,0.0,0.0,16.666,-6.200798026399301,-37.206276387127524,-0.7705514567028501,0.18696508454098903,24.263802305250675,-0.8594508414910079,0.27871906502709576,32.42990155208565,-0.65301588452741,0.15713922067475544,24.06361345744542,0.5465242098445878,0.0,0.0,17.704,-7.2387980263993015,-40.887923759096864,-0.6135611625730928,0.029974790411231744,4.885379282643718,-0.6198785937650976,0.03914681730118541,6.315239316764683,-0.5195352762582427,0.023658612405588142,4.553802798647304,0.5465242098445878,0.0,0.0,40.496,-30.030798026399303,-74.15744275726875,0.6418277077186032,-1.2254140798804642,-190.9257026537023,0.4787738566860091,-1.0595056331499213,-221.29562761719606,0.42305478306838173,-0.9189314469210363,-217.21334020496542,0.5465242098445878,0.0,0.0,51.097,-40.6317980263993,-79.51895026801458,37.5,-0.5545183050297204,29.545454545454547,-0.57620392408524,42.04545454545455,-0.49090986817103727,70.45454545454545,0.5464215372652854,31.818181818181817,-0.7459102615395519,BTPS 0.45 02/15/29,100.0,0.0,100.0,0.0,100.0,0.0,100.0,0.0,100.0,0.0,0.9725439238594755,-0.002406722066856881,falling,47.72727272727273,100.0,-1.0,-1.0,-1.0,1,1,0.6325705326047368,0.6953633227370378,0.5471841119922994,0.7350475916685835,Below Median,Top Decile,Below Median,Top Decile,Very Tight,2.981321677884808,"['Cpn', 'Issue_Age', 'GREEN_BOND_LOAN_INDICATOR']","[0.6916336560218299, 0.18772680326432215, 0.05877632053128455]",0.9381367798174366,0.5495529239770669,0.0
2025-11-06,IT0005480980,BTPS 2.15 09/01/52,2052-09-01,-4.154398226968482,NO ACTION,-0.6642056734174014,0.9577713977473585,-0.460803808619809,-0.6778474345700491,-0.7294869436060903,120.84544468823984,-0.7388417203082976,0.009354776702207301,1.2661408145292252,-0.6762024281959711,0.011996754778569652,1.7741365752208151,-0.46729389049183645,0.006490081872027431,1.388865094364914,-0.6778474345700491,0.0,0.0,128.8443845468372,-7.9989398585973674,-6.208217677557216,-0.6327892644898846,-0.09669767911620575,-15.281181747929814,-0.5171493330525996,-0.14705634036480186,-28.435952271884574,-0.37335750200106826,-0.08744630661874075,-23.421600960982015,-0.6778474345700491,0.0,0.0,140.655,-19.809555311760164,-14.083790345420914,-0.5384081194048551,-0.19107882420123523,-35.48958750166898,-0.38134715461876295,-0.2828585187986385,-74.1734946636919,-0.29409926379064116,-0.16670454482916786,-56.6830861839662,-0.6778474345700491,0.0,0.0,141.959,-21.113555311760166,-14.872995238253909,-0.3208181123835094,-0.40866883122258096,-127.38333738330839,-0.06073768763465575,-0.6034679857827457,-993.5641443188631,-0.09373685250886638,-0.36706695611094264,-391.5929617083381,-0.6778474345700491,0.0,0.0,174.991,-54.14555531176018,-30.94190861739517,0.3984615045966769,-1.1279484482027673,-283.0758823331979,0.2958141684919992,-0.9600198419094006,-324.5347626010989,0.2289183224196564,-0.6897221310394654,-301.2961538506479,-0.6778474345700491,0.0,0.0,170.523,-49.67755531176016,-29.13246618277119,28.40909090909091,-0.6981104869050893,26.136363636363637,-0.6590269913473022,45.45454545454545,-0.456316869156231,20.454545454545457,-0.6926738166089564,95.45454545454545,1.6880459640444934,BTPS 2.15 09/01/52,100.0,0.0,100.0,0.0,100.0,0.0,100.0,0.0,100.0,0.0,0.9763980313541546,-0.01862663360679606,falling,26.136363636363637,100.0,-1.0,-1.0,-1.0,1,1,0.7907174780927199,0.7953142617072155,0.508482332810931,0.9116707280746577,Below Median,Top Decile,Top Decile,Top Decile,Moderate,12.354721187741546,"['Issue_Age', 'Cpn', 'AMT_OUTSTANDING']","[0.3413551630409269, 0.28042239540676756, 0.25361599335419144]",0.8753935518018858,-0.6966433336155161,0.0
2025-11-06,IT0005484552,BTPS 1.1 04/01/27,2027-04-01,-0.1215839886742093,NO ACTION,-0.0552993844082973,0.9498123671904862,-0.24627264301857904,0.2646698846565103,-0.24112422108330586,-6.453524502544309,0.42002488563475177,-0.6611491067180576,-157.40712362273507,0.20484592953764683,-0.26014531394594415,-126.99559216702674,0.32676007994388273,-0.5730327229624618,-175.3680270625686,0.2646698846565103,0.0,0.0,-4.665701343471675,-1.7878231590726337,-38.318422539889795,0.5140661274024313,-0.7551903484857372,-146.9052897165534,0.3475682051208761,-0.4028675895291734,-115.91036579368037,0.4157911739964906,-0.6620638170150697,-159.22988329176735,0.2646698846565103,0.0,0.0,0.639,-7.092524502544309,-1109.9412193349276,0.32141515867219117,-0.5625393797554971,-175.01954935089782,0.055924221828874666,-0.11122360623717197,-198.88267142856893,0.2344839449552613,-0.48075658797384035,-205.02749881780483,0.2646698846565103,0.0,0.0,2.82,-9.273524502544308,-328.8483854489174,-0.5540906929566437,0.3129664718733378,56.48289534607598,-0.5122745173343574,0.45697513292606007,89.20512509258461,-0.5261574237497589,0.2798847807311799,53.19411316429169,0.2646698846565103,0.0,0.0,12.41,-18.86352450254431,-152.0026147247707,0.4651619310472344,-0.7062861521305402,-151.83661641372785,0.2628664090508993,-0.3181657934591966,-121.03706308624747,0.3637007203666431,-0.6099733633852221,-167.71298830505896,0.2646698846565103,0.0,0.0,26.253,-32.70652450254431,-124.58204582366245,56.81818181818182,-0.21747447445158521,56.81818181818182,-0.054868225895228044,53.40909090909091,-0.2447208542033733,55.68181818181818,0.26117776638648693,12.5,-1.1189791969107672,BTPS 1.1 04/01/27,100.0,0.0,100.0,0.0,100.0,0.0,100.0,0.0,100.0,0.0,0.911681882615462,0.038130484575024215,rising,17.045454545454543,100.0,-1.0,1.0,1.0,0,0,0.261363328943988,0.0662150156852247,0.2717540213147829,0.35596769145742213,Above Median,Top Decile,Bottom Quartile,Top Decile,Very Tight,1.338209800453427,"['Cpn', 'Issue_Age', 'GREEN_BOND_LOAN_INDICATOR']","[0.6154042838991004, 0.23756916955808158, 0.07071963169195838]",0.9236930851491404,0.2626745020224379,0.0
2025-11-06,IT0005494239,BTPS 2 1/2 12/01/32,2032-12-01,0.9825858900860354,WEAK SELL,-0.6275883905827372,0.9907375031665602,-0.595303208810748,-1.2168182860642887,-0.8462570737851216,49.70055476268785,-0.7834772035544012,-0.0627798702307204,-8.012979719717302,-0.5338495692196766,-0.09373882136306055,-17.55903254622356,-0.53959038390349,-0.05571282490725804,-10.325021634321887,-1.2168182860642887,0.0,0.0,52.287284611431375,-2.5867298487435235,-4.947148943518251,-0.7985460446873244,-0.04771102909779723,-5.974737313864606,-0.5589527093183362,-0.068635681264401,-12.279335781406482,-0.5543251337350404,-0.04097807507570761,-7.39242582423693,-1.2168182860642887,0.0,0.0,61.158,-11.45744523731215,-18.734172529250028,-0.7518191681510312,-0.09443790563409038,-12.56125254297769,-0.49011013729077924,-0.13747825329195795,-28.050480907589325,-0.5126112644936088,-0.08269194431713922,-16.13151103608241,-1.2168182860642887,0.0,0.0,63.704,-14.00344523731215,-21.98205016186416,-1.0720143634024624,0.22575728961734076,21.059166296512476,-0.9713549808946724,0.34376659031193524,35.390417873418954,-0.7809497367780422,0.1856465279672942,23.77189169126624,-1.2168182860642887,0.0,0.0,89.199,-39.49844523731215,-44.28126462503394,-0.9472371843877738,0.10098011060265222,10.660488333961434,-0.788520103631052,0.16093171304831477,20.409335192128605,-0.6869756152531344,0.09167240644238639,13.344346301749388,-1.2168182860642887,0.0,0.0,90.174,-40.473445237312156,-44.88371951208085,26.136363636363637,-0.8130331195192273,27.27272727272727,-0.6226952063240252,32.95454545454545,-0.5889760891543773,10.227272727272728,-1.238126074513413,59.09090909090909,0.11925481542869922,BTPS 2 1/2,100.0,0.0,100.0,0.0,100.0,0.0,100.0,0.0,100.0,0.0,0.9845465951394419,0.006190908027118303,rising,92.04545454545455,100.0,-1.0,-1.0,-1.0,1,1,0.9172888768833469,0.7514690366076789,0.6568981390422246,1.6365594324251256,Below Median,Top Decile,Above Median,Top Decile,Very Tight,6.12045707528921,"['Issue_Age', 'Cpn', 'AMT_OUTSTANDING']","[0.42509856587495676, 0.2529198103504579, 0.169755480867512]",0.8477738570929266,-1.245221423566894,0.0
2025-11-06,IT0005495731,BTPS 2.8 06/15/29,2029-06-15,-1.7593665673068417,NO ACTION,0.1514745890407565,0.9675361820245547,0.34853204064248616,-1.5068823282364388,0.3593605576029246,16.017568841924767,0.3613921194039975,-0.0020315618010728898,-0.5621488781239677,0.1519025112283946,-0.00042792218763809675,-0.281708416804149,0.34887163794974346,-0.0003395973072573,-0.09734161811458537,-1.5068823282364388,0.0,0.0,17.435396691373786,-1.4178278494490186,-8.131893261352085,0.37665113195286337,-0.017290574349938748,-4.590607175725118,0.17323777506622784,-0.021763186025471337,-12.562609258223542,0.36085187628909626,-0.0123198356466101,-3.414097615867822,-1.5068823282364388,0.0,0.0,23.657,-7.639431158075233,-32.292476454520795,0.36552565089191547,-0.006165093288990842,-1.6866376149755014,0.1566365425731815,-0.00516195353242499,-3.295497409529168,0.3514374842712426,-0.0029054436287564434,-0.8267312612108474,-1.5068823282364388,0.0,0.0,25.729,-9.711431158075232,-37.74507813867902,-0.5163564509411686,0.8757170085440932,169.59543934976898,-0.053013684249983456,0.20448827329073996,385.7272657258813,-0.2978725672046106,0.6464046078470967,217.00708870661742,-1.5068823282364388,0.0,0.0,47.12,-31.10243115807523,-66.00685728241626,0.35303949128760703,0.006321066315317592,1.7904699877105463,0.14276033447026643,0.008714254570490076,6.104114278251163,0.34355128013604663,0.00498076050643953,1.4497865819299192,-1.5068823282364388,0.0,0.0,56.567,-40.54943115807524,-71.6838990063232,59.09090909090909,0.3735096368578309,61.36363636363637,0.15029357121791115,60.22727272727273,0.34194589132637254,6.8181818181818175,-1.5316782885172973,36.36363636363637,-0.6234769566878708,BTPS 2.8 06/15/29,100.0,0.0,100.0,0.0,100.0,0.0,100.0,0.0,100.0,0.0,0.9833291920650432,-0.015793010040488498,falling,42.04545454545455,100.0,1.0,1.0,1.0,1,1,0.38952400221053907,0.1813743931612689,0.3845940110956521,2.0266809893254556,Above Median,Top Decile,Below Median,Top Decile,Very Tight,3.409961024392061,"['Issue_Age', 'GREEN_BOND_LOAN_INDICATOR', 'AMT_OUTSTANDING']","[0.5688055090553592, 0.14969792773537963, 0.11440601665469845]",0.8329094534454372,-1.5404559019755557,0.0
2025-11-06,IT0005496770,BTPS 3 1/4 03/01/38,2038-03-01,2.951007911918353,WEAK BUY,0.9778820540790482,0.9618472807133065,0.9256210647749651,-0.9634316481794776,0.9439079416082276,85.61270536191351,0.9205849978182621,0.023322943789965467,2.5334915941374727,0.9380280614332794,0.03985399264576872,4.248699357671992,0.9043207670031079,0.021300297771857157,2.355391838109228,-0.9634316481794776,0.0,0.0,90.09567457584996,-4.4829692139364425,-4.975787388843769,0.9452588288145961,-0.0013508872063685562,-0.14291188306291205,0.9765530384211102,0.0013290156579379708,0.13609252053298299,0.9249796031945904,0.0006414615803747026,0.06934872630968533,-0.9634316481794776,0.0,0.0,100.048,-14.43529463808649,-14.428369019514287,0.8808733565756239,0.06303458503260362,7.155919048574392,0.8925967909109307,0.08528526316811746,9.554735473069188,0.8813036161778947,0.04431744859707043,5.028624333394581,-0.9634316481794776,0.0,0.0,101.384,-15.771294638086488,-15.555999602038673,0.808487496929507,0.1354204446787205,16.74984999991199,0.7707594728658201,0.20712258121322802,26.872531031744117,0.8180253179256282,0.10759574684933693,13.153107022025988,-0.9634316481794776,0.0,0.0,131.179,-45.56629463808649,-34.735967368719756,0.6512359897791915,0.29267195182903605,44.94099710830936,0.5326893101219942,0.445192743957054,83.57455784078755,0.6797714808377894,0.2458495839371757,36.166504075388126,-0.9634316481794776,0.0,0.0,130.013,-44.40029463808649,-34.15065773012808,73.86363636363636,0.9488085095626946,76.13636363636364,0.9702576984572793,72.72727272727273,0.9111393576334701,15.909090909090908,-0.9816923297683758,78.4090909090909,0.9111411202185017,BTPS 3 1/4,100.0,0.707106774156017,100.0,0.7071067742099236,100.0,0.7071067732710202,50.0,-0.707106773102511,50.0,-0.7071067807961297,0.974842510216076,-0.012995229502769545,falling,30.681818181818183,50.0,1.0,1.0,1.0,1,1,1.023136210568247,1.1709077097688008,1.0213933772062997,1.2957671407328817,Above Median,Top Decile,Top Quartile,Above Median,Tight,9.492692617506291,"['Issue_Age', 'Cpn', 'AMT_OUTSTANDING']","[0.4993723298259061, 0.1849046541512307, 0.17648173410095372]",0.8607587180780905,-0.9873181298272014,0.0
2025-11-06,IT0005500068,BTPS 2.65 12/01/27,2027-12-01,1.089002807704813,NO ACTION,0.21138143090843106,0.9565135069829288,0.281121975151923,-0.402130754756653,0.3689485002846837,2.453707860148417,0.4074913890479068,-0.03854288876322315,-9.458577249305781,0.2646888360219893,-0.05330740511355822,-20.13964922009961,0.3153269705995555,-0.0342049954476325,-10.847468676037778,-0.402130754756653,0.0,0.0,3.529596128587748,-1.0758882684393312,-30.481908586567428,0.4540506481253604,-0.08510214784067671,-18.742875121476107,0.3404860558288773,-0.12910462492044625,-37.91774109937647,0.36160653697189016,-0.08048456181996716,-22.25749574888745,-0.402130754756653,0.0,0.0,9.185,-6.7312921398515835,-73.28570639654886,-0.6041871131337255,0.9731356134184093,161.06526871527248,-0.5004114588152996,0.7117928897237307,142.24152204362272,-0.4694635399548688,0.7505855151067917,159.8815318418114,-0.402130754756653,0.0,0.0,7.927,-5.473292139851583,-69.04619822060002,-0.6389759173550136,1.0079244176396973,157.74059310996495,-0.5581610021926245,0.7695424331010556,137.87104729476914,-0.5041967978804571,0.7853187730323801,155.7563952722556,-0.402130754756653,0.0,0.0,23.221,-20.767292139851584,-89.43323771977202,0.502469432108757,-0.13352093182407337,-26.572945662867475,0.4046021946782205,-0.19322076376978944,-47.755736754686644,0.40199975001843247,-0.12087777486650947,-30.06911617583229,-0.402130754756653,0.0,0.0,34.752,-32.29829213985158,-92.93937652669672,60.22727272727273,0.3829458823484527,64.77272727272727,0.2097333311254751,59.09090909090909,0.27545811000313275,28.40909090909091,-0.4136414995009051,23.863636363636363,-0.9225689233987995,BTPS 2.65 12/01/27,100.0,0.0,100.0,0.0,100.0,0.0,100.0,0.0,100.0,0.0,0.9351987132879301,0.02131479369499867,rising,22.727272727272727,100.0,1.0,1.0,1.0,1,1,0.3999167226339383,0.25310633948154593,0.3102091498718604,0.5408456523889428,Above Median,Top Decile,Bottom Quartile,Top Decile,Very Tight,1.9926127713937087,"['Issue_Age', 'Cpn', 'GREEN_BOND_LOAN_INDICATOR']","[0.5371216124060564, 0.20566417898537917, 0.1467369299221252]",0.8895227213135607,-0.4160119615098857,0.0
2025-11-06,IT0005508590,BTPS 4 04/30/35,2035-04-30,-3.072551599262397,STRONG SELL,-2.134342839307423,0.9648090839035178,-1.5329691071821423,0.5225873004792027,-1.6698651192836536,62.94445533094397,-1.6937356670582728,0.023870547774619277,1.4093431518239203,-2.181603178839329,0.047260339531906226,2.1663123602716214,-1.535836817776759,0.002867710594616657,0.1867197440998916,0.5225873004792027,0.0,0.0,65.88904241366703,-2.9445870827230607,-4.469008767481161,-1.7382912083674094,0.0684260890837558,3.936399629747948,-2.256162606826476,0.1218197675190531,5.399423189202785,-1.5402893158052429,0.007320208623100566,0.4752489354085251,0.5225873004792027,0.0,0.0,75.249,-12.304544669056028,-16.35177167460146,-1.775276953541719,0.10541183425806544,5.9377683833493995,-2.3313949250484916,0.1970520857410687,8.452110913459206,-1.5448172799020063,0.011848172719864047,0.766962720919289,0.5225873004792027,0.0,0.0,76.75,-13.805544669056033,-17.987680348217935,-1.3788912059063403,-0.29097391337731326,-21.102020958633574,-1.5924825141847057,-0.5418603251227172,-34.02613949563625,-1.4659929715841857,-0.06697613559795657,-4.5686532227173835,0.5225873004792027,0.0,0.0,106.387,-43.44254466905603,-40.83444844292309,-1.0163679452826029,-0.6534971740010507,-64.29730203559446,-1.0024541120625554,-1.1318887272448674,-112.9117734501405,-1.2626685171224448,-0.27030059005969753,-21.40709016290272,0.5225873004792027,0.0,0.0,108.789,-45.844544669056035,-42.14079058070389,2.272727272727273,-1.6236103166650846,2.272727272727273,-2.1177017845321804,4.545454545454546,-1.5138131257524798,65.9090909090909,0.522196774044035,64.77272727272727,0.4112914466803524,BTPS 4 04/30/35,100.0,0.0,100.0,0.0,100.0,0.0,100.0,0.0,100.0,0.0,0.9892852933763406,-0.024476209472822807,falling,35.22727272727273,100.0,-1.0,-1.0,-1.0,1,1,1.810027646756563,2.5556440834662,1.6915826066667567,0.7028536517404349,Bottom Decile,Top Decile,Above Median,Top Decile,Tight,8.25079040852117,"['GREEN_BOND_LOAN_INDICATOR', 'Cpn', 'Issue_Age']","[0.6784461029846744, 0.13982080312283524, 0.11864322086383142]",0.936910126971341,0.5251893355147276,0.0
2025-11-06,IT0005518128,BTPS 4.4 05/01/33,2033-05-01,3.164487628141778,NO ACTION,0.18313384981751452,0.9994039671917986,0.210844199066743,0.01950398419374405,0.34521540427579095,55.07814530821694,0.3789653709357612,-0.033749966659970265,-8.905817881473256,0.2359668907748086,-0.052833040957294075,-22.39002198351305,0.2440304025926038,-0.0331862035258608,-13.599208054966269,0.01950398419374405,0.0,0.0,57.78066230775308,-2.7025169995361438,-4.677199760491144,0.4918519565221112,-0.14663655224632027,-29.813147497038262,0.400362177343732,-0.21722832752621746,-54.257953021851066,0.34611712645754583,-0.13527292739080282,-39.082990450949595,0.01950398419374405,0.0,0.0,67.54,-12.461854691783067,-18.451072978883566,0.44706921576314584,-0.1018538114873549,-22.782559303537557,0.33789041612920373,-0.15475656631168921,-45.80081421203478,0.30691250398640374,-0.09606830491966073,-31.301527484772606,0.01950398419374405,0.0,0.0,69.725,-14.646854691783055,-21.00660407268899,-0.22160519024985134,0.5668205945256423,255.779464510117,-0.06150673376922344,0.24464058358673796,397.74595206119574,-0.14722342840188254,0.3580676274686255,243.21373780932353,0.01950398419374405,0.0,0.0,95.265,-40.18685469178306,-42.184280362740395,-0.17948335865036638,0.5246987629261574,292.3383747873992,-0.0038373534118759443,0.18697120322939045,4872.387187795362,-0.1094149281939092,0.3202591272606522,292.70146521773574,0.01950398419374405,0.0,0.0,95.224,-40.145854691783065,-42.159387011223146,57.95454545454546,0.35958828336963594,62.5,0.18170599091411405,57.95454545454546,0.20614185323597112,38.63636363636363,0.013063617731038955,62.5,0.23783418855773228,BTPS 4.4 05/01/33,100.0,0.0,100.0,0.0,100.0,0.0,100.0,0.0,100.0,0.0,0.9840379815837943,0.015365985608004284,rising,100.0,100.0,1.0,1.0,1.0,1,1,0.37419155512001845,0.21928292453727302,0.232659861302416,0.026231878389486967,Above Median,Top Decile,Above Median,Top Decile,Tight,6.87608058408884,"['Cpn', 'Issue_Age', 'GREEN_BOND_LOAN_INDICATOR']","[0.5599818995627958, 0.2692611851514632, 0.0818864131739829]",0.9111294978882418,0.0131384816157548,0.0
2025-11-06,IT0005519787,BTPS 3.85 12/15/29,2029-12-15,0.5195289152745701,WEAK BUY,0.9112167098620338,0.9796757764564861,0.6501887820722693,-0.6167214276007199,0.8347998688817998,23.265617994060204,0.8101115442804369,0.024688324601362943,3.0475216000704726,0.8714722693947218,0.03974444046731207,4.560608685673449,0.630624203870838,0.019564578201431315,3.102414682325924,-0.6167214276007199,0.0,0.0,24.98088014335401,-1.7152621492938067,-6.866299901220694,0.8163138787633718,0.018485990118427997,2.264568859220599,0.8820299711696918,0.029186738692342007,3.309041564963179,0.636038894269884,0.014149887802385241,2.2246890414082534,-0.6167214276007199,0.0,0.0,31.919,-8.653382005939797,-27.110442066570855,0.6720753927932626,0.16272447608853724,24.212235027829607,0.6646070746521178,0.24660963520991608,37.10607980337759,0.5177080992078039,0.13248068286446535,25.58984116883683,-0.6167214276007199,0.0,0.0,33.316,-10.050382005939799,-30.166832761805484,0.5999869205692875,0.23481294831251232,39.136343868309595,0.5613471400987169,0.34986956976331696,62.326774029544794,0.45646738479908067,0.1937213972731886,42.43926279958228,-0.6167214276007199,0.0,0.0,56.056,-32.79038200593979,-58.495757813775896,0.6064023338746714,0.22839753500712845,37.66435557418173,0.5794195031090276,0.3317972067530063,57.26372675519007,0.4669949013240552,0.18319388074821408,39.22823917477185,-0.6167214276007199,0.0,0.0,63.769,-40.5033820059398,-63.515786666857274,68.18181818181817,0.8414267079157219,72.72727272727273,0.9041121309248231,68.18181818181817,0.639475456279432,22.727272727272727,-0.6308127374324686,42.04545454545455,-0.46365275334029554,BTPS 3.85 12/15/29,100.0,0.0,100.0,0.0,100.0,0.0,100.0,0.0,100.0,0.0,0.9821781273959401,-0.0025023509394540566,falling,61.36363636363637,100.0,1.0,1.0,1.0,1,1,0.9048699950287074,1.0910831898356608,0.7174626218169528,0.8294593211474162,Above Median,Top Decile,Below Median,Top Decile,Very Tight,3.939525729342108,"['Issue_Age', 'Cpn', 'AMT_OUTSTANDING']","[0.384073990361148, 0.36721872445498993, 0.12723325434485003]",0.8785259691609879,-0.6344277461554072,0.0
2025-11-06,IT0005521981,BTPS 3.4 04/01/28,2028-04-01,-0.1674879210334605,NO ACTION,-0.06541158631271678,0.9576723961782557,-0.4830191324695538,0.22882687047768044,-0.31476361327940033,4.912775107017767,-0.33735369147941063,0.0225900782000103,6.69625917870328,-0.0930218676368868,0.027610281324170025,29.681492166764727,-0.5014139866126547,0.01839485414310088,3.668596063805338,0.22882687047768044,0.0,0.0,5.680326690848776,-0.7675515838310094,-13.51245490362938,-0.32777122984783896,0.013007616568438629,3.9685045504532814,-0.0830852786458863,0.017673692333169524,21.271746925614828,-0.49503710384304633,0.01201797137349253,2.427690982640724,0.22882687047768044,0.0,0.0,11.429,-6.516224892982233,-57.014829707592526,-0.5709513370547595,0.2561877237753592,44.87032478282049,-0.43593763044380934,0.3705260441310926,84.99519421031778,-0.7127567108290804,0.22973757835952663,32.23225704449273,0.22882687047768044,0.0,0.0,12.349,-7.436224892982233,-60.217223151352414,0.6746559366227329,-0.9894195499021332,-146.65542560694507,0.4877872264658135,-0.5531988127785303,-113.4098581149122,0.7297017182631393,-1.2127208507326932,-166.19404939868406,0.22882687047768044,0.0,0.0,31.442,-26.529224892982235,-84.37511890002139,1.0720345112247196,-1.3867981245041199,-129.3613309130947,1.0824927365532808,-1.1479043228659975,-106.0426803339783,1.0522059610551036,-1.5352250935246574,-145.90537744099709,0.22882687047768044,0.0,0.0,40.266,-35.35322489298223,-87.79919754681944,54.54545454545454,-0.2899487690533384,55.68181818181818,-0.06490158493396977,43.18181818181818,-0.4782282496510854,52.27272727272727,0.2249037212136504,27.27272727272727,-0.8683448893919086,BTPS 3.4 04/01/28,100.0,0.0,100.0,0.0,100.0,0.0,100.0,0.0,100.0,0.0,0.9610663185432164,-0.003393922364960722,falling,25.0,100.0,-1.0,-1.0,-1.0,1,1,0.3411837493037232,0.07832328081109885,0.5329962354392587,0.30776063900537476,Above Median,Top Decile,Below Median,Top Decile,Very Tight,2.334327075834608,"['Issue_Age', 'Cpn', 'GREEN_BOND_LOAN_INDICATOR']","[0.5444492255633704, 0.2566142393330895, 0.12079283611802175]",0.9218563010144816,0.2261925805942013,0.0
2025-11-06,IT0005530032,BTPS 4.45 09/01/43,2043-09-01,3.2261843611902634,WEAK BUY,1.074312745670842,0.9947403266202085,1.4380734014261487,0.226604600802066,1.1826167778836452,108.9498020826998,1.2158671816823743,-0.03325040379872912,-2.7347068846163305,1.1300847211439942,-0.05577197547315227,-4.93520299284938,1.4617131473146667,-0.023639745888518027,-1.6172629883107112,0.226604600802066,0.0,0.0,115.45668765262324,-6.5068855699234405,-5.635780569885441,1.2523410678224487,-0.06972428993880353,-5.567516004508855,1.1863926874959652,-0.11207994182512326,-9.447120001807365,1.4834662414962003,-0.04539284007005162,-3.0599172730939537,0.226604600802066,0.0,0.0,126.002,-17.05219791730019,-13.533275595583296,1.2494328291738248,-0.06681605129017965,-5.347710512744415,1.186663031691085,-0.112350286020243,-9.467749653695739,1.483636040149829,-0.04556263872368027,-3.0710118373760875,0.226604600802066,0.0,0.0,127.371,-18.42119791730019,-14.46263114512246,1.4527829879110175,-0.2701662100273723,-18.59646006429378,1.5277596257032948,-0.4534468800324529,-29.680511870816083,1.5922505789209376,-0.15417717749478888,-9.682971924618611,0.226604600802066,0.0,0.0,158.22,-49.270197917300194,-31.140309641123853,1.4064396562131871,-0.22382287832954195,-15.914147169368519,1.4436941277438493,-0.3693813820730074,-25.58584761244946,1.5698560231590297,-0.13178262173288102,-8.394567332884288,0.226604600802066,0.0,0.0,155.109,-46.159197917300204,-29.75920024906632,81.81818181818183,1.1837405752456567,80.68181818181817,1.065936538757312,89.77272727272727,1.4165804761058578,51.13636363636363,0.22265472758277785,87.5,1.4257392987843975,BTPS 4.45 09/01/43,100.0,0.0,100.0,0.0,100.0,0.0,100.0,0.0,100.0,0.0,0.992611072922754,0.002129253697454536,rising,97.72727272727273,100.0,1.0,1.0,1.0,1,1,1.2818814159109058,1.2863730051714317,1.5868682164340173,0.3047717979921596,Top Quartile,Top Decile,Top Quartile,Top Decile,Moderate,12.945425865223823,"['Cpn', 'Issue_Age', 'AMT_OUTSTANDING']","[0.4961804945271763, 0.3262309525178021, 0.0993309732098456]",0.921742420254824,0.2239306986192751,0.0
2025-11-06,IT0005534141,BTPS 4 1/2 10/01/53,2053-10-01,8.358150212723487,MODERATE BUY,1.6404727415238254,0.9502076616583485,1.6711503533070382,-0.329976039380544,1.4915879485663954,134.581381534861,1.4984322090845237,-0.006844260518128253,-0.45676143578318124,1.6422147249442154,-0.001741983420390003,-0.1060752521167201,1.6714899506142948,-0.00033959730725663384,-0.02031704139771365,-0.329976039380544,0.0,0.0,143.23817945225684,-8.656797917395835,-6.0436386094092285,1.4929489962564708,-0.0013610476900753898,-0.09116504879749243,1.6402497816278032,0.00022295989602216792,0.013593045227635719,1.6710560207216887,9.433258534952138e-05,0.005645088112861268,-0.329976039380544,0.0,0.0,154.804,-20.222618465138993,-13.06336946321326,1.439419873494123,0.05216807507227239,3.624243048917518,1.550275571790126,0.0901971697336994,5.818137806798673,1.6509443135252317,0.020206039781806462,1.2239080079127604,-0.329976039380544,0.0,0.0,155.996,-21.414618465139,-13.727671519632704,1.445551732625564,0.046036215940831404,3.1846812938854447,1.5539808631024679,0.08649187842135753,5.565826447315246,1.651680107690956,0.019470245616082238,1.1788145541947666,-0.329976039380544,0.0,0.0,186.913,-52.331618465139,-27.99784844410994,1.8754752127214909,-0.38388726415509544,-20.468799561000807,2.3475125352377995,-0.7070397937139741,-30.118680096014227,1.7408244008459828,-0.06967404753894457,-4.002359290509105,-0.329976039380544,0.0,0.0,180.857,-46.27561846513899,-25.586855063713486,96.5909090909091,1.4878233084094676,96.5909090909091,1.6276822955625532,100.0,1.6464685394888148,29.545454545454547,-0.3406190859302285,97.72727272727273,1.9909323156218748,BTPS 4 1/2,50.0,-0.7071066504882365,50.0,-0.7071066729039102,100.0,0.7071066935187565,50.0,-0.7071067695347296,100.0,0.7071067811181456,0.9590325547463174,-0.008824893087968966,falling,18.181818181818183,100.0,1.0,1.0,1.0,1,1,1.6167865256280467,1.9642882009168512,1.8440612126721154,0.4438011870031862,Top Decile,Above Median,Top Decile,Top Decile,Moderate,16.407879386696322,"['Cpn', 'Issue_Age', 'AMT_OUTSTANDING']","[0.47837760683830666, 0.31317964705427065, 0.10166305367258668]",0.8932203075651639,-0.3425710772166573,0.0
2025-11-06,IT0005538597,BTPS 3.8 04/15/26,2026-04-15,5.994449122133576,MODERATE BUY,1.2920048331603111,0.9161269853433284,1.4905977849486025,-0.5160974773225778,1.2567028044711388,-12.055056779084872,1.1358745221901703,0.12082828228096854,10.637467330831857,1.104298522271165,0.18770631088914613,16.997786866844635,1.4192446173904412,0.07135316755816135,5.027545370339579,-0.5160974773225778,0.0,0.0,-12.46467530135766,0.4096185222727886,3.2862349964266553,1.2791602078943907,-0.022457403423251865,-1.7556364800195796,1.3346036619246726,-0.042598828764361496,-3.1918710895593767,1.5057287316386196,-0.015130946690017133,-1.0048919351536572,-0.5160974773225778,0.0,0.0,-8.02,-4.035056779084872,-50.31242860415996,1.6253563401823914,-0.3686535357112526,-22.68139756982422,1.957818153229865,-0.665813320069554,-34.00792436061293,1.6308514728458443,-0.1402536878972418,-8.6000282289653,-0.5160974773225778,0.0,0.0,1.238,-13.293056779084871,-1073.752558296415,1.583972575522808,-0.3272697710516692,-20.66132798274726,1.8567400720379834,-0.5647352388776723,-30.415417017217138,1.6210220174524546,-0.13042423250385204,-8.045802604473089,-0.5160974773225778,0.0,0.0,6.236,-18.291056779084872,-293.31393120194804,1.0663113541680842,0.1903914503030546,17.85514594525534,0.9984228568446334,0.29358197631567773,29.40457255786817,1.371078399311122,0.11951938563748055,8.717180930413111,-0.5160974773225778,0.0,0.0,12.124,-24.179056779084874,-199.43134905263722,86.36363636363636,1.2566544377403026,90.9090909090909,1.2819313235054726,94.31818181818183,1.4683862368682141,25.0,-0.5289787315185792,7.954545454545454,-1.2424966310275132,BTPS 3.8 04/15/26,100.0,0.0,100.0,0.0,100.0,0.0,100.0,0.0,100.0,0.0,0.8950930144488953,0.02103397089443304,rising,5.681818181818182,100.0,1.0,1.0,1.0,1,1,1.3621859595612522,1.5470356715265696,1.6448272015017575,0.6941251658001897,Top Quartile,Top Decile,Bottom Decile,Top Decile,Very Tight,0.4293053669975677,"['Issue_Age', 'Cpn', 'AMT_OUTSTANDING']","[0.4147475634433224, 0.3400623496270258, 0.1288725553324571]",0.8836824684028054,-0.5320101584622895,0.0
2025-11-06,IT0005542359,BTPS 4 10/30/31,2031-10-30,-2.3825411329547848,WEAK SELL,-0.8838196169619728,0.9913980428479544,-1.2235393607195824,0.4552433009061676,-0.9482823496711673,37.428123156392616,-1.006174000327489,0.057891650656321736,5.753642020377687,-0.9724904328527632,0.0886708158907904,9.117911290796647,-1.2691019994432626,0.04556263872368027,3.590147867125982,0.4552433009061676,0.0,0.0,39.544473521035904,-2.1163503646432886,-5.351823341338207,-1.0159603701542603,0.06767802048309302,6.661482259063783,-0.9876497348782018,0.10383011791622909,10.512848148311276,-1.2766486062712015,0.05310924555161911,4.160051941836515,0.4552433009061676,0.0,0.0,48.002,-10.573876843607387,-22.027992253249003,-0.782770147997127,-0.16551220167404035,-21.144418956585696,-0.6399540938931596,-0.24386552306881315,-38.10672071407272,-1.0891342931139925,-0.1344050676055899,-12.340541218957696,0.4552433009061676,0.0,0.0,51.991,-14.562876843607384,-28.010380336608925,-1.3466568653578233,0.39837451568665594,29.58248110386716,-1.5265842642042553,0.6427646472422825,42.10476015661362,-1.4710491981589047,0.2475098374393223,16.825394831563376,0.4552433009061676,0.0,0.0,73.662,-36.23387684360739,-49.189374221020955,-1.232261818387719,0.28397946871655166,23.045383876583113,-1.3395657532096237,0.4557461362476509,34.021930745354,-1.4181474842950537,0.1946081235754713,13.72269981495888,0.4552433009061676,0.0,0.0,79.008,-41.57987684360738,-52.62742613196719,19.318181818181817,-0.9134441859454733,19.318181818181817,-0.8769286478137965,12.5,-1.2086169036751062,63.63636363636363,0.45404292765031906,52.27272727272727,-0.15136029264294776,BTPS 4 10/30/31,100.0,0.0,100.0,0.0,100.0,0.0,100.0,0.0,100.0,0.0,0.9891317870516164,0.0022662557963379903,rising,93.18181818181817,100.0,-1.0,-1.0,-1.0,1,1,1.0278777908555894,1.058278142265639,1.3501367323506615,0.6122793573032939,Bottom Quartile,Top Decile,Above Median,Top Decile,Very Tight,5.593564179784494,"['GREEN_BOND_LOAN_INDICATOR', 'Issue_Age', 'Cpn']","[0.6606346400762438, 0.13688214611067082, 0.13594228085506135]",0.933459067041976,0.4566449187748608,0.0
2025-11-06,IT0005542797,BTPS 3.7 06/15/30,2030-06-15,1.5130945007410084,WEAK BUY,1.242453324637472,0.9715757332205621,1.2242591634735729,-0.5612271737256835,1.1653110777941857,29.027531158277448,1.1113210422542317,0.05399003553995407,4.858185258925792,1.1507921536764831,0.09166117096098891,7.965049976370642,1.189224041274867,0.03503512219870597,2.9460489098877347,-0.5612271737256835,0.0,0.0,30.859873152907824,-1.8323419946303758,-5.937619979698323,1.2280282123567403,-0.06271713456255457,-5.107141140632136,1.3477194872693026,-0.10526616263183053,-7.810687820805204,1.2612186704134032,-0.0369595069398303,-2.930459841247807,-0.5612271737256835,0.0,0.0,39.015,-9.987468841722553,-25.599048671440848,1.399178631598044,-0.23386755380385815,-16.714631488138714,1.639222089966133,-0.3967687653286609,-24.204698395468093,1.3375903315121436,-0.11333116803857068,-8.472786063216486,-0.5612271737256835,0.0,0.0,42.693,-13.66546884172255,-32.00868722863627,0.8663182673321876,0.2989928104619981,34.51304425698386,0.7745362133341668,0.46791711130330527,60.412553629712754,1.0070300859313548,0.2172290775422181,21.571259728967,-0.5612271737256835,0.0,0.0,66.482,-37.45446884172255,-56.337758846136964,1.067088887885036,0.09822218990914977,9.204686704530953,1.0855723888877293,0.1568809357497427,14.451448462625057,1.1630373155819194,0.061221847891653525,5.2639624322479515,-0.5612271737256835,0.0,0.0,70.85,-41.82246884172255,-59.02959609854565,80.68181818181817,1.1667086800986517,86.36363636363636,1.232766158428653,81.81818181818183,1.2056915800139805,23.863636363636363,-0.5746511361270495,44.31818181818182,-0.33659881621879956,BTPS 3.7 06/15/30,100.0,0.0,100.0,0.0,100.0,0.0,100.0,0.0,100.0,0.0,0.9627627570129496,0.008812976207612566,rising,50.0,100.0,1.0,1.0,1.0,1,1,1.2631231370255809,1.4877031138647878,1.3509310117742823,0.7548223390567418,Top Quartile,Top Decile,Below Median,Top Decile,Very Tight,4.367955602010909,"['Issue_Age', 'Cpn', 'GREEN_BOND_LOAN_INDICATOR']","[0.46245388447373525, 0.32644759650957844, 0.09246830495529894]",0.8813697859386126,-0.5779442986560768,0.0
2025-11-06,IT0005544082,BTPS 4.35 11/01/33,2033-11-01,4.655142115811692,WEAK BUY,0.737011563386469,0.9945241871007422,0.7673121200418793,0.7370269641262596,0.9070254944231951,60.33173221482279,0.8485815446977352,0.058443949725459965,6.887251956151427,0.6578987578398582,0.07911280554661082,12.025072764062083,0.7213910174938718,0.04592110254800752,6.365632617796541,0.7370269641262596,0.0,0.0,62.90586717281133,-2.5741349579885338,-4.092042719175647,0.8799119519741783,0.02711354244901687,3.081392641621178,0.6982799795178979,0.03873158386857112,5.546712557997249,0.7448609647287614,0.02245115531311792,3.014140366434613,0.7370269641262596,0.0,0.0,72.586,-12.254267785177205,-16.882412288167092,0.7994494623809553,0.10757603204223987,13.456264061548783,0.5866871506185726,0.15032441276789643,25.622584378598322,0.6789224875696462,0.08838963247223308,13.019104947713972,0.7370269641262596,0.0,0.0,74.57,-14.2382677851772,-19.093828326763873,0.7272472818867991,0.17977821253639603,24.720368785419925,0.4755971895401889,0.2614143738462801,54.96549897665872,0.6134934063714169,0.1538187136704624,25.072594027209337,0.7370269641262596,0.0,0.0,101.151,-40.8192677851772,-40.354784214829046,0.8746304485314638,0.03239504589173137,3.7038552197374672,0.6990182904290322,0.03799327295743682,5.435232945134329,0.7453514941725774,0.02196062586930192,2.946344878404806,0.7370269641262596,0.0,0.0,100.715,-40.38326778517721,-40.09657725380286,71.5909090909091,0.9125096040013392,69.31818181818183,0.7312652279944095,70.45454545454545,0.754996348094342,77.27272727272727,0.7392151868140057,63.63636363636363,0.3536792007039528,BTPS 4.35 11/01/33,100.0,0.0,100.0,0.0,100.0,0.0,100.0,0.0,100.0,0.0,0.9887929322309452,0.005731254869796976,rising,96.5909090909091,100.0,1.0,1.0,1.0,1,1,0.9831579821987693,0.8824914192445283,0.8467044965657073,0.9912642207192781,Above Median,Top Decile,Above Median,Top Decile,Tight,7.237881598790352,"['Cpn', 'Issue_Age', 'GREEN_BOND_LOAN_INDICATOR']","[0.5075710792624729, 0.3632434839481126, 0.07708457740964467]",0.9478991406202302,0.7434514192010393,0.0
2025-11-06,IT0005548315,BTPS 3.8 08/01/28,2028-08-01,0.3228465165348702,NO ACTION,0.04260445019099808,0.9654520827112326,0.6182666351900883,0.04338256358300514,0.38730805591821177,9.032484986614197,0.40252478086753224,-0.01521672494932047,-3.7803199441517568,0.05976068693213052,-0.01715623674113244,-28.708227349852635,0.6290582829540408,-0.010791647763952472,-1.7155242820621894,0.04338256358300514,0.0,0.0,10.139638340236235,-1.1071533536220386,-10.919061561956436,-0.4277479392206344,0.8150559951388462,190.54585688228195,-0.1621184126790805,0.20472286287007857,126.27982649161049,-0.7062571956985181,1.3245238308886065,187.54128385544706,0.04338256358300514,0.0,0.0,15.116,-6.083515013385803,-40.245534594874634,0.7666873517420775,-0.3793792958238657,-49.48292025602651,0.5937110710593708,-0.5511066208683727,-92.82404160033899,0.9540906390333642,-0.33582400384327593,-35.19833300782432,0.04338256358300514,0.0,0.0,17.755,-8.722515013385802,-49.127091008015164,0.8933029156295407,-0.5059948597113288,-56.64314368552383,0.7809218183572693,-0.7383173681662711,-94.54433739153892,1.06312024118001,-0.44485360598992174,-41.844147498475046,0.04338256358300514,0.0,0.0,37.575,-28.542515013385806,-75.96145044787667,1.3283218565740416,-0.9410138006558297,-70.84230293391597,1.4731584888077933,-1.4305540386167952,-97.10795136942309,1.3494762372661473,-0.731209602076059,-54.18469599278897,0.04338256358300514,0.0,0.0,45.278,-36.2455150133858,-80.05105129506757,61.36363636363637,0.40101495929300907,57.95454545454546,0.04227227160364076,67.04545454545455,0.6079900585747241,39.77272727272727,0.03722934952769157,30.681818181818183,-0.7775026040114835,BTPS 3.8 08/01/28,100.0,0.0,100.0,0.0,100.0,0.0,100.0,0.0,100.0,0.0,0.9594903182671378,0.005961764444094797,rising,36.36363636363637,100.0,1.0,1.0,-1.0,1,0,0.41981731394223915,0.05101420870851561,0.6822375489956106,0.05834736743165507,Above Median,Top Decile,Below Median,Top Decile,Very Tight,2.662336533735754,"['Issue_Age', 'Cpn', 'GREEN_BOND_LOAN_INDICATOR']","[0.43834881859489044, 0.3792537827528748, 0.09475056025250585]",0.9123531616002712,0.0374427003611598,0.0
2025-11-06,IT0005556011,BTPS 3.85 09/15/26,2026-09-15,6.818583777285097,MODERATE BUY,1.4735538988067927,0.9251061073287864,1.5352359643358602,0.5961699413747801,1.4650074177165735,-6.02733047250284,1.4608106411818211,0.004196776534752367,0.28729093201484407,1.4544739865674918,0.019079912239300834,1.3118084121358489,1.5301042716928621,0.005131692642998065,0.33538188895991533,0.5961699413747801,0.0,0.0,-5.4923395503960615,-0.5349909221067781,-9.740674556330582,1.5805338792037802,-0.11552646148720669,-7.309331503508922,1.6705870207629385,-0.19703312195614586,-11.79424467734333,1.581402331605776,-0.04616636726991574,-2.9193309036736235,0.5961699413747801,0.0,0.0,-0.71,-5.31733047250284,-748.919774311389,1.584291171124114,-0.1192837534075406,-7.529155929713899,1.677879347108545,-0.20432544830175225,-12.17760069793469,1.582760720834805,-0.04752475649894472,-3.0026494575638387,0.5961699413747801,0.0,0.0,5.263,-11.29033047250284,-214.52271425138835,1.463483033330445,0.0015243843861285633,0.10416139722804887,1.4592078734705882,0.014346025336204438,0.9831378721778675,1.5314437944048214,0.0037921699310388135,0.24762057348311242,0.5961699413747801,0.0,0.0,12.063,-18.090330472502842,-149.96543527734642,1.4829211272979288,-0.017913709581355297,-1.2080014999311668,1.4897778630909324,-0.016223964284139747,-1.0890190126450803,1.5400469261886716,-0.0048109618528113796,-0.312390599257813,0.5961699413747801,0.0,0.0,19.696,-25.72333047250284,-130.6017996519225,95.45454545454545,1.461663325742159,93.18181818181817,1.462064886501594,96.5909090909091,1.5124136901597856,72.72727272727273,0.5966642846854606,13.636363636363635,-1.109581341033534,BTPS 3.85 09/15/26,100.0,0.0,100.0,0.0,100.0,0.0,100.0,0.0,100.0,0.0,0.9360046080356115,-0.010898500706825076,falling,6.8181818181818175,100.0,1.0,1.0,1.0,1,1,1.5879749197396127,1.7644209888867382,1.6940840113689533,0.8018186051764203,Top Decile,Top Decile,Bottom Quartile,Top Decile,Very Tight,0.8362766572780345,"['Issue_Age', 'Cpn', 'GREEN_BOND_LOAN_INDICATOR']","[0.47462129796270913, 0.3769747392755363, 0.08908485038143196]",0.9406808876196774,0.6000835983197829,0.0
2025-11-06,IT0005560948,BTPS 4.2 03/01/34,2034-03-01,4.987776468290711,WEAK BUY,0.8606074443431336,0.9862920102888916,1.0887975709120716,0.5337949859352961,1.025306921432846,63.04277059315812,0.9571246384880836,0.06818228294476247,7.123657618938789,0.7628963614020647,0.0977110829410689,12.807910301302613,1.0370089815553418,0.05178858935672981,4.994034745933639,0.5337949859352961,0.0,0.0,65.69853410411302,-2.6557635109549054,-4.0423481996448505,1.0137056896176528,0.011601231815193236,1.1444378599793767,0.8423781117346573,0.018229332608476367,2.1640320585413386,1.0799303078892435,0.008867263022828142,0.8210958499766428,0.5337949859352961,0.0,0.0,75.643,-12.600229406841883,-16.657495611194868,0.8922771754794211,0.13302974595342498,14.909015731691941,0.666347536376181,0.19425990796695258,29.1529411376094,0.9816923535065504,0.10710521740552126,10.910262867172298,0.5337949859352961,0.0,0.0,77.392,-14.349229406841879,-18.540972458377848,0.9672378923838089,0.05806902904903721,6.003593211755145,0.771734968263502,0.08887247607963167,11.51593209881527,1.0419708755447112,0.046826695367360394,4.494050267333602,0.5337949859352961,0.0,0.0,104.747,-41.70422940684188,-39.81424709333963,1.3160025019413826,-0.2906955805085365,-22.089287662505974,1.3278188648153348,-0.4672114204722012,-35.186381918029156,1.291046633900831,-0.20224906298875944,-15.665511695044131,0.5337949859352961,0.0,0.0,104.51,-41.46722940684189,-39.677762322145355,77.27272727272727,1.0289196222180275,71.5909090909091,0.8538974559769055,77.27272727272727,1.072083332070834,69.31818181818183,0.5335392377801735,65.9090909090909,0.41345936222982893,BTPS 4.2 03/01/34,100.0,0.0,100.0,0.0,100.0,0.0,100.0,0.0,100.0,0.0,0.9875790636835837,-0.0012870533946921503,falling,82.95454545454545,100.0,1.0,1.0,1.0,1,1,1.1113675306904038,1.0304840828834165,1.2014534568941184,0.7179274253341483,Top Quartile,Top Decile,Above Median,Top Decile,Tight,7.440114762781746,"['Cpn', 'Issue_Age', 'GREEN_BOND_LOAN_INDICATOR']","[0.47938430538182547, 0.37659077955554177, 0.08150938264967338]",0.9374844675870406,0.5365967996906363,0.0
2025-11-06,IT0005561888,BTPS 4 11/15/30,2030-11-15,2.730707050494537,WEAK BUY,1.0365694974014303,0.9832777987101909,1.0073508167215424,-0.2954779187585989,1.000690762972082,34.12347231780377,0.9269159302722407,0.07377483269984131,7.959171861708754,0.923902234192507,0.11266726320892329,12.194716910488161,0.9498079396585091,0.05754287706303329,6.058369703446057,-0.2954779187585989,0.0,0.0,36.02863820922208,-1.9051658914183136,-5.287920902882933,0.9427039148418735,0.05798684813020849,6.151119837539134,0.9469904788245675,0.08957901857686279,9.45933667064079,0.9617127119295824,0.045638104791959955,4.745502867050731,-0.2954779187585989,0.0,0.0,44.529,-10.405527682196237,-23.367979698307703,0.8522041953550528,0.14848656761702927,17.423824792693377,0.8152745247070644,0.22129497269436593,27.14361399425768,0.8958874338728863,0.11146338284865609,12.441672624275684,-0.2954779187585989,0.0,0.0,47.489,-13.36552768219623,-28.144470676118228,0.8587079288392157,0.1419828341328664,16.5344732138841,0.8187666789263442,0.2178028184750861,26.601328732693407,0.897547687375033,0.10980312934650938,12.233681805171969,-0.2954779187585989,0.0,0.0,71.797,-37.67352768219623,-52.472286692966286,0.8021741524405515,0.19851661053153058,24.747320448162963,0.738050379779946,0.2985191176214843,40.44698326227962,0.8527019763000068,0.1546488404215356,18.1363293279729,-0.2954779187585989,0.0,0.0,74.483,-40.35952768219624,-54.18622729586296,75.0,1.004692932303231,79.54545454545455,1.0284875672321423,76.13636363636364,0.9917509077852404,31.818181818181817,-0.3057061073627756,48.86363636363637,-0.22422999544618424,BTPS 4 11/15/30,100.0,0.0,100.0,0.0,100.0,0.0,100.0,0.0,100.0,0.0,0.9872932709744651,-0.0040154722642741225,falling,75.0,100.0,1.0,1.0,1.0,1,1,1.0846851796092356,1.241179558573219,1.111579556557396,0.39740294878522353,Top Quartile,Top Decile,Below Median,Top Decile,Very Tight,4.759782840354632,"['Issue_Age', 'Cpn', 'AMT_OUTSTANDING']","[0.42977931861858204, 0.3827019839447853, 0.08250686973319972]",0.894988172296567,-0.3074580222801398,0.0
2025-11-06,IT0005566408,BTPS 4.1 02/01/29,2029-02-01,1.3555576639811768,MODERATE BUY,1.1899334212973618,0.967089285342775,1.319912405017697,0.29214967081221915,1.214575779752287,15.379761396436066,1.1903561782009655,0.024219601551321412,2.034651627083613,1.1469160460866317,0.043017375210730124,3.750699537462996,1.3031589378596729,0.01675346715802406,1.2856042760969566,0.29214967081221915,0.0,0.0,16.869118866433748,-1.4893574699976817,-8.828899013085517,0.9470890828536781,0.2674866968986088,28.243034252737885,0.7705079499468678,0.419425471350494,54.434930351584754,1.1203612539699257,0.1995511510477712,17.811321889215893,0.29214967081221915,0.0,0.0,21.792,-6.412238603563935,-29.424736603439154,1.0043569016945573,0.21021887805772965,20.930694617618258,0.8586838793065498,0.331249541990812,38.5764244695822,1.1668106189958887,0.15310178602180824,13.121391099561855,0.29214967081221915,0.0,0.0,24.675,-9.295238603563934,-37.67067315013928,1.153213241181809,0.06136253857047791,5.321005330765476,1.0872884011770096,0.10264502012035215,9.440459317435108,1.2792739272492466,0.04063847776845031,3.1766830062865994,0.29214967081221915,0.0,0.0,46.039,-30.659238603563935,-66.59405850888275,1.2222510024443536,-0.007675222692066663,-0.6279579737649102,1.2057797575188665,-0.015846336221504664,-1.3141982183124268,1.3256478262069307,-0.005735421189233758,-0.43265043947452064,0.29214967081221915,0.0,0.0,51.51,-36.13023860356393,-70.14218325868707,84.0909090909091,1.2151939325797054,85.22727272727273,1.180655742529912,84.0909090909091,1.300036122781634,59.09090909090909,0.2889880113446472,35.22727272727273,-0.6375410261670839,BTPS 4.1 02/01/29,100.0,0.0,100.0,0.0,100.0,0.0,100.0,0.0,100.0,0.0,0.9859483090872585,-0.01885902374448345,falling,40.909090909090914,100.0,1.0,1.0,1.0,1,1,1.3165229425090548,1.4248162253277412,1.4564813186325594,0.39292662258888167,Top Quartile,Top Decile,Below Median,Top Decile,Very Tight,3.147891783124379,"['Cpn', 'Issue_Age', 'GREEN_BOND_LOAN_INDICATOR']","[0.4488181517295608, 0.3933284272964713, 0.08295471456737569]",0.9251012935934078,0.2906441195996738,0.0
2025-11-06,IT0005580045,BTPS 2.95 02/15/27,2027-02-15,6.907145135662138,MODERATE BUY,1.4930631279906799,0.9630389986175454,1.3296946941184127,0.605241518741153,1.4246740602304877,-0.8838010146074183,1.444243032630407,-0.019568972399919282,-1.3549639376678746,1.5292214263739827,-0.03615829838330287,-2.364490682856219,1.3388638214143584,-0.009169127295945767,-0.6848439012845406,0.605241518741153,0.0,0.0,0.044223864924639,-0.9280248795320574,-2098.470297126802,1.57910785670039,-0.1544337964699023,-9.779813002426362,1.75701036609885,-0.2639472381081702,-15.022520168277051,1.385275453406182,-0.05558075928776929,-4.012253212881188,0.605241518741153,0.0,0.0,5.315,-6.198801014607419,-116.62842903000141,1.1436200168294457,0.281054043401042,24.575823858229544,1.0365230683074471,0.45654005968323275,44.04533475788338,1.167914310244475,0.16178038387393778,13.852076395473336,0.605241518741153,0.0,0.0,6.998,-7.881801014607419,-112.62933700120728,1.1063728205170762,0.3183012397134115,28.769799016543974,0.9723365123635485,0.5207266156271314,53.55415575271748,1.1361619620159225,0.19353273210249022,17.033903340304548,0.605241518741153,0.0,0.0,17.175,-18.05880101460742,-105.14585737463076,1.4972050026098556,-0.07253094237936786,-4.844422892556004,1.6252384479833506,-0.13217531999267074,-8.132672429907807,1.3607489812153808,-0.031054287096968114,-2.282146619063913,0.605241518741153,0.0,0.0,26.457,-27.34080101460742,-103.34051859346624,93.18181818181817,1.421968109017116,94.31818181818183,1.4814220060311685,85.22727272727273,1.3096845735558014,73.86363636363636,0.6058449525147597,19.318181818181817,-0.9961631672949186,BTPS 2.95 02/15/27,100.0,0.0,100.0,0.0,100.0,0.0,100.0,0.0,100.0,0.0,0.9861604796426415,-0.023121481025096147,falling,32.95454545454545,100.0,1.0,1.0,1.0,1,1,1.5442561239558856,1.787781175084831,1.467275763229407,0.8140194207591075,Top Decile,Top Decile,Bottom Quartile,Top Decile,Very Tight,1.2378422754984797,"['Issue_Age', 'GREEN_BOND_LOAN_INDICATOR', 'AMT_OUTSTANDING']","[0.744775513651731, 0.12321783356687063, 0.0731524156289165]",0.9411457628475182,0.6093168779502012,0.0
2025-11-06,IT0005580094,BTPS 3 1/2 02/15/31,2031-02-15,2.996936353526351,MODERATE BUY,1.13655757486689,0.9828008422604303,1.3960859676872042,1.0110962298603519,1.3339383721878217,36.665829178830194,1.377479945392318,-0.043541573204496364,-3.160958751816853,1.208041438557042,-0.07148386369015203,-5.917335350996169,1.4235367500238316,-0.027450782336627455,-1.928350788508468,1.0110962298603519,0.0,0.0,39.184309753086815,-2.518480574256621,-6.427267928116295,1.4442680175812608,-0.11032964539343904,-7.63913922391607,1.317293514386605,-0.180735939519715,-13.720248082436626,1.4633262345241387,-0.06724026683693451,-4.59502910499637,1.0110962298603519,0.0,0.0,48.177,-11.511170821169806,-23.89349859638511,1.4823256233035567,-0.14838725111573492,-10.010435479351088,1.382785321604016,-0.2462277467371261,-17.80665017985869,1.484607665778926,-0.08852169809172183,-5.962632386719767,1.0110962298603519,0.0,0.0,51.765,-15.099170821169807,-29.16868698590348,1.4306456324078876,-0.09670726022006582,-6.759693480581257,1.2942096919941368,-0.15765211712724692,-12.181342550927743,1.4549683674621965,-0.05888239977499232,-4.046988284219409,1.0110962298603519,0.0,0.0,76.64,-39.97417082116981,-52.15836484336375,1.2481366406248673,0.08580173156295445,6.874386031369134,1.006333692417138,0.13022388244975192,12.940427428492551,1.3384487580388216,0.05763720964838259,4.306269393697916,1.0110962298603519,0.0,0.0,77.886,-41.2201708211698,-52.923722897410876,88.63636363636364,1.332668010388033,82.95454545454545,1.1276960571621177,87.5,1.3751675017608058,89.77272727272727,1.016580278826732,50.0,-0.16816937121337575,BTPS 3 1/2,100.0,0.7071067768331701,100.0,0.7071067762976372,100.0,0.7071067773711313,100.0,0.7071067714211637,100.0,0.707106780592998,0.9769263601276544,0.00587448213277586,rising,70.45454545454545,50.0,1.0,1.0,1.0,1,1,1.4459044055996402,1.3609044377658612,1.5405364200014537,1.3598736072741902,Top Quartile,Top Decile,Above Median,Top Decile,Very Tight,4.913185693149558,"['Issue_Age', 'Cpn', 'GREEN_BOND_LOAN_INDICATOR']","[0.6027240423966794, 0.25906060176849566, 0.1001592438244129]",0.961943887989588,1.022406011817616,0.0
2025-11-06,IT0005582421,BTPS 4.15 10/01/39,2039-10-01,3.732831493883623,MODERATE BUY,1.2518582206847426,0.9694387933334515,1.4561758245546668,0.36032689452055305,1.2968306643894216,94.17396970371904,1.2511936353538584,0.045637029035563215,3.647479285483128,1.1722626232973765,0.0795955973873661,6.789911673929002,1.4262723949989593,0.02990342955570746,2.096614184702626,0.36032689452055305,0.0,0.0,99.11203077960288,-4.938061075883837,-4.98230238704972,1.1436242775705272,0.15320638681889442,13.396566379712027,1.0099381177974505,0.24192010288729215,23.953952844110347,1.356277616669827,0.09989820788483983,7.365616443156083,0.36032689452055305,0.0,0.0,108.704,-14.530030296280955,-13.366601316367657,1.3548514266074803,-0.05802076221805863,-4.2824446024385825,1.354800163992356,-0.1029419433076133,-7.598311934391155,1.491890141367887,-0.035714316813220126,-2.393897216928091,0.36032689452055305,0.0,0.0,111.404,-17.230030296280958,-15.466258208622971,1.5502516382044824,-0.2534209738150608,-16.34708623652009,1.6813151832304603,-0.42945696254571764,-25.54291808429827,1.5738651580363718,-0.11768933348170507,-7.477726546838813,0.36032689452055305,0.0,0.0,141.985,-47.811030296280975,-33.67329668127875,1.1828888896167196,0.11394177477270206,9.632500128255625,1.0651434586896535,0.18671476199508907,17.529541088468278,1.3814644169580725,0.07471140759659423,5.408131120763323,0.36032689452055305,0.0,0.0,139.191,-45.017030296280964,-32.34191168469712,87.5,1.2961474082106612,88.63636363636364,1.2420977263360409,92.04545454545455,1.4344352273456138,60.22727272727273,0.3579851018297259,81.81818181818183,1.0999225735939857,BTPS 4.15 10/01/39,100.0,0.0,100.0,0.0,100.0,0.0,100.0,0.0,100.0,0.0,0.9613117309741366,0.00812706235931493,rising,46.590909090909086,100.0,1.0,1.0,1.0,1,1,1.4056820090436348,1.498964456933093,1.6068436640534485,0.4846215616067005,Top Quartile,Top Decile,Top Quartile,Top Decile,Tight,10.850804544460855,"['Issue_Age', 'Cpn', 'GREEN_BOND_LOAN_INDICATOR']","[0.463281212942891, 0.39507300894648767, 0.07024083041047499]",0.9285950522998536,0.3600366128234105,0.0
2025-11-06,IT0005584849,BTPS 3.35 07/01/29,2029-07-01,1.8445072639173248,MODERATE BUY,1.3529402853108952,0.9796961216279715,1.4559682928668984,0.9071116616245973,1.4431555793628768,20.06302351768777,1.4582506879278305,-0.015095108564953774,-1.0351518148699586,1.375301246712691,-0.022360961401795887,-1.625895511449186,1.4632507684558593,-0.0072824755889608905,-0.4976915574680882,0.9071116616245973,0.0,0.0,21.969038258475504,-1.9060147407877324,-8.675913426409613,1.4056849849709796,0.03747059439189715,2.6656466083050656,1.2916298738412941,0.061310411469601034,4.746747674129721,1.4350075924022985,0.02096070046459997,1.4606682521758323,0.9071116616245973,0.0,0.0,28.47,-8.406976482312228,-29.529246502842653,1.4720351776311298,-0.028879598268253037,-1.9618823320879635,1.40126011139008,-0.048319826079184836,-3.4483123683881436,1.4709105743862172,-0.014942281519318756,-1.015852471110872,0.9071116616245973,0.0,0.0,31.571,-11.50797648231223,-36.451099042371546,1.5560251734098436,-0.11286959404696684,-7.2537125523654185,1.5430997876925858,-0.19015950238169066,-12.323214782740447,1.5089643393160985,-0.052996046449200085,-3.5120807508288223,0.9071116616245973,0.0,0.0,53.416,-33.35297648231223,-62.440048816961635,0.9266708663883098,0.516484712974567,55.7355071940494,0.558147735620155,0.7947925496907402,142.39823701297055,1.0748080485047802,0.38116024436211826,35.46309886179767,0.9071116616245973,0.0,0.0,58.24,-38.17697648231223,-65.55112719051702,94.31818181818183,1.4401572197952428,92.04545454545455,1.3423916738222197,90.9090909090909,1.434230535043751,81.81818181818183,0.9113452417664419,38.63636363636363,-0.5342720469030008,BTPS 3.35 07/01/29,100.0,0.0,100.0,0.0,100.0,0.0,100.0,0.0,100.0,0.0,0.9783495095567054,0.0013466120712660734,rising,62.5,100.0,1.0,1.0,1.0,1,1,1.5642889159445195,1.6199992671092318,1.6066146594429078,1.220019589692565,Top Decile,Top Decile,Below Median,Top Decile,Very Tight,3.4864485335674544,"['Issue_Age', 'Cpn', 'GREEN_BOND_LOAN_INDICATOR']","[0.6453031754990706, 0.20336747018399662, 0.1079445273655326]",0.9566151730485998,0.9165679026340832,0.0
2025-11-06,IT0005584856,BTPS 3.85 07/01/34,2034-07-01,5.368744332107703,MODERATE BUY,1.0021624533003328,0.9880991882886115,1.2970933526217172,0.8885656762106067,1.2173121113751997,65.78196582244037,1.1870980125746649,0.030214098800534828,2.545206733223621,0.9626358834285369,0.039526569871795925,4.1060768813655555,1.2769627789081903,0.02013057371352689,1.5764416855669408,0.8885656762106067,0.0,0.0,68.73660591859837,-2.954640096158002,-4.298495766909408,1.1861369824448351,0.03117512893036456,2.62829075637437,0.9542105868525484,0.047951866447784375,5.02529175487602,1.2723970817772872,0.024696270844430046,1.9409248106606591,0.8885656762106067,0.0,0.0,78.581,-12.799034177559633,-16.287695722796684,1.1444258832184733,0.07288622815672641,6.368802784752465,0.8975749899680856,0.10458746333224722,11.652225533907021,1.2436256432457709,0.05346770937594636,4.299341143084304,0.8885656762106067,0.0,0.0,80.66,-14.878034177559627,-18.445368430095577,1.4031719829919083,-0.18585987161670858,-13.2456942231586,1.3004838859723602,-0.2983214326720274,-22.939263884461646,1.4174428650102708,-0.12034951238855363,-8.49060759416365,0.8885656762106067,0.0,0.0,108.825,-43.04303417755963,-39.552523936231914,1.4279384188446738,-0.21062630746947408,-14.750377412273236,1.3414025538385475,-0.33924010053821463,-25.289954685001327,1.4321398818076818,-0.1350465291859646,-9.429702360675506,0.8885656762106067,0.0,0.0,108.574,-42.79203417755963,-39.41278222559577,85.22727272727273,1.2178869708877755,77.27272727272727,0.994348788142174,82.95454545454545,1.2775292737722699,80.68181818181817,0.8925762311769473,69.31818181818183,0.47386040065332424,BTPS 3.85 07/01/34,100.0,0.0,100.0,0.0,100.0,0.0,100.0,0.0,100.0,0.0,0.9899009498313093,-0.001801761542697733,falling,85.22727272727273,100.0,1.0,1.0,1.0,1,1,1.3194889520573536,1.1999808546597168,1.4313012207735683,1.1950761715088563,Top Quartile,Top Decile,Above Median,Top Decile,Tight,7.572416863078502,"['Issue_Age', 'Cpn', 'GREEN_BOND_LOAN_INDICATOR']","[0.508793757464995, 0.3613690339487631, 0.08550198802117757]",0.9556647794349356,0.8976913321730517,0.0
2025-11-06,IT0005595803,BTPS 3.45 07/15/31,2031-07-15,3.36360356365941,MODERATE BUY,1.274267244664009,0.9836878992855748,1.456270157140016,0.9991004041081849,1.4194126876062354,40.655422153775575,1.4746813229958218,-0.055268635389586374,-3.7478358308983197,1.3655449446889272,-0.09127770002491808,-6.684342372727762,1.4871923786174952,-0.03092222147747914,-2.0792347859058546,0.9991004041081849,0.0,0.0,43.39484137408985,-2.739419220314275,-6.312776203207064,1.5412778587154097,-0.12186517110917428,-7.906761887831672,1.476834727383635,-0.202567482719626,-13.716327060297564,1.518774928192419,-0.06250477105240293,-4.115472903891437,0.9991004041081849,0.0,0.0,52.679,-12.023577846224427,-22.824233269314153,1.6736774526849223,-0.2542647650786869,-15.191981176038185,1.7112933859389594,-0.4370261412749503,-25.537768234953134,1.571299311714873,-0.11502915457485696,-7.320639230552032,0.9991004041081849,0.0,0.0,56.741,-16.085577846224425,-28.349126457745744,1.4430657833830318,-0.023653095776796418,-1.6390864425762324,1.3119156466100137,-0.037648401946004606,-2.8697273148860782,1.4691371217816516,-0.012866964641635503,-0.8758178091946721,0.9991004041081849,0.0,0.0,81.438,-40.78257784622443,-50.0780690110472,1.8204089848349012,-0.4009962972286658,-22.027813440079903,1.998094614047847,-0.723827369383838,-36.22588042990025,1.6063344339135783,-0.15006427677356227,-9.342031937505775,0.9991004041081849,0.0,0.0,82.37,-41.71457784622443,-50.64292562967117,92.04545454545455,1.4167899800536903,89.77272727272727,1.2643320315266333,93.18181818181817,1.434528269301006,88.63636363636364,1.0044401969952048,54.54545454545454,-0.08019624830569408,BTPS 3.45 07/15/31,100.0,0.0,100.0,0.0,100.0,0.0,100.0,0.0,100.0,0.0,0.9880048460124654,-0.004316946726890647,falling,78.4090909090909,100.0,1.0,1.0,1.0,1,1,1.5385531304626927,1.5257968329198153,1.6069477570582398,1.3437398245974563,Top Decile,Top Decile,Above Median,Top Decile,Very Tight,5.244956572244774,"['Issue_Age', 'Cpn', 'GREEN_BOND_LOAN_INDICATOR']","[0.633091463973968, 0.23026235758941585, 0.09797533736592533]",0.9613291589293091,1.010196358623442,0.0
2025-11-06,IT0005596470,BTPS 4.05 10/30/37,2037-10-30,2.2302882904267847,WEAK BUY,0.7253186834559568,0.9690945263820607,0.5988812889008205,0.7382990724149403,0.8491800204878384,83.12067523699886,0.7148077839000068,0.1343722365878316,18.798373175912612,0.5220310000991741,0.2032876833567827,38.94168726071706,0.47902230595608275,0.11985898294473774,25.021586458975438,0.7382990724149403,0.0,0.0,86.95972483163466,-3.839049594635796,-4.414744413723963,0.5227656306304106,0.32641438985742777,62.43990891669926,0.246690445365557,0.47862823809039984,194.01976350529938,0.31286489012194046,0.28601639877888,91.4185000194665,0.7382990724149403,0.0,0.0,95.9,-12.779324763001142,-13.325677540843142,0.5314773625625674,0.31770265792527097,59.777268859714226,0.25910528625124774,0.4662133972047091,179.93202144067098,0.3204114969498793,0.2784697919509412,86.9100472082924,0.7382990724149403,0.0,0.0,97.269,-14.148324763001142,-14.545564117598191,-0.4793927565467362,1.3285727770345745,277.1365923196615,-0.410505421353629,1.1358241048095858,276.6891782805994,-0.42692897722089873,1.0258102661217192,240.27655578021253,0.7382990724149403,0.0,0.0,126.475,-43.35432476300113,-34.27896798543051,-0.909021288147358,1.7582013086351964,193.41695428022643,-1.0701501594219274,1.7954688428778842,167.77727969222852,-0.787015322015998,1.3858966109168185,176.09524929669942,0.7382990724149403,0.0,0.0,124.211,-41.090324763001135,-33.08106750585136,69.31818181818183,0.855579341619415,68.18181818181817,0.7196635151678041,65.9090909090909,0.5888699367416345,78.4090909090909,0.740502592870263,76.13636363636364,0.8561902332870439,BTPS 4.05 10/30/37,100.0,0.0,100.0,0.0,100.0,0.0,100.0,0.0,100.0,0.0,0.9633562187081421,0.005738307673918586,rising,45.45454545454545,100.0,1.0,1.0,1.0,1,1,0.9204571653162372,0.8684904636048099,0.6608464365110189,0.9929751424261176,Above Median,Top Decile,Top Quartile,Top Decile,Tight,9.77545993592841,"['GREEN_BOND_LOAN_INDICATOR', 'Issue_Age', 'Cpn']","[0.6389634851341258, 0.17167070615888, 0.13733013883139264]",0.9479643301243984,0.744746203015936,0.0
2025-11-06,IT0005599904,BTPS 3.45 07/15/27,2027-07-15,4.273040958481408,WEAK BUY,0.9127949045961281,0.9370056667374482,0.9684574917820528,-0.6656265829803947,0.9186041139919884,1.297196596956715,1.0475626565421767,-0.12895854255018835,-12.310341583273315,1.1092763935795502,-0.1964814889834221,-17.712581674809936,1.063129674438545,-0.09467218265649224,-8.905045550156947,-0.6656265829803947,0.0,0.0,3.022908783481805,-1.72571218652509,-57.087801995421906,1.1308882089977934,-0.21228409500580503,-18.771448091831193,1.2467017285434094,-0.33390682394728133,-26.78321635593475,1.1163332525755134,-0.14787576079346065,-13.246560480720044,-0.6656265829803947,0.0,0.0,8.401,-7.103803403043285,-84.5590214806259,0.6894325119472242,0.22917160204476417,33.240613801840226,0.5692181594627101,0.34357674513341796,60.35941288692926,0.7781509340985064,0.19030655768354632,24.456252238313205,-0.6656265829803947,0.0,0.0,9.493,-8.195803403043286,-86.33523011071065,0.6679826117756833,0.2506215022163051,37.5191650270906,0.5261780300545735,0.3866168745415546,73.47643670219605,0.7529452672931908,0.21551222448886198,28.622561424864777,-0.6656265829803947,0.0,0.0,22.05,-20.752803403043284,-94.1170221933405,,,,,,,,,,,,,,,,72.72727272727273,0.9239050305615661,73.86363636363636,0.9056780207824315,75.0,0.9533897095770516,21.59090909090909,-0.6803060028865411,22.727272727272727,-0.9480707498106214,BTPS 3.45 07/15/27,100.0,0.0,100.0,0.0,100.0,0.0,100.0,0.0,100.0,0.0,0.9364059857356605,0.0005996810017877552,rising,9.090909090909092,100.0,1.0,1.0,1.0,1,1,0.9957084698332334,1.0929729068766467,1.068662010681984,0.8952342969572344,Above Median,Top Decile,Bottom Quartile,Top Decile,Very Tight,1.6476054232114734,"['Issue_Age', 'Cpn', 'AMT_OUTSTANDING']","[0.543499910916407, 0.19398587678009807, 0.13853402467040757]",0.8760198123669126,-0.684204643463636,0.0
2025-11-06,IT0005607269,BTPS 3.1 08/28/26,2026-08-28,8.137818044956347,STRONG BUY,1.7641687239053696,0.9413131298141568,1.5455842489486715,-0.4666627578106994,1.5176077200185432,-5.312497741820054,1.3725441400141212,0.145063580004422,10.568955468786163,1.5139613794260998,0.25020734447926984,16.52666615058898,1.494474854206456,0.05110939474221543,3.4198898868301653,-0.4666627578106994,0.0,0.0,-5.8330664548542375,0.5205687130341836,8.924443363893541,1.499022606362842,0.018585113655701146,1.2398154272545396,1.732615231189751,0.03155349271561869,1.8211482829824104,1.5403582237203237,0.005226025228347808,0.339273366022509,-0.4666627578106994,0.0,0.0,-1.107,-4.205497741820054,-379.90042491689354,1.5401918781693298,-0.022584158150786626,-1.466321068450122,1.7998974538652601,-0.035728729959890515,-1.9850425192090366,1.55073480810874,-0.0051505591600684575,-0.3321366812637912,-0.4666627578106994,0.0,0.0,5.322,-10.634497741820054,-199.8214528718134,1.56516082594931,-0.04755310593076678,-3.038224880059985,1.8401280045220985,-0.07595928061672885,-4.127934579402418,1.5563192971614146,-0.01073504821274307,-0.6897715760092205,-0.4666627578106994,0.0,0.0,12.941,-18.253497741820055,-141.05167860068687,,,,,,,,,,,,,,,,97.72727272727273,1.5134314038249164,98.86363636363636,1.7504138444986455,97.72727272727273,1.522620392666306,27.27272727272727,-0.4789495336466127,14.772727272727273,-1.0938188138610343,BTPS 3.1 08/28/26,100.0,0.0,100.0,0.0,100.0,0.0,100.0,0.0,100.0,0.0,0.9354600956843716,0.005853034129785217,rising,11.363636363636363,100.0,1.0,1.0,1.0,1,1,1.6449903039732572,2.112400725156168,1.7055030139945482,0.627637952850646,Top Decile,Top Decile,Bottom Quartile,Top Decile,Very Tight,0.7866244489278529,"['Issue_Age', 'AMT_OUTSTANDING', 'GREEN_BOND_LOAN_INDICATOR']","[0.6378426577483215, 0.154006750721698, 0.09436635437191142]",0.8862157628419309,-0.4816942574596205,0.0
2025-11-06,IT0005607970,BTPS 3.85 02/01/35,2035-02-01,5.386598853365584,WEAK BUY,1.00879660057791,0.9777800526138969,1.1463121481995,0.2574256845157863,1.0687894038560726,69.81259920999327,1.0865214006126982,-0.017731996756625623,-1.6319969936557814,1.0407023955781398,-0.03190579500022972,-3.06579429712235,1.1623675542259397,-0.016055406026439734,-1.3812675543068493,0.2574256845157863,0.0,0.0,73.18361293286632,-3.371013722873059,-4.606241188863925,1.0184455580173877,0.0503438458386849,4.943204371411766,0.9293882398151115,0.07940836076279856,8.544153724624312,1.1054472722262114,0.040864875973288584,3.6966824768877826,0.2574256845157863,0.0,0.0,82.94,-13.127400790006732,-15.827587157492133,1.0459060848395707,0.02288331901650187,2.1878942219962774,0.9784057930950515,0.030390807482858606,3.106155685782064,1.131879262641067,0.014432885558433028,1.2751258819994205,0.2574256845157863,0.0,0.0,85.254,-15.441400790006739,-18.11223026273901,1.2874845133766886,-0.218695109520616,-16.986232109963066,1.3560393590989903,-0.3472427585210802,-25.607129588855738,1.2830755304388206,-0.1367633822393206,-10.65902808750813,0.2574256845157863,0.0,0.0,113.806,-43.99340079000673,-38.65648628907183,,,,,,,,,,,,,,,,78.4090909090909,1.0717141394889562,78.4090909090909,1.0009312102675405,78.4090909090909,1.1288110122734358,54.54545454545454,0.25384645094982655,70.45454545454545,0.5627384913823291,BTPS 3.85 02/01/35,100.0,0.0,100.0,0.0,100.0,0.0,100.0,0.0,100.0,0.0,0.9882456180597851,-0.01046556544588817,falling,56.81818181818182,100.0,1.0,1.0,1.0,1,1,1.1584997777364463,1.2079245265602843,1.2649189619153132,0.346224606391678,Top Quartile,Top Decile,Above Median,Top Decile,Tight,7.964957806722595,"['Issue_Age', 'Cpn', 'GREEN_BOND_LOAN_INDICATOR']","[0.49228774229618516, 0.3485598643901429, 0.08247424763327363]",0.9233218543196016,0.2553011728982258,0.0
2025-11-06,IT0005611055,BTPS 3 10/01/29,2029-10-01,1.2345463169144466,MODERATE BUY,1.1495904489378854,0.9765023453564277,1.3683804873701337,0.2778494623786173,1.2068956015932,21.96557018790814,1.2948481045571816,-0.0879525029639816,-6.792495735614523,1.2886077485952256,-0.13901729965734022,-10.788178072813235,1.420735072238959,-0.05235458486882516,-3.685034988107617,0.2778494623786173,0.0,0.0,24.282267206910465,-2.3166970190023264,-9.540694854840204,1.2779483298335177,-0.07105272824031772,-5.559906142182084,1.2619380673482745,-0.1123476184103891,-8.902783775767071,1.4112074811186865,-0.04282699374855281,-3.034776531309593,0.2778494623786173,0.0,0.0,31.148,-9.182429812091861,-29.479998103068773,1.336102690667347,-0.12920708907414702,-9.670445917788475,1.3590615052543333,-0.2094710563164479,-15.412919427510074,1.4448653475712934,-0.07648486020115963,-5.29356315454367,0.2778494623786173,0.0,0.0,34.119,-12.153429812091861,-35.620709307218235,1.5395647546232691,-0.33266915303006916,-21.60799991492876,1.7166736701366538,-0.5670832211987684,-33.03383909011912,1.5317456586779385,-0.1633651713078048,-10.665293504554613,0.2778494623786173,0.0,0.0,57.452,-35.486429812091856,-61.767092191594976,,,,,,,,,,,,,,,,82.95454545454545,1.2076352676057551,84.0909090909091,1.1406273164562835,86.36363636363636,1.3478410794621274,57.95454545454546,0.274515835424581,40.909090909090914,-0.492319653987734,BTPS 3 10/01/29,100.0,0.0,100.0,0.0,100.0,0.0,100.0,0.0,100.0,0.0,0.9856536215196855,-0.009151276163257838,falling,54.54545454545454,100.0,1.0,1.0,1.0,1,1,1.3081981175639559,1.3765098910682498,1.509964304494278,0.3736935610334442,Top Quartile,Top Decile,Below Median,Top Decile,Very Tight,3.68038180202106,"['Issue_Age', 'GREEN_BOND_LOAN_INDICATOR', 'AMT_OUTSTANDING']","[0.6997553766526279, 0.11407931845667808, 0.11053378076285479]",0.9243684758721608,0.2760890077477748,0.0
2025-11-06,IT0005611741,BTPS 4.3 10/01/54,2054-10-01,9.67597387753422,STRONG BUY,1.8832018521943301,0.9558250361402729,1.5305948011366781,0.045656134877087425,1.5843576220712148,136.86866304122415,1.5598674745318628,0.02449014753935197,1.570014618690625,1.8277896519142167,0.0554122002801134,3.0316508203729,1.5240858527475807,0.006508948389097435,0.4270722895731924,0.045656134877087425,0.0,0.0,145.36491788532234,-8.496254844098189,-5.8447766951695765,1.5893296564544144,-0.004972034383199597,-0.31283845561704976,1.8878329829802647,-0.0046311307859345785,-0.24531464399419953,1.5309155319268657,-0.00032073079018757333,-0.020950260246485577,0.045656134877087425,0.0,0.0,157.338,-20.46933695877584,-13.009785911524782,1.5587290198550554,0.02562860221615937,1.6441986852931423,1.8373598530042845,0.04584199919004561,2.494992957726252,1.5253687759083305,0.005226025228347586,0.34260732726581783,0.045656134877087425,0.0,0.0,158.983,-22.11433695877585,-13.909875242878083,1.6565475206570908,-0.07218989858587599,-4.3578525366695,2.0102505726232254,-0.12704872042889526,-6.320043955072818,1.5421788426175638,-0.011584041480885654,-0.7511477323932878,0.045656134877087425,0.0,0.0,191.071,-54.202336958775845,-28.36764184828628,,,,,,,,,,,,,,,,100.0,1.5791252114696253,100.0,1.8685188947059386,95.45454545454545,1.5078360259544914,40.909090909090914,0.03953026170582853,100.0,2.041368362192893,BTPS 4.3 10/01/54,100.0,0.0,100.0,0.0,100.0,0.0,100.0,0.0,100.0,0.0,0.9706174285696523,-0.014792392429379353,falling,20.454545454545457,100.0,1.0,1.0,1.0,1,1,1.7173429549379398,2.2549299872998576,1.6889626355332266,0.06140520654307747,Top Decile,Top Decile,Top Decile,Top Decile,Moderate,16.259203398789168,"['Issue_Age', 'Cpn', 'AMT_OUTSTANDING']","[0.427624133925947, 0.3937128434001716, 0.09113269399794847]",0.912469671324067,0.0397567984138061,0.0
2025-11-06,IT0005619546,BTPS 3.15 11/15/31,2031-11-15,4.287779492126951,MODERATE BUY,1.621361171872627,0.979323154122466,1.430611693925024,-0.2134763393534803,1.4185708421942949,44.47047559933059,1.4107306357235283,0.007840206470766553,0.555755026271901,1.6107263628957338,0.010634808976893284,0.6602492611935212,1.4284420444619916,0.0021696494630323304,0.15188921778486192,-0.2134763393534803,0.0,0.0,47.0895284214155,-2.6190528220849103,-5.561858250289091,1.387377002750215,0.03119383944407983,2.2484039419280766,1.5655844403595442,0.05577673151308282,3.5626779187972533,1.4186691886198108,0.011942505305213125,0.8418104316941328,-0.2134763393534803,0.0,0.0,56.153,-11.682524400669408,-20.804809001458384,1.46763016402844,-0.049059321834145075,-3.3427577806937623,1.7076731714401459,-0.08631199956751878,-5.05436289013619,1.4476670253561659,-0.017055331431141907,-1.1781252881085205,-0.2134763393534803,0.0,0.0,59.865,-15.394524400669411,-25.715400314203407,1.2815817177096098,0.13698912448468503,10.68906660595937,1.3844683604917696,0.2368928113808575,17.110742031377146,1.3701067736820245,0.06050492024299947,4.416073328269974,-0.2134763393534803,0.0,0.0,85.461,-40.99052440066941,-47.96401211765953,,,,,,,,,,,,,,,,90.9090909090909,1.4159614540355552,95.45454545454545,1.6087197350918618,88.63636363636364,1.4092208574343374,34.090909090909086,-0.2227184160725137,57.95454545454546,0.003928164328098628,BTPS 3.15 11/15/31,100.0,0.0,100.0,0.0,100.0,0.0,100.0,0.0,100.0,0.0,0.983233274439709,-0.0039101203172430266,falling,59.09090909090909,100.0,1.0,1.0,1.0,1,1,1.5376406235468278,1.9414041688835129,1.578634459755033,0.28711494622465505,Top Decile,Top Decile,Above Median,Top Decile,Very Tight,5.464765454372866,"['Issue_Age', 'GREEN_BOND_LOAN_INDICATOR', 'Cpn']","[0.70574146853902, 0.09946471961175982, 0.09398417538218297]",0.8991903635329628,-0.2239947520896608,0.0
2025-11-06,IT0005622128,BTPS 2.7 10/15/27,2027-10-15,4.357128612595572,WEAK BUY,0.9313186190660944,0.9592679498979141,0.850305928632136,-0.7584432539828968,0.8983408659751672,4.267066615349814,0.8287642523805606,0.06957661359460654,8.395223678534732,0.8307283504770991,0.10059026858899522,12.108683581143756,0.8009511199774163,0.04935480865471975,6.1620249734976165,-0.7584432539828968,0.0,0.0,4.685582068060639,-0.41851545271082546,-8.93198423885147,1.0457012568764033,-0.1473603909012361,-14.092016101444905,1.1644610966581999,-0.2331424775921055,-20.02149116522953,0.957580944691286,-0.10727501605914991,-11.202709863181672,-0.7584432539828968,0.0,0.0,11.249,-6.981933384650187,-62.06714711035177,0.40177648198108473,0.4965643839940824,123.59219464175627,0.1945754074836176,0.7367432115824768,378.6414651503998,0.4234887129609882,0.42681721567114783,100.7859696208407,-0.7584432539828968,0.0,0.0,10.431,-6.163933384650186,-59.09244922577835,0.6378694905838748,0.2604713753912924,40.834586879113914,0.5377645118722822,0.3935541071938121,73.18335278489796,0.63285045288508,0.21745547574705604,34.36127308111711,-0.7584432539828968,0.0,0.0,26.228,-21.96093338465019,-83.73087302225522,,,,,,,,,,,,,,,,70.45454545454545,0.9039623808117033,75.0,0.9240573094640668,71.5909090909091,0.8368546604483671,19.318181818181817,-0.7742388429077254,26.136363636363637,-0.8825831820841139,BTPS 2.7 10/15/27,100.0,0.0,100.0,0.0,100.0,0.0,100.0,0.0,100.0,0.0,0.9470766542944873,0.0121912956034268,rising,29.545454545454547,100.0,1.0,1.0,1.0,1,1,0.9737443969868794,1.1151530460825616,0.9382855221810054,1.0200680541049463,Above Median,Top Decile,Below Median,Top Decile,Very Tight,1.870509931040232,"['Issue_Age', 'AMT_OUTSTANDING', 'Cpn']","[0.653134422050741, 0.11284420568917297, 0.10528477134438084]",0.8712633990842948,-0.7786757859253025,0.0
2025-11-06,ES0000011868,SPGB 6 01/31/29,2029-01-31,-4.573014788425022,STRONG SELL,-1.6736577492542035,0.9810350753122163,-1.7136231696031827,1.2541623921747462,-1.5108520975267565,0.3195888689573016,-1.5736860711468157,0.06283397362005916,3.9927895641212774,-1.7814781376625788,0.10782038840837527,6.052299240933323,-1.7335273896741568,0.019904220070974032,1.148191835601522,1.2541623921747462,0.0,0.0,1.4789558925083792,-1.1593670235510776,-78.39091223644574,-1.706173267770889,0.19532117024413242,11.447909352988992,-2.021001867339522,0.3473441180853185,17.18672911588621,-1.7661419220757044,0.05251875247252169,2.973642804052427,1.2541623921747462,0.0,0.0,4.608,-4.288411131042698,-93.06447746823461,-1.6879742354709406,0.17712213794418408,10.49317774956735,-2.0059999927090173,0.3323422434548138,16.567409920538374,-1.7644321592495102,0.05080898964632752,2.879622721225877,1.2541623921747462,0.0,0.0,10.138,-9.818411131042698,-96.8476141384685,-1.8826836250224153,0.37183152749565873,19.75008018228361,-2.3579254749335017,0.6842677256792982,29.019904575084393,-1.7863042195544057,0.07268104995122293,4.068794595495822,1.2541623921747462,0.0,0.0,19.546,-19.2264111310427,-98.36493973808557,-1.7386619334571034,0.22780983593034687,13.102595175999344,-2.0878188612789534,0.4141611120247499,19.837023111638207,-1.7715938073139448,0.05797063771076205,3.272230753133694,1.2541623921747462,0.0,0.0,2.743,-2.4234111310426982,-88.34892899044132,5.660377358490567,-1.4700447372034589,1.8867924528301887,-1.6402414121561777,1.8867924528301887,-1.698564822936902,96.22641509433963,1.2186561952584787,26.41509433962264,-0.8856030126320507,SPGB 6 01/31/29,100.0,0.0,100.0,0.0,100.0,0.0,100.0,0.0,100.0,0.0,0.9925851613976777,-0.011550086085461375,falling,37.735849056603776,100.0,-1.0,-1.0,-1.0,1,1,1.553275515078104,1.8979852434003288,1.8278995630758788,1.7901503735248554,Bottom Decile,Top Decile,Below Median,Top Decile,Very Tight,3.3202348103024804,"['Issue_Age', 'Cpn', 'AMT_OUTSTANDING']","[0.6337776782596739, 0.2553981741843382, 0.0702979980863038]",0.959473850530316,1.2186562075606568,0.0
2025-11-06,ES00000120N0,SPGB 4.9 07/30/40,2040-07-30,3.139272409809891,NO ACTION,0.32508069113370763,0.9862830370046554,0.20721471643572523,0.7953745046114287,0.5363590314924376,72.58664782063194,0.4807487723118087,0.055610259180628896,11.56742590448428,0.24143038429654093,0.0836503068371667,34.64779448374748,0.15808322993962567,0.04913148649609955,31.079503756921728,0.7953745046114287,0.0,0.0,75.52736163791,-2.9407138172780662,-3.8935741340826273,0.5445037366663894,-0.008144705173951827,-1.495803329879011,0.33721437279441663,-0.012133681660708995,-3.5982100052079677,0.2142795854722622,-0.007064869036536969,-3.297033028724144,0.7953745046114287,0.0,0.0,83.25,-10.663352179368061,-12.808831445149766,0.6274660506628685,-0.09110701917043096,-14.519832208005571,0.46042591537219846,-0.13534522423849082,-29.39565666922006,0.2844121210221771,-0.07719740458645188,-27.142796022449687,0.7953745046114287,0.0,0.0,88.895,-16.308352179368057,-18.34563493732324,0.409987971573054,0.12637105991938358,30.823113261642295,0.14409309010457963,0.180987601029128,125.60462707636324,0.09678984560437334,0.11042487083135188,114.08723583875506,0.7953745046114287,0.0,0.0,101.973,-29.38635217936806,-28.8177774278351,-0.3205337438609344,0.8568927753533719,267.3330858394215,-0.20989830879892604,0.5349789999326336,254.8753143874018,-0.1724816696831795,0.3796963861189047,220.13722664131322,0.7953745046114287,0.0,0.0,83.112,-10.525352179368056,-12.664058352706773,56.60377358490566,0.4722284647921222,60.37735849056604,0.3185901132579001,52.83018867924528,0.15253746274220667,84.90566037735849,0.7555157245376306,77.35849056603774,0.9657297708709536,SPGB 4.9 07/30/40,100.0,0.0,100.0,0.0,100.0,0.0,100.0,0.0,100.0,0.0,0.9856905552019096,0.0005924818027457368,rising,62.264150943396224,100.0,1.0,1.0,1.0,1,1,0.5514195282728228,0.3686526441628207,0.22103324485479736,1.1352915502858643,Above Median,Top Decile,Top Quartile,Top Decile,Tight,12.37183449064645,"['Issue_Age', 'Cpn', 'AMT_OUTSTANDING']","[0.6341658317331469, 0.2147145825394843, 0.06362883418800239]",0.9125092484606336,0.7555157321644654,0.0
2025-11-06,ES00000121S7,SPGB 4.7 07/30/41,2041-07-30,2.45780788699399,NO ACTION,0.031152216252184,0.9873696641184813,0.6336231133532854,1.261888268554807,0.5871093408638189,75.60630080661409,-0.3783505431583296,0.9654598840221486,255.17602021798268,-0.041346725228252765,0.07249894148043676,175.34381150097985,-0.6734421777579861,1.3070652911112715,194.08723048116929,1.261888268554807,0.0,0.0,78.74931570844727,-3.143014901833183,-3.9911647144597633,-0.35001650153732955,0.9371258424011485,267.73760994449634,-0.0035855103983265125,0.03473772665051051,968.8336082740966,-0.6484731885603623,1.2820963019136475,197.70999090786714,1.261888268554807,0.0,0.0,86.605,-10.998699193385917,-12.699843187016837,0.6790385142798919,-0.09192917341607298,-13.538138136354222,0.16460133133732,-0.133449115085136,-81.0741358490249,0.717143414429058,-0.08352030107577268,-11.646247909512104,1.261888268554807,0.0,0.0,92.364,-16.757699193385918,-18.143106829036864,-0.608075871407067,1.195185212270886,196.55198451635144,-0.37860179968819635,0.40975401594038036,108.22822433887464,-0.879226650744604,1.5128497640978895,172.0659565551253,1.261888268554807,0.0,0.0,105.493,-29.88669919338591,-28.330504574287264,-1.3678607508091545,1.9549700916729735,142.92171744999223,-1.5551807460545932,1.5863329623067772,102.00312446838755,-1.4190278086823809,2.0526509220356663,144.651915558754,1.261888268554807,0.0,0.0,85.119,-9.512699193385913,-11.17576474379203,58.490566037735846,0.5203773657470735,47.16981132075472,0.03053022949288544,60.37735849056604,0.563465195844443,98.11320754716981,1.2264553680797066,81.13207547169812,1.0430870433108048,SPGB 4.7 07/30/41,100.0,0.0,100.0,0.0,100.0,0.0,100.0,0.0,100.0,0.0,0.9846183937905518,0.0027512703279294337,rising,66.0377358490566,100.0,1.0,-1.0,-1.0,0,0,0.6035948623496976,0.035327680807027834,0.6758775398219249,1.80117803674763,Above Median,Top Decile,Top Quartile,Top Decile,Tight,12.793569223533297,"['Issue_Age', 'Cpn', 'YAS_RISK']","[0.6515267064337669, 0.22610238411131212, 0.082635632455206]",0.960264723000285,1.2264553804606164,0.0
2025-11-06,ES00000123C7,SPGB 5.9 07/30/26,2026-07-30,6.497149770860876,MODERATE BUY,1.6409841147819046,0.9076628715560643,1.1020336083784763,0.6289196791423038,1.4254011862663356,-9.845819593650468,1.4221281795192326,0.003273006747102958,0.23014850357543623,1.6439651496838712,-0.0029810349019665505,-0.18133199991536275,1.102517503517965,-0.00048389513948876584,-0.043890018394785436,0.6289196791423038,0.0,0.0,-8.005996197161531,-1.8398233964889368,-22.980567925365442,1.348490259470394,0.07691092679594158,5.703484002605935,1.5031108126447816,0.137873302137123,9.172530731601654,1.0655156551850522,0.0365179531934241,3.4272563404388703,0.6289196791423038,0.0,0.0,-2.862,-6.983819593650468,-244.0188528738149,-0.24226013649755598,1.6676613227638917,688.3762545651379,-0.02464073145811283,1.6656248462400174,6759.637688141154,-0.35913615482200556,1.4611697632004819,406.85675972640195,0.6289196791423038,0.0,0.0,-10.072,0.22618040634953118,2.24563548575226,-0.4073238666266243,1.83272505289296,449.9429466475735,-0.21502879603261948,1.856012910814524,863.1461733238524,-0.47917440909120235,1.5812080174696788,329.9858995955133,0.6289196791423038,0.0,0.0,-3.884,-5.961819593650468,-153.49689954430428,0.4888123647123722,0.9365888215539634,191.604973606708,0.1813839186673879,1.4596001961145166,804.7020520715774,0.423870700222859,0.6781629081556173,159.99286853273227,0.6289196791423038,0.0,0.0,-11.415,1.5691804063495312,13.74665269360373,94.33962264150944,1.3156992373885135,98.11320754716981,1.6082201411579706,83.01886792452831,1.014870150046627,79.24528301886792,0.587481719474915,9.433962264150944,-1.146019780901386,SPGB 5.9 07/30/26,100.0,0.0,100.0,0.0,100.0,0.0,100.0,0.0,100.0,0.0,0.9328137273705931,-0.025150855814528805,falling,3.7735849056603774,100.0,1.0,1.0,1.0,1,1,1.4654252162836694,1.8609322221931475,1.1755249269396955,0.897699377336183,Top Decile,Top Decile,Bottom Decile,Top Decile,Very Tight,0.7343833939764011,"['Issue_Age', 'Cpn', 'AMT_OUTSTANDING']","[0.5083232896808642, 0.32148489000141867, 0.06566163758879696]",0.8954698172710798,0.5874817254054682,0.0
2025-11-06,ES0000012411,SPGB 5 3/4 07/30/32,2032-07-30,-2.757159616996649,WEAK SELL,-1.0004010306323416,0.9971032508449948,-1.4636752002192173,1.3657000249906766,-1.0965793558648913,26.81225689306559,-1.1182661427679883,0.021686786903097,1.939322481451914,-1.0361068898701173,0.035705859237775694,3.4461559171405627,-1.4796114801463829,0.01593627992716562,1.0770584057568378,1.3657000249906766,0.0,0.0,28.665824193864605,-1.853567300799014,-6.4661224725892374,-0.9388037041416362,-0.15777565172325514,-16.806031904924026,-0.7620501192788875,-0.2383509113534541,-31.27758951750335,-1.343895023357748,-0.11978017686146925,-8.912911640293524,1.3657000249906766,0.0,0.0,34.123,-7.310743106934407,-21.42467867652885,-1.5377627552205848,0.4411833993556935,28.689952009106413,-1.7293782852207207,0.728977254588379,42.15256179651195,-1.7066873392705095,0.24301213905129226,14.238819966361332,1.3657000249906766,0.0,0.0,39.689,-12.87674310693441,-32.44411072007357,-1.6355403332796516,0.5389609774147603,32.95308364781843,-1.9032990823119649,0.9028980516796232,47.438579429093295,-1.7327531574509747,0.2690779572317574,15.52892600551951,1.3657000249906766,0.0,0.0,49.658,-22.84574310693441,-46.00616839649964,-1.7064176793827006,0.6098383235178093,35.73792790078374,-2.0325289232250037,1.032127892592662,50.780477252788216,-1.7491410728416634,0.28546587262244616,16.32034576414367,1.3657000249906766,0.0,0.0,30.445,-3.6327431069344094,-11.93215012560747,22.641509433962266,-1.0770071881976695,22.641509433962266,-0.9804269719648994,7.547169811320755,-1.4576911600471967,100.0,1.3312520007838147,52.83018867924528,-0.2069155781774225,SPGB 5 3/4,100.0,0.0,100.0,0.0,100.0,0.0,100.0,0.0,100.0,0.0,0.9900259526268742,0.007077298218120642,rising,96.22641509433963,100.0,-1.0,-1.0,-1.0,1,1,1.1273703538508606,1.134489052178537,1.561283312704771,1.9493555420846342,Bottom Quartile,Top Decile,Above Median,Top Decile,Very Tight,6.73501457722665,"['Issue_Age', 'Cpn', 'AMT_OUTSTANDING']","[0.6517088058489746, 0.251569133734241, 0.06761365034910567]",0.9708915899323212,1.3312520142226332,0.0
2025-11-06,ES00000124C5,SPGB 5.15 10/31/28,2028-10-31,-1.7476497342322466,NO ACTION,-0.5306628972869841,0.9769931992705092,-0.778028047239506,0.5316872239614293,-0.656325534115094,1.1544674748924215,0.40618573513767886,-1.0625112692527727,-261.5826089348923,0.027654127530452176,-0.5583170248174363,-2018.9276349791378,0.4438716993217308,-1.221899746561237,-275.28218647419345,0.5316872239614293,0.0,0.0,2.326465008545671,-1.1719975336532495,-50.376752898089705,-0.4518193112296749,-0.2045062228854191,-45.262832569628365,-0.22563392849215563,-0.3050289687948285,-135.1875390879786,-0.6023741116050594,-0.17565393563444665,-29.160272550621354,0.5316872239614293,0.0,0.0,5.494,-4.339532525107578,-78.98675859499276,-0.7105724094407452,0.0542468753256512,7.634250055518072,-0.611256018961897,0.08059312167491284,13.184838734725455,-0.8259981854008323,0.047970138161326226,5.80753546780423,0.5316872239614293,0.0,0.0,10.215,-9.060532525107579,-88.69831146586145,0.776581676567737,-1.432907210682831,-184.51467958455984,0.5700471250408091,-1.1007100223277932,-193.0910541720369,0.7677911056955559,-1.5458191529350618,-201.3332951286726,0.5316872239614293,0.0,0.0,21.882,-20.72753252510758,-94.72412263794519,-1.0730017043676134,0.41667617025251946,38.832759041591345,-1.163082524517841,0.632419627230857,54.3744410617453,-1.100528027870831,0.3224999806313249,29.30411307423471,0.5316872239614293,0.0,0.0,2.731,-1.5765325251075784,-57.727298401129566,37.735849056603776,-0.6593203224221593,39.62264150943396,-0.5200676544608694,24.528301886792452,-0.7969362773603355,71.69811320754717,0.4893268067526409,28.30188679245283,-0.8642151471808422,SPGB 5.15 10/31/28,100.0,0.0,100.0,0.0,100.0,0.0,100.0,0.0,100.0,0.0,0.990061663208382,-0.013068463937872754,falling,24.528301886792452,100.0,-1.0,1.0,-1.0,0,1,0.6747545863227556,0.6017899111808093,0.8299124059691582,0.7589129513941995,Below Median,Top Decile,Below Median,Top Decile,Very Tight,3.007015036344285,"['Issue_Age', 'Cpn', 'AMT_OUTSTANDING']","[0.5115560267008065, 0.3034219142432323, 0.07053851075306919]",0.8855164516971079,0.4893268116923328,0.0
2025-11-06,ES00000124H4,SPGB 5.15 10/31/44,2044-10-31,-1.1961561287320848,MODERATE SELL,-1.5448712368490967,0.9888897705786687,-1.6329739796883775,0.16014481101535216,-1.4230570197172074,82.4574372195896,-1.3977736006419659,-0.025283419075241564,-1.8088350561740438,-1.502866704004229,-0.042004532844867715,-2.794960621155225,-1.6199410705981445,-0.013032909090233025,-0.8045298218760384,0.16014481101535216,0.0,0.0,86.40137112230461,-3.943933902715017,-4.564665873965997,-1.4226310773493211,-0.0004259423678862895,-0.02994046535844476,-1.5462733143485887,0.0014020774994920604,0.09067462248840936,-1.6335546538557633,0.0005806741673857196,0.035546662761509584,0.16014481101535216,0.0,0.0,94.891,-12.433562780410412,-13.102994782540087,-1.122178811991983,-0.30087820772522433,-26.811966313099234,-1.057512984864411,-0.48735825198468574,-46.08532040281665,-1.4564167731268847,-0.17655720656149287,-12.122711617098346,0.16014481101535216,0.0,0.0,101.353,-18.8955627804104,-18.643318676848313,-1.5692490839294766,0.14619206421226916,9.31605216646626,-1.798645008869876,0.25377377202077933,14.10916380711022,-1.6853959531330007,0.05242197344462318,3.110365432890643,0.16014481101535216,0.0,0.0,115.713,-33.2555627804104,-28.739694569785968,-1.291424737402734,-0.13163228231447355,-10.192795405168406,-1.331356366655682,-0.21351487019341464,-16.037394189657626,-1.5627124054345984,-0.0702615742537791,-4.496129521965755,0.16014481101535216,0.0,0.0,96.679,-14.221562780410409,-14.71008469154563,11.320754716981133,-1.386749944360915,7.547169811320755,-1.5140262579120365,5.660377358490567,-1.6208435842657276,39.62264150943396,0.11425952034600592,84.90566037735849,1.218599007262104,SPGB 5.15 10/31/44,100.0,0.0,100.0,0.0,100.0,0.0,100.0,0.0,100.0,0.0,0.9812272890824856,0.007662481496183093,rising,71.69811320754717,100.0,-1.0,-1.0,-1.0,1,1,1.4630152275693629,1.7519369248580172,1.7418721203903127,0.22858546472605087,Bottom Quartile,Top Decile,Top Quartile,Top Decile,Tight,15.092305042890075,"['Issue_Age', 'Cpn', 'AMT_OUTSTANDING']","[0.3979248517944205, 0.2435204611050687, 0.20603756805821258]",0.8474828809577019,0.1142595214994418,0.0
2025-11-06,ES00000127A2,SPGB 1.95 07/30/30,2030-07-30,-3.491488781047332,WEAK SELL,-1.0318915952327714,0.9860679840271601,-1.2101786664790004,0.45747742728267704,-1.0385438018265245,12.587993546571305,-1.0055661277938452,-0.03297767403267926,-3.2795131810057168,-0.97905931284235,-0.05283228239042137,-5.396228926868461,-1.1861774675603542,-0.02400119891864616,-2.0234070678875242,0.45747742728267704,0.0,0.0,14.061052165103622,-1.473058618532317,-10.47616209788697,-0.6901058595846981,-0.34843794224182645,-50.49050552946528,-0.5073050626080086,-0.5245865326247628,-103.40652221904895,-0.9338100224789445,-0.2763686440000559,-29.595810109941972,0.45747742728267704,0.0,0.0,18.623,-6.0350064534286965,-32.40619905594199,-0.9267268008525863,-0.11181700097393821,-12.065799722689242,-0.8627509979393736,-0.1691405972933978,-19.604798573041307,-1.1253357186886248,-0.0848429477903756,-7.539345426208471,0.45747742728267704,0.0,0.0,24.56,-11.972006453428694,-48.74595459508998,-0.9565067336162262,-0.08203706821029833,-8.576737044230772,-0.9050205643969038,-0.1268710308358676,-14.018579734545053,-1.148143309596532,-0.06203535688246831,-5.403102193223411,0.45747742728267704,0.0,0.0,34.82,-22.232006453428696,-63.8483815251116,-1.3007538025649255,0.26221000073840095,20.158311142779226,-1.4545497048867715,0.4226581096540001,29.05765992927245,-1.3714125269566795,0.16123386047767907,11.756773117699169,0.45747742728267704,0.0,0.0,17.041,-4.453006453428696,-26.13113344765907,24.528301886792452,-1.0219464766892818,20.754716981132077,-1.0112887943254274,16.9811320754717,-1.2133977626559593,66.0377358490566,0.4144129716284466,39.62264150943396,-0.571311825050491,SPGB 1.95 07/30/30,100.0,0.0,100.0,0.0,100.0,0.0,100.0,0.0,100.0,0.0,0.9847829401125977,0.0012850439145624115,rising,58.490566037735846,100.0,-1.0,-1.0,-1.0,1,1,1.0677052117503507,1.1702004316075714,1.2908818548554981,0.6529883151010375,Bottom Quartile,Top Decile,Below Median,Top Decile,Very Tight,4.339609332389927,"['Issue_Age', 'AMT_OUTSTANDING', 'Cpn']","[0.5223027938406914, 0.2844875504418386, 0.07112949541769151]",0.8779198397002216,0.414412975811893,0.0
2025-11-06,ES00000127Z9,SPGB 1.95 04/30/26,2026-04-30,4.173289569044572,WEAK BUY,1.028888688977711,0.9475219722346052,1.0421273901097587,0.327199334915494,1.0491773104297475,-14.459676606490548,0.933738251400822,0.11543905902892548,12.363106857776222,0.86951809762443,0.1593705913532809,18.3286109807063,0.9627040678816581,0.07942332222810067,8.250024493805448,0.327199334915494,0.0,0.0,-13.326293685229196,-1.1333829212613526,-8.504862245885388,1.2562755644894548,-0.20709825405970728,-16.48509755862054,1.3661075646509417,-0.33721887567323083,-24.684650164493426,1.1734565309670282,-0.13132914085726943,-11.191649308890728,0.327199334915494,0.0,0.0,-5.829,-8.63067660649055,-148.06444658919378,1.1580999231300506,-0.10892261270030312,-9.405286157465955,1.2489823513631213,-0.2200936623854104,-17.621839122307808,1.133712610177012,-0.09158522006725334,-8.078345291150917,0.327199334915494,0.0,0.0,-8.57,-5.889676606490548,-68.72434772016467,-0.7364153256244448,1.7855926360541923,242.47086524075377,-0.659309429449926,1.688198118427637,256.05550556596484,-0.8906143163605746,1.9327417064703334,217.01219588150238,0.327199334915494,0.0,0.0,-7.696,-6.763676606490549,-87.88561067700088,-0.7232419706022877,1.7724192810320352,245.0658740185454,-0.6275296813955724,1.6564183703732833,263.9585653213556,-0.8725811574956239,1.9147085476053827,219.43042308611194,0.327199334915494,0.0,0.0,-14.769,0.3093233935094517,2.0944098672896656,81.13207547169812,0.9587602086629291,84.90566037735849,1.008345844251813,79.24528301886792,0.9571388139616784,50.943396226415096,0.28289891326040806,1.8867924528301887,-1.2642172676979362,SPGB 1.95 04/30/26,100.0,0.0,100.0,0.0,100.0,0.0,100.0,0.0,100.0,0.0,0.9269017210081105,0.02062025122649469,rising,11.320754716981133,100.0,1.0,1.0,1.0,1,1,1.0786373000598526,1.1667950330056414,1.1116237425128568,0.4670336275993544,Top Quartile,Top Decile,Bottom Decile,Top Decile,Very Tight,0.4638154478456613,"['Issue_Age', 'YAS_RISK', 'Cpn']","[0.6067290019857842, 0.15806755509912934, 0.09978714421174642]",0.86458370129666,0.2828989161162369,0.0
2025-11-06,ES00000128C6,SPGB 2.9 10/31/46,2046-10-31,-5.083509913278888,NO ACTION,-0.6688729593932455,0.981921578452999,-0.644408469388656,-0.010738031590866377,-0.6918593708431572,83.97644643882063,-0.7183961671123313,0.026536796269174157,3.6938944157305498,-0.706633164615833,0.037760205222587495,5.343678527846664,-0.6647965845991188,0.0203881152104628,3.0668200433182276,-0.010738031590866377,0.0,0.0,88.38914846300193,-4.4127020241813,-4.992357207207557,-0.6883128984541861,-0.0035464723889711003,-0.5152413016538905,-0.6645205592288013,-0.00435240016444427,-0.6549684638799635,-0.6425374081826326,-0.0018710612060234277,-0.2911987929536586,-0.010738031590866377,0.0,0.0,97.087,-13.110553561179373,-13.503922831922896,-0.6494784556062081,-0.04238091523694909,-6.5253765107349215,-0.6045571449632008,-0.06431581443004475,-10.63850024799717,-0.6076001791115387,-0.036808290277117295,-6.0579787394306255,-0.010738031590866377,0.0,0.0,104.423,-20.44655356117937,-19.580507703495705,-0.889584989878507,0.1977256190353498,22.226725839841464,-0.965817751280061,0.29694479188681544,30.74542670381783,-0.796706399623775,0.15229793023511895,19.11594138009231,-0.010738031590866377,0.0,0.0,121.362,-37.385553561179364,-30.804991313672208,-0.8187612437643701,0.1269018729212129,15.49925235687005,-0.8597423904814658,0.1908694310882203,22.200769786546665,-0.7404455247392066,0.09603705535055052,12.970171450135878,-0.010738031590866377,0.0,0.0,105.237,-21.260553561179364,-20.202546213935317,33.9622641509434,-0.6930327313978124,30.18867924528302,-0.6555182073259255,35.84905660377358,-0.6681677291299326,30.18867924528302,-0.05824451105529847,88.67924528301887,1.2575128859614746,SPGB 2.9 10/31/46,100.0,0.0,100.0,0.0,100.0,0.0,100.0,0.0,100.0,0.0,0.9773778616203085,0.004543716832690503,rising,41.509433962264154,100.0,-1.0,-1.0,-1.0,1,1,0.7112861823915139,0.758524858026435,0.6873821389277114,0.015327115039686812,Below Median,Top Decile,Top Quartile,Top Decile,Tight,13.148368404200284,"['Issue_Age', 'YAS_RISK', 'AMT_OUTSTANDING']","[0.5050597668166938, 0.18392891605984038, 0.14100148538955448]",0.8299901682660887,-0.0582445116432686,0.0
2025-11-06,ES00000128E2,SPGB 3.45 07/30/66,2066-07-30,4.4662718835025,MODERATE BUY,1.472152169117543,0.9790599434116927,1.3064309152985598,-1.1393570437865632,1.3015863612583203,119.79478424564743,1.3029991306680984,-0.0014127694097780807,-0.1084244314277674,1.4708158276973724,0.0013363414201705837,0.09085715464300993,1.3061405782148665,0.0002903370836933039,0.0222286242624245,-1.1393570437865632,0.0,0.0,125.53620216191496,-5.7414179162675225,-4.573515700598434,1.219928697854383,0.08165766340393721,6.693642249599743,1.3413261999080524,0.13082596920949063,9.753478925790821,1.2607189544548476,0.04571196084371221,3.62586445770479,-1.1393570437865632,0.0,0.0,137.258,-17.463215754352575,-12.722912874353613,1.1760081962454627,0.12557816501285757,10.678340877720562,1.2659155919045815,0.2062365772129615,16.29149501773078,1.2355564072014287,0.07087450809713114,5.73624215862712,-1.1393570437865632,0.0,0.0,141.967,-22.172215754352578,-15.617865949686047,0.9406318732444199,0.3609544880139004,38.37361824998947,0.895955761456012,0.576196407661531,64.31080930760209,1.0730321596851122,0.23339875561344758,21.751328823807757,-1.1393570437865632,0.0,0.0,165.518,-45.723215754352566,-27.62431623846961,0.844956943405692,0.4566294178526282,54.04173739409245,0.7509558164411991,0.7211963526763439,96.03712059790703,1.0004156290858213,0.30601528621273855,30.588814714289654,-1.1393570437865632,0.0,0.0,151.533,-31.738215754352552,-20.94475510433904,88.67924528301887,1.1982310323685192,92.45283018867924,1.4427591028441409,88.67924528301887,1.2118468573348533,9.433962264150944,-1.1975708854916205,100.0,2.1751047181779555,SPGB 3.45 07/30/66,100.0,0.0,100.0,0.0,100.0,0.0,100.0,0.0,100.0,0.0,0.9706605589034363,0.008399384508256391,rising,32.075471698113205,100.0,1.0,1.0,1.0,1,1,1.338133778290862,1.6694710099899261,1.3935528776819956,1.6262809746479023,Top Quartile,Top Decile,Top Decile,Top Decile,Moderate,17.823476880846556,"['AMT_OUTSTANDING', 'Issue_Age', 'YAS_RISK']","[0.29364356970291755, 0.2541764013502488, 0.16663719332834698]",0.7144571643815134,-1.1975708975809438,0.0
2025-11-06,ES00000128H5,SPGB 1.3 10/31/26,2026-10-31,3.248504697061829,WEAK BUY,0.7853040750878003,0.9776874687496429,1.2192975305146037,-0.025460369458593896,0.923796674651606,-10.789245871933527,1.028403439150919,-0.10460676449931294,-10.171763288588682,0.9568027446110897,-0.1714986695232894,-17.924140445540232,1.306753512058219,-0.08745598154361534,-6.69261494745135,-0.025460369458593896,0.0,0.0,-8.395299283256218,-2.3939465886773093,-28.515321551434386,0.8512644308900804,0.07253224376152556,8.520530199251127,0.6835048027995674,0.10179927228823293,14.893716969054434,1.166520700634355,0.05277682988024868,4.524294288058426,-0.025460369458593896,0.0,0.0,-4.587,-6.202245871933528,-135.2135569743225,-0.8183175110774812,1.7421141857290872,212.88975744222606,-0.6366852501849206,1.421989325272721,223.34258607772927,-1.1761124486589865,2.39540997917359,203.6718480054924,-0.025460369458593896,0.0,0.0,-9.423,-1.3662458719335273,-14.499054128023154,-1.7360003677973,2.659797042448906,153.2140820051982,-2.142925216352481,2.928229291440281,136.64635869840797,-1.6558460899482166,2.8751436204628202,173.63592066634303,-0.025460369458593896,0.0,0.0,-4.955,-5.834245871933527,-117.74461877213047,-1.6294287207704543,2.5532253954220603,156.69451183758133,-1.944990339145124,2.730294414232924,140.37573067819912,-1.6359741295532078,2.855271660067811,174.53036640588948,-0.025460369458593896,0.0,0.0,-12.05,1.2607541280664734,10.462689850790076,75.47169811320755,0.8398064547148821,71.69811320754717,0.76962465334863,86.79245283018868,1.1278768310745155,28.30188679245283,-0.07310652174695968,5.660377358490567,-1.17018841351409,SPGB 1.3 10/31/26,100.0,0.0,100.0,0.0,100.0,0.0,100.0,0.0,100.0,0.0,0.9472956921237828,0.030391776625860012,rising,26.41509433962264,100.0,1.0,1.0,1.0,1,1,0.9497360846874697,0.8905617332832633,1.3006088286045094,0.036341298527816306,Top Quartile,Top Decile,Bottom Decile,Top Decile,Very Tight,0.9523155937593232,"['Issue_Age', 'AMT_OUTSTANDING', 'Cpn']","[0.3543220736644705, 0.33308814367444556, 0.14107287378273128]",0.8284830911216473,-0.0731065224849599,0.0
2025-11-06,ES00000128P8,SPGB 1 1/2 04/30/27,2027-04-30,1.1629498353203471,NO ACTION,0.23597731690419063,0.9489931317606284,0.3424472780848713,-0.4906367185298894,0.3866584859316708,-8.488166602131269,0.2948142536042341,0.09184423232743671,31.153252629164058,0.11504523600732822,0.12093208089686242,105.11697362023912,0.265378912202283,0.07706836588258831,29.04087681230522,-0.4906367185298894,0.0,0.0,-7.30406810634099,-1.1840984957902787,-16.211493060164106,-0.3508478966172449,0.7375063825489157,210.20686418217485,-0.07553196854179532,0.31150928544598594,412.42039657893184,-0.2749706602269145,0.6174179383117858,224.53956191119326,-0.4906367185298894,0.0,0.0,-3.91,-4.578166602131269,-117.08865960159598,-0.8574225441927827,1.2440810301244536,145.0954402868127,-0.816304741610772,1.0522820585149626,128.90799134006613,-0.7005403055693608,1.0429875836542322,148.88330628145917,-0.4906367185298894,0.0,0.0,-5.013,-3.475166602131269,-69.32309186512985,-1.0152723159837842,1.401930801915455,138.084213076231,-1.0507965389392409,1.2867738558434314,122.45699294905424,-0.8170945148342378,1.159541792919109,141.9103613690647,-0.4906367185298894,0.0,0.0,2.815,-11.303166602131268,-401.53344802763496,-0.5335462325835967,0.9202047185152675,172.46953404813615,-0.3233589604089868,0.5593362773131775,172.976885906621,-0.42817186138907914,0.7706191394739504,179.97892691406858,-0.4906367185298894,0.0,0.0,-5.475,-3.0131666021312693,-55.0350063311008,52.83018867924528,0.33020141450635276,56.60377358490566,0.23126578160214223,56.60377358490566,0.28286043574603287,18.867924528301888,-0.5426960621799599,15.09433962264151,-1.1112395154764267,SPGB 1 1/2,100.0,0.0,100.0,0.0,100.0,0.0,100.0,0.0,100.0,0.0,0.9055037266130299,0.04348940514759847,rising,13.20754716981132,100.0,1.0,1.0,-1.0,1,0,0.3975155211274409,0.2676063642407993,0.36528406074995545,0.7003188027495189,Above Median,Top Decile,Bottom Quartile,Top Decile,Very Tight,1.424782657744572,"['Issue_Age', 'AMT_OUTSTANDING', 'Cpn']","[0.38746315829773387, 0.2376661582692274, 0.15573520676207853]",0.7808645233290398,-0.5426960676584062,0.0
2025-11-06,ES00000128Q6,SPGB 2.35 07/30/33,2033-07-30,-0.3464335028967369,WEAK SELL,-1.4060261425872687,0.9950820037768621,-1.0442994126622283,0.046959098931170465,-1.1848835334350065,35.36185232085065,-1.0617276469720274,-0.12315588646297915,-11.59957411434596,-1.2050637848666625,-0.2009623577206061,-16.676491201268075,-0.9749088496595294,-0.06939056300269886,-7.1176461589376006,0.046959098931170465,0.0,0.0,37.48291669031504,-2.121064369464385,-5.658749521609555,-1.0193301374990529,-0.16555339593595364,-16.241391107890042,-1.1380825476232421,-0.26794359496402653,-23.54342338077799,-0.9487785121271324,-0.09552090053509588,-10.067776441749645,0.046959098931170465,0.0,0.0,42.789,-7.42714767914935,-17.357609846955032,-0.949693491174301,-0.2351900422607055,-24.764836441429974,-1.032127426040645,-0.37389871654662366,-36.226022435847696,-0.8997115449829645,-0.1445878676792638,-16.070469127408447,0.046959098931170465,0.0,0.0,47.567,-12.205147679149349,-25.6588552496131,-0.3645370881580994,-0.8203464452769071,-225.03784921257144,-0.1585872325307442,-1.2474389100565244,-786.5947412602827,-0.41849395859930255,-0.6258054540629256,-149.5375085470153,0.046959098931170465,0.0,0.0,60.134,-24.77214767914935,-41.19491082420903,0.37547431629094663,-1.5603578497259531,-415.569784794518,0.16216795080817417,-1.5681940933954428,-967.0184453083393,0.3867398131860825,-1.431039225848311,-370.0263433072307,0.046959098931170465,0.0,0.0,41.471,-6.109147679149345,-14.731131821456517,16.9811320754717,-1.1607849848731222,11.320754716981133,-1.3779533519762435,22.641509433962266,-1.053540718957087,35.84905660377358,-7.214865859223271e-16,58.490566037735846,0.012107397584331412,SPGB 2.35 07/30/33,100.0,0.0,100.0,0.0,100.0,0.0,100.0,0.0,100.0,0.0,0.9909111592952277,0.004170844481634406,rising,92.45283018867924,100.0,-1.0,-1.0,-1.0,1,1,1.2181540362002443,1.5944818297856187,1.1139406107398249,0.06702788172930046,Bottom Quartile,Top Decile,Above Median,Top Decile,Very Tight,6.679391952916092,"['Issue_Age', 'GREEN_BOND_LOAN_INDICATOR', 'AMT_ISSUED']","[0.6993866093531051, 0.10432972005321058, nan]",,,0.0
2025-11-06,ES0000012932,SPGB 4.2 01/31/37,2037-01-31,3.410212065611283,WEAK BUY,0.44194206417416776,0.9808638147185922,1.0111742310204561,1.130355622778937,0.8821301025066645,57.87896333574247,0.8553391539813225,0.026790948525341918,3.1322017807110414,0.4003018924404107,0.04164017173375706,10.402191815702313,0.9879150046490265,0.02325922637142963,2.3543752272752796,1.130355622778937,0.0,0.0,60.27223073372728,-2.3932673979848076,-3.970762934195666,0.7523928085569447,0.12973729394971978,17.24329243314018,0.25038423264571535,0.1915578315284524,76.50554583800219,0.9004267634294453,0.11074746759101084,12.299441871237148,1.130355622778937,0.0,0.0,66.378,-8.499036664257531,-12.803996298437934,-0.4586936089217497,1.3408237114284143,292.3135740541336,-0.107953959763943,0.5498960239381108,509.3800859204513,-0.8434345402604133,1.8546087712808694,219.8876926144717,1.130355622778937,0.0,0.0,70.895,-13.016036664257527,-18.359597520871105,-0.9691764404182878,1.8513065429249522,191.01852321380127,-0.8616411077202667,1.3035831718944344,151.290734052184,-1.272101114495588,2.283275345516044,179.4885093291153,1.130355622778937,0.0,0.0,82.21,-24.331036664257525,-29.596200780072873,-1.4430913229319131,2.3252214254385777,161.12780753207426,-1.6232011135938351,2.065143177768003,127.2265739439417,-1.565760944813378,2.5769351758338344,164.58037019712103,1.130355622778937,0.0,0.0,61.096,-3.2170366642575274,-5.265543838763541,69.81132075471697,0.8002756680026648,64.15094339622641,0.43311822608611056,77.35849056603774,0.9273094025596813,94.33962264150944,1.0936748541839738,69.81132075471697,0.5889492729334018,SPGB 4.2 01/31/37,100.0,0.0,100.0,0.0,100.0,0.0,100.0,0.0,100.0,0.0,0.9821596545275958,-0.0012958398090036072,falling,33.9622641509434,100.0,1.0,1.0,1.0,1,1,0.9068995513061293,0.501177445994695,1.078606410010136,1.6134326407482433,Above Median,Top Decile,Above Median,Top Decile,Tight,9.732820364696693,"['Issue_Age', 'Cpn', 'YAS_RISK']","[0.753128228441353, 0.1594192295548098, 0.03425270210808528]",0.946800160104248,1.0936748652244817,0.0
2025-11-06,ES0000012A89,SPGB 1.45 10/31/27,2027-10-31,-4.824802376552832,MODERATE SELL,-1.341172520625594,0.966887696298306,-1.0990440827763983,-0.7522079123366217,-1.2911259270478401,-10.14868470209922,-1.2680688039610002,-0.023057123086839937,-1.8182864236537457,-1.3001943205542985,-0.04097820007129549,-3.151698104530703,-1.085527278546677,-0.013516804229721346,-1.2451832738187432,-0.7522079123366217,0.0,0.0,-8.510691266741425,-1.6379934353577958,-19.246303056888124,-1.2358354014576927,-0.055290525590147466,-4.4739392541706815,-1.2487526230340975,-0.09241989759149649,-7.400977194894367,-1.0684941696366699,-0.030549913139728435,-2.8591557840882778,-0.7522079123366217,0.0,0.0,-5.313,-4.835684702099221,-91.0160868247245,-1.0964625341717094,-0.19466339287613077,-17.75376586376542,-1.0310045386663624,-0.31016798195923156,-30.084055629089494,-0.9781025575801559,-0.12094152519624246,-12.3649123522346,-0.7522079123366217,0.0,0.0,-0.789,-9.359684702099221,-1186.2718103259872,-0.49609783118628475,-0.7950280958615554,-160.25631031984724,-0.13261440318908088,-1.2085581174365132,-911.3324022430036,-0.4804970558058052,-0.618547026970593,-128.73065643663708,-0.7522079123366217,0.0,0.0,10.129,-20.277684702099222,-200.19433983690186,0.5973439939058683,-1.8884699209537086,-316.1444508701054,0.46972944975898284,-1.8109019703845768,-385.52020376021267,0.6468495804993135,-1.7458936632757118,-269.9072070105244,-0.7522079123366217,0.0,0.0,-2.039,-8.109684702099221,-397.7285268428822,15.09433962264151,-1.2615815031730861,13.20754716981132,-1.3143946007815848,20.754716981132077,-1.1062978957670802,15.09433962264151,-0.8067488175176758,7.547169811320755,-1.1537785594151941,SPGB 1.45 10/31/27,100.0,0.0,100.0,0.0,100.0,0.0,100.0,0.0,100.0,0.0,0.9720432376573361,-0.00515554135903018,falling,16.9811320754717,100.0,-1.0,-1.0,-1.0,1,1,1.32737962415306,1.5209355999670238,1.1723360388347874,1.07367696850069,Bottom Quartile,Top Decile,Bottom Decile,Top Decile,Very Tight,1.9004316409187536,"['Issue_Age', 'AMT_OUTSTANDING', 'Cpn']","[0.38672530551797546, 0.1923286417225536, 0.17503439615213537]",0.7540883433926644,-0.8067488256617006,0.0
2025-11-06,ES0000012B39,SPGB 1.4 04/30/28,2028-04-30,-5.964819861626248,MODERATE SELL,-1.6414485386945152,0.9789785005950441,-1.3070222137286989,-0.44787568217763685,-1.454627665060385,-7.135908834634556,-1.4426571182452872,-0.011970546815097904,-0.8297568826806238,-1.61914357256481,-0.022304966129705228,-1.3775780214854678,-1.3030542735848905,-0.003967940143808413,-0.30451073249934274,-0.44787568217763685,0.0,0.0,-5.588198379180013,-1.5477104554545429,-27.696054214024546,-1.364503563429036,-0.09012410163134921,-6.604900374490395,-1.4870258486994778,-0.1544226899950374,-10.384667428049456,-1.2661814639558413,-0.040840749772857565,-3.2255052386181022,-0.44787568217763685,0.0,0.0,-2.267,-4.868908834634556,-214.77321628395393,-1.2618494084907055,-0.19277825656967962,-15.277437525014765,-1.3265367684538807,-0.31491177024063455,-23.739392330130034,-1.2116626115734328,-0.09535960215526607,-7.870144746351475,-0.44787568217763685,0.0,0.0,2.971,-10.106908834634556,-340.1854190715589,-1.03385181531632,-0.420775849744065,-40.69982171916399,-0.961100489573485,-0.6803480491210302,-70.78843985857394,-1.0624293505550764,-0.2445928631736225,-23.022035370505257,-0.44787568217763685,0.0,0.0,14.309,-21.444908834634553,-149.87007351769896,0.41585723280510956,-1.8704848978654947,-449.7901455914025,0.1556425975770403,-1.7970911362715556,-1154.6267209523767,0.5787816642112176,-1.8858038779399164,-325.8230109842284,-0.44787568217763685,0.0,0.0,1.473,-8.608908834634557,-584.4473032036542,9.433962264150944,-1.4167023110467771,3.7735849056603774,-1.6086752923587455,11.320754716981133,-1.3067254260523065,20.754716981132077,-0.4995293460535227,20.754716981132077,-1.0765974645471459,SPGB 1.4 04/30/28,100.0,0.0,100.0,0.0,100.0,0.0,100.0,0.0,100.0,0.0,0.9837876058133146,-0.004809105218270493,falling,30.18867924528302,100.0,-1.0,-1.0,-1.0,1,1,1.4954723492737618,1.8614588948257151,1.3941836080323264,0.6392830982220074,Bottom Decile,Top Decile,Bottom Quartile,Top Decile,Very Tight,2.3583140410316616,"['AMT_OUTSTANDING', 'Issue_Age', 'Cpn']","[0.3969641794866371, 0.22365768940282418, 0.16461996062138914]",0.7852418295108504,-0.4995293510962065,0.0
2025-11-06,ES0000012B47,SPGB 2.7 10/31/48,2048-10-31,-5.009032028994199,NO ACTION,-0.652175298109971,0.9855468026565553,-0.5462745351003206,-0.7271173904722938,-0.7785307164414034,88.77409180646121,-0.7843165489785897,0.005785832537186342,0.737690983436738,-0.6594876426410592,0.0073123445310882,1.1087917266994087,-0.5496618010767425,0.003387265976421805,0.616245463694563,-0.7271173904722938,0.0,0.0,93.6238729390526,-4.849781132591389,-5.180068907457502,-0.811585288593615,0.033054572152211636,4.0728401819859785,-0.7007854442379117,0.04861014612794068,6.936523273132589,-0.5709531872142511,0.0246786521139305,4.32235991222058,-0.7271173904722938,0.0,0.0,102.494,-13.719908193538785,-13.386059859309013,-0.7319167930525139,-0.04661392338888948,-6.368746173674741,-0.5829613688379353,-0.06921392927203573,-11.87281555598169,-0.5046918127802468,-0.04158272232007387,-8.239230445819972,-0.7271173904722938,0.0,0.0,109.788,-21.013908193538782,-19.140441752855267,-0.8038008850043,0.025270168562896655,3.1438343400652062,-0.6896134234900271,0.037438125380056086,5.428856742332804,-0.5648238487807259,0.018549313680405244,3.2840881970615197,-0.7271173904722938,0.0,0.0,128.229,-39.4549081935388,-30.769099182292525,-0.885996045583506,0.1074653291421026,12.129323653853884,-0.8176811935984406,0.1655058954884696,20.240882970051587,-0.6286980071932519,0.08242347209293122,13.110184832600726,-0.7271173904722938,0.0,0.0,112.197,-23.422908193538788,-20.87659045380102,30.18867924528302,-0.7752613933810156,32.075471698113205,-0.6391539324105862,37.735849056603776,-0.573596525914847,16.9811320754717,-0.7814202584561143,90.56603773584906,1.3804186507951286,SPGB 2.7 10/31/48,100.0,0.0,100.0,0.0,100.0,0.0,100.0,0.0,100.0,0.0,0.991698112549903,-0.006151309893347778,falling,54.71698113207547,100.0,-1.0,-1.0,-1.0,1,1,0.8003911842623168,0.7395891379073878,0.5827039466679141,1.0378635783307975,Below Median,Top Decile,Top Decile,Top Decile,Tight,13.40476369539374,"['Issue_Age', 'YAS_RISK', 'GREEN_BOND_LOAN_INDICATOR']","[0.33806152871261885, 0.32090960341781705, 0.0976856451878434]",0.7566567773182793,-0.7814202663444506,0.0
2025-11-06,ES0000012B88,SPGB 1.4 07/30/28,2028-07-30,-2.803482895058704,WEAK SELL,-0.8087651031120764,0.9894291299346334,-0.6517314158329204,-1.105397926577551,-0.9544381182626129,-1.944589020390961,-0.9961794799815188,0.041741361718905856,4.190144661548919,-0.8741669192244903,0.06540181611241391,7.481616373938394,-0.6854750368932752,0.03374362106035478,4.922662205325831,-1.105397926577551,0.0,0.0,-0.626561986352232,-1.318027034038729,-210.35859846465672,-1.0288919917383332,0.0744538734757203,7.23631570173828,-0.9212762163867813,0.11251111327470487,12.21252758425887,-0.7104762857668648,0.058744869933944455,8.268378591088272,-1.105397926577551,0.0,0.0,2.59,-4.5345890203909605,-175.08065648196506,-0.6281345594052921,-0.3263035588573209,-51.94803386896217,-0.3294332547275544,-0.479331848384522,-145.50195736333296,-0.38629880198531213,-0.26543261384760825,-68.71173444294737,-1.105397926577551,0.0,0.0,8.37,-10.31458902039096,-123.23284358503794,-0.44716318755162976,-0.5072749307109832,-113.44290708369687,-0.06483428208999016,-0.7439308210220862,-1147.4341695433466,-0.22264546581018863,-0.42908595002273175,-192.72161199832297,-1.105397926577551,0.0,0.0,18.304,-20.24858902039096,-110.62384729746817,0.25276193646890416,-1.2072000547315171,-477.60356002798545,0.055513873000948906,-0.8642789761130253,-1556.8699744859352,0.1831489981651472,-0.8348804139980676,-455.8476304961739,-1.105397926577551,0.0,0.0,3.322,-5.2665890203909616,-158.5366948987746,26.41509433962264,-0.9421519635557153,26.41509433962264,-0.7926172572751627,33.9622641509434,-0.6752248176012754,11.320754716981133,-1.1632895935137983,22.641509433962266,-0.9436065735218903,SPGB 1.4 07/30/28,100.0,0.0,100.0,0.0,100.0,0.0,100.0,0.0,100.0,0.0,0.9889652774804145,0.00046385245421887156,rising,75.47169811320755,100.0,-1.0,-1.0,-1.0,1,1,0.9812379134803312,0.9171673430651437,0.6951934307235609,1.5778088415847566,Below Median,Top Decile,Bottom Quartile,Top Decile,Very Tight,2.577826721390153,"['Issue_Age', 'Cpn', 'AMT_OUTSTANDING']","[0.28241397914620386, 0.22352344979059896, 0.21199601820977998]",0.7179334471465828,-1.1632896052570565,0.0
2025-11-06,ES0000012E51,SPGB 1.45 04/30/29,2029-04-30,-3.028654710232537,MODERATE SELL,-0.7572507270976746,0.9809086042429271,-0.7178960112390269,-3.223214358751283,-1.30790290666986,3.760815253168417,-1.2197362494442867,-0.08816665722557326,-7.228337810154311,-0.624251955893764,-0.13299877120391057,-21.3053027415767,-0.6470215031418958,-0.07087450809713114,-10.953964691679104,-3.223214358751283,0.0,0.0,5.218953376827356,-1.458138123658939,-27.93928237296162,-1.265831090699787,-0.042071815970073034,-3.3236516267308143,-0.696681096264382,-0.06056963083329259,-8.694025184358473,-0.6864105674962868,-0.031485443742740093,-4.586969486627763,-3.223214358751283,0.0,0.0,8.713,-4.952184746831582,-56.83673523640432,-1.014664487957186,-0.293238418712674,-28.900037332837407,-0.3257588080678808,-0.4314919190297938,-132.4574793060185,-0.47469031413193913,-0.24320569710708778,-51.234601748378864,-3.223214358751283,0.0,0.0,15.096,-11.335184746831583,-75.08733929069189,-1.131442339641256,-0.1764605670286039,-15.596072312880446,-0.493294625840768,-0.2639561012569066,-53.50881239708225,-0.5705015517507281,-0.14739445948829877,-25.835943206883016,-3.223214358751283,0.0,0.0,24.951,-21.190184746831584,-84.92719625802117,-1.0102525959979354,-0.2976503106719246,-29.4629589574682,-0.31691974821221125,-0.44033097888546335,-138.94084148285108,-0.4704320369044374,-0.2474639743345895,-52.60355368282528,-3.223214358751283,0.0,0.0,8.605,-4.8441847468315835,-56.29499989775808,13.20754716981132,-1.2774985121558806,28.30188679245283,-0.7421314199539668,30.18867924528302,-0.7389873218071074,1.8867924528301887,-3.301198038539871,30.18867924528302,-0.7974459004849276,SPGB 1.45 04/30/29,100.0,0.0,100.0,0.0,100.0,0.0,100.0,0.0,100.0,0.0,0.9692994736904513,0.01160913055247581,rising,35.84905660377358,100.0,-1.0,-1.0,-1.0,1,1,1.3446276868234606,0.8587482752826898,0.7657703447027997,4.600710740707117,Bottom Quartile,Top Decile,Below Median,Top Decile,Very Tight,3.238841205559595,"['Cpn', 'REL_SPRD_LOG', 'Issue_Age']","[0.2855669461433106, 0.10908385431351046, 0.10648876723071234]",0.5011395676875334,-3.3011980718650404,0.0
2025-11-06,ES0000012E69,SPGB 1.85 07/30/35,2035-07-30,-0.2005220045687181,STRONG SELL,-1.3045985082445597,0.9905539280845815,-1.3008928752951736,-2.3868992125442112,-1.6137845743569244,46.70027271446819,-1.5248853546248848,-0.08889921973203951,-5.829895269137713,-1.1589316579769835,-0.1456668502675762,-12.569062895817698,-1.2495677308333915,-0.05132514446178216,-4.107431937027373,-2.3868992125442112,0.0,0.0,49.069448961898935,-2.369176247430744,-4.828210418232987,-1.4880888071867329,-0.12569576717019149,-8.446792000481686,-1.1025172907197487,-0.202081217524811,-18.329074509115433,-1.2251471561271883,-0.07574571916798534,-6.1825812655164585,-2.3868992125442112,0.0,0.0,54.881,-8.180727285531809,-14.906301423154058,-1.6191705121593574,0.005385937802433016,0.3326356136505144,-1.3163890398662286,0.011790531621668876,0.8956722651914363,-1.3049898541428462,0.004096978847672572,0.31394717769425606,-2.3868992125442112,0.0,0.0,59.727,-13.026727285531805,-21.810449684984615,-1.1184908038423074,-0.495293770514617,-44.28232797130929,-0.543533125247516,-0.7610653829970437,-140.02189262122303,-0.9362940175283204,-0.3645988577668532,-38.94063692036367,-2.3868992125442112,0.0,0.0,73.7,-26.99972728553181,-36.634636746090024,0.4376922673024208,-2.051476841659345,-468.7030016391835,0.1453324765528287,-1.4499309847973885,-997.6647473586956,0.6683022650166517,-1.9691951403118253,-294.6563574488445,-2.3868992125442112,0.0,0.0,56.391,-9.690727285531807,-17.184882842675815,3.7735849056603774,-1.5677010016347919,15.09433962264151,-1.2785508270214971,13.20754716981132,-1.300818611913297,5.660377358490567,-2.4569486566686853,66.0377358490566,0.3025743086825139,SPGB 1.85 07/30/35,100.0,0.0,100.0,0.0,100.0,0.0,100.0,0.0,100.0,0.0,0.9886952591137684,0.0018586689708131043,rising,81.13207547169812,100.0,-1.0,-1.0,-1.0,1,1,1.6590982466534643,1.4794594165465622,1.3876455223882234,3.4069818578221613,Bottom Decile,Top Decile,Above Median,Top Decile,Very Tight,7.744837300717933,"['Cpn', 'GREEN_BOND_LOAN_INDICATOR', 'REL_SPRD_LOG']","[0.2763225286801068, 0.1677334323614009, 0.1426944283594536]",0.5867503894009612,-2.4569486814712653,0.0
2025-11-06,ES0000012F43,SPGB 0.6 10/31/29,2029-10-31,-1.433814262500574,NO ACTION,0.1891108152386154,0.9858198786015491,0.1430179612635399,-3.2175777354230233,0.3120030890037188,9.18939422003549,0.31306783345994377,-0.001064744456224953,-0.3401002301794002,0.1900383717559846,-0.0009275565173691991,-0.4880890422231713,0.14375993381075616,-0.0007419725472162519,-0.5161191132579848,-3.2175777354230233,0.0,0.0,10.378109401674944,-1.1887151816394539,-11.454062917299739,0.281705385238497,0.03029770376522184,10.755102414553065,0.14346144572794634,0.04564936951066906,31.819954202358304,0.11446814803369877,0.02854981322984114,24.941270760586747,-3.2175777354230233,0.0,0.0,14.031,-4.84160577996451,-34.50649117321545,-0.8173940012611973,1.1293970902649162,138.17046304539397,-0.12938795119654056,0.31849876643515596,246.15796051640055,-0.1391896840863478,0.28220764534988774,202.75038838350866,-3.2175777354230233,0.0,0.0,19.763,-10.573605779964511,-53.50202790373074,-0.8668177050047705,1.1788207940084894,135.99408198550736,-0.1997315039955297,0.3888423192341451,194.68250725964458,-0.18264346761244496,0.32566142887598487,178.30443941010185,-3.2175777354230233,0.0,0.0,30.163,-20.973605779964508,-69.53421666615085,0.6337058091846259,-0.3217027201809071,-50.76530946091583,0.6656522516201163,-0.4765414363815009,-71.59014756768906,0.4212899261455852,-0.2782719648820453,-66.05236465603177,-3.2175777354230233,0.0,0.0,13.664,-4.474605779964509,-32.74740761628929,49.056603773584904,0.2593727760810754,52.83018867924528,0.18533501893037257,47.16981132075472,0.09067135675995132,3.7735849056603774,-3.295507939798618,33.9622641509434,-0.6583769200257057,SPGB 0.6 10/31/29,100.0,0.0,100.0,0.0,100.0,0.0,100.0,0.0,100.0,0.0,0.9933444684481367,-0.007524589846587659,falling,56.60377358490566,100.0,1.0,1.0,1.0,1,1,0.32076386535223267,0.2144581452511663,0.15255540047708632,4.592665208948661,Below Median,Top Decile,Below Median,Top Decile,Very Tight,3.586806471736992,"['Cpn', 'REL_SPRD_LOG', 'Issue_Age']","[0.4004135084973718, 0.0853978421872607, 0.015905219532401836]",0.5017165702170343,-3.2955079730663464,0.0
2025-11-06,ES0000012F76,SPGB 0 1/2 04/30/30,2030-04-30,-2.549283038822221,NO ACTION,-0.4727966207616179,0.9838245032719989,-0.36158789019541565,-0.08572729367035418,-0.523652656424405,11.73225066144661,-0.5124720605107939,-0.011180595913611091,-2.1816985855379607,-0.45308281518974586,-0.019713805571872023,-4.351037928576549,-0.35058734069103614,-0.011000549504379509,-3.1377485476006286,-0.08572729367035418,0.0,0.0,13.067747909581836,-1.3354972481352263,-10.219796527709281,-0.35148390560569803,-0.17216875081870692,-48.98339388361925,-0.2196241877728455,-0.25317243298877234,-115.27529095433526,-0.21435472908694655,-0.1472331611084691,-68.6866834554791,-0.08572729367035418,0.0,0.0,17.225,-5.492749338553391,-31.888239973088922,-0.38296866154413445,-0.1406839948802705,-36.735118387890815,-0.26703132157128184,-0.20576529919033604,-77.05661278755548,-0.24338843745627659,-0.11819945273913907,-48.56411796635211,-0.08572729367035418,0.0,0.0,23.669,-11.93674933855339,-50.43199684612865,-0.37434874233552157,-0.14930391408888338,-39.88364143259256,-0.25455852312175525,-0.21823809763986263,-85.73199058130942,-0.23693650226309215,-0.1246513879323235,-52.60961543736734,-0.08572729367035418,0.0,0.0,33.265,-21.53274933855339,-64.73094643643557,-0.4728303786525054,-0.05082227777189957,-10.748521878370662,-0.39776574631086153,-0.07503087445075635,-18.863080408590598,-0.3199406485234101,-0.041647241672005564,-13.017176955319115,-0.08572729367035418,0.0,0.0,16.32,-4.58774933855339,-28.11120916508743,41.509433962264154,-0.533448119346691,41.509433962264154,-0.46335673900250796,45.28301886792453,-0.39561488935785616,26.41509433962264,-0.1339452064746165,37.735849056603776,-0.5932341902395905,SPGB 0 1/2,100.0,0.7071067135208762,100.0,0.7071067116201354,100.0,0.7071067486797835,50.0,-0.7071067591044837,50.0,-0.7071067802542701,0.9828787645930753,0.0009457386789235578,rising,49.056603773584904,50.0,-1.0,-1.0,-1.0,1,1,0.5383563692045842,0.5361675705412078,0.38570110291796644,0.12236433474866691,Below Median,Top Decile,Below Median,Above Median,Very Tight,3.96925178055767,"['AMT_OUTSTANDING', 'Cpn', 'Issue_Age']","[0.4037167743183718, 0.2928570044550027, 0.1257399861949568]",0.8223137649683312,-0.1339452078267754,0.0
2025-11-06,ES0000012G00,SPGB 1 10/31/50,2050-10-31,-8.434310048035712,STRONG SELL,-1.420109735457557,0.9729179714694837,-1.4627719292921715,-2.1461858814413017,-1.675059470216776,89.45191110201606,-1.6559471781507555,-0.019112292066020498,-1.1541607246160883,-1.3878903357824308,-0.032219399675126104,-2.3214657968502723,-1.4506100314530186,-0.012161897839152891,-0.8383988454244257,-2.1461858814413017,0.0,0.0,94.91829768735366,-5.466386585337602,-5.759044059942098,-1.7037233224204933,0.028663852203717255,1.6824241153635136,-1.467705085954451,0.04759535049689401,3.2428415373145976,-1.4780630157000187,0.015291086407847265,1.034535479338259,-2.1461858814413017,0.0,0.0,103.969,-14.517088897983939,-13.962901342311316,-1.7273914090194193,0.05233193880264331,3.0295356470133648,-1.5073889052019638,0.08727916974440686,5.79008966194454,-1.4889345265005343,0.02616259720836278,1.7571354929984455,-2.1461858814413017,0.0,0.0,110.674,-21.22208889798395,-19.175315698417354,-1.4216159902131005,-0.25344348000367556,-17.827843803508426,-1.0094305697710209,-0.41067916568653606,-40.68424059232429,-1.3025381187694356,-0.1602338105227359,-12.301659888767766,-2.1461858814413017,0.0,0.0,132.475,-43.02308889798394,-32.47638338911968,-1.2167304011701594,-0.45832906904661663,-37.66890880994997,-0.6977149769856786,-0.7223947584718783,-103.5372282302295,-1.1453689774634626,-0.3174029518287089,-27.71185140359269,-2.1461858814413017,0.0,0.0,118.63,-29.17808889798394,-24.595877008787284,1.8867924528301887,-1.6258350096502123,9.433962264150944,-1.3917557511035967,9.433962264150944,-1.4568206821740795,7.547169811320755,-2.213951645418254,92.45283018867924,1.3977829811187235,SPGB 1 10/31/50,100.0,0.0,100.0,0.0,100.0,0.0,100.0,0.0,100.0,0.0,0.9721079592303014,0.0008100122391823117,rising,18.867924528301888,100.0,-1.0,-1.0,-1.0,1,1,1.7220936884865008,1.6104531067410037,1.5603198053466925,3.0633955230102297,Bottom Decile,Top Decile,Top Decile,Top Decile,Tight,11.014819469887271,"['Cpn', 'Issue_Age', 'YAS_RISK']","[0.26712008590231234, 0.17367340115770727, 0.17059793170237095]",0.6113914187623906,-2.213951667767811,0.0
2025-11-06,ES0000012G26,SPGB 0.8 07/30/27,2027-07-30,-1.954833051079266,NO ACTION,-0.5852341492262718,0.9665728124365947,-0.7664790832437058,-0.39812883620208783,-0.7474162252957297,-9.44943417296246,-0.754875880525052,0.007459655229322237,0.9881962482778055,-0.5935750519716483,0.008340902745376466,1.4051976371229125,-0.770995437878935,0.004516354635229147,0.5857822698764267,-0.39812883620208783,0.0,0.0,-7.919515419330045,-1.5299187536324155,-19.318337937272503,-0.7471889008221339,-0.00022732447359585795,-0.03042396244153734,-0.5833361347640984,-0.001898014462173414,-0.32537233963806106,-0.7650273978252393,-0.0014516854184665196,-0.18975600136905663,-0.39812883620208783,0.0,0.0,-4.233,-5.216434172962461,-123.23255753931504,-0.409570671686467,-0.3378455536092627,-82.48772891119414,-0.09310715958167437,-0.49212698964459745,-528.5597144190917,-0.47349670612120004,-0.2929823771225058,-61.876327152290465,-0.39812883620208783,0.0,0.0,-0.228,-9.22143417296246,-4044.48849496211,0.663885120381111,-1.4113013456768408,-212.5821593363097,0.5586304420248985,-1.1438645912511705,-204.76230522431086,0.7165304805857056,-1.4830095638294114,-206.97089423468515,-0.39812883620208783,0.0,0.0,8.84,-18.28943417296246,-206.8940514963015,1.1778155455906032,-1.925231770886333,-163.4578318946506,1.3595173984969104,-1.9447515477231823,-143.0471971575053,1.0900007492431874,-1.8564798324868932,-170.31913205050336,-0.39812883620208783,0.0,0.0,-2.261,-7.18843417296246,-317.93162941925243,32.075471698113205,-0.7457417988998525,37.735849056603776,-0.573549333964289,26.41509433962264,-0.7858065959826231,22.641509433962266,-0.44931054497671014,11.320754716981133,-1.1358652051532148,SPGB 0.8 07/30/27,100.0,0.0,100.0,0.0,100.0,0.0,100.0,0.0,100.0,0.0,0.9733582467585111,-0.0067854343219164726,falling,15.09433962264151,100.0,-1.0,-1.0,-1.0,1,1,0.7684030251699716,0.6636755810202992,0.8175932761765851,0.5682760775519088,Below Median,Top Decile,Bottom Quartile,Top Decile,Very Tight,1.6444786296375469,"['Cpn', 'Issue_Age', 'YAS_RISK']","[0.3680798337687047, 0.23741974298646923, 0.18483467321575459]",0.7903342499709285,-0.4493105495124416,0.0
2025-11-06,ES0000012G34,SPGB 1 1/4 10/31/30,2030-10-31,-1.5404623601657867,NO ACTION,0.12582695613082062,0.9838009176487177,0.17495504046980292,0.11713749125160601,0.308322211208723,16.348450222975433,0.3239541613425288,-0.015631950133805805,-4.825358497167664,0.1467152478584027,-0.02088829172758208,-14.237300218455612,0.18911703821884282,-0.014161997749039895,-7.488482864142363,0.11713749125160601,0.0,0.0,18.12218865570309,-1.773738432727658,-9.787661222645381,-0.2191735885733416,0.5274957997820646,240.67488201848812,-0.027763358425303218,0.15359031455612385,553.2121038171412,-0.14857724979243114,0.32353229026223407,217.75357192225962,0.11713749125160601,0.0,0.0,22.692,-6.343549777024567,-27.95500517463893,0.48568553702849077,-0.17736332581976777,-36.51813954623679,0.3844169720476352,-0.2585900159168146,-67.2681041663168,0.33276937529509454,-0.1578143348252916,-47.42453536864409,0.11713749125160601,0.0,0.0,28.265,-11.916549777024567,-42.16009118276511,0.5275005505226357,-0.21917833931391267,-41.55035192697344,0.44475124157847207,-0.31892428544765145,-71.70846272287113,0.3666742947352788,-0.19171925426547587,-52.28598017084616,0.11713749125160601,0.0,0.0,38.388,-22.039549777024565,-57.41260230093598,0.2679679226183376,0.04035428859038542,15.059372289840885,0.06950268812838334,0.05632426800243728,81.03896613969829,0.13959843561115223,0.03535660485865069,25.327362854122015,0.11713749125160601,0.0,0.0,20.671,-4.322549777024566,-20.91117882508562,47.16981132075472,0.2558805762782802,50.943396226415096,0.12331468862334509,49.056603773584904,0.12144896727373661,37.735849056603776,0.07084418428381645,43.39622641509434,-0.47497669218414396,SPGB 1 1/4,100.0,0.0,100.0,0.0,100.0,0.0,100.0,0.0,100.0,0.0,0.9808286855369227,0.0029722321117949813,rising,47.16981132075472,100.0,1.0,1.0,-1.0,1,0,0.3169796316987063,0.14269208030417052,0.18662226778057067,0.16719822331318138,Below Median,Top Decile,Below Median,Top Decile,Very Tight,4.448163432358143,"['AMT_OUTSTANDING', 'Cpn', 'Issue_Age']","[0.5061870472789591, 0.17474477829133472, 0.16214853798548737]",0.8430803635557812,0.0708441849989801,0.0
2025-11-06,ES0000012G42,SPGB 1.2 10/31/40,2040-10-31,-0.0599004590363847,WEAK SELL,-1.0547827804624008,0.9861014319258886,-1.1417558937552792,-0.7674131033164515,-1.162140540430825,70.3534051665549,-1.113471809101793,-0.04866873132903193,-4.370899244517177,-0.9793533796944148,-0.07542940076798599,-7.701959431775901,-1.1081090517228225,-0.033646842032456714,-3.0364197166788434,-0.7674131033164515,0.0,0.0,73.66635897078882,-3.3129538042339277,-4.4972411424567635,-1.0133461917261435,-0.14879434870468145,-14.683466366304405,-0.8281314042868102,-0.2266513761755906,-27.369010795319674,-1.029040585930347,-0.11271530782493211,-10.953436460203704,-0.7674131033164515,0.0,0.0,81.495,-11.141594833445112,-13.671507248393105,-0.9639171908177,-0.19822334961312493,-20.5643544326183,-0.7530130701790777,-0.3017697102833231,-40.07496260377811,-0.9934581633399348,-0.14829773041534444,-14.927425672766692,-0.7674131033164515,0.0,0.0,87.268,-16.914594833445108,-19.382356455409628,0.5927262509551139,-1.7548667913859388,-296.0669885889925,0.39449886512251564,-1.4492816455849165,-367.3728208058457,0.7582745012856089,-1.900030395040888,-250.5728950086296,-0.7674131033164515,0.0,0.0,103.583,-33.229594833445105,-32.080162604131075,1.1408333664565928,-2.3029739068874178,-201.86768325804175,1.2258540953655703,-2.2806368758279714,-186.04472309107675,1.1796826484284513,-2.3214385421837305,-196.78500193232497,-0.7674131033164515,0.0,0.0,87.298,-16.94459483344511,-19.410060747673604,18.867924528301888,-1.13920777418926,18.867924528301888,-1.0337229329679947,18.867924528301888,-1.1474590637673345,13.20754716981132,-0.8220982622146588,75.47169811320755,0.9085187068123645,SPGB 1.2 10/31/40,100.0,0.0,100.0,0.0,100.0,0.0,100.0,0.0,100.0,0.0,0.9846216990617381,0.0014797328641504848,rising,60.37735849056604,100.0,-1.0,-1.0,-1.0,1,1,1.194772439662227,1.1961598201319816,1.2178961724810633,1.0953803607263648,Bottom Quartile,Top Decile,Top Quartile,Top Decile,Tight,9.48527244023296,"['AMT_OUTSTANDING', 'Issue_Age', 'Cpn']","[0.3025483604891434, 0.22822516341008273, 0.22175831426930528]",0.7525318381685314,-0.8220982705136343,0.0
2025-11-06,ES0000012H41,SPGB 0.1 04/30/31,2031-04-30,-2.6867277191761474,WEAK SELL,-0.9454109494951047,0.9922858879982034,-0.7229930400416426,0.45150816103972297,-0.856216548501219,18.644028100071218,-0.8718519335959322,0.015635385094713183,1.7933532418618483,-0.9707867195792345,0.025375770084129723,2.61393870671556,-0.735283976584659,0.012290936543016495,1.671590401432106,0.45150816103972297,0.0,0.0,20.33973119874086,-1.695703098669643,-8.336900233671358,-0.8697451256539529,0.013528577152733923,1.5554645376155989,-0.9711650566697705,0.025754107174665752,2.6518774262525064,-0.7354452749644886,0.012452234922846084,1.6931558577396204,0.45150816103972297,0.0,0.0,25.22,-6.575971899928781,-26.07443258255884,-0.7250387320147098,-0.13117781648650917,-18.092525114174904,-0.7477017890856207,-0.19770916040948405,-26.442247517829497,-0.6225686687597267,-0.10042437128191584,-16.13064947018857,0.45150816103972297,0.0,0.0,30.641,-11.99697189992878,-39.15333016550846,-0.6140957808256928,-0.24212076767552615,-39.427198702987134,-0.5809650949119187,-0.364445854583186,-62.731109235629624,-0.5306931116087802,-0.19229992843286237,-36.23561727159962,0.45150816103972297,0.0,0.0,41.569,-22.924971899928785,-55.14920227672992,-0.5828566642537316,-0.27335988424748736,-46.9000178470097,-0.539994366892376,-0.4054165826027287,-75.07792672506487,-0.5059176804669518,-0.2170753595746907,-42.90724828664017,0.45150816103972297,0.0,0.0,23.676,-5.031971899928781,-21.253471438602105,28.30188679245283,-0.8489651299647446,24.528301886792452,-0.9265348256289374,28.30188679245283,-0.7438993040911255,64.15094339622641,0.40838707414387476,45.28301886792453,-0.41616872846455255,SPGB 0.1 04/30/31,100.0,0.0,100.0,0.0,100.0,0.0,100.0,0.0,100.0,0.0,0.9733070736461985,0.01897881435200488,rising,86.79245283018868,100.0,-1.0,-1.0,-1.0,1,1,0.8802583671616305,1.0721284156754223,0.7712072790805274,0.6444679797272714,Below Median,Top Decile,Below Median,Top Decile,Very Tight,4.648651616100352,"['AMT_OUTSTANDING', 'Cpn', 'Issue_Age']","[0.3609835132645259, 0.2600541306298932, 0.2562711417188316]",0.8773087856132507,0.4083870782664905,0.0
2025-11-06,ES0000012H58,SPGB 1.45 10/31/2071,2071-10-31,-1.2117130386045574,NO ACTION,0.19916932445884922,0.9883649975873131,0.19369791220600377,0.30021941605067753,0.3834493920958695,116.20867558839876,0.36988897308902435,0.013560419006845126,3.666078100947771,0.178523447028828,0.02064587743002122,11.564798135567877,0.18195539015440804,0.011742522051595733,6.453516653878359,0.30021941605067753,0.0,0.0,122.05181712362152,-5.843141535222756,-4.787426908053097,0.48769592359864733,-0.10424653150277785,-21.375312837561662,0.35291821472141344,-0.15374889026256422,-43.565018605636055,0.2870574144513827,-0.09335950224537895,-32.52293593304733,0.30021941605067753,0.0,0.0,134.987,-18.778324411601233,-13.911209531443852,-0.19779076361117068,0.5812401557070401,293.86616225571674,-0.006386301487083752,0.20555562594593296,3218.6908884990507,-0.10712356617622104,0.30082147838222484,280.81724781794605,0.30021941605067753,0.0,0.0,139.625,-23.416324411601238,-16.77086797487853,-0.572303533725793,0.9557529258216625,167.00104975753757,-0.5573842486254377,0.756553573084287,135.73285599238477,-0.43746264806726487,0.6311605602732686,144.27758544278322,0.30021941605067753,0.0,0.0,165.969,-49.76032441160123,-29.981698033128513,0.6085377618053919,-0.2250883697095224,-36.98839745669966,0.5305499876760538,-0.33138066321720455,-62.459836899206024,0.387385006705401,-0.19368709449939722,-49.9986024618739,0.30021941605067753,0.0,0.0,155.467,-39.25832441160125,-25.251869791708888,50.943396226415096,0.3271568155045135,54.71698113207547,0.19519269943580092,50.943396226415096,0.13951138314091768,49.056603773584904,0.25566303223175535,98.11320754716981,2.0832360214483985,SPGB 1.45 10/31/2071,100.0,0.0,100.0,0.0,100.0,0.0,100.0,0.0,100.0,0.0,0.980552701240551,0.00781229634676206,rising,69.81132075471697,100.0,1.0,1.0,1.0,1,1,0.39421631871782187,0.2258648394089874,0.20661504546069637,0.4285233739552697,Above Median,Top Decile,Top Decile,Top Decile,Moderate,12.14539771435348,"['AMT_OUTSTANDING', 'REL_SPRD_LOG', 'Issue_Age']","[0.4560978267690649, 0.2927879181724268, 0.11293611109354172]",0.8618218560350334,0.2556630348126415,0.0
2025-11-06,ES0000012I08,SPGB 0 01/31/28,2028-01-31,-4.497651391022291,WEAK SELL,-1.2550022675122328,0.9341644265471802,-1.24182540860157,0.016409625796098386,-1.1532554042159096,-7.706706096971789,-1.0457478423624174,-0.1075075618534922,-10.280447778173784,-1.0709926362144022,-0.18400963129783054,-17.18122266742377,-1.1677249329078467,-0.07410047569372336,-6.345713187319587,0.016409625796098386,0.0,0.0,-5.48888128746223,-2.217824809509559,-40.40577103634879,-0.9789456047556802,-0.1743097994602294,-17.805871626865876,-0.9730071433510571,-0.28199512416117567,-28.981814079164632,-1.1226259059074875,-0.11919950269408264,-10.617918311437375,0.016409625796098386,0.0,0.0,-1.808,-5.8987060969717895,-326.2558663908298,-0.7755283376029961,-0.37772706661291344,-48.70577172071049,-0.6619988336568733,-0.5930034338553595,-89.57771445333891,-0.9645857533504346,-0.2772396552511355,-28.74183569620176,0.016409625796098386,0.0,0.0,2.803,-10.50970609697179,-374.9449182831716,0.9157924298653637,-2.0690478340812732,-225.92977884655357,0.8667544277136013,-2.121756695225834,-244.7932889530724,1.033707614682653,-2.275533023284223,-220.1331371607914,0.016409625796098386,0.0,0.0,14.832,-22.53870609697179,-151.95999246073214,1.0157239656720891,-2.1689793698879987,-213.5402355204639,1.0287093780873426,-2.2837116455995754,-221.9977451402122,1.114550362653254,-2.3563757712548243,-211.4194054455637,0.016409625796098386,0.0,0.0,1.328,-9.034706096971789,-680.3242491671208,20.754716981132077,-1.1307780808754204,16.9811320754717,-1.2299448273942257,15.09433962264151,-1.2438955767105286,33.9622641509434,-0.03083930014629875,16.9811320754717,-1.091220111432573,SPGB 0 01/31/28,100.0,0.0,100.0,0.0,100.0,0.0,100.0,0.0,100.0,0.0,0.9604554714177976,-0.026291044870617397,falling,7.547169811320755,100.0,-1.0,-1.0,-1.0,1,1,1.1856378165225072,1.4232155799078987,1.3246390233653145,0.02342256308399624,Bottom Quartile,Top Decile,Bottom Quartile,Top Decile,Very Tight,2.0810437449370056,"['AMT_OUTSTANDING', 'Issue_Age', 'Cpn']","[0.3361005556869016, 0.255631873562662, 0.24103675511713415]",0.8327691843666978,-0.0308393004576168,0.0
2025-11-06,ES0000012I24,SPGB 0.85 07/30/37,2037-07-30,3.5360195375959123,NO ACTION,0.49620519472767405,0.9851763093306874,0.978543568780926,0.39915516152880376,0.7762661327070925,60.32506948658708,0.8564345077292673,-0.08016837502217478,-9.360712741323358,0.6145079125585192,-0.11830271783084517,-19.251618000023303,1.0474824963201017,-0.06893892753917574,-6.581391777258817,0.39915516152880376,0.0,0.0,63.187058346968456,-2.8619888603813735,-4.529390882881233,0.7750032545934618,0.0012628781136307943,0.16295132824934017,0.49390308483361206,0.0023021098940619877,0.4661055818728026,0.9771241430384253,0.0014194257425006462,0.14526564900548797,0.39915516152880376,0.0,0.0,69.525,-9.199930513412923,-13.23255017920125,0.6058868634282888,0.17037926927880376,28.120640461270764,0.2436427741261493,0.2525624206015248,103.66094834590184,0.832923391470753,0.14562017731017296,17.48302149429838,0.39915516152880376,0.0,0.0,74.274,-13.948930513412918,-18.780367977401085,1.128743602771321,-0.35247747006422836,-31.227416578581245,1.0295805361010535,-0.5333753413733795,-51.80511067281069,1.2598156835278018,-0.28127211474687586,-22.3264495109791,0.39915516152880376,0.0,0.0,88.377,-28.051930513412913,-31.74121152589338,1.299437197725085,-0.5231710650179924,-40.2613579100066,1.302154766540318,-0.8059495718126439,-61.89353111724271,1.368627570560858,-0.39008400177993197,-28.501836973070287,0.39915516152880376,0.0,0.0,70.499,-10.173930513412913,-14.431311808635275,66.0377358490566,0.6998381759023323,66.0377358490566,0.48629793617125755,75.47169811320755,0.8958633893933241,60.37735849056604,0.35553739459825,71.69811320754717,0.6516134601118956,SPGB 0.85 07/30/37,100.0,0.0,100.0,0.0,100.0,0.0,100.0,0.0,100.0,0.0,0.9870703080564079,-0.0018939987257204915,falling,52.83018867924528,100.0,1.0,1.0,1.0,1,1,0.7980630129792989,0.5627136956234821,1.043799706699556,0.5697410207510049,Above Median,Top Decile,Above Median,Top Decile,Tight,8.147447985566458,"['Issue_Age', 'AMT_OUTSTANDING', 'Cpn']","[0.3437652853839778, 0.31071809647976784, 0.21746619995220492]",0.8719495818159506,0.3555373981873551,0.0
2025-11-06,ES0000012I32,SPGB 0 1/2 10/31/31,2031-10-31,-2.2655115069466483,NO ACTION,-0.616544137672842,0.9889937171280527,-0.6692161602064503,0.367128915774003,-0.6714380683683374,22.45867201616274,-0.5012167847983776,-0.1702212835699598,-33.961608097835985,-0.36386523925165754,-0.25267889842118446,-69.44298718848691,-0.5238540603040046,-0.14536209990244564,-27.748586513432766,0.367128915774003,0.0,0.0,24.49092658265024,-2.0322545664874987,-8.29798970161211,-0.5567323173710603,-0.11470575099727709,-20.603393292954237,-0.44991084396516884,-0.16663329370767316,-37.0369579304645,-0.5731145855039679,-0.09610157470248237,-16.768299997311274,0.367128915774003,0.0,0.0,29.367,-6.90832798383726,-23.524118845931994,-0.6570294450441774,-0.014408623324160041,-2.1929950344754685,-0.5963177529017122,-0.020226384771129813,-3.3918803076915243,-0.6572155607471273,-0.01200059945932297,-1.8259761322575792,0.367128915774003,0.0,0.0,34.669,-12.210327983837256,-35.21972938450859,-0.7107017330890946,0.03926366472075715,5.524633237860935,-0.6751466390203268,0.05860250134748479,8.679966261036782,-0.701669394228168,0.032453234021717736,4.625145948527725,0.367128915774003,0.0,0.0,45.612,-23.15332798383726,-50.76148377348309,-0.6017651900139445,-0.06967287835439295,-11.578083669972681,-0.5180344623278249,-0.09850967534501709,-19.01604634578792,-0.6110197047639265,-0.05819645544252372,-9.52448080419279,0.367128915774003,0.0,0.0,28.042,-5.583327983837261,-19.910591191235298,35.84905660377358,-0.6736582037858552,33.9622641509434,-0.6042341855637755,32.075471698113205,-0.6920747821451861,58.490566037735846,0.32320731148930365,47.16981132075472,-0.3184454304405796,SPGB 0 1/2,50.0,-0.7071067135208772,50.0,-0.7071067116201354,50.0,-0.7071067486797838,100.0,0.7071067591044838,100.0,0.7071067802542701,0.9789240451124179,0.0100696720156348,rising,73.58490566037736,100.0,-1.0,-1.0,-1.0,1,1,0.6902914674408801,0.6991821809025666,0.7138441802977917,0.5240278051751968,Below Median,Above Median,Below Median,Top Decile,Very Tight,5.062412630884694,"['Issue_Age', 'Cpn', 'AMT_OUTSTANDING']","[0.3731378206348516, 0.24994797253836973, 0.24558536755003532]",0.8686711607232567,0.3232073147520407,0.0
2025-11-06,ES0000012J07,SPGB 1 07/30/42,2042-07-30,-1.3931268248331747,MODERATE SELL,-1.6298284053633354,0.9833785032782217,-1.6362644666369013,0.45781769156909125,-1.4666780045409173,75.22309980256885,-1.5052703523449595,0.03859234780404219,2.563815030804285,-1.696855617802533,0.06702721243919751,3.950083397843298,-1.6495231934588954,0.013258726821994138,0.803791471025799,0.45781769156909125,0.0,0.0,78.50336793661124,-3.2802681340423874,-4.178506247366661,-1.51489311787939,0.048215113338472726,3.1827402508562592,-1.714302404653631,0.08447399929029564,4.9276019544873195,-1.653233056194976,0.016968589558074676,1.0263882271075666,0.45781769156909125,0.0,0.0,86.379,-11.155900197431151,-12.915060600539071,-1.4027905221481882,-0.06388748239272912,-4.554313771628747,-1.5208717578978799,-0.10895664746545553,-7.164091658828893,-1.607779172758992,-0.028485293877909212,-1.7717167993820948,0.45781769156909125,0.0,0.0,92.474,-17.25090019743115,-18.654865362767552,-1.2636161303810274,-0.20306187415988997,-16.06990190064043,-1.2961400177334705,-0.33368838762986486,-25.74477915116763,-1.5328722051661205,-0.10339226147078073,-6.7450019935011944,0.45781769156909125,0.0,0.0,108.04,-32.81690019743115,-30.374768784148166,-1.1797794335274863,-0.2868985710134311,-24.317983550859097,-1.1689720923667146,-0.4608563129966208,-39.42406427523512,-1.4886119297408753,-0.14765253689602598,-9.918806436667978,0.45781769156909125,0.0,0.0,90.464,-15.240900197431145,-16.84747545514945,7.547169811320755,-1.4281349625775455,5.660377358490567,-1.5972871672100581,3.7735849056603774,-1.624014610803511,67.9245283018868,0.41475646404847616,79.24528301886792,1.0332702250847496,SPGB 1 07/30/42,100.0,0.0,100.0,0.0,100.0,0.0,100.0,0.0,100.0,0.0,0.9833599200615631,1.8583216658596413e-05,rising,45.28301886792453,100.0,-1.0,-1.0,-1.0,1,1,1.507861051843742,1.8482812654096943,1.7453820400518834,0.6534739972130368,Bottom Decile,Top Decile,Top Quartile,Top Decile,Tight,9.766306066964605,"['GREEN_BOND_LOAN_INDICATOR', 'AMT_OUTSTANDING', 'Issue_Age']","[0.6101504242283607, 0.13936566935339686, 0.12843857785060678]",0.8779546714323644,0.4147564682353901,0.0
2025-11-06,ES0000012J15,SPGB 0 01/31/27,2027-01-31,3.076503515391284,WEAK BUY,0.7399996559789528,0.8998429910737828,0.88057093287242,0.6870530501419606,0.9081778416324455,-8.715244427088955,0.7002668647216618,0.20791097691078375,29.690248734587517,0.42383101682549706,0.3161686391534557,74.59780411112543,0.7023362231606998,0.17823470971172028,25.37740490898735,0.6870530501419606,0.0,0.0,-8.237284244199115,-0.47796018288983966,-5.802400016075567,0.8795928662082118,0.02858497542423377,3.2497961497208983,0.6821501383086568,0.057849517670296,8.480466919743373,0.8493113068614414,0.03125962601097865,3.680585127076367,0.6870530501419606,0.0,0.0,-2.335,-6.380244427088955,-273.24387151025985,-0.3415312019624547,1.2497090435949003,365.91356802033187,-0.07442827789462823,0.814427933873581,1094.2451545124973,-0.5244024747954252,1.4049734076678453,267.91890740486093,0.6870530501419606,0.0,0.0,-5.053,-3.6622444270889547,-72.47663605464658,0.6996093680489198,0.2085684735835257,29.81213233092791,0.4153243268237905,0.3246753291551623,78.17392345416833,0.6977876088495046,0.18278332402291542,26.194692924515362,0.6870530501419606,0.0,0.0,3.152,-11.867244427088956,-376.4988702233207,1.1840731702396403,-0.2758953286071948,-23.300530170893435,1.141272660747429,-0.40127300476847627,-35.16013438801433,1.0756774531143178,-0.19510652024189779,-18.13801319933044,0.6870530501419606,0.0,0.0,-5.603,-3.112244427088955,-55.54603643645103,71.69811320754717,0.8249882269368352,69.81132075471697,0.7252247846125489,69.81132075471697,0.8014476286555807,83.01886792452831,0.6461666096806421,13.20754716981132,-1.1170567803250189,SPGB 0 01/31/27,100.0,0.0,100.0,0.0,100.0,0.0,100.0,0.0,100.0,0.0,0.9584905547996246,-0.05864756372584179,falling,1.8867924528301887,100.0,1.0,1.0,1.0,1,1,0.9336786883728542,0.8391849694450574,0.9392935693251296,0.9806770494930073,Above Median,Top Decile,Bottom Quartile,Top Decile,Very Tight,1.1737426256971162,"['Issue_Age', 'Cpn', 'YAS_RISK']","[0.4565097039560668, 0.31317603840262026, 0.131734996264019]",0.901420738622706,0.6461666162036116,0.0
2025-11-06,ES0000012K20,SPGB 0.7 04/30/32,2032-04-30,-1.43147339758438,NO ACTION,0.034635579538022945,0.9870406108586459,0.26163678979023597,0.8372673258687067,0.4100408497113539,26.547559796511223,0.6381843932503365,-0.22814354353898258,-35.74884349680513,0.36484056534745496,-0.33020498580943203,-90.50665088305,0.46345332263304556,-0.2018165328428096,-43.546246975119814,0.8372673258687067,0.0,0.0,28.64673861244373,-2.0991788159325075,-7.327810832496909,0.5333620879171819,-0.12332123820582797,-23.121485138784035,0.214230983330519,-0.17959540379249606,-83.83259630198017,0.3742230589113046,-0.11258626912106862,-30.08533638736016,0.8372673258687067,0.0,0.0,33.545,-6.997440203488779,-20.859860490096267,-0.3516763980500469,0.7617172477614008,216.5960611304359,-0.15942057265699586,0.19405615219501882,121.72590826150957,-0.3737820477105343,0.6354188375007703,169.99714790827488,0.8372673258687067,0.0,0.0,38.918,-12.370440203488776,-31.785909348656627,-0.77576736266098,1.185808212372334,152.85615948307571,-0.7851866632511696,0.8198222427891926,104.41112549638798,-0.7317676719043735,0.9934044616946095,135.75407690994834,0.8372673258687067,0.0,0.0,49.678,-23.130440203488774,-46.560731508580666,-0.4304125072856748,0.8404533569970287,195.2669411887016,-0.27436203139554133,0.30899761093356426,112.62403842814746,-0.44478559451152916,0.7064223843017652,158.82312222707156,0.8372673258687067,0.0,0.0,32.061,-5.513440203488777,-17.196719384202318,54.71698113207547,0.35238522248044707,49.056603773584904,0.03394404376737702,54.71698113207547,0.20498375459751544,86.79245283018868,0.7978059886942718,50.943396226415096,-0.2136965710621178,SPGB 0.7 04/30/32,100.0,0.0,100.0,0.0,100.0,0.0,100.0,0.0,100.0,0.0,0.9810832297664517,0.005957381092194236,rising,64.15094339622641,100.0,1.0,1.0,1.0,1,1,0.42155444141823906,0.039277934146977944,0.2790845631790176,1.1950879929871034,Above Median,Top Decile,Above Median,Top Decile,Very Tight,5.431439548072348,"['AMT_OUTSTANDING', 'Issue_Age', 'Cpn']","[0.38326276600487635, 0.36345785574241196, 0.17007705658095557]",0.916797678328244,0.7978059967480213,0.0
2025-11-06,ES0000012K46,SPGB 1.9 10/31/52,2052-10-31,-3.230389331592363,NO ACTION,-0.2534103010853256,0.9846072810922063,-0.530370514849121,-0.39729506149091914,-0.5126116844009249,98.21824302894952,-0.5005783899126975,-0.01203329448822732,-2.403878091888496,-0.23687914037987623,-0.016531160705449355,-6.978731846571897,-0.5195957830765029,-0.010774731772618118,-2.0736757141202826,-0.39729506149091914,0.0,0.0,103.61460187392017,-5.396358844970649,-5.208106528282771,-0.49117900736571085,-0.02143267703521401,-4.363516412032755,-0.22200360273708872,-0.03140669834823687,-14.146931196759732,-0.5099823996386581,-0.02038811521046291,-3.9978075371087134,-0.39729506149091914,0.0,0.0,113.772,-15.55375697105049,-13.67098844151759,-0.39743635966969515,-0.11517532473122971,-28.97956340204864,-0.0889216699563156,-0.16448863112900997,-184.9814704465975,-0.42588142439549864,-0.10448909045362237,-24.53478410063483,-0.39729506149091914,0.0,0.0,120.379,-22.16075697105049,-18.409155225753306,0.6694521096436488,-1.1820637940445735,-176.5718203527071,0.5865226680635852,-0.8399329691489108,-143.20554013733346,0.6884645624953531,-1.2188350773444743,-177.03671707126233,-0.39729506149091914,0.0,0.0,142.49,-44.27175697105049,-31.07007998311705,0.7223240118618106,-1.2349356962627356,-170.96699803498902,0.6599198934140686,-0.9133301944993942,-138.4001588335672,0.7310150750944046,-1.2613855899435256,-172.55260741720917,-0.39729506149091914,0.0,0.0,126.976,-28.757756971050483,-22.6481830966369,43.39622641509434,-0.5229730961401386,43.39622641509434,-0.24835069792036973,39.62264150943396,-0.5582698976488913,24.528301886792452,-0.44846886013133047,94.33962264150944,1.622358298321734,SPGB 1.9 10/31/52,100.0,0.0,100.0,0.0,100.0,0.0,100.0,0.0,100.0,0.0,0.9875926657282587,-0.0029853846360523573,falling,50.943396226415096,100.0,-1.0,-1.0,-1.0,1,1,0.5270053762551038,0.2873759657253141,0.5657393349703204,0.5670859748028971,Below Median,Top Decile,Top Decile,Top Decile,Tight,12.7005151789092,"['Issue_Age', 'AMT_OUTSTANDING', 'YAS_RISK']","[0.4198852648037671, 0.20838580342019827, 0.16214853251272504]",0.7904196007366904,-0.4484688646585652,0.0
2025-11-06,ES0000012K53,SPGB 0.8 07/30/29,2029-07-30,0.7061133072515684,MODERATE BUY,1.4589213209093008,0.982575840297738,1.5378940903540517,0.2784334376606037,1.4090842474632894,9.406284979447394,1.3396665470138591,0.0694177004494303,5.181714814480673,1.3456772094013836,0.11324411150791724,8.415399315319704,1.4974081970168194,0.04048589333723229,2.703731230236108,0.2784334376606037,0.0,0.0,10.256967376857592,-0.850682397410198,-8.293702858997,1.2519028408634088,0.15718140659988067,12.55539968548488,1.2005766449511517,0.25834467595814914,21.518382428372348,1.4485993072803791,0.08929478307367256,6.16421546030519,0.2784334376606037,0.0,0.0,13.77,-4.363715020552606,-31.690014650570834,1.3160348208385608,0.09304942662472859,7.070437988745228,1.312843553080298,0.14607776782900284,11.126822108664918,1.4869238023278948,0.050970288026156885,3.4279017931899913,0.2784334376606037,0.0,0.0,19.999,-10.592715020552605,-52.96622338744928,0.9969440428401961,0.4121402046230933,41.340354400926124,0.8085539591532303,0.6503673617560706,80.43586285738937,1.2629448720964966,0.27494921825755503,21.77048437784059,0.2784334376606037,0.0,0.0,29.446,-20.039715020552606,-68.05581407915174,1.5219865130396606,-0.11290226557637117,-7.418085762736358,1.657154878341509,-0.19823355743220827,-11.962282996407273,1.5893482735196978,-0.051454183165646095,-3.237439125154999,0.2784334376606037,0.0,0.0,12.766,-3.3597150205526063,-26.317679914780186,92.45283018867924,1.3002186880076874,90.56603773584906,1.4297924224348508,98.11320754716981,1.434906812321125,47.16981132075472,0.2336703672983323,35.84905660377358,-0.6528206267551212,SPGB 0.8 07/30/29,100.0,0.0,100.0,0.0,100.0,0.0,100.0,0.0,100.0,0.0,0.9881425705223336,-0.005566730224595529,falling,43.39622641509434,100.0,1.0,1.0,1.0,1,1,1.4486501119797548,1.6544667747046038,1.6404516381895715,0.39742678104518575,Top Decile,Top Decile,Below Median,Top Decile,Very Tight,3.393278749820184,"['Issue_Age', 'AMT_OUTSTANDING', 'Cpn']","[0.4291905510041848, 0.27660878100506764, 0.15379236531077503]",0.8595916973200274,0.2336703696572053,0.0
2025-11-06,ES0000012K61,SPGB 2.55 10/31/32,2032-10-31,-0.3439424523998973,WEAK BUY,0.8837311848752796,0.9919257590911428,0.6833675336927374,0.8567781193043824,0.9705391823567853,30.825774612305867,-0.9986967958838284,1.9692359782406137,197.18056237276895,-1.154222126172876,2.0379533110481556,176.56508631913096,-0.8467088973709544,1.5300764310636918,180.70867304497895,0.8567781193043824,0.0,0.0,32.90683646523544,-2.081061852929576,-6.324101845814659,-1.0044823264576659,1.9750215088144512,196.6208301660553,-1.1632875788948958,2.0470187637701756,175.96841772504513,-0.8504187601070355,1.533786293799773,180.35658991942609,0.8567781193043824,0.0,0.0,37.925,-7.09922538769413,-18.719117694982778,-0.7134126140067936,1.6839517963635788,236.04177157755805,-0.7183398128435956,1.6020709977188752,223.02411014566493,-0.6349886440066068,1.3183561776993442,207.618855767087,0.8567781193043824,0.0,0.0,42.901,-12.075225387694136,-28.146722418776864,-0.5110800658555449,1.48161924821233,289.89962986369767,-0.41779422838793895,1.3015254132632186,311.5230641487926,-0.46465755490653726,1.1480250885992747,247.0690623169327,0.8567781193043824,0.0,0.0,54.19,-23.36422538769413,-43.115381774095944,-0.3332973900913736,1.3038365724481589,391.19314224794783,-0.15966154267370838,1.043392727548988,653.5028064529179,-0.31045630378942896,0.9938238374821664,320.11712867152073,0.8567781193043824,0.0,0.0,35.796,-4.970225387694132,-13.8848625162187,79.24528301886792,0.8841529897756489,75.47169811320755,0.8660865623764507,62.264150943396224,0.6114036558568237,88.67924528301887,0.8175018836838468,54.71698113207547,-0.1040975440884962,SPGB 2.55 10/31/32,100.0,0.0,100.0,0.0,100.0,0.0,100.0,0.0,100.0,0.0,0.9924844688239531,-0.0005587097328103585,falling,83.01886792452831,100.0,1.0,-1.0,-1.0,0,0,0.9977910815006299,1.0021814488496181,0.7289392664703823,1.2229370613171437,Top Quartile,Top Decile,Above Median,Top Decile,Very Tight,6.195880721192992,"['Issue_Age', 'AMT_OUTSTANDING', 'GREEN_BOND_LOAN_INDICATOR']","[0.6136396549073176, 0.23134156340015039, 0.07381371556001197]",0.91879493386748,0.817501891936424,0.0
2025-11-06,ES0000012K95,SPGB 3.45 07/30/43,2043-07-30,3.2805446551906385,NO ACTION,0.38601406952333994,0.9779299370781092,0.8683122560053698,0.36662089045738494,0.6814270622533493,83.14417945061821,0.7399605780758843,-0.058533515822535076,-7.910355871079494,0.46983056970506115,-0.08381650018172121,-17.839728574997714,0.9148629684241955,-0.04655071241882569,-5.08827152444259,0.36662089045738494,0.0,0.0,87.03426683151328,-3.890087380895068,-4.469604354775341,0.6927626563167433,-0.011335594063394017,-1.6362882433695096,0.3997421190376043,-0.013728049514264373,-3.434226346698863,0.87637717499685,-0.008064918991480208,-0.9202566120555952,0.36662089045738494,0.0,0.0,95.264,-12.119820549381785,-12.722351096016911,1.1849738409376955,-0.5035467786843463,-42.49433675569117,1.1479580445491604,-0.7619439750258205,-66.37385155375387,1.2657837235814977,-0.39747146757612795,-31.401214680764948,0.36662089045738494,0.0,0.0,102.043,-18.898820549381796,-18.520447798996255,1.5166905202282348,-0.8352634579748855,-55.07144940432861,1.6996875575277464,-1.3136734880044063,-77.28911554699368,1.4357922159219079,-0.5674799599165381,-39.523821739051755,0.36662089045738494,0.0,0.0,117.346,-34.20182054938179,-29.14613241735311,0.6566078111812267,0.024819251072122572,3.7799201093086503,0.3472443490834578,0.03876972043988214,11.164967673546599,0.8456014441253604,0.02271081188000934,2.6857583757941907,0.36662089045738494,0.0,0.0,97.919,-14.774820549381786,-15.088818868526952,60.37735849056604,0.6098604581997488,62.264150943396224,0.3783068926662312,66.0377358490566,0.7896340003775623,56.60377358490566,0.3226944664673345,86.79245283018868,1.2361919247623092,SPGB 3.45 07/30/43,100.0,0.0,100.0,0.0,100.0,0.0,100.0,0.0,100.0,0.0,0.9895295493303427,-0.011599612252233493,falling,28.30188679245283,100.0,1.0,1.0,1.0,1,1,0.7005609436174381,0.43775318342515523,0.9262173980369237,0.5233026664563368,Above Median,Top Decile,Top Quartile,Top Decile,Tight,12.509329328884178,"['Issue_Age', 'AMT_OUTSTANDING', 'YAS_RISK']","[0.4408599519626473, 0.2807629447783975, 0.14699625910701125]",0.868619155848056,0.3226944697248944,0.0
2025-11-06,ES0000012L29,SPGB 2.8 05/31/26,2026-05-31,6.302499406316191,MODERATE BUY,1.5897139920456929,0.9329439003035461,1.4425828777127345,0.23800401763241125,1.4336406786138125,-11.546511962461278,1.441077685716063,-0.007437007102250481,-0.5160725979146514,1.5969058906012588,-0.007191898555565901,-0.4503645802083921,1.4440345631312006,-0.0014516854184660755,-0.1005298242491719,0.23800401763241125,0.0,0.0,-9.69387861898721,-1.8526333434740678,-19.11137341800643,1.4443880450104716,-0.010747366396659075,-0.7440774907669226,1.6074459941310104,-0.017732002085317555,-1.1031164990766533,1.4470024533200658,-0.004419575607331305,-0.3054297224339783,0.23800401763241125,0.0,0.0,-3.856,-7.690511962461278,-199.44273709847002,1.9243886660585312,-0.4907479874447187,-25.501500479095128,2.5165777101663287,-0.9268637181206358,-36.830323605478654,1.5378457008401025,-0.095262823127368,-6.194563112272642,0.23800401763241125,0.0,0.0,-3.586,-7.960511962461277,-221.98862075466857,0.9992726757156867,0.4343680028981258,43.468415489314424,0.9043525456535171,0.6853614463921758,75.78476359774417,1.1803762314617186,0.262206646251016,22.21381937731248,0.23800401763241125,0.0,0.0,-3.477,-8.069511962461277,-232.08259819537008,0.5748888311308248,0.8587518474829877,149.3770249208169,0.2670927378363476,1.3226212542093452,495.19175077705154,0.8286489844052682,0.6139338933074663,74.08853416253697,0.23800401763241125,0.0,0.0,-13.541,1.9944880375387228,14.729252167977236,96.22641509433963,1.3235163818723943,94.33962264150944,1.557973680341392,94.33962264150944,1.3430558524595306,43.39622641509434,0.19285738785749265,3.7735849056603774,-1.1895880066283842,SPGB 2.8 05/31/26,100.0,0.0,100.0,0.0,100.0,0.0,100.0,0.0,100.0,0.0,0.9351706583171144,-0.0022267580135683085,falling,5.660377358490567,100.0,1.0,1.0,1.0,1,1,1.4738960664356862,1.802790145998647,1.538784406423769,0.3397191493888398,Top Decile,Top Decile,Bottom Decile,Top Decile,Very Tight,0.5541640731685504,"['Issue_Age', 'YAS_RISK', 'GREEN_BOND_LOAN_INDICATOR']","[0.6331185995106375, 0.1577999340688106, 0.06453453742762955]",0.8554530710070778,0.1928573898043639,0.0
2025-11-06,ES0000012L52,SPGB 3.15 04/30/33,2033-04-30,0.8149635057957951,NO ACTION,-0.5987028509055895,0.9979942865564569,-0.46214130018119537,0.3519765466988461,-0.6047431238070473,35.02803786484502,-0.432781031826549,-0.17196209198049833,-39.734201677304,-0.34637101735689696,-0.25233183354869254,-72.85015593659702,-0.3171663163903408,-0.14497498379085455,-45.70945013009733,0.3519765466988461,0.0,0.0,37.18529479375574,-2.1572569289107193,-5.801371053518809,-0.5339839826006935,-0.07075914120635385,-13.251172729304386,-0.4965472596031583,-0.10215559130243118,-20.573185586958147,-0.4025899383481028,-0.059551361833092564,-14.792063755551338,0.3519765466988461,0.0,0.0,42.149,-7.120962135154983,-16.894735660313433,-0.3138880201136925,-0.2908551036933548,-92.66205646261982,-0.17668642822498815,-0.42201642268060136,-238.85048955665522,-0.2148386242264354,-0.24730267595475997,-115.11089560088534,0.3519765466988461,0.0,0.0,47.08,-12.05196213515498,-25.59890002675253,-0.2002634942647021,-0.4044796295423452,-201.97371010132557,-0.010446832938120964,-0.5882560179674685,-5630.945362650164,-0.10989789830929032,-0.35224340187190506,-320.51874989337523,0.3519765466988461,0.0,0.0,58.585,-23.556962135154983,-40.20988671355124,0.4519343091819901,-1.0566774329890374,-233.81216874647714,0.28943870685019385,-0.8881415577557834,-306.84960444164176,0.25002330644250403,-0.7121646066236994,-284.8392768949893,0.3519765466988461,0.0,0.0,40.04,-5.011962135154981,-12.517387946811295,39.62264150943396,-0.6103819731647192,35.84905660377358,-0.5867491188499614,41.509433962264154,-0.4925177297330772,54.71698113207547,0.3079111898255955,56.60377358490566,0.003555760711662889,SPGB 3.15 04/30/33,100.0,0.0,100.0,0.0,100.0,0.0,100.0,0.0,100.0,0.0,0.9903212491426485,0.007673037413808426,rising,98.11320754716981,100.0,-1.0,-1.0,-1.0,1,1,0.6217237866360362,0.6789495502929881,0.492960118458331,0.502399809208388,Below Median,Top Decile,Above Median,Top Decile,Very Tight,6.715272256101201,"['Issue_Age', 'AMT_OUTSTANDING', 'GREEN_BOND_LOAN_INDICATOR']","[0.5762426814739516, 0.23029510465493327, 0.060582276574310194]",0.8671200627031951,0.3079111929339201,0.0
2025-11-06,ES0000012L60,SPGB 3.9 07/30/39,2039-07-30,4.495597023512161,WEAK BUY,0.9100890251001693,0.9876325338293497,0.9294766016367583,0.0082698125361348,0.9083120127863957,69.9834997663316,0.8590779841559391,0.04923402863045667,5.731031287657422,0.8344132365096617,0.07567578859050761,9.0693417089264,0.8895391227909466,0.03993747884581167,4.489682058225706,0.0082698125361348,0.0,0.0,72.77610344058564,-2.792603674254039,-3.8372536338802385,0.8876941273586157,0.02061788542777998,2.3226339524027573,0.8796337236979199,0.03045530140224939,3.4622707424165498,0.9135080620336267,0.015968539603131604,1.7480458128391658,0.0082698125361348,0.0,0.0,80.127,-10.14350023366839,-12.659278685589706,0.9114424445122176,-0.003130431725821836,-0.3434590642913566,0.9175317677039936,-0.0074427426038242706,-0.8111700090048962,0.9340574756239192,-0.004580873987160894,-0.4904274156211085,0.0082698125361348,0.0,0.0,85.495,-15.5115002336684,-18.143166538223383,0.8469842888636103,0.061327723922785404,7.240715560497184,0.8192006917806824,0.09088833331948687,11.094757746413602,0.881925839262989,0.04755076237376932,5.39169618551341,0.0082698125361348,0.0,0.0,98.427,-28.443500233668402,-28.898066821886875,0.5861590532467917,0.322152959539604,54.95998948735307,0.4283591882195089,0.4817298368806604,112.45931892743019,0.6689151988600043,0.260561402776754,38.95282979449885,0.0082698125361348,0.0,0.0,79.412,-9.428500233668402,-11.872891039743505,73.58490566037736,0.8251155206160773,77.35849056603774,0.891918140601524,73.58490566037736,0.8485777877857813,32.075471698113205,-0.03905633692297053,73.58490566037736,0.8990424944942996,SPGB 3.9 07/30/39,100.0,0.0,100.0,0.0,100.0,0.0,100.0,0.0,100.0,0.0,0.9851579786585398,0.0024745551708098557,rising,67.9245283018868,100.0,1.0,1.0,1.0,1,1,0.9338166269365308,1.0320721429398745,0.9914606105696574,0.011804059899190094,Above Median,Top Decile,Above Median,Top Decile,Tight,11.018489852302338,"['Issue_Age', 'AMT_OUTSTANDING', 'Cpn']","[0.45621912242499013, 0.2674913512632125, 0.10822546485610414]",0.8319359385443068,-0.0390563373172385,0.0
2025-11-06,ES0000012L78,SPGB 3.55 10/31/33,2033-10-31,2.428103783042104,NO ACTION,0.5226412793302099,0.9968139143195024,0.8121804198246649,0.4454315396060979,0.7522942295194868,39.6408043137682,0.8903880662014704,-0.1380938366819836,-15.509398696253065,0.7270193101207749,-0.20437803079056505,-28.111774355131725,0.9279926565423257,-0.11581223671766072,-12.479865508977978,0.4454315396060979,0.0,0.0,41.80650570193223,-2.165701388164031,-5.180297542891527,0.8717054278491297,-0.11941119832964298,-13.69857214889946,0.6996307929302168,-0.17698951360000692,-25.29755877796312,0.9137983991173201,-0.10161797929265515,-11.120393543999779,0.4454315396060979,0.0,0.0,47.127,-7.486195686231802,-15.885152215594642,0.8297996096802679,-0.07750538016078112,-9.340252552856665,0.6435537633184764,-0.12091248398826648,-18.788248783746987,0.8845388730162285,-0.07235845319156353,-8.18035866832956,0.4454315396060979,0.0,0.0,51.596,-11.955195686231797,-23.170780068057056,1.0086757908218682,-0.25638156130238143,-25.417637767604017,0.9116783379664943,-0.38903705863628446,-42.67262236775006,1.020932783000148,-0.20875236317548307,-20.447218916539672,0.4454315396060979,0.0,0.0,63.818,-24.177195686231798,-37.88460259243996,1.0124189397876744,-0.2601247102681876,-25.693386154293268,0.9164263121534475,-0.3937850328232376,-42.96963359781167,1.0240297118928763,-0.21184929206821135,-20.68780695902232,0.4454315396060979,0.0,0.0,44.607,-4.966195686231799,-11.13322053740103,64.15094339622641,0.6770950477011752,67.9245283018868,0.5122061965426901,64.15094339622641,0.7355400182624243,62.264150943396224,0.4022528029753206,60.37735849056604,0.12172530951321035,SPGB 3.55 10/31/33,100.0,0.0,100.0,0.0,100.0,0.0,100.0,0.0,100.0,0.0,0.9941112846595722,0.002702629659930178,rising,94.33962264150944,100.0,1.0,1.0,1.0,1,1,0.7734179995249152,0.5926931215194003,0.8663422979277693,0.6357944090660509,Above Median,Top Decile,Above Median,Top Decile,Very Tight,7.191796493184199,"['Issue_Age', 'AMT_OUTSTANDING', 'Cpn']","[0.5325169553787513, 0.26385809750155714, 0.08031168904936979]",0.8766867419296782,0.4022528070360117,0.0
2025-11-06,ES0000012M51,SPGB 3 1/2 05/31/29,2029-05-31,-0.1567211579725196,WEAK BUY,0.9469244271437812,0.9810756373154012,0.8775707830075893,0.24642852263599746,0.9520620471677537,7.286896337142107,0.9702859559422112,-0.018223908774457565,-1.8781997693598458,0.9732754455658523,-0.026351018422071104,-2.7074574080110643,0.8903778743660605,-0.012807091358471245,-1.438388304937488,0.24642852263599746,0.0,0.0,8.399941716787712,-1.1130453796456052,-13.250632157316804,0.9335592319517054,0.01850281521604824,1.981964762875265,0.9166541331218939,0.0302702940218873,3.302259008920668,0.8619893595160488,0.015581423491540458,1.8076120242977494,0.24642852263599746,0.0,0.0,12.014,-4.727103662857893,-39.34662609391735,1.1532343924459512,-0.2011723452781975,-17.444185228217375,1.2675532545577552,-0.320628827413974,-25.2950969698177,1.0139001736395767,-0.13632939063198746,-13.446036684065746,0.24642852263599746,0.0,0.0,18.501,-11.214103662857895,-60.61350011781278,0.9074951197770099,0.04456692739074375,4.910982541767993,0.8764311215933573,0.07049330555042388,8.04322245174776,0.8404721556467789,0.03709862736081038,4.41402212674841,0.24642852263599746,0.0,0.0,28.006,-20.719103662857894,-73.98094570970434,0.6535128263940766,0.29854922077367707,45.683757708723576,0.49870843708778,0.4482159900560012,89.87535556563545,0.6365587438661842,0.24101203914140512,37.86171153528274,0.24642852263599746,0.0,0.0,11.08,-3.7931036628578934,-34.23378754002269,77.35849056603774,0.8666229734433818,81.13207547169812,0.9280180851046804,67.9245283018868,0.798556398577013,45.28301886792453,0.2013618172871222,32.075471698113205,-0.7071149861963639,SPGB 3 1/2,50.0,-0.7071067652090444,50.0,-0.7071067667372412,50.0,-0.7071067595130986,50.0,-0.7071067687287543,50.0,-0.7071067810442028,0.9897576201342876,-0.008681982818886436,falling,39.62264150943396,50.0,1.0,1.0,1.0,1,1,0.9787951243682987,1.0738447511954436,0.9360933484572266,0.35174401225590507,Top Quartile,Above Median,Below Median,Above Median,Very Tight,3.4628114164114265,"['Issue_Age', 'AMT_OUTSTANDING', 'Cpn']","[0.5101462727934526, 0.28158660142422065, 0.06458258556611977]",0.856315459783793,0.2013618193198446,0.0
2025-11-06,ES0000012M77,SPGB 2 1/2 05/31/27,2027-05-31,1.4656274480628584,NO ACTION,0.3157013821075197,0.9383711474718724,0.9110724564981997,0.6319392672129918,0.6961625891955521,-7.447215665706353,0.5929388010258282,0.10322378816972388,17.408843248283755,0.17026755804962426,0.14543382405789543,85.41487126632884,0.8220034911562883,0.08906896534191133,10.835594400342652,0.6319392672129918,0.0,0.0,-6.3480509009973485,-1.0991647647090046,-17.314996053431365,-0.4010220333832828,1.0971846225788349,273.5970854176174,-0.03600898634802888,0.3517103684555486,976.7291625021952,-0.7716245015602704,1.68269695805847,218.07199393600874,0.6319392672129918,0.0,0.0,-2.97,-4.477215665706353,-150.7480017047661,0.8690102616508195,-0.17284767245526744,-19.890175996069242,0.5643439995485571,-0.24864261744103738,-44.058697041887136,1.052821472692462,-0.1417490161942624,-13.463727566781468,0.6319392672129918,0.0,0.0,0.282,-7.729215665706353,-2740.8565218513127,1.4376281049192563,-0.7414655157237042,-51.575613194330735,1.4556126417475401,-1.1399112596400205,-78.31144214578629,1.457357809305127,-0.5462853528069272,-37.48464142233772,0.6319392672129918,0.0,0.0,8.914,-16.361215665706354,-183.5451609530159,1.128055059964652,-0.43189247076909987,-38.28647042760363,0.9558372453981254,-0.6401358632906058,-66.97121917726217,1.2600898907735123,-0.3490174342753126,-27.697820136568556,0.6319392672129918,0.0,0.0,-2.988,-4.459215665706353,-149.2374715790698,62.264150943396224,0.623840657257594,58.490566037735846,0.30939807200034963,71.69811320754717,0.8308418011210192,81.13207547169812,0.5905299547887745,18.867924528301888,-1.0845725025582686,SPGB 2 1/2,100.0,0.0,100.0,0.0,100.0,0.0,100.0,0.0,100.0,0.0,0.9800824772066812,-0.04171132973480873,falling,9.433962264150944,100.0,1.0,1.0,-1.0,1,0,0.7157102313859532,0.35801618630103327,0.971829148148811,0.9020094385741538,Above Median,Top Decile,Bottom Quartile,Top Decile,Very Tight,1.5250036293416258,"['Issue_Age', 'YAS_RISK', 'AMT_OUTSTANDING']","[0.7284974589616916, 0.10148160685405017, 0.06579985672162435]",0.8957789225373661,0.5905299607500991,0.0
2025-11-06,ES0000012M85,SPGB 3 1/4 04/30/34,2034-04-30,3.017977635141172,WEAK BUY,0.9326809956281578,0.9994419122209782,1.3110440489616864,0.21023597082147197,1.0653573856172365,43.09133933229378,1.1676456616307602,-0.10228827601352375,-8.76021540598576,1.0919254333915926,-0.1592444377634349,-14.58381968541837,1.386338132666149,-0.07529408370446267,-5.431148533478287,0.21023597082147197,0.0,0.0,45.271045015336206,-2.179705683042428,-4.814789854801326,1.1902886516280229,-0.12493126601078641,-10.49587970029985,1.1276701663099464,-0.19498917068178867,-17.291329927678678,1.4030809044924626,-0.09203685553077623,-6.559625648109453,0.21023597082147197,0.0,0.0,50.828,-7.736660667706225,-15.221257311293183,1.1553248017231674,-0.08996741610593095,-7.787196742684381,1.0786857838602228,-0.14600478823206509,-13.535432566472135,1.379724899093135,-0.06868085013144865,-4.977865491795113,0.21023597082147197,0.0,0.0,55.416,-12.324660667706219,-22.24025672275551,1.226256100032918,-0.1608987144156815,-13.121134573703555,1.1860748423546268,-0.25339384672646903,-21.36406873676016,1.4268240260033813,-0.11577997704169496,-8.114523874016136,0.21023597082147197,0.0,0.0,67.747,-24.655660667706222,-36.393730591859196,1.4859012209886293,-0.42054383537139284,-28.30227383899455,1.6165539898102628,-0.683872994182105,-42.304370547619946,1.5652825552491196,-0.2542385062874333,-16.242339366181493,0.21023597082147197,0.0,0.0,49.188,-6.0966606677062245,-12.394609796020905,83.01886792452831,0.9741109099157059,79.24528301886792,0.9140590386786434,90.56603773584906,1.216292512186844,41.509433962264154,0.1648259018055814,62.264150943396224,0.21012088964458525,SPGB 3 1/4,100.0,0.0,100.0,0.0,100.0,0.0,100.0,0.0,100.0,0.0,0.9909584264125639,0.008483485808414293,rising,100.0,100.0,1.0,1.0,1.0,1,1,1.0952716977364951,1.0576922117386265,1.3984736474036097,0.3000839476950128,Top Quartile,Top Decile,Above Median,Top Decile,Very Tight,7.460620866768153,"['Issue_Age', 'AMT_OUTSTANDING', 'GREEN_BOND_LOAN_INDICATOR']","[0.6738092153744469, 0.12363694983348858, 0.055164382480459184]",0.8526105476883947,0.1648259034694784,0.0
2025-11-06,ES0000012M93,SPGB 4 10/31/54,2054-10-31,3.802097624162897,MODERATE BUY,1.3232468004697064,0.9767416543106128,1.542749171586923,0.6097832427977671,1.3965178165533325,108.32352942645116,1.406923558024887,-0.010405741471554597,-0.739609578519089,1.3415510086929994,-0.018304208223292928,-1.3644064197517982,1.5484913939088571,-0.0057422223219341095,-0.3708268775298989,0.6097832427977671,0.0,0.0,113.60082231196192,-5.277292885510761,-4.6454706732263915,1.4212226220888697,-0.024704805535537222,-1.7382783652429494,1.3607702775287873,-0.03752347705908088,-2.7575173710784795,1.5554917435934623,-0.012742572006539277,-0.81919894317033,0.6097832427977671,0.0,0.0,124.504,-16.180470573548845,-12.995944365039879,1.5186616683122933,-0.12214385175896081,-8.042861257597592,1.5242997985419182,-0.20105299807221177,-13.189859169800114,1.60946218148445,-0.06671300989752704,-4.145049834068848,0.6097832427977671,0.0,0.0,130.335,-22.01147057354885,-16.888380382752143,1.6405786605294188,-0.2440608439760863,-14.876509634087054,1.7397675636469498,-0.4165207631772434,-23.941172917950233,1.6582710712208903,-0.1155218996339673,-6.966406213205813,0.6097832427977671,0.0,0.0,150.544,-42.22047057354885,-28.04526953631119,1.6556404730571268,-0.2591226565037943,-15.650901216508453,1.7650692301899453,-0.4418224297202389,-25.031450305750774,1.66262612747629,-0.11987695588936687,-7.210096917598614,0.6097832427977671,0.0,0.0,134.211,-25.887470573548853,-19.288635485630827,90.56603773584906,1.2882963993608725,88.67924528301887,1.2968267864805358,100.0,1.4395856308891302,75.47169811320755,0.5681637331531747,96.22641509433963,1.8812348634645337,SPGB 4 10/31/54,100.0,0.0,100.0,0.0,100.0,0.0,100.0,0.0,100.0,0.0,0.9872650746183307,-0.010523420307717912,falling,22.641509433962266,100.0,1.0,1.0,1.0,1,1,1.4357308265802713,1.5006072190012263,1.6456304902392427,0.8703846540723922,Top Decile,Top Decile,Top Decile,Top Decile,Moderate,16.970115769062488,"['AMT_OUTSTANDING', 'Issue_Age', 'YAS_RISK']","[0.3763760466523434, 0.36677303213126067, 0.1503618046482972]",0.8935108834319013,0.5681637388887153,0.0
2025-11-06,ES0000012N35,SPGB 3.45 10/31/34,2034-10-31,3.123480573212745,WEAK BUY,1.0060193791512206,0.9932370876920638,1.2155554081025568,0.3301105809925213,1.0952324196327152,46.0159326424261,1.1298453757159015,-0.034612956083186264,-3.0635126293191464,1.0600143285393047,-0.053994949388084024,-5.093794246452255,1.2400405021606917,-0.024485094058134926,-1.974539849143413,0.3301105809925213,0.0,0.0,48.12701003325154,-2.111077390825436,-4.386471108278324,1.2084986154872492,-0.11326619585453401,-9.372472046368006,1.1828861459045643,-0.17686676675334367,-14.952137690553322,1.2945593545431002,-0.07900394644054343,-6.10276736659558,0.3301105809925213,0.0,0.0,53.943,-7.927067357573897,-14.69526603285759,1.11575784098412,-0.020525421351404782,-1.8395946157404104,1.0437052606525337,-0.03768588150131302,-3.6107781153343685,1.2327498153923933,-0.017194407289836455,-1.39480103226649,0.3301105809925213,0.0,0.0,58.531,-12.515067357573898,-21.38194692630521,1.2040390815371187,-0.10880666190440347,-9.036804757351945,1.1775608590988176,-0.17154147994759694,-14.567525505401427,1.292656033661111,-0.07710062555855424,-5.964512055363686,0.3301105809925213,0.0,0.0,71.127,-25.111067357573894,-35.304550106209234,1.0518135007686882,0.043418918864027045,4.128005432474009,0.9429878255924689,0.06303155355875179,6.684238245676812,1.1853926110744195,0.03016279702813729,2.5445406434872395,0.3301105809925213,0.0,0.0,53.392,-7.376067357573902,-13.81492987000376,84.90566037735849,1.0024545805583964,83.01886792452831,0.9859331442469553,84.90566037735849,1.1242705656001732,52.83018867924528,0.28583777872536115,64.15094339622641,0.2850429295339098,SPGB 3.45 10/31/34,100.0,0.0,100.0,0.0,100.0,0.0,100.0,0.0,100.0,0.0,0.9926921570508683,0.0005449306411954291,rising,88.67924528301887,100.0,1.0,1.0,1.0,1,1,1.1259855968165782,1.140860451938054,1.2966171552638992,0.4711890450195627,Top Quartile,Top Decile,Above Median,Top Decile,Very Tight,7.877780609975105,"['Issue_Age', 'AMT_OUTSTANDING', 'Cpn']","[0.6082329038770622, 0.19727406614652798, 0.05937474592698901]",0.8648817159505792,0.2858377816108575,0.0
2025-11-06,ES0000012N43,SPGB 3.1 07/30/31,2031-07-30,0.6298045313185696,STRONG BUY,1.6439893533869854,0.9941427006020903,1.520731942740181,0.5811487961739084,1.5530157426379836,23.65193558340224,1.673159382611738,-0.12014363997375432,-7.180645221506045,1.8592030354951516,-0.21521368210816627,-11.575587864360967,1.5580563878327531,-0.037324445092572045,-2.395577281059281,0.5811487961739084,0.0,0.0,25.30481017870568,-1.652874595303441,-6.531859290693949,1.7479854293629244,-0.19496968672494086,-11.153965149503765,1.9966583950086116,-0.35266904162162627,-17.66296331595615,1.5761218063736697,-0.055389863633488634,-3.5143136182791537,0.5811487961739084,0.0,0.0,30.343,-6.6910644165977615,-22.051426735631345,1.73967111174782,-0.1866553691098365,-10.729348023108344,1.9817741405360667,-0.33778478714908133,-17.044565197185115,1.5741539661397483,-0.05342202339956725,-3.393697453318545,0.5811487961739084,0.0,0.0,36.185,-12.533064416597764,-34.636076863711914,1.7344135545372998,-0.18139781189931625,-10.458740383970005,1.9709395798724325,-0.32695022648544714,-16.5885463037763,1.5731216565088386,-0.05238971376865753,-3.3303027276284216,0.5811487961739084,0.0,0.0,46.187,-22.53506441659776,-48.790924744449015,,,,,,,,,,,,,,,,98.11320754716981,1.4367724034688265,100.0,1.6111653770137842,96.22641509433963,1.4183677327318993,73.58490566037736,0.5392576276353505,49.056603773584904,-0.2878764825210651,SPGB 3.1 07/30/31,100.0,0.0,100.0,0.0,100.0,0.0,100.0,0.0,100.0,0.0,0.982879378761981,0.011263321840109364,rising,90.56603773584906,100.0,1.0,1.0,1.0,1,1,1.5966230788038456,1.864340265759929,1.622144998386083,0.8295127816265183,Top Decile,Top Decile,Below Median,Top Decile,Very Tight,5.319557976337563,"['Issue_Age', 'GREEN_BOND_LOAN_INDICATOR', 'AMT_OUTSTANDING']","[0.7943105980270557, 0.056624566579509886, 0.039644505016885996]",0.8905796696234516,0.5392576330790877,0.0
2025-11-06,ES0000012O00,SPGB 2.7 01/31/30,2030-01-31,0.2947340081021163,MODERATE BUY,1.2148131729237492,0.9900171413381853,1.0543215476248773,0.8932641875147096,1.2522940100175044,12.791218273248544,1.3062386520789577,-0.05394464206145333,-4.129769208912954,1.3012270673347635,-0.08641389441101421,-6.640954212850485,1.083516554374037,-0.029195006749159758,-2.6944679674579897,0.8932641875147096,0.0,0.0,14.027173511653231,-1.2359552384046868,-8.81114956264559,1.3716099023222168,-0.1193158923047124,-8.698966902528689,1.4095539186759214,-0.19474074575217215,-13.815771201822965,1.1217442703936547,-0.06742272276877737,-6.010525210355132,0.8932641875147096,0.0,0.0,18.03,-5.238781726751457,-29.05591638294989,1.170787107150148,0.08150690286735629,6.961718460462304,1.0884705395961187,0.12634263332763052,11.607354316982711,1.002157651587981,0.052163896036896196,5.205158632848176,0.8932641875147096,0.0,0.0,23.918,-11.126781726751455,-46.520535672294514,0.851171513711013,0.40112249630649144,47.125929983846504,0.602772547324994,0.6120406255987553,101.53757303001507,0.7555324288285056,0.2987891187963717,39.54682862587086,0.8932641875147096,0.0,0.0,33.785,-20.99378172675145,-62.13935687594352,,,,,,,,,,,,,,,,86.79245283018868,1.1514653561169161,86.79245283018868,1.1905581503448308,81.13207547169812,0.9688902652487602,90.56603773584906,0.8543341001912013,41.509433962264154,-0.5661056273115238,SPGB 2.7 01/31/30,100.0,0.0,100.0,0.0,100.0,0.0,100.0,0.0,100.0,0.0,0.9904961084932421,-0.00047896715505679754,falling,79.24528301886792,100.0,1.0,1.0,1.0,1,1,1.287457340545351,1.3776397693764133,1.1246310918469142,1.2750160815801512,Top Quartile,Top Decile,Below Median,Top Decile,Very Tight,3.9965000748182433,"['Issue_Age', 'AMT_OUTSTANDING', 'GREEN_BOND_LOAN_INDICATOR']","[0.559971147815583, 0.32534034283070934, 0.03721840162143276]",0.9225298922677252,0.8543341088155949,0.0
2025-11-06,ES0000012O59,SPGB 2.4 05/31/28,2028-05-31,-0.394633058142836,NO ACTION,-0.1742837494260973,0.9766171855332937,-0.4411563809653629,0.6270138345116536,-0.377157704400919,-0.8707522923839449,-0.4772559952015447,0.10009829080062571,20.973710065388136,-0.31826319287345056,0.14397944344735325,45.23911094572975,-0.5287736608888078,0.08761727992344492,16.56990216176428,0.6270138345116536,0.0,0.0,0.2081950264789824,-1.0789473188629273,-518.2387328296603,-0.6098584363585894,0.23270073195767038,38.156515392564586,-0.5173803914096206,0.34309664198352324,66.31419378251374,-0.6413599300098763,0.20020354904451343,31.215474580690284,0.6270138345116536,0.0,0.0,3.218,-4.088752292383945,-127.0588029732152,0.5919140383739381,-0.9690717427748571,-163.71832117129478,0.334802240429217,-0.5090859898553144,-152.0557251938018,0.5038263071043972,-0.9449826880697602,-187.56120035586616,0.6270138345116536,0.0,0.0,9.121,-9.991752292383945,-109.54667559948771,1.1752718802211435,-1.5524295846220624,-132.0911014327035,1.2190816233208843,-1.3933653727469817,-114.2963140992727,0.9578167269728209,-1.398973107938184,-146.05853645444088,0.6270138345116536,0.0,0.0,18.75,-19.620752292383944,-104.64401217023756,,,,,,,,,,,,,,,,45.28301886792453,-0.3944623471859256,45.28301886792453,-0.17080399107996855,43.39622641509434,-0.4722946634308374,77.35849056603774,0.5855577938367554,24.528301886792452,-0.9160970945486503,SPGB 2.4 05/31/28,100.0,0.0,100.0,0.0,100.0,0.0,100.0,0.0,100.0,0.0,0.973148846427888,0.003468339105405671,rising,20.754716981132077,100.0,-1.0,-1.0,-1.0,1,1,0.38774796588495186,0.19764374450069927,0.47057577787154653,0.8949790370527188,Below Median,Top Decile,Bottom Quartile,Top Decile,Very Tight,2.4694907473282512,"['Issue_Age', 'AMT_OUTSTANDING', 'YAS_RISK']","[0.6758438719089889, 0.15025767594309097, 0.06917317439336504]",0.8952747222454449,0.5855577997478868,0.0
2025-11-06,ES0000012O67,SPGB 3.15 04/30/35,2035-04-30,2.8961371128227142,WEAK BUY,0.8479858476278298,0.9920370537425474,0.5973471077296058,0.4919219101184876,0.8652117717666419,48.47662383708686,0.9563932345048731,-0.09118146273823124,-9.533888205728188,0.9856295143217465,-0.1376436666939167,-13.965051096519772,0.6688668093460555,-0.07151970161644972,-10.692666992567194,0.4919219101184876,0.0,0.0,50.79172557626645,-2.315101739179589,-4.55802930980862,0.8935836815720145,-0.02837190980537263,-3.175070233819964,0.8902475716963183,-0.04226172406848849,-4.747187741634869,0.6199611405817173,-0.0226140328521115,-3.64765321680116,0.4919219101184876,0.0,0.0,56.412,-7.935376162913137,-14.066822948143045,0.8890481155667902,-0.02383634380014832,-2.6811083803761533,0.890587144498717,-0.042601296870887206,-4.783506774793548,0.6201546986375128,-0.02280759090790707,-3.677725991634509,0.4919219101184876,0.0,0.0,61.332,-12.855376162913139,-20.96030809498648,0.8285130362151053,0.036698735551536577,4.429469845910978,0.791500318622748,0.05648552900508186,7.136513651658191,0.5704425379740267,0.02690456975557909,4.716438114781737,0.4919219101184876,0.0,0.0,74.504,-26.027376162913143,-34.934199720041505,,,,,,,,,,,,,,,,67.9245283018868,0.7842245534141138,73.58490566037736,0.8310549183794134,58.490566037735846,0.5285061826901484,69.81132075471697,0.4491842339628557,67.9245283018868,0.3480807554097209,SPGB 3.15 04/30/35,100.0,0.0,100.0,0.0,100.0,0.0,100.0,0.0,100.0,0.0,0.9933174116824914,-0.0012803579399440768,falling,84.90566037735849,100.0,1.0,1.0,1.0,1,1,0.8895061685008313,0.9616450114290883,0.637182396101957,0.7021532431830186,Above Median,Top Decile,Above Median,Top Decile,Very Tight,8.102768599200516,"['Issue_Age', 'AMT_OUTSTANDING', 'GREEN_BOND_LOAN_INDICATOR']","[0.6440144647177658, 0.1946088147794718, 0.042822528245583226]",0.8814458077428208,0.4491842384973135,0.0
2025-11-06,ES0000012O75,SPGB 3 1/2 01/31/41,2041-01-31,6.185553733753423,STRONG BUY,1.63899916176359,0.9896939091000172,1.338964798510192,1.0491388970666584,1.5779420423312462,77.53884611751607,1.589905063081701,-0.011963020750454856,-0.7524361644602481,1.659938431219235,-0.02093926945564495,-1.2614485534936422,1.342835959626103,-0.003871161115911015,-0.2882825008767746,1.0491388970666584,0.0,0.0,80.86832904479911,-3.3294829272830384,-4.117165478993474,1.625897411778513,-0.04795536944726675,-2.9494707848672292,1.731415100678089,-0.09241593891449895,-5.337595724130264,1.3572560347828702,-0.018291236272678146,-1.3476629073038555,1.0491388970666584,0.0,0.0,88.806,-11.267153882483925,-12.68737909737539,1.6812880330377673,-0.10334599070652106,-6.146834335405998,1.8215809794827182,-0.1825818177191283,-10.023261044845269,1.3716115905877053,-0.03264679207751331,-2.3801776000964763,1.0491388970666584,0.0,0.0,94.055,-16.516153882483934,-17.560101941127982,,,,,,,,,,,,,,,,,,,,,,,,,,,,,,,100.0,1.4604210067969696,96.22641509433963,1.6062748198141803,92.45283018867924,1.243199605014805,92.45283018867924,1.011687614336454,83.01886792452831,1.0925948625244017,SPGB 3 1/2,100.0,0.7071067652090438,100.0,0.7071067667372414,100.0,0.7071067595130983,100.0,0.7071067687287543,100.0,0.7071067810442028,0.9621276089495928,0.027566300150424383,rising,77.35849056603774,100.0,1.0,1.0,1.0,1,1,1.622249287390658,1.8586812174466376,1.4282563480613528,1.4975065431571717,Top Decile,Top Decile,Top Quartile,Top Decile,Tight,11.426834231220084,"['AMT_OUTSTANDING', 'Issue_Age', 'YAS_RISK']","[0.48490049838297855, 0.39169079510540705, 0.06189497841637654]",0.9384862719047622,1.011687624549311,0.0
2025-11-06,FR0000187635,FRTR 5 3/4 10/25/32,2032-10-25,1.246517570831692,MODERATE BUY,1.332931952127255,0.9773533400462265,1.525533531051527,1.0719144234661533,1.4800335684161159,51.190853468393975,1.2372044888601534,0.24282907955596245,19.627238648071753,0.9664914115829077,0.36644054054434716,37.91451557264682,1.352811708540192,0.17272182251133494,12.767617262934241,1.0719144234661533,0.0,0.0,52.79029895496967,-1.5994454865756964,-3.0298094876050023,-1.6645242332546888,3.1445578016708047,188.91631133723632,-1.8851350573396437,3.218067009466899,170.70750341556834,-1.6549314867960334,3.1804650178475606,192.18106755506062,1.0719144234661533,0.0,0.0,57.526,-6.3351465316060285,-11.012666499504158,-1.6304693891412352,3.110502957557351,190.7734643284717,-1.8257227502562612,3.158654702383516,173.00845293401298,-1.6464375003860705,3.1719710314375975,192.656630538854,1.0719144234661533,0.0,0.0,50.724,0.46685346839397823,0.920379836570342,-1.7389962079286108,3.2190297763447266,185.1084978309524,-2.0180446907226357,3.350976642849891,166.05066486634067,-1.6702723367760044,3.1958058678275316,191.3344176472864,1.0719144234661533,0.0,0.0,60.08,-8.889146531606023,-14.795516861062701,0.8267895488290585,0.6532440195870574,79.00970840901942,0.37755458472736403,0.9553773673998909,253.04350171920925,1.0102747508821477,0.5152587801693793,51.00184624225075,1.0719144234661533,0.0,0.0,17.968,33.22285346839398,184.90011937836132,96.29629629629629,1.425195124620803,90.74074074074075,1.3055528928720224,98.14814814814815,1.4555512627135674,85.18518518518519,1.041603589394531,46.2962962962963,-0.22379756777319115,FRTR 5 3/4,100.0,0.0,100.0,0.0,100.0,0.0,100.0,0.0,100.0,0.0,0.9791267108598516,-0.0017733708136250526,falling,44.44444444444444,100.0,1.0,1.0,-1.0,1,0,1.5448875858265525,1.5332619908746623,1.6636111588842897,1.3051154068334734,Top Decile,Top Decile,Below Median,Top Decile,Tight,6.838292067772045,"['Issue_Age', 'Cpn', 'AMT_OUTSTANDING']","[0.38833155176044976, 0.35883472179261927, 0.12233654062010509]",0.8695028141731742,0.9912544637991944,0.0
2025-11-06,FR0000571218,FRTR 5 1/2 04/25/29,2029-04-25,-0.8449006496945302,WEAK BUY,1.17435678104852,0.930455152975869,1.1710468586722427,-1.7435635623164278,1.0979051457468334,18.308823030313185,0.43850054370668035,0.659404602040153,150.37714239267274,0.21005636066538838,0.9643004203831317,459.0674480990747,0.6323730969544865,0.5386737617177562,85.18290164362189,-1.7435635623164278,0.0,0.0,18.255065052524422,0.0537579777887629,0.29448253185972983,-0.7756515610764263,1.8735567068232597,241.54617571691284,-0.18743574574831598,1.361792526796836,726.5382858035993,-0.6311639004484616,1.8022107591207042,285.53767560001603,-1.7435635623164278,0.0,0.0,20.003,-1.694176969686815,-8.46961440203896,0.5396246155138428,0.5582805302329906,103.4572004013685,0.352628681147455,0.821728099901065,233.02927995653414,0.7093357190645299,0.4617111396077128,65.09063630794635,-1.7435635623164278,0.0,0.0,21.836,-3.5271769696868134,-16.15303612415969,0.3316449827062469,0.7662601630405865,231.04831367657587,0.04540834472914847,1.1289484363193716,2486.2130395459553,0.5437837253859389,0.6272631332863038,115.35158050306839,-1.7435635623164278,0.0,0.0,30.065,-11.756176969686816,-39.10253439473328,-1.8173938028206995,2.915298948567533,160.41096475632992,-1.7708631197886613,2.9452199008371815,166.31550181908585,-1.3523130356121869,2.5233598942844297,186.59584054682506,-1.7435635623164278,0.0,0.0,-0.472,18.780823030313186,3978.9878458505095,79.62962962962963,1.0564625566369825,85.18518518518519,1.1502349315844134,81.48148148148148,1.108985340462978,5.555555555555555,-1.7670001515628138,27.77777777777778,-0.8617820863812619,FRTR 5 1/2,100.0,0.0,100.0,0.0,100.0,0.0,100.0,0.0,100.0,0.0,0.9515780809131129,-0.021122927937243907,falling,12.962962962962962,100.0,1.0,1.0,-1.0,1,0,1.1460145676928997,1.3508541176719508,1.2770395288005862,2.1228855757107716,Top Quartile,Top Decile,Below Median,Top Decile,Very Tight,3.4977092425542367,"['YAS_RISK', 'Issue_Age', 'GREEN_BOND_LOAN_INDICATOR']","[0.41799465715899015, 0.15793617318100878, 0.0736526630649269]",0.6495834934049258,-1.6815867433681193,0.0
2025-11-06,FR0010070060,FRTR 4 3/4 04/25/35,2035-04-25,3.447414611132004,WEAK SELL,-0.5864931081789952,0.9834026470901718,-0.5510362187636032,-1.0064888089409794,-0.838316860800295,71.50899548999234,-0.9560479405539438,0.11773107975364883,12.314348844682344,-0.7616084510614527,0.17511534288245745,22.992830546866486,-0.6495083273718794,0.09847210860827615,15.161023029623626,-1.0064888089409794,0.0,0.0,73.74565120052297,-2.236655710530627,-3.0329323476249574,-0.5659634530665865,-0.27235340773370853,-48.12208305073321,-0.19895208934940756,-0.3875410188295877,-194.7911181117887,-0.33025716515711706,-0.22077905360648614,-66.85064556173606,-1.0064888089409794,0.0,0.0,79.193,-7.684004510007654,-9.702883473333964,0.2874659568692777,-1.1257828176695726,-391.62299103793083,0.11410277893233671,-0.7005958871113319,-614.0041743649117,0.27336491089689446,-0.8244011296604976,-301.5753180604466,-1.0064888089409794,0.0,0.0,69.66,1.8489954899923475,2.6543145129585364,0.9715417445421217,-1.8098586053424168,-186.28726937169938,1.1054349310600056,-1.6919280392390008,-153.0554152392365,0.8300278377490583,-1.3810640565126615,-166.3876772638353,-1.0064888089409794,0.0,0.0,78.814,-7.305004510007649,-9.268663573833056,-0.5722481865460277,-0.2660686742542673,-46.49532770224581,-0.20854875155289174,-0.3779443566261035,-181.2258935569128,-0.3351662371507078,-0.2158699816128954,-64.40683793431899,-1.0064888089409794,0.0,0.0,28.644,42.864995489992346,149.64737981785927,31.48148148148148,-0.8118834503775305,35.18518518518518,-0.5744462594737846,38.88888888888889,-0.5746190272778837,14.814814814814813,-1.0317250330397028,57.407407407407405,0.17041957405050073,FRTR 4 3/4,100.0,0.0,100.0,0.0,100.0,0.0,100.0,0.0,100.0,0.0,0.9564324473690261,0.02697019972114567,rising,62.96296296296296,100.0,-1.0,-1.0,-1.0,1,1,0.8750513088871638,0.6746387835070398,0.6009110805009056,1.2254560836178747,Below Median,Top Decile,Above Median,Top Decile,Tight,8.543332818913285,"['Issue_Age', 'Cpn', 'AMT_OUTSTANDING']","[0.34368296981886504, 0.1979060927264759, 0.16556795121254073]",0.7071570137578818,-0.9818534179672512,0.0
2025-11-06,FR0010171975,FRTR 4 04/25/55,2055-04-25,1.3287101011764548,NO ACTION,0.24902685246619377,0.9688006473715624,0.17363323776394696,0.47673637146574566,0.4118863455135837,136.76567224270963,0.44885131347833346,-0.03696496796474974,-8.235459278206646,0.2997216364089757,-0.05069478394278193,-16.913954847828364,0.19953505183539255,-0.025901814071445595,-12.981084042669869,0.47673637146574566,0.0,0.0,140.94605608949408,-4.180383846784451,-2.9659459529917678,0.6048336417055872,-0.19294729619200346,-31.9008864086689,0.5295312441346531,-0.28050439166845936,-52.97220692418858,0.3327905192403606,-0.15915728147641367,-47.82506336334501,0.47673637146574566,0.0,0.0,146.318,-9.552327757290385,-6.52847069850431,0.6537786619857563,-0.24189231647217257,-36.999114048407286,0.5970990458176376,-0.34807219335144385,-58.29387770088016,0.3738394041341353,-0.20020616637018834,-53.554055244253476,0.47673637146574566,0.0,0.0,130.697,6.068672242709624,4.64331410992241,0.7440997870350242,-0.3322134415214405,-44.64635561589912,0.7365830948353776,-0.4875562423691839,-66.19161356927268,0.4529981900307849,-0.27936495226683794,-61.67021243083368,0.47673637146574566,0.0,0.0,146.358,-9.592327757290377,-6.55401669648053,0.503919236821095,-0.09203289130751124,-18.263420555592592,0.38614114180782133,-0.13711428934162756,-35.50885180190999,0.2487226613501202,-0.07508942358617324,-30.190019743102503,0.47673637146574566,0.0,0.0,93.367,43.39867224270962,46.48181074476147,57.407407407407405,0.39449276091176216,59.25925925925925,0.2439117219158797,51.85185185185185,0.13385821064656345,61.111111111111114,0.44787871858208456,92.5925925925926,1.4365442308730851,FRTR 4 04/25/55,100.0,0.0,100.0,0.0,100.0,0.0,100.0,0.0,100.0,0.0,0.9654691081653638,0.0033315392061985527,rising,29.629629629629626,100.0,1.0,1.0,1.0,1,1,0.4299349119739012,0.28645378857053194,0.18934896284987304,0.5804530378329003,Above Median,Top Decile,Top Decile,Top Decile,Moderate,16.014749395679928,"['Issue_Age', 'Cpn', 'AMT_OUTSTANDING']","[0.637965601915672, 0.1352997424574986, 0.0497476184876992]",0.8230129628608697,0.4262291178290032,0.0
2025-11-06,FR0010371401,FRTR 4 10/25/38,2038-10-25,2.0578701435227345,WEAK BUY,0.6946010915387818,0.9873380649719946,0.8899701905129025,0.8170193474299572,0.9171311709836693,90.90100072718636,0.8812027987388785,0.03592837224479073,4.077196746139419,0.6465497380195402,0.04805135351924161,7.431965392675304,0.862518143180323,0.027452047332579443,3.182779079067123,0.8170193474299572,0.0,0.0,93.43638814454094,-2.5353874173545847,-2.7134903943002713,0.8909364260662292,0.026194744917440005,2.940136227125049,0.6602762924539126,0.034324799084869184,5.198550812334365,0.8706891643275497,0.019281026185352768,2.214455715524875,0.8170193474299572,0.0,0.0,97.749,-6.847999272813638,-7.005697523363992,0.9027702297743558,0.014360941209313416,1.5907636934180376,0.678073632631302,0.016527458907479753,2.437413559291884,0.8809917562088353,0.008978434304067195,1.0191280609470414,0.8170193474299572,0.0,0.0,84.931,5.97000072718636,7.02923635243131,-0.3452954779628248,1.262426648946494,365.6076296839446,-0.0154907101267079,0.7100918016654897,4583.981866932089,-0.5181906515433288,1.4081608420562313,271.74570029153006,0.8170193474299572,0.0,0.0,94.616,-3.7149992728136425,-3.9263964577037744,-1.0712056860049148,1.988336856988584,185.61671809663915,-1.0548680046418373,1.749469096180619,165.8472028630636,-1.1045017895146785,1.994471980027581,180.57661661610314,0.8170193474299572,0.0,0.0,42.343,48.558000727186354,114.67775244011659,74.07407407407408,0.8820257757415894,72.22222222222221,0.680333653194582,70.37037037037037,0.8341891286055723,75.92592592592592,0.7873308628017575,66.66666666666666,0.546667602571531,FRTR 4 10/25/38,100.0,0.0,100.0,0.0,100.0,0.0,100.0,0.0,100.0,0.0,0.9726427213599367,0.014695343612057932,rising,79.62962962962963,100.0,1.0,1.0,1.0,1,1,0.9573192060390379,0.7989946154241415,0.9705223188317017,0.9947664801112149,Above Median,Top Decile,Above Median,Top Decile,Tight,10.34502416402745,"['Issue_Age', 'Cpn', 'YAS_RISK']","[0.6373603046438824, 0.11403388308391645, 0.09819856063341692]",0.8495927483612158,0.7492727945501554,0.0
2025-11-06,FR0010773192,FRTR 4 1/2 04/25/41,2041-04-25,-0.5913123934751496,NO ACTION,0.05380194891894522,0.9883043859779227,0.187423854482784,-0.2337235504400955,0.23354342779941203,100.20575968930554,0.20421764489889488,0.029325782900517156,14.3600625102839,0.012965100312595793,0.040836848606349424,314.9749413753606,0.1632337563038404,0.024190098178943603,14.819297947164062,-0.2337235504400955,0.0,0.0,102.7819044786479,-2.576144789342365,-2.5064186173227565,-0.32355378077436264,0.5570972085737746,172.18070826506826,-0.05740800023690656,0.11120994915585178,193.71852237504817,-0.19955312332776534,0.38697697781054935,193.92177479615967,-0.2337235504400955,0.0,0.0,106.794,-6.588240310694459,-6.169110914543466,0.30076020222257666,-0.06721677442316462,-22.348958303507597,0.15370301537202838,-0.09990106645308316,-64.99616140364122,0.24187579778011223,-0.05445194329732822,-22.512356153795317,-0.2337235504400955,0.0,0.0,93.241,6.964759689305538,7.469632123806667,-0.6374068707278879,0.8709502985273,136.6396135436625,-0.5183099323809703,0.5721118812999155,110.38026372247349,-0.45511553573094327,0.6425393902137273,141.18159580371398,-0.2337235504400955,0.0,0.0,103.931,-3.72524031069446,-3.584339908531647,-1.1936252652755575,1.4271686930749694,119.56589078976204,-1.3334309723887545,1.3872329213076997,104.03484991945835,-0.8878889877974899,1.075312842280274,121.10892746139554,-0.2337235504400955,0.0,0.0,51.557,48.648759689305535,94.35917466080186,51.85185185185185,0.22240181417947166,51.85185185185185,0.052696831178202445,53.70370370370371,0.14734068593819996,38.88888888888889,-0.2608465509960306,70.37037037037037,0.727200619788646,FRTR 4 1/2,100.0,0.0,100.0,0.0,100.0,0.0,100.0,0.0,100.0,0.0,0.9853565348102618,0.002947851167660942,rising,83.33333333333334,100.0,1.0,1.0,-1.0,1,0,0.24377713455837774,0.06188799299225088,0.20438778264267027,0.284571417215211,Above Median,Top Decile,Above Median,Top Decile,Moderate,12.02722384572894,"['YAS_RISK', 'Issue_Age', 'Cpn']","[0.44823025823506957, 0.17461083439635822, 0.14467725643825416]",0.767518349069682,-0.2482377275521298,0.0
2025-11-06,FR0010870956,FRTR 4 04/25/60,2060-04-25,8.940840308702946,STRONG BUY,1.6211888365496634,0.9674944691191295,1.5005360197157431,0.8737873725338929,1.58759334698193,147.50670528885007,1.610224352061166,-0.02263100507923599,-1.405456631538427,1.653724712171164,-0.03253587562150062,-1.9674299588860527,1.5074151798120248,-0.006879160096281645,-0.45635470192783967,0.8737873725338929,0.0,0.0,152.46778743023154,-4.961082141381468,-3.2538559289622055,1.5002951958317068,0.08729815115022332,5.818731594348363,1.4818234673333106,0.13936536921635279,9.404991306194898,1.4693375753354236,0.03119844438031949,2.123299961267746,0.8737873725338929,0.0,0.0,154.442,-6.935294711149936,-4.490549663110346,1.1494408124566726,0.4381525345252575,38.11875530823801,0.9322610411088671,0.6889277954407963,73.89859252634861,1.2337990092218918,0.26673701049385135,21.619162143772154,0.8737873725338929,0.0,0.0,137.876,9.630705288850066,6.985048368208798,1.3074921100064272,0.28010123697550293,21.422785857717145,1.1682013264309776,0.45298751011868577,38.77649305749191,1.3551693549581665,0.14536666475757665,10.726826366980637,0.8737873725338929,0.0,0.0,153.057,-5.550294711149917,-3.6262926300576175,1.0374975421430848,0.5500958048388453,53.02140749176243,0.7690457403389612,0.8521430962107022,110.80525389225741,1.1371355060849382,0.36340051363080494,31.957537909110634,0.8737873725338929,0.0,0.0,99.751,47.755705288850066,47.874913819473065,98.14814814814815,1.5289842986510964,98.14814814814815,1.5878888431411649,96.29629629629629,1.4311123028172523,77.77777777777779,0.8439602836243668,100.0,1.6449441595271033,FRTR 4 04/25/60,100.0,0.0,100.0,0.0,100.0,0.0,100.0,0.0,100.0,0.0,0.9383397278896923,0.029154741229437175,rising,25.925925925925924,100.0,1.0,1.0,1.0,1,1,1.6571605573230077,1.8648418016725614,1.63635109677744,1.0638847068620796,Top Decile,Top Decile,Top Decile,Top Decile,Moderate,16.772345225158602,"['AMT_OUTSTANDING', 'Issue_Age', 'YAS_RISK']","[0.3340388506004582, 0.27921820884798365, 0.24076988643989192]",0.8540269458883338,0.8031648574657647,0.0
2025-11-06,FR0010916924,FRTR 3 1/2 04/25/26,2026-04-25,3.5964157322128525,MODERATE BUY,1.2124910894180925,0.9188546377744173,1.339634725820554,0.9099518963844778,1.3241264540669866,-9.39844366913582,1.282661499856937,0.04146495421004959,3.232727722115434,1.158516323377762,0.05397476604033047,4.6589559840699035,1.3148309936424114,0.02480373217814269,1.886457811645005,0.9099518963844778,0.0,0.0,-9.909382095377342,0.5109384262415215,5.156107825978977,1.286143147426261,0.03798330664072558,2.953272069396621,1.1683757089206606,0.04411538049743191,3.775787170430542,1.318997245531709,0.020637480288845156,1.5646340583571463,0.9099518963844778,0.0,0.0,-9.073,-0.32544366913582046,-3.5869466414320046,0.7426843191137166,0.58144213495327,78.28926936524093,0.3715110921012872,0.8409799973168053,226.36739321117892,0.8705276816961816,0.46910704412437254,53.88766475772182,0.9099518963844778,0.0,0.0,-11.793,2.3945563308641784,20.30489552135749,-0.930365248038893,2.2544917021058795,242.32328997947522,-0.7931757593728855,2.005666848790978,252.8653706071648,-1.1249777871721556,2.4646125129927094,219.0809915704985,0.9099518963844778,0.0,0.0,-9.223,-0.1754436691358201,-1.9022407995836061,-1.091606959006492,2.415733413073479,221.30065872262787,-1.0229901320668877,2.23548122148498,218.5242193016963,-1.256909096999905,2.5965438228204594,206.5816699361902,0.9099518963844778,0.0,0.0,-19.93,10.531556330864179,52.84273118705421,94.44444444444444,1.2747534740381785,88.88888888888889,1.187585943037109,90.74074074074075,1.2738062327869646,79.62962962962963,0.8800365085103735,1.8518518518518516,-1.3993646800255348,FRTR 3 1/2,100.0,0.7071067630698052,100.0,0.7071067709983381,100.0,0.7071067634029153,50.0,-0.7071067658587423,50.0,-0.7071067810474331,0.8683743436017474,0.05048029417266997,rising,9.25925925925926,50.0,1.0,1.0,1.0,1,1,1.3821487327086668,1.3947197369768565,1.4608864592886452,1.1079170253241934,Top Decile,Top Decile,Bottom Decile,Above Median,Very Tight,0.4569340764817298,"['Issue_Age', 'YAS_RISK', 'GREEN_BOND_LOAN_INDICATOR']","[0.6266994505816045, 0.1977582303161515, 0.032394105945218514]",0.8568517868429745,0.8374972266313366,0.0
2025-11-06,FR0011317783,FRTR 2 3/4 10/25/27,2027-10-25,-3.1447577152905053,WEAK SELL,-0.8426242133374008,0.9734544169536343,-0.7150379791810603,-0.6660705599834742,-0.9592080606859361,0.6526945550705399,-0.9708985449062171,0.011690484220280961,1.20408915650412,-0.8653557176061565,0.022731504268755698,2.6268392920490764,-0.7286025202159818,0.013564541034921551,1.8617202757861095,-0.6660705599834742,0.0,0.0,0.4702933789093932,0.18240117616114665,38.78455033870104,-0.9891249363553893,0.029916875669453225,3.0245800371012166,-0.8936834750314943,0.05105926169409347,5.71334958621218,-0.7468177610343052,0.031779781853244926,4.255359618616402,-0.6660705599834742,0.0,0.0,1.123,-0.47030544492946014,-41.87938029755317,-1.1843877500340936,0.22517968934815746,19.012328305526857,-1.172975418343935,0.33035120500653414,28.16352303926267,-0.8918291640028718,0.17679118482181155,19.823435919718214,-0.6660705599834742,0.0,0.0,3.638,-2.98530544492946,-82.05897297206054,0.4382832863284627,-1.3974913470143988,-318.8557170034326,0.32346791938102004,-1.1660921327184208,-360.4969849560743,0.4036813944109628,-1.1187193735920231,-277.12928100426564,-0.6660705599834742,0.0,0.0,9.894,-9.241305444929461,-93.40312750747066,-0.6524830755088876,-0.3067249851770485,-47.00887915551498,-0.40802799004830814,-0.43459622328909264,-106.51137256208862,-0.46273751593151824,-0.25230046324954203,-54.52344992804423,-0.6660705599834742,0.0,0.0,-8.718,9.37069455507054,107.48674632165478,24.074074074074073,-0.9285367007929205,25.925925925925924,-0.8253163093367202,29.629629629629626,-0.7349562861325207,29.629629629629626,-0.6921379461080168,16.666666666666664,-1.2043502452110968,FRTR 2 3/4,33.33333333333333,-1.1545392775039511,33.33333333333333,-1.1544440754850624,33.33333333333333,-1.154078247197639,100.0,0.6353911712838294,33.33333333333333,-1.071316594499994,0.9384015582245433,0.03505285872909103,rising,37.03703703703704,66.66666666666666,-1.0,-1.0,-1.0,1,1,1.0012398750957474,0.9692645426040141,0.7797568109641936,0.8109779389493217,Bottom Quartile,Below Median,Bottom Quartile,Below Median,Very Tight,1.912587286047796,"['Issue_Age', 'AMT_OUTSTANDING', 'GREEN_BOND_LOAN_INDICATOR']","[0.6164123130841871, 0.08352129622384664, 0.033813756235902534]",0.7337473655439363,-0.6586813214067261,0.0
2025-11-06,FR0011461037,FRTR 3 1/4 05/25/45,2045-05-25,-5.287788527669903,WEAK SELL,-1.0822080609979086,0.9958400187453229,-1.3554135021344547,1.2581270627691377,-1.1589600641374864,110.65420860459338,-1.1476027590126647,-0.011357305124821693,-0.9896547334573708,-1.0667216364901,-0.015486424507808572,-1.4517774677925126,-1.3475331497236906,-0.007880352410764013,-0.5847984039502127,1.2581270627691377,0.0,0.0,113.38239184959028,-2.728183244996899,-2.40617894917529,-1.1575555106934672,-0.0014045534440192409,-0.12133788996814619,-1.0832301559463144,0.0010220949484058828,0.09435621168405851,-1.3560271361336536,0.0006136339991988926,0.045252338859771715,1.2581270627691377,0.0,0.0,117.444,-6.789791395406624,-5.78130121149526,-1.0369442506716349,-0.12201581346585155,-11.766863282200067,-0.9065401336491262,-0.17566792734878234,-19.377843174341997,-1.2625286925715153,-0.09288480956293932,-7.357045378354708,1.2581270627691377,0.0,0.0,102.38,8.274208604593383,8.08186032797929,-1.2711999739981266,0.11223990986064014,8.829445506097928,-1.2555632350717718,0.17335517407386325,13.806964703235938,-1.4371237136067205,0.08171021147226587,5.685676892675559,1.2581270627691377,0.0,0.0,114.966,-4.311791395406615,-3.7504926630756628,-1.2305122144267782,0.07155215028929174,5.814826449418136,-1.1978519971884871,0.11564393619057856,9.654275778358445,-1.4121584987972102,0.056744996662755565,4.018316379447196,1.2581270627691377,0.0,0.0,65.449,45.20520860459338,69.06936484543148,12.962962962962962,-1.121286218554777,12.962962962962962,-1.059978990278083,9.25925925925926,-1.3610230778949746,90.74074074074075,1.2273615736518761,77.77777777777779,0.9299237656105985,FRTR 3 1/4,50.0,-0.7071067761362932,50.0,-0.7071067754757147,50.0,-0.7071067771094,100.0,0.7071067750024734,50.0,-0.7071067808359394,0.9837185282257241,0.012121490519598765,rising,100.0,100.0,-1.0,-1.0,-1.0,1,1,1.2097448691456665,1.244856110995115,1.4780933890709427,1.5318396482291516,Bottom Quartile,Above Median,Top Quartile,Above Median,Moderate,12.449096680898464,"['YAS_RISK', 'Issue_Age', 'AMT_OUTSTANDING']","[0.4342382949449676, 0.26750863793018714, 0.1823011050080861]",0.8840480378832407,1.1680332623327785,0.0
2025-11-06,FR0011883966,FRTR 2 1/2 05/25/30,2030-05-25,-2.9254845239462703,MODERATE SELL,-1.3247902899188986,0.9904745307154452,-1.415258965319478,-0.11578391011281239,-1.3229618284544116,26.46163063012365,-1.3245553783125474,0.0015935498581358676,0.12030828398697717,-1.3294362293463244,0.00464593942742586,0.34946688603210035,-1.4169383846857064,0.0016794193662283963,0.11852451542897964,-0.11578391011281239,0.0,0.0,27.86932306540001,-1.4076924352763598,-5.051046383393921,0.5039759518920494,-1.8269377803464608,-362.5049443802217,0.22787998092445286,-1.5526702708433515,-681.3543675092103,0.811748003878188,-2.227006969197666,-274.34707952754576,-0.11578391011281239,0.0,0.0,31.528,-5.066369369876348,-16.069428343914634,-1.5005166478365866,0.177554819382175,11.83291224758343,-1.6292227931177143,0.30443250319881576,18.68575020041749,-1.4941593790059384,0.07890041368646039,5.280588822518641,-0.11578391011281239,0.0,0.0,30.093,-3.6313693698763494,-12.067156377461979,-0.6723042648963653,-0.6506575635580463,-96.78022107747925,-0.3760765946365462,-0.9487136952823524,-252.26607653491845,-0.9019702732527894,-0.5132886920666886,-56.90749480300033,-0.11578391011281239,0.0,0.0,39.435,-12.973369369876352,-32.898109209044094,-0.8123370265951413,-0.5106248018592703,-62.858737058145394,-0.5761352797934137,-0.7486550101254849,-129.94430707307166,-1.0209506760448164,-0.39430828927466166,-38.621678271476554,-0.11578391011281239,0.0,0.0,4.061,22.40063063012365,551.6038063275861,9.25925925925926,-1.2795387538884126,11.11111111111111,-1.2975784642960229,7.4074074074074066,-1.4195313371816314,40.74074074074074,-0.14319487099601846,35.18518518518518,-0.7035994874792919,FRTR 2 1/2,25.0,-0.8213056435437345,25.0,-1.0071894007554094,25.0,-0.8613297242975072,100.0,1.010644900100119,75.0,-0.10156543770622439,0.9721030701619747,0.018371460553470498,rising,92.5925925925926,100.0,-1.0,-1.0,1.0,1,0,1.3809330740307841,1.5238966956795919,1.5433555274223554,0.1409733479124371,Bottom Decile,Below Median,Below Median,Top Quartile,Very Tight,4.219372059132809,"['AMT_OUTSTANDING', 'Issue_Age', 'YAS_RISK']","[0.5397109799417169, 0.15549669854870357, 0.08152303371028354]",0.776730712200704,-0.1362731047715213,0.0
2025-11-06,FR0012993103,FRTR 1 1/2 05/25/31,2031-05-25,-1.6787535701700094,WEAK SELL,-1.0442078792907472,0.982903686124277,-1.354702978556435,0.7352293622965699,-1.136556913816062,36.5764266719594,-0.9509990247598039,-0.18555788905625814,-19.511890367283595,-0.7757192656898033,-0.2684886136009439,-34.611569161046326,-1.2021664849661142,-0.15253649359032084,-12.68846655010298,0.7352293622965699,0.0,0.0,38.65155464709164,-2.07512797513224,-5.368808560334334,-0.8995484806423041,-0.23700843317375797,-26.347488283208275,-0.7078969250151024,-0.33631095427564484,-47.508463116664,-1.1643795492259752,-0.19032342933045987,-16.345480116206947,0.7352293622965699,0.0,0.0,42.554,-5.977573328040599,-14.047030424016297,-0.7357871095175573,-0.40076980429850473,-54.46817342511818,-0.4652718424181092,-0.578936036872638,-124.42962836969261,-1.021758089201657,-0.3329448893547782,-32.585490598500975,0.7352293622965699,0.0,0.0,38.768,-2.1915733280405973,-5.65304717157267,-0.8223943974809241,-0.3141625163351379,-38.20095485540192,-0.5856588258138682,-0.458549053476879,-78.29627514108115,-1.0951680934216015,-0.2595348851348336,-23.69817787095665,0.7352293622965699,0.0,0.0,48.255,-11.6785733280406,-24.20178909049926,-1.1620518819176664,0.025494968101604343,2.1939612403652204,-1.0909945396147867,0.04678666032403944,4.2884412521179955,-1.37756891915816,0.022865940601724866,1.6598763312481482,0.7352293622965699,0.0,0.0,8.911,27.665426671959402,310.46377107971074,14.814814814814813,-1.09966843076699,14.814814814814813,-1.0227593504620582,11.11111111111111,-1.3603284304560614,72.22222222222221,0.7057405753342366,40.74074074074074,-0.5073499494308124,FRTR 1 1/2,50.0,-0.7071067623761963,50.0,-0.7071067599163636,50.0,-0.707106771019717,100.0,0.7071067651211519,50.0,-0.7071067810736362,0.9536178322238449,0.029285853900432146,rising,61.111111111111114,50.0,-1.0,-1.0,-1.0,1,1,1.1863600287247742,1.2011447766205912,1.4773185552642882,0.8951826258543689,Bottom Quartile,Above Median,Below Median,Above Median,Very Tight,4.868274926402449,"['AMT_OUTSTANDING', 'REL_SPRD_LOG', 'Issue_Age']","[0.44012965812123933, 0.2171774321669401, 0.1858969744935481]",0.8432040647817276,0.6716264255492076,0.0
2025-11-06,FR0013131877,FRTR 0 1/2 05/25/26,2026-05-25,2.7333666619204884,WEAK BUY,0.9493818006274846,0.872603473827353,1.1376522505053162,1.1275367916222045,1.1572003363507959,-9.30333166183306,1.2267247303895772,-0.0695243940387813,-5.667481200118463,1.0363499894681385,-0.08696818884065394,-8.391777766708792,1.184708289285985,-0.047056038780668885,-3.9719514760746777,1.1275367916222045,0.0,0.0,-9.33865187193215,0.03532021009909059,0.37821529858529107,1.4628784745319932,-0.30567813818119727,-20.89566162968009,1.4064810914236727,-0.45709929079618816,-32.49949752851295,1.343445715920841,-0.2057934654155249,-15.318331172215197,1.1275367916222045,0.0,0.0,-7.023,-2.28033166183306,-32.46948111328651,1.614202682104096,-0.4570023457533001,-28.31133586808745,1.6483312711099465,-0.6989494704824619,-42.40345848510539,1.4007397535302486,-0.26308750302493245,-18.78204002447105,1.1275367916222045,0.0,0.0,-9.097,-0.20633166183305995,-2.268128631485623,-1.3344024672831456,2.4916028036339415,186.72048696333846,-1.434877017847407,2.3842588184748914,166.16467977410863,-1.3610653942323385,2.4987176447376545,183.58542043370568,1.1275367916222045,0.0,0.0,-8.754,-0.5493316618330599,-6.2752074617950555,-1.2018118980024968,2.3590122343532927,196.28797307177223,-1.213815890489207,2.1631976911166912,178.21464443206364,-1.2817774222305947,2.4194296727359106,188.7558332592526,1.1275367916222045,0.0,0.0,-19.625,10.32166833816694,52.594488320547725,83.33333333333334,1.1136791011372897,81.48148148148148,0.9298810447683905,77.77777777777779,1.07633691083405,87.03703703703704,1.0970901504945887,3.7037037037037033,-1.3975192955591722,FRTR 0 1/2,100.0,1.2603663976200774,100.0,1.1392347034781576,100.0,1.2522913054714333,80.0,0.6353341704330433,20.0,-1.295492234230707,0.9064552035799249,-0.03385172975257189,falling,3.7037037037037033,20.0,1.0,1.0,1.0,1,1,1.2079080313400203,1.0920670236820145,1.2406223398878171,1.3728387325540907,Top Quartile,Top Decile,Bottom Decile,Bottom Quartile,Very Tight,0.5230266054702781,"['Cpn', 'Issue_Age', 'YAS_RISK']","[0.4205022004763627, 0.2948712980925819, 0.15847402491688298]",0.8738475234858276,1.0440589106456863,0.0
2025-11-06,FR0013154028,FRTR 1 3/4 05/25/66,2066-05-25,8.05743877938383,MODERATE BUY,1.4619469473325875,0.9661412894416095,1.1468244639670253,-0.38895059391569886,1.2479493741130863,146.31639979557266,1.112162415666035,0.13578695844705124,12.209274051470784,1.2428085907308766,0.21913835660171088,17.63251046644182,1.0713474820655684,0.07547698190145691,7.045051438533408,-0.38895059391569886,0.0,0.0,150.83758102701788,-4.521181231445212,-2.997383808704572,0.7627708851437186,0.48517848896936766,63.607367829360086,0.7226544496526837,0.7392924976799038,102.30235042557084,0.7952767754786403,0.351547688488385,44.2044449061599,-0.38895059391569886,0.0,0.0,150.216,-3.899600204427344,-2.5959952363048835,0.7018192790389925,0.5461300950740937,77.81634155737078,0.6499150523505343,0.8120318949820532,124.94431072965047,0.7527099538500053,0.39411451011702003,52.359411864455716,-0.38895059391569886,0.0,0.0,140.936,5.380399795572657,3.8176191996302538,0.7406919512972376,0.5072574228158486,68.48426192278974,0.6959677350962261,0.7659792122363613,110.05958503586331,0.7791608088681025,0.36766365509892285,47.18713341271868,-0.38895059391569886,0.0,0.0,151.764,-5.447600204427346,-3.589520705877806,0.5149791966041485,0.7329701775089378,142.33005296315847,0.3666902790933432,1.0952566682392444,298.68712120719414,0.5876101115392451,0.5592143524277802,95.16758339065326,-0.38895059391569886,0.0,0.0,98.768,47.548399795572664,48.141503109062164,88.88888888888889,1.2012468499647833,92.5925925925926,1.431917858424376,79.62962962962963,1.0853041777727497,35.18518518518518,-0.4156945935681507,98.14814814814815,1.6218495857733588,FRTR 1 3/4,100.0,0.7071067758185793,100.0,0.7071067753339805,100.0,0.7071067765365983,50.0,-0.7071067709963105,100.0,0.707106781007678,0.9952506742719776,-0.029109384830368068,falling,24.074074074074073,50.0,1.0,1.0,1.0,1,1,1.3026336273376176,1.6816670074139672,1.2506247399373593,0.4735689729548986,Top Quartile,Top Decile,Top Decile,Top Decile,Moderate,11.730116767440537,"['AMT_OUTSTANDING', 'REL_SPRD_LOG', 'Issue_Age']","[0.4366831918816699, 0.19943438308593317, 0.11927586098309777]",0.7553934359507007,-0.3956007118707663,0.0
2025-11-06,FR0013154044,FRTR 1 1/4 05/25/36,2036-05-25,5.415242199427297,MODERATE BUY,1.5067010902491236,0.9597560978053675,1.2310861010149075,-2.609949027700026,1.29486642315548,80.45554665289912,1.3010110789250533,-0.006144655769573237,-0.4722984932165486,1.5191178869098396,-0.012416796660716045,-0.8173688616251612,1.2338313057481654,-0.0027452047332579,-0.2224943311309354,-2.609949027700026,0.0,0.0,83.2220100421974,-2.7664633892982806,-3.3241967930877134,1.3734918282151296,-0.07862540505964954,-5.724490155094353,1.6410330834233475,-0.13433199317422395,-8.185818659756272,1.2600237885560734,-0.02893768754116599,-2.2965984907846333,-2.609949027700026,0.0,0.0,87.773,-7.31745334710088,-8.336793030051611,1.2717482416472439,0.02311818150823619,1.8178268755858047,1.4632944587692325,0.0434066314798911,2.9663633948128116,1.219814613345413,0.011271487669494373,0.924032836938916,-2.609949027700026,0.0,0.0,75.743,4.712546652899121,6.221758647369322,0.886762808449036,0.4081036147064441,46.02173278083813,0.8815168157037025,0.625184274545421,70.92142274724537,0.9598598733690223,0.2712262276458851,28.256856270928342,-2.609949027700026,0.0,0.0,84.757,-4.301453347100889,-5.075041998411205,0.5963024798588229,0.6985639432966572,117.14925816627817,0.4669501420092326,1.039750948239891,222.66851049645507,0.7175713332643037,0.5135147677506038,71.56288675277553,-2.609949027700026,0.0,0.0,35.122,45.333546652899116,129.07450213539,90.74074074074075,1.246519179761086,96.29629629629629,1.4757527298590682,87.03703703703704,1.1676830490511563,1.8518518518518516,-2.6312702582641037,61.111111111111114,0.3440025633253776,FRTR 1 1/4,100.0,0.7126960232217017,100.0,0.829561982612669,66.66666666666666,0.3572717082567151,33.33333333333333,-0.8719499552250592,66.66666666666666,0.10833543474063412,0.9581804409069301,0.0015756568984374164,rising,20.37037037037037,33.33333333333333,1.0,1.0,1.0,1,1,1.3516065480712853,1.7331473745539292,1.3425129854629043,3.1777580490863735,Top Decile,Top Decile,Above Median,Above Median,Tight,7.643489403142922,"['Cpn', 'REL_SPRD_LOG', 'Issue_Age']","[0.34736020920683564, 0.1390998957639201, 0.09544930110946208]",0.5819094060802178,-2.504079685902864,0.0
2025-11-06,FR0013200813,FRTR 0 1/4 11/25/26,2026-11-25,0.0158691778743564,NO ACTION,0.12092504778557116,0.8792593178195197,0.31354178958128137,-0.9042367289133878,0.28644197087376677,-6.244008700535239,-0.5767960675505197,0.8632380384242865,149.66087184403193,-0.22504303934133169,0.34596808712690286,153.73418025551163,-0.38076893224906333,0.6943107218303447,182.3443681433954,-0.9042367289133878,0.0,0.0,-7.763037951766805,1.519029251231566,19.567458754070643,-0.5042804603590255,0.7907224312327923,156.80211265564827,-0.12167378213894879,0.24259882992451995,199.38462150294242,-0.32437919737531773,0.6379209869565992,196.65902513242872,-0.9042367289133878,0.0,0.0,-6.866,0.621991299464761,9.05900522223799,1.2908490140886035,-1.0044070432148366,-77.80979994341263,1.5971830651712684,-1.4762580173856972,-92.42885429570407,1.0375330190570853,-0.723991229475804,-69.78006571354847,-0.9042367289133878,0.0,0.0,-3.097,-3.1470087005352387,-101.6147462180744,-0.9790770607913792,1.265519031665146,129.25632408511396,-0.8083992624482,0.9293243102337712,114.95857825543993,-0.7120989952901605,1.025640784871442,144.0306442295228,-0.9042367289133878,0.0,0.0,-1.926,-4.3180087005352386,-224.1956738377815,0.7598731055965077,-0.4734311347227409,-62.30397220345043,0.7943610829443497,-0.6734360351587786,-84.77706689569163,0.6937042003480963,-0.38016241076681495,-54.80180242470373,-0.9042367289133878,0.0,0.0,-14.298,8.053991299464762,56.32949569052883,53.70370370370371,0.27344595136811184,53.70370370370371,0.11844118951847873,59.25925925925925,0.2706406063453204,18.51851851851852,-0.9297226107382768,7.4074074074074066,-1.338161626317743,FRTR 0 1/4,100.0,0.0,100.0,0.0,100.0,0.0,100.0,0.0,100.0,0.0,0.9475580008084714,-0.0682986829889517,falling,5.555555555555555,100.0,1.0,-1.0,-1.0,0,0,0.29899365413457785,0.13909920849179064,0.3419207833238714,1.1009584911764452,Above Median,Top Decile,Bottom Decile,Top Decile,Very Tight,1.0010862803255804,"['Cpn', 'Issue_Age', 'YAS_RISK']","[0.3477691450754309, 0.26680993346650256, 0.10056492999991155]",0.7151440085418449,-0.8847815976950177,0.0
2025-11-06,FR0013234333,FRTR 1 3/4 06/25/39,2039-06-25,-1.833663662249464,NO ACTION,-0.2467049496224453,0.9773616379012321,-1.0037366275409751,0.5923808412212026,-0.61495283442158,90.40976613839824,-0.6325552220113417,0.017602387589761737,2.782743181775805,-0.27146239137821504,0.024757441755769743,9.120026062569318,-1.016590644997877,0.012854017456901845,1.264424121322332,0.5923808412212026,0.0,0.0,92.84574005324905,-2.4359739148508055,-2.6236787096439254,-0.6111234267837208,-0.003829407637859217,-0.6266177023111716,-0.2426257082218898,-0.004079241400555489,-1.6812897785324137,-1.0018634290171051,-0.0018731985238700233,-0.18697144250595232,0.5923808412212026,0.0,0.0,97.218,-6.808233861601764,-7.0030589612021,-0.9262230097724727,0.31127017535089274,33.606395944181614,-0.6944738346513393,0.447768885028894,64.47598976944862,-1.2596865982594365,0.2559499707184614,20.318543440905394,0.5923808412212026,0.0,0.0,83.068,7.341766138398242,8.8382603860866,-1.1311807393049096,0.5162279048833296,45.63619962596981,-0.9987125298789951,0.7520075802565498,75.29770081265464,-1.4349921428726617,0.4312555153316866,30.052813492280844,0.5923808412212026,0.0,0.0,94.191,-3.7812338616017627,-4.0144322294065455,-1.4461256327730982,0.8311727983515182,57.47583569278648,-1.4779656838598831,1.2312607342374378,83.30780202494782,-1.6328729593511482,0.629136331810173,38.529410653430794,0.5923808412212026,0.0,0.0,44.148,46.26176613839824,104.78790914179453,40.74074074074074,-0.596349650335888,44.44444444444444,-0.2416375120660926,20.37037037037037,-1.0172041705164514,66.66666666666666,0.5632408318773603,62.96296296296296,0.5371365590661193,FRTR 1 3/4,50.0,-0.7071067758185793,50.0,-0.7071067753339804,50.0,-0.7071067765365983,100.0,0.7071067709963105,50.0,-0.7071067810076777,0.9708214103286351,0.006540227572596979,rising,46.2962962962963,100.0,-1.0,-1.0,-1.0,1,1,0.641899629873561,0.2837829205107321,1.0945858744953731,0.7212566093576567,Below Median,Above Median,Above Median,Above Median,Tight,9.158022893731754,"['GREEN_BOND_LOAN_INDICATOR', 'YAS_RISK', 'Cpn']","[0.39935564632255177, 0.293565283974527, 0.13912511801771793]",0.8320460483147967,0.5360148471809175,0.0
2025-11-06,FR0013250560,FRTR 1 05/25/27,2027-05-25,-3.381441208331076,WEAK SELL,-0.9147795839483509,0.9484070974125594,-0.9898491212433174,1.180521454126924,-0.9562995930464965,-4.123508540478834,-0.8909278507015351,-0.06537174234496135,-7.337489961699736,-0.8204606769587435,-0.09431890698960743,-11.495847209843244,-0.9329103454229201,-0.0569387758203973,-6.103349104168214,1.180521454126924,0.0,0.0,-4.107391236656459,-0.01611730382237564,-0.39239757925412183,-0.9590145158686475,0.0027149228221510224,0.2830950677928391,-0.920935171851678,0.006155587903327042,0.6684062054128839,-0.9935955182910576,0.0037463970477402686,0.3770545399075933,1.180521454126924,0.0,0.0,-4.02,-0.10350854047883473,-2.574839308988826,-0.9249152425433226,-0.0313843505031739,-3.3932136395062713,-0.8682636821594819,-0.046515901788868996,-5.357347336864685,-0.9626231495946532,-0.027225971648664138,-2.8283104740725955,1.180521454126924,0.0,0.0,-0.62,-3.503508540478834,-565.0820135436504,1.16316153882869,-2.1194611318751866,-182.21554297504895,0.9734930656766437,-1.8882726496249946,-193.9687807550677,1.0126323973001223,-2.0024815185434397,-197.75009214671002,1.180521454126924,0.0,0.0,5.615,-9.738508540478835,-173.4373735197702,-0.42209904157297934,-0.5342005514735171,-126.55810276824462,-0.145690677850396,-0.7690889060979549,-527.8916020272359,-0.5517467423416229,-0.43810237890169446,-79.40280156473604,1.180521454126924,0.0,0.0,-12.294,8.170491459521166,66.45917889112776,25.925925925925924,-0.9257301920959304,20.37037037037037,-0.895989574154957,24.074074074074073,-1.003626970574054,88.88888888888889,1.1499454461408636,12.962962962962962,-1.297019207318727,FRTR 1 05/25/27,100.0,0.0,100.0,0.0,100.0,0.0,100.0,0.0,100.0,0.0,0.9392226752837612,0.009184422128798109,rising,14.814814814814813,100.0,-1.0,-1.0,-1.0,1,1,0.9982039604747317,1.052264343920715,1.0794413955471232,1.4373505049931383,Below Median,Top Decile,Bottom Quartile,Top Decile,Very Tight,1.478222087230563,"['Issue_Age', 'Cpn', 'GREEN_BOND_LOAN_INDICATOR']","[0.6476959572364805, 0.18650015977970588, 0.043790082406023514]",0.87798619942221,1.0943592823785175,0.0
2025-11-06,FR0013257524,FRTR 2 05/25/48,2048-05-25,-4.469981493561463,NO ACTION,-0.7962448319115238,0.9709198643104086,-0.553975202654503,0.4912061977935424,-0.7710278728691783,119.65101244138474,-0.9036099260816325,0.1325820532124542,14.672487310993521,-0.9814358233110435,0.18519099139951967,18.869393710105918,-0.6626207170389704,0.10864551438446746,16.396335030141266,0.4912061977935424,0.0,0.0,121.75170004700436,-2.100687605619626,-1.7253866719200477,-1.0126554432826163,0.24162757041343796,23.86078795410422,-1.1485667349549282,0.3523219030434044,30.674917638959688,-0.747592877664872,0.19361767501036908,25.898811800516114,0.4912061977935424,0.0,0.0,126.342,-6.690987558615262,-5.295932910738843,-0.8285186431798227,0.05749077031064442,6.938983219025554,-0.8794615604339854,0.08321672852246154,9.46223590888648,-0.6044869697464491,0.05051176709194616,8.35613814430432,0.4912061977935424,0.0,0.0,111.407,8.24401244138474,7.399905248902448,-0.7869604743586638,0.0159326014894855,2.024574525170705,-0.8184347462358633,0.022189914324339477,2.7112624623122192,-0.5670552957953202,0.013080093140817262,2.30666973876064,0.4912061977935424,0.0,0.0,125.313,-5.661987558615266,-4.518276282718823,-0.3797958660289633,-0.391232006840215,-103.01112558957315,-0.2310131019548593,-0.5652317299566645,-244.67517240627993,-0.23294773149469142,-0.32102747115981156,-137.81093952659222,0.4912061977935424,0.0,0.0,77.454,42.19701244138474,54.48009455410533,33.33333333333333,-0.7469533382870555,29.629629629629626,-0.7798895825683099,37.03703703703704,-0.5774923416842981,62.96296296296296,0.4623132155166989,79.62962962962963,1.1044817685184503,FRTR 2 05/25/48,100.0,0.0,100.0,0.0,100.0,0.0,100.0,0.0,100.0,0.0,0.9730987860581802,-0.0021789217477716782,falling,35.18518518518518,100.0,-1.0,-1.0,-1.0,1,1,0.8048137654043743,0.9159146753530366,0.6041160748829771,0.5980708558799288,Below Median,Top Decile,Top Quartile,Top Decile,Moderate,11.465120318296584,"['Issue_Age', 'YAS_RISK', 'AMT_OUTSTANDING']","[0.4652107346689852, 0.1987524209530101, 0.16018005737533883]",0.8241432129973342,0.439965878785683,0.0
2025-11-06,FR0013286192,FRTR 0 3/4 05/25/28,2028-05-25,-3.254289766983054,WEAK SELL,-0.8760161735544949,0.9787033892807961,-1.057962495154388,0.47666949201565734,-0.9611131784250712,6.677030460492541,-0.8911418603715445,-0.06997131805352663,-7.851871893793233,-0.788541588388498,-0.08747458516599693,-11.09321123257977,-1.0049315990130991,-0.053030896141288864,-5.277065191865969,0.47666949201565734,0.0,0.0,7.133314518315042,-0.4562840578225007,-6.39652234611726,-0.9594346900996013,-0.0016784883254699068,-0.1749455513017883,-0.8819226365953607,0.005906463040865839,0.6697257479063027,-1.0610629616766558,0.0031004665222678085,0.2922038187204437,0.47666949201565734,0.0,0.0,7.947,-1.2699695395074588,-15.980489969918333,-0.4472229697775801,-0.513890208647491,-114.9069327571376,-0.13789904367142006,-0.7381171298830749,-535.2590247949262,-0.6378815779133752,-0.4200809172410128,-65.85562668694868,0.47666949201565734,0.0,0.0,11.225,-4.547969539507458,-40.51643238713421,-1.4386017060922158,0.47748852766714467,33.19115515614588,-1.6314265041916087,0.7554103306371138,46.30366884845124,-1.3587077478143645,0.30074525265997654,22.134653381515932,0.47666949201565734,0.0,0.0,18.629,-11.95196953950746,-64.15786962849144,-0.5145552849995197,-0.4465578934255514,-86.78521001828737,-0.23480709931892593,-0.6412090742355689,-273.07907162412573,-0.6901696539503706,-0.36779284120401745,-53.29020680202847,0.47666949201565734,0.0,0.0,-5.171,11.848030460492541,229.12454916998811,22.22222222222222,-0.9303750329205224,24.074074074074073,-0.858022382734181,16.666666666666664,-1.0702184000589752,59.25925925925925,0.44781200242423863,20.37037037037037,-1.0874647308025074,FRTR 0 3/4,40.0,-0.5504483388291769,60.0,-0.475127434579885,20.0,-1.2976809513733694,80.0,0.82461086205421,40.0,-0.7487697287986478,0.9462174709971015,0.032485918283694626,rising,50.0,40.0,-1.0,-1.0,-1.0,1,1,1.0032284737380588,1.0076750731040598,1.1537197818305172,0.5803716083840562,Bottom Quartile,Below Median,Bottom Quartile,Below Median,Very Tight,2.3764781629466825,"['Issue_Age', 'AMT_OUTSTANDING', 'Cpn']","[0.4455350888071701, 0.253372914203372, 0.12409973584100797]",0.8230077388515501,0.4261656266026425,0.0
2025-11-06,FR0013313582,FRTR 1 1/4 05/25/34,2034-05-25,4.458267724909035,NO ACTION,0.37218158803126494,0.989999118263438,0.3347283108167779,1.3747105734303158,0.6841646201688117,66.20696716061136,0.6239715833381203,0.06019303683069144,9.6467591591263,0.2897900587676136,0.08239152926365134,28.431453712004938,0.28880265045568626,0.045925660361091636,15.902090475422906,1.3747105734303158,0.0,0.0,68.32614253958363,-2.1191753789722725,-3.101558641971347,0.782297836554398,-0.09813321638558625,-12.544226833527713,0.5182965653920355,-0.14611497736077056,-28.191383909926532,0.420540181125794,-0.0858118703090161,-20.405153210040666,1.3747105734303158,0.0,0.0,73.536,-7.3290328393886455,-9.96659165360094,-0.3883491689751087,1.0725137891439205,276.17253935604776,-0.22234526820478206,0.5945268562360471,267.3890181236421,-0.26424306545383197,0.5989713762706099,226.67438881487777,1.3747105734303158,0.0,0.0,63.584,2.6229671606113527,4.1251999877309276,-0.6266994502006344,1.3108640703694463,209.16949089915926,-0.5659353915020391,0.938116979533304,165.76396829805387,-0.4601860903559021,0.79491440117268,172.73759475957732,1.3747105734303158,0.0,0.0,73.369,-7.162032839388644,-9.761660699222393,1.4289437710459447,-0.744779150877133,-52.120955404695955,1.4979685473600555,-1.1257869593287906,-75.15424498047015,0.9007895268145664,-0.5660612159977885,-62.840562957639676,1.3747105734303158,0.0,0.0,26.562,39.64496716061136,149.25445051459195,61.111111111111114,0.6572260763728753,61.111111111111114,0.36453680036138275,61.111111111111114,0.291353729978373,96.29629629629629,1.3436604350993444,53.70370370370371,0.06754843299562631,FRTR 1 1/4,33.33333333333333,-1.143144187939691,33.33333333333333,-1.1103887497120124,33.33333333333333,-1.1295657472773781,100.0,1.0915491128802135,33.33333333333333,-1.0497567759477584,0.9698471715406246,0.020151946722813396,rising,90.74074074074075,100.0,1.0,1.0,1.0,1,1,0.7141442268040296,0.4281177908001943,0.3650249186495737,1.6737865542653894,Above Median,Below Median,Above Median,Below Median,Tight,6.69279268749392,"['Issue_Age', 'Cpn', 'AMT_OUTSTANDING']","[0.4409350920291911, 0.2883014390244392, 0.16391794154757094]",0.8931544726012013,1.2787104592226035,0.0
2025-11-06,FR0013341682,FRTR 0 3/4 11/25/28,2028-11-25,-1.94558164360987,NO ACTION,-0.14775463010634723,0.9867505200417988,-0.4534361163647148,-0.38966136752779335,-0.47244814136156754,13.114375675928557,-0.44646947218449345,-0.025978669177074087,-5.81868867049215,-0.1230261687774205,-0.02472846132892674,-20.100162074988596,-0.4388057899627637,-0.01463032640195111,-3.3341232962719762,-0.38966136752779335,0.0,0.0,13.78719396008016,-0.672818284151603,-4.880023343485979,-1.157205215564586,0.6847570742030185,59.17334791406028,-1.1579380597983335,1.0101834296919863,87.23984952562445,-1.016849017208066,0.5634129008433512,55.40772383785411,-0.38966136752779335,0.0,0.0,14.696,-1.5816243240714432,-10.762277646946213,0.3524027470734547,-0.8248508884350223,-234.06482267194372,0.1461963870430242,-0.29395101714937144,-201.06584231543306,0.4417267023612905,-0.8951628187260053,-202.65082316186644,-0.38966136752779335,0.0,0.0,17.595,-4.480624324071442,-25.46532720389264,0.26785987105220577,-0.7403080124137733,-276.37883265896306,0.020536043257435282,-0.1682906733637825,-819.4888825721719,0.3714494611898872,-0.824885577554602,-222.07208288981937,-0.38966136752779335,0.0,0.0,25.742,-12.627624324071444,-49.05455799536162,0.38437077894999117,-0.8568189203115587,-222.9146815896657,0.18767269379468463,-0.33542732390103186,-178.72994693356787,0.4638498228587223,-0.9172859392234372,-197.75493580975825,-0.38966136752779335,0.0,0.0,-2.039,15.153375675928556,743.1768318592875,48.148148148148145,-0.4588405871400285,48.148148148148145,-0.14471967939752778,42.592592592592595,-0.4791997290780584,33.33333333333333,-0.4164036317620144,24.074074074074073,-0.9625659172661125,FRTR 0 3/4,100.0,1.5790328769774171,100.0,1.6837738435823968,100.0,1.2520211509303623,40.0,-0.5334748536174109,60.0,-0.6508520718134292,0.9332270157814344,0.05352350426036434,rising,74.07407407407408,100.0,-1.0,-1.0,-1.0,1,1,0.49315048260520683,0.16996108312675431,0.4944770912413435,0.4744343793451919,Below Median,Top Decile,Bottom Quartile,Above Median,Very Tight,2.810904182601348,"['Issue_Age', 'Cpn', 'AMT_OUTSTANDING']","[0.5024096708751339, 0.1619122694322079, 0.09101597652696693]",0.7553379168343087,-0.3962754765142715,0.0
2025-11-06,FR0013404969,FRTR 1 1/2 05/25/50,2050-05-25,-3.2374356136444646,NO ACTION,-0.5740662099025903,0.9923594549428368,-0.37111227089325005,0.1127734961945549,-0.6049347434010734,125.14153289430304,-0.6499478360797576,0.04501309267868414,6.92564687308163,-0.6413362348164968,0.06727002491390655,10.4890415063247,-0.40860853789692625,0.0374962670036762,9.176574302389493,0.1127734961945549,0.0,0.0,128.08318284749586,-2.9416499531928224,-2.296671497042414,-0.6728465447806522,0.06791180137957875,10.093207863971003,-0.6742944204023954,0.10022821049980513,14.864161111340104,-0.4279218606085528,0.056809589715302755,13.275692040351469,0.1127734961945549,0.0,0.0,133.046,-7.904467105696952,-5.941153514651201,-0.45365487015939643,-0.15127987324167702,-33.34690749684501,-0.36301753478090865,-0.21104867512168163,-58.13732095209213,-0.2463507898982449,-0.12476148099500514,-50.64383028045284,0.1127734961945549,0.0,0.0,118.074,7.067532894303042,5.985680923577142,-0.4118589394938168,-0.19307580390725665,-46.87910852600164,-0.3056750856759018,-0.2683911242266885,-87.80274481741084,-0.2133114435203287,-0.15780082737292137,-73.97672500407151,0.1127734961945549,0.0,0.0,132.63,-7.488467105696955,-5.646133684032527,0.2390793198572532,-0.8440140632583266,-353.0267814295201,0.0871582677709017,-0.661224477673492,-758.6479386519563,0.08682017514044868,-0.45793244603369876,-527.449285316431,0.1127734961945549,0.0,0.0,83.391,41.750532894303035,50.06599379944651,44.44444444444444,-0.5866827524838953,37.03703703703704,-0.5622746156263289,48.148148148148145,-0.3987153508148702,53.70370370370371,0.08480449167701327,83.33333333333334,1.2110100759676816,FRTR 1 1/2,100.0,0.7071067623761963,100.0,0.707106759916364,100.0,0.7071067710197172,50.0,-0.7071067651211519,100.0,0.7071067810736363,0.9853720876504234,0.006987367292413449,rising,96.29629629629629,100.0,-1.0,-1.0,-1.0,1,1,0.6314425532358845,0.6603442122340881,0.40470202882485645,0.13730800159406298,Below Median,Top Decile,Top Quartile,Top Decile,Moderate,10.900854148055572,"['Issue_Age', 'YAS_RISK', 'GREEN_BOND_LOAN_INDICATOR']","[0.5257747586922232, 0.19695687521240743, 0.07185188687972754]",0.7945835207843582,0.080705204725653,0.0
2025-11-06,FR0013407236,FRTR 0 1/2 05/25/29,2029-05-25,-1.618524483639746,NO ACTION,0.24509852688171882,0.9810514917149217,0.24765687598309072,-0.8754054342371667,0.350178922821143,18.336371279989784,0.6450108387375133,-0.2948319159163703,-45.70960573662411,0.679586516668148,-0.4344879897864291,-63.93416772351579,0.49598486650097695,-0.24832799051788623,-50.06765372963889,-0.8754054342371667,0.0,0.0,19.389996666833472,-1.053625386843688,-5.4338605849403,0.2659659673406266,0.08421295548051638,31.663055674472073,0.13097396437244252,0.1141245625092763,87.13529772315484,0.18661644132594343,0.061040434657147286,32.70903193338209,-0.8754054342371667,0.0,0.0,21.148,-2.8116287200102157,-13.295010018350267,0.7538232316342959,-0.4036443088131529,-53.54628068219921,0.8349329984026829,-0.589834471520964,-70.6445266368593,0.5850909824899024,-0.3374341065068117,-57.67207337628517,-0.8754054342371667,0.0,0.0,23.048,-4.711628720010214,-20.442679269203172,0.8477120335168096,-0.4975331106956666,-58.6912872715133,0.9631863322843217,-0.7180878054026029,-74.55336250922788,0.660761743549001,-0.41310486756591025,-62.51948835523439,-0.8754054342371667,0.0,0.0,31.846,-13.509628720010216,-42.42174438161164,0.6047664271733838,-0.2545875043522408,-42.09683089262636,0.6139745704682333,-0.3688760435865145,-60.0800188348514,0.4591991230753205,-0.2115422470922298,-46.067649491300635,-0.8754054342371667,0.0,0.0,1.004,17.332371279989783,1726.3317836012554,55.55555555555556,0.33494854728298673,57.407407407407405,0.24006408601611037,55.55555555555556,0.20622784382790027,20.37037037037037,-0.9009617102825871,29.629629629629626,-0.8612475890715073,FRTR 0 1/2,80.0,0.6185457777728623,80.0,0.5977035397569271,80.0,0.5467595712173501,20.0,-1.6034653864387403,40.0,-0.8244343244474795,0.9435548660371538,0.0374966256777679,rising,55.55555555555556,100.0,1.0,1.0,1.0,1,1,0.3655235139453257,0.2819350640423642,0.2700725576158944,1.0658547869467576,Above Median,Top Quartile,Below Median,Below Median,Very Tight,3.206393272986219,"['AMT_OUTSTANDING', 'Issue_Age', 'Cpn']","[0.29445128436872137, 0.23596248567438946, 0.1869822748400167]",0.7173960448831276,-0.8574109441662999,0.0
2025-11-06,FR0013451507,FRTR 0 11/25/29,2029-11-25,-3.113231404021537,MODERATE SELL,-1.5503073052289011,0.9780060042536247,-1.4155657823190773,0.7029073422454,-1.4189263014595876,21.668718574003822,-1.386280464397947,-0.0326458370616407,-2.3549229513470995,-1.5014012867267996,-0.04890601850210152,-3.257358216535538,-1.4052631904377915,-0.010302591881285794,-0.733143220293263,0.7029073422454,0.0,0.0,22.98826121984125,-1.3195426458374264,-5.74007156367493,-1.0901536191892462,-0.3287726822703414,-30.15838075178923,-1.0366425333140863,-0.5136647719148149,-49.55080950784234,-1.2209146184679522,-0.19465116385112502,-15.94306098988922,0.7029073422454,0.0,0.0,25.447,-3.778281425996177,-14.847649721033568,-1.5173289748080023,0.09840267334841468,6.485256284804065,-1.7205415112755484,0.1702342060466473,9.894222484118936,-1.4514149264827987,0.035849144163721425,2.4699445529060315,0.7029073422454,0.0,0.0,25.546,-3.877281425996177,-15.177645911212762,-0.38958301374736465,-1.029343287712223,-264.2166688402028,-0.019160670369828457,-1.5311466348590728,-7991.086982851125,-0.6458749681660968,-0.7696908141529805,-119.17024813973246,0.7029073422454,0.0,0.0,35.869,-14.200281425996177,-39.589287189598956,0.48719952061445637,-1.906125822074044,-391.24130921678784,0.04890545125837926,-1.5992127564872805,-3270.00853348107,0.6536403595056671,-2.0692061418247443,-316.5664543317048,0.7029073422454,0.0,0.0,2.042,19.626718574003824,961.1517374088468,5.555555555555555,-1.3721391061972938,7.4074074074074066,-1.5184632523453752,5.555555555555555,-1.4198312985757073,70.37037037037037,0.6734974724261592,31.48148148148148,-0.7965926405819415,FRTR 0 11/25/29,100.0,0.0,100.0,0.0,100.0,0.0,100.0,0.0,100.0,0.0,0.9632051287576286,0.014800875495996069,rising,48.148148148148145,100.0,-1.0,-1.0,-1.0,1,1,1.4811026419310183,1.7833072884847938,1.543690114747956,0.8558287694034445,Bottom Decile,Top Decile,Below Median,Top Decile,Very Tight,3.5647892507135737,"['Issue_Age', 'Cpn', 'YAS_RISK']","[0.38876626443986295, 0.3671377338085491, 0.08477536673761278]",0.8406793649860248,0.6409418925754425,0.0
2025-11-06,FR0013480613,FRTR 0 3/4 05/25/52,2052-05-25,-5.562715530510914,WEAK SELL,-0.9932209822581851,0.9813728628087495,-0.6112046472113627,-0.9536548813070143,-1.0596187747026735,126.23516175755591,-0.9617695905442366,-0.09784918415843691,-10.173869511270368,-0.8506847957449675,-0.14253618651321764,-16.75546401565206,-0.5296559183704649,-0.08154872884089781,-15.396547923439648,-0.9536548813070143,0.0,0.0,130.4329235991952,-4.197761841639277,-3.218329947288972,-0.9034266326556761,-0.15619214204699738,-17.28885718799053,-0.7757084220604958,-0.21751256019768928,-28.04050480925105,-0.48498982253404443,-0.12621482467731826,-26.02422075899054,-0.9536548813070143,0.0,0.0,135.796,-9.560838242444078,-7.04058900243013,-0.811958460677023,-0.24766031402565047,-30.50159866170835,-0.6391928142315848,-0.3540281680266003,-55.386755702741276,-0.4075104560036231,-0.20369419120773957,-49.985020803350004,-0.9536548813070143,0.0,0.0,120.026,6.209161757555918,5.173180608400347,-0.545693090706869,-0.5139256839958045,-94.17851963495336,-0.2572798069629461,-0.735941175295239,-286.04699116418857,-0.18837852523709187,-0.42282612197427083,-224.45557368948906,-0.9536548813070143,0.0,0.0,136.16,-9.924838242444082,-7.289099766242048,0.5806497294807551,-1.6402685041834286,-282.48845950576595,0.6117017678351242,-1.6049227500933094,-262.37013006130155,0.38191353570254105,-0.9931181829139037,-260.03743362572646,-0.9536548813070143,0.0,0.0,89.453,36.78216175755591,41.11898064172696,16.666666666666664,-1.025427427145731,16.666666666666664,-0.9728197486592842,31.48148148148148,-0.6334430354004101,16.666666666666664,-0.9790201042313257,87.03703703703704,1.2322289080946127,FRTR 0 3/4,20.0,-0.9797113329355517,20.0,-0.8225762510024957,80.0,0.5866031164312847,20.0,-1.4176076607976325,80.0,1.0698141281099243,0.9510233838202552,0.03034947898849427,rising,59.25925925925925,60.0,-1.0,-1.0,-1.0,1,1,1.1060505151236257,1.1424949174676882,0.6665254160371612,1.1611278392645232,Bottom Quartile,Bottom Quartile,Top Quartile,Top Quartile,Moderate,9.776098024343227,"['Issue_Age', 'YAS_RISK', 'GREEN_BOND_LOAN_INDICATOR']","[0.5224045839852665, 0.13143618554671474, 0.05744314613650129]",0.7112839156684825,-0.9316961446269286,0.0
2025-11-06,FR0013508470,FRTR 0 02/25/26,2026-02-25,7.280356870028331,STRONG BUY,2.335578021646341,0.8453130347712928,1.6510055356245517,-0.6816942807906706,1.8320432356554432,-7.612363693581452,1.861113013988252,-0.02906977833280866,-1.5619566333759727,2.4043320455748267,-0.06875402392848562,-2.859589371986638,1.6528141410958752,-0.0018086054713235544,-0.10942582202145257,-0.6816942807906706,0.0,0.0,-7.483359537831799,-0.1290041557496533,-1.7238802295291356,1.7519915255771357,0.08005171007830758,4.569183609208317,2.2177765582015443,0.1178014634447968,5.311692130480269,1.645708905315678,0.005296630308873729,0.3218449058385113,-0.6816942807906706,0.0,0.0,-6.879,-0.7333636935814525,-10.660905546087541,0.9208725033843382,0.911170732271105,98.94645773739322,0.8092059672906147,1.5263720543557264,188.62589960918586,1.22843778586047,0.4225677497640816,34.39879098380316,-0.6816942807906706,0.0,0.0,-13.23,5.617636306418548,42.46134771105376,-0.8394015443681999,2.671444780023643,318.2558771926964,-0.45073966473733773,2.7863176863836787,618.1656158862355,-1.030833413084545,2.6818389487090966,260.1622035774002,-0.6816942807906706,0.0,0.0,-10.987,3.374636306418548,30.714811170902586,-1.0213183265288999,2.853361562184343,279.380234362766,-0.7077498876863039,3.043327909332645,430.0004732295333,-1.1822718247815625,2.833277360406114,239.64686268023908,-0.6816942807906706,0.0,0.0,-20.599,12.986636306418548,63.04498422308874,100.0,1.7648647771674861,100.0,2.2876041329959707,100.0,1.578219685448948,27.77777777777778,-0.707723520184018,5.555555555555555,-1.364710756340825,FRTR 0 02/25/26,100.0,0.0,100.0,0.0,100.0,0.0,100.0,0.0,100.0,0.0,0.7497384632891968,0.09557457148209603,rising,1.8518518518518516,100.0,1.0,1.0,1.0,1,1,1.9123220661072575,2.686598518099513,1.8004397651958044,0.8300006876792072,Top Decile,Top Decile,Bottom Decile,Top Decile,Very Tight,0.2855721658050925,"['YAS_RISK', 'Issue_Age', 'GREEN_BOND_LOAN_INDICATOR']","[0.5215915774930008, 0.1779194690462092, 0.03301593721337785]",0.7325269837525878,-0.6735135186370463,0.0
2025-11-06,FR0013515806,FRTR 0 1/2 05/25/40,2040-05-25,-1.2111494325180132,NO ACTION,-0.09612771339597827,0.9698935748702513,-0.1416131551928859,0.9218906923838246,-0.2834071601090056,95.4559734633191,-0.261488794761992,-0.02191836534701358,-8.382142924613447,-0.05961642292550709,-0.03651129047047118,-61.24366836253583,-0.12220294290243848,-0.019410212290447412,-15.883586958773149,0.9218906923838246,0.0,0.0,98.27158327273044,-2.8156098094113418,-2.8651312163260294,-0.2755671825092626,-0.007839977599742975,-2.8450330129481767,-0.08626273963444663,-0.009864973761531642,-11.435960253221907,-0.13625193183146453,-0.005361223361421363,-3.934786755591986,0.9218906923838246,0.0,0.0,102.453,-6.997026536680906,-6.829498927311017,-0.42554218503645863,0.14213502492745306,33.4009239472188,-0.2999238232111025,0.20379610981512425,67.9492882020088,-0.2496127390518808,0.10799958385899491,43.26685406463262,0.9218906923838246,0.0,0.0,88.183,7.27297346331909,8.247591329955128,-0.4642086647340604,0.18080150462505484,38.9483252825109,-0.362596488062144,0.26646877466616575,73.48906459115794,-0.28565566237324397,0.14404250718035808,50.42522208071155,0.9218906923838246,0.0,0.0,100.67,-5.214026536680905,-5.179325058272546,0.5215144149615714,-0.8049215750705769,-154.34310855924815,0.2790078227958566,-0.3751355361918349,-134.45340671360745,0.22860192548165323,-0.3702150806745391,-161.94748303180978,0.9218906923838246,0.0,0.0,51.544,43.9119734633191,85.1931814659316,50.0,-0.2764266070845174,50.0,-0.0941532042269706,50.0,-0.17434422804585692,81.48148148148148,0.8919461548566125,68.51851851851852,0.6350442037004286,FRTR 0 1/2,60.0,0.11465752195292549,60.0,0.3353309265227449,60.0,0.23817104587117766,60.0,0.40547212553568784,60.0,0.4898995771960127,0.9635879229475692,0.006305651922682065,rising,31.48148148148148,60.0,-1.0,-1.0,-1.0,1,1,0.29582586012242595,0.11057501396416025,0.1544307092754032,1.1224531732261918,Above Median,Above Median,Above Median,Above Median,Tight,8.460453162068404,"['Issue_Age', 'Cpn', 'GREEN_BOND_LOAN_INDICATOR']","[0.5668803634691412, 0.19398732269903377, 0.09691664993294526]",0.8577843361011201,0.8488311834486721,0.0
2025-11-06,FR0013516549,FRTR 0 11/25/30,2030-11-25,-2.131191451293269,MODERATE SELL,-1.4118688777485435,0.9881195985187907,-1.03890754465295,0.027761439872673793,-1.2383027939275755,31.795256515175083,-1.3699635125416334,0.13166071861405793,9.61052732044964,-1.6347906201796003,0.22292174243105678,13.63610350559486,-1.0917446616365976,0.05283711698364746,4.83969543029151,0.027761439872673793,0.0,0.0,33.14773475660204,-1.352478241426958,-4.080152839854522,-1.159303180149561,-0.07899961377801445,-6.81440493300314,-1.2882133685392494,-0.12365550920929413,-9.598992780956172,-0.9971804327074294,-0.0417271119455207,-4.184509659277719,0.027761439872673793,0.0,0.0,37.219,-5.423743484824918,-14.572512650441084,-0.9743729932858609,-0.26392980064171456,-27.087142167493223,-1.0112385723189756,-0.4006303054295679,-39.617782829334026,-0.865701274247511,-0.17320627040543912,-20.00762544276393,0.027761439872673793,0.0,0.0,34.015,-2.2197434848249173,-6.52577828655693,-0.6338517473592474,-0.604451046568328,-95.36157935202252,-0.5212931899594562,-0.8905756877890874,-170.83969018938905,-0.5837848964050568,-0.4551226482478933,-77.96067408637458,0.027761439872673793,0.0,0.0,43.913,-12.117743484824913,-27.594888716474454,-0.3619410720166335,-0.876361721910942,-242.12828149490574,-0.13161550771165229,-1.2802533700368912,-972.7222080619047,-0.366752239846311,-0.6721553048066391,-183.27230578362054,0.027761439872673793,0.0,0.0,7.383,24.412256515175084,330.65497063672746,11.11111111111111,-1.1978475177692718,9.25925925925926,-1.3828684163200329,18.51851851851852,-1.051589218742662,47.22222222222222,4.430049257717744e-16,37.03703703703704,-0.6001152835729139,FRTR 0 11/25/30,100.0,0.0,100.0,0.0,100.0,0.0,100.0,0.0,100.0,0.0,0.9768414535121098,0.011278145006680895,rising,81.48148148148148,100.0,-1.0,-1.0,-1.0,1,1,1.2925643408752676,1.6240625659066181,1.1329401479247783,0.0338010965246161,Bottom Quartile,Top Decile,Below Median,Top Decile,Very Tight,4.292741103254372,"['Issue_Age', 'AMT_ISSUED', 'REL_SPRD_LOG']","[0.3139678362738766, nan, 0.2920676520917782]",,,0.0
2025-11-06,FR0014001NN8,FRTR 0 1/2 05/25/2072,2072-05-25,-8.990933236477048,STRONG SELL,-1.6111912325092153,0.9612310899600901,-1.6993715069485384,1.3410714059012512,-1.5306414683634084,125.78156080714058,-1.5370646449744867,0.006423176611078274,0.41788590937216563,-1.6196822446485815,0.008491012139366205,0.5242393756551023,-1.7008571471571252,0.0014856402085867693,0.08734655948827136,1.3410714059012512,0.0,0.0,132.23966191342925,-6.458101106288666,-4.883634011426996,-1.5149737067028863,-0.015667761660522084,-1.034193629089528,-1.5958045722362562,-0.015386660272959096,-0.9641945163108404,-1.695721999479619,-0.003649507468919344,-0.21521849976101332,1.3410714059012512,0.0,0.0,134.846,-9.064439192859425,-6.72206753792268,-1.9250997631045756,0.3944582947411672,20.49027797167266,-2.327559180239519,0.7163679477303035,30.77764684715001,-1.7830518065234953,0.08368029957495682,4.693094098527796,1.3410714059012512,0.0,0.0,128.325,-2.5434391928594096,-1.9820293728121618,-1.876576035802485,0.3459345674390766,18.434348462075977,-2.2600497926868024,0.6488585601775871,28.709923091349943,-1.7803711948427845,0.08099968789424605,4.549595481769137,1.3410714059012512,0.0,0.0,132.019,-6.237439192859426,-4.724652657865126,-1.7321818642736835,0.20154039591027506,11.635059741909748,-1.9726660227274504,0.36147479021823514,18.324175720633885,-1.7560842070850204,0.056712700136482,3.2294977418919695,1.3410714059012512,0.0,0.0,84.639,41.14256080714058,48.609459944327845,3.7037037037037033,-1.4799379976993736,5.555555555555555,-1.5780965946651901,3.7037037037037033,-1.697295588096212,94.44444444444444,1.3101034006483858,85.18518518518519,1.2234280408690976,FRTR 0 1/2,40.0,-0.8772624982574674,40.0,-0.8296180949886534,40.0,-0.9967207107887353,100.0,0.8740136458830167,100.0,1.006732475769384,0.9238714257452295,0.03735966421486059,rising,22.22222222222222,40.0,-1.0,-1.0,-1.0,1,1,1.5977130879244503,1.8533416300017045,1.853183390928764,1.6328289975294055,Bottom Decile,Below Median,Top Quartile,Top Decile,Moderate,8.577227350986405,"['REL_SPRD_LOG', 'AMT_OUTSTANDING', 'YAS_RISK']","[0.4628448783219908, 0.2741300934626395, 0.15355191753886158]",0.8905268893234919,1.2467755076440363,0.0
2025-11-06,FR0014002JM6,FRTR 0 1/2 06/25/44,2044-06-25,-9.695447682917589,STRONG SELL,-2.1483573988400244,0.9766326611435553,-1.754598566876434,0.28058163749866144,-1.831214847273038,103.2830285271988,-1.8186169478994008,-0.012597899373637311,-0.6927186793742732,-2.1208075348278643,-0.027549864012160086,-1.2990270653906117,-1.752757664878837,-0.0018409019975968999,-0.1050288938386281,0.28058163749866144,0.0,0.0,105.72850315568324,-2.4454746284844475,-2.3129757399972215,-1.7796847009861894,-0.05153014628684871,-2.8954649084047,-2.0515339927714815,-0.0968234060685429,-4.7195613593409185,-1.7459430978351025,-0.00865546904133141,-0.4957474846969003,0.28058163749866144,0.0,0.0,110.165,-6.881971472801212,-6.246967251101997,-1.8500314469015893,0.0188165996285512,1.0170961990054492,-2.181042052765075,0.03268465392505071,1.4985797148549191,-1.7573760681359658,0.0027775012595319115,0.15804820004594486,0.28058163749866144,0.0,0.0,95.434,7.849028527198797,8.224562028602325,-1.854805039905537,0.02359019263249884,1.2718421611856332,-2.188892446235017,0.040535047394992585,1.8518519390721688,-1.758183481292805,0.003584914416371099,0.20389876449898214,0.28058163749866144,0.0,0.0,108.959,-5.6759714728012085,-5.2092727285311735,-1.2757692487483345,-0.5554455985247035,-43.53809238746314,-1.1993455079309,-0.9490118909091245,-79.12748050673099,-1.5529067602976587,-0.20169180657877517,-12.988017724986491,0.28058163749866144,0.0,0.0,62.6,40.68302852719879,64.9888634515973,1.8518518518518516,-1.7699745071501292,1.8518518518518516,-2.1042291112478586,1.8518518518518516,-1.7512886390299323,55.55555555555556,0.2522029141863654,72.22222222222221,0.7869064789468232,FRTR 0 1/2,20.0,-1.1163071990883977,20.0,-1.242651074769176,20.0,-1.0405012117712258,40.0,-0.31135455541300766,80.0,0.6232945057127892,0.9868335806575547,-0.010200919513999374,falling,42.592592592592595,80.0,-1.0,-1.0,-1.0,1,1,1.911457378335621,2.4712399888072376,1.9134091095369217,0.34162374342342317,Bottom Decile,Bottom Quartile,Above Median,Top Quartile,Moderate,9.166985240137038,"['GREEN_BOND_LOAN_INDICATOR', 'Issue_Age', 'AMT_OUTSTANDING']","[0.3934782510368429, 0.2534968347928549, 0.16071606806042005]",0.8076911538901179,0.2400119076161396,0.0
2025-11-06,FR0014002WK3,FRTR 0 11/25/31,2031-11-25,-0.6246021472156826,NO ACTION,-0.18758118895509118,0.9860320061150606,-0.41506784315165085,-1.9992875342070973,-0.7634908260320058,41.89545730042168,-0.7845791230230206,0.021088296991014777,2.6878483129879545,-0.2177228941955362,0.030141705240445016,13.844067233907028,-0.43079625144690514,0.015728408295254293,3.6510085399598555,-1.9992875342070973,0.0,0.0,43.72187943829632,-1.826422137874637,-4.17736419596163,-0.7656139895575067,0.002123163525500904,0.2773151387942233,-0.19673596463262344,0.009154775677532256,4.653330787430974,-0.41991232209269425,0.004844478941043395,1.1536881798398797,-1.9992875342070973,0.0,0.0,47.728,-5.832542699578319,-12.220379438393145,-1.1172622533576602,0.35377142732565436,31.664134637688413,-0.6981578477464604,0.5105766587913692,73.13197912567041,-0.7042509394056702,0.28918309625401933,41.062507121654015,-1.9992875342070973,0.0,0.0,42.511,-0.6155426995783202,-1.4479609969973044,-0.9309034112227124,0.16741258519070656,17.98388333032608,-0.43066135088238383,0.24308016192729265,56.44345743700914,-0.5483879036091661,0.13332006045751527,24.311268930068348,-1.9992875342070973,0.0,0.0,52.799,-10.903542699578317,-20.65104016650545,-1.250564587237792,0.48707376120578616,38.948308810406076,-0.8948892664658397,0.7073080775107485,79.03861361531784,-0.8200662826228817,0.4049984394712309,49.386060994641404,-1.9992875342070973,0.0,0.0,12.413,29.482457300421682,237.51274693201,35.18518518518518,-0.7396805093886665,46.2962962962963,-0.18372818169588928,46.2962962962963,-0.44168876737673735,3.7037037037037033,-2.0220997501856632,42.592592592592595,-0.4041489259614369,FRTR 0 11/25/31,100.0,0.0,100.0,0.0,100.0,0.0,100.0,0.0,100.0,0.0,0.9626356796637437,0.02339632645131684,rising,70.37037037037037,100.0,-1.0,-1.0,-1.0,1,1,0.7969464505400217,0.21577328592724823,0.4526360656819922,2.4342437292207766,Below Median,Top Decile,Below Median,Top Decile,Very Tight,4.950925406544116,"['REL_SPRD_LOG', 'Issue_Age', 'GREEN_BOND_LOAN_INDICATOR']","[0.42844049978122983, 0.11556239389288725, 0.08560578817612965]",0.6296086818502467,-1.9243553152345731,0.0
2025-11-06,FR0014003513,FRTR 0 02/25/27,2027-02-25,-1.94258823242388,NO ACTION,-0.4761306169354476,0.9204610849722201,-0.5923434758675669,0.6426023969042394,-0.6054616861643592,-5.3776447411013,-0.5320123242525393,-0.07344936191181994,-13.805950949429397,-0.3580026513089956,-0.118127965626452,-32.99639315376334,-0.5249083290082424,-0.0674351468593245,-12.84703287182214,0.6426023969042394,0.0,0.0,-5.281431705937991,-0.09621303516330926,-1.821722599820107,-0.4391243765071681,-0.16633730965719112,-37.879315011459944,-0.22220710088971982,-0.2539235160457278,-114.2733529224223,-0.45162751089339204,-0.14071596497417482,-31.1575266041839,0.6426023969042394,0.0,0.0,-4.137,-1.2406447411013009,-29.988995361431027,-1.2272455445036108,0.6217838583392515,50.66499170092713,-1.3904757338735863,0.9143451169381387,65.7577178866103,-1.0697507272442603,0.4774072513766935,44.627896458059205,0.6426023969042394,0.0,0.0,-4.094,-1.2836447411013001,-31.354292573665628,0.7925347116404778,-1.397996397804837,-176.39560256881947,0.6403201797639937,-1.1164507966994413,-174.3582061829001,0.679170763524966,-1.2715142393925327,-187.21568844802366,0.6426023969042394,0.0,0.0,2.42,-7.7976447411013,-322.21672350742267,0.7608302977156629,-1.3662919838800223,-179.57906908075384,0.6014840517079134,-1.077614668643361,-179.1593056653031,0.6576612770267332,-1.2500047528943,-190.06816693522185,0.6426023969042394,0.0,0.0,-12.962,7.584355258898699,58.51223000345222,42.592592592592595,-0.5871912227958643,40.74074074074074,-0.46635066653850377,33.33333333333333,-0.6150033033856191,68.51851851851852,0.6133397670778314,11.11111111111111,-1.3213522387514958,FRTR 0 02/25/27,100.0,0.0,100.0,0.0,100.0,0.0,100.0,0.0,100.0,0.0,0.9654939741764248,-0.045032889204204674,falling,11.11111111111111,100.0,-1.0,-1.0,-1.0,1,1,0.6319925862559549,0.5476896074655201,0.6459571004423285,0.7824041456181817,Below Median,Top Decile,Bottom Quartile,Top Decile,Very Tight,1.2340282372143463,"['Issue_Age', 'Cpn', 'GREEN_BOND_LOAN_INDICATOR']","[0.4054720042236187, 0.3516992583500486, 0.07879763311181064]",0.8359688956854779,0.583692095660755,0.0
2025-11-06,FR0014004J31,FRTR 0 3/4 05/25/53,2053-05-25,-3.810873109479616,NO ACTION,-0.6774340071658348,0.9748988320699742,-0.7292484507414542,0.5921122011706802,-0.7604783678686006,129.40408847608026,-0.6488665831614373,-0.11161178470716326,-17.201037298493553,-0.5136124938580228,-0.16382151330781203,-31.895935569570362,-0.6341028843393614,-0.09514556640209282,-15.00475194979515,0.5921122011706802,0.0,0.0,133.86925023524373,-4.465161759163465,-3.33546482928936,-0.5599419088167431,-0.20053645905185746,-35.81379645153673,-0.3908778436516084,-0.2865561635142264,-73.31092330690997,-0.561758665486446,-0.16748978525500813,-29.8152556540356,0.5921122011706802,0.0,0.0,139.231,-9.826911523919733,-7.057991053151909,-0.4925596816741384,-0.2679186861944622,-54.393140714345854,-0.2937599387527422,-0.3836740684130926,-130.60802537654007,-0.5067576812424662,-0.22249076949898794,-43.90476421847413,0.5921122011706802,0.0,0.0,123.37,6.034088476080257,4.8910500734304545,0.41269724367397825,-1.1731756115425789,-284.2702734507077,0.09365817162720097,-0.7710921787930358,-823.3046653225746,0.39005226032349394,-1.1193007110649482,-286.9617218575973,0.5921122011706802,0.0,0.0,139.857,-10.452911523919738,-7.473999530357678,1.0752376233679857,-1.8357159912365861,-170.7265384198413,1.0515265983116924,-1.728960605477527,-164.42385687733642,0.930437737933752,-1.6596861886752061,-178.37691907501772,0.5921122011706802,0.0,0.0,92.905,36.49908847608026,39.28646302368185,37.03703703703704,-0.7367736556488242,31.48148148148148,-0.6635191889381656,27.77777777777778,-0.7488492349107877,64.81481481481481,0.562972847735883,88.88888888888889,1.2937131339799048,FRTR 0 3/4,80.0,0.3238684792602588,80.0,0.11356119891135755,60.0,0.08873148570577312,100.0,1.005582245625254,100.0,1.118016278072569,0.9668716287742086,0.008027203295765561,rising,40.74074074074074,20.0,-1.0,-1.0,-1.0,1,1,0.7938019886043055,0.7792474423436472,0.7952534870972865,0.7209295251603047,Below Median,Top Quartile,Top Quartile,Top Decile,Moderate,9.73322796921643,"['Issue_Age', 'Cpn', 'YAS_RISK']","[0.568261937884689, 0.1759095833665531, 0.08785354336638469]",0.8320250646176268,0.5357598168803583,0.0
2025-11-06,FR0014007L00,FRTR 0 05/25/32,2032-05-25,0.4010626828832215,WEAK BUY,0.6458966678967651,0.9949766448222243,0.7957935198990181,0.7758271735770498,0.8582686709262035,47.00829583751586,1.152070822481345,-0.29380215155514144,-25.50209095410797,1.074116246047948,-0.42821957815118294,-39.867153647478865,1.0368224954790657,-0.24102897558004754,-23.24688886538778,0.7758271735770498,0.0,0.0,49.48526598855859,-2.476970151042728,-5.005470014276325,1.1730143352936053,-0.3147456643674018,-26.83220931016159,1.1076210563230235,-0.4617243884262584,-41.68613278176874,1.0537135787201706,-0.25792005882115243,-24.477245200417265,0.7758271735770498,0.0,0.0,53.58,-6.571704162484139,-12.265218666027653,0.813468131920872,0.04480053900533154,5.50735015873423,0.5809952237448468,0.06490144415191834,11.170736071893634,0.760105858366665,0.03568766153235314,4.695090910038585,0.7758271735770498,0.0,0.0,47.818,-0.8097041624841381,-1.693304116263348,-0.5137368119180731,1.3720054828442767,267.0638786843809,-0.28093767729218705,0.9268343451889522,329.90744464447926,-0.5953793493372874,1.3911728692363057,233.66158860206548,0.7758271735770498,0.0,0.0,58.589,-11.580704162484139,-19.766004131334448,-1.144985906744557,2.00325457767076,174.95888363120196,-1.2001748860047519,1.846071553901517,153.8168778606254,-1.1095400476133637,1.9053335675123817,171.72282825108462,0.7758271735770498,0.0,0.0,14.855,32.153295837515856,216.4476325538276,72.22222222222221,0.8252267534324805,66.66666666666666,0.6326296416882026,68.51851851851852,0.7421167680659659,74.07407407407408,0.7462392633768435,44.44444444444444,-0.30494848762624244,FRTR 0 05/25/32,100.0,0.0,100.0,0.0,100.0,0.0,100.0,0.0,100.0,0.0,0.9799315830596816,0.01504506176254261,rising,98.14814814814815,100.0,1.0,1.0,1.0,1,1,0.895877393130152,0.742970268915992,0.8678216197314756,0.944612718244151,Above Median,Top Decile,Below Median,Top Decile,Very Tight,5.248880160997516,"['Issue_Age', 'YAS_RISK', 'AMT_OUTSTANDING']","[0.6564102180997305, 0.10627976644207059, 0.0836852089529073]",0.8463751934947085,0.7101674844597099,0.0
2025-11-06,FR0014009O62,FRTR 1 1/4 05/25/38,2038-05-25,4.08853813680814,MODERATE BUY,1.1857904644377286,0.9743193578978568,1.481287290056664,-1.2860900500890455,1.2019870496831955,90.70541333245862,1.2661531766071952,-0.0641661269239997,-5.067801242592163,1.2848260600743977,-0.09903559563666908,-7.708093565608802,1.524629228315866,-0.04334193825920196,-2.842785456946784,-1.2860900500890455,0.0,0.0,93.9856338370801,-3.2802205046214823,-3.490129682966851,1.2155638993186302,-0.013576849635434707,-1.1169177968639303,1.2095424583489134,-0.023751993911184766,-1.963717234633972,1.4924295916210637,-0.01114230156439966,-0.7465880837727281,-1.2860900500890455,0.0,0.0,97.902,-7.196586667541382,-7.3508065890444545,1.1249400060121564,0.0770470436710391,6.848991286145742,1.0673924095966623,0.11839805484106636,11.09227053399964,1.4229920601327748,0.05829522992388925,4.09666583162687,-1.2860900500890455,0.0,0.0,84.378,6.327413332458619,7.498889914087475,0.924089909948692,0.2778971397345035,30.07252148686278,0.7832697071527334,0.40252075728499526,51.3898020656537,1.2636409994987194,0.2176462905579446,17.22374384195428,-1.2860900500890455,0.0,0.0,95.456,-4.750586667541384,-4.976729243885886,1.2588807963641382,-0.056893746680942714,-4.519391064930248,1.2781920078856088,-0.09240154344788021,-7.2290815585541885,1.5215610583198718,-0.04027376826320772,-2.6468716308362543,-1.2860900500890455,0.0,0.0,45.61,45.09541333245862,98.87176786356379,87.03703703703704,1.1568957760531553,87.03703703703704,1.161433761653076,94.44444444444444,1.412293672199418,11.11111111111111,-1.3106436024017356,64.81481481481481,0.5428727721365263,FRTR 1 1/4,66.66666666666666,0.4304481647179904,66.66666666666666,0.28082676709934346,100.0,0.7722940390206635,66.66666666666666,-0.21959915765515395,100.0,0.941421341207122,0.9621373415736141,0.012182016324242761,rising,38.88888888888889,66.66666666666666,1.0,1.0,1.0,1,1,1.254657266569355,1.3640062010385403,1.6153601445607957,1.5658861399764037,Top Quartile,Above Median,Above Median,Top Decile,Tight,8.4033247364097,"['Cpn', 'Issue_Age', 'YAS_RISK']","[0.3364184038738666, 0.17969530074452658, 0.16920342427810836]",0.6853171288965016,-1.2472895970776878,0.0
2025-11-06,FR001400AIN5,FRTR 0 3/4 02/25/28,2028-02-25,-3.2814035121168548,WEAK SELL,-0.8842820745839549,0.9846630150330646,-0.8995803303085415,0.027761439872673793,-0.9203337490538076,4.084222661514682,-0.934229212251771,0.01389546319796342,1.487371928323031,-0.9155688917668754,0.03128681718292048,3.4171996364820623,-0.9178924607056855,0.018312130397144077,1.995019131496472,0.027761439872673793,0.0,0.0,4.011351068815585,0.07287159269909704,1.8166346267705282,-1.0229466485270085,0.10261289947320085,10.031109502909786,-1.0501666179092182,0.16588454332526326,15.796021213845234,-0.9903335691374215,0.09075323882888009,9.163906055566242,0.027761439872673793,0.0,0.0,4.424,-0.33977733848531866,-7.680319568654761,-0.8381764787490412,-0.08215727030476638,-9.801905852475555,-0.7686726635179435,-0.11560941106601141,-15.040135424212226,-0.8303688745041674,-0.06921145580437404,-8.335025203371128,0.027761439872673793,0.0,0.0,7.801,-3.7167773384853184,-47.644883139608126,-1.3099702362656684,0.38963648721186084,29.74391886553129,-1.4912606009211131,0.6069785263371582,40.70237769924355,-1.1653161484879104,0.265735818179369,22.80375297671854,0.027761439872673793,0.0,0.0,16.05,-11.965777338485319,-74.55312978834894,-0.39067750339530966,-0.5296562456584979,-135.5737731243727,-0.12370268920852963,-0.7605793853754252,-614.8446155514296,-0.46661309908435306,-0.4329672312241884,-92.78934148974322,0.027761439872673793,0.0,0.0,-6.585,10.66922266151468,162.0231229356472,27.77777777777778,-0.8910251630313765,22.22222222222222,-0.8661184982065296,25.925925925925924,-0.915375170948471,47.22222222222222,4.430049257717744e-16,18.51851851851852,-1.1377709683868642,FRTR 0 3/4,60.0,-0.37274168447294875,40.0,-0.4996313569113746,40.0,-0.6296748016940503,60.0,0.12088940673557957,20.0,-0.788208605570416,0.9225855573056709,0.0620774577273937,rising,64.81481481481481,80.0,-1.0,-1.0,-1.0,1,1,0.9606621188004638,1.0171832793171198,0.9810022823834978,0.0338010965246161,Below Median,Above Median,Bottom Quartile,Bottom Quartile,Very Tight,2.160941332697064,"['Issue_Age', 'AMT_ISSUED', 'REL_SPRD_LOG']","[0.3720275522279603, nan, 0.347131724852518]",,,0.0
2025-11-06,FR001400BKZ3,FRTR 2 11/25/32,2032-11-25,2.2376970716810405,MODERATE SELL,-1.7337672064899612,0.9889396998352431,-1.0031229935417765,0.027761439872673793,-1.396878086483297,52.84735440762182,-1.369340628730056,-0.027537457753241013,-2.011001278599283,-1.6888152735117299,-0.0449519329782313,-2.661743615012653,-0.9943383383953509,-0.008784655146425568,-0.8834673992612393,0.027761439872673793,0.0,0.0,54.92601322957207,-2.078658821950249,-3.784470598446158,-1.0395961528549997,-0.3572819336282973,-34.367377102192144,-1.1511759963578176,-0.5825912101321435,-50.608352407847,-0.8276882628234568,-0.17543473071831972,-21.195749230548707,0.027761439872673793,0.0,0.0,59.284,-6.436645592378177,-10.857306509838146,-1.0172064885323886,-0.37967159795090843,-37.324928468181575,-1.1177293054464286,-0.6160379010435326,-55.11512425506018,-0.8102158421094269,-0.1929071514323496,-23.80935289406011,0.027761439872673793,0.0,0.0,52.274,0.5733544076218209,1.096825204713889,0.49594258824456655,-1.8928206747278635,-381.6612409233796,0.4265639975991866,-2.1603312040891476,-506.44948134467666,0.40846128029945905,-1.4115842738412354,-345.5858137270113,0.027761439872673793,0.0,0.0,63.369,-10.521645592378178,-16.603774070472628,-0.8259770342057711,-0.570901052277526,-69.11827105636856,-0.8505451690608204,-0.8832220374291407,-103.84187215127155,-0.6658826661926062,-0.3372403273491703,-50.64560761325825,0.027761439872673793,0.0,0.0,17.673,35.17435440762182,199.02876923962512,7.4074074074074066,-1.3508638111776845,3.7037037037037033,-1.6981547995658786,22.22222222222222,-1.016604247728299,47.22222222222222,4.430049257717744e-16,48.148148148148145,-0.19165776557097722,FRTR 2 11/25/32,100.0,0.0,100.0,0.0,100.0,0.0,100.0,0.0,100.0,0.0,0.9858495652809152,0.003090134554327939,rising,88.88888888888889,100.0,-1.0,-1.0,-1.0,1,1,1.4580882898694236,1.9943398869638698,1.0939166998441716,0.0338010965246161,Bottom Decile,Top Decile,Below Median,Top Decile,Tight,6.011369902158492,"['Issue_Age', 'AMT_ISSUED', 'REL_SPRD_LOG']","[0.3796036809950039, nan, 0.20783627788650857]",,,0.0
2025-11-06,FR001400CMX2,FRTR 2 1/2 05/25/43,2043-05-25,-2.2231334022221034,NO ACTION,-0.34091207652494204,0.9806440355313257,-0.46079972435510086,-0.795718120261475,-0.6458551869113911,106.92177903214402,-0.6465991950954689,0.0007440081840778268,0.1150648157645006,-0.338140756438668,-0.002771320086274065,-0.8195758575524279,-0.4591203049888725,-0.0016794193662283408,-0.36579068958624583,-0.795718120261475,0.0,0.0,109.6986950432105,-2.77691601106649,-2.5314029576372974,-0.6812416544761234,0.035386467564732293,5.194407419567412,-0.3916894421338067,0.050777365608864644,12.963679601849062,-0.48967281884371966,0.0288730944886188,5.896405270596242,-0.795718120261475,0.0,0.0,113.741,-6.819220967855983,-5.995393892489466,0.2664898435163971,-0.9123450304277883,-342.35638557685337,0.05574472005516642,-0.39665679658010844,-711.5592741907022,0.2974581194970171,-0.7582578438521179,-254.9124628512537,-0.795718120261475,0.0,0.0,99.939,6.982779032144023,6.987041126532505,-0.599477270394477,-0.04637791651691414,-7.736392693046825,-0.2730701184310871,-0.06784195809385496,-24.844152117127592,-0.4234326434565191,-0.03736708089858176,-8.824799078094449,-0.795718120261475,0.0,0.0,112.517,-5.59522096785598,-4.972778306708055,0.8201315503508164,-1.4659867372622075,-178.75019181497203,0.8568426195170834,-1.1977546960420256,-139.78701044754044,0.7500939352218418,-1.2108936595769426,-161.4322668900918,-0.795718120261475,0.0,0.0,63.633,43.288779032144014,68.02881999173562,38.88888888888889,-0.6261686931349393,42.592592592592595,-0.3339095795639346,40.74074074074074,-0.48639880253588774,22.22222222222222,-0.8214689601104488,75.92592592592592,0.8575063311549719,FRTR 2 1/2,75.0,-0.10410438880431377,75.0,0.11337631199023067,75.0,0.036102413734751225,50.0,-0.11276967169549992,100.0,1.443272720458415,0.982561321635949,-0.0019172861046232725,falling,53.70370370370371,75.0,-1.0,-1.0,-1.0,1,1,0.6741561014517266,0.3921486977123233,0.5025071870557645,0.968831051728649,Below Median,Top Quartile,Top Quartile,Top Decile,Moderate,10.989364916948574,"['YAS_RISK', 'Issue_Age', 'Cpn']","[0.3634634117666043, 0.18382184933725934, 0.17633522597056345]",0.7236204870744272,-0.781760721519112,0.0
2025-11-06,FR001400FTH3,FRTR 3 05/25/54,2054-05-25,2.231801612730237,NO ACTION,0.41181805631046475,0.9885043966679984,0.6405764146279868,-0.6827450535173312,0.5534487905283405,136.6838284411595,0.6110404217108897,-0.057591631182549174,-9.425175191974583,0.4954595976677079,-0.08364154135724317,-16.881606504911982,0.6894733554062517,-0.0488969407782649,-7.091925987518579,-0.6827450535173312,0.0,0.0,141.00301348733825,-4.319185046178745,-3.063186338397143,0.6620293705069576,-0.10858057997861714,-16.401172391392983,0.5734960942359243,-0.16167803792545954,-28.19165408993756,0.7371430281861191,-0.09656661355813234,-13.100118776913758,-0.6827450535173312,0.0,0.0,145.617,-8.933171558840485,-6.134703749031373,0.7678269527116883,-0.21437816218334782,-27.920113853027683,0.7227154285690058,-0.3108973722585411,-43.017950865160074,0.8225673401798516,-0.1819909255518648,-22.124744619643984,-0.6827450535173312,0.0,0.0,130.144,6.5398284411595,5.025071029518835,0.7430890961256738,-0.18964030559733325,-25.52053367947782,0.694776845005743,-0.28295878869527824,-40.72657093520182,0.8055147743073787,-0.16493835967939197,-20.47614306933101,-0.6827450535173312,0.0,0.0,145.073,-8.389171558840502,-5.782724254866328,0.9022054516397139,-0.3487566611113734,-38.65601306353492,0.9205876896353895,-0.5087696333249248,-55.26574312544361,0.9375106771876756,-0.2969342625596888,-31.672626948971192,-0.6827450535173312,0.0,0.0,94.037,42.6468284411595,45.35111545096546,59.25925925925925,0.531092607412936,62.96296296296296,0.4033591166413357,62.96296296296296,0.5903678775469852,25.925925925925924,-0.7087717273537766,90.74074074074075,1.4349562791061974,FRTR 3 05/25/54,100.0,0.0,100.0,0.0,100.0,0.0,100.0,0.0,100.0,0.0,0.9634859873405626,0.02501840932743582,rising,85.18518518518519,100.0,1.0,1.0,1.0,1,1,0.5777005225583931,0.4737113337924057,0.6985556526959182,0.8312800618947445,Above Median,Top Decile,Top Decile,Top Decile,Moderate,13.863960747269743,"['YAS_RISK', 'REL_SPRD_LOG', 'AMT_OUTSTANDING']","[0.3408626721184877, 0.2250658959104239, 0.16651633899443316]",0.7324449070233447,-0.6745110574767631,0.0
2025-11-06,FR001400FYQ4,FRTR 2 1/2 09/24/26,2026-09-24,2.015947196559263,WEAK BUY,0.730669178375558,0.9103501430454681,0.9806911328155091,-1.5341903225019464,0.8061652705546718,-6.171401237798476,0.7865471783240925,0.01961809223057931,2.4942041013940766,0.693592433651801,0.037076744723756994,5.345609667911888,0.9588909775808138,0.021800155234695362,2.273475871297422,-1.5341903225019464,0.0,0.0,-6.523796356835628,0.35239511903715126,5.401687901059989,0.5826536634736382,0.22351160708103357,38.360971063395546,0.4142193893013596,0.3164497890741984,76.39666070877809,0.7961810782143016,0.1845100546012075,23.174382980514157,-1.5341903225019464,0.0,0.0,-6.809,0.6375987622015238,9.36405876435773,0.7094385369019931,0.0967267336526787,13.634265303889839,0.5772746714520763,0.15339450692348167,26.57218683792492,0.8937488840869164,0.08694224872859269,9.727816090605156,-1.5341903225019464,0.0,0.0,-6.457,0.28559876220152347,4.423087529180962,-0.9351817142620277,1.7413469848166994,186.20412906281229,-0.4497064943907034,1.1803756727662615,262.47689576238713,-0.8260734365097756,1.8067645693252847,218.71718271044847,-1.5341903225019464,0.0,0.0,-3.691,-2.4804012377984765,-67.20133381409762,1.4321398606877378,-0.625974590133066,-43.709040083666025,1.694401453440531,-0.9637322750649729,-56.877445862687516,1.379617825347299,-0.3989266925317899,-28.9157390047343,-1.5341903225019464,0.0,0.0,-14.361,8.189598762201523,57.02666079311229,68.51851851851852,0.7749498845058489,74.07407407407408,0.7156608842921354,72.22222222222221,0.9228829766013728,9.25925925925926,-1.5581381155004503,9.25925925925926,-1.3367528800650232,FRTR 2 1/2,100.0,1.4338969098224439,100.0,1.3338294090460965,100.0,1.3914669661251609,25.0,-1.3329030617797533,25.0,-0.7281209915722291,0.8889786580822481,0.021371484963220055,rising,7.4074074074074066,25.0,1.0,1.0,1.0,1,1,0.8414908588439927,0.8404834750333198,1.0694545080541074,1.8679620155100283,Above Median,Top Decile,Bottom Decile,Below Median,Very Tight,0.8596416661617923,"['Issue_Age', 'YAS_RISK', 'AMT_OUTSTANDING']","[0.27627709051546584, 0.21798621146429958, 0.17167450885174465]",0.66593781083151,-1.482820698710619,0.0
2025-11-06,FR001400H7V7,FRTR 3 05/25/33,2033-05-25,3.3856984247571447,WEAK SELL,-0.645023616140832,0.9866708143260042,-0.5649883181138082,-1.2561526721160237,-0.9173142353319003,57.80830754811627,-0.8365566543536003,-0.08075758097829999,-9.653569736450624,-0.5290186130486141,-0.11600500309221795,-21.92834014494754,-0.4974562816756629,-0.06753203643814532,-13.575471366673478,-1.2561526721160237,0.0,0.0,59.99648079871045,-2.1881732505941827,-3.64716933576627,-0.5046288522571454,-0.4126853830747549,-81.77998008850739,-0.046119395879303006,-0.598904220261529,-1298.5948297532148,-0.22942741013086645,-0.3355609079829418,-146.26015835053033,-1.2561526721160237,0.0,0.0,64.935,-7.126692451883734,-10.975117349328132,0.27729094121146647,-1.1946051765433667,-430.8128957415354,0.10463063187919963,-0.7496542480200317,-716.476774447717,0.25024059808498056,-0.8152289161987888,-325.77802717053055,-1.2561526721160237,0.0,0.0,57.386,0.42230754811626525,0.7359069251083444,0.8955277985714201,-1.8128420339033204,-202.432801812736,0.9994214161621698,-1.6444450323030018,-164.53970159692852,0.7584910320529837,-1.3234793501667919,-174.48846153602184,-1.2561526721160237,0.0,0.0,67.792,-9.983692451883734,-14.726947796806467,-0.5825399675621445,-0.3347742677697557,-57.468033210483384,-0.16570981566320933,-0.47931380047762273,-289.24887136854875,-0.29482787583495285,-0.2701604422788554,-91.63327326170683,-1.2561526721160237,0.0,0.0,20.606,37.202307548116266,180.54114107571652,29.629629629629626,-0.8881115010719652,33.33333333333333,-0.6317745228325352,35.18518518518518,-0.588259376987455,12.962962962962962,-1.2807793192519201,50.0,-0.095404241715889,FRTR 3 05/25/33,100.0,0.0,100.0,0.0,100.0,0.0,100.0,0.0,100.0,0.0,0.9825506090004074,0.004120205325596871,rising,72.22222222222221,100.0,-1.0,-1.0,-1.0,1,1,0.9575102921366945,0.7419660037910527,0.6161259988861242,1.5294357178368776,Below Median,Top Decile,Above Median,Top Decile,Tight,6.602850533864313,"['Issue_Age', 'YAS_RISK', 'AMT_OUTSTANDING']","[0.48760969915728525, 0.11179500265538012, 0.08825086050887312]",0.6876555623215385,-1.2188688962642185,0.0
2025-11-06,FR001400HI98,FRTR 2 3/4 02/25/29,2029-02-25,-1.1384852750345864,WEAK BUY,0.8217100237705708,0.9490622656157712,1.3037855816568327,-0.7371582825218662,0.9548524917378668,16.427888254388012,0.8644967524130572,0.09035573932480956,10.451830851581317,0.6911007600928498,0.13060926367772097,18.89872929242627,1.2292774955435846,0.0745080861132481,6.0611282462458105,-0.7371582825218662,0.0,0.0,16.917340829776965,-0.4894525753889525,-2.8932004150328705,-0.6124969566881953,1.5673494484260622,255.8950547789333,-0.06997449573119435,0.8916845195017651,1274.2991324971313,-0.8904727098993798,2.1942582915562125,246.41499312906024,-0.7371582825218662,0.0,0.0,18.361,-1.9331117456119884,-10.528357630625525,0.9124322022773141,0.04242028946055265,4.649144220223992,0.7565030909639706,0.06520693280660017,8.619519566213347,1.2670967278099972,0.03668885384683551,2.8955053510947524,-0.7371582825218662,0.0,0.0,20.619,-4.1911117456119875,-20.32645493757865,1.0788909859743139,-0.12403849423644708,-11.496851368606675,0.9893879033439709,-0.16767787957340008,-16.947637757841207,1.4012242014243528,-0.09743861976752011,-6.953820735688914,-0.7371582825218662,0.0,0.0,29.371,-12.943111745611986,-44.06765769366117,-0.7740538478031178,1.7289063395409845,223.35737004759366,-0.3079761080136557,1.1296861317842266,366.8096536414347,-1.0172688720496232,2.3210544537064557,228.16528595959085,-0.7371582825218662,0.0,0.0,-0.787,17.21488825438801,2187.4063577696793,77.77777777777779,0.9184247417548409,77.77777777777779,0.8048317072177051,88.88888888888889,1.2387581120054272,24.074074074074073,-0.7630521015252077,25.925925925925924,-0.8982764041458385,FRTR 2 3/4,100.0,0.5939811394391817,100.0,0.5982965809336819,100.0,0.6098649066657637,66.66666666666666,0.5172945408657692,66.66666666666666,0.16254897788449224,0.9451230260357598,0.003939239580011411,rising,16.666666666666664,33.33333333333333,1.0,1.0,-1.0,1,0,0.9966934482168727,0.9452071015008944,1.4217925717710693,0.8975311934727115,Top Quartile,Top Decile,Below Median,Above Median,Very Tight,3.154791244081423,"['REL_SPRD_LOG', 'AMT_OUTSTANDING', 'Issue_Age']","[0.3568940930905991, 0.20943436958327702, 0.1618661818988608]",0.728194644572737,-0.7261676221641008,0.0
2025-11-06,FR001400L834,FRTR 3 1/2 11/25/33,2033-11-25,4.309364365870934,NO ACTION,0.23096435226774525,0.9915310563829469,0.7773199068705059,1.5623610018861396,0.7721508533250445,62.48482883948442,0.8420252910952317,-0.0698744377701872,-8.298377457221385,0.33636938296049956,-0.10540503069275431,-31.336094454090897,0.8331606007975999,-0.05584069392709401,-6.702272431438722,1.5623610018861396,0.0,0.0,64.70833673109905,-2.2235078916146307,-3.436200037888449,0.93760010045765,-0.16544924713260545,-17.646035371289404,0.47677950743556385,-0.2458151551678186,-51.55740676318802,0.9135143581663735,-0.1361944512958676,-14.908846104877382,1.5623610018861396,0.0,0.0,69.68,-7.195171160515585,-10.326020607753994,0.9178991656712752,-0.14574831234623065,-15.878466416493122,0.4490617261122773,-0.21809737384453204,-48.567347494956,0.8969785367142786,-0.11965862984377273,-13.340188601176042,1.5623610018861396,0.0,0.0,61.252,1.2328288394844193,2.0127160570808265,1.335387647426741,-0.5632367941016965,-42.177774443942354,1.0496222002548554,-0.8186578479871102,-77.99547684764926,1.2423898852106754,-0.4650699783401695,-37.43349653220629,1.5623610018861396,0.0,0.0,71.573,-9.088171160515572,-12.69776474263451,1.4557672694542194,-0.6836164161291749,-46.959182678255345,1.2357960051072028,-1.0048316528394574,-81.31047847344696,1.3314960011996009,-0.554176094329095,-41.62055985656423,1.5623610018861396,0.0,0.0,23.965,38.51982883948442,160.73369006222012,64.81481481481481,0.7421278731884432,55.55555555555556,0.22622023410290348,66.66666666666666,0.7240559346542187,98.14814814814815,1.5308526980169257,51.85185185185185,-0.004669328297079943,FRTR 3 1/2,50.0,-0.7071067630698052,50.0,-0.7071067709983383,50.0,-0.7071067634029159,100.0,0.7071067658587421,100.0,0.7071067810474332,0.9732803767724819,0.018250679610465004,rising,94.44444444444444,100.0,1.0,1.0,1.0,1,1,0.8059859540644263,0.26567662513750834,0.8476759407584548,1.9022613838928042,Above Median,Above Median,Above Median,Top Decile,Tight,7.0928730815822405,"['Issue_Age', 'YAS_RISK', 'GREEN_BOND_LOAN_INDICATOR']","[0.4646285168161712, 0.3486534300739172, 0.09453005632448222]",0.9078120032145706,1.456854206128838,0.0
2025-11-06,FR001400NBC6,FRTR 2 1/2 09/24/27,2027-09-24,-3.092855956410727,WEAK SELL,-0.826801434151492,0.9701606060128718,-1.1014174712555478,-0.4641697557638748,-1.02763096740928,-0.2060650360494665,-1.0213280438334544,-0.006302923575825625,-0.6171301720508138,-0.8191350509093996,-0.007666383242092345,-0.9359119891146113,-1.0970574402086084,-0.004360031046939383,-0.3974296009849176,-0.4641697557638748,0.0,0.0,-0.3156681994156781,0.10960316336621159,34.72100138594698,-0.8919271313656033,-0.13570383604367675,-15.214677270152874,-0.6374014095510235,-0.18940002460046845,-29.71440269679335,-0.9939346318169305,-0.10748283943861725,-10.81387396279263,-0.4641697557638748,0.0,0.0,1.169,-1.3750650360494665,-117.62746144454408,-0.9097436039766224,-0.11788736343265771,-12.95830623282474,-0.6652195255588266,-0.1615819085926654,-24.290012538030222,-1.009921412322374,-0.0914960589331737,-9.059720579327161,-0.4641697557638748,0.0,0.0,3.376,-3.5820650360494666,-106.10382184357479,1.630730233633694,-2.658361201042974,-163.0166124299902,1.9996170339748751,-2.8264184681263673,-141.34798843822423,1.478429047481448,-2.579846518736996,-174.4991757082919,-0.4641697557638748,0.0,0.0,10.422,-10.628065036049467,-101.97721191567592,1.6499380867272229,-2.677569054136503,-162.28300076515984,2.0437297421151626,-2.8705311762666543,-140.45551635659226,1.48307974726485,-2.584497218520398,-174.26555826551245,-0.4641697557638748,0.0,0.0,-8.196,7.9899349639505335,97.4857851903606,18.51851851851852,-0.9945609811350593,27.77777777777778,-0.8098185375964068,12.962962962962962,-1.1127024059252444,31.48148148148148,-0.4907301010113892,14.814814814814813,-1.2210120911202917,FRTR 2 1/2,50.0,-0.5084868774743956,50.0,-0.4400163202809176,50.0,-0.5662396555624053,75.0,0.43502783337513373,50.0,-0.6135862911799616,0.9414238503848606,0.028736755628011146,rising,33.33333333333333,50.0,-1.0,-1.0,-1.0,1,1,1.0726610248850628,0.9510637140643134,1.2011079130511464,0.5651524845375794,Bottom Quartile,Above Median,Bottom Quartile,Above Median,Very Tight,1.825785244080436,"['YAS_RISK', 'REL_SPRD_LOG', 'Issue_Age']","[0.3243806157222694, 0.29945211748655104, 0.12568527161937054]",0.7495180048281911,-0.4670091463787382,0.0
2025-11-06,FR001400NEF3,FRTR 3 06/25/49,2049-06-25,-5.184135678035844,WEAK SELL,-0.9249782082456502,0.9538903233869509,-1.0695892446128923,0.928068805949358,-0.9858471792050372,121.3566284584881,-1.0618026662772464,0.07595548707220923,7.153446564903605,-1.0298688190425545,0.1048906107969042,10.184851491662158,-1.1263342412756476,0.05674499666275534,5.038024600467215,0.928068805949358,0.0,0.0,123.95260774759666,-2.5959792891085556,-2.094332129087019,-1.1209018222978806,0.13505464309284343,12.048748534559675,-1.117665859161773,0.19268765091612272,17.24018387182518,-1.1700960343764066,0.10050678976351435,8.589618796385098,0.928068805949358,0.0,0.0,128.869,-7.512371541511897,-5.829463673132366,-0.9153816817274569,-0.07046549747758024,-7.697936075671527,-0.8168670117785711,-0.10811119646707912,-13.234858745024097,-1.0046409302766366,-0.0649483143362557,-6.464828550424355,0.928068805949358,0.0,0.0,113.95,7.4066284584881,6.499893337286627,-0.9126668926671442,-0.07318028653789299,-8.018290827029402,-0.8177279956257997,-0.10725021261985057,-13.115634035032587,-1.0052545642758357,-0.06433468033705658,-6.399839601167886,0.928068805949358,0.0,0.0,127.534,-6.177371541511903,-4.843705632245152,-1.1432512810567612,0.15740410185172404,13.768110570531523,-1.1561899072223807,0.23121169897673044,19.997726630603317,-1.1897000258244956,0.12011078121160335,10.095887836833022,0.928068805949358,0.0,0.0,76.61,44.746628458488104,58.40833892787792,20.37037037037037,-0.9542419611128906,18.51851851851852,-0.905978713835647,14.814814814814813,-1.0815853581502846,83.33333333333334,0.8981091839976106,81.48148148148148,1.1375745124611025,FRTR 3 06/25/49,100.0,0.0,100.0,0.0,100.0,0.0,100.0,0.0,100.0,0.0,0.9806782884408237,-0.02678796505387282,falling,18.51851851851852,100.0,-1.0,-1.0,-1.0,1,1,1.029046300825377,1.0639957477401705,1.166398880484866,1.129975369982787,Bottom Quartile,Top Decile,Top Quartile,Top Decile,Moderate,13.16943554118879,"['GREEN_BOND_LOAN_INDICATOR', 'AMT_OUTSTANDING', 'Cpn']","[0.7057884135743941, 0.1270586178578496, 0.025419882243917644]",0.8582669136761615,0.8546963035468949,0.0
2025-11-06,FR001400OHF4,FRTR 3 1/4 05/25/55,2055-05-25,3.657697767176643,WEAK BUY,0.6688499833849151,0.9871188389381991,1.0972815926632877,-0.35892986789411313,0.8211382093369413,139.17608440422157,0.8689181788232722,-0.0477799694863309,-5.498788044825793,0.7394416692924304,-0.0705916859075153,-9.546619819302622,1.1374584713476743,-0.040176878684386574,-3.532162214552617,-0.35892986789411313,0.0,0.0,143.5678145633074,-4.391730159085824,-3.058993530087731,0.9996528242762996,-0.17851461493935838,-17.857661061761938,0.9330251977384654,-0.2641752143535503,-28.31383462767072,1.2503671272002603,-0.1530855345369726,-12.24324680187546,-0.35892986789411313,0.0,0.0,148.573,-9.396915595778438,-6.324780138481392,1.0509424900018662,-0.22980428066492498,-21.866494186362896,1.0060615850969337,-0.3372116017120186,-33.517987701292626,1.2900918545168165,-0.19281026185352879,-14.94546761797795,-0.35892986789411313,0.0,0.0,132.957,6.219084404221576,4.677515590569752,1.05575444087866,-0.23461623154171884,-22.22261353920484,1.0179046715310613,-0.34905468814614626,-34.29149059626315,1.2960990084037103,-0.19881741574042255,-15.339677981184513,-0.35892986789411313,0.0,0.0,148.311,-9.134915595778438,-6.159297419046805,1.4066159792074133,-0.5854777698704721,-41.62314194937963,1.5642150522308433,-0.8953650688459283,-57.2405349152553,1.5041855271846625,-0.40690393452137474,-27.051445746710495,-0.35892986789411313,0.0,0.0,97.931,41.24508440422157,42.116474252289805,70.37037037037037,0.7893979334860447,70.37037037037037,0.6551114851076912,75.92592592592592,1.0368683063503368,37.03703703703704,-0.3857471658715904,94.44444444444444,1.4833115874511722,FRTR 3 1/4,100.0,0.7071067761362932,100.0,0.7071067754757147,100.0,0.7071067771094,50.0,-0.7071067750024734,100.0,0.7071067808359394,0.960355537637121,0.02676330130107807,rising,75.92592592592592,50.0,1.0,1.0,1.0,1,1,0.8571199011452586,0.7693733018287893,1.1965976917824392,0.43701706993226397,Above Median,Top Decile,Top Decile,Top Decile,Moderate,14.46345750073661,"['Issue_Age', 'YAS_RISK', 'AMT_OUTSTANDING']","[0.5184881701652254, 0.1558430357058546, 0.08340717388986399]",0.7577383797609439,-0.3671008855589399,0.0
2025-11-06,FR001400PM68,FRTR 2 3/4 02/25/30,2030-02-25,-1.1718052345897547,WEAK BUY,0.7816868935533381,0.9851227806075544,1.228647713281249,-1.742395201227342,0.9182651874922513,25.96842802751208,1.3110477642385872,-0.3927825767463359,-29.959440415849905,1.3731200474241596,-0.5914331538708215,-43.07220994064372,1.5235795912119732,-0.2949318779307242,-19.357825327676515,-1.742395201227342,0.0,0.0,27.28822857983976,-1.3198005523276812,-4.8365197029281815,1.7275508302778007,-0.8092856427855494,-46.84583654020923,2.0931368892950335,-1.3114499957416954,-62.654764539452266,1.6515384283080676,-0.42289071502681863,-25.60586573207782,-1.742395201227342,0.0,0.0,30.646,-4.677571972487922,-15.263238174514122,1.0479785703680025,-0.12971338287575118,-12.377484168636514,0.9716664861492751,-0.189979592595937,-19.551934058530183,1.3401353219777954,-0.11148760869654639,-8.319130615861834,-1.742395201227342,0.0,0.0,30.193,-4.224571972487922,-13.99189206467967,1.6282387942409018,-0.7099736067486505,-43.603776356358615,1.913689961292254,-1.132003067738916,-59.15289752887769,1.6334200770685645,-0.4047723637873155,-24.780665242934827,-1.742395201227342,0.0,0.0,40.179,-14.210571972487923,-35.368157417932515,1.5343276386260005,-0.6160624511337492,-40.151948750023294,1.749839875861473,-0.968152982308135,-55.32808973727893,1.6100373920464617,-0.3813896787652127,-23.68824961957044,-1.742395201227342,0.0,0.0,5.527,20.441428027512078,369.8467159494736,75.92592592592592,0.8831200382840734,75.92592592592592,0.7656306712206978,83.33333333333334,1.16529914534034,7.4074074074074066,-1.7658346431332803,33.33333333333333,-0.7131687148296502,FRTR 2 3/4,66.66666666666666,0.5605581380647695,66.66666666666666,0.5561474945513806,66.66666666666666,0.5442133405318756,33.33333333333333,-1.1526857121495981,100.0,0.9087676166155018,0.9741680252924876,0.010954755315066844,rising,68.51851851851852,100.0,1.0,1.0,1.0,1,1,0.9585029143437795,0.8991687840759315,1.3398538967173397,2.121463031126308,Top Quartile,Above Median,Below Median,Top Decile,Very Tight,4.035674201249151,"['Issue_Age', 'AMT_OUTSTANDING', 'GREEN_BOND_LOAN_INDICATOR']","[0.47870465495082665, 0.11976103617454548, 0.051209063933319594]",0.6496747550586917,-1.6804775733872035,0.0
2025-11-06,FR001400QMF9,FRTR 3 11/25/34,2034-11-25,5.014726982054171,WEAK BUY,0.8999174202964744,0.9889031599188374,0.9958220553747016,1.2635403505343903,1.134036116457103,70.27834229527001,1.086878634042504,0.04715748241459883,4.338799246179196,0.839236353374722,0.06068106692175235,7.230509731220742,0.9583257883710254,0.03749626700367614,3.912684711964635,1.2635403505343903,0.0,0.0,72.47197442318668,-2.193632127916672,-3.0268695520901314,1.2152169587481256,-0.08118084229102274,-6.680357860263622,1.0279400272398778,-0.1280226069434034,-12.454287439484988,1.0650335111790752,-0.0692114558043736,-6.498523701653176,1.2635403505343903,0.0,0.0,77.985,-7.706657704729992,-9.882230818416065,1.2322668164090538,-0.09823069995195088,-7.971544623838067,1.050135027500783,-0.15021760720430866,-14.3045991077311,1.0765956675850323,-0.08077361221033075,-7.502687767753094,1.2635403505343903,0.0,0.0,68.413,1.8653422952700112,2.72659040679016,0.7737311599633805,0.3603049564937224,46.567201953460795,0.38931014550065085,0.5106072747958235,131.15693684876655,0.6971760769225107,0.2986459784521909,42.836520651544454,1.2635403505343903,0.0,0.0,77.846,-7.567657704729996,-9.721318633915505,1.1594170283021867,-0.025380911845083842,-2.189109785918865,1.1938208202355847,-0.2939033999391103,-24.61871936688459,1.1472281705454457,-0.1514061151707441,-13.197558928404163,1.2635403505343903,0.0,0.0,29.689,40.58934229527001,136.71508734412913,81.48148148148148,1.091326923753888,79.62962962962963,0.8814326864465645,74.07407407407408,0.9376758095618687,92.5925925925926,1.2327616443841434,55.55555555555556,0.14654216515730953,FRTR 3 11/25/34,100.0,0.0,100.0,0.0,100.0,0.0,100.0,0.0,100.0,0.0,0.9537469712066355,0.03515618871220183,rising,87.03703703703704,100.0,1.0,1.0,1.0,1,1,1.1837287718199676,1.035168504487041,1.0859549461640032,1.5384306270511448,Top Quartile,Top Decile,Above Median,Top Decile,Tight,7.588298990294362,"['Issue_Age', 'YAS_RISK', 'GREEN_BOND_LOAN_INDICATOR']","[0.7293888356928393, 0.09120111547841733, 0.06388092310938052]",0.8844708742806372,1.173172303972701,0.0
2025-11-06,FR001400WYO4,FRTR 3.6 05/25/42,2042-05-25,1.1434483045634067,NO ACTION,0.47341560423671925,0.9849110382672348,0.29913753886324557,1.7927130585253617,0.7990993107435471,106.45040751570843,0.7445440495690466,0.05455526117450049,7.327338184133509,0.3932899567439809,0.08012564749273837,20.373173553368982,0.25347025071234275,0.04566728815090282,18.016822968722757,1.7927130585253617,0.0,0.0,109.03166126314918,-2.5812537474407407,-2.367435034282484,0.7485801249697569,0.05051918577379022,6.7486676995284185,0.40189820471867216,0.07151739951804709,17.794903510111162,0.2579271713381027,0.041210367525142844,15.977520209908553,1.7927130585253617,0.0,0.0,113.419,-6.9685924842915625,-6.144113846601673,0.9295449334636156,-0.13044562272006843,-14.033277641639321,0.6637716078522512,-0.19035600361553195,-28.677936581781243,0.41140026419035874,-0.11226272532711318,-27.287955883852465,1.7927130585253617,0.0,0.0,98.809,7.641407515708437,7.733513662657335,-0.2314389636796116,1.0305382744231588,445.274301920197,-0.035554226330911945,0.5089698305676312,1431.5307628337869,-0.06884908149841353,0.3679866203616591,534.4828992698307,1.7927130585253617,0.0,0.0,109.871,-3.4205924842915607,-3.113280559911381,,,,,,,,,,,,,,,,66.66666666666666,0.7681316282551711,64.81481481481481,0.46369142149801085,57.407407407407405,0.25655820826553144,100.0,1.7606423292202784,74.07407407407408,0.8483606754277503,FRTR 3.6 05/25/42,100.0,0.0,100.0,0.0,100.0,0.0,100.0,0.0,100.0,0.0,0.9792336711407102,0.005677367126524557,rising,66.66666666666666,100.0,1.0,1.0,1.0,1,1,0.8341152737038273,0.5445665479807064,0.3262127888798725,2.1827278199572486,Above Median,Top Decile,Above Median,Top Decile,Moderate,11.673540775809954,"['Issue_Age', 'AMT_OUTSTANDING', 'YAS_RISK']","[0.6050633405548789, 0.26790086382193856, 0.05284078904740162]",0.9258049934242192,1.675536245999207,0.0
2025-11-06,FR001400X8V5,FRTR 3.2 05/25/35,2035-05-25,5.607634974961499,MODERATE BUY,1.4622205702143012,0.9800189254244002,1.3464169963380146,0.027761439872673793,1.3135415372901142,74.21595920720019,1.3414910652422203,-0.027949527952106035,-2.0834673049956334,1.5140465425189618,-0.05182597230466057,-3.423010489237352,1.3596262755839263,-0.013209279245911754,-0.9715375015891731,0.027761439872673793,0.0,0.0,76.56431240621438,-2.3483531990141984,-3.0671642243036414,1.1823302240616131,0.1312113132285011,11.097687384492907,1.2583664388586957,0.20385413135560548,16.199901987254638,1.2782067328481233,0.06821026348989134,5.336403040552267,0.027761439872673793,0.0,0.0,81.845,-7.629040792799813,-9.321327865926667,1.30307742716691,0.01046411012320414,0.8030305663149782,1.4478671594828756,0.014353410731425598,0.9913485873536385,1.3427028958165481,0.003714100521466479,0.2766137248513509,0.027761439872673793,0.0,0.0,71.91,2.305959207200189,3.2067295325817224,1.4038698346279264,-0.09032829733781211,-6.434235886144575,1.6224049975293917,-0.16018442731509053,-9.873270026392508,1.3833319258687657,-0.03691492953075115,-2.668551818516912,0.027761439872673793,0.0,0.0,81.252,-7.03604079279981,-8.65952935550369,,,,,,,,,,,,,,,,92.5925925925926,1.2645396210152406,94.44444444444444,1.4321858609613451,92.5925925925926,1.2804369583402282,47.22222222222222,4.430049257717744e-16,59.25925925925925,0.2229406903259821,FRTR 3.2 05/25/35,100.0,0.0,100.0,0.0,100.0,0.0,100.0,0.0,100.0,0.0,0.9548824268528097,0.025136498571590504,rising,51.85185185185185,100.0,1.0,1.0,1.0,1,1,1.371099992413474,1.6819817538372155,1.4682826001703484,0.0338010965246161,Top Decile,Top Decile,Above Median,Top Decile,Tight,7.968563365629677,"['Issue_Age', 'AMT_ISSUED', 'REL_SPRD_LOG']","[0.7360230709184626, nan, 0.1316286497854366]",,,0.0
2025-11-06,FR001400XJJ3,FRTR 3 3/4 05/25/56,2056-05-25,6.4062555824581295,WEAK BUY,1.1643047959491741,0.9685411856202121,1.2302140948055196,0.4563279308472899,1.1963281561476389,142.83145753920547,1.2255917258495814,-0.02926356970194255,-2.3877094505420287,1.2054642051505113,-0.041159409201337205,-3.4144032385231893,1.2491398592018625,-0.01892576439634297,-1.515103701592327,0.4563279308472899,0.0,0.0,147.26043030335646,-4.428972764150984,-3.0075783119243527,1.3830221265576064,-0.1866939704099675,-13.498986420756484,1.46238739937242,-0.2980826034232458,-20.38328568153956,1.3403129528723,-0.11009885806678033,-8.2144141791211,0.4563279308472899,0.0,0.0,152.292,-9.460542460794528,-6.212107307129275,1.353548610121451,-0.157220453973812,-11.615427154711663,1.4118058872743329,-0.24750109132515874,-17.53081580144908,1.3263285569958216,-0.09611446219030206,-7.24665551070837,0.4563279308472899,0.0,0.0,136.328,6.5034575392054705,4.7704488723728256,1.286959258017779,-0.09063110187014023,-7.042266536510787,1.3076388177324987,-0.14333402178332455,-10.961285237443724,1.2927724661975273,-0.0625583713920077,-4.8390859601229,0.4563279308472899,0.0,0.0,151.207,-8.37554246079452,-5.5391234931191065,,,,,,,,,,,,,,,,85.18518518518519,1.1514352601073978,83.33333333333334,1.1403894190624773,85.18518518518519,1.166830527194308,57.407407407407405,0.42752010702214777,96.29629629629629,1.5542339556500289,FRTR 3 3/4,100.0,0.0,100.0,0.0,100.0,0.0,100.0,0.0,100.0,0.0,0.9584769870421904,0.010064198578021655,rising,27.77777777777778,100.0,1.0,1.0,1.0,1,1,1.248750404347337,1.3392913918620784,1.3415620530638281,0.5556046267121092,Top Quartile,Top Decile,Top Decile,Top Decile,Moderate,15.553670246676177,"['Issue_Age', 'AMT_OUTSTANDING', 'YAS_RISK']","[0.44717143842892876, 0.2141983757526256, 0.1600490284548226]",0.821418842636377,0.406854602618978,0.0
2025-11-06,FR001400XLW2,FRTR 2.4 09/24/28,2028-09-24,-2.1140780794219936,NO ACTION,-0.5284110413419058,0.9813615105531914,-0.4487692683181764,0.027761439872673793,-0.6016937069482633,11.23511393520424,-0.57168609696375,-0.03000760998451335,-5.248966105523376,-0.5006831757925277,-0.027727865549378006,-5.53800613565398,-0.4323626329711759,-0.016406635347000487,-3.794646834947361,0.027761439872673793,0.0,0.0,11.709598380688126,-0.4744844454838866,-4.052098369669218,-0.5598695823754194,-0.0418241245728439,-7.470333295900596,-0.4788625538797943,-0.049548487462111435,-10.347120697985751,-0.4192179467778114,-0.029551321540364994,-7.049154517974862,0.027761439872673793,0.0,0.0,13.369,-2.1338860647957603,-15.961448598994805,0.3882390145290841,-0.9899327214773475,-254.98022067155404,0.2878366606868549,-0.8162477020287606,-283.5801637369472,0.2996381350204867,-0.7484074033386631,-249.7704033268172,0.027761439872673793,0.0,0.0,16.011,-4.77588606479576,-29.828780599668235,0.7971128925408494,-1.3988065994891126,-175.48412464913378,1.1233291518676742,-1.65174019320958,-147.039732366901,0.7723946866137784,-1.2211639549319548,-158.10102791818818,0.027761439872673793,0.0,0.0,25.072,-13.83688606479576,-55.188601066037414,,,,,,,,,,,,,,,,46.2962962962963,-0.5835553334716537,38.88888888888889,-0.5175572260447855,44.44444444444444,-0.47463715839974124,47.22222222222222,4.430049257717744e-16,22.22222222222222,-0.9990277744270398,FRTR 2.4 09/24/28,100.0,0.0,100.0,0.0,100.0,0.0,100.0,0.0,100.0,0.0,0.9400717358636039,0.0412897746895875,rising,57.407407407407405,100.0,-1.0,-1.0,-1.0,1,1,0.6280594968728346,0.6078274018077517,0.4893878419203619,0.0338010965246161,Below Median,Top Decile,Bottom Quartile,Top Decile,Very Tight,2.7520093670716506,"['Issue_Age', 'AMT_ISSUED', 'REL_SPRD_LOG']","[0.38196533155644674, nan, 0.21594837276318526]",,,0.0
2025-11-06,FR001400Z2L7,FRTR 2.7 02/25/31,2031-02-25,0.4243609161436978,NO ACTION,0.664829325970362,0.9873067848494268,0.7231101875202298,0.027761439872673793,0.7148707482387833,36.56777616523856,0.6618954168617515,0.05297533137703181,8.003580207254798,0.5876251224340836,0.07720420353627844,13.138342673751918,0.6798005457873016,0.04330964173292817,6.37093355752993,0.027761439872673793,0.0,0.0,38.10904887117072,-1.5412727059321583,-4.044374633274264,1.002813936202337,-0.28794318796355367,-28.713520494404417,1.0852252018639517,-0.4203958758935896,-38.73812286129344,0.9584226779498464,-0.23531249042961655,-24.552057603412063,0.027761439872673793,0.0,0.0,42.267,-5.69922383476144,-13.483861720522047,1.3188677322249391,-0.6039969839861559,-45.796630294953516,1.5936730387386984,-0.9288437127683363,-58.28320391710604,1.1385727015041147,-0.4154625139838849,-36.48976563253804,0.027761439872673793,0.0,0.0,39.172,-2.6042238347614344,-6.648176845952765,,,,,,,,,,,,,,,,,,,,,,,,,,,,,,,62.96296296296296,0.6868557735751682,68.51851851851852,0.6511734139177556,64.81481481481481,0.6710574925534885,47.22222222222222,4.430049257717744e-16,38.88888888888889,-0.507517788499522,FRTR 2.7 02/25/31,100.0,0.0,100.0,0.0,100.0,0.0,100.0,0.0,100.0,0.0,0.9806462091701128,0.006660575679313996,rising,77.77777777777779,100.0,1.0,1.0,1.0,1,1,0.74619587554796,0.7647483686638035,0.788559643282553,0.0338010965246161,Above Median,Top Decile,Below Median,Top Decile,Very Tight,4.858246915075171,"['Issue_Age', 'AMT_ISSUED', 'REL_SPRD_LOG']","[0.6180997827375502, nan, 0.10045390192156427]",,,0.0
2025-11-06,DE0001030724,DBR 0 08/15/50,2050-08-15,-3.625192195226276,STRONG SELL,-1.8285868579421012,0.87070343787706,-1.670501591419078,0.0,-1.6981213024440165,22.08122229513188,-1.8363481482997126,0.1382268458556961,7.527267921987152,-2.064492207988284,0.23590535004618274,11.426797737026952,-1.6957961623445832,0.025294570925505244,1.4916044356046245,0.0,0.0,0.0,24.07768459779676,-1.996462302664881,-8.29175369303738,-1.718924961983325,0.020803659539308406,1.2102715289140742,-1.8641663445573973,0.035579486615296085,1.908600406198384,-1.6757069050500495,0.005205313630971542,0.31063389332710795,0.0,0.0,0.0,28.162,-6.080777704868119,-21.592137286801027,-1.5335992845730904,-0.16452201787092613,-10.727836042512283,-1.5445583444119837,-0.2840285135301175,-18.388979135608487,-1.6157644652683845,-0.05473712615069348,-3.3876921413067613,0.0,0.0,0.0,22.561,-0.47977770486811977,-2.126579959467496,-1.3769383705498002,-0.3211829318942163,-23.325875466262378,-1.2987209542746612,-0.52986590366744,-40.799056783022785,-1.5365460984470254,-0.13395549297205256,-8.717961162092317,0.0,0.0,0.0,34.823,-12.74177770486812,-36.59012061341386,0.5514222354496153,-2.249543537893632,-407.9529900102983,0.1709272082245489,-1.9995140661666502,-1169.8043687459228,1.0075102721779283,-2.678011863597006,-265.8049164330081,0.0,0.0,0.0,13.538,8.54322229513188,63.10549777530898,4.3478260869565215,-1.6242129858957708,4.3478260869565215,-1.750300603435636,2.1739130434782608,-1.6439627871821794,51.08695652173913,0.0,84.78260869565217,1.31245697796115,DBR 0 08/15/50,50.0,-0.7071067667480803,50.0,-0.7071067714399089,50.0,-0.7071067571655881,75.0,0.0,50.0,-0.7071067751948382,0.8683025504055668,0.0024008874714931405,rising,6.521739130434782,50.0,-1.0,-1.0,-1.0,1,1,1.8254767694928518,2.1091753485429776,1.8609655267253948,0.0,Bottom Decile,Above Median,Top Quartile,Above Median,Very Tight,10.958202755337965,,,,,0.0
2025-11-06,DE0001030732,DBR 0 08/15/31,2031-08-15,-4.599775509735684,MODERATE SELL,-1.1766283793159658,0.9405366103745351,-1.4361404784870995,0.0,-1.2790324429648092,-13.544319153217463,-1.2781164735743773,-0.0009159693904319255,-0.07166556430524454,-1.1719816587045613,-0.004646720611404476,-0.396484069289299,-1.4333751556206455,-0.002765322866453923,-0.19292387176643666,0.0,0.0,0.0,-12.628517957231953,-0.9158011959855106,-7.251850124945778,-1.389332144436757,0.11029970147194779,7.93904475036525,-1.3413225683278094,0.16469418901184363,12.278492263744894,-1.5071035432218383,0.07096306473473879,4.708572585011574,0.0,0.0,0.0,-11.189,-2.3553191532174633,-21.05030968909136,-1.2372325271597904,-0.04179991580501885,-3.3785011749671057,-1.119727969321721,-0.05690040999424473,-5.081627952952675,-1.4043392655228786,-0.03180121296422089,-2.2644964445917335,0.0,0.0,0.0,-11.274,-2.2703191532174642,-20.137654348090287,-1.3213497454656553,0.04231730250084609,3.202581475934288,-1.2336936873920097,0.05706530807604393,4.62556534062533,-1.4626550447948645,0.026514566307765053,1.812769608312309,0.0,0.0,0.0,-8.77,-4.774319153217464,-54.439214911899,-1.7693724908405584,0.49034004787574914,27.712652233648267,-1.9571793990827695,0.7805510197668037,39.88142406079208,-1.6410997027066325,0.20495922421953305,12.489138998232956,0.0,0.0,0.0,-32.207,18.662680846782536,57.94603918709576,10.869565217391305,-1.2183042570197238,10.869565217391305,-1.126254054266772,6.521739130434782,-1.4102294428240703,51.08695652173913,0.0,23.91304347826087,-0.8591627218799467,DBR 0 08/15/31,50.0,-0.707106736317636,50.0,-0.7071067482577003,50.0,-0.7071067265415371,75.0,0.0,50.0,-0.707106764985709,0.9273706292515594,0.013165981122975623,rising,19.565217391304348,50.0,-1.0,-1.0,-1.0,1,1,1.374957141577302,1.357176751692421,1.5998834935134938,0.0,Bottom Quartile,Above Median,Bottom Quartile,Above Median,Very Tight,4.942264976874355,,,,,0.0
2025-11-06,DE0001030740,OBL 1.3 10/15/27,2027-10-15,-1.306446855736656,WEAK SELL,-0.8957243131552336,0.940780865809085,-1.3581421070479993,0.0,-1.100019245275173,-20.745091915542933,-1.1610226018427474,0.061003356567574496,5.254278077388297,-0.9807460672946986,0.085021754139465,8.669089391006283,-1.4139772290427255,0.05583512199472618,3.948799206451656,0.0,0.0,0.0,-20.23318853183086,-0.5119033837120739,-2.5300183540213914,-1.080650502760538,-0.01936874251463494,-1.7923225211041818,-0.8634211500518358,-0.03230316310339776,-3.7412985224335276,-1.337849517189756,-0.020292589858243337,-1.5168065948993013,0.0,0.0,0.0,-18.566,-2.1790919155429336,-11.737002662766526,-1.2388517408724862,0.13883249559731325,11.206546344188293,-1.0733778657846937,0.17765355262946014,16.55088637816262,-1.4678196919130948,0.10967758486509549,7.472142847118507,0.0,0.0,0.0,-19.035,-1.7100919155429324,-8.983934408429413,-1.2856499563271462,0.18563071105197326,14.438666504405113,-1.1373375596700392,0.24161324651480565,21.243758489830043,-1.5046635524573202,0.14652144540932088,9.737821069450996,0.0,0.0,0.0,-18.811,-1.9340919155429326,-10.281707057119567,-1.7742950628068856,0.6742758175317127,38.00246237876472,-1.9296207148808482,1.0338964017256145,53.58029111080658,-1.7291020362802572,0.37095992923225785,21.45390609133151,0.0,0.0,0.0,-35.822,15.07690808445707,42.08840399823636,17.391304347826086,-1.0449209329759075,19.565217391304348,-0.8573761749507318,10.869565217391305,-1.3324400007836654,51.08695652173913,0.0,4.3478260869565215,-1.2980989274507875,OBL 1.3 10/15/27,50.0,-0.7071067386725988,50.0,-0.7071067500938312,50.0,-0.7071067274373561,75.0,0.0,50.0,-0.7071067679114259,0.9662932377424344,-0.02551237193334932,falling,21.73913043478261,100.0,-1.0,-1.0,-1.0,1,1,1.1825183367965488,1.0331692105256443,1.5129920585489918,0.0,Bottom Quartile,Above Median,Bottom Decile,Above Median,Very Tight,1.8587206150307625,,,,,0.0
2025-11-06,DE0001030757,DBR 1.8 08/15/53,2053-08-15,-0.4994719002802625,NO ACTION,0.09293738881195844,0.8986917404473922,0.7722138294528849,0.0,0.4381780645076592,28.12627642031314,-0.40846791623483814,0.8466459807424973,207.27355230719877,-0.032024536338264055,0.1249619251502225,390.20669904358203,-0.6745786943682116,1.4467925238210966,214.47349500546645,0.0,0.0,0.0,30.264092353662395,-2.1378159333492555,-7.063869313048015,0.41477235918429367,0.023405705323365555,5.64302423746212,0.054206357422798085,0.038731031389160356,71.45107342660796,0.7542798973336757,0.01793393211920913,2.377622941409677,0.0,0.0,0.0,35.47,-7.343723579686859,-20.70404166229618,0.7016000727048874,-0.2634220081972282,-37.545891839358696,0.4689692796704186,-0.37603189085846017,-80.18262584373642,0.9459818383993265,-0.17376800894644162,-18.36906376591373,0.0,0.0,0.0,31.35,-3.2237235796868617,-10.283009820282489,0.9189829446821052,-0.48080488017444595,-52.31923810173019,0.7676316393554894,-0.6746942505435309,-87.89296938316839,1.1021819138412363,-0.32996808438835146,-29.937715113161456,0.0,0.0,0.0,42.097,-13.970723579686862,-33.18698143898179,-1.1984735338831911,1.6366515983908503,136.56134561701816,-1.1313431544082042,1.2242805432201627,108.21478236981909,-1.2564351586803304,2.0286489881332153,161.46069759126235,0.0,0.0,0.0,17.936,10.19027642031314,56.81465440807133,56.52173913043478,0.44490085696714354,54.347826086956516,0.08895851297015812,76.08695652173914,0.7922094834335618,51.08695652173913,0.0,93.47826086956522,1.6809442511688266,DBR 1.8 08/15/53,50.0,-0.7071067623724481,50.0,-0.707106767870629,50.0,-0.7071067547112503,75.0,0.0,50.0,-0.707106773000639,0.9176263610476351,-0.01893462060024287,falling,13.043478260869565,50.0,1.0,-1.0,1.0,0,1,0.4710404825078406,0.1071982162557702,0.8602585733855231,0.0,Above Median,Above Median,Top Decile,Above Median,Very Tight,15.04486898332047,,,,,0.0
2025-11-06,DE0001102341,DBR 2 1/2 08/15/46,2046-08-15,-0.4341992308258255,NO ACTION,0.13306350540974243,0.9797790060615174,0.3199615412494273,0.0,0.336511831626775,20.31968714862738,0.3793755238749749,-0.042863692248199914,-11.298486175528087,0.19492964869564863,-0.0618661432859062,-31.737675887741766,0.34952609601283996,-0.029564554763412687,-8.458468267410796,0.0,0.0,0.0,21.63056993757548,-1.3108827889480992,-6.0603247724179035,0.8466507984782157,-0.5101389668514407,-60.25376244172883,0.8521600034266422,-0.7190964980168998,-84.38514911364153,0.6844554949557119,-0.3644939537062846,-53.253126180915054,0.0,0.0,0.0,27.146,-6.82631285137262,-25.146661934936837,-0.28314160962477625,0.6196534412515513,218.84929600696847,-0.04326470499260134,0.17632821040234378,407.55662075318764,-0.20935378860006518,0.5293153298494925,252.8329236865959,0.0,0.0,0.0,21.471,-1.1513128513726194,-5.362176195037035,-0.6733669464453649,1.0098787780721399,149.9745077191174,-0.6046348490049483,0.7376983544146908,122.00724841249244,-0.47311679024448805,0.7930783314939154,167.62844419899776,0.0,0.0,0.0,29.726,-9.406312851372618,-31.643385750549285,0.576533470498323,-0.24002163887154804,-41.631864755553636,0.5161929967110138,-0.3831294913012714,-74.22213906818057,0.4975522023936138,-0.17759066114418653,-35.69286935532596,0.0,0.0,0.0,5.646,14.67368714862738,259.89527316042955,54.347826086956516,0.3464319751897139,56.52173913043478,0.12736673284201602,54.347826086956516,0.34116861537759685,51.08695652173913,0.0,82.6086956521739,1.2050793979836565,DBR 2 1/2,60.0,0.26344155497582067,60.0,0.0688821324627383,60.0,0.24433707389450418,60.0,0.0,80.0,0.47829118579624125,0.9862612252426515,-0.006482219181134119,falling,67.3913043478261,100.0,1.0,1.0,1.0,1,1,0.36174949952635654,0.15348150632384688,0.356442281289472,0.0,Above Median,Above Median,Top Quartile,Top Quartile,Very Tight,14.149891418662008,,,,,0.0
2025-11-06,DE0001102432,DBR 1 1/4 08/15/48,2048-08-15,-0.65074981730179,NO ACTION,-6.0115163468263465e-05,0.9604002501791647,-0.5144339671903304,0.0,-0.3501519943372447,22.733674946419185,0.8219365516370762,-1.1720885459743209,-142.60085275192483,0.6818106436429928,-0.6818707588064611,-100.00881552131035,0.9077959829346157,-1.422229950124946,-156.66845427763224,0.0,0.0,0.0,25.18716379913513,-2.453488852715946,-9.741028689487024,0.7587923174548732,-1.1089443117921178,-146.14595742048655,0.5975130368994361,-0.5975731520629044,-100.01005922193333,0.8638354826605453,-1.3782694498508756,-159.55230614638373,0.0,0.0,0.0,29.82,-7.086325053580815,-23.763665496996808,-0.7523448069167178,0.4021928125794731,53.45857425159806,-0.5772572429598554,0.5771971277963871,99.98958433815079,-0.7831989499020157,0.26876498271168525,34.31630996360233,0.0,0.0,0.0,22.714,0.019674946419186767,0.08662035049099556,-1.004907393053396,0.6547553987161514,65.15579412856219,-0.9175169917462824,0.9174568765828142,99.99344697009931,-0.9823835293121886,0.46794956212185823,47.63410047052407,0.0,0.0,0.0,32.472,-9.738325053580816,-29.989914543550828,0.6274965750855839,-0.9776485694228285,-155.8014167183854,0.43317685801363215,-0.4332369731771004,-100.01387543239413,0.783234454405959,-1.2976684215962893,-165.68071000048505,0.0,0.0,0.0,9.726,13.007674946419185,133.74125985035016,50.0,-0.31863662412495464,50.0,-5.754148698883297e-05,39.130434782608695,-0.4909918495780989,51.08695652173913,0.0,86.95652173913044,1.352228416461342,DBR 1 1/4,100.0,0.0,100.0,0.0,100.0,0.0,100.0,0.0,100.0,0.0,0.9739560436622314,-0.01355579348306668,falling,36.95652173913043,100.0,-1.0,1.0,1.0,0,0,0.37641264527703294,6.933956695039715e-05,0.573087678356853,0.0,Above Median,Top Decile,Top Quartile,Top Decile,Very Tight,12.82500762279355,,,,,0.0
2025-11-06,DE0001102481,DBR 0 08/15/50,2050-08-15,-1.95621896600542,WEAK SELL,-0.8025921352803647,0.8801004027449625,-1.254198500479522,0.0,-1.0055270239557248,23.750195524352737,-1.0629037143025175,0.057376690346792714,5.398107941003177,-0.8848846575246362,0.08229252224427153,9.299802026683937,-1.3064956358656963,0.05229713538617431,4.002855696585329,0.0,0.0,0.0,25.679441730144177,-1.92924620579144,-7.51280430982067,-1.1370057389488,0.13147871499307517,11.563592806336437,-0.9830125051272132,0.1804203698468485,18.353822262730805,-1.369650730153977,0.11545222967445512,8.429318970869604,0.0,0.0,0.0,29.78,-6.029804475647264,-20.247832349303156,-1.2665367784911428,0.26100975453541797,20.608146317357708,-1.1443427071135546,0.3417505718331899,29.86435503301041,-1.4626957113076062,0.20849721082808426,14.254311938623434,0.0,0.0,0.0,23.646,0.10419552435273616,0.44064756960446333,-1.0911837409842975,0.0856567170285727,7.849889347353865,-0.901518798850673,0.09892666357030833,10.973333290342307,-1.3162149324110273,0.0620164319315053,4.711725261065972,0.0,0.0,0.0,35.461,-11.710804475647262,-33.02446200711998,1.2045650842374245,-2.210092108193149,-183.4763533134168,1.0830434936170599,-1.8856356288974245,-174.10525270683343,1.4973790846677089,-2.751577585147231,-183.759583324345,0.0,0.0,0.0,14.866,8.884195524352737,59.761842582917744,23.91304347826087,-0.9534004437600536,28.26086956521739,-0.7682312123115989,17.391304347826086,-1.2287748215056287,51.08695652173913,0.0,89.13043478260869,1.4141922778537317,DBR 0 08/15/50,100.0,0.7071067667480803,100.0,0.7071067714399089,100.0,0.7071067571655881,75.0,0.0,100.0,0.7071067751948412,0.8606594262277325,0.01944097651722998,rising,8.695652173913043,100.0,-1.0,-1.0,-1.0,1,1,1.080939400905356,0.9257463156947918,1.3971972161249737,0.0,Bottom Quartile,Top Decile,Top Quartile,Top Decile,Very Tight,10.912655844619934,,,,,0.0
2025-11-06,DE0001102515,DBR 0 05/15/35,2035-05-15,-0.1694119972805797,NO ACTION,0.4483786250488147,0.9872227253773354,0.6689208870882789,0.0,0.6190752590981842,-0.0131082595631287,0.7571360530283486,-0.13806079393016446,-18.23460810702332,0.6490137455930979,-0.20063512054428317,-30.913847174307392,0.7673338479238485,-0.09841296083556961,-12.825311931607256,0.0,0.0,0.0,0.391413228614631,-0.40452148817775974,-103.34895406438578,0.9607815744257959,-0.34170631532761175,-35.56545221792839,0.9204062915255338,-0.47202766647671907,-51.284706079733866,0.9328465547836697,-0.26392566769539083,-28.29250571947982,0.0,0.0,0.0,3.395,-3.4081082595631287,-100.38610455153221,0.9682595581842584,-0.3491842990860742,-36.063087890872765,0.9296572630278126,-0.4812786379789979,-51.769469453136786,0.9393938633351271,-0.2704729762468482,-28.792286592905786,0.0,0.0,0.0,3.297,-3.310108259563129,-100.39758111990811,-0.5657106732320475,1.1847859323302317,209.433190400657,-0.36265616008608775,0.8110347851349025,223.63738770593042,-0.5609564577671451,1.2298773448554239,219.24648622929328,0.0,0.0,0.0,7.955,-7.968108259563129,-100.1647800068718,-0.5240644062244174,1.1431396653226016,218.12960963048496,-0.3066124925530072,0.7549911176018219,246.23624650508145,-0.5365565501219626,1.2054774372102415,224.66921976244757,0.0,0.0,0.0,-18.397,18.38389174043687,99.92874778737834,63.04347826086957,0.6201089271714673,60.86956521739131,0.4291824446741322,67.3913043478261,0.6891932254655597,51.08695652173913,0.0,60.86956521739131,-0.034343141749026425,DBR 0 05/15/35,100.0,0.0,100.0,0.0,100.0,0.0,100.0,0.0,100.0,0.0,0.9875374208581994,-0.00031469548086404675,falling,84.78260869565217,100.0,1.0,1.0,1.0,1,1,0.665504579929007,0.5171803235154274,0.7451885813053172,0.0,Above Median,Top Decile,Above Median,Top Decile,Very Tight,7.208224273573904,,,,,0.0
2025-11-06,DE0001102531,DBR 0 02/15/31,2031-02-15,-3.507245609591706,NO ACTION,-0.6391087297473629,0.9795056407947241,-0.35327257719389993,0.0,-0.657135891084881,-13.740575211647382,-0.777776149710563,0.12064025862568195,15.510922663221807,-0.8055627519435872,0.1664540221962243,20.663073078827455,-0.45046554264721034,0.09719296545331041,21.57611495088698,0.0,0.0,0.0,-13.27775735397031,-0.46281785767707184,-3.4856628645206706,-0.8432131195155536,0.18607722843067254,22.06763888242329,-0.8892529615583319,0.250144231810969,28.129704348652872,-0.5026406784951589,0.149368101301259,29.716675295119405,0.0,0.0,0.0,-11.543,-2.197575211647383,-19.038163473478008,-0.6592510779684111,0.0021151868835300736,0.32084693103023376,-0.6443728551439961,0.005264125396633235,0.8169377826698018,-0.3559159005221281,0.0026433233282281976,0.7426819791086176,0.0,0.0,0.0,-11.38,-2.3605752116473813,-20.743191648269434,-0.8223404589619326,0.16520456787705162,20.089558292758564,-0.8681248718995037,0.22901614215214083,26.380552720829893,-0.4892207292903085,0.1359481520964086,27.788714005383895,0.0,0.0,0.0,-9.265,-4.4755752116473815,-48.30626235096335,0.15127164774726534,-0.8084075388321463,-534.4078004240424,0.0,-0.6391087297473629,-6391087297.473629,0.03474695413361476,-0.3880195313275147,-1116.700526225652,0.0,0.0,0.0,-31.419,17.67842478835262,56.26666915791703,34.78260869565217,-0.6159660340956603,30.434782608695656,-0.6117469293182526,43.47826086956522,-0.33026215259888925,51.08695652173913,0.0,21.73913043478261,-0.871125867010456,DBR 0 02/15/31,100.0,0.0,100.0,0.0,100.0,0.0,100.0,0.0,100.0,0.0,0.9909657398528856,-0.011460099058161477,falling,65.21739130434783,100.0,-1.0,-1.0,-1.0,1,1,0.7064196779399291,0.7371771113671842,0.39355130882383876,0.0,Below Median,Top Decile,Bottom Quartile,Top Decile,Very Tight,4.578215317838641,,,,,0.0
2025-11-06,DE0001102549,DBR 0 05/15/36,2036-05-15,0.5449391036408553,STRONG SELL,-1.808198444772374,0.973288842028138,-1.2924250224569747,0.0,-1.5897509462994803,2.9420932972335674,-1.496491739835812,-0.09325920646366836,-6.231855703441087,-1.6501802102363512,-0.15801823453602282,-9.575816786447135,-1.2649751263561442,-0.027449896100830484,-2.1699949123033337,0.0,0.0,0.0,3.36519680382469,-0.4231035065911226,-12.572920099441298,-1.1979150241737109,-0.39183592212576945,-32.70982590147115,-1.194219282668082,-0.613979162104292,-51.412597826364184,-1.1158103576185951,-0.1766146648383795,-15.82837639475579,0.0,0.0,0.0,6.768,-3.8259067027664324,-56.529354271771524,-0.6936915841626036,-0.8960593621368768,-129.17258471591592,-0.5020536207647899,-1.3061448240075841,-260.1604179254522,-0.7163838694669576,-0.576041152990017,-80.40956385264197,0.0,0.0,0.0,5.987,-3.0449067027664327,-50.858638678479515,-0.38400802176790294,-1.2057429245315774,-313.9889858502586,-0.054259171164379554,-1.7539392736079944,-3232.520719939343,-0.5093099865848422,-0.7831150358721325,-153.75999707904398,0.0,0.0,0.0,10.917,-7.974906702766432,-73.05034987140604,-0.4375122892731105,-1.1522386570263699,-263.36143211075813,-0.13402134014191489,-1.6741771046304592,-1249.1868667624055,-0.5458285150271319,-0.7465965074298427,-136.78224445905076,0.0,0.0,0.0,-16.035,18.977093297233566,118.34794689989879,6.521739130434782,-1.5192508221075547,6.521739130434782,-1.7307850678628662,15.217391304347828,-1.2668989484701652,51.08695652173913,0.0,65.21739130434783,0.14579654615003657,DBR 0 05/15/36,100.0,0.0,100.0,0.0,100.0,0.0,100.0,0.0,100.0,0.0,0.9809879181429022,-0.0076990761147641695,falling,58.69565217391305,100.0,-1.0,-1.0,-1.0,1,1,1.7089788683365594,2.0856584243855476,1.4397821738239476,0.0,Bottom Decile,Top Decile,Above Median,Top Decile,Very Tight,7.684029918618052,,,,,0.0
2025-11-06,DE0001102564,DBR 0 08/15/31,2031-08-15,-3.982523601589168,WEAK SELL,-0.8729433000163119,0.9458713820937694,-1.2531411711482305,0.0,-1.0561609930806841,-12.927067245070948,-1.0373239762558888,-0.018837016824795327,-1.8159241543026057,-0.8453110712079522,-0.027632228808359693,-3.268882831734934,-1.234841240414344,-0.01829993073388647,-1.481966263092202,0.0,0.0,0.0,-12.066073055200786,-0.8609941898701621,-7.135661993903521,-1.0901134862853727,0.03395249320468863,3.1145833273676358,-0.9218140402933923,0.04887074027708038,5.301583357459776,-1.28490171759971,0.03176054645147941,2.4718268930037497,0.0,0.0,0.0,-10.264,-2.6630672450709483,-25.945705791858707,-1.0084805255542393,-0.047680467526444836,-4.727951194441316,-0.8098652122816472,-0.06307808773466472,-7.788714220491373,-1.213613320763035,-0.03952785038519546,-3.257038249599905,0.0,0.0,0.0,-10.516,-2.4110672450709476,-22.92760786209763,-1.1506563173889888,0.09449532430830465,8.212297804221759,-0.9938655447460406,0.12092224472972868,12.166861418255667,-1.3308548769981372,0.07771370584990667,5.839382385648139,0.0,0.0,0.0,-8.088,-4.839067245070948,-59.830208198416514,-0.9962431238339619,-0.059917869246722266,-6.014382153494313,-0.7957725182496191,-0.07717078176669279,-9.697593096916476,-1.204097356781414,-0.049043814366816596,-4.07307712148828,0.0,0.0,0.0,-31.072,18.14493275492905,58.396410752733686,21.73913043478261,-1.0024420004146537,23.91304347826087,-0.8355704724374787,19.565217391304348,-1.2277203243768222,51.08695652173913,0.0,26.08695652173913,-0.8215370087258358,DBR 0 08/15/31,100.0,0.707106736317636,100.0,0.7071067482577007,100.0,0.7071067265415354,75.0,0.0,100.0,0.7071067649857049,0.9307672906891867,0.015104091404582687,rising,23.91304347826087,100.0,-1.0,-1.0,-1.0,1,1,1.1353708094577368,1.006892552614233,1.3960193343162786,0.0,Bottom Quartile,Top Decile,Below Median,Top Decile,Very Tight,4.940248996126684,,,,,0.0
2025-11-06,DE0001102572,DBR 0 08/15/52,2052-08-15,-2.5332102715082208,MODERATE SELL,-1.1572952689812834,0.9559980799723853,-1.3679834031315563,0.0,-1.2502911939819912,25.195476406721458,-1.1179393786142975,-0.1323518153676937,-11.838907969039873,-0.9709633452190122,-0.18633192376227126,-19.190417718724504,-1.2593224810850099,-0.10866092204654643,-8.628522305904829,0.0,0.0,0.0,27.91523271215442,-2.7197563054329628,-9.742911092675495,-1.3594714325491595,0.1091802385671683,8.031079958725963,-1.3117689102163501,0.15447364123506668,11.775979660319239,-1.4388651348408112,0.07088173170925494,4.92622480733571,0.0,0.0,0.0,31.769,-6.573523593278541,-20.691628918786797,-1.0254243921476405,-0.2248668018343507,-21.929144787601263,-0.8504378631530252,-0.30685740582825827,-36.08228367000811,-1.1810801105694582,-0.18690329256209814,-15.824776770604071,0.0,0.0,0.0,26.712,-1.5165235932785421,-5.677312042193812,0.4658343536526479,-1.716125547634639,-368.3982294003278,0.06577805747211767,-1.223073326453401,-1859.3938275426585,0.8561088452395708,-2.224092248371127,-259.79082388404265,0.0,0.0,0.0,39.716,-14.520523593278543,-36.56089130230249,1.1912095239047482,-2.4415007178867394,-204.9598033255808,1.0904133891157932,-2.2477086580970767,-206.1336241759065,1.3989254573193977,-2.766908860450954,-197.7881542004427,0.0,0.0,0.0,19.075,6.120476406721458,32.08637695157442,13.043478260869565,-1.190466905639343,13.043478260869565,-1.1077486414458768,8.695652173913043,-1.3422549355979396,51.08695652173913,0.0,91.30434782608695,1.5022920037345593,DBR 0 08/15/52,100.0,0.0,100.0,0.0,100.0,0.0,100.0,0.0,100.0,0.0,0.967547964874336,-0.011549884901950747,falling,32.608695652173914,100.0,-1.0,-1.0,-1.0,1,1,1.3440603603704282,1.334877061879237,1.5239554199991532,0.0,Bottom Quartile,Top Decile,Top Decile,Top Decile,Very Tight,11.05318325788538,,,,,0.0
2025-11-06,DE0001102580,DBR 0 02/15/32,2032-02-15,-2.806556366054396,NO ACTION,-0.29437286797092077,0.9549597826368942,-0.5760844005071581,0.0,-0.5305979533935589,-10.46151719983459,-0.42067028899291226,-0.10992766440064661,-26.13154878388473,-0.1267144180835095,-0.16765844988741127,-132.31204403725687,-0.49658136809660525,-0.0795030324105529,-16.01007124256003,0.0,0.0,0.0,-9.54552240598326,-0.9159947938513309,-9.596067705184646,-0.7090111270308482,0.17841317363728937,25.16366306803539,-0.5425597991895361,0.24818693121861535,45.743699959890414,-0.6899913026974186,0.11390690219026045,16.508454540530128,0.0,0.0,0.0,-8.073,-2.38851719983459,-29.586488255616754,-0.44488446024665584,-0.08571349314690302,-19.266461043106577,-0.16711603872279335,-0.12725682924812742,-76.1487781818112,-0.5156946290853316,-0.060389771421826555,-11.710374094432636,0.0,0.0,0.0,-7.678,-2.7835171998345904,-36.253154417937935,-0.5250146568938375,-0.005583296499721335,-1.063455337877318,-0.28494517557951504,-0.009427692391405729,-3.3085985896662553,-0.5717737501565093,-0.004310650350648815,-0.7539083901767156,0.0,0.0,0.0,-4.54,-5.92151719983459,-130.42989398219385,0.6264568754739054,-1.1570548288674642,-184.69823793095821,0.47309920410935946,-0.7674720720802802,-162.22222510453693,0.7267080016946196,-1.3027924022017778,-179.2731580272219,0.0,0.0,0.0,-28.772,18.31048280016541,63.63993741763318,36.95652173913043,-0.4934076499221738,41.30434782608695,-0.2817700489351847,36.95652173913043,-0.5524771437038827,51.08695652173913,0.0,32.608695652173914,-0.6712449196373916,DBR 0 02/15/32,100.0,0.0,100.0,0.0,100.0,0.0,100.0,0.0,100.0,0.0,0.9897598304482397,-0.03480004781134549,falling,30.434782608695656,100.0,-1.0,-1.0,-1.0,1,1,0.5703916654636779,0.33954307049045956,0.6417672484330704,0.0,Below Median,Top Decile,Below Median,Top Decile,Very Tight,5.288984664965568,,,,,0.0
2025-11-06,DE0001102598,DBR 1 05/15/38,2038-05-15,2.734638442997261,WEAK BUY,0.7396343578484462,0.9869063964044026,0.7492372497536713,0.0,0.8045030180247836,9.3612067423395,0.7638316405780633,0.040671377446720336,5.324652024558092,0.6835825803810341,0.05605177746741208,8.199708163452259,0.7188593647354191,0.030377885018252226,4.225845288507645,0.0,0.0,0.0,9.940772246502757,-0.5795655041632575,-5.830185917237311,0.3988780361687931,0.40562498185599055,101.69147832326233,0.16198239530932532,0.5776519625391209,356.61401708168455,0.4683943127576208,0.28084293699605056,59.958655207991896,0.0,0.0,0.0,12.758,-3.3967932576604998,-26.624809962361017,0.41288911920781457,0.39161389881696906,94.84722922309314,0.1874763047192606,0.5521580531291856,294.5214993990166,0.48091959868214784,0.2683176510715235,55.79262026906904,0.0,0.0,0.0,10.835,-1.4737932576605015,-13.602152803878967,1.1112858988794867,-0.30678288085470307,-27.606116338146798,1.157737272469752,-0.4181029146213059,-36.11379895526769,1.0058022786427654,-0.25656502888909405,-25.50849523670345,0.0,0.0,0.0,17.18,-7.8187932576605,-45.51102009958905,0.8391752951743026,-0.034672277149518926,-4.131708468508526,0.7958997152392735,-0.056265357390827275,-7.069402791150865,0.784576449326444,-0.03533919957277265,-4.504239090108722,0.0,0.0,0.0,-10.46,19.8212067423395,189.495284162428,73.91304347826086,0.7997050777772419,71.73913043478261,0.707968810582393,73.91304347826086,0.7692944496729629,51.08695652173913,0.0,69.56521739130434,0.5370852858065892,DBR 1 05/15/38,100.0,0.0,100.0,0.0,100.0,0.0,100.0,0.0,100.0,0.0,0.9844304399544923,0.002475956449910277,rising,82.6086956521739,100.0,1.0,1.0,1.0,1,1,0.8648390243249706,0.8531279483573502,0.8346622956196506,0.0,Above Median,Top Decile,Above Median,Top Decile,Very Tight,9.140988116907067,,,,,0.0
2025-11-06,DE0001102606,DBR 1.7 08/15/32,2032-08-15,-2.366509986508772,NO ACTION,-0.07787208781275302,0.9829383645682408,-0.7296004861080982,0.0,-0.46328591876309644,-8.766260925532931,-0.4680962499101025,0.004810331147006075,1.0276371676052047,-0.0815271035209707,0.0036550157082176765,4.483190377244891,-0.7313898126687449,0.0017893265606466757,0.24464745135742513,0.0,0.0,0.0,-8.216219819715633,-0.5500411058172983,-6.694576304153433,-0.48387080195512383,0.020584883192027392,4.25421056270212,-0.10935085409492212,0.0314787662821691,28.786938761493396,-0.7442810972079497,0.014680611099851415,1.972455159438798,0.0,0.0,0.0,-5.796,-2.970260925532931,-51.2467377572163,-1.845372530197844,1.3820866114347476,74.89472078556956,-2.1326584753587063,2.054786387545953,96.34859034639786,-1.5345127728099268,0.8049122867018286,52.453931679077414,0.0,0.0,0.0,-6.408,-2.3582609255329308,-36.801824623170226,-1.765771227013401,1.3024853082503045,73.76297002398276,-1.997074339226251,1.919202251413498,96.10069110131408,-1.5256068065194353,0.796006320411337,52.1763741346784,0.0,0.0,0.0,-3.451,-5.315260925532931,-154.0208898907807,-0.6023997826308982,0.13911386386780178,23.09327884397853,-0.31110714375841725,0.23323505594566424,74.96936445465901,-0.8394814035369034,0.10988091742880512,13.089142374916296,0.0,0.0,0.0,-28.49,19.72373907446707,69.2303933574729,43.47826086956522,-0.42821254440477924,47.82608695652174,-0.07453819417845244,28.26086956521739,-0.7055820152901853,51.08695652173913,0.0,41.30434782608695,-0.567907488909773,DBR 1.7 08/15/32,100.0,0.0,100.0,0.0,100.0,0.0,100.0,0.0,100.0,0.0,0.9758590024328597,0.007079362135381073,rising,76.08695652173914,100.0,-1.0,-1.0,-1.0,1,1,0.49803137215108734,0.08982121206923455,0.8127866264262901,0.0,Below Median,Top Decile,Below Median,Top Decile,Very Tight,6.014192997522372,,,,,0.0
2025-11-06,DE0001102614,DBR 1.8 08/15/53,2053-08-15,0.7221395853725134,WEAK BUY,0.8439182406784883,0.9036225013861725,1.1499243998003101,0.0,0.9696943272386971,29.34788790596592,0.872459574341036,0.09723475289766104,11.144900536693847,0.7081032367355542,0.1358150039429341,19.18011315003264,1.0673307124213673,0.08259368737894279,7.738340670225359,0.0,0.0,0.0,31.269091803609488,-1.9212038976435686,-6.144098808803229,0.7838301462535666,0.18586418098513047,23.7123029143834,0.5835521744352449,0.26036606624324343,44.61744351025311,1.0022642920342142,0.14766010776609595,14.732651603614164,0.0,0.0,0.0,36.442,-7.094112094034081,-19.466857176026,0.9960925420664206,-0.026398214827723532,-2.650176911067122,0.877668750754896,-0.033750510076407725,-3.8454724134625007,1.1724129813466198,-0.022488581546309616,-1.9181450318525979,0.0,0.0,0.0,32.458,-3.110112094034079,-9.581958509692166,1.2362353588082253,-0.26654103156952824,-21.560702621417736,1.197830212079588,-0.35391197140109976,-29.546087991223235,1.3630169265682375,-0.21309252676792734,-15.633886934996216,0.0,0.0,0.0,42.788,-13.440112094034077,-31.410937858495338,-0.8912532658469753,1.8609475930856725,208.80120651642798,-0.7171819193994047,1.5611001600778929,217.67142981212834,-1.0023507870684965,2.1522751868688066,214.72274907780906,0.0,0.0,0.0,18.539,10.808887905965918,58.30351097759083,80.43478260869566,0.9597012046790986,78.26086956521739,0.8077880465422597,84.78260869565217,1.1689083039086816,51.08695652173913,0.0,95.65217391304348,1.7554098020052096,DBR 1.8 08/15/53,100.0,0.7071067623724483,100.0,0.707106767870629,100.0,0.7071067547112503,75.0,0.0,100.0,0.707106773000639,0.9211386014563663,-0.017516100070193774,falling,15.217391304347828,100.0,1.0,1.0,1.0,1,1,1.0424193285459356,0.9734137274879106,1.2810341979685755,0.0,Top Quartile,Top Decile,Top Decile,Top Decile,Very Tight,14.998818003329715,,,,,0.0
2025-11-06,DE0001135176,DBR 5 1/2 01/04/31,2031-01-04,0.6335125754781394,MODERATE BUY,1.398125114647881,0.9921214513547364,1.386928836060516,0.0,1.3647573478980854,-9.901744447462018,1.382810625259956,-0.018053277361870457,-1.3055495019733199,1.4324179569239437,-0.03429284227606266,-2.394052788216911,1.3976647954243966,-0.010735959363880498,-0.7681354872937906,0.0,0.0,0.0,-9.724077383500822,-0.1776670639611968,-1.8270840180677939,1.20277610999398,0.16198123790410546,13.467280835681722,1.165212914908592,0.23291219973928912,19.988810178840104,1.2882718761484948,0.09865695991202128,7.6580852980478245,0.0,0.0,0.0,-7.329,-2.5727444474620187,-35.10362183042239,1.4233632565549703,-0.058605908656884864,-4.117424555906333,1.4927155450516245,-0.09459043040374349,-6.336802084203655,1.4140534000594107,-0.027124563998894624,-1.9182135417186965,0.0,0.0,0.0,-6.45,-3.4517444474620183,-53.515417707139164,1.218315550421289,0.14644179747679642,12.020021924874488,1.2031273056263236,0.1949978090215574,16.207578906148058,1.307710469239157,0.07921836682135908,6.057790931479677,0.0,0.0,0.0,-3.735,-6.166744447462019,-165.1069459424719,0.1608133905380667,1.2039439573600188,748.6589757642921,0.0,1.398125114647881,13981251146.478811,0.03474695413361476,1.3521818819269014,3891.510857545046,0.0,0.0,0.0,-26.673,16.77125555253798,62.87727494563886,91.30434782608695,1.3423396950962838,91.30434782608695,1.3382679751951865,95.65217391304348,1.405277891088806,51.08695652173913,0.0,36.95652173913043,-0.6371229530071028,DBR 5 1/2,100.0,0.0,100.0,0.0,100.0,0.0,100.0,0.0,100.0,0.0,0.9753449294777381,0.016776521876998296,rising,100.0,100.0,1.0,1.0,1.0,1,1,1.4671112310981465,1.6126611723070288,1.5450609357022134,0.0,Top Decile,Top Decile,Below Median,Top Decile,Very Tight,5.27246813724247,,,,,0.0
2025-11-06,DE0001135226,DBR 4 3/4 07/04/34,2034-07-04,-2.190532039643128,STRONG SELL,-2.6375733007019195,0.9754679972970323,-1.631746404775979,0.0,-2.1522755068864217,-4.027522043555163,-2.2824521461863703,0.1301766392999486,5.703367711218707,-2.867887000407835,0.23031369970591564,8.030780113375641,-1.6342270620532393,0.002480657277260212,0.15179391650534338,0.0,0.0,0.0,-4.152728527152349,0.12520648359718578,3.0150413752554996,-2.1886828859667995,0.03640737908037783,1.663437821324762,-2.69627153038557,0.05869822968365046,2.177014770376449,-1.6322344029288827,0.0004879981529035682,0.029897553258168594,0.0,0.0,0.0,-1.307,-2.7205220435551634,-208.15011650651508,-1.317856346830743,-0.8344191600556787,-63.31639679322397,-1.2385862281885305,-1.398987072513389,-112.95031620563213,-1.4307724988051593,-0.20097390597081977,-14.046531138528334,0.0,0.0,0.0,-0.995,-3.032522043555163,-304.7760817163372,-1.1405846975215672,-1.0116908093648544,-88.69931384256479,-0.9928115491957783,-1.6447617515061412,-165.66706302638858,-1.2956783434763322,-0.33606806129964695,-25.937614871620667,0.0,0.0,0.0,2.941,-6.968522043555163,-236.9439653131849,-1.7956822603264306,-0.35659324655999103,-19.858370963097343,-2.0268036402287466,-0.6107696604731729,-30.13462406209112,-1.6130804754274146,-0.01866592934856448,-1.1571604465612644,0.0,0.0,0.0,-22.751,18.72347795644484,82.29738450272559,2.1739130434782608,-2.0640842725436928,2.1739130434782608,-2.5246523673585686,4.3478260869565215,-1.6053114116532394,51.08695652173913,0.0,47.82608695652174,-0.27904903819890814,DBR 4 3/4,50.0,-0.7071067776233819,50.0,-0.7071067780197442,50.0,-0.7071067768178201,75.0,0.0,50.0,-0.7071067806109548,0.996338190344301,-0.02087019304726878,falling,60.86956521739131,50.0,-1.0,-1.0,-1.0,1,1,2.313691568273076,3.0422971496559716,1.8177916281220727,0.0,Bottom Decile,Above Median,Below Median,Above Median,Very Tight,8.450802873452545,,,,,0.0
2025-11-06,DE0001135275,DBR 4 01/04/37,2037-01-04,1.5768316708936485,NO ACTION,-0.6075360139201016,0.9724077610399988,-0.7008085950867828,0.0,-0.7450185299542891,5.3644610212412775,-1.127341646420385,0.38232311646609585,33.913686617424865,-1.1268169588601324,0.5192809449400309,46.083876910846136,-1.0101994240276968,0.30939082894091396,30.626707808314947,0.0,0.0,0.0,5.285605108825786,0.0788559124154915,1.4918994257559972,-1.3879286933439212,0.6429101633896321,46.321555411360535,-1.5096207602726712,0.9020847463525696,59.75571905980288,-1.1629021793737973,0.4620935842870144,39.7362382244584,0.0,0.0,0.0,7.939,-2.5745389787587225,-32.42900838286713,0.7739204982846111,-1.5189390282389001,-196.26550943915632,0.6578011969918351,-1.2653372109119367,-192.35860279101652,0.7951497426393564,-1.4959583377261394,-188.1354213795043,0.0,0.0,0.0,8.642,-3.277538978758722,-37.92569977975182,0.9183472593285547,-1.6633657892828437,-181.1260124396086,0.8577414157749826,-1.4652774296950843,-170.82973792144682,0.9145466240497828,-1.6153552191365657,-176.62907051371147,0.0,0.0,0.0,13.533,-8.168538978758722,-60.3601490631989,-0.5942374732703736,-0.1507810566839155,-25.373871714401975,-0.4028706657510927,-0.2046653481690089,-50.80174867218634,-0.6023143012257294,-0.09849429386105346,-16.352640477795443,0.0,0.0,0.0,-15.085,20.449461021241277,135.56155788985825,32.608695652173914,-0.7010848088540333,32.608695652173914,-0.5815259183093748,32.608695652173914,-0.6768672473211516,51.08695652173913,0.0,67.3913043478261,0.2934563782775317,DBR 4 01/04/37,100.0,0.0,100.0,0.0,100.0,0.0,100.0,0.0,100.0,0.0,0.9885209330067483,-0.01611317196674944,falling,54.347826086956516,100.0,-1.0,-1.0,-1.0,1,1,0.8008933268288152,0.7007597032357732,0.7807119987125948,0.0,Below Median,Top Decile,Above Median,Top Decile,Very Tight,10.143305898035493,,,,,0.0
2025-11-06,DE0001135325,DBR 4 1/4 07/04/39,2039-07-04,2.1460379892231938,NO ACTION,0.054766112784333576,0.9873152322035852,0.1857620492009234,0.0,0.25348690979838023,11.035224526949085,0.2477612160308878,0.005725693767492435,2.310972487187574,0.04891924285226957,0.005846869932064007,11.95208346644392,0.18279339377075954,0.0029686554301638635,1.6240495383995597,0.0,0.0,0.0,11.651015450942625,-0.61579092399354,-5.285298316338509,-0.5778982647646285,0.8313851745630088,143.8635847981416,-0.5099432295657562,0.5647093423500897,110.73964679499815,-0.32635134575871527,0.5121133949596387,156.9208725268066,0.0,0.0,0.0,14.535,-3.4997754730509154,-24.078262611923556,0.8311790087294253,-0.577692098931045,-69.50272876403078,0.8718838435180489,-0.8171177307337154,-93.71864468376695,0.5994218168122507,-0.4136597676113273,-69.00979395615046,0.0,0.0,0.0,13.785,-2.7497754730509154,-19.947591375089996,0.8059802339842588,-0.5524933241858785,-68.54923905512862,0.8438412913846973,-0.7890751786003638,-93.50990254986745,0.5808372204891701,-0.39507517128824665,-68.01822447840023,0.0,0.0,0.0,19.488,-8.452775473050915,-43.374258357519956,-0.3108647426933348,0.564351652491715,181.54250284156296,-0.14409733210708917,0.19886344489142274,138.00632404699937,-0.15742265182856843,0.34318470102949183,218.00209515146952,0.0,0.0,0.0,-9.46,20.495224526949087,216.65142183175413,52.17391304347826,0.26601814475223623,52.17391304347826,0.05242144218520803,52.17391304347826,0.20732859518294838,51.08695652173913,0.0,71.73913043478261,0.6391280857514856,DBR 4 1/4,100.0,0.0,100.0,0.0,100.0,0.0,100.0,0.0,100.0,0.0,0.981423064358797,0.0058921678447881876,rising,86.95652173913044,100.0,1.0,1.0,-1.0,1,0,0.2724978860706145,0.06316972831700088,0.20694189787818068,0.0,Above Median,Top Decile,Above Median,Top Decile,Very Tight,12.118576230815847,,,,,0.0
2025-11-06,DE0001135366,DBR 4 3/4 07/04/40,2040-07-04,2.546035829841271,NO ACTION,0.52018508651603,0.9821621297896729,0.6572495979313333,0.0,0.6542177064725686,13.345874404970386,0.5689901296481953,0.08522757682437332,14.978744074030745,0.3953984958076284,0.12478659070840159,31.559702142403513,0.5998691484524125,0.05738044947892085,9.565494186591495,0.0,0.0,0.0,13.963544298725427,-0.6176698937550409,-4.423446369336732,0.9366905960960736,-0.28247288962350503,-30.156477259955842,0.9067406658795361,-0.38655557936350604,-42.631326645686,0.8775400974545895,-0.2202904995232562,-25.10318305134055,0.0,0.0,0.0,18.116,-4.770125595029613,-26.33100901079991,0.8320856970361817,-0.17786799056361313,-21.376162222178255,0.7664338399185815,-0.24624875340255148,-32.129159408696594,0.7888870996770929,-0.1316375017457596,-16.68648151693611,0.0,0.0,0.0,15.502,-2.1561255950296143,-13.908693030826633,-0.36916959635717456,1.023387302829743,277.21331474932083,-0.10252773113388232,0.6227128176499124,607.3603209854828,-0.39446775460151645,1.0517173525328498,266.6168054556432,0.0,0.0,0.0,20.702,-7.356125595029615,-35.533405426897275,-0.6632503427013493,1.317468049173918,198.63812266484416,-0.5394260330962124,1.0596111196122424,196.43306680750106,-0.5969869880565313,1.2542365859878646,210.09445600506953,0.0,0.0,0.0,-7.938,21.283874404970387,268.12640939982043,65.21739130434783,0.6541461625230729,63.04347826086957,0.4979146967357536,65.21739130434783,0.677553199466813,51.08695652173913,0.0,73.91304347826086,0.7799779533056805,DBR 4 3/4,100.0,0.707106777623382,100.0,0.7071067780197442,100.0,0.7071067768178201,75.0,0.0,100.0,0.7071067806109549,0.9898407123880157,-0.007678582598342865,falling,71.73913043478261,100.0,1.0,1.0,1.0,1,1,0.7032826357208598,0.6000051659531539,0.7321865782631837,0.0,Above Median,Top Decile,Above Median,Top Decile,Very Tight,13.231107343307258,,,,,0.0
2025-11-06,DE0001135432,DBR 3 1/4 07/04/42,2042-07-04,2.693429129272776,NO ACTION,0.6916851077419933,0.9731947938601304,0.4291917944743609,0.0,0.6773082688648779,17.0680535710859,0.8113286024598081,-0.13402033359493015,-16.518625318612106,0.8688778912647401,-0.1771927835227468,-20.393289237167235,0.5366327211386478,-0.1074409266642869,-20.021314472621643,0.0,0.0,0.0,18.156017088313376,-1.0879635172274753,-5.992302779493102,1.0809545127738454,-0.4036462439089674,-37.341649015276595,1.2394435853348906,-0.5477584775928973,-44.193901171024734,0.7518399065691574,-0.32264811209479655,-42.914469554519584,0.0,0.0,0.0,22.453,-5.384946428914098,-23.98319345528784,0.23612509072521087,0.44118317813966706,186.84298144697934,0.056496949098950124,0.6351881586430432,1124.287340015167,0.12606360849571024,0.30312818597865065,240.45651679351536,0.0,0.0,0.0,18.147,-1.0789464289140973,-5.945591162834288,-0.847509814999737,1.524818083864615,179.91745215049139,-0.9167873197109769,1.6084724274529703,175.44662489609792,-0.49780136347886433,0.9269931579532252,186.2174769577215,0.0,0.0,0.0,24.025,-6.956946428914097,-28.957113115581212,0.7285500614605367,-0.05124179259565875,-7.033393393666609,0.7904971461881231,-0.09881203844612974,-12.499986580927606,0.48685690954247557,-0.05766511506811467,-11.84436592219035,0.0,0.0,0.0,-1.775,18.8430535710859,1061.580476897344,67.3913043478261,0.6765105385204271,69.56521739130434,0.6620723845903234,58.69565217391305,0.45010628029966515,51.08695652173913,0.0,78.26086956521739,1.0068701569004999,DBR 3 1/4,100.0,0.0,100.0,0.0,100.0,0.0,100.0,0.0,100.0,0.0,0.9849266843489825,-0.011731890488852037,falling,56.52173913043478,100.0,1.0,1.0,1.0,1,1,0.7281049409242748,0.7978210998659047,0.4781265327569653,0.0,Above Median,Top Decile,Top Quartile,Top Decile,Very Tight,13.08856549666544,,,,,0.0
2025-11-06,DE0001135481,DBR 2 1/2 07/04/44,2044-07-04,1.1261022509459195,MODERATE SELL,-1.1319839052852285,0.9667781193054505,-1.3139172744411058,0.0,-1.2217098607231196,18.767392282946066,-0.9931025091505823,-0.2286073515725373,-23.019511799050626,-0.8175867414857765,-0.31439716379945204,-38.454287967375606,-1.1217273352225516,-0.1921899392185542,-17.133391642549604,0.0,0.0,0.0,19.98076530453432,-1.2133730215882537,-6.072705436891485,-0.7657731304090759,-0.4559367303140437,-59.539399628260966,-0.5051438298448713,-0.6268400754403572,-124.09140248703392,-0.9501959844769189,-0.36372128996418696,-38.278554327564265,0.0,0.0,0.0,24.353,-5.585607717053936,-22.936014925308314,-1.6501404026093036,0.428430541886184,25.96327794970631,-1.787353334723995,0.6553694294387664,36.66703236790425,-1.5221298196799968,0.208212545238891,13.679026662440766,0.0,0.0,0.0,19.241,-0.4736077170539339,-2.4614506356623296,-1.9408989907363041,0.7191891300131845,37.05443352489497,-2.2985050747265428,1.1665211694413142,50.75129818910526,-1.5636909957022909,0.24977372126118502,15.97334258177214,0.0,0.0,0.0,26.407,-7.639607717053934,-28.930237111981334,0.8713811959623807,-2.0930910566855,-240.20383299107587,0.7030165684573497,-1.8350004737425782,-261.0180940212213,1.121071509009882,-2.434988783450988,-217.2019128272515,0.0,0.0,0.0,0.515,18.252392282946065,3544.1537725302305,15.217391304347828,-1.1627844407150594,15.217391304347828,-1.0835209188421817,13.043478260869565,-1.288333630492247,51.08695652173913,0.0,80.43478260869566,1.1104564400375134,DBR 2 1/2,20.0,-1.383701740222383,20.0,-1.3679277749330723,20.0,-1.4695288780942597,60.0,0.0,60.0,0.3671471071615243,0.9766852524665571,-0.009907133161106585,falling,43.47826086956522,60.0,-1.0,-1.0,-1.0,1,1,1.3133354882248922,1.3056817824131002,1.463724886742998,0.0,Bottom Quartile,Bottom Quartile,Top Quartile,Above Median,Very Tight,13.23624289805494,,,,,0.0
2025-11-06,DE0001141836,OBL 0 04/10/26,2026-04-10,0.3748593960141093,NO ACTION,-0.17788595767580354,0.8696416123929689,-0.3178520445956433,0.0,-0.37133656653183966,-23.543730495317657,1.3712162660557277,-1.7425528325875672,-127.08081598914364,1.6527790752920635,-1.830665032967867,-110.76283873984099,1.0858339757189641,-1.4036860203146073,-129.27261798544495,0.0,0.0,0.0,-18.514404635050965,-5.029325860266692,-27.1643941929889,1.2228483152341267,-1.5941848817659663,-130.36652615611536,1.3895530692347624,-1.567439026910566,-112.8016662575975,1.0164569049811618,-1.3343089495768052,-131.27058608298557,0.0,0.0,0.0,-16.263,-7.2807304953176555,-44.76868038394384,0.41407031500515756,-0.7854068815369972,-189.67958680140006,0.24891925765035877,-0.42680521532616233,-171.46330991366597,0.4215058235661284,-0.7393578681617717,-175.40869171524213,0.0,0.0,0.0,-20.267,-3.2767304953176577,-16.16781217595538,0.2717432041084227,-0.6430797706402623,-236.64979924160323,0.06665843822730555,-0.24454439590310909,-366.86181932890463,0.33529281655315024,-0.6531448611487936,-194.79834026370312,0.0,0.0,0.0,-22.007,-1.5367304953176557,-6.982916774750597,0.11643546279875655,-0.4877720293305962,-418.92046951503016,0.0,-0.17788595767580354,-1778859576.7580352,0.03474695413361476,-0.3525989987292581,-1014.7620303557634,0.0,0.0,0.0,-34.524,10.980269504682344,31.804743081629788,47.82608695652174,-0.339154952342929,45.65217391304348,-0.17027022682044424,45.65217391304348,-0.29493649878387745,51.08695652173913,0.0,2.1739130434782608,-1.4686950342183296,OBL 0 04/10/26,100.0,0.0,100.0,0.0,100.0,0.0,100.0,0.0,100.0,0.0,0.8643889859900198,0.005252626402949101,rising,4.3478260869565215,100.0,-1.0,1.0,1.0,0,0,0.39918601509296947,0.20518176380421307,0.3540922682325555,0.0,Below Median,Top Decile,Bottom Decile,Top Decile,Very Tight,0.407302940022447,,,,,0.0
2025-11-06,DE0001141844,OBL 0 10/09/26,2026-10-09,5.254591000076218,STRONG BUY,1.9055289503419206,0.8982511561798253,1.2611473121496006,0.0,1.589098880396818,-17.168521258852657,1.082623797064994,0.5064750833318241,46.782186021281404,1.1230914572145758,0.7824374931273448,69.66818963266628,1.0316255142339168,0.22952179791568383,22.248557497268816,0.0,0.0,0.0,-18.28045283102177,1.1119315721691123,6.082625971244605,0.8961458785266627,0.6929530018701553,77.32591431172293,0.8539993856035684,1.0515295647383522,123.13001275547488,0.8663568064505472,0.3947905056990534,45.569042477960174,0.0,0.0,0.0,-16.37,-0.7985212588526558,-4.877955151892854,1.315771543822808,0.2733273365740101,20.773160491264008,1.4637943767902417,0.4417345735516789,30.177364904390664,1.1741616413945248,0.0869856707550758,7.408321558770457,0.0,0.0,0.0,-15.678,-1.490521258852656,-9.507088008049159,0.8535815991047029,0.7355172812921151,86.16836087454813,0.7904247263036903,1.1151042240382303,141.07658488180135,0.8265036239634159,0.4346436881861847,52.588236799624724,0.0,0.0,0.0,-18.81,1.641478741147342,8.726628071635721,0.12558287760550832,1.4635160027913097,1165.3785246510904,0.0,1.9055289503419206,19055289503.419205,0.03474695413361476,1.226400358015986,3529.5180128543857,0.0,0.0,0.0,-32.652,15.483478741147344,47.41969477032149,100.0,1.559625800968499,100.0,1.823948617568563,89.13043478260869,1.2798332903427312,51.08695652173913,0.0,13.043478260869565,-1.0800825554834197,OBL 0 10/09/26,100.0,0.0,100.0,0.0,100.0,0.0,100.0,0.0,100.0,0.0,0.9464496218000893,-0.048198465620263975,falling,10.869565217391305,100.0,1.0,1.0,1.0,1,1,1.7082778988853338,2.1979238615546324,1.4049383036139944,0.0,Top Decile,Top Decile,Bottom Quartile,Top Decile,Very Tight,0.8808021633299745,,,,,0.0
2025-11-06,DE0001141851,OBL 0 04/16/27,2027-04-16,3.483870577910757,WEAK BUY,1.1495149674417242,0.781340876011918,0.8396389075790726,0.0,1.0207523859459757,-17.4081357898999,0.6485738851074944,0.37217850083848136,57.384132116016886,0.6003656172486832,0.549149350193041,91.46915234132359,0.5144694716942738,0.32516943588479874,63.20480562111016,0.0,0.0,0.0,-17.99324816122525,0.5851123713253479,3.251844057045008,0.7032103878112456,0.31754199813473016,45.156044211388945,0.6701190719506142,0.47939589549111006,71.53891127762873,0.5496460052160785,0.289992902362994,52.75993900346773,0.0,0.0,0.0,-15.358,-2.050135789899901,-13.348976354766268,1.0153502429985832,0.0054021429473924965,0.5320472350736721,1.1127745090961598,0.036740458345564386,3.3016983867860725,0.8188583195679254,0.020780588011147128,2.5377513131132345,0.0,0.0,0.0,-15.003,-2.4051357898999015,-16.031032382168885,1.193395177891774,-0.17264279194579824,-14.466523218581537,1.3545253197983422,-0.20501035235661802,-15.135217322745776,0.9308538956593131,-0.09121498808024053,-9.79906594640477,0.0,0.0,0.0,-15.877,-1.531135789899901,-9.64373489283572,0.14042443440038718,0.8803279515455885,626.9050629358668,0.0,1.1495149674417242,11495149674.417242,0.03474695413361476,0.8048919534454578,2316.4382083866503,0.0,0.0,0.0,-33.883,16.4748642101001,48.622802600825835,82.6086956521739,1.0091535135152352,86.95652173913044,1.1003014335539163,78.26086956521739,0.8594539541859034,51.08695652173913,0.0,10.869565217391305,-1.0946886952032833,OBL 0 04/16/27,100.0,0.0,100.0,0.0,100.0,0.0,100.0,0.0,100.0,0.0,0.9778456765318154,-0.19650480051989738,falling,2.1739130434782608,100.0,1.0,1.0,1.0,1,1,1.0973066324925933,1.3259029077994373,0.9353711902630749,0.0,Top Quartile,Top Decile,Bottom Quartile,Top Decile,Very Tight,1.364548404327337,,,,,0.0
2025-11-06,DE0001141869,OBL 1.3 10/15/27,2027-10-15,-0.5531581004268595,WEAK SELL,-0.5741055951199844,0.9379348419426513,-1.1720928112534827,0.0,-0.8648023414030261,-19.991803160233136,-0.9023440383031254,0.03754169690009923,4.160463735611387,-0.626488642206001,0.0523830470860166,8.36137205383763,-1.19824137894657,0.026148567693087266,2.1822454085045164,0.0,0.0,0.0,-19.412044891199308,-0.5797582690338281,-2.98659039778962,-0.9757179254964814,0.11091558409345526,11.367586887394593,-0.7226821462407799,0.14857655112079549,20.55904519542246,-1.2506198473582284,0.07852703610474565,6.279049196501949,0.0,0.0,0.0,-18.134,-1.8578031602331357,-10.244861361027073,-1.144449536203755,0.27964719480072886,24.435082850820685,-0.9447140384932339,0.3706084433732495,39.22969537336184,-1.391691980060125,0.21959916880664232,15.779293864956067,0.0,0.0,0.0,-18.711,-1.2808031602331376,-6.845188175664682,-1.2407826028227185,0.3759802614196923,30.301864124639533,-1.0742709246592987,0.5001653295393144,46.5585834450543,-1.4685110226297082,0.2964182113762255,20.184949570683187,0.0,0.0,0.0,-18.692,-1.299803160233136,-6.953793920060755,-0.927316679052833,0.06251433764980685,6.741422686316515,-0.6753840546053593,0.10127845948537495,14.995683906838106,-1.2249592778180447,0.052866466564561954,4.315773355923542,0.0,0.0,0.0,-34.373,14.381196839766861,41.83864322457451,28.26086956521739,-0.8171014806059516,34.78260869565217,-0.5495267371139012,21.73913043478261,-1.1468890636956302,51.08695652173913,0.0,6.521739130434782,-1.2521808407580917,OBL 1.3 10/15/27,100.0,0.7071067386725988,100.0,0.7071067500938312,100.0,0.7071067274373561,75.0,0.0,100.0,0.7071067679114259,0.9638608554250244,-0.02592601348237311,falling,17.391304347826086,50.0,-1.0,-1.0,-1.0,1,1,0.9296606680348126,0.662199535903045,1.3057301633651563,0.0,Below Median,Top Decile,Bottom Decile,Top Decile,Very Tight,1.858319253606311,,,,,0.0
2025-11-06,DE000BU25000,OBL 2.2 04/13/28,2028-04-13,-1.7027926085474512,WEAK SELL,-1.0649452287990624,0.9634855418587582,-1.0190647238054464,0.0,-1.0936202750343411,-19.71649097009917,-1.115128607058232,0.021508332023890908,1.9287759003648406,-1.1022579126297978,0.03731268383073538,3.3851136893363156,-1.0411466402243366,0.022081916418890124,2.1209227743403987,0.0,0.0,0.0,-19.115555863230675,-0.6009351068684943,-3.1436967402556193,-1.2797190068265132,0.18609873179217207,14.542155687712249,-1.3275682304963294,0.26262300169726704,19.782260051587393,-1.1504582264747543,0.13139350266930783,11.42097109686703,0.0,0.0,0.0,-18.518,-1.1984909700991686,-6.472032451949267,-0.9046351336158628,-0.18898514141847833,-20.890758307608653,-0.807396239258833,-0.2575489895402294,-31.8987101781377,-0.8601806585225666,-0.1588840652828798,-18.471010927945713,0.0,0.0,0.0,-16.927,-2.7894909700991697,-16.479535466717174,-1.4725848816376634,0.3789646066033223,25.73465263397313,-1.6347092864109039,0.5697640576118415,34.85415167472225,-1.2385825595866051,0.2195178357811587,17.723310594821786,0.0,0.0,0.0,-14.466,-5.25049097009917,-36.29538895665444,0.9738761990752632,-2.0674964741096042,-212.2956136358213,0.9291429519552721,-1.9940881807543345,-214.61586240270393,1.0074696056651864,-2.026534329470633,-201.1509129367246,0.0,0.0,0.0,-31.476,11.75950902990083,37.36023963071803,19.565217391304348,-1.0387232070812145,17.391304347826086,-1.019352331280902,26.08695652173913,-0.9942708830918539,51.08695652173913,0.0,8.695652173913043,-1.2353986852765215,OBL 2.2 04/13/28,100.0,0.0,100.0,0.0,100.0,0.0,100.0,0.0,100.0,0.0,0.9675838097769204,-0.004098267918162146,falling,41.30434782608695,100.0,-1.0,-1.0,-1.0,1,1,1.1756394574688456,1.2283563202785328,1.135254423129796,0.0,Bottom Quartile,Top Decile,Bottom Decile,Top Decile,Very Tight,2.3528064280050387,,,,,0.0
2025-11-06,DE000BU25018,OBL 2.4 10/19/28,2028-10-19,-0.0104217832489936,NO ACTION,-0.34238282303356077,0.9723585540573512,-0.3707185111602054,0.0,-0.49730714752761374,-16.557892092895294,-0.7213739519369945,0.22406680440938076,31.061116179980857,-0.6667435276248256,0.3243607045912648,48.64849620391544,-0.5274065847550191,0.15668807359481374,29.709160854842075,0.0,0.0,0.0,-16.663894587048652,0.10600249415335838,0.6361207671832761,-0.9561967873182604,0.4588896397906467,47.991129135513084,-0.9795610507944955,0.6371782277609348,65.04732101581668,-0.7208165193558325,0.3500980081956271,48.569642056973485,0.0,0.0,0.0,-14.901,-1.6568920928952942,-11.119334888821962,-1.162815571598634,0.6655084240710202,57.232499684608804,-1.2695789288326342,0.9271961057990734,73.03178065096301,-0.8779519245908077,0.5072334134306024,57.77462221402947,0.0,0.0,0.0,-14.008,-2.549892092895295,-18.20311315730285,-0.5580901917745833,0.060783044246969564,10.891258089408327,-0.4257753176397751,0.08339249460621434,19.586032630986104,-0.40825370242104453,0.03753519126083915,9.194084491784844,0.0,0.0,0.0,-11.674,-4.8838920928952945,-41.835635503783884,0.7744060247204255,-1.2717131722480393,-164.21787992744018,0.7496692877397121,-1.0920521107732728,-145.67117982100385,0.6434636501118053,-1.0141821612720108,-157.6129662234214,0.0,0.0,0.0,-30.594,14.036107907104707,45.87862947805728,39.130434782608695,-0.461163822899195,39.130434782608695,-0.3277245809565,41.30434782608695,-0.3476613552241935,51.08695652173913,0.0,15.217391304347828,-1.0428605436295624,OBL 2.4 10/19/28,100.0,0.0,100.0,0.0,100.0,0.0,100.0,0.0,100.0,0.0,0.9701837189220973,0.0021748351352538497,rising,52.17391304347826,100.0,-1.0,-1.0,-1.0,1,1,0.5346041203345321,0.3949199388426342,0.4129863586673066,0.0,Below Median,Top Decile,Bottom Quartile,Top Decile,Very Tight,2.8445875941457643,,,,,0.0
2025-11-06,DE000BU25026,OBL 2.1 04/12/29,2029-04-12,0.3004426447374637,WEAK SELL,-0.8304664938097923,0.9669337205789079,-0.7079659013293698,0.0,-0.8693191070857934,-14.909136370323589,-0.9973391978226059,0.12802009073681253,12.83616343694202,-0.9968568199609379,0.16639032615114557,16.69149682785096,-0.8149188298407531,0.10695292851138338,13.124365676989811,0.0,0.0,0.0,-15.159329734265976,0.2501933639423868,1.6504249736834342,-0.5341547399847312,-0.33516436710106223,-62.7466791431964,-0.3624332008414753,-0.468033292968317,-129.1364254069504,-0.4633568271864151,-0.24460907414295469,-52.79064740433407,0.0,0.0,0.0,-13.074,-1.835136370323589,-14.036533340369708,0.41696853405857637,-1.2862876411443698,-308.48553433413673,0.20802087657870186,-1.0384873703884943,-499.2226441625115,0.4616030051297117,-1.1695689064590815,-253.37115836005307,0.0,0.0,0.0,-11.813,-3.0961363703235882,-26.209568845362153,0.8115798366166249,-1.6808989437024184,-207.11442635125502,0.7687818405114347,-1.599248334321227,-208.02368490584442,0.738663956440759,-1.4466298577701289,-195.84410821346717,0.0,0.0,0.0,-9.054,-5.855136370323589,-64.66905637129095,0.7573740779810156,-1.626693185066809,-214.7806758748767,0.6929098144491938,-1.5233763082589862,-219.85202900968318,0.6950287882686242,-1.402994689597994,-201.86137511035122,0.0,0.0,0.0,-29.651,14.741863629676411,49.71793067587811,26.08695652173913,-0.8214761963146948,26.08695652173913,-0.7949122017010476,30.434782608695656,-0.6840053817315328,51.08695652173913,0.0,19.565217391304348,-0.9423576386406375,OBL 2.1 04/12/29,100.0,0.7071067598647465,100.0,0.7071067660913807,100.0,0.7071067508319544,75.0,0.0,100.0,0.7071067514770826,0.957979839839621,0.008953880739286935,rising,45.65217391304348,50.0,-1.0,-1.0,-1.0,1,1,0.9345161814868065,0.9578978701103595,0.7886853524945304,0.0,Below Median,Top Decile,Bottom Quartile,Top Decile,Very Tight,3.267900436696181,,,,,0.0
2025-11-06,DE000BU25034,OBL 2 1/2 10/11/29,2029-10-11,1.208032589300915,WEAK BUY,0.9558011835607391,0.9817929753705912,1.1021615805848655,0.0,1.0312171695934238,-12.630221265445426,0.7813349028540165,0.24988226673940728,31.981454127865767,0.6227496469351271,0.33305153662561193,53.48080611794002,0.900293011333722,0.2018685692511435,22.422540713698872,0.0,0.0,0.0,-12.790321969442342,0.16010070399691578,1.2517331796200504,1.1938576986276352,-0.16264052903421145,-13.623108336852821,1.176620326059653,-0.220819142498914,-18.767238312267175,1.2317250901807844,-0.1295635095959189,-10.518865741787874,0.0,0.0,0.0,-10.554,-2.076221265445426,-19.672363686547182,0.7527114503391411,0.2785057192542827,37.00032933320816,0.5764810653315016,0.3793201182292375,65.79923165927207,0.8775604307109605,0.224601149873905,25.59380977701583,0.0,0.0,0.0,-10.232,-2.398221265445427,-23.438440804354794,1.211850546572372,-0.1806333769789481,-14.905581880480051,1.2083083029474169,-0.2525071193866778,-20.89757363091703,1.2470563654845075,-0.14489478489964203,-11.618944239256816,0.0,0.0,0.0,-7.035,-5.595221265445426,-79.53406194018507,,,,,,,,,,,,,,,,84.78260869565217,1.0192891850613055,82.6086956521739,0.9148810082959851,82.6086956521739,1.12127342399395,51.08695652173913,0.0,28.26086956521739,-0.8034422219249666,OBL 2 1/2,100.0,0.0,100.0,0.0,100.0,0.0,100.0,0.0,100.0,0.0,0.9869192636221965,-0.0051262882516053265,falling,69.56521739130434,100.0,1.0,1.0,1.0,1,1,1.1085562525395776,1.1024646085137422,1.2278256524181024,0.0,Top Quartile,Top Decile,Below Median,Top Decile,Very Tight,3.748743643083685,,,,,0.0
2025-11-06,DE000BU25042,OBL 2.4 04/18/30,2030-04-18,0.9333432466903684,NO ACTION,0.4151730100529446,0.9837611113908411,0.5345993955015493,0.0,0.5588901381285619,-11.502471016483227,0.6824867230690911,-0.12359658494052916,-18.109741765195153,0.5933459900756934,-0.17817298002274884,-30.02851287444749,0.6211377346164633,-0.08653833911491393,-13.932229986820257,0.0,0.0,0.0,-11.422398505465033,-0.08007251101819435,-0.7010131095477227,1.116913560994166,-0.5580234228656041,-49.9611999851436,1.1832642760391898,-0.7680912659862452,-64.91290872619187,0.9690397511240239,-0.4344403556224745,-44.832046428987766,0.0,0.0,0.0,-9.088,-2.414471016483228,-26.567682810590444,1.2813658753455248,-0.7224757372169629,-56.38325052037302,1.4271195543395983,-1.0119465442866535,-70.90832258017102,1.0674120454468516,-0.5328126499453023,-49.91630432000794,0.0,0.0,0.0,-8.346,-3.156471016483227,-37.82016550085323,1.2668687959647245,-0.7079786578361625,-55.88413374003907,1.4084744250840653,-0.9933014150311207,-70.52321222797595,1.0613934015610396,-0.5267940060594902,-49.632304131670686,0.0,0.0,0.0,-5.422,-6.080471016483227,-112.14443019676843,,,,,,,,,,,,,,,,58.69565217391305,0.5618165975199735,58.69565217391305,0.39739844288483184,60.86956521739131,0.5552315325252799,51.08695652173913,0.0,30.434782608695656,-0.7346981535520637,OBL 2.4 04/18/30,100.0,0.0,100.0,0.0,100.0,0.0,100.0,0.0,100.0,0.0,0.9868075862931035,-0.003046474902262397,falling,78.26086956521739,100.0,1.0,1.0,1.0,1,1,0.6008057035642635,0.47887945512719154,0.5955522884545613,0.0,Above Median,Top Decile,Below Median,Top Decile,Very Tight,4.206490770041427,,,,,0.0
2025-11-06,DE000BU25059,OBL 2.2 10/10/30,2030-10-10,1.206315888905264,WEAK BUY,0.9524224700273324,0.990034983016797,0.7367729635982574,0.0,0.9187661402188585,-9.950552924660942,1.0592539922987063,-0.14048785207984782,-13.262905004368413,1.1461503247200577,-0.19372785469272535,-16.902482058781807,0.8503952001993239,-0.11362223660106652,-13.36110966269843,0.0,0.0,0.0,-9.809200293436898,-0.14135263122404318,-1.4410209482063154,1.2258965841387952,-0.3071304439199367,-25.053535949799986,1.3870356452205133,-0.4346131751931809,-31.33395839951103,0.9565754649686097,-0.2198025013703523,-22.97806154580381,0.0,0.0,0.0,-7.49,-2.4605529246609414,-32.85117385014451,,,,,,,,,,,,,,,,,,,,,,,,,,,,,,,,,,,,,,,,,,,,,,78.26086956521739,0.910374683132157,80.43478260869566,0.9116469457133559,71.73913043478261,0.7568635508276116,51.08695652173913,0.0,34.78260869565217,-0.6400981625420399,OBL 2.2 10/10/30,100.0,0.0,100.0,0.0,100.0,0.0,100.0,0.0,100.0,0.0,0.9883029707525149,0.0017320122642821012,rising,95.65217391304348,100.0,1.0,1.0,1.0,1,1,0.987671636385606,1.098567446471098,0.8207768812209959,0.0,Top Quartile,Top Decile,Below Median,Top Decile,Very Tight,4.5999069164267326,,,,,0.0
2025-11-06,DE000BU27006,DBR 2.4 11/15/30,2030-11-15,1.1714752335210346,STRONG BUY,1.662800250215433,0.982416357907887,1.4781438241407567,0.0,1.5371215210846954,-9.72463120827918,1.4930328616208377,0.04408865946385765,2.9529597306183195,1.5986790465366365,0.06412120367879659,4.010886576428177,1.4636258790918732,0.014517945048883485,0.9919163877246898,0.0,0.0,0.0,-9.795676295674117,0.07104508739493731,0.7252698555768391,1.2735464226699176,0.2635750984147778,20.69615144398054,1.2520516633348866,0.4107485868805465,32.806041126601606,1.353622962124842,0.12452086201591483,9.199080141233782,0.0,0.0,0.0,-7.515,-2.2096312082791796,-29.402943517483504,1.269849440676865,0.26727208040783035,21.047540735271173,1.2483665304185345,0.4144337197968986,33.19807976092928,1.3518336355641951,0.12631018857656162,9.343619238286186,0.0,0.0,0.0,-7.404,-2.3206312082791793,-31.3429390214058,0.9167079416599181,0.6204135794247773,67.67843327870897,0.7690275489066799,0.8937727013087532,116.22115370994277,1.0690387059565303,0.40910511818422646,38.26850347680595,0.0,0.0,0.0,-5.4,-4.324631208279179,-80.08576296797412,0.15358286680596953,1.3835386542787258,900.8417364304443,0.0,1.662800250215433,16628002502.15433,0.03474695413361476,1.443396870007142,4154.022965738111,0.0,0.0,0.0,-27.796,18.071368791720822,65.01427826025109,97.82608695652173,1.5092831030620564,97.82608695652173,1.5916117239409535,97.82608695652173,1.4962485472392897,51.08695652173913,0.0,39.130434782608695,-0.6263266932542578,DBR 2.4 11/15/30,100.0,0.0,100.0,0.0,100.0,0.0,100.0,0.0,100.0,0.0,0.9903604559076009,-0.007944097999713962,falling,73.91304347826086,100.0,1.0,1.0,1.0,1,1,1.652402348753961,1.9179495259265031,1.646675893275403,0.0,Top Decile,Top Decile,Below Median,Top Decile,Very Tight,4.706308622325395,,,,,0.0
2025-11-06,DE000BU2D004,DBR 2 1/2 08/15/54,2054-08-15,1.2743303922828415,MODERATE BUY,1.1833753654981645,0.9673646321249609,1.2774545837591307,0.0,1.2080184359304889,30.72248770551445,1.1262441693384007,0.0817742665920882,7.260793715278117,1.0669270394382633,0.11644832605990119,10.914366274733704,1.2099075060947173,0.06754707766441337,5.582829825079413,0.0,0.0,0.0,32.76334653671995,-2.040858831205501,-6.229091488854084,0.9462777762043365,0.26174065972615235,27.660023678251367,0.8252001260141832,0.3581752394839812,43.40465104792772,1.0606207378189423,0.2168338459401884,20.44405093772538,0.0,0.0,0.0,38.011,-7.288512294485553,-19.174744922701528,1.192892997280161,0.015125438650327894,1.2679627223915446,1.1593996031363478,0.023975762361816644,2.067946382779847,1.2644819661944422,0.012972617564688482,1.0259234855787027,0.0,0.0,0.0,34.237,-3.5145122944855522,-10.26524605969865,1.5362715869719314,-0.3282531510414426,-21.36686974415501,1.6911516849693695,-0.507776319471205,-30.02547441377824,1.4399173021633045,-0.1624627184041738,-11.282781103596353,0.0,0.0,0.0,44.773,-14.050512294485554,-31.38166370658072,-1.8085971781955148,3.0166156141260037,166.7931164448929,-2.161219280836409,3.3445946463345733,154.7549876366405,-1.4235338595370886,2.700988443296219,189.7382634228815,0.0,0.0,0.0,18.532,12.19048770551445,65.78074519175684,89.13043478260869,1.190530141863962,89.13043478260869,1.132712185547101,91.30434782608695,1.2960968806754747,51.08695652173913,0.0,97.82608695652173,1.8392010338781366,DBR 2 1/2,100.0,1.1846816243750595,100.0,1.2618006536755706,100.0,1.2487045392563472,60.0,0.0,100.0,1.2231301391921627,0.9814090037092407,-0.014044371584279736,falling,47.82608695652174,80.0,1.0,1.0,1.0,1,1,1.2986172358454926,1.3649590327859582,1.4231048653557905,0.0,Top Quartile,Top Decile,Top Decile,Top Decile,Very Tight,16.822343825159436,,,,,0.0
2025-11-06,DE000BU2D012,DBR 2.9 08/15/56,2056-08-15,1.84670414527249,MODERATE BUY,1.5352398769688635,0.9687724878548154,1.323062077799251,0.0,1.4165857262771924,32.71867871883227,1.2635341501380717,0.15305157613912068,12.112974937092014,1.3005941785577375,0.23464569841112604,18.041422949254503,1.2468530329207976,0.07620904487845337,6.112111231643705,0.0,0.0,0.0,34.897149029959245,-2.178470311126972,-6.2425452252059275,1.2267800500539043,0.18980567622328803,15.471858599898342,1.246316061702655,0.2889238152662086,23.18222654960192,1.2243237848617459,0.09873829293750513,8.06472057080741,0.0,0.0,0.0,40.836,-8.117321281167726,-19.877856007395287,1.4920794278046738,-0.07549370152748147,-5.05963017884335,1.6538232290693573,-0.11858335210049376,-7.17025552060952,1.3502273083108876,-0.02716523051163655,-2.011900525432993,0.0,0.0,0.0,37.479,-4.760321281167727,-12.701302809300133,,,,,,,,,,,,,,,,,,,,,,,,,,,,,,,93.47826086956522,1.3925380974439698,93.47826086956522,1.4695125207785653,93.47826086956522,1.3415822087507165,51.08695652173913,0.0,100.0,1.9608824891747998,DBR 2.9 08/15/56,100.0,0.0,100.0,0.0,100.0,0.0,100.0,0.0,100.0,0.0,0.9690138317827859,-0.0002413439279704832,falling,50.0,100.0,1.0,1.0,1.0,1,1,1.5228266270450532,1.7708155828304708,1.4739123441423854,0.0,Top Decile,Top Decile,Top Decile,Top Decile,Very Tight,18.379997114814728,,,,,0.0
2025-11-06,DE000BU2F009,DBR 2.6 05/15/41,2041-05-15,3.423745727349271,MODERATE BUY,1.5414476990869042,0.9888536580040036,1.5621405062092975,0.0,1.497060546055156,15.804604960106571,1.5317084391716016,-0.03464789311644556,-2.262042305452078,1.5978057002765866,-0.05635800118968248,-3.5272124030603624,1.5744217930573727,-0.012281286848075279,-0.7800506080534597,0.0,0.0,0.0,16.774985345203373,-0.9703803850968011,-5.784686928479507,1.413070943710573,0.08398960234458297,5.943763979015722,1.410760455827628,0.13068724325927605,9.263602604756002,1.5249306470503943,0.03720985915890318,2.440101717862802,0.0,0.0,0.0,20.397,-4.592395039893427,-22.51505141757083,1.3903446829380885,0.10671586311706749,7.675496850464801,1.3790411881073452,0.16240651097955894,11.776770063320265,1.5139913551228041,0.048149151086493314,3.18027910830177,0.0,0.0,0.0,17.721,-1.9163950398934286,-10.814260136628873,1.0217298425899952,0.4753307034651608,46.522150866027786,0.8754154771924374,0.6660322218944668,76.08184132434211,1.2475850301501532,0.31455547605914425,25.213149078902543,0.0,0.0,0.0,23.617,-7.812395039893429,-33.079540316659504,1.7367663000860745,-0.23970575403091843,-13.801842691147007,1.967434642450666,-0.42598694336376175,-21.651897959261117,1.6347708979664575,-0.07263039175716002,-4.442848316129337,0.0,0.0,0.0,-2.424,18.228604960106573,752.0051520175767,95.65217391304348,1.4704820252381727,95.65217391304348,1.4754545709207476,100.0,1.5800202326065764,51.08695652173913,0.0,76.08695652173914,0.9298543479669712,DBR 2.6 05/15/41,100.0,0.0,100.0,0.0,100.0,0.0,100.0,0.0,100.0,0.0,0.9866695501530262,0.002184107850977446,rising,91.30434782608695,100.0,1.0,1.0,1.0,1,1,1.609336886248777,1.7779759675410152,1.7402495423469249,0.0,Top Decile,Top Decile,Top Quartile,Top Decile,Very Tight,11.827094138228489,,,,,0.0
2025-11-06,DE000BU2Z007,DBR 2.3 02/15/33,2033-02-15,-0.6386689736796303,NO ACTION,-0.2681075012764103,0.9623285797417321,-0.2551442819475243,0.0,-0.418984065808216,-5.789954561753989,0.4082620250762969,-0.827246090884513,-202.6262595614396,0.265412408928368,-0.5335199102047783,-201.01542812462355,0.3234995278579787,-0.578643809805503,-178.87005763190194,0.0,0.0,0.0,-5.217512689540104,-0.5724418722138847,-10.971547271257094,-0.2926231386616755,-0.1263609271465405,-43.18213638410277,-0.0902590440157794,-0.17784845726063092,-197.04223493139963,-0.17063926846970895,-0.08450501347781536,-49.52260360900218,0.0,0.0,0.0,-2.967,-2.822954561753989,-95.1450809652673,-0.515122182724497,0.09613811691628094,18.663167356041,-0.4055344884038188,0.13742698712740847,33.88786593207735,-0.31638805013693244,0.06124376818940813,19.35716795472683,0.0,0.0,0.0,-3.306,-2.483954561753989,-75.13474150757757,-0.3039107897441874,-0.11507327606402862,-37.86416151084131,-0.1018198841057313,-0.16628761717067903,-163.3154489416415,-0.17568191604971337,-0.07946236589781094,-45.230814395400685,0.0,0.0,0.0,-0.074,-5.715954561753989,-7724.261877470003,0.5517866609870482,-0.9707707267952642,-175.93225386519902,0.4749510627875333,-0.7430585640639435,-156.4494969350973,0.41776450439386714,-0.6729087863413914,-161.07370615661603,0.0,0.0,0.0,-26.662,20.872045438246012,78.28387004132333,45.65217391304348,-0.38530396210050244,43.47826086956522,-0.2566291665236173,47.82608695652174,-0.23239670752928726,51.08695652173913,0.0,45.65217391304348,-0.3864813191008018,DBR 2.3 02/15/33,100.0,0.7071067586999665,100.0,0.7071067652097812,100.0,0.7071067504947655,75.0,0.0,100.0,0.7071067567923844,0.9502768221065785,0.012051757635153648,rising,39.130434782608695,100.0,-1.0,1.0,-1.0,0,1,0.45040697494328613,0.30924740052439154,0.28423481634764314,0.0,Below Median,Top Decile,Below Median,Top Decile,Very Tight,6.540612870513485,,,,,0.0
2025-11-06,DE000BU2Z015,DBR 2.6 08/15/33,2033-08-15,0.0401967565893421,WEAK BUY,0.7684202475656955,0.9851572191260884,0.701047432154436,0.0,0.8052931211068167,-3.9030866234169928,0.7156144470711029,0.08967867403571383,12.531702392200753,0.6449074144431385,0.12351283312255701,19.15202530490438,0.6305316990598585,0.07051573309457748,11.183534797911832,0.0,0.0,0.0,-3.734679503600318,-0.16840711981667456,-4.509279021222524,0.574861035225067,0.23043208588174968,40.084832290476726,0.4443257536298134,0.3240944939358821,72.94073863470561,0.532118738224289,0.16892869393014698,31.74642774641408,0.0,0.0,0.0,-1.308,-2.595086623416993,-198.40111648141294,0.5715971270380953,0.23369599406872144,40.88473838054691,0.43998990394068394,0.32843034362501156,74.6449709911505,0.5301260790999325,0.1709213530545035,32.24164148282158,0.0,0.0,0.0,-1.208,-2.6950866234169926,-223.10319545585045,0.7318164408490776,0.07347668025773912,10.040315460589749,0.6707265173442879,0.0976937302214076,14.565359537548275,0.6449683110832582,0.05607912107117774,8.694864420160963,0.0,0.0,0.0,2.127,-6.0300866234169925,-283.50195557436757,0.5859336781235365,0.21935944298328025,37.43758848988235,0.5000678764039842,0.2683523711617113,53.66318823059165,0.5585113049938282,0.14253612716060782,25.52072327526308,0.0,0.0,0.0,-25.595,21.691913376583006,84.75058944367238,76.08695652173914,0.8004703325208484,76.08695652173914,0.7355223062906774,69.56521739130434,0.7212337151485211,51.08695652173913,0.0,50.0,-0.27146385075349533,DBR 2.6 08/15/33,100.0,0.0,100.0,0.0,100.0,0.0,100.0,0.0,100.0,0.0,0.987197069625383,-0.00203985049929456,falling,80.43478260869566,100.0,1.0,1.0,1.0,1,1,0.865688383448892,0.8863309043524661,0.7809780670310507,0.0,Top Quartile,Top Decile,Above Median,Top Decile,Very Tight,7.003323189226762,,,,,0.0
2025-11-06,DE000BU2Z023,DBR 2.2 02/15/34,2034-02-15,0.2009079829748259,WEAK BUY,1.013802564379653,0.9889787382039714,1.1616973552391106,0.0,1.0828367015956597,-2.534751041882288,0.8335813625854889,0.24925533901017083,29.90174051479397,0.6771407312869123,0.3366618330927408,49.71814758227541,0.9537288090766717,0.20796854616243887,21.805836418341464,0.0,0.0,0.0,-2.500083317782163,-0.034667724100124975,-1.38666274499254,0.8224354797554578,0.26040122184020187,31.66220634734881,0.6616272620497774,0.3521753023298757,53.22865565060623,0.9446195102224704,0.21707784501664018,22.980453015147884,0.0,0.0,0.0,0.128,-2.662751041882288,-2080.2740889491242,0.921605310407503,0.16123139118815666,17.494624609682756,0.7996911586683739,0.21411140571127918,26.774261627499552,1.025871202680928,0.13582615255818253,13.24007837233541,0.0,0.0,0.0,0.357,-2.891751041882288,-810.0142747565437,1.0078529403651628,0.07498376123049688,7.439950560578203,0.9174464310515696,0.09635613332808346,10.502643970981111,1.1007382526388965,0.06095910260021409,5.5380197699379945,0.0,0.0,0.0,3.798,-6.332751041882288,-166.73910018979404,1.5866067259005243,-0.5037700243048646,-31.75141091399284,1.8153221320676358,-0.8015195676879827,-44.15302105967038,1.4417676284930638,-0.2800702732539533,-19.425479236493537,0.0,0.0,0.0,-23.25,20.715248958117712,89.0978449428298,86.95652173913044,1.0692853091440158,84.78260869565217,0.9703992088159735,86.95652173913044,1.180649723862121,51.08695652173913,0.0,52.17391304347826,-0.1880544656873781,DBR 2.2 02/15/34,100.0,0.0,100.0,0.0,100.0,0.0,100.0,0.0,100.0,0.0,0.9927062804344915,-0.0037275422305200756,falling,93.47826086956522,100.0,1.0,1.0,1.0,1,1,1.1640471390778677,1.169366042303102,1.2941494588769296,0.0,Top Quartile,Top Decile,Above Median,Top Decile,Very Tight,7.255464440887493,,,,,0.0
2025-11-06,DE000BU2Z031,DBR 2.6 08/15/34,2034-08-15,-0.0490368673549808,NO ACTION,0.6321736774061067,0.9877595162239347,0.9054576584519524,0.0,0.793244282436474,-1.6167883804620358,0.6117736037036221,0.18147067873285194,29.66304441184458,0.37561203916217323,0.2565616382439335,68.30495422503371,0.7834581202260399,0.12199953822591247,15.571928290630375,0.0,0.0,0.0,-1.5434656411942784,-0.07332273926775734,-4.750526142970712,0.7876506465861451,0.005593635850328904,0.7101671030876783,0.6244975202098256,0.007676157196281119,1.229173347363279,0.9012690076395293,0.004188650812423034,0.4647503387382969,0.0,0.0,0.0,1.344,-2.960788380462036,-220.29675285955065,1.1646806309070188,-0.37143634847054474,-31.89169077123847,1.1401609385943587,-0.507987261188252,-44.55399580335753,1.2100905054020559,-0.3046328469501035,-25.174385144973094,0.0,0.0,0.0,1.86,-3.476788380462036,-186.92410547148523,1.0468712798112214,-0.25362699737474736,-24.227142328115907,0.9785802137515751,-0.34640653634546836,-35.398889936427736,1.1171675237866525,-0.21170986533470015,-18.950592362553458,0.0,0.0,0.0,5.234,-6.850788380462036,-130.89011019054308,,,,,,,,,,,,,,,,71.73913043478261,0.7888004236733811,67.3913043478261,0.6051087834489232,80.43478260869566,0.9250964004540969,51.08695652173913,0.0,54.347826086956516,-0.1320983814226954,DBR 2.6 08/15/34,100.0,0.0,100.0,0.0,100.0,0.0,100.0,0.0,100.0,0.0,0.9873823946624064,0.0003771215615282486,rising,89.13043478260869,100.0,1.0,1.0,1.0,1,1,0.8527359076390534,0.7291779062020032,1.00869433285434,0.0,Above Median,Top Decile,Above Median,Top Decile,Very Tight,7.756390902235921,,,,,0.0
2025-11-06,DE000BU2Z049,DBR 2 1/2 02/15/35,2035-02-15,-0.1077255104070435,NO ACTION,0.5425647836985836,0.9494721503148844,0.3928969318521519,0.0,0.5794549499993037,-0.5085303038669271,0.39787487360800516,0.18158007639129853,45.637481497875875,0.2789410899357193,0.2636236937628643,94.50873099145848,0.27236138808495036,0.12053554376720155,44.255736904980246,0.0,0.0,0.0,-0.4375647770223834,-0.07096552684454371,-16.218290170802412,0.3630083058361865,0.2164466441631172,59.62580875441772,0.22166940973343668,0.32089537396514695,144.76303242505531,0.24568415572621746,0.14721277612593445,59.91952134594772,0.0,0.0,0.0,2.302,-2.810530303866927,-122.09080328661368,0.7346196936182847,-0.15516474361898103,-21.121778092084238,0.7527399493607194,-0.2101751656621358,-27.92135093248292,0.5048925079435396,-0.11199557609138766,-22.182062936395454,0.0,0.0,0.0,2.566,-3.074530303866927,-119.81801605164168,0.9528406528817687,-0.373385702882465,-39.18658359449084,1.044739837834026,-0.5021750541354424,-48.06699535550032,0.686997152002085,-0.2941002201499331,-42.8095247574022,0.0,0.0,0.0,6.672,-7.180530303866927,-107.62185691104229,,,,,,,,,,,,,,,,60.86956521739131,0.58173465655977,65.21739130434783,0.5193362646056079,56.52173913043478,0.4139086384742943,51.08695652173913,0.0,58.69565217391305,-0.06454249388253697,DBR 2 1/2,80.0,0.5202484846357364,80.0,0.5339836683912802,80.0,0.32084304327766255,60.0,0.0,40.0,-1.013006047442347,0.9816954842191395,-0.032223333904255136,falling,28.26086956521739,40.0,1.0,1.0,1.0,1,1,0.6229128323571241,0.6258189277661536,0.43769347451618423,0.0,Above Median,Top Quartile,Above Median,Below Median,Very Tight,8.082398024581039,,,,,0.0
2025-11-06,DE000BU2Z056,DBR 2.6 08/15/35,2035-08-15,0.034222091923317,NO ACTION,0.7592978166633317,0.9911470145377673,0.5415737024367973,0.0,0.7524308800704784,0.7613905491812204,0.8494521616823468,-0.0970212816118684,-11.421629709853702,0.8926844455468911,-0.13338662888355934,-14.942192401215479,0.6251027196088054,-0.08352901717200811,-13.362446397295574,0.0,0.0,0.0,1.143791574007182,-0.3824010248259616,-33.43275384893551,0.9256000222848844,-0.17316914221440594,-18.708852222804087,0.9919157390397696,-0.23261792237643786,-23.451379071420643,0.6894371427666033,-0.14786344032980603,-21.44697884882664,0.0,0.0,0.0,4.057,-3.29560945081878,-81.2326705125835,-1.1855440773398553,1.9379749574103338,163.46713530989777,-1.629726366865239,2.389024183528571,146.59050853210297,-0.8801682495352452,1.4217419519720425,161.53070013258193,0.0,0.0,0.0,3.097,-2.3356094508187795,-75.4152225791817,,,,,,,,,,,,,,,,,,,,,,,,,,,,,,,69.56521739130434,0.7492705819685103,73.91304347826086,0.7267904288609247,63.04347826086957,0.5621871578172138,51.08695652173913,0.0,63.04347826086957,0.012867842342574503,DBR 2.6 08/15/35,100.0,0.0,100.0,0.0,100.0,0.0,100.0,0.0,100.0,0.0,0.9875723600496837,0.003574654488083584,rising,97.82608695652173,100.0,1.0,1.0,1.0,1,1,0.8088615873558911,0.8758086771503599,0.6033217780772996,0.0,Above Median,Top Decile,Above Median,Top Decile,Very Tight,8.471618485021537,,,,,0.0
2025-11-06,DE000BU35025,OBL 2.1 04/12/29,2029-04-12,-0.0361504530454244,MODERATE SELL,-1.4929301698312243,0.9782757864979769,-1.0374053210520753,0.0,-1.338322620630907,-15.245729468106475,-1.2526972411152795,-0.08562537951562743,-6.835281185409718,-1.3653891417699406,-0.12754102806128365,-9.341002006347674,-0.9979588036923638,-0.0394465173597115,-3.952719973859712,0.0,0.0,0.0,-15.39046026704623,0.14473079893975438,0.940392920903152,-1.0074718030899903,-0.3308508175409166,-32.83970958216417,-1.0178903504628722,-0.47503981936835205,-46.66905570776149,-0.8272407832015701,-0.21016453785050515,-25.405485268337735,0.0,0.0,0.0,-13.54,-1.705729468106476,-12.597706549827958,-0.951068625252604,-0.38725399537830285,-40.71777588117477,-0.9420425674171667,-0.5508876024140575,-58.47799405462612,-0.7799862953954,-0.2574190256566753,-33.003018626869526,0.0,0.0,0.0,-12.479,-2.766729468106476,-22.171083146801568,0.32978777231184103,-1.6681103929427479,-505.81327823885675,0.08339446059182713,-1.5763246304230514,-1890.2028146906123,0.40308389329401567,-1.440489214346091,-357.3670897235943,0.0,0.0,0.0,-9.632,-5.6137294681064756,-58.282074982124875,0.43800771988017695,-1.776330340511084,-405.54771510471375,0.23328271534202968,-1.7262128851732539,-739.9660144755042,0.4746162892071423,-1.5120216102592177,-318.5776832327683,0.0,0.0,0.0,-30.182,14.936270531893523,49.487345195629146,8.695652173913043,-1.2757297888775438,8.695652173913043,-1.429014195193126,23.91304347826087,-1.0125623525184557,51.08695652173913,0.0,17.391304347826086,-0.9628752833488761,OBL 2.1 04/12/29,50.0,-0.7071067598647461,50.0,-0.7071067660913807,50.0,-0.7071067508319544,75.0,0.0,50.0,-0.70710675147709,0.9563667049255391,0.02190908157243776,rising,63.04347826086957,100.0,-1.0,-1.0,-1.0,1,1,1.4386939558041723,1.7220136400016728,1.1556861421960059,0.0,Bottom Decile,Above Median,Bottom Quartile,Above Median,Very Tight,3.268372251172025,,,,,0.0
2025-11-06,DE000BU3Z005,DBR 2.3 02/15/33,2033-02-15,-1.0486030877044603,WEAK SELL,-0.8940163746192848,0.9573941452179788,-0.5809643820361948,0.0,-0.8636937255995661,-6.199888675778819,-0.47289863197821463,-0.3907950936213515,-82.63823553956294,-0.3461668018717504,-0.5478495727475344,-158.2617264160218,-0.28893815403610207,-0.29202622800009276,-101.06876292174572,0.0,0.0,0.0,-5.6584298686206616,-0.5414588071581576,-9.569064542161428,-0.8795823069232767,0.015888581323710516,1.8063779839603606,-0.9175418791611089,0.023525504541824005,2.563970628450863,-0.5970683210820152,0.016103939045820415,2.6971685161456547,0.0,0.0,0.0,-3.556,-2.643888675778819,-74.35007503778998,-0.8829989777495542,0.019305252149988017,2.1863277781540997,-0.9171683134611649,0.02315193884188005,2.5242846105402323,-0.5966616559545955,0.0156972739184007,2.6308500803862973,0.0,0.0,0.0,-3.864,-2.3358886757788193,-60.45260532436747,-0.5941098337442018,-0.26958389185536435,-45.376102532890464,-0.5197872274536981,-0.37422914716558675,-71.99660172474368,-0.36917318367601054,-0.21179119836018429,-57.36906199805342,0.0,0.0,0.0,-0.493,-5.706888675778819,-1157.5838864138805,-0.3704498122651343,-0.49324391333443185,-133.14729382739796,-0.19938121427770744,-0.6946351603415775,-348.39547347450196,-0.22167574196088227,-0.3592886400753126,-162.07845779123105,0.0,0.0,0.0,-27.321,21.121111324221182,77.30724101054301,30.434782608695656,-0.8160277302033435,21.73913043478261,-0.8557413574209447,34.78260869565217,-0.5573440535291428,51.08695652173913,0.0,43.47826086956522,-0.4114695988984265,DBR 2.3 02/15/33,50.0,-0.7071067586999669,50.0,-0.7071067652097813,50.0,-0.7071067504947652,75.0,0.0,50.0,-0.7071067567923844,0.9462903239378848,0.011103821280094017,rising,34.78260869565217,50.0,-1.0,-1.0,-1.0,1,1,0.9284689084163471,1.0311991964455345,0.647203626011663,0.0,Below Median,Above Median,Below Median,Above Median,Very Tight,6.542738463917885,,,,,0.0
2025-11-06,DE000BU3Z047,DBR 2 1/2 02/15/35,2035-02-15,-0.7020890127231356,NO ACTION,-0.3649405381645703,0.9493731355473654,-0.2412566678461413,0.0,-0.46581405438223494,-1.1028938061830191,-0.609573671310816,0.14375961692858102,23.58363251829426,-0.5696580726167144,0.20471753445214413,35.936913860991446,-0.33690430581525665,0.09564763796911535,28.390149214225048,0.0,0.0,0.0,-1.049361159756245,-0.05353264642677402,-5.1014510513295495,-0.32872543476053406,-0.13708861962170088,-41.703075258310335,-0.16036952262569729,-0.204571015538873,-127.56226958417471,-0.14589369546621966,-0.09536297237992164,-65.36469279135696,0.0,0.0,0.0,2.03,-3.132893806183019,-154.32974338670172,0.6470856394919946,-1.1128996938742295,-171.9864587860865,0.6317082918202722,-0.9966488299848425,-157.77041826314317,0.43742676330461006,-0.6786834311507514,-155.15361028853573,0.0,0.0,0.0,2.434,-3.536893806183019,-145.31198815332047,,,,,,,,,,,,,,,,,,,,,,,,,,,,,,,41.30434782608695,-0.43066117144980737,36.95652173913043,-0.34931654539310825,50.0,-0.21854629331823505,51.08695652173913,0.0,56.52173913043478,-0.10077300261368158,DBR 2 1/2,40.0,-0.5846699237642335,40.0,-0.4967386795965168,40.0,-0.3443557783342542,60.0,0.0,20.0,-1.0555623847075812,0.977308897852127,-0.02793576230476169,falling,26.08695652173913,20.0,-1.0,-1.0,-1.0,1,1,0.5007491125364312,0.42093903466361415,0.26876379182189897,0.0,Below Median,Below Median,Above Median,Bottom Quartile,Very Tight,8.087033887571238,,,,,0.0
2025-11-06,FI4000037635,RFGB 2 3/4 07/04/28,2028-07-04,-8.541700762040486,STRONG SELL,-2.9451441862042733,0.957335052333982,-2.035935453622689,0.0,-2.7095576036865956,-10.91232286175554,-2.5856501516848316,-0.123907452001764,-4.7921197475928015,-2.7418474881290575,-0.20329669807521578,-7.414588091202683,-2.018397892981103,-0.01753756064158596,-0.8688851992802606,0.0,0.0,0.0,-10.061359503296796,-0.8509633584587437,-8.457737320032502,-2.7085146559959883,-0.0010429476906073099,-0.038506259674388435,-2.9467043707898,0.0015601845855268692,0.0529467630244163,-2.0361040840134734,0.00016863039078440778,0.008282012264511066,0.0,0.0,0.0,-10.407,-0.5053228617555394,-4.85560547006802,-2.8938108452997673,0.1842532416131717,6.367148746979355,-3.245688292267842,0.3005441060635685,9.259795706617021,-2.0502690368393695,0.014333583216680434,0.6991074287921695,0.0,0.0,0.0,0.235,-11.147322861755539,-4743.541441447403,0.07839820513874157,-2.787955808825337,-3556.147042240034,-1.691358291792277e-17,-2.9451441862042733,-29451441812.22979,0.031515294992763065,-2.0674507486154523,-6560.148312352382,0.0,0.0,0.0,3.611,-14.52332286175554,-402.1966995717493,0.07413179759791147,-2.7836894012845073,-3755.0539929946785,-1.691358291792277e-17,-2.9451441862042733,-29451441812.22979,0.031515294992763065,-2.0674507486154523,-6560.148312352382,0.0,0.0,0.0,-6.757,-4.15532286175554,-61.496564386649155,3.7037037037037033,-2.1794386061829463,3.7037037037037033,-2.388712230246089,3.7037037037037033,-1.6614030181177035,51.85185185185185,0.0,14.814814814814813,-1.3200691782838774,RFGB 2 3/4,50.0,-0.7071067787265582,50.0,-0.7071067787175849,50.0,-0.7071067786770773,75.0,0.0,50.0,-0.7071067810071783,0.9470555480236553,0.010279504310326648,rising,14.814814814814813,50.0,-1.0,-1.0,-1.0,1,1,3.5148241497140167,4.5062288957211045,2.7187311275375667,0.0,Bottom Decile,Above Median,Bottom Quartile,Above Median,Very Tight,2.581812196629585,"['GREEN_BOND_LOAN_INDICATOR', 'Issue_Age', 'AMT_OUTSTANDING']","[nan, 0.876948673786145, 0.06666014196673688]",,,0.0
2025-11-06,FI4000046545,RFGB 2 5/8 07/04/42,2042-07-04,-1.0098141058199277,STRONG SELL,-1.1279871802497357,0.9957500809315589,-1.983407086893323,0.0,-1.630778089278887,53.00395724987602,-1.6746993597725388,0.0439212704936518,2.622636115257945,-1.2016108279636752,0.07362364771393959,6.127079199677229,-1.9909954544786244,0.007588367585301459,0.38113434815325414,0.0,0.0,0.0,55.93318898938846,-2.9292317395124456,-5.237019007703051,-2.1138574906720335,0.48307940139314653,22.852978558846416,-1.920204383718803,0.7922172034690673,41.25692067263755,-2.062241794585068,0.07883470769174528,3.822767413426922,0.0,0.0,0.0,58.29,-5.286042750123983,-9.068524188054779,-2.3767846763457454,0.7460065870668584,31.387217838980074,-2.3293690318456535,1.2013818515959178,51.5754193523588,-2.111481868694137,0.1280747818008141,6.065634902821094,0.0,0.0,0.0,59.409,-6.405042750123982,-10.781266725657487,-2.2854339957110716,0.6546559064321846,28.644708392203178,-2.189091362582851,1.0611041823331155,48.47235687019983,-2.093691362466374,0.1102842755730511,5.267456179233138,0.0,0.0,0.0,63.694,-10.690042750123986,-16.7834376054976,-2.301790782389265,0.6710126931103779,29.151767194874605,-2.2099533695914277,1.081966189341692,48.95877891965866,-2.0957992423511804,0.11239215545785752,5.362734781576525,0.0,0.0,0.0,45.651,7.352957249876013,16.106891959136323,11.11111111111111,-1.2817241137508433,11.11111111111111,-0.9148743160503648,7.4074074074074066,-1.6153980019188283,51.85185185185185,0.0,81.48148148148148,1.055982006744817,RFGB 2 5/8,50.0,-0.7071067753445169,50.0,-0.7071067723211986,50.0,-0.7071067762235772,75.0,0.0,100.0,0.7071067808792775,0.9508872996556426,0.044862781275916364,rising,96.29629629629629,100.0,-1.0,-1.0,-1.0,1,1,2.115436927129046,1.7258810110058829,2.6485862192342493,0.0,Bottom Quartile,Above Median,Top Quartile,Top Decile,Tight,11.74678188014795,"['GREEN_BOND_LOAN_INDICATOR', 'Issue_Age', 'YAS_RISK']","[nan, 0.8821448739844238, 0.03045197134493218]",,,0.0
